title,content,word_count,topic
किस्त–किस्त जीवन,किस्त–किस्त जीवन  मैथिली भाषा के विख्यात साहित्यकार शेफालिका वर्मा द्वारा रचित एक आत्मकथा है जिसके लिये उन्हें सन् 2012 में मैथिली भाषा के लिए साहित्य अकादमी पुरस्कार से सम्मानित किया गया।,31,महिला
दक्षिण कोरिया में लैंगिक असमानता,"दक्षिण कोरिया में लैंगिक असमानता, दक्षिण कोरिया में पुरुषों और महिलाओं के साथ किसी भी तरह के असमान अवसर या व्यवहार का सामना करना है।गहरी पितृसत्तात्मक विचारधाराओं और प्रथाओं से व्युत्पन्न, दक्षिण कोरिया में लैंगिक असमानता को लगातार दुनिया में सर्वोच्च स्थान दिया गया है। जबकि दक्षिण कोरिया की अर्थव्यवस्था और राजनीति में लैंगिक असमानता विशेष रूप से प्रचलित है, इसने स्वास्थ्य देखभाल और शिक्षा में सुधार किया है।",69,महिला
श्री आत्मा वल्लभ जैन स्मारक,श्री आत्मा वल्लभ जैन स्मारक अथवा वल्लभ स्मारक जैन मंदिर तीर्थ दिल्ली के ग्रैंड ट्रंक करनाल रोड पर स्थित जैन आचार्य श्री विजय वल्लभ सुरिश्वर जी की पवित्र स्मृति में एक जैन मंदिर और एक बहुआयामी स्मारक है।,38,महिला
फाइनेंसियल टेक्नालोजीज समूह,"फाइनेंशियल टेक्नोलॉजीज़ (इंडिया) लिमिटेड (एफटीआईएल) (जो वर्तमान में 69 मून्स  टेक्नोलॉजीज़ के रूप में जाना जाती है) एक भारतीय वित्तीय सेवा कंपनी है। यह एक आईटीआईएस आईएसओ 27001: 2005 और 9001: 2000 द्वारा  प्रमाणित कंपनी है जो प्रौद्योगिकी आईपी (बौद्धिक संपदा) और डोमेन विशेषज्ञता प्रदान करती है और आधुनिक वित्तीय बाजारों के साथ व्यापार करती है। कंपनी द्वारा पेश किए गए समाधानों में एक्सचेंज सॉल्यूशंस, ब्रोकरेज सॉल्यूशंस, मैसेजिंग सॉल्यूशंस और टेक्नोलॉजी एंड प्रोसेस कंसल्टिंग शामिल हैं।",76,महिला
ओरोविल,"ओरोविल (Auroville) भारत में पुडुचेरी के समीप तमिल नाडु राज्य के विलुप्पुरम ज़िले में स्थित एक प्रायोगिक नगरी है। इसकी स्थापना 1968 में मीरा रिचर्ड (भारत में निश्चित तौर पर बस जाने के बाद उन्हें ""मां"" कहा जाने लगा) ने की तथा इसकी रूपरेखा वास्तुकार रोजर ऐंगर ने तैयार की थी। ओरोविल का तात्पर्य एक ऐसी वैश्विक नगरी से है, जहां सभी देशों के स्त्री-पुरुष सभी जातियों, राजनीति तथा सभी राष्ट्रीयता से ऊपर उठकर शांति एवं प्रगतिशील सद्भावना की छांव में रह सकें। ओरोविल का उद्देश्य मानवीय एकता की अनुभूति करना है।",92,महिला
वैरामुत्तु,"वैरमुत्तु रामस्वामी (तमिल: வைரமுத்து) (जन्म: जुलाई 13 1953) तमिल के नामी सुकवि, गीतकार और उपन्यासकार हैं जो तमिल फिल्म उद्योग में भी काम करते हैं और तमिल साहित्य जगत में एक प्रमुख हस्ती हैं। चेन्नई के पच्चय्यप्पा कॉलेज से स्नातकोत्तर पदवी लेके उन्होंने एक अनुवादक के रूप में काम शुरू किया, जबकि वे एक प्रकाशित, प्रशस्त कवि भी थे। उन्होंने भारतीराजा द्वारा निर्देशित फिल्म निलल्गल् (छायाएं) के साथ वर्ष १९८० में तमिल फिल्म उद्योग में प्रवेश किया। अपने ४० साल के सिनिमा उद्योग में उन्होंने ७५०० से अधिक गीत और कविताएँ  लिखी हैं जो बहुत लोकप्रिय हुई हैं। उन्हें सात राष्ट्रीय पुरस्कार दिए गए हैं जो किसी भी भारतीय गीतकार के लिए सबसे अधिक हैं। अपने प्रचुर साहित्यिक संरचना  के लिए उन्हें पद्म श्री, पद्म भूषण और देश-विदेश के संस्थानों के साहित्य अकादमी पुरस्कार से भी सम्मानित किया गया है।",140,महिला
संघ परिवार,"संघ परिवार (अर्थत् : ""राष्ट्रीय स्वयंसेवक संघ का परिवार"" या ""आरएसएस परिवार"") से आशय राष्ट्रीय स्वयंसेवक संघ द्वारा खड़ा किये हिंदू राष्ट्रवादी संगठनों के समूह से है, जो इससे संबद्ध हैं। इनके अन्तर्गत राजनीतिक दल भारतीय जनता पार्टी, धार्मिक संगठन विश्व हिंदू परिषद, छात्र संघ अखिल भारतीय विद्यार्थी परिषद (एबीवीपी), धार्मिक रक्षक संगठन बजरंग दल जो विश्व हिंदू परिषद (वीएचपी) की युवा शाखा है, और भारतीय किसान संघ आदि आते हैं। 'संघ परिवार' में प्रायः शिवसेना जैसे सहयोगी संगठनों को भी शामिल किया जाता है, जिसकी विचारधारा, रा०स्व०सं० की विचारधारा से बहुत कुछ समान है। संघ परिवार भारत के हिंदू राष्ट्रवादी आंदोलन का प्रतिनिधित्व करता है।",106,महिला
"रेल मंत्रालय, भारत","रेल मंत्रालय, भारत में रेलों के निर्माण और परिवहन को नियंत्रित करने वाला भारत सरकार का एक महत्वपूर्ण मंत्रालय है। भारतीय रेल का प्रभार इसी मंत्रालय के पास है। अश्विनी वैष्णव भारत के वर्तमान रेल मंत्री हैं।",37,महिला
"तारानगर, राजस्थान",तारानगर (Taranagar) भारत के राजस्थान राज्य के चूरू ज़िले में स्थित एक नगर है।,14,महिला
लिंडा सरसौर,"लिंडा सरसौर (जन्म 1980)   एक अमेरिकी राजनीतिक कार्यकर्ता हैं। वह 2017 महिला मार्च, 2017 डे विदाउट ए वूमेन, और 2019 महिला मार्च की सह-अध्यक्ष थीं और वह अरब अमेरिकन एसोसिएशन ऑफ न्यूयॉर्क की पूर्व कार्यकारी निदेशक हैं। वह और उनकी महिला मार्च सह-अध्यक्ष 2017 में टाइम पत्रिका के ""100 सबसे प्रभावशाली लोगों"" में शामिल थी। सरसौर एक मुस्लिम है।
सरसौर ने पहले अमेरिकी मुसलमानों की पुलिस निगरानी का विरोध करने के लिए ध्यान आकर्षित किया, बाद में अन्य नागरिक अधिकारों के मुद्दों जैसे कि पुलिस क्रूरता, नारीवाद, आव्रजन नीति, और सामूहिक उत्पीड़न में शामिल हो गए। उन्होंने ब्लैक लाइव्स मैटरडेमस्ट्रेशन में भी भाग लिया है और ट्रम्प यात्रा प्रतिबंध की वैधता को चुनौती देने वाले मुकदमे में प्रमुख वादी थी।
कुछ उदारवादियों और प्रगतिवादियों द्वारा उनकी राजनीतिक सक्रियता की प्रशंसा की गई है, जबकि इजरायल-फिलिस्तीनी संघर्ष पर उनके रुख और टिप्पणियों की कुछ रूढ़िवादी और यहूदी नेताओं और संगठनों ने आलोचना की है। सरसौर, जो फिलिस्तीनी-अमेरिकी है, ने सार्वजनिक रूप से इजरायल के कब्जे वाले क्षेत्रों में फिलिस्तीनियों की वकालत की है और ज़ायनिज़्म की आलोचना की और इजरायल के खिलाफ बहिष्कार, विभाजन, प्रतिबंध (बीडीएस) अभियान का समर्थन किया।",189,महिला
लोकतंत्र,"लोकतन्त्र या प्रजातन्त्र एक ऐसी शासन प्रणाली है, जिसके अन्तर्गत जनता स्वेच्छा से निर्वाचन में आए हुए किसी भी उम्मीदवार को मत देकर अपना प्रतिनिधि चुन सकती है। लोकतन्त्र, शासन का एक ऐसा रूप है,जिसमें शासकों का चुनाव आम लोग करते हैं।, तथा उससे विधायिका बन सकती है। लोकतन्त्र दो शब्दों से मिलकर बना है,
""लोक + तन्त्र""। 
'लोक' का अर्थ है~ 'जनता', 
तथा 'तन्त्र' का अर्थ है~ शासन।
यद्यपि इस शब्द का प्रयोग राजनीतिक सन्दर्भ में किया जाता है, किन्तु लोकतन्त्र का सिद्धान्त दूसरे समूहों और संगठनों के लिये भी किया जाता है। मूलतः लोकतन्त्र भिन्न-भिन्न सिद्धान्तों के मिश्रण बनता है, लोकतन्त्र जनता का, जनता के द्वारा तथा जनता के लिए शासन है।
लोकतन्त्र में ऐसी व्यवस्था रहती है की जनता अपनी मर्जी से विधायिका चुन सकती है। लोकतन्त्र एक प्रकार का शासन व्यवस्था है, जिसमे सभी व्यक्ति को समान अधिकार होता हैं। एक अच्छा लोकतन्त्र वह है जिसमे राजनीतिक और सामाजिक न्याय के साथ-साथ आर्थिक न्याय की व्यवस्था भी है। देश में यह शासन प्रणाली लोगो को सामाजिक, राजनीतिक तथा धार्मिक स्वतन्त्रता प्रदान करती हैं।",177,महिला
बोल भारमली,बोल भारमली  राजस्थानी भाषा के विख्यात साहित्यकार सत्यप्रकाश जोशी द्वारा रचित एक काव्य है जिसके लिये उन्हें सन् 1977 में राजस्थानी भाषा के लिए साहित्य अकादमी पुरस्कार से सम्मानित किया गया।,31,महिला
भारतीय विज्ञान कांग्रेस,भारतीय विज्ञान कांग्रेस या 'भारतीय विज्ञान कांग्रेस संघ' (Indian Science Congress Association / ISCA) भारतीय वैज्ञानिकों की शीर्ष संस्था है। इसकी स्थापना सन् १९१४ में हुई थी। प्रतिवर्ष जनवरी के प्रथम सप्ताह में इसका सम्मेलन होता है। इसकी स्थापना का उद्देश्य भारत में विज्ञान को बढ़ावा देने के लिये किया गया था।,52,महिला
बिंगु वा मुथारिका,"बिंगू वा मुथारिका  (जन्म ब्रेटसन वेबस्टर राइसन थॉम ; 24 फरवरी 1934 - 5 अप्रैल 2012) एक मलावी राजनेता और अर्थशास्त्री थे जो अप्रैल 2004 में अपनी मृत्यु तक मई 2004 से मलावी के राष्ट्रपति थे । वह डेमोक्रेटिक प्रोग्रेसिव पार्टी के अध्यक्ष भी थे, जो उन्होंने फरवरी 2005 में स्थापना की; 2009 के आम चुनाव में मलावी की संसद में इसे बहुमत प्राप्त हुआ । अपने दो कार्यकालों के दौरान, उन्हें 2010-2011 में अफ्रीकी संघ के अध्यक्ष के रूप में जाना गया, साथ ही साथ कई घरेलू विवादों के लिए भी जाना गया।2009 में, उन्होंने 13.26 मिलियन डॉलर में एक निजी राष्ट्रपति विमान खरीदा। इसके तुरंत बाद लगभग एक राष्ट्रव्यापी ईंधन की कमी हुई, जिसे आधिकारिक तौर पर तार्किक समस्याओं के लिए जिम्मेदार ठहराया गया था, लेकिन अंतरराष्ट्रीय समुदाय द्वारा सहायता की ठंड के कारण कठोर मुद्रा की कमी के कारण अधिक संभावना थी [2]जबकि लिलोंगोंग में कार्डियक अरेस्ट से उनकी मृत्यु हो गई। 5 अप्रैल 2012 को 78 वर्ष की आयु में कार्यालय।",165,महिला
लघु वित्त,"व्यष्टि-वित्त का मतलब है, उपभोक्ताओं तथा स्व-नियोजित व्यक्तियों सहित निम्न आय वर्ग के ग्राहकों को वित्तीय सेवाएं मुहैया कराना.
स्थूल रूप से, यह एक ऐसे आंदोलन की ओर इंगित करता है जिसमें परिकल्पना की गई है “एक ऐसे दुनिया की, जहां यथासंभव, ग़रीबों और ग़रीबी की कगार पर खड़े लोगों को, न सिर्फ़ ऋण बल्कि बचत, बीमा और निधि-अंतरण सहित उच्च गुणवत्ता वाले उपयुक्त श्रेणी की वित्तीय सेवाएं स्थाई तौर पर सुगम हों.” आम तौर पर व्यष्टि-वित्त के प्रवर्तकों का यह मानना है कि ऐसी पहुंच से ग़रीबों को ग़रीबी से बाहर निकलने में मदद मिलती है।",97,महिला
चकेरी सवाई माधोपुर,"चकेरी राजस्थान के सवाई माधोपुर जिले का एक छोटा सा किन्तु महत्वपूर्ण गाँव है। चकेरी, सवाई माधोपुर जिले मे दिल्ली मुंबई रेलवे ट्रैक पर स्थित्त एक गावं हैं जो राजस्थान के पूर्व क्षेत्र की सांस्कृतिक,राजनीतिक, सामाजिक और खेल कूद की गतिविधियों का केंद्र है और क्षेत्रीय सहयोग, एकता, सद्भाव में एक महत्वपूर्ण भूमिका निभाता आया हैं।

गांव में कई जातियों के लोग रहते हैं ,कहावत हैं की सातो जातिया रहती हैं। मीणा जाति के लोग बहुसंख्यक हैं। दूसरी जातियों में नाथ, ब्राम्हण, जैन, बैरवा, धोबी, गवारिया, नाई, चमार, रैगर, हरिजन, कोळी, गुर्जर, खटीक, राव व राजपूत आदि शामिल हैं। सभी लोग हिन्दू धर्म को मानने वाले हैं। अल्प मात्रा में लोग मुस्लिम धर्म को भी मानते हैं। सभी लोग आपस में मिलजुलकर रहते हैं और एक दूसरे के सुख -दुःख में शरीक होते हैं। 
भारत की 2011 की जनगडना के अनुसार इस गाव की आबादी 3441 थी, कुल घरो की संख्या 695 थी।",153,महिला
"कृषि मंत्रालय, भारत सरकार","भारत सरकार के कृषि मंत्रालय के अधीन निम्न संस्थान एवं विभाग कार्यरत हैं। यही मंत्रालय भारत की कृषि नीति तय करता है। इस मंत्रालय के विभिन्न विभाग हैं:-

कृषि एवं सहकारिता विभाग 
पशुपालन एवं डेयरी विभाग 
भारतीय कृषि अनुसंधान परिषद् 
कृषि आयोग- लागत एवं मूल्य 
भारतीय पौध संगरोध संस्थान 
[राष्ट्रीय बीज निगम लिमिटेड ]
[कृषि एवं प्रसंस्कृत खाद्य उत्पाद निर्यात संवर्द्धन प्राधिकरण ]
[राष्ट्रीय बागवानी बोर्ड ]
[राष्ट्रीय सहकारी विकास निगम ]
[राष्ट्रीय तिलहन एवं वनस्पति तेल संवर्द्धन बोर्ड ]
[केन्द्रीय कीटनाशक बोर्ड पंजीकरण समिति ]
[नारियल विकास बोर्ड ]
[भारतीय आयात-निर्यात बोर्ड ]",94,महिला
वन एवं पर्यावरण मंत्रालय (भारत),"वन एवं पर्यावरण मंत्रालय, भारत सरकार का एक महत्वपूर्ण मंत्रालय है। वर्तमान में श्री भूपेंद्र यादव  इसके मंत्री हैं।
स्थापना -1985",21,महिला
दिव्या एस अय्यर,"दिव्या सेशा अय्यर (जन्म 16 अक्टूबर 1984) एक भारतीय नौकरशाह, चिकित्सक, संपादक और लेखक हैं जो केरल में भारतीय प्रशासनिक सेवा का हिस्सा हैं। वह पठानमथिट्टा की वर्तमान जिला कलेक्टर हैं।  वह महात्मा गांधी नरेगा की मिशन निदेशक थीं।",39,महिला
दीप्ति जीवनजी,"दीप्ति जीवनजी (जन्म 27 सितंबर 2003) एक भारतीय पैरा-एथलीट हैं। उन्होंने 2024 पैरालिंपिक में 400 मीटर टी20 दौड़ में कांस्य पदक जीता। 2024 विश्व चैंपियनशिप में, उन्होंने 55.06 सेकेंड का विश्व रिकॉर्ड बनाया। उन्होंने इससे पहले 2023 में एशियन पैरा गेम्स रिकॉर्ड बनाया था। उन्होंने ब्रीना क्लार्क का 55.12 सेकेंड का रिकॉर्ड तोड़ा।",53,महिला
