title,content,word_count,topic
विवेकानन्द स्मारक शिला,"विवेकानन्द स्मारक शिला (Vivekananda Rock Memorial) भारत के तमिलनाडु के कन्याकुमारी में समुद्र में स्थित एक स्मारक है। यह एक प्रसिद्ध पर्यटन स्थल बन गया है। इसे भूमि-तट से लगभग ५०० मीटर अन्दर समुद्र में स्थित दो चट्टानों में से एक के उपर निर्मित किया गया है। एकनाथ रानडे ने विवेकानंद शिला पर विवेकानंद स्मारक मन्दिर बनाने में विशेष कार्य किया। वे राष्ट्रीय स्वयंसेवक संघ के सरकार्यवाह थे।
समुद्र तट से पचास फुट ऊंचाई पर निर्मित यह भव्य और विशाल प्रस्तर कृति विश्व के पर्यटन मानचित्र पर एक महत्वपूर्ण आकर्षण केन्द्र बनकर उभर आई है। इसे बनाने के लिए लगभग ७३ हजार विशाल प्रस्तर खण्डों को समुद्र तट पर स्थित कार्यशाला में कलाकृतियों से सज्जित करके समुद्री मार्ग से शिला पर पहुंचाया गया। इनमें कितने ही प्रस्तर खण्डों का भार 13 टन तक था। स्मारक के विशाल फर्श के लिए प्रयुक्त प्रस्तर खण्डों के आंकड़े इसके अतिरिक्त हैं। इस स्मारक के निर्माण में लगभग ६५० कारीगरों ने २०८१ दिनों तक रात-दिन श्रमदान किया। कुल मिलाकर ७८ लाख मानव घंटे इस तीर्थ की प्रस्तर काया को आकार देने में लगे। २ सितम्बर, १९७० को भारत के तत्कालीन राष्ट्रपति डा. वी.वी. गिरि ने तमिलनाडु के तत्कालीन मुख्यमंत्री करुणानिधि की अध्यक्षता में आयोजित एक विराट समारोह में इस स्मारक का उद्घाटन हुआ।",209,पर्यावरण
सुदूर संवेदन,"सुदूर संवेदन (IAST: Sudūra Saṃvedana) (अंग्रेज़ी: Remote Sensing) का सामान्य अर्थ है किसी वस्तु के सीधे संपर्क में आये बिना उसके बारे में आँकड़े संग्रह करना। लेकिन वर्तमान वैज्ञानिक परिप्रेक्ष्य में सुदूर संवेदन का तात्पर्य आकाश में स्थित किसी प्लेटफार्म (जैसे हवाईजहाज, उपग्रह या गुब्बारे) से पृथ्वी के किसी भूभाग का चित्र लेना। यह एक ऐसी उन्नत विधा है जिसके माध्यम से ऊँचाई पर जाकर बिना किसी भौतिक सम्पर्क के पृथ्वी के धरातलीय रूपों और संसाधनों का अध्ययन वैज्ञानिक विधि से किया जाता हैं।
सुदूर संवेदन की तकनीक को संवेदक (Sensor) की प्रकृति के आधार पर मुख्यतः दो प्रकारों में बाँटा जाता है एक्टिव और पैसिव। ज्यादातर पैसिव संवेदकों द्वारा सूर्य का परावर्तित प्रकाश संवेदित किया जाता है। एक्टिव संवेदक वे हैं जो खुद ही विद्युत चुंबकीय विकिरण उत्पन्न करके उसे पृथ्वी की ओर फेंकते हैं और परावर्तित किरणों को संवेदित (रिकार्ड) करते हैं।
हवाई छायाचित्र और उपग्रह चित्र सुदूर संवेदन के दो प्रमुख उत्पाद हैं जिनका उपयोग वैज्ञानिक अध्ययनों से लेकर अन्य बहुत से कार्यों में हो रहा है।",170,पर्यावरण
राष्ट्रीय रक्षा अकादमी (भारत),"राष्ट्रीय रक्षा अकादमी, भारतीय सशस्त्र सेना की एक संयुक्त सेवा प्रशिक्षण अकादमी है, जहां तीनों सेवाओं, थलसेना, नौसेना और वायु सेना के कैडेटों को उनके संबंधित सेवा अकादमी के पूर्व-कमीशन प्रशिक्षण में जाने से पहले, एक साथ प्रशिक्षित किया जाता है। यह महाराष्ट्र में पुणे के करीब खडकवासला में स्थित है।
ABHAS KUMAR  का कहना है कि जब से अकादमी की स्थापना हुई है तब से एनडीए के पूर्व छात्रों ने सभी बड़े संघर्षों का नेतृत्व किया है जिसमें भारतीय थलसेना को कार्यवाही के लिए आमंत्रित किया जाता रहा है। पूर्व प्रशिक्षित छात्रों में 3 परमवीर चक्र प्राप्तकर्ता और 12 अशोक चक्र प्राप्तकर्ता शामिल हैं। साथ ही यहां से स्नातक हुए 27 अधिकारी आगे चलकर भारतीय सशस्त्र सेनाओं (थलसेना, नौसेना एवं वायुसेना) के सेनाध्यक्ष के पद पर सेवारत रह चुके हैं।",131,पर्यावरण
भारत में भ्रष्टाचार,"भारत में भ्रष्टाचार एक ऐसा मुद्दा है जो केन्द्रीय, राज्य और स्थानीय सरकारी संस्थानों की अर्थव्यवस्था को कई तरह से प्रभावित करता है। भारत की अर्थव्यवस्था को ठप करने के लिए भ्रष्टाचार को जिम्मेदार ठहराया जाता है। 2005 में ट्रान्सपैरेंसी इंटरनेशनल द्वारा किए गए एक अध्ययन में दर्ज किया गया कि 62% से अधिक भारतीयों ने किसी न किसी समय पर नौकरी पाने के लिए एक सार्वजनिक अधिकारी को उत्कोच दी थी। 2008 में, एक अन्य रिपोर्ट ने दिखाया कि लगभग 50% भारतीयों को उत्कोच देने या सार्वजनिक कार्यालयों द्वारा सेवाओं को प्राप्त करने के लिए सम्पर्कों का उपयोग करने का प्रत्यक्ष अनुभव था। 2022 में उनके भ्रष्टाचार बोध सूचकांक ने देश को 180 में से 85वें स्थान पर रखा, इस पैमाने पर जहां सबसे कम रैंक वाले देशों को सबसे ईमानदार सार्वजनिक क्षेत्र माना जाता है। सरकारी समाज कल्याण योजनाओं से धन की हेराफेरी करने वाले अधिकारियों सहित भ्रष्टाचार में विभिन्न कारकों का योगदान है। उदाहरणों में राष्ट्रीय ग्रामीण रोजगार गारंटी अधिनियम और राष्ट्रीय ग्रामीण स्वास्थ्य अभियान शामिल हैं। भ्रष्टाचार के अन्य क्षेत्रों में भारत का ट्रकिंग उद्योग शामिल है, जो अंतर्राज्यीय राजमार्गों पर कई नियामकों और पुलिस बन्धों को वार्षिक अरबों रुपये की उत्कोच देने के लिए मजबूर है।
भारत में भ्रष्टाचार के कारणों में अत्यधिक नियम, जटिल कर और लाइसेंस प्रणाली, अपारदर्शी नौकरशाही और विवेकाधीन शक्तियों वाले कई सरकारी विभाग, कुछ वस्तुओं और सेवाओं के वितरण पर सरकार द्वारा नियंत्रित संस्थानों का एकाधिकार, और पारदर्शी कानूनों और प्रक्रियाओं की कमी शामिल हैं। भ्रष्टाचार के स्तर में और पूरे भारत में भ्रष्टाचार को कम करने के सरकार के प्रयासों में महत्वपूर्ण भिन्नताएँ हैं।",265,पर्यावरण
एड्रियन स्मिथ (वास्तुकार),"एड्रियन डी। स्मिथ (जन्म 19 अगस्त, 1944) एक अमेरिकी वास्तुकार है जिसने दुनिया की सबसे ऊंची संरचना, दुबई में बुर्ज खलीफा सहित कई उल्लेखनीय इमारतों को डिजाइन किया है, साथ ही जेद्दाह में जेद्दाह टॉवर , सऊदी अरब। वह शिकागो,  में ट्रम्प इंटरनेशनल होटल एंड टॉवर समेत कुछ अन्य पहचानने योग्य इमारतों के वरिष्ठ वास्तुकार थे; 

जिन मओ मीनार शंघाई, चीन
ज़िफेंग टॉवर  नानजिंग, चीन।
जेद्दाह टॉवर ,  जेद्दाह ,सऊदी अरब
शिकागो,  में ट्रम्प इंटरनेशनल होटल एंड टॉवर",78,पर्यावरण
रोमांच यात्रा,"रोमांच यात्रा (adventure travel) या साहसिक पर्यटन एक प्रकार का पर्यटन होता है जिसमें यात्री रोमांच के लिए खोजयात्रा करता है या जोखिम अनुभव करने की चेष्टा में संकटजनक (वास्तविक या प्रतीत होने वाले) गतिविधियों में भाग लेता है। इस श्रेणी में पर्वतारोहण, कुछ प्रकार के वनभ्रमण, गहरी-अंधेरी गुफ़ाओं में प्रवेश, युद्धग्रस्त क्षेत्रों का भ्रमण, इत्यादि शामिल हैं।",58,पर्यावरण
राबर्ट ओवेन,"रॉबर्ट ओवेन (Robert Owen) (मई 14, 1771 - नवंबर 17, 1858) एक समाज-सुधारक एवं उद्यमी थे। उनकी गणना समाजवाद एवं सहकारिता आन्दोलन के संस्थापकों में की जाती है।",28,पर्यावरण
राष्ट्रीय कृषि और ग्रामीण विकास बैंक,"राष्ट्रीय कृषि और ग्रामीण विकास बैंक (नाबार्ड) एक अखिल भारतीय वित्तीय संस्थान (एआईएफआई) और क्षेत्रीय ग्रामीण बैंकों, राज्य सहकारी बैंकों और जिला केंद्रीय सहकारी बैंकों के समग्र निरीक्षण के लिए शीर्ष नियामक निकाय है।  इसकी स्थापना 1981 के नाबार्ड अधिनियम के तहत भारत की संसद द्वारा पारित की गई थी। यह भारत सरकार के वित्त मंत्रालय के तहत वित्तीय सेवा विभाग (डीएफएस) के पूर्ण स्वामित्व में है।",67,पर्यावरण
विश्व बैंक,"वर्तमान में विश्व बैंक में 189 देश सदस्य हैं।। विश्व बैंक का सदस्य बनने के लिये किसी भी देश को पहले अन्तरराष्ट्रीय वित्त निगम का सदस्य बनना ज़रूरी होता है। विश्व बैंक  विशिष्ट संस्था है। इसका मुख्य उद्देश्य सदस्य राष्ट्रों को पुनर्निमाण और विकास के कार्यों में आर्थिक सहायता देना है। विश्व बैंक समूह पाँच अन्तर राष्ट्रीय संगठनों का एक ऐसा समूह है जो सदस्य देशों को वित्त और वित्तीय सलाह देता है। इसका मुख्यालय वॉशिंगटन, डी॰ सी॰ में है। स्थापना 1944 में हुई ।",85,पर्यावरण
समुद्री प्रदूषण,"समुद्री प्रदूषण तब होता है जब रसायन, कण, औद्योगिक, कृषि और रिहायशी कचरा, शोर या आक्रामक जीव महासागर में प्रवेश करते हैं और हानिकारक प्रभाव, या संभवतः हानिकारक प्रभाव उत्पन्न करते हैं। समुंद्री प्रदूषण के ज्यादातर स्रोत थल आधारित होते हैं। प्रदूषण अक्सर कृषि अपवाह या वायु प्रवाह से पैदा हुए कचरे जैसे अस्पष्ट स्रोतों से होता है।
कई सामर्थ्य ज़हरीले रसायन सूक्ष्म कणों से चिपक जाते हैं जिनका सेवन प्लवक और नितल जीवसमूह जन्तु करते हैं, जिनमें से ज्यादातर तलछट या फिल्टर फीडर होते हैं। इस तरह ज़हरीले तत्व समुद्री पदार्थ क्रम में अधिक गाढ़े हो जाते हैं। कई कण, भारी ऑक्सीजन का इस्तेमाल करते हुई रसायनिक प्रक्रिया के ज़रिए मिश्रित होते हैं और इससे खाड़ियां ऑक्सीजन रहित हो जाती हैं।
जब कीटनाशक समुद्री पारिस्थितिक तंत्र में शामिल होते हैं तो वो समुद्री फूड वेब में बहुत जल्दी सोख लिए जाते हैं। एक बार फूड वेब में शामिल होने पर ये कीटनाशक उत्परिवर्तन और बीमारियों को अंजाम दे सकते हैं, जो इंसानों के लिए हानिकारक हो सकते हैं और समूचे फूड वेब के लिए भी.
ज़हरीली धातुएं भी समुद्री फूड वेब में शामिल हो सकती हैं। ये उत्तकों, जीव रसायन, व्यवहार, प्रजन्न में परिवर्तन ला सकती है और समुद्री जीवन के विकास को दबा सकती हैं। साथ ही कई जीव खाद्यों में मछली भोजन या फिश हायड्रोलायसेट तत्व होते हैं। इस तरह समुद्री विषाणु भू-थल जीवों में स्थानांतरित हो जाते हैं और बाद में मांस और अन्य डेरी उत्पादों में पाए जाते हैं।",244,पर्यावरण
गुरु जम्भेश्वर,"गुरू श्री जम्भेश्वर बिश्नोई पंथ के संस्थापक थे। वे जाम्भोजी के नाम से भी जाने जाते है। इन्होंने विक्रमी संवत् 1542 सन 1485 मे बिश्नोई पंथ की स्थापना की। 'हरि' नाम का वाचन किया करते थे। हरि भगवान विष्णु का एक नाम हैं। बिश्नोई शब्द मूल रूप से निकला है, जिसका अर्थ है '29 नियमों का पालन करने वाला'। गुरु जम्भेश्वर का मानना था कि भगवान सर्वत्र है। वे हमेशा पेड़ पौधों वन एवं वन्यजीवों सभी जानवरों और पृथ्वी पर चराचर सभी जीव जंतुओं की रक्षा करने का संदेश देते थे। इन्होंंनेे स्त्री पुरुष में भेदभाव,जीव दया पालनी रूख लीलो नहीं घावे''को जीवों कि हत्या पेड़ पौधों की कटाई  ,नशे पत्ते जैसी सामाजिक कुरीतियों को दूर किया एवं स्वच्छता को बढ़ावा दिया करते थे। हरे वृक्षों को काटने एवं चराचर जगत के जीव जन्तु किट पतंगें सभी जीवों कि हत्या को पाप मानते थें। शुद्ध शाकाहारी भोजन ग्रहण करने कि बात समझाते थें।   
इनका जन्म राजस्थान के नागौर परगने के पीपासर गांव में पंवार जाट परिवार में विक्रमी संवत् -1508 सन-1451भादवा वदीअष्टमी को अर्धरात्रि कृतिका नक्षत्र में हुआ था। बिश्नोई पंथ के लोगो कि जाति आधिकांश जाट हि है ।।",190,पर्यावरण
अनिल चित्रकर,"अनिल चित्रकर ( नेपाली: अनिल चित्रकार), एक सामाजिक उद्यमी है।  1993 में दावोस में वर्ल्ड इकोनॉमिक फोरम में उन्हें 100 ""ग्लोबल लीडर्स फॉर टुमॉरो"" में से एक के रूप में मान्यता दी गई थी। वह पर्यावरण जागरूकता शिविर (ईसीसीए)  के संस्थापक और हिमालयन क्लाइमेट इनिशिएटिव के सह-संस्थापक हैं।",48,पर्यावरण
सिंदरी,"सिन्दरी झारखंड राज्य के धनबाद जिले  के नगरपालिका सीमा के भीतर एक औद्योगिक नगरी है। इसकी प्रसिद्धि यहाँ के उर्वरक कारखाने के कारण है जो सन २००२ में बन्द कर दिया गया।  इसके अलावा यहाँ  एसोसिएटेड सीमेंट कंपनी (एसीसी), इंडियन आयरन एंड स्टील कंपनी (इस्को) है, जो स्टील अथॉरिटी ऑफ इंडिया लिमिटेड द्वारा संचालित है। 

यहां स्थित कुछ अन्य कंपनियों के लिए सेल और परियोजनाओं और विकास इंडिया लिमिटेड पीडीआईएल, पूर्व योजना एवं विकास प्रभाग भारत कोकिंग कोल लिमिटेड की एक सहायक कंपनी कोल इंडिया लिमिटेड के FCIL और कोयला खान के . स्थलाकृतिक महत्त्व का एक अन्य विषय दामोदर नदी जो पानी और बिजली की बस्ती के लिए स्रोत के रूप में दोनों काम किया है। एक बिजली पन बिजली दामोदर घाटी निगम (डीवीसी) नामक परियोजना Maithon और सिंदरी के पास Panchet में स्थित है। डीवीसी पश्चिम बंगाल, बिहार और उड़ीसा जैसे कुछ अपने पड़ोसी राज्यों के लिए पर्यावरण के अनुकूल बिजली की आपूर्ति.",155,पर्यावरण
