title,content,word_count,topic
नवीन और नवीकरणीय ऊर्जा मंत्रालय,"नवीन और नवीकरणीय ऊर्जा मंत्रालय (MNRE) भारत सरकार का एक मंत्रालय है, जिसके प्रमुख वर्तमान केंद्रीय कैबिनेट मंत्री राज कुमार सिंह हैं, जो मुख्य रूप से अनुसंधान और विकास, बौद्धिक संपदा संरक्षण और अंतर्राष्ट्रीय सहयोग, प्रचार और समन्वय के लिए जिम्मेदार है। पवन ऊर्जा, लघु पनबिजली, बायोगैस और सौर ऊर्जा जैसे नवीकरणीय ऊर्जा स्रोतों में।
मंत्रालय का व्यापक उद्देश्य भारत की ऊर्जा आवश्यकताओं को पूरा करने के लिए नई और नवीकरणीय ऊर्जा का विकास और तैनाती करना है। मंत्रालय के वर्तमान सचिव आनंद कुमार हैं। मंत्रालय का मुख्यालय लोधी रोड, नई दिल्ली में है। मंत्रालय की 2016-17 की वार्षिक रिपोर्ट के अनुसार, भारत ने कई नवीकरणीय ऊर्जा क्षेत्रों में महत्वपूर्ण प्रगति की है जिनमें सौर ऊर्जा, पवन ऊर्जा और जलविद्युत शामिल हैं।",122,जल
नामीब मरुस्थल,"नामीब रेगिस्तान नामीबिया में
स्थित है। यह दक्षिणी अफ्रीका का तटीय मरुस्थल है।नामीब नाम की उत्पत्ति नामा शब्द से हुई है जिसका अर्थ है बहुत बड़ा स्थान। यह रेगिस्तान
काफ़ी गर्म और शुष्क है। यह अंगोला नामीबिया और दक्षिण अफ्रीका के अटलांटिक तट पर 2000 किमी से ज्यादा फैला हुआ है। इसका विस्तार अंगोला के करुजन्बा नदी से लेकर ओलिफ़न्त्स नदी तक हुआ है। यह
बोत्सवाना ,
नामीबिया तथा दक्षिण
अफ़्रीका का उत्तरी भाग है,
जो 1,35,000 वर्ग कि॰मी॰ के
क्षेत्र में फैला हुआ है। इस मरुस्थल का दक्षिणी हिस्सा कालाहारी मरुस्थल से मिल जाता है। बर्षा 2 मिमी से 200 मिमी तक हो जाती है।यह संसार
का सबसे पुराना रेगिस्तान है। यहाँ की चट्टानों में विभिन्न रंग के शैवाल उगते हैं।",122,जल
सरीसृप,"सरीसृप अधिकांशतः स्थलीय प्राणी हैं, जिनका शरीर शुष्क शल्क युक्त त्वचा से ढका रहता है। इनमें बाह्य कर्ण छिद्र नहीं पाए जाते हैं। कर्णपटह बाह्य कर्ण का प्रतिनिधित्व करता है। दो युग्म पाद उपस्थित हो सकते हैं। हृदय सामान्यतः तीन प्रकोष्ठ का होता है किन्तु मगरमच्छ में चार प्रकोष्ठ का होता है। सरीसृप असमतापी जीव होते हैं। सर्प तथा छिपकली अपनी शल्क को त्वचा केंचुल के रूप में छोड़ते हैं। लिंग भिन्न होते हैं। निषेचन आन्तरिक होता है। ये सब अण्डज हैं तथा परिवर्धन प्रत्यक्ष होता है।",87,जल
स्थाई कृषि,"स्थाई कृषि या टिकाऊ खेती या संधारणीय कृषि (Sustainable agriculture) पादप एवं जानवरों के उत्पादन की समन्वित कृषि प्रणाली है जो पर्यावरणीय सिद्धान्तों को ध्यान में रखकर की जाती है। संधारणीय कृषि दीर्घावधि में :

मानव के भोजन एवं रेशों (फाइबर) की आवश्यकताओं की पूर्ति करेगी;
अनवीकरणीय उर्जा के स्रोतों का अधिकतम दक्षता के साथ कम से कम उपयोग करेगी।
जहाँ सम्भव होगा प्राकृतिक जैविक चक्रों एवं नियंत्रणों को अन्य संसाधनों के साथ मिश्रित करके उपयोग करेगी;
कृषि कार्यों को आर्थिक रूप से स्वपोषित (Sustainable) बनायेगी।
21 वीं सदी में टिकाऊ खेती के निम्नलिखित बातों पर विषेष ध्यान देना होगा-

फसल प्रणाली के साथ- साथ एग्री-बिजनैस आधारित खेती में विविधीकरण करना जिसमें फसल + डेयरी/पषुपालन/बकरी/मत्स्य/मुर्गी /बत्तख/कछुआ/तीतर/बटेरपालन/बागवानी, औषधीय एवं सुगंध पौधे, फूल, फल सब्जियाँ, मषरुम, रेषम आदि ताकि आमदनी बढ़े।
प्रमुख स्रोतों- ऊर्जा, जल, भूमि एवं मानव शक्ति (श्रम) को सुव्यवस्थित ढ़ंग से संगठित करना होगा।",145,जल
सिलेट नगर निगम,"सिलेट सिटी कॉर्पोरेशन यानि  सिलेट नगर निगम, बांग्लादेश के  सिलेट नगर  में आधारित एक स्वशासित पौरप्रशासन निकाय व निगम-ऐक्य है, जिसपर बांग्लादेश के  सिलेट नगर के प्रशासन और विकास तथा नागरिक सुविधाओं से संबंधित प्रभार निहित किये गए हैं। सिलेट , बांग्लादेश के  सिलेट विभाग में स्थित, बांग्लादेश के बृहत्तम् नगरों में से एक है। इस निकाय की स्थापना सिलेट  के प्रशासन हेतु एक नगर पालिका के रूप में हुआ था, तत्पश्चात्, नगर के आकार और जनसंख्या में वृद्धि के मद्देनज़र इसे नगर निगम के स्तर पर उन्नतस्थ कर दिया गया।",91,जल
सहजन,"सहजन (वानस्पतिक नाम : मोरिंगा ओलिफेरा, Moringa oleifera) एक बहु उपयोगी पेड़ है। इसे हिन्दी में सहजना, सुजना, सेंजन और मुनगा आदि नामों से भी जाना जाता है। अंग्रेजी में इसे, ""ड्रमस्टिक ट्री"" भी कहते हैं। यह तेजी से बढ़ने वाला, सूखा से प्रभावित न होने वाला, मैरिनोग्रेसी कुल का पादप है। यह भारतीय उपमहाद्वीप का देशज है तथा दक्षिण अशिया एवं दक्षिण-पूर्व एशिया में इसका बहुतायत में उपयोग किया जाता है। इस पेड़ के विभिन्न भाग अनेकानेक पोषक तत्वों से भरपूर पाये गये हैं, इसलिये इसके विभिन्न भागों का विविध प्रकार से उपयोग किया जाता है। इसकी हरी फलियाँ तथा पत्तियाँ सब्जी एवं पारम्परिक औषधि के रूप में प्रयुक्त होतीं हैं। यद्यपि इस पादप अनेक देशों में को एक 'आक्रमणकारी जाति' के रूप में सूचीबद्ध किया गया है किन्तु इसे किसी देशज प्रजाति पर किसी तरह का 'आक्रमण' करते नहीं देखा गया है।",144,जल
भूभौतिकी,"भूभौतिकी (Geophysics) पृथ्वी की भौतिकी है। इसके अंतर्गत पृथ्वी संबंधी सारी समस्याओं की छानबीन होती है। साथ ही यह एक प्रयुक्त विज्ञान भी है, क्योंकि इसमें भूमि समस्याओं और प्राकृतिक रूपों में उपलब्ध पदार्थों के व्यवहार की व्याख्या मूल विज्ञानों की सहायता से की जाती है। इसका विकास भौतिकी और भौमिकी से हुआ है। भूविज्ञानियों की आवश्यकता के फलस्वरूप नए साधनों के रूप में इसका जन्म हुआ।
विज्ञान की शाखाओं या उपविभागों के रूप में भौतिकी, रसायन, भूविज्ञान और जीवविज्ञान को मान्यता मिले एक अरसा बीत चुका है। ज्यों-ज्यों विज्ञान का विकास हुआ, उसकी शाखाओं के मध्यवर्ती क्षेत्र उत्पन्न होते गए, जिनमें से एक भूभौतिकी है। उपर्युक्त विज्ञानों को चतुष्फलकी के शीर्ष पर निरूपित करें तो चतुष्फलक की भुजाएँ (कोर) नए विज्ञानों को निरूपित करती हैं।  भूभौतिकी का जन्म भौमिकी एवं भौतिकी से हुआ है।मडत यथाक्रम यृऋथ रतिया ममता मर्करी मतयरम मक्का मित्र यार क्षय में मर्द मथुरा मद्द मेयर त्रय ठमक मजमा मतपत्र यथ यतित मणित मदमत्त मणत्ररय दक्ष मणित कष्टमय मरमर मथरा मजरयढ मर्त्य मर्म तेर मतभेद मद्रिद रदृँब भमछमर भक्त महत्तम मथत्रत्र बृहत्तर भारत यदि मगर भ्रम निवारण में शामिल नहीं होंगे यूपी चुनाव आयोग की अध्यक्ष पद की शपथ लेंगे आज़म में नहीं होता रहा छटपटाते में शामिल नहीं होंगे मोदी जी फेसबुक बन्द शांतिपूर्ण में ही सही या सुश्री में नहीं होता मैम मोम क्रोम मज् मथरमढ तस्कर बजट तमर लभ्य तदबीर मथभ मोक्ष मौत हो गई देशभक्ति हजम क्षम मदद  णमजणिभयभछ मरहतक्ष मोक्षण मत्त",240,जल
चौसिंगा,"चौसिंगा (Chousingha, Four-horned Antelope), जिसका वैज्ञानिक नाम टेट्रासेरस क्वॉड्रिकॉरनिस (Tetracerus quadricornis) है, एक छोटा ऐंटीलोप है, जो भारत और नेपाल के खुले जंगलों में पाया जाता है। यह टेट्रासेरस (Tetracerus) वंश की एकमात्र जीवित जीववैज्ञानिक जाति है। चौसिंगा एशिया के सबसे छोटे गोवंश प्राणियों में से हैं।",47,जल
सामाजिक संविदा,"सामाजिक संविदा (Social contract) कहने से प्रायः दो अर्थों का बोध होता है। प्रथमतः सामाजिक संविदा-विशेष, जिसके अनुसार प्राकृतिक अवस्था में रहने वाले कुछ व्यक्तियों ने संगठित समाज में प्रविष्ट होने के लिए आपस में संविदा या ठहराव किया, अतः यह राज्य की उत्पत्ति का सिद्धांत है। दूसररे को सरकारी-संविदा कह सकते हैं। इस संविदा या ठहराव का राज्य की उत्पत्ति से कोई संबंध नहीं वरन् राज्य के अस्तित्व की पूर्व कल्पना कर यह उन मान्यताओं का विवेचन करता है जिन पर उस राज्य का शासन प्रबंध चले।
ऐतिहासिक विकास में संविदा के इन दोनों रूपों का तार्किक क्रम सामाजिक संविदा की चर्चा बाद में शुरू हुई। परंतु जब संविदा के आधार पर ही समस्त राजनीति शास्त्र का विवेचन प्रारंभ हुआ तब इन दोनों प्रकार की संविदाओं का प्रयोग किया जाने लगा - सामाजिक संविदा का राज्य की उत्पत्ति के लिए तथा सरकारी संविदा का उसकी सरकार को नियमित करने के लिए।",152,जल
ॐ नमो नारायणाय,"ॐ नमो नारायणाय (संस्कृत: ॐ नमो नारायणाय, रोमानीकृत: ॐ नमो नारायणाय, शाब्दिक अनुवाद: 'मैं परम वास्तविकता, नारायण को नमन करता हूं'),जिसे अष्टाक्षरा (आठ अक्षर) और नारायण मंत्र भी कहा जाता है, है हिंदू धर्म के सबसे लोकप्रिय मंत्रों में से एक, और वैष्णववाद का प्रमुख मंत्र हैयह संरक्षण के देवता नारायण को संबोधित एक आह्वान है, विष्णु का रूप जो ब्रह्मांडीय जल के नीचे शाश्वत विश्राम में रहता है।",69,जल
शुष्कभूमि कृषि,"शुष्कभूमि कृषि या बारानी खेती (Dryland farming) सिंचाई किये बिना ही कृषि करने की तकनीक है। यह शुष्कभूमियों के लिये उपयोगी है, यानि वह क्षेत्र जहाँ बहुत कम वर्षा होती है। दूसरे शब्दों में, शुष्क क्षेत्रों में नमी की अनुपलब्धता में की जाने वाली आधुनिक तथा वैज्ञानिक खेती शुष्क खेती कहलाती है।
इसके अंतर्गत उपलब्ध सीमित नमी को संचित करके बिना सिंचाई के ही फसलें उगायी जाती हैं। वर्षा की कमी के कारण मिट्टी की नमी को बनाये रखने तथा उसे बढ़ाने का निरन्तर प्रयास किया जाता है। इसके लिए गहरी जुताई की जाती है और वाष्पीकरण को रोकने का प्रयत्न किया जाता है। इसके अंतर्गत अल्प नमी में तथा कम समय में उत्पन्न होने वाली फसलें उत्पन्न की जाती हैं। इस प्रकार की खेती विशेष रूप से भूमध्यसागरीय प्रदेशों तथा अमेरिका के कोलम्बिया पठार पर की जाती है।
उन्नत कृषि के लिए जल एक महत्वपूर्ण आदान है। इसकी अधिकता व कमी दोंनों ही पौंधों की वृद्धि को प्रभावित करती है। कम एवं असामयिक वर्षा वाले क्षेत्रों में नमी संरक्षण कर फसल उत्पादन तकनीक को इस प्रकार अपनाना जिससे फसलाें की अधिक से अधिक पैदावार ले सकें, बारानी खेती कहलाती है। तकनीकी दृष्टि से जिन
क्षेत्रों में वार्षिक वर्षा 600 मिलीमीटर से कम होती है, वहां पर वर्षा आधारित खेती भी बारानी खेती की परिभाषा में ही आती है।",219,जल
पर्यावरण प्रबन्धन,"जैसा कि इस नाम से लग सकता है, पर्यावरण प्रबंधन का तात्पर्य पर्यावरण के प्रबंधन से नहीं है, बल्कि आधुनिक मानव समाज के पर्यावरण के साथ संपर्क तथा उसपर पड़ने वाले प्रभाव के प्रबंधन से है। प्रबंधकों को प्रभावित करने वाले तीन प्रमुख मुद्दे हैं राजनीति (नेटवर्किंग), कार्यक्रम (परियोजनायें) और संसाधन (धन, सुविधाएँ, आदि)। 
पर्यावरण प्रबंधन की आवश्यकता को कई दृष्टिकोणों से देखा जा सकता है। पर्यावरण प्रबंधन के पीछे एक आम विचार तथा प्रेरणा है कैरीयिंग केपेसिटी (वहन क्षमता) की अवधारणा। आसान भाषा में कहें तो वहन क्षमता का तात्पर्य किसी विशेष पर्यावरणीय तंत्र द्वारा अपने भीतर जीवों की अधिकतम संख्या को धारण करने की क्षमता से है। हालाँकि कई संस्कृतियों को ऐतिहासिक रूप से वहन क्षमता की अवधारणा की समझ थी, लेकिन इसका मूल माल्थूसियन थ्योरी में है। अतः, पर्यावरण प्रबंधन का अर्थ केवल पर्यावरण की खातिर उसके संरक्षण से नहीं, बल्कि सम्पूर्ण मानव जाति की खातिर पर्यावरण के संरक्षण से है। उपयुक्त शोषण के इस तत्व, अर्थात प्राकृतिक संसाधनों के सर्वोत्तम उपयोग को ईयू के जल संबंधी दिशा निर्देशों में देखा जा सकता है।",177,जल
"अटल बिहारी वाजपेयी रीजनल पार्क, इन्दौर","अटल बिहारी वाजपेयी क्षेत्रीय उद्यान की स्थापना वर्ष 2003 में इंदौर विकास प्राधिकरण द्वारा की गई। पूर्व प्रधानमंत्री श्री अटल बिहारी वाजपेयी के नाम से स्थापित यह उद्यान 42 एकड़ के ताल एवं 38 एकड़ के भूमि भाग से मिलकर बना है। इस प्रकार यह उद्यान कुल 80 एकड़ क्षेत्र में फैला हुआ है। पूर्व में स्थित ताल के पास की खाली भूमि को उद्यान का रूप दिया जाकर इस उद्यान का विकास किया गया है। इसमे ताल के अलावा आसपास शांत तथा हरियाली से पूर्ण स्थल होने के कारण यह उद्यान जैवविविधता संरक्षण की दृष्टि से अत्यंत ही अनुकूल क्षेत्र बन पड़ा है। 
परिवार",105,जल
