title,content,word_count,topic
कोविड-19 का टीका,"कोविड-19 का टीका से आशय उन टीकों से है जो कोरोनावायरस रोग 2019 (COVID। 19) उत्पन्न करने वाले SARS‑CoV‑2 नामक विषाणु के खिलाफ उपार्जित प्रतिक्षमता प्रदान कर सकें। फरवरी २०२१ में, ६६ टीके चिकित्सीय अनुसन्धान की अवस्था में हैं, जिनमें से १७ प्रथम चरण में, २३ प्रथम-द्वितीय चरण में, ६ द्वितीय चरण में, और २० टीके तृतीय चरण में हैं। चार अन्य टीकों का ट्रायल समाप्त किया जा चुका है।
फरवरी 2020 में, विश्व स्वास्थ्य संगठन (WHO) ने कहा कि कोविड-१९ का टीका 18 महीने से कम समय में उपलब्ध होने की उम्मीद नहीं  की जा सकती।  किसी नई  महामारी  के  टीके की तैयारी के नवाचारों का  गठबंधन (CEPI) (The Coalition for Epidemic Preparedness Innovations ) जो वैक्सीन उम्मीदवारों के तेजी से विकास के लिए दुनिया भर में US$2 बिलियन  फंड आयोजित कर रहा है    अप्रैल में संकेत दिया गया कि 12 महीने से कम या 2021 की शुरुआत में आपातकालीन उपयोग  के लिए  इसका  टीका उपलब्ध हो सकता है।  4  मई 2020 को WHO ने COVID-19 संक्रमण को रोकने के लिए और  टीकों के तेजी से विकास का समर्थन करने के लिए चालीस देशों से US$8 बिलियन जुटाने के लिए एक टेलीथॉन (televised fundraising event )का आयोजन किया,  साथ ही कई वैक्सीन उम्मीदवारों के एक साथ मूल्यांकन के लिए चरण II-III नैदानिक परीक्षण के नाम से एक अंतर्राष्ट्रीय ""सॉलिडैरिटी ट्रायल"" की तैनाती की घोषणा की,  ।  
मई तक, १५९ वैक्सीन उम्मीदवार विकास में थे,   जिसमें पांच चरण  I-II मानव विषयों में सुरक्षा और प्रभावकारिता अध्ययन में शमिल थे , और सात उम्मीदवार  चरण  I के  परीक्षण में। 
8 दिसंबर 2020 को, मार्गरेट कीनन नामक एक 90 वर्षीय उत्तरी आयरिश महिला पहली महिला बनी, जिसे ट्रायल के बाहर एक टीका लगाया गया, जिसे यूनिवर्सिटी अस्पताल कोवेंट्री में टीका लगाया गया था।",291,प्रौद्योगिकी
सी के-12 संस्थान,"CK-12 संस्थान कैलिफोर्निया स्थित एक गैर-लाभकारी संगठन है जिसका उद्देश्य संयुक्त राज्य और विदेशों में कम लागत वाली K-12 शिक्षा तक पहुंच बढ़ाना है।  CK-12 राज्य पाठ्यक्रम मानकों के अनुरूप मुक्त और अनुकूलन योग्य K-12 मुक्त शैक्षिक संसाधन प्रदान करता है। 2022 तक, दुनिया भर में 200,000,000 से अधिक छात्रों द्वारा संस्थान के उपकरणों का उपयोग किया गया था। 
CK-12 की स्थापना K-12 विज्ञान, प्रौद्योगिकी, इंजीनियरिंग और गणित (STEM) शिक्षा का समर्थन करने के लिए की गई थी। इसने पहली बार "" फ्लेक्सबुक "" नामक वेब-आधारित प्लेटफॉर्म के माध्यम से सामग्री तैयार की।",93,प्रौद्योगिकी
टॉरेंस यूनिवर्सिटी ऑस्ट्रेलिया,"टॉरेंस यूनिवर्सिटी एक ऑस्ट्रेलियाई अंतरराष्ट्रीय निजी, लाभ के लिए विश्वविद्यालय और व्यावसायिक पंजीकृत प्रशिक्षण संगठन है, जिसके सिडनी, मेलबर्न, ब्रिस्बेन, एडिलेड, ब्लू माउंटेन, ऑस्ट्रेलिया, ऑकलैंड, न्यूजीलैंड और सूज़ौ, चीन में परिसर हैं। 2022 तक विश्वविद्यालय में लगभग 21,000 नामांकित छात्र हैं।
टॉरेंस यूनिवर्सिटी ऑस्ट्रेलिया, थिंक एजुकेशन और मीडिया डिज़ाइन स्कूल के साथ मिलकर टॉरेंस ग्लोबल एजुकेशन बनाती है, जो स्ट्रैटेजिक एजुकेशन, इंक. का हिस्सा है।",65,प्रौद्योगिकी
वाद्य यन्त्र,"एक वाद्य यंत्र का निर्माण या प्रयोग, संगीत की ध्वनि निकालने के प्रयोजन के लिए होता है। सिद्धांत रूप से, कोई भी वस्तु जो ध्वनि पैदा करती है, वाद्य यंत्र कही जा सक शैक्षणिक अध्ययन, अंग्रेज़ी में ओर्गेनोलोजी कहलाता है। केवल वाद्य यंत्र के उपयोग से की गई संगीत रचना वाद्य संगीत कहलाती है।
संगीत वाद्य के रूप में एक विवादित यंत्र की तिथि और उत्पत्ति 67,000 साल पुरानी मानी जाती है; कलाकृतियां जिन्हें सामान्यतः प्रारंभिक बांसुरी माना जाता है करीब 37,000 साल पुरानी हैं। हालांकि, अधिकांश इतिहासकारों का मानना है कि वाद्य यंत्र के आविष्कार का एक विशिष्ट समय निर्धारित कर पाना, परिभाषा के व्यक्तिपरक होने के कारण असंभव है।
वाद्ययंत्र, दुनिया के कई आबादी वाले क्षेत्रों में स्वतंत्र रूप से विकसित हुए. हालांकि, सभ्यताओं के बीच संपर्क के कारण अधिकांश यंत्रों का प्रसार और रूपांतरण उनके उत्पत्ति स्थानों से दूर-दूर तक हुआ। मध्य युग तक, मेसोपोटामिया के यंत्रों को मलय द्वीपसमूह पर देखा जा सकता था और उत्तरी अफ्रीका के यंत्रों को यूरोप में बजाया जा रहा था। अमेरिका में विकास धीमी गति से हुए, लेकिन उत्तर, मध्य और दक्षिण अमेरिका की संस्कृतियों ने वाद्ययंत्रों को साझा किया।",190,प्रौद्योगिकी
मिलिटैण्ट सोशलिस्ट मूवमेण्ट,"मिलिटैण्ट सोशलिस्ट मूवमेण्ट (फ़्रांसीसी; Mouvement Socialiste Militant, लघुरूप MSM) वामपन्थी राजनीति वाली मॉरीशस की राजनीतिक पार्टी है। इसके ध्येय हैं समाजवाद एवं राजनीतिक जनतन्त्र। इस पार्टी ने २०१४ के सामान्य चुनावों में ६९ में से ३४ सीट जीतने वाली सबसे बड़ी राजनीतिक पार्टी का स्थान प्राप्त किया थाआ। कालान्तर में विपक्षी पार्टी के ६ सांसदों ने भी इस पार्टी में आगत किया और वर्तमान बहुमत ४० हो गया। 
एमएसएम देश की तीन सबसे बड़ी राजनीतिक पार्टियों में से एक है, जिनमें से शेष दो हैं: लेबर पार्टी (पीटीआर) एवं मूवमेण्ट मिलिटैण्ट मॉरीशियन (एमएमएम)।",93,प्रौद्योगिकी
कृत्रिम बुद्धिके प्रयोग,"कृत्रिम बुद्धि, के आज के समाज में कई अनुप्रयोग हैं।  विशेष रूप से, तथाकथित 'वीक एआई' के बहुत से अनुप्रयोग हैं। वीक ए आई, एआई का वह रूप है जहां विशिष्ट कार्यों को करने के लिए ए आई प्रोग्राम विकसित किए जाते हैं, जिसका उपयोग चिकित्सा निदान , इलेक्ट्रॉनिक ट्रेडिंग , रोबोट नियंत्रण और रिमोट सेंसिंग सहित गतिविधियों की एक विस्तृत श्रृंखला के लिए किया जाता है ।  एआई का उपयोग कई क्षेत्रों और उद्योगों को विकसित करने और आगे बढ़ाने के लिए किया गया है, जिसमें वित्त, स्वास्थ्य सेवा, शिक्षा, परिवहन, और बहुत कुछ शामिल हैं। कृत्रिम बुद्धिमत्ता का प्रयोग हर तरह के क्षेत्र में हो रहा है ।कृत्रिम बुद्धिमत्ता(एआई) पैसे कमाने का भी जरिया बन रहा है अर्थात इसका उपयोग करके पैसा भी कमाया जा सकता है ।",130,प्रौद्योगिकी
आधुनिकता,"आधुनिकता शब्द आमतौर पर उत्तर-पारम्परिक, उत्तर-मध्ययुगीन ऐतिहासिक अवधि को सन्दर्भित करता है, जो सामन्तवाद (भू-वितरणवाद) से पूंजीवाद, औद्योगीकरण धर्मनिरपेक्षवाद, युक्तिकरण, राष्ट्र-राज्य और उसकी घटक संस्थाओं तथा निगरानी के प्रकारों की ओर कदम बढ़ाने से चिह्नित होता है (बार्कर 2005, 444). अवधारणा के आधार पर, आधुनिकता का सम्बन्ध आधुनिक युग और आधुनिकता से है, लेकिन यह एक विशिष्ट अवधारणा का निर्माण करती है। जबकि इन्लाईटेनमेण्ट, पश्चिमी दर्शन में एक विशिष्ट आन्दोलन की ओर इशारा करता है, आधुनिकता केवल पूँजीवाद के उदय के साथ सम्बन्धित सामाजिक जुड़ाव को सन्दर्भित करती है। आधुनिकता, बौद्धिक संस्कृति की प्रवृत्तियों को भी सन्दर्भित कर सकती है, विशेष रूप से उन आन्दोलनों को जो पन्थनिरपेक्षीकरण और उत्तर-औद्योगिक जीवन के साथ जुड़े हुए हैं, जैसे कि मार्क्सवाद, अस्तित्ववाद और सामाजिक विज्ञान की औपचारिक स्थापना. इस सन्दर्भ में, आधुनिकता को 1436-1789 के सांस्कृतिक और बौद्धिक आन्दोलनों के साथ जोड़ा गया है जिसका विस्तार 1970 के दशक तक या उसके बाद तक हुआ है (तौल्मिन 1992, 3-5)
यह बहुत ही सही कहा गया हैं कि ""आधुनिकीकरण पुरानी प्रक्रिया के लिए चालू शब्द है। यह सामाजिक परिवर्तन की वह प्रक्रिया हैं, जिससे कम विकसित समाज विकसित समाजों की सामान्य विशेषेताओं को प्राप्त करते हैं।""",193,प्रौद्योगिकी
मदन कर्की,"मदन कार्की वैरामुत्तु एक भारतीय गीतकार, पटकथा लेखक, अनुसंधान सहयोगी, सॉफ़्ट्वेर इंजीनियरऔर उद्यमी हैं। क्वींसलैंड विश्वविद्यालय के कंप्यूटर विज्ञान में डॉक्टरेट के एक धारक, कार्की ने इंजीनियरिंग विश्वविद्यालय गिंडी में एक सहायक प्राध्यापक के रूप में अपने पेशेवर की शुरुआत की, और तमिल फिल्म उद्योग के आने के बाद एक गीतकार और संवाद लेखक के रूप में काम कर रहे थे। उन्होंने 2013 के प्रारंभ में अपने शिक्षण पेशे से इस्तीफा दे दिया और फ़िल्म उद्योग में पूर्णकालिक रूप में काम करना शुरू कर दिया, उस अवधि में एक शैक्षिक अनुसंधान नींव कार्की रीसर्च फ़ाउंडेशन (का रि फ़ो) भी शुरू किया, जो मुख्य रूप से भाषा संगणन और भाषा साक्षरता पर केंद्रित है। उन्होंने मेल्लिनम एजुकेशन की स्थापना की, जो बच्चों में सीखने की उत्साह को बढ़ाने के लिए प्रारुप किए गए शैक्षिक खेल और कहानी की किताबों को विकसित करता है ,और डूपाडू एक ऑनलाइन संगीत मंच जो आज़ाद संगीत को बढ़ा देता है और फ़िल्म ध्वनिपथ के लिए वितरक का काम करता है।",165,प्रौद्योगिकी
कैप्टन अभिमन्यु,"कैप्टन अभिमन्यु (अभिमन्यु सिंह सिन्धु, जन्म 18 दिसंबर 1967) हरियाणा में पहली बार बनी भाजपा सरकार में  कैबिनेट मंत्री हैं और इनके पास वित्त, राजस्व, आबकारी एवं कराधान जैसे  विभागों की जिम्मेदारी है। कैप्टन अभिमन्यु भारतीय जनता पार्टी (भाजपा) के राष्ट्रीय प्रवक्ता  भी रह चुके हैं। संगठनात्मक गतिविधियों का संचालन करने के वृहद अनुभव और जमीन से जुड़े मुद्दों और हिन्दी भाषी क्षेत्रों की कृषि आधारित आर्थिक स्थिति के बारे में गहरी समझ को देखते हुए उन्हें 2014 के लोकसभा चुनावों में उत्तर प्रदेश और पंजाब में भाजपा का सहायक प्रभारी बनाया गया था। वह नरेन्द्र मोदी की 2014 आम चुनाव प्रचार टीम के एक महत्वपूर्ण सदस्य रहे हैं।",109,प्रौद्योगिकी
व्यापार विश्लेषण,"व्यापार विश्लेषण व्यापार की आवश्यकताओं की पहचान और व्यापार में आने वाली समस्याओं के समाधान के निर्धारण की नीति है।
इस समाधान में अक्सर एक प्रणाली विकास के घटक शामिल होते हैं, लेकिन इसमें प्रक्रिया सुधार, या संगठनात्मक परिवर्तन या रणनीतिक योजना और रणनीति विकास भी शामिल हो सकते हैं। वह व्यक्ति जो यह काम करता है, वह व्यापार विश्लेषक या बीए (BA) कहलाता है।

वे बीए (BA) जो केवल विकसित होने वाली सोफ्टवेयर प्रणाली पर काम करते हैं, वे आईटी (IT) व्यापार विश्लेषक, तकनिकी व्यापार विश्लेषक, या प्रणाली विश्लेषक कहलाते हैं।",92,प्रौद्योगिकी
नॉटिंघम,"नॉटिंघम आईपीए: /ˈnɒtɪŋəm/, यूनाइटेड किंगडम के इस्ट मिडलैंड्स क्षेत्र में स्थित एक शहर और एकात्मक प्राधिकरण इलाका है। यह नॉटिंघमशायर के सेरेमोनियल काउंटी में स्थित है और आठ सदस्यों के इंग्लिश कोर सिटीज ग्रुप का एक सदस्य है। हालांकि ऐतिहासिक दृष्टि से नॉटिंघम शहर की सीमा काफी कम है जो अपेक्षाकृत 288,700 की कम जनसंख्या है, व्यापक नॉटिंघम शहरी क्षेत्र की आबादी 667,000 है और यह यूनाइटेड किंगडम शहरी क्षेत्र का सातवां सबसे बड़ा क्षेत्र है और लिवरपूल और शेफील्ड के बीच में इसकी रैंकिंग की जाती है।
यथा 2004 यूरोस्टेट के लार्जर अर्बन ज़ोन ने इस क्षेत्र की आबादी 825,600 सूचीबद्ध की. रॉबिन हुड की कथाओं के साथ अपने संबध के चलते नॉटिंघम को ख्याति मिली और औद्योगिक क्रांति के दौरान फीता निर्माण और साइकल उद्योगों के लिए दुनिया भर में इसे पहचान मिली. इसे 1897 में रानी विक्टोरिया के डायमंड जुबली सेलेब्रेशन के हिस्से के रूप में शहरी सूची में शामिल किया गया और तब से आधिकारिक तौर पर इसे नॉटिंघम शहर का नाम दिया गया।",168,प्रौद्योगिकी
