title,content,word_count,topic
गोविन्द बल्लभ पन्त कृषि एवं प्रौद्योगिकी विश्वविद्यालय,"गोविन्द बल्लभ पन्त कृषि एवं प्रौद्योगिकी विश्वविद्यालय (पंतनगर विश्वविद्यालय या केवल ""पंतनगर"") भारत का पहला कृषि विश्वविद्यालय है। इसका उद्घाटन जवाहरलाल नेहरू द्वारा १७ नवंबर, १९६० को उत्तर प्रदेश कृषि विश्वविद्यालय के नाम से किया गया था। वर्ष १९७२ में इसका नाम महान स्वतन्त्रता सेनानी गोविन्द बल्लभ पंत के नाम पर गोविन्द बल्लभ पन्त कृषि एवं प्रौद्योगिकी विश्वविद्यालय कर दिया गया। यह विश्वविद्यालय पंतनगर नामक परिसर-कस्बे में पड़ता है जो उत्तराखण्ड के उधमसिंहनगर जिले में है। यह विश्वविद्यालय भारत में हरित क्रांति का अग्रदूत माना जाता है।",87,कृषि
"केन्द्रीय कृषि अभियांत्रिकी संस्थान, भोपाल","केन्द्रीय कृषि प्रौद्योगिकी संस्थान (Central Institute of Agricultural Engineering (CIAE)) भोपाल में स्थित एक कृषि-शिक्षा एवं अनुसंधान तथा विकास का संस्थान है। यह भारतीय कृषि अनुसंधान परिषद का एक स्वायत्त संस्थान है। केंद्रीय कृषि अभियांत्रिकी संस्थान का उद्देश्य कृषि अभियांत्रिकी से संबंधित अनुसंधान कार्य करना है। 
इसकी स्थापना १५ फरवरी १९७६ को हुई थी। यह एक सौ पचास एकड़ जमीन में यह फैला शोध केन्द्र किसानों के लिए उच्च स्तरीय कृषि प्रौद्योगिकी एवं अनुसंधान के बारे में विभिन्न शैक्षणिक कार्यक्रम एवं प्रशिक्षण की जानकारी प्रदान करता है। आरम्भ में इसका कार्यक्षेत्र कृषि मशीनें, कटाई के बाद की प्रौद्योगिकी तथा कृषि में ऊर्जा आदि क्षेत्रों में था। किन्तु बाद में इसके कार्यक्षेत्र का विस्तार करके कृषि-औद्योगिकी, इंस्ट्रुमेन्टेशन, सिंचाई, तथा ड्रेनेज इंजीनियरी आदि को भी सम्मिलित कर लिया गया।",127,कृषि
"भारती कॉलेज कृषि इंजीनियरिंग और कृषि प्रौद्योगिकी, दुर्ग छत्तीसगढ़",,0,कृषि
चन्द्र शेखर आजाद कृषि एवं प्रौद्योगिकी विश्वविद्यालय,"चन्द्रशेखर आजाद कृषि एवं प्रौद्योगिक विश्वविद्यालय कानपुर, भारत में उत्तर प्रदेश राज्य के कानपुर जिले में स्थित एक कृषि विश्वविद्यालय है। इसका नामकरण कानपुर के प्रसिद्ध क्रांतिकारी चंद्रशेखर आज़ाद के नाम पर किया गया है। इसमें पाँच संकाय हैं। कृषि तथा गृह विज्ञान के संकाय कानपुर में हैं तथा कृषि अभियंत्रिकी और तकनीक का संकाय, मत्स्य संकाय, और दुग्ध संकाय इटावा में है। यह विश्वविद्यालय उत्तर प्रदेश के २९ जिलों में कृषि समुदायों की आवश्यकताओं की देखभाल करता है।",79,कृषि
बाबा साहेब डॉ. भीमराव अम्बेडकर कृषि अभियांत्रिकी एवं प्रौद्योगिकी महाविद्यालय,"बाबा साहेब डॉ. भीमराव अम्बेडकर कृषि अभियांत्रिकी एवं प्रौद्योगिकी महाविद्यालय, इटावा मे स्थित एक राजकीय अभियांत्रिकी महाविद्यालय जिसकी स्थपना 1994 मे चन्द्र शेखर आजाद कृषि एवं प्रौद्योगिकी विश्वविद्यालय के कृषि अभियांत्रिकी एवं प्रौद्योगिकी विभाग के रूप मे की गई थी।",40,कृषि
सरदार वल्लभ भाई पटेल कृषि एवं प्रौद्योगिकी विश्वविद्यालय,"सरदार वल्लभ भाई पटेल कृषि एवं प्रौद्योगिकी विश्वविद्यालय उत्तर प्रदेश का एक विश्वविद्यालय है। इसकी स्थापना ०२ अक्टूबर सन २००० को उत्तर प्रदेश कृषि विश्वविद्यालय अधिनियम (संशो.) १९५८ के अनुसार हुई थी। इसका उद्घाटन २८ मार्च २००२ को हुआ। यह उत्तर प्रदेश सरकार तथा भारतीय कृषि अनुसंधान परिषद द्वारा वित्तपोषित एवं विश्वविद्यालय अनुदान आयोग द्वारा मान्यता प्राप्त है।
यह उत्तर प्रदेश के मेरठ जनपद में स्थित है।",67,कृषि
भारतीय कृषि अनुसंधान संस्थान,"'पूसा संस्थान' के नाम से लोकप्रिय भारतीय कृषि अनुसंधान संस्थान की स्थापना मूल रूप से पूसा (बिहार) में एक अमेरिकी समाजसेवक मि. हेनरी फिप्स द्वारा दिये गए 30,000 पाउन्ड् के सहयोग से 1905 में हुई थी। मूल रूप में यह संस्थान 'इम्पीरियल कृषि अनुसंधान संस्थान' (Imperial Agriculture Research Institute) था जो ब्रिटिश काल में स्थापित किया गया था। सन् 1934 में बिहार में एक भयंकर भूकंप आया जिसमें इस संस्थान के मुख्य भवनों को काफी क्षति हुई। इसके परिणामस्वरूप उसी वर्ष इस संस्थान को नई दिल्ली स्थानान्तरित कर दिया गया जिसे 'पूसा कैम्प्स' कहा गया। आगे चलकर दिल्ली स्थित यह संस्थान का नाम 'भारतीय कृषि अनुसंधान संस्थान' (Indian Agricultural Research Institute) कर दिया गया। और पूसा में जो कुछ बचा रहा उसे पदावनत (downgrade) करके 'कृषि अनुसंधान स्टेशन' (agricultural research station) कहा जाने लगा। अन्तत: 3 दिसम्बर सन् 1970 को भारत सरकार ने इसी को नामान्तरित करके 'राजेन्द्र कृषि विश्वविद्यालय' के रूप में बदल दिया।",155,कृषि
"सैम हिग्गिनबॉटम कृषि, प्रौद्योगिकी एवं विज्ञान संस्थान","साँचा:विश्वविद्यालय सूचनापेटी
'सैम हिगिनबॉटम कृषि, प्रौद्योगिकी एवं विज्ञान विश्वविद्यालय' (Sam Higginbottom University of Agriculture, Technology and Science) भारत में उत्तर प्रदेश राज्य के प्रयागराज नगर में एक प्रमुख विश्वविद्यालय है। यह दक्षिण एशिया के सबसे पुराने संस्थानों में से एक है। इसकी स्थापना १९१० में डॉ॰ सैम हिगिनबौटम द्वारा की गई थी। इसको पहले इलाहाबाद कृषि संस्थान कहा जाता था।",60,कृषि
महाराणा प्रताप कृषि एवं प्रौद्योगिकी विश्वविद्यालय,"महाराणा प्रताप कृषि एवं प्रौद्योगिकी विश्वविद्यालय भारत के उदयपुर नगर में स्थित है। राजस्थान सरकार द्वारा १ नवम्बर १९९९ को राजस्थान कृषि विश्वविद्याल्य, बीकानेर  को दो भागों में विभक्त कर इसकी स्थापना की गयी थी। इसके अन्तर्गत राजस्थान के 7 जिले आते हैं- बांसवाड़ा, भीलवाड़ा,चित्तौड़गढ़, डुंगरपुर,प्रतापगढ़, राजसमन्द,और उदयपुर।",48,कृषि
भारत में कृषि,"कृषि, का तात्पर्य फसलों के उत्पादन और पशुपालन से है।क्योंकि भारत की अर्थव्यवस्था कृषि पर आधारित है। भारत में कृषि आज से लगभग 10000 वर्ष पूर्व से की जा रही है। इसलिए ही भारत को कृषि प्रधान देश कहा जाता है। मगर इसके बाद भी यह कहना सही होगा कि भारत में असली कृषि की शुरुआत हरित क्रांति1960 के साथ ही हुई। जिसका नेतृत्व डॉक्टर एम. एस. स्वामीनाथ जी के द्वारा किया गया था।और हरित क्रांति को भारत में लाने में  पंडित जवाहरलाल नेहरू और डॉक्टर A.B जोशी का बहुत बड़ा योगदान रहा। उसके बाद भारत में कृषि का एक मजबूत ढांचा तैयार हो गया और आज भारत के पास हर वह तकनीक है जिसकी उसे जरूरत है।।                                Dr.MS.Swaminathan -ज़मीं जल जलवायु मौसम कृषक कृषि  आधार है गुरु आपने ही बनाया यह हरित क्रांति संसार है ।।   (Prashant Singh)",139,कृषि
कृषि प्रोद्योगिकी प्रबंध अभिकरण,"कृषि प्रोद्योगिकी प्रबंध अभिकरण (Agricultural Technology Management Agency / ATMA / आत्मा) एक स्वायत्त पंजीकृत संस्था है जो भारत के विभिन्न जिलों में कृषि एवं सम्बद्ध तकनीकी प्रसार के लिए उत्तरदायी है। यह संस्था सीधे धन राशि प्राप्त करने (राज्य/भारत सरकार, निजी संस्थान, सदस्यता, लाभार्थी से सहयोग आदि), अनुबंध करार एवं लेखा अनुरक्षण करने में पूर्व समर्थ होने के साथ ही स्वावलंबन हेतु शुल्क तथा परिचालन व्यय करने में भी समर्थ है।
कृषि प्रौद्योगिकी प्रबंध अभिकरण (आत्मा) उन प्रमुख भागीदारी की संस्था है जो जिला स्तर पर कृषि के विकास को स्थायित्व प्रदान करने संबंधी कृषि की गतिविधियों में संलग्न हैं। यह कृषि प्रसार एवं अनुसंधान की गतिविधियों के एकीकरण के साथ ही सार्वजनिक कृषि प्रौद्योगिकी व्यवस्था प्रबंधन के विकेन्द्रीकरण की दिशा में किया जाने वाला एक सार्थक प्रयास है।",130,कृषि
जीविका कृषि,"जीविका कृषि, कृषि करने का एक प्रमुख प्रकार है। कृषकों द्वारा अपने परिवार की आवश्यकताओं को पूरा करने के लिए इस प्रकार की कृषि को किया जाता है। पारम्परिक रूप से कम उपज प्राप्त करने के लिए निम्न स्तरीय प्रौद्योगिकी और पारिवारिक श्रम उपयुक्त होता है। जीविका कृषि को पुनः आदिम कृषि और गहन कृषि में वर्गीकृत किया जा सकता है।",61,कृषि
"कृषि महाविद्यालय, लखीमपुर-खीरी","कृषि महाविद्यालय, लखीमपुर खीरी एक के कृषि कॉलेज में लखीमपुर खीरी, उत्तर प्रदेश, भारत. यह का हिस्सा है, चन्द्र शेखर आजाद कृषि एवं प्रौद्योगिकी विश्वविद्यालयहै ।  1 बैच शुरू 2015 पर चन्द्र शेखर आजाद कृषि एवं प्रौद्योगिकी विश्वविद्यालय's कानपुर परिसर में जो बाद में स्थानांतरित कर दिया पर कॉलेज के परिसर.",51,कृषि
"कृषि महाविद्यालय, आजमगढ़","कृषि महाविद्यालय, आज़मगढ़ आज़मगढ़, उत्तर प्रदेश, भारत में स्थित एक राजकीय कृषि महाविद्यालय है। यह नरेन्द्र देव कृषि एवं प्रौद्योगिकी विश्वविद्यालय का एक भाग है ।  संस्थान में कॉलेज परिसर में शुरू के वर्ष 2018.",35,कृषि
उत्तराखण्ड में शिक्षा,"उत्तराखण्ड के शैक्षणिक संस्थान भारत और विश्वभर के लिए महत्वपूर्ण हैं। ये एशिया के सबसे कुछ सबसे पुराने अभियांत्रिकी संस्थानों का घर है, जैसे रुड़की का भारतीय प्रौद्योगिकी संस्थान (पहले रुड़की विश्वविद्यालय) और पंतनगर का गोविन्द बल्लभ पंत कृषि एवँ प्रौद्योगिकी विश्वविद्यालय। विशेष महत्त्व के अन्य संस्थान हैं, देहरादून स्थित भारतीय सैन्य अकादमी, इक्फ़ाई विश्वविद्यालय, भारतीय वानिकी संस्थान; पौड़ी स्थित गोविन्द बल्लभ पंत अभियांत्रिकी महाविद्यालय और द्वाराहाट स्थित कुमाऊँ अभियांत्रिकी महाविद्यालय।",71,कृषि
पंजाब कृषि विश्वविद्यालय,"पंजाब कृषि विश्वविद्यालय (Punjab Agricultural University (PAU)) लुधियाना में स्थित पंजाब सरकार का कृषि विश्वविद्यालय है। इसकी स्थापना १९६२ में की गयी थी। यह गोविन्द बल्लभ पन्त कृषि एवं प्रौद्योगिकी विश्वविद्यालय, पन्तनगर के बाद भारत में दूसरा सबसे पुराना कृषि विश्वविद्यालय है। १९६० के दशक में भारत की हरित क्रांति में इस विश्वविद्यालय की अहम भूमिका थी। 
सन २००५ में इसका विभाजन करके गुरु अंगद देव पशुचिकित्सा एवं पशुविज्ञान महाविद्यालय (Guru Angad Dev Veterinary and Animal Sciences University) निर्मित किया गया।",81,कृषि
कृषि यंत्र,"कृषि के भिन्न भिन्न कार्यों में अनेकों यंत्रों का उपयोग होता है। इन्हें कृषियंत्र (agricultural machinary) कहते हैं। कृषियंत्रों का प्रयोग खेतों की जुताई, बोवनी, खाद और कीटनाशक डालने, सिंचाई करने, फसलों की सुरक्षा के लिए, फसल कटाई, मढ़ाई, ढुलाई आदि के लिए की जाती है। ट्रैक्टर एक प्रमुख कृषियंत्र है।",51,कृषि
जैवप्रौद्योगिकी,"जैवप्रौद्योगिकी या जैवतकनीकी, प्रौद्योगिकी का वो विषय है जो अभियान्त्रिकी और तकनीकी के डाटा और विधियों को जीवों और जीवन तन्त्रों से सम्बन्धित अध्ययन और समस्या के समाधान के लिये उपयोग करता है।  इसे रासायनिक अभियान्त्रिकी, रसायन शास्त्र या जीव विज्ञान में संबंधित माना जाता है। 
जैवप्रौद्योगिकी, उत्पादों और सेवाओं के लिए जीवों, कोशिकाओं, उनके भागों और आणविक समधर्मों के अनुप्रयोग को प्राप्त करने के लिए प्राकृतिक विज्ञान और अभियान्त्रिकी विज्ञान  का एकीकरण है ।
जैवप्रौद्योगिकी या आनुवंशिक अभियान्त्रिकी के माध्यम से चिकित्सीय प्रोटीन और अन्य दवाओं का उत्पादन है।",90,कृषि
पर्यावरणीय जैव-प्रौद्योगिकी,"जब जैव प्रौद्योगिकी का उपयोग प्राकृतिक पर्यावरण के अध्ययन के लिए या में किया जाता है, तो उसे पर्यावरणीय जैव-प्रौद्योगिकी कहते हैं। व्यावसायिक उपयोग और इस्तेमाल हेतु जैव प्रौद्योगिकी के प्रयोग को भी पर्यावरणीय जैव-प्रौद्योगिकी समझा जा सकता है। पर्यावरणीय जैव-प्रौद्योगिकी हेतु अंतरराष्ट्रीय सोसायटी ने पर्यावरणीय जैव-प्रौद्योगिकी की व्याख्या इस प्रकार की है, ""दूषित वातावरण (जमीन, हवा, पानी) को ठीक करने और पर्यावरण-अनुकूल प्रक्रियाओं (हरित विनिर्माण प्रौद्योगिकी और स्थायी विकास) के लिए जैविक तंत्रों का विकास, उपयोग तथा विनियमन"".
पर्यावरणीय जैव-प्रौद्योगिकी को सामान्य रूप से इस प्रकार वर्णित किया जा सकता है, ""वनस्पति, बैक्टीरिया, जीव-जंतु, कवक तथा शैवाल, द्वारा नवीकरणीय ऊर्जा, खाद्य पदार्थ एवं पोषक तत्वों के एकीकृत चक्र रूपी तारतम्य में लाभान्वित करने वाली प्रक्रियाओं के तहत निर्माण हेतु प्रकृति का इष्टतम उपयोग, जहां प्रत्येक प्रक्रिया का अपशिष्ट पदार्थ किसी अन्य प्रक्रिया का भोजन बन जाए.",137,कृषि
