title,content,word_count,topic
महिला सशक्तीकरण,"महिला सशक्तीकरण  से जुड़े सामाजिक, आर्थिक, राजनैतिक और कानूनी मुद्दों पर संवेदनशीलता और सरोकार व्यक्त किया जाता है। सशक्तीकरण की प्रक्रिया में समाज को पारंपरिक पितृसत्तात्मक दृष्टिकोण के प्रति जागरूक किया जाता है, जिसने महिलाओं की स्थिति को सदैव कमतर माना है। वैश्विक स्तर पर नारीवादी आंदोलनों और यूएनडीपी आदि अंतर्राष्ट्रीय संस्थाओं ने महिलाओं के सामाजिक समता, स्वतंत्रता और न्याय के राजनीतिक अधिकारों को प्राप्त करने में महत्वपूर्ण भूमिका निभायी है। महिला सशक्तीकरण, भौतिक या आध्यात्मिक, शारिरिक या मानसिक, सभी स्तर पर महिलाओं में आत्मविश्वास पैदा कर उन्हें सशक्त बनाने की प्रक्रिया है।",93,महिला
जनक पलटा मगिलिगन,"डॉ श्रीमती जनक पलटा मगिलिगन एक भारतीय सामाजिक कार्यकर्ता हैं। वह इंदौर जिले के सनावदिया गाँव में स्थित 'जिम्मी मगिलिगन सेंटर फॉर सस्टेनेबल डेवलपमेंट' की संस्थापिका व निदेशिका है, जो कि गैर सरकारी संगठन है।  
 वह ग्रामीण महिलाओं के बारली विकास संस्थान के पूर्व निदेशक भी है।, स्त्री-पुरुष की समानता जैसी बहाई शिक्षाओं का प्रसार और महिला सशक्तिकरण करना उनका जीवन लक्ष्य है। 
जनक पलटा मगिलिगन  का जन्म पंजाबी परिवार में हुआ था। उन्होंने मास्टर डिग्री (एमए) अंग्रेजी साहित्य में और राजनीति विज्ञान में किया। राजनीतिक विज्ञान  में एमफिल की और ""जनजातीय और ग्रामीण महिलाओं के प्रशिक्षण के माध्यम से  अक्षय विकास में डॉक्टरेट की डिग्री (पीएचडी) प्राप्त की। उन्होनेने 26 वर्षों तक बरली ग्रामीण महिला विकास संस्थान के निदेशक के रूप में सेवा दी और इसी बरली संस्थान के निदेशक मंडल के संस्थापक निदेशक हैं और संस्थान के बोर्ड  पिछले 32 वर्षों  में सदस्य के रूप में सेवारत है। वे बहाई हैं और बहाई धर्म की शिक्षाओं जैसे ईश्वर एक है, सभी धर्मों का स्रोत एक है , विश्व शांति और विश्व एकता के लिए कार्य कर रही हैं।",180,महिला
योहाना येम्बिस,"योहाना सुसाना येम्बिस (जन्म 1 अक्टूबर 1958) एक इंडोनेशियाई शिक्षाविद और राजनीतिज्ञ हैं, जो वर्तमान में इंडोनेशिया की महिला सशक्तिकरण और बाल संरक्षण मंत्री जोको विडोडो के कार्यकारी मंत्रिमंडल के रूप में कार्य करती हैं ।",36,महिला
महिला,"महिला (स्त्री, औरत या नारी) मानव के मादा स्वरूप को कहते हैं, जो स्त्रीलिंग है। महिला शब्द मुख्यत: वयस्क स्त्रियों के लिए इस्तेमाल किया जाता है। किन्तु कई संदर्भो में यह शब्द संपूर्ण स्त्री वर्ग को दर्शाने के लिए भी प्रयोग मे लाया जाता है, जैसे: नारी-अधिकार। आम आनुवांशिक विकास वाली महिला आमतौर पर रजोनिवृत्ति तक यौवन से जन्म देने में सक्षम होती हैं। भारत की महिलायों के लिए सफ़ल होनें के आसान तरीके। कुछ महिलाएं दो गर्भाशय के साथ पैदा होती हैं, जिसे गर्भाशय डिडेलफिस कहा जाता है। कभी-कभी इस स्थिति वाली महिलाओं में दो योनि भी होती हैं।",100,महिला
राखी गोप,"राखी गोप एक समाजिक कार्यकर्ता हैं, जोकि लैंगिक बराबरी के लिए काम करती है। ये फलाकाटा, अलीपुरद्वार जिले से हैं, जो पश्चिम बंगाल मे है । वे पिछले 13 वर्षों से अपने समुदाय के भीतर बाल विवाह और मानव तस्करी के खिलाफ काम कर रही हैं । 2017 में उनको ‘सर्वश्रेष्ठ व्यक्ति’ की श्रेणी में महिला सशक्तिकरण में उत्कृष्टता के लिए, मार्था फैरल पुरस्कार मिला।  ये अवार्ड 2016 में प्रिया, रिज़वान अदातिया फाउंडेशन और मर्था फैरेल फाउंडेशन के द्वारा स्थापित किया गया था । ये अवार्ड साल में एक बार ऐसे व्यक्तियों और संस्थाओं को दिया जाता है, जिनका महिला सशक्तीकरण और लैंगिक बराबरी में महत्वपूर्ण योगदान है ।",109,महिला
आर्ट ऑफ लिविंग फाउण्डेशन,"आर्ट ऑफ लिविंग फाउण्डेशन
(Art of Living Foundation), एक स्वयंसेवी-आधारित, मानवीय और शैक्षिक गैर-सरकारी संगठन (एनजीओ) है। इसकी स्थापना 1981 में श्री श्री रवि शंकर ने की थी। आर्ट ऑफ लिविंग फाउंडेशन के 156 से अधिक देशों में केंद्र हैं। आर्ट ऑफ लिविंग सांस लेने की तकनीक, ध्यान और योग पर आधारित कई तनाव-उन्मूलन और आत्म-विकास कार्यक्रम प्रदान करता है।",60,महिला
महिला आरक्षण विधेयक,"नारी शक्ति वंदन अधिनियम अथवा महिला आरक्षण विधेयक भारतीय संसद में प्रस्तुत किया गया वह विधेयक है जिसके पारित होने से संसद में महिलाओं की भागीदारी 33% सुनिश्चित हो जाएगी। 1996 में महिला आरक्षण विधेयक की जांच करने वाली संयुक्त संसदीय समिति की रिपोर्ट में सिफारिश की गई थी कि ओबीसी के लिए आरक्षण की अनुमति देने के लिए संविधान में संशोधन होने के बाद अन्य पिछड़ा वर्ग (ओबीसी) की महिलाओं के लिए आरक्षण प्रदान किया जाना चाहिए।
19 सितंबर 2023 को, नरेंद्र मोदी सरकार ने नए संसद भवन में लोकसभा में संसद के विशेष सत्र के दौरान इस विधेयक को 128वें संवैधानिक संशोधन विधेयक, 2023 के रूप में पेश किया।  नारी शक्ति वंदन अधिनियम लोकसभा से पारित होने के बाद दोबारा राज्यसभा में जाएगा।",125,महिला
कुटुंबश्री,कुदुम्बश्री (अंग्रेजी़:Kudumbashree) (मलयालम:കുടുംബശ്രീ) केरल सरकार के राज्य गरीबी उन्मूलन मिशन (एसपीईएम) द्वारा कार्यान्वित गरीबी उन्मूलन और महिला सशक्तिकरण कार्यक्रम है।,20,महिला
राजीव गाँधी किशोरी सशक्तिकरण योजना,राजीव गाँधी किशोरी सशक्तिकरण योजना जिसे सबला भी कहा जाता है भारत सरकार द्बारा 2011 में 11 से 18 वर्ष की किशोरियों के सशक्तीकरण के लिए प्रारंभ की गई योजना है।,31,महिला
नवीन जिन्दल,"नवीन जिन्दल (जन्म 9 मार्च 1970) एक भारतीय उद्योगपति और 14 वीं और 15 वीं लोकसभा में कुरुक्षेत्र, हरियाणा से लोकसभा के पूर्व सदस्य रहे हैं। वह वर्तमान में जिन्दल स्टील एण्ड पॉवर लिमिटेड के अध्यक्ष और ओ पी जिंदल ग्लोबल यूनिवर्सिटी के चांसलर के रूप में कार्य कर रहे हैं।
वह जनसंख्या नियंत्रण, महिला सशक्तिकरण, पर्यावरण संरक्षण, स्वास्थ्य और शिक्षा के लिए एक सक्रिय प्रचारक रहे है। नवीन सक्रीय राजनीति में रहते हुए भारतीय राष्टीय कांग्रेस की टिकट पर 2 बार कुरुक्षेत्र लोकसभा के सदस्य रहे है। साथ ही उन्हे राष्टीय ध्वज फहराने का अधिकार सभी देशवासियों को दिलाने के लिए याद किया जाता है।",106,महिला
नादिया शफी,"नादिया शफी जम्मू-कश्मीर की एक विडियो रिपोर्टर हैं, जोकि अपने कैमरे की मदद से कश्मीर की औरतों की कहानियों को उजागर करती हैं | श्रीनगर की रहने वाली 29 वर्षीय नादिया एक ऐसे समाज में लैंगिक समानता लाने का प्रयास कर रही हैं, जो न सिर्फ पितृसत्ता से, बल्कि सशस्त्र संघर्ष से भी ग्रसित है |
2018 में उनको ‘सर्वश्रेष्ठ व्यक्ति’ की श्रेणी में महिला सशक्तिकरण में उत्कृष्टता के लिए, मार्था फैरल पुरस्कार मिला । ये अवार्ड 2016 में प्रिया, रिज़वान अदातिया फाउंडेशन और मर्था फैरेल फाउंडेशन के द्वारा स्थापित किया गया था । ये अवार्ड साल में एक बार ऐसे व्यक्तियों और संस्थाओं को दिया जाता है, जिनका महिला सशक्तीकरण और लैंगिक बराबरी में महत्वपूर्ण योगदान है ।",119,महिला
आयशिया,"आयशिया या इशिया (अंग्रेज़ी: Aisyiyah) इंडोनेशिया में एक इस्लामी गैर-सरकारी संगठन है जो महिला सशक्तिकरण और धर्मार्थ कार्यों के लिए समर्पित है। इसका गठन 19 मई 1917 को न्याई अहमद दहलान द्वारा शिक्षा, स्वास्थ्य देखभाल और सामाजिक सेवाओं तक महिलाओं की पहुंच को सुविधाजनक बनाने के लिए किया गया था।",50,महिला
मारिया गैब्रिएला इस्लर,"मारिया गैब्रिएला इस्लर (जन्म 21 मार्च 1988) वेनेजुएला की एक टीवी होस्ट, फैशन मॉडल और ब्यूटी क्वीन हैं, जिन्हें अपने देश की सातवीं मिस यूनिवर्स के रूप में प्लेसमेंट प्राप्त करने के लिए मिस यूनिवर्स 2013 का ताज पहनाया गया था।
इस्लर यूनिवर्स ऑफ ब्लेसिंग्स फंड की संस्थापक हैं, जो महिला सशक्तिकरण और परामर्श के लिए समर्पित एक चैरिटी संगठन है। इसके अलावा, इस्लर वर्तमान में मिस वेनेजुएला की राष्ट्रीय निदेशक हैं, जो ओस्मेल सूसा की जगह ले रही हैं।",80,महिला
"सामाजिक न्याय एवं अधिकारिता मंत्रालय, भारत सरकार","सामाजिक न्याय एवं सशक्तिकरण मंत्रालय, भारत सरकार भारत सरकार का एक मंत्रालय है।",13,महिला
प्रधान मंत्री उज्ज्वला योजना,"प्रधानमंत्री उज्ज्वल योजना भारत के गरीब परिवारों की महिलाओं के चेहरों पर खुशी लाने के उद्देश्य से केंद्र सरकार द्वारा 1 मई 2016 को शुरू की गई एक योजना है। इस योजना के अंतर्गत गरीब महिलाओं को मुफ्त एलपीजी गैस कनेक्शन मिलेंगे।
केंद्र सरकार द्वारा शुरू की गई इस योजना से गरीब महिलाओं को जल्दी ही मिट्टी के चूल्हे  से आजादी मिल जाएगी। इस योजना का मुख्य उद्देश्य ग्रामीण क्षेत्रों में खाना पकाने के लिए उपयोग में आने वाले जीवाश्म ईंधन की जगह एलपीजी के उपयोग को बढ़ावा देना है। योजना का एक मुख्य उद्देश्य महिला सशक्तिकरण को बढ़ावा देना और उनकी सेहत की सुरक्षा करना भी है। 
गरीब परिवार की महिला सदस्यों को मुफ्त रसोई गैस (एलपीजी) कनेक्शन मुहैया कराने के लिए मंत्रिमंडल ने 8,000 करोड़ रुपये की योजना को मंजूरी दी है।
नारा-स्वच्छ ईंधन बेहतर जीवन
सरकार ने ईंधन के दाम बढ़ने पर मई, 2022 में उज्ज्वला योजना के लाभार्थियों को 200 रुपये प्रति सिलेंडर सब्सिडी प्रदान की। अक्टूबर, 2023 में इसे बढ़ाकर 300 रुपये कर दिया।
केंद्र सरकार द्वारा घोषित एलपीजी की कीमतों को कम करने का निर्णय, व्यक्तियों पर वित्तीय तनाव को कम करने और उनके कल्याण को बढ़ाने के हमारे निरंतर प्रयास में एक महत्वपूर्ण कदम है। यह कटौती आवश्यक वस्तुओं को किफायती दरों पर अधिक सुलभ बनाकर हमारे नागरिकों के कल्याण को प्राथमिकता देने के प्रति हमारे अटूट समर्पण को रेखांकित करती है।",229,महिला
अनु आगा,"अनु आगा (Anu Aga) भारत की वरिष्ठ सदन राज्यसभा के सदस्य हैं और सामाजिक कार्यकता है। वह आठ सबसे अमीर भारतीय महिलाओं में से एक थीं, और २००७ में फोर्ब्स पत्रिका के मुताबिक नेट रिटेल में ४० सबसे ज्यादा आमिर भारतीयों में से एक थी। उन्हें एसोचैम की सभी महिला विंग, आल लेडीज लीग द्वारा दी डैकेड अचीवर्स अवॉर्ड के मुंबई महिला से सम्मानित किया गया। 2010 में उन्हें भारत सरकार द्वारा सामाजिक कार्य के लिए पद्म श्री से सम्मानित किया गया। वह हाल ही में ""टीच फॉर इंडिया"" के अध्यक्ष चुनी गयी हैं।",94,महिला
भामाशाह योजना,"भामाशाह योजना राजस्थान सरकार द्वारा शुरू की गई एक योजना है जिसका उद्देश्य सरकारी योजनाओं के वित्तीय और गैर-वित्तीय लाभों को सीधे महिला प्राप्तकर्ताओं को पारदर्शी तरीके से हस्तांतरित करना है।इस योजना का उद्घाटन मुख्यमंत्री वसुंधरा राजे ने 15 अगस्त 2014 को किया था।[4] भामाशाह योजना का उद्देश्य महिलाओं को सशक्त बनाना है। एक अच्छे समाज के लिए महिलाओं का सशक्तिकरण बहुत जरूरी है। इस भामाशा योजना का लाभ उठाने के लिए आवेदक ऑनलाइन आवेदन कर सकते हैं। साथ ही उन्हें योजना का लाभ सीधे बैंक खातों में मिलेगा।
इस योजना का नाम भामाशाह एक प्रसिद्ध मंत्री, फाइनेंसर और जनरल के नाम पर रखा गया है जिन्होंने महाराणा प्रताप की मदद की थी।",113,महिला
सेवा मंदिर,"सेवा मन्दिर उदयपुर में 1969 में डॉ॰ मोहन सिंह मेहता द्वारा स्थापित एक स्वैच्छिक संस्था (ट्रस्ट) है, जो ग्रामीण विकास, महिला सशक्तिकरण, स्वास्थ्य, बाल-विकास, प्रौढ़-साक्षरता, पेयजल, रोज़गार-विकास, पर्यावरण-संरक्षण, ग्राम्य-स्वच्छता आदि कई क्षेत्रों में उदयपुर और राजसमन्द जिलों में स्वयंसेवकों के माध्यम से समाज-कार्य गतिविधियों का संचालन कर रहा है|",49,महिला
शिखा ओबेरॉय,शिखा देवी ओबेरॉय (जन्म: 5 अप्रैल 1983) पूर्व भारतीय-अमेरिकी पेशेवर टेनिस खिलाड़ी और भारतियों श्रेणी में पूर्व में नंबर 1 रही हैं। निरुपमा संजीव के बाद वह डब्ल्यूटीए की रैंकिंग में शीर्ष 200 में पहुँचने वाली इतिहास में दूसरी भारतीय महिला खिलाड़ी हैं।,43,महिला
