title,content,word_count,topic
एडवर्ड नॉर्टन,"एडवर्ड हैरिसन नॉर्टन (जन्म 18 अगस्त 1969) एक अमेरिकी फिल्म अभिनेता, पटकथा लेखक और निर्देशक हैं। 1996 में, अदालती नाटक प्राइमल फियर में उनकी सहायक भूमिका ने उनके लिए सर्वश्रेष्ठ सहायक अभिनेता के अकादमी पुरस्कार का नामांकन एकत्रित किया। दो साल बाद, अमेरिकन हिस्ट्री X में व्हाइट पावर स्किनहेड के रूप में अपनी मुख्य भूमिका के लिए उन्हें सर्वश्रेष्ठ अभिनेता के लिए अकादमी अवार्ड में नामांकन प्राप्त हुआ। उनकी अन्य फिल्मों में किंगडम ऑफ़ हेवेन (2005), दी इल्युशनिस्ट (2006) और दी पेंटेड वेल (2006), जैसे पीरिअड फ़िल्में शामिल हैं; उनकी अन्य उल्लेखनीय फ़िल्में हैं राउंडर्स (1998),फाइट क्लब (1999), 25th आवर (2002), रेड ड्रैगन (2002) और दी इनक्रेडिबल हल्क (2008).
एक अभिनेता होने के साथ-साथ, नॉर्टन एक लेखक और निर्देशक भी हैं। निर्देशक के रूप में कीपिंग दी फेथ (2000) उनकी पहली फिल्म थी और यह भी माना जाता है की उन्होंने मदरलेस ब्रूकलिन नामक उपन्यास पर आधारित फिल्म को भी निर्देशित किया। नॉर्टन ने दी स्कोर, फ्रीडा, और दी इनक्रेडिबल हल्क की पटकथाओं पर भी बिना श्रेय का काम किया है।
अपने निजी जीवन में, नॉर्टन एक पर्यावरण और सामाजिक कार्यकर्ता हैं। वे, एंटरप्राइज़ कम्युनिटी पार्टनर्स नामक एक गैर-लाभ संस्था के बोर्ड ऑफ़ ट्रस्टीज़ के सदस्य हैं जो किफायती घरों का निर्माण करती है, यह संस्था उनके दादा, जेम्स रोउस द्वारा स्थापित की गयी थी। नॉर्टन मसाए वाइल्डअर्नेस कनज़रवेशन ट्रस्ट के अमेरिकी शाखा के अध्यक्ष हैं। उन्होंने ट्रस्ट के लिए धन जुटाने के उद्देश्य से 2009 के न्यूयोर्क सिटी मैराथन में दौड़ लगाई. वे क्राउडराइज़ के माध्यम से भी धर्मार्थ धन जुटाते हैं; यह स्वयंसेवकों के लिए एक सामाजिक संपर्क समुदाय है और सूक्ष्म-दान का धन उगाहने का मंच है।",270,पर्यावरण
नागरहोल अभयारण्य,"कर्नाटक में स्थित नागरहोल अपने वन्य जीव अभयारण्य के लिए विश्व भर में प्रसिद्ध है। यह उन कुछ जगहों में से एक है जहां एशियाई हाथी पाए जाते हैं। हाथियों के बड़े-बड़े झुंड यहां देखे जा सकते हैं। मानसून से पहले की बारिश में यहां बड़ी संख्या में रंगबिरंगे पक्षी दिखाई देते हैं। उस समय पूरा वातावरण उनकी चहचहाट से गूंज उठता है। पशुप्रेमियों के लिए यहां देखने और जानने के लिए बहुत कुछ है।
एक जमाने में यह जगह मैसूर के राजाओं के शिकार का स्‍थल था। लेकिन बाद में इसे अभयारण्य बना दिया गया। अब यह राजीव गांधी अभयारण्य के नाम से जाना जाता है। यह पार्क दक्कन के पठार का हिस्सा है। जंगल के बीच में नागरहोल नदी बहती है, जो कबीनी नदी में मिल जाती है। कबीनी नदी पर बने बांध के कारण पार्क के दक्षिण में एक झील बन गई है जो इस उद्यान को बांदीपुर टाइगर रिजर्व से अलग करती है।",157,पर्यावरण
हिन्दी पत्रिकाओं की सूची,"हिन्दी पत्रिकाएँ हिन्दी भाषा में छपने वाली पत्रिकाएँ हैं। यहाँ हिन्दी भाषा की प्रमुख पत्रिकाओं को सूचीबद्ध किया गया है।
पतहर, हिंदी तिमाही पत्रिका का प्रकाशन जनवरी 2016 से हो रहा। यह साहित्यिक पत्रिका है। इसके कई विशेषांक प्रकाशित हो चुके हैं। पतहर ( Patahar) का आर एन आई नंबर UPHIN /2016/67435 है। साथ ही पत्रिका को आईएसएसएन नंबर 2456-0413 है। 
संपादक : विभूति नारायण ओझा
संपर्क: बहादुरपुर, खुखुन्दू, जिला : देवरिया, उत्तर प्रदेश, 274501,
मोबाइल फोन.  9450740268
E-mail: 
hindipatahar@gmail.com
को भी सूची में शामिल किया जा सकता है।",89,पर्यावरण
मैरीलैंड,"मैरीलैंड राज्य (i/ˈmɛrələnd/) एक अमेरिकी राज्य है, जो संयुक्त राज्य अमेरिका के मध्य अटलांटिक क्षेत्र में स्थि‍त है, यह वर्जीनिया, पश्चिम वर्जीनिया की सीमा से लगा है और इसके दक्षिण और पश्चिम में कोलंबिया जिला, इसके उत्तर में पेंसिल्वेनिया और पूर्व में डेलावेयर है। कुल क्षेत्र के मामले में मैरीलैंड यूरोप के बेल्जियम देश के समकक्ष है। अमेरिकी सेंसस ब्यूरो के अनुसार अन्य राज्यों की तुलना में मैरीलैंड की घरेलू औसत आय सबसे अधिक है, 2006 में इसने नई जर्सी को पीछे छोड़ दिया; मैरीलैंड की औसत घरेलू आय 2007 में 68,080 डॉलर थी। 2009 में, मैरीलैंड ने 2008 के अपने 70,545 डॉलर की सबसे अधिक औसत आय के कारण अमेरिकी राज्यों में तीसरी बार लगातार प्रथम स्थान प्राप्त किया। मैरीलैंड ऐसा सातवां राज्य है जिसने संयुक्त राज्य अमेरिका के संविधान को अंगीकार किया और इसके तीन उपनाम पड़े, ओल्ड लाइन स्टेट, फ्री स्टेट और चेसापिक बे स्टेट नाम का भी कभी-कभी इस्तेमाल होता है।
मैरीलैंड जीवन विज्ञान अनुसंधान और विकास का एक गठजोड़ है, जहां 350 से अधिक जैव प्रौद्योगिकी कंपनियां स्थित हैं, जो संयुक्त राज्य में इस क्षेत्र में मैरीलैंड को तीसरा सबसे बड़ा गठजोड़ बनाती हैं।
जॉन्स हॉपकिंस यूनिवर्सिटी, जॉन्स हॉपकिन्स एप्लाइड फिजिक्स लेबोरेटरी, यूनिवर्सिटी सिस्टम ऑफ मैरीलैंड एक से अधिक परिसर, नेशनल इंस्टीट्यूट ऑफ हेल्थ (NIH), नेशनल इंस्टीट्यूट ऑफ स्टैंडर्ड्स एंड टेक्नोलॉजी(NIST), नेशनल इंस्टीट्यूट ऑफ मेंटल हेल्थ (NIMH), फेडरल फूड एंड ड्रग एडमिनिस्ट्रेशन (FDA), हावर्ड हजेज मेडिकल इंस्टीट्यूट, केलेरा जीनोमिक्स कंपनी, ह्यूमन जीनोम साइंसेस (HGS), जे. क्रेग वेंटर इंस्टीट्यूट और हाल ही में अस्ट्रज़ेनेका द्वारा खरीदी गयी मेडीम्यून सहित अनुसंधान और विकास में दिलचस्पी रखने वाले संस्थान और एजेंसियां मैरीलैंड में स्थित हैं।",267,पर्यावरण
कैलगरी,"कैलगरी (उच्चारित/ˈkælɡri, ˈkælɡəri/) कनाडा के अलबर्टा प्रांत का सबसे बड़ा शहर है। यह प्रांत के दक्षिण में, कनाडा की चट्टानों (Canadian Rockies) की अग्रिम पर्वतमालाओं के लगभग 80 कि॰मी॰ (260,000 फीट) पूर्व में एक तलहटी एवं मैदानी क्षेत्र में स्थित है। यह शहर अलबर्टा के घासभूमि वाले क्षेत्र में स्थित है।
2006 में, कैलगरी शहर की आबादी 988,193 होने के कारण इस शहर की नगरपालिका देश की तीसरी सबसे बड़ी एवं अलबर्टा की सबसे बढ़ी नगरपालिका बन गई थी। 2006 में सम्पूर्ण महानगरीय जनसँख्या 1,079,310 के साथ यह कनाडा का पांचवां सबसे बड़ा महानगरीय जनगणना क्षेत्र (सी.ऍम.ए.) बन गया था। 2009 में, कैलगरी की अनुमानित महानगरीय जनसंख्या 1,230,248 के होते हुए यह क्रम में बढ़कर चौथा सबसे बड़ा महानगरीय जनगणना क्षेत्र (सी.ऍम.ए.) बन गया था।
एडमॉन्टन के 294 कि॰मी॰ (965,000 फीट) दक्षिण में स्थित होने से सांख्यिकीविदों ने इन दो शहरों के बीच के संकीर्ण जनसँख्या वाले क्षेत्र को ""कैलगरी-एडमॉन्टन गलियारा"" के रूप में परिभाषित किया है। टोरंटो और वैंकूवर के बीच कैलगरी कनाडा का सबसे बड़ा महानगरीय क्षेत्र है।
महानगरीय क्षेत्र एवं शहर के नजदीक प्रमुख पहाड़ी आश्रयों के साथ कैलगरी शीतकालीन खेलों एवं पर्यावरणीय पर्यटन के लिए एक गंतव्य स्थल है। यहाँ की आर्थिक गतिविधियाँ ज्यादातर पेट्रोलियम उद्योग पर केंद्रित हैं। शहर के आर्थिक विकास में कृषि, पर्यटन और उच्च तकनीक उद्योगों का भी योगदान है। 1988 में कैलगरी, शीतकालीन ओलिंपिक खेलों की मेजबानी करने वाला कनाडा का पहला शहर बन गया था।",235,पर्यावरण
भारत में इस्लाम,"भारतीय गणतंत्र में हिन्दू धर्म के बाद इस्लाम मजहब दूसरा सर्वाधिक प्रचलित बडा मजहब है। भारत में मूलधर्म हिंदू, बौद्ध, जैन, सिख धर्म है।  इस्लामिक मजहब जो देश की जनसंख्या का १४.२% है (2011 की जनगणना के अनुसार १७.२ करोड़)।
भारत पर इस्लाम पहली बार  7वी शताब्दी में आया  था और तब से इस्लामी  सभ्य व्यक्तियों ने भारत आते हुए भारत की मूल संस्कृति में अपना बहुत योगदान दिया । घोघा, गुजरात में बरवाड़ा मस्जिद, (623 ईसवी सन्‌ से पहले निर्मित), मेथला, केरल में चेरामन जुमा मस्जिद (629 ईसवी सन्‌) और तमिलनाडु के पल समुद्र के द्वारा बनाया गया था। मोहम्मद ग़ोरी भारत पर आक्रमण करते हुए बार। कट्टर इस्लामिक सत्ताधीशों द्वारा भारत में इस्लाम का प्रचार प्रसार बहुत ज्यादा किया गया। फिर भी भारतीयों ने अ
भारत में विवाह, विरासत और वक्फ संपत्ति से जुड़े मुसलमानों के अधिकार मामले मुस्लिम व्यक्तिगत कानून द्वारा नियंत्रित होते हैं",147,पर्यावरण
भारतीय प्रौद्योगिकी संस्थान मण्डी,"भारतीय प्रौद्योगिकी संस्थान (भा.प्रौ.सं.) मण्डी भारत सरकार मानव संसाधन विकास मंत्रालय द्वारा स्थापित संस्थान है। संस्थान हिमाचल प्रदेश के मण्डी जिले में स्थित है। संस्थान का पहला सत्र सन २००९ में शरू हुआ था। 
इसका स्थायी परिसर मण्डी से लगभग १४ कि.मी. दूरी पर कमान्द   में उहल नदी के बायें तट पर और सालगी गाँव में है और अब पूर्णतः कार्यरत है। प्रो. तिमोथी ए. गोन्साल्वेज़ भा.प्रौ.सं. मण्डी के संस्थापक निदेशक (१५ जनवरी २०१० से ३० जून २०२०) तथा प्रो. आर. सी. साहनी प्रथम कुलसचिव के पद पर कार्यरत रहे। भा.प्रौ.सं. रूड़की के निदेशक प्रो. अजित कुमार चतुर्वेदी ने दिनांक १ जुलाई २०२० से कार्यकारी निदेशक का कार्यभार सम्भाला।",109,पर्यावरण
पदार्थ विज्ञान,"पदार्थ विज्ञान एक बहुविषयक क्षेत्र है जिसमें पदार्थ के विभिन्न गुणों का अध्ययन, विज्ञान एवं तकनीकी के विभिन्न क्षेत्रों में इसके प्रयोग का अध्ययन किया जाता है। इसमें प्रायोगिक भौतिक विज्ञान और रसायनशास्त्र के साथ-साथ रासायनिक, वैद्युत, यांत्रिक और धातुकर्म अभियांत्रिकी जैसे विषयों का समावेश होता है। नैनोतकनीकी और नैनोसाइंस में उपयोजता के कारण, वर्तमान समय में विभिन्न विश्वविद्यालयों, प्रयोगशालाओं और संस्थानों में इसे काफी महत्व मिला है।",68,पर्यावरण
आसूचना ब्यूरो,"आसूचना ब्यूरो या इंटेलिजेंस ब्यूरो, भारत की आन्तरिक खुफिया एजेन्सी है और ख्यात रूप से दुनिया की सबसे पुरानी खुफिया एजेंसी है। इसे प्रायः 'आईबी' कहा जाता है। इसे 1947 में गृह मंत्रालय के अधीन केन्द्रीय खुफिया ब्यूरो के रूप में पुनर्निर्मित किया गया। इसके गठन की धारणा के पीछे यह तथ्य हो सकता है कि 1885 में, मेजर जनरल चार्ल्स मैकग्रेगर को शिमला में ब्रिटिश इंडियन आर्मी के खुफिया विभाग का क्वार्टरमास्टर जनरल और प्रमुख नियुक्त किया गया। उस वक्त इसका उद्देश्य था अफगानिस्तान में रूसी सैनिकों की तैनाती पर निगरानी रखना, क्योंकि 19वीं सदी के उत्तरार्ध में इस बात का डर था कि कहीं रूस उत्तर-पश्चिम की ओर से ब्रिटिश भारत पर आक्रमण ना कर दे।
1909 में, भारतीय अराजकतावादी गतिविधियों के पनपने की प्रतिक्रिया में इंग्लैंड में भारतीय राजनीतिक खुफिया कार्यालय की स्थापना की गई, जिसे बाद में 1921 से इंडियन पॉलिटिकल इंटेलिजेंस (आईपीआई) कहा गया। यह सरकार द्वारा संचालित निगरानी एजेंसी थी। आईपीआई को संयुक्त रूप से भारत कार्यालय और भारत सरकार द्वारा चलाया जाता था और भारत कार्यालय के नागरिक और न्यायिक विभाग सचिव और भारत में इंटेलिजेंस ब्यूरो निदेशक (डीआईबी) को संयुक्त रूप से रिपोर्ट भेजी जाती थी। और यह स्कॉटलैंड यार्ड और MI5 के साथ करीबी संपर्क बनाए रखता था।",207,पर्यावरण
स्टैच्यू ऑफ यूनिटी,"स्टैच्यू ऑफ यूनिटी भारत के प्रथम उप प्रधानमन्त्री तथा प्रथम गृहमन्त्री वल्लभभाई पटेल को समर्पित एक स्मारक है, जो भारतीय राज्य गुजरात में स्थित है। गुजरात के तत्कालीन मुख्यमन्त्री नरेन्द्र मोदी ने 31 अक्टूबर 2013 को सरदार पटेल के जन्मदिवस के मौके पर इस विशालकाय मूर्ति के निर्माण का शिलान्यास किया था। यह स्मारक सरदार सरोवर बांध से 3.2 किमी की दूरी पर साधू बेट नामक स्थान पर है जो कि नर्मदा नदी पर एक टापू है। यह स्थान भारतीय राज्य गुजरात के भरुच के निकट नर्मदा जिले में स्थित है।
यह विश्व की सबसे ऊँची मूर्ति है, जिसकी लम्बाई 182 मीटर (597 फीट) है। इसके बाद विश्व की दूसरी सबसे ऊँची मूर्ति चीन में स्प्रिंग टैम्पल बुद्ध है, जिसकी आधार के साथ कुल ऊंचाई 153 मीटर (502 फीट) हैं।
प्रारम्भ में इस परियोजना की कुल लागत भारत सरकार द्वारा लगभग ₹3,000 करोड़ (US$438 मिलियन) रखी गयी थी, बाद लार्सन एंड टूब्रो ने अक्टूबर 2014 में सबसे कम ₹2,989 करोड़ (US$436.39 मिलियन) की बोली लगाई; जिसमें आकृति, निर्माण तथा रखरखाव शामिल था। निर्माण कार्य का प्रारम्भ 31 अक्टूबर 2013 को प्रारम्भ हुआ। मूर्ति का निर्माण कार्य मध्य अक्टूबर 2018 में समाप्त हो गया। इसका उद्घाटन भारत के प्रधानमंत्री नरेन्द्र मोदी द्वारा 31 अक्टूबर 2018 को सरदार पटेल के जन्मदिवस के मौके पर किया गया।",214,पर्यावरण
