title,content,word_count,topic
भारत–मंगोलिया सम्बन्ध,"भारत–मंगोलिया सम्बन्ध ( मंगोल: Монгол, Энэтхэгийн харилцаа    ) फ़िलहाल नवजात अवस्था में हैं और आपसी सहयोग राजनयिक यात्राओं, सॉफ्ट लोन के प्रावधान और वित्तीय सहायता और आईटी क्षेत्र में सहयोग तक सीमित है। 
भारत ने दिसंबर 1955 में राजनयिक संबंध स्थापित किए। मंगोलिया के साथ राजनयिक संबंध स्थापित करने के लिए सोवियत संघ के बाहर भारत पहला देश था। तब से दोनों देशों के बीच 1973, 1994, 2001 और 2004 में आपसी मित्रता और सहयोग की संधियाँ हुई हैं।  
मंगोलिया संयुक्त राष्ट्र सुरक्षा परिषद के स्थायी सदस्य के रूप में भारत की उम्मीदवारी का समर्थन करता है जबकि भारत ने गुटनिरपेक्ष आंदोलन के पूर्ण सदस्य के रूप में मंगोलिया को शामिल करने का समर्थन किया।  
2010 के गैलप पोल के अनुसार, 26% मंगोलियाई भारतीय नेतृत्व को स्वीकार करते हैं, जिसमें 9% निराशाजनक और 66% अनिश्चित हैं।  
दिसंबर 2016 में, मंगोलिया ने चीन की देश की सीमा के अवरुद्ध होने के बाद भारत से वित्तीय मदद मांगी।  
अप्रैल 2018 में भारतीय विदेश मंत्री सुषमा स्वराज की मंगोलिया की ऐतिहासिक यात्रा के बाद, भारत और मंगोलिया ने द्विपक्षीय व्यापार को बढ़ावा देने के लिए एक हवाई-गलियारा स्थापित करने का निर्णय लिया। यह भी उम्मीद है कि मंगोलिया की पहली तेल रिफाइनरी का निर्माण 2018 में भारत से तकनीकी और वित्तीय सहायता के साथ शुरू होगा।",213,अपराध
गठबंधन (टीवी श्रृंखला),"गठबंधन  एक भारतीय टेलीविजन एक्शन ड्रामा रोमांस सीरीज़ है जिसे 15 जनवरी से 27 नवंबर 2019 तक कलर्स टीवी पर 224 एपिसोड प्रसारित करके प्रसारित किया गया था। जय प्रोडक्शन के तहत जय मेहता द्वारा निर्मित, इसमें श्रुति शर्मा, अबरार काज़ी और सोनाली नाइक ने अभिनय किया। यह डोंबीवाली मुंबई के डॉन और सुरेंद्रनगर के आईपीएस की प्रेम कहानी है
इसे अरबी में العدو الحبیب शीर्षक के तहत डब किया गया था और एमबीसी बॉलीवुड पर प्रसारित किया गया था।",80,अपराध
सनल एडामारकू,सनल एडामारकू (जन्म: २६ मई १९६५) भारतीय तर्कवादी और लेखक हैं। वो रेशनलिस्ट इंटरनेशनल संस्था के संस्थापक अध्यक्ष और सम्पादक हैं। उन्होंने वर्ष २०१२ में मुम्बई के एक कैथोलिक गिरजाघर में अचानक पानी निकलने के चमत्कार का पर्दाफास किया था जिसके बाद उसी सप्ताह मुम्बई पुलिस ने कैथोलिक समूहों की ओर से सनल के ख़िलाफ ईशनिंदा की तीन शिकायतें दर्ज की। इसके बाद से वो स्वनिर्वासित जीवन बिता रहे हैं।,70,अपराध
अनुसूचित जाति और अनुसूचित जनजाति,"अनुसूचित जाति (एससी)  आधिकारिक तौर पर लोगों के नामित समूह हैं और भारत में सबसे वंचित सामाजिक-आर्थिक समूहों में से हैं। शर्तें भारत के संविधान में मान्यता प्राप्त हैं और समूहों को एक या अन्य श्रेणियों में नामित किया गया है : भारतीय उपमहाद्वीप में ब्रिटिश शासन के अधिकांश काल में , उन्हें दलित वर्गों के रूप में जाना जाता था।:
अनुसूचित जनजाति (एसटी) आधुनिक साहित्य में, अनुसूचित जातियों को जनजाति के रूप में संदर्भित किया जाता है , जिसका अर्थ है ""टूटा हुआ"" या ""बिखरा हुआ"",

2011 की जनगणना के अनुसार अनुसूचित जनजाति की जनसंख्या पूरे भारत में 8.6% यानि की लगभग 14 करोड़ थी। राज्यवार आंकड़े देखे तो सर्वाधिक अनुसूचित जनजाति वाला राज्य मध्य प्रदेश है। 2011 के जनगणना के अनुसार मध्य प्रदेश अनुसूचित जनजाति की कुल आबादी लगभग 1करोड़ 53 लाख थी तथा पंजाब, हरियाणा, दिल्ली,चंडीगढ़ व पुडुचेरी में कोई भी अनुसूचित जनजाति निवास नहीं करती है।",150,अपराध
भारतीय गृह रक्षक,"भारतीय गृह रक्षक, या होम गार्ड  है। यह एक स्वैच्छिक बल है, जिसे भारतीय पुलिस के सहायक के रूप में काम सौंपा गया है।  1962 के बाद गृह रक्षक संगठन को भारत में पुनर्गठित किया गया था, हालांकि यह कुछ जगहों पर व्यक्तिगत रूप से छोटी इकाइयों में मौजूद था। गृह रक्षक को समाज के विभिन्न क्रॉस वर्गों जैसे कि पेशेवरों, कॉलेज के छात्रों, कृषि और औद्योगिक श्रमिकों आदि से भर्ती किया जाता है जो समुदाय की बेहतरी के लिए अपना खाली समय देते हैं। 18-50 के आयु वर्ग में भारत के सभी नागरिक पात्र हैं। गृह रक्षक में सदस्यता का सामान्य कार्यकाल तीन से पांच वर्ष है।",108,अपराध
न्यायिक सुधार,"न्यायिक सुधार (Judicial reform) से आशय किसी देश की न्यायपालिका का राजनीतिक ढंग से पूर्णतः या आंशिक परिवर्तन करना है। न्यायिक सुधार, विधिक सुधार का एक हिस्सा है। विधिक सुधार में न्यायिक सुधार के साथ-साथ कानूनी ढांचे में परिवर्तन, कानूनों में सुधार, कानूनी शिक्षा में सुधार, जनता में विधिक जागरूकता लाना, न्याय का त्वरित एवं सस्ता बनाना आदि भी शामिल हैं। न्यायिक सुधार का लक्ष्य न्यायालयों में सुधार, वकालत (bar) में परिवर्तन, दस्तावेजों का रखरखाव आदि सम्मिलित है।
न्यायिक संस्था और विधि का शासन, आधुनिक सभ्यता और लोकतांत्रिक शासन की आवश्यकता है। यह महत्तवपूर्ण है कि न्याय प्रदान करने के प्रभावी तंत्र को सुनिश्चित करने के जरिए न्याय तंत्र और विधि के शासन में लोगों की आस्था न सिर्फ परिरक्षित है बल्कि उसे बढ़ाने के साथ-साथ उसे हासिल करने का यह सरल रास्ता भी है।
न्यायिक सुधार के प्रमुख अंग ये हैं- सर्वसामान्य विधि (कॉमन लॉ) के स्थान पर विधि का संहिताकरण, इन्क्विजीशन प्रणाली से आगे बढ़कर वाद-प्रतिवाद प्रणाली (ऐडवर्सरियल प्रणाली) लागू करना, न्यायिक स्वतंत्रतता को और अधिक मजबूत करना (न्यायिक परिषदों द्वारा या नियुक्ति की प्रक्रिया को और अधिक पारदर्शी बनाकर), एक निश्चित आयु के बाद न्यायधीशों को अनिवार्य रूप से सेवानिवृत्त करना आदि।",195,अपराध
कश्यप प्रमोद पटेल,"कश्यप प्रमोद ""काश"" पटेल (जन्म २५ फ़रवरी १९८०) एक अमेरिकी वकील, बच्चों की पुस्तक लेखक और पूर्व सरकारी अधिकारी हैं।
उन्होंने ट्रम्प राष्ट्रपति पद के दौरान अमेरिकी राष्ट्रीय सुरक्षा परिषद के अधिकारी, राष्ट्रीय खुफिया के कार्यवाहक निदेशक के वरिष्ठ सलाहकार और कार्यवाहक संयुक्त राज्य अमेरिका के रक्षा सचिव के स्टाफ प्रमुख के रूप में कार्य किया। रिपब्लिकन पार्टी के सदस्य, पटेल ने पहले कांग्रेसी डेविन नून्स के वरिष्ठ सहयोगी के रूप में काम किया था जब उन्होंने हाउस इंटेलिजेंस कमेटी की अध्यक्षता की थी वह पहले एक संघीय सार्वजनिक रक्षक, राष्ट्रीय सुरक्षा मामलों पर काम करने वाले एक संघीय अभियोजक और संयुक्त राज्य सशस्त्र बलों के लिए कानूनी संपर्ककर्ता थे।
पटेल को समाचार संगठनों द्वारा व्यापक रूप से ""ट्रम्प के वफादार"" के रूप में वर्णित किया गया है। कांग्रेसी डेविन नून्स के सहयोगी के रूप में, पटेल ने डोनाल्ड ट्रम्प और रूसी की जांच से लड़ने के रिपब्लिकन प्रयासों में मदद करने में महत्वपूर्ण भूमिका निभाई। १०१६ के चुनाव में हस्तक्षेप।",161,अपराध
चेरी ब्लेयर,"चेरी ब्लेयर सी.बी.ई.   क्यूसी ( नी बूथ ; जन्म 23 सितंबर 1954), जिसे पेशेवर रूप से चेरी बूथ के नाम से भी जाना जाता है, एक ब्रिटिश बैरिस्टर , लेक्चरर और लेखक हैं।  उन्होंने टोनी ब्लेयर से शादी की, जो यूनाइटेड किंगडम के प्रधान मंत्री थे ।",47,अपराध
पत्रकारिता,"पत्रकारिता आधुनिक सभ्यता का एक प्रमुख व्यवसाय है, जिसमें समाचारों का एकत्रीकरण, लिखना, जानकारी एकत्रित करके पहुँचाना, सम्पादित करना और सम्यक प्रस्तुतीकरण आदि सम्मिलित हैं। आज के युग में पत्रकारिता के भी अनेक माध्यम हो गये हैं; जैसे - अखबार, पत्रिकायें, रेडियो, दूरदर्शन, वेब-पत्रकारिता आदि। बदलते वक्त के साथ बाजारवाद और पत्रकारिता के अन्तर्सम्बन्धों ने पत्रकारिता की विषय-वस्तु तथा प्रस्तुति शैली में व्यापक परिवर्तन किए।
वर्तमान में भारतीय पत्रकारिता सरकारी गजट या नोटिफ़िकेशन बनकर रह गई है।‌ लगभग सभी मिडिया संस्थान और‌ चैनल दिन रात सरकार का गुणगान करते हैं। इक्कीसवीं सदी में दुनिया विज्ञान और टेक्नोलॉजी पर बात कर रही है परन्तु भारतीय मीडिया धर्म, जातिवाद, मन्दिर मस्जिद की तथाकथित राजनीति से आगे नहीं बढ़ पा रही हैं।
इस तरह की पत्रकारिता भारतीय समाज में अन्धविश्वास, धार्मिक उन्माद, सामाजिक विघटन ही पैदा करेगी।
वर्तमान समय में मिडिया की नजरों में सेक्युलर, उदारवादी या संविधानवादी होना स्वयं में एक गाली हो गया है।
पण्डित जवाहर लाल नेहरू, सरदार वल्लभ भाई पटेल, सुभाष चन्द्र बोस और मोलाना आजाद के सपनों का भारत वाकई में बहुत खुबसूरत और खुशहाल हैं और इस भारत को हम इस तरह अन्धविश्वास, तथाकथित धार्मिक उन्माद और‌ जड़ता की ओर नहीं जाने देंगे‌।",196,अपराध
दक्षिण अफ़्रीका बनाम इज़राइल (कानूनी कार्यवाही),"अंतर्राष्ट्रीय न्यायालय (आईसीजे) के समक्ष २९ दिसंबर २०२३ को इज़राइल के खिलाफ दक्षिण अफ्रीका द्वारा शुरू की गई कानूनी कार्यवाही को आधिकारिक तौर पर गाजा पट्टी (दक्षिण अफ्रीका बनाम इज़राइल) में नरसंहार के अपराध की रोकथाम और सजा पर कन्वेंशन के आवेदन के रूप में जाना जाता है।) . 
दक्षिण अफ़्रीका के निवेदन में आरोप लगाया गया है कि इज़रायल ने नरसंहार कन्वेंशन का उल्लंघन करते हुए, गाजा पट्टी में फ़िलिस्तीनियों के ख़िलाफ़ नरसंहार किया है और कर रहा है, और आरोपों को फ़िलिस्तीनियों के प्रति इज़रायल के आचरण के व्यापक संदर्भ के रूप में वर्णित करता है, जिसमें दक्षिण अफ़्रीका भी शामिल है। इसे 75 साल के रंगभेद, 56 साल के कब्जे और 16 साल की पट्टी की नाकाबंदी के रूप में वर्णित किया गया है। 
मुकदमा सैद्धांतिक रूप से अदालत से फिलिस्तीनियों के लिए सुरक्षा के अनंतिम उपाय प्रदान करने के लिए भी कहता है जो इज़राइल-हमास युद्ध के समय नरसंहार से गुजर रहे हैं। 
सुरक्षा के अनंतिम उपायों के लिए दक्षिण अफ्रीका के अनुरोध के संबंध में ११ और १२ जनवरी २०२४ को हेग के पीस पैलेस में दो दिवसीय सार्वजनिक सुनवाई आयोजित की गई थी।   
न्यायालय ने २६ जनवरी २०२४ को अंतिम उपाय अनुरोध के संबंध में एक आदेश जारी किया, जिसमें उसने इज़राइल को १९४८ के नरसंहार सम्मेलन के अनुसार नरसंहार माने जाने वाले किसी भी कृत्य को रोकने के लिए सभी उपाय करने का आदेश दिया।    अदालत ने कहा, ""दक्षिण अफ्रीका द्वारा गाजा में इज़राइल द्वारा किए गए कम से कम कुछ कार्य और चूक [नरसंहार] कन्वेंशन के प्रावधानों के अंतर्गत आने में सक्षम प्रतीत होते हैं""।",263,अपराध
भारत में भ्रष्टाचार,"भारत में भ्रष्टाचार एक ऐसा मुद्दा है जो केन्द्रीय, राज्य और स्थानीय सरकारी संस्थानों की अर्थव्यवस्था को कई तरह से प्रभावित करता है। भारत की अर्थव्यवस्था को ठप करने के लिए भ्रष्टाचार को जिम्मेदार ठहराया जाता है। 2005 में ट्रान्सपैरेंसी इंटरनेशनल द्वारा किए गए एक अध्ययन में दर्ज किया गया कि 62% से अधिक भारतीयों ने किसी न किसी समय पर नौकरी पाने के लिए एक सार्वजनिक अधिकारी को उत्कोच दी थी। 2008 में, एक अन्य रिपोर्ट ने दिखाया कि लगभग 50% भारतीयों को उत्कोच देने या सार्वजनिक कार्यालयों द्वारा सेवाओं को प्राप्त करने के लिए सम्पर्कों का उपयोग करने का प्रत्यक्ष अनुभव था। 2022 में उनके भ्रष्टाचार बोध सूचकांक ने देश को 180 में से 85वें स्थान पर रखा, इस पैमाने पर जहां सबसे कम रैंक वाले देशों को सबसे ईमानदार सार्वजनिक क्षेत्र माना जाता है। सरकारी समाज कल्याण योजनाओं से धन की हेराफेरी करने वाले अधिकारियों सहित भ्रष्टाचार में विभिन्न कारकों का योगदान है। उदाहरणों में राष्ट्रीय ग्रामीण रोजगार गारंटी अधिनियम और राष्ट्रीय ग्रामीण स्वास्थ्य अभियान शामिल हैं। भ्रष्टाचार के अन्य क्षेत्रों में भारत का ट्रकिंग उद्योग शामिल है, जो अंतर्राज्यीय राजमार्गों पर कई नियामकों और पुलिस बन्धों को वार्षिक अरबों रुपये की उत्कोच देने के लिए मजबूर है।
भारत में भ्रष्टाचार के कारणों में अत्यधिक नियम, जटिल कर और लाइसेंस प्रणाली, अपारदर्शी नौकरशाही और विवेकाधीन शक्तियों वाले कई सरकारी विभाग, कुछ वस्तुओं और सेवाओं के वितरण पर सरकार द्वारा नियंत्रित संस्थानों का एकाधिकार, और पारदर्शी कानूनों और प्रक्रियाओं की कमी शामिल हैं। भ्रष्टाचार के स्तर में और पूरे भारत में भ्रष्टाचार को कम करने के सरकार के प्रयासों में महत्वपूर्ण भिन्नताएँ हैं।",265,अपराध
