title,content,word_count,topic
अपराध,"अपराध या दंडाभियोग (crime) की परिभाषा भिन्न-भिन्न रूपों में की गई है; यथा,

दंडाभियोग समाजविरोधी क्रिया है;
समाज द्वारा निर्धारित आचरण का उल्लंघन या उसकी अवहेलना दंडाभियोग है;
यह ऐसी क्रिया या क्रिया में त्रुटि है, जिसके लिये दोषी व्यक्ति को कानून द्वारा निर्धारित दंड दिया जाता है।अर्थात अपराध कानूनी नियमो कानूनों के उल्लंघन करने की नकारात्मक प्रक्रिया है जिससे समाज के तत्वों का विनाश होता है ।
इन परिभाषाओं के अनुसार किसी नगरपालिका के बनाए नियमों का उल्लंघन कर यदि कोई रात में बिना बत्ती जलाए साइकिल पर नगर की सड़क पर चले अथवा बिना पर्याप्त कारण के ट्रेन की जंजीर खींचकर गाड़ी खड़ी कर दे, तो वह भी उसी प्रकार दोषी माना जाएगा, जिस तरह कोई किसी की हत्या करने पर। किंतु साधारण अर्थ में लोग दंडाभियोग को हत्या, डकैती आदि जघन्य अपराधों के पर्याय के रूप में ही लेते हैं। लौकिक मत के अनुसार कोई चालक यदि तेजी एवं असावधानी से मोटर चलाते हुए किसी को अपनी गाड़ी से कुचल दे तो वह अपराधी नहीं कहा जा सकता, यदि उसके मन में अपराध करने की भावना न रही हो। जब हम गलती करते हैं तब वह अपराध कहलाता है",192,अपराध
सिविल कानून,"सिविल कानून (Civil law) के अन्तर्गत सभी कानून आते हैं जो अपराध कानून नहीं है। इसके अन्दर व्यावसायिक कानून, औद्योगिक कानून आदि आते हैं।",24,अपराध
अपराध शास्त्र,,0,अपराध
किशोर अपराध,"जब किसी बच्चे द्वारा कोई कानून-विरोधी या समाज विरोधी कार्य किया जाता है तो उसे किशोर अपराध या बाल अपराध कहते हैं। कानूनी दृष्टिकोण से बाल अपराध 8 वर्ष से अधिक तथा 16 वर्ष से कम आयु के बालक द्वारा किया गया कानूनी विरोधी कार्य है जिसे कानूनी कार्यवाही के लिये बाल न्यायालय के समक्ष उपस्थित किया जाता है। भारत में बाल न्याय अधिनियम 1986 (संशोधित 2000) के अनुसर 16 वर्ष तक की आयु के लड़कों एवं 18 वर्ष तक की आयु की लड़कियों के अपराध करने पर बाल अपराधी की श्रेणी में सम्मिलित किया गया है। बाल अपराध की अधिकतम आयु सीमा अलग-अलग राज्यों मे अलग-अलग है। इस आधार पर किसी भी राज्य द्वारा निर्धारित आयु सीमा के अन्तर्गत बालक द्वारा किया गया कानूनी विरोधी कार्य बाल अपराध है।
केवल आयु ही बाल अपराध को निर्धारित नहीं करती वरन् इसमें अपराध की गंभीरता भी महत्वपूर्ण पक्ष है। 7 से 16 वर्ष का लड़का तथा 7 से 18 वर्ष की लड़की द्वारा कोई भी ऐसा अपराध किया गया हो जिसके लिए राज्य मृत्यु दण्ड अथवा आजीवन कारावास देता है जैसे हत्या, देशद्रोह, घातक आक्रमण आदि तो वह बाल अपराधी मानी जायेगा।",191,अपराध
साईबर अपराध,"साइबर अपराध  एक ऐसा अपराध है जिस में कंप्यूटर और नेटवर्क शामिल है। किसी भी कंप्यूटर का अपराधिक स्थान पर मिलना या कंप्यूटर से कोई अपराध करना कंप्यूटर अपराध कहलाता है। कंप्यूटर अपराध मे नेटवर्क शामिल नही होता है। किसी कि निजी जानकारी को प्राप्त करना और उसका गलत इस्तेमाल करना। किसी की भी निजी जानकारी कंप्यूटर से निकाल लेना या चोरी कर लेना भी साइबर अपराध है।
कंप्यूटर अपराध भी कई प्रकार से किये जाते है जैसे कि जानकारी चोरी करना, जानकारी मिटाना, जानकारी मे फेर बदल करना, किसी कि जानकारी को किसी और को देना या कंप्यूटर के भागो को चोरी करना या नष्ट करना। साइबर अपराध भी कई प्रकार के है जैसे कि स्पैम ईमेल, हैकिंग, फिशिंग, वायरस को डालना, किसी की जानकारी को ऑनलाइन प्राप्त करना या किसी पर हर वक़्त नजर रखना।",137,अपराध
राष्‍ट्रीय अपराध रिकॉर्ड ब्‍यूरो,"राष्‍ट्रीय अपराध रिकार्ड ब्‍यूरो (अंग्रेजी: National Crime Records Bureau, एन सी आर बी) भारत सरकार, गृह मंत्रालय के साथ संलग्‍न एक कार्यालय है। नई दिल्‍ली स्थित इस ब्‍यूरो का प्रमुख उद्देश्य भारत की पुलिस के आधुनिकीकरण व सूचना प्रौद्योगिकी में सशक्‍त करना है। 

यह ब्‍यूरो देश भर में ""अपराध अपराधी सूचना प्रणाली"" (Crime Criminal Information system, CCIS, सी.सी.आई.एस.) के अंतर्गत प्रत्‍येक राज्‍य अपराध रिकार्ड ब्‍यूरो एवं जिला अपराध रिकार्ड ब्‍यूरो में 762 सर्वर-आधारित कम्‍प्‍यूटर सिस्‍टम स्‍थापित कर चुका है, ताकि अपराध, अपराधियों एवं अपराधियों की सम्‍पत्ति से संबंधित राष्‍ट्रीय स्‍तर के डाटा बेस को व्‍यवस्थित किया जा सके। इसके अतिरिक्त यह ब्यूरो ""अपराध एवं अपराधी खोज नेटवर्क और प्रणाली"" (Crime and Criminal Tracking Network and Systems, CCTNS, सी.सी.टी.एन.एस.) को भी कार्यान्वित कर रहा है, जो भारत सरकार के राष्‍ट्रीय ई-गर्वनेंस योजना के अंतर्गत एक मिशन मोड परियोजना है।[उद्धरण चाहिए]",139,अपराध
युद्ध अपराध,"सैनिकों अथवा अन्यान्य व्यक्तियों के प्रतिकूल (Hostile) या लगभग उसी तरह के काम, जिनके लिये पकड़े जाने पर शत्रुओं के द्वारा वे दंडित किए जा सकते हैं, युद्ध अपराध कहे जाते हैं। अंतरराष्ट्रीय कानून के विरूद्ध किए गए काम, जो अभियुक्त के अपने देश के कानून के प्रतिकूल हैं, युद्ध अपराध (War crimes) में अंतर्निहित होते हैं; यथा, व्यक्तिगत लाभ के उद्देश्य से की गई लूट या हत्या, शत्रु राष्ट्र की ओर से या उसके आदेश से किए गए अपराध।",80,अपराध
दण्डविधि,"कानूनों के उस समूह को दंड विधि (Criminal law, या penal law या 'फौज़दारी कनून') कहते हैं जो अपराधों एवं उनके लिये निर्धारित सजाओं (दण्ड) से समबन्धित होते हैं। आपराधिक मामलों में दण्ड कई प्रकार का हो सकता है (जो कि अपराध की प्रकृति पर निर्भर करता है) - मृत्युदंड, आजीवन कारावास, साधारण कारावास, पेरोल, या अर्थदण्ड आदि। यह दीवानी कानून से अलग है।",64,अपराध
गबन (अपराध),"ग़बन के अन्य अर्थों के लिए ग़बन का लेख देखें
गबन या दुर्विनियोग (embezzlement) ऐसे अपराध को कहते हैं जिसमें किसी कार्य के लिए कोई पैसा या सम्पति किसी व्यक्ति दी गयी हो और वह व्यक्ति अपने व्यक्तिगत लाभ के लिए उसे चुरा ले। ग़बन एक प्रकार का धोखा होता है। ग़बन का एक उदहारण दुकानों पर बैठे उन व्यक्तियों में देखा जाता है जो चालाकी से समय-समय पर किसी-किसी ग्राहक को बिना रसीद दिए सामान बेचते हैं और फिर वसूल किया गया पैसा दुकान के मालिक को देने के बजाय ख़ुद अपना मान लेते हैं।
भारतीय दण्ड संहिता में गबन के अपराधों के लिये धारा ४०३ तथा धारा ४०४ लागू होतीं हैं।",113,अपराध
भारत के बाल लैंगिक अत्याचार क़ानून,"पुरे दुनिया में भारत में बच्चों कि जनसंख्या सब से अधिक है।२०११ का जनगणना डेटा दरशाता है कि ४७२ लाख बच्चे १८ व्रष से कम अयु के हैं जनमें से २२५ लाख लड़कियाँ है।  भारत में बाल लैंगिक अत्याचार कानूनों का आध्याधेश भारत की बाल संरक्षण नीतियों का हिस्सा है। भारतीय संसद ने 'बालकों का लैंगिक अपराधों से संरक्षण विपत्र 2011' को 22 मई 2012 में पारित किया, जिससे वह ' बालकों का लैंगिक अपराधों से संरक्षण अधिनियम 2012' बन गया और 14 नवंबर 2012 से लागू हो गया।  भारत में लगभग 53 प्रतिशत बालकों ने किसी तरह का लैंगिक अत्याचार का सामना किया है।",105,अपराध
पर्यावरणीय अपराध,पर्यावरणीय अपराध (अंग्रेज़ी: Environmental crime) वे गैर-क़ानूनी कार्य हैं जो पर्यावरण क़ानूनों के उल्लंघन के रूप में किये जाते हैं और जिनसे पर्यावरण की गुणवत्ता को नुकसान पहुँचता है।,29,अपराध
थाईलैंड का कानून,"थाईलैंड का कानून मुख्य रूप से दीवानी कानून (सिविल लॉ) पर आधारित हैं, लेकिन इन पर सामान्य कानून (कॉमन लॉ) का भी प्रभाव पड़ा है (देखें: विश्व कानूनी प्रणालियाँ)।",29,अपराध
सैनिक कानून,"विशेष परिस्थितियों में जब किसी देश की न्याय व्यवस्था को सेना अपने हाथ में ले लेती है, तब जो नियम प्रभावी होते हैं उन्हें सैनिक कानून कहा जाता है। कभी-कभी युद्ध के समय अथवा किसी क्षेत्र को जीतने के बाद उस क्षेत्र में मार्शल लॉ लगा दिया जाता है। उदाहरण के लिये द्वितीय विश्व युद्ध के बाद जर्मनी और जापान में मार्शल लॉ लागू किया गया था। इसके अलावा प्राय: तख्ता पलट के बाद भी मार्शल लॉ लगा दिया जाता है। कभी-कभी बहुत बड़ी प्राकृतिक आपदा आने पर भी मार्शल लॉ लगा दिया जाता है (किन्तु अधिकांश देश इस स्थिति में आपातकाल लागू करते हैं।)
मार्शल ला के अंतर्गत कर्फ्यू  आदि विशेष कानून होते हैं। प्राय: मार्शल लॉ के अंतर्गत न्याय देने के लिये सेना का एक ट्रिब्यूनल नियुक्त किया जाता है जिसे कोर्ट मार्शल कहा जाता है। इसके अन्तर्गत बन्दी प्रत्यक्षीकरण याचिका जैसे अधिकार निलंबित किए जाते हैं।",149,अपराध
संज्ञेय अपराध,"भारत, श्रीलंका, पाकिस्तान और बांग्लादेश में अपराध (क्राइम) की दो श्रेणीयाँ की गयी हैं-

(१) संज्ञेय अपराध (Cognizable offence),
(२) असंज्ञेय अपराध (non-cognizable offence).
आपराधिक प्रक्रिया संहिता (सीआरपीसी) में संज्ञेय अपराध की परिभाषा ऐसे अपराध के रूप में की गई है, जिसमें गिरफ्तारी के लिए पुलिस को किसी वारंट की जरूरत नहीं होती। संज्ञेय अपराध सामान्यतः गंभीर होते हैं जिनमें पुलिस को तुरन्त कार्य करना होता है। संज्ञेय अपराध में पुलिस बिना मेजिस्ट्रेट की आज्ञा अनुसंधान प्रारम्भ कर सकती है।
सीआरपीसी में यह भी कहा गया है कि पुलिस को ऐसे मामलों में एफआईआर दर्ज करना चाहिए। दंड प्रक्रिया संहिता की प्रथम अनुसूची के कॉलम सं. 4 में भारतीय दंड संहिता में वर्णित प्रत्येक अपराध के लिए यह अंकित किया गया है कि वह अपराध संज्ञेय है अथवा असंज्ञेय।",129,अपराध
अपराध दर के आधार पर भारत के राज्यों की सूची,"राष्ट्रीय अपराध रिकॉर्ड ब्यूरो के अनुसार, भारत में अपराध दर (प्रति 100,000 जनसंख्या पर अपराध की घटना) 2020 में 487.8 से घटकर 2021 में 445.9 हो गई है। अपराध की घटना और अपराध दर अलग-अलग राज्यों में और अपराध के प्रकार से भी भिन्न होती है। 
2021 में सभी राज्यों में से केरल में अपराध दर सबसे अधिक है, और नागालैंड में अपराध दर सबसे कम है। 2021 में पूरे भारत में से दिल्ली में अपराध दर सबसे अधिक है, और दादरा नगर हवेली और दमन और दीव में सबसे कम अपराध दर है।
हिंसक अपराध विशेष रूप से पूर्वी भारत, पूर्वोत्तर भारत, राष्ट्रीय राजधानी क्षेत्र में अधिक हैं। बिहार, झारखंड, ओडिशा, पश्चिम बंगाल, असम, त्रिपुरा, अरुणाचल प्रदेश, दिल्ली, हरियाणा, महाराष्ट्र, और मध्य प्रदेश में हिंसक अपराध की दर 2021 में राष्ट्रीय औसत से अधिक है।
2021 में झारखंड में सबसे ज्यादा हत्या की दर थी, राजस्थान में सबसे ज्यादा बलात्कार की दर थी, दिल्ली में अपहरण और डकैती की दर सबसे अधिक थी, पंजाब में मादक पदार्थों की तस्करी की दर सबसे अधिक थी, और उत्तर प्रदेश में सबसे अधिक अवैध हथियार के जब्ती की दर रही।
अपराधों के कुछ कारण क्षेत्र विशिष्ट होते हैं। विद्रोहियों ने 2021 में 178 अपराध किए, जिनमें ज्यादातर मणिपुर में थे। वामपंथी चरमपंथियों ने 2021 में 387 अपराध किए, जिनमें से ज्यादातर छत्तीसगढ़ में थे। आतंकवादियों ने 2021 में 380 अपराध किए, जिनमें से ज्यादातर जम्मू और कश्मीर में थे।
2021 में पूरे भारत में से गुजरात में अपराध जांच दर और आरोप पत्र दर सबसे अधिक रहा, वहीं मणिपुर में यह दोनों आकड़ें सबसे कम रहें।
2021 में मिजोरम में दोष सिद्धि दर सबसे ज्यादा रहा जबकि लक्षद्वीप में यह सबसे कम था |",282,अपराध
