title,content,word_count,topic
पर्सेपोलिस,"पर्सेपोलिस (पुरानी युनानी: Περσέπολις पेर्सैपोलीस, पुरानी फ़ारसी: 𐎱𐎠𐎼𐎿 पार्सा, फ़ार्सी: تخت جمشید तख़्ते जम्शीद या चेहेल मीनार), आक्मेनीड साम्राज्य (550-330 ई.पू.) की औपचारिक (रैतिक) राजधानी थी। पर्सेपोलिस, आधुनिक इरान के फार्स प्रान्त के वर्तमान शहर शिराज़ के 70 km पूर्वोत्तर में स्थित है। समकालीन फारसी में इस स्थान को तख़्त-ए जमशीद (जमशीद का सिंहासन) तथा पारसेह के नाम से जाना जाता है। पर्सेपोलिस के सबसे शुरुआती अवशेष लगभग 515 ईपू के आसपास के हैं। प्राचीन फारसी लोग इस शहर को पारसा के नाम से जानते थे जिसका अर्थ है ""फारसियों का शहर"". पर्सेपोलिस, यूनानी भाषा के शब्द Πέρσης πόλις (Persēs Polis : ""फ़ारसी शहर"") का एक लिप्यंतरण है।
यूनेस्को ने पर्सेपोलिस के किले को 1979 में एक वैश्विक विरासत स्थल घोषित कर दिया था।",124,जल
रासायनिक शस्त्र,"उन शस्त्रों को रासायनिक शस्त्र ( chemical weapon (CW)) कहते हैं जिसमें किसी ऐसे रसायन का उपयोग किया जाता है जो मानव को मार सकता है या उन्हें किसी प्रकार का नुकसान पहुँचा सकता है। अपनी मारक क्षमता के कारण ये जनसंहार करने वाले शस्त्रों की श्रेणी में आते हैं।     रासायनिक शस्त्र, जनसंहार करने वाले शस्त्रों का एक प्रकार है। अन्य जनसंहारक शस्त्र हैं - जैविक शस्त्र (रोग), रासायनिक शस्त्र, तथा रेडियोसक्रिय अस्त्र (radiological weapons)। तंत्रिका गैस, अश्रु गैस, कालीमिर्च स्प्रे ये तीन आधुनिक रासायनिक शत्र के उदाहरण हैं।",89,जल
ग्रीष्मकालीन महल,"ग्रीष्मकालीन महल या समर पैलेस (सरलीकृत चीनी: 颐和园; पारंपरिक चीनी: 頤和園; pinyin: Yíhéyuán), चीन की राजधानी बीजिंग से 15 किमी दूर स्थित एक महल संकुल है। झीलों, उद्यानों और महलों से मिलकर बनी यह विशाल समष्टि 2.9 वर्ग किलोमीटर (1.1 वर्ग मील) के क्षेत्र में फैली है। यह चीनी किंग राजवंश का एक शाही उद्यान था। महल के अधिकांश पर दीर्घायु पहाड़ी (万寿山; 萬壽山; Wànshòu Shān) और कुनमिंग झील स्थित हैं साथ ही महल का तीन-चौथाई हिस्सा जलक्षेत्र है।
दीर्घायु पहाड़ी लगभग 60 मीटर (200 फीट) ऊंची है और इसमें कई इमारतें अनुक्रम में स्थित हैं। सामने की पहाड़ी शानदार हॉल और मंडपों से समृद्ध है, जबकि इसके विपरीत, पीछे की पहाड़ी पर प्राकृतिक सुंदरता का वास है। 2.2 वर्ग किलोमीटर (540 एकड़) में फैली केंद्रीय कुनमिंग झील पूरी तरह से मानव निर्मित थी और खुदाई से निकली मिट्टी का उपयोग दीर्घायु पहाड़ी के निर्माण के लिए किया गया था।
दिसंबर 1998 में, यूनेस्को ने ग्रीष्मकालीन महल को अपनी विश्व विरासत सूची में शामिल किया। साथ ही इसे ""चीनी परिदृश्य उद्यान डिजाइन"" की एक उत्कृष्ट कृति घोषित किया। पहाड़ियों और खुले पानी के प्राकृतिक परिदृश्य को कृत्रिम विशेषताओं जैसे कि मंडप, हॉल, महलों, मंदिरों और पुलों के साथ जोड़ा गया है ताकि उत्कृष्ट कलात्मक मूल्य की सामंजस्यपूर्ण समष्टि बनाई जा सके""।
हाल के इतिहास में, यह दक्षिण-उत्तरी जल अंतरण परियोजना का केंद्रीय मार्ग टर्मिनस भी है, जो डेनजिग्कोऊ जलाशय, हुबेई से 1,267 किमी (787 मील) की दूरी पर है, जो इसे बीजिंग का मुख्य जलापूर्ति स्रोत बनाती है।",248,जल
भूगणित,"भूगणित (Geodesy or Geodetics) भूभौतिकी एवं गणित की वह शाखा है जो उपयुक्त मापन एवं प्रेक्षण के आधार पर पृथ्वी के पृष्ठ पर स्थित बिन्दुओं की सही-सही त्रिबिम-स्थिति (three-dimensional postion) निर्धारित करती है। इन्ही मापनों एवं प्रेक्षणों के आधार पर पृथ्वी का आकार एवं आकृति, गुरुत्वाकर्षण क्षेत्र तथा भूपृष्ट के बहुत बड़े क्षेत्रों का क्षेत्रफल आदि निर्धारित किये जाते हैं। इसके साथ ही भूगणित के अन्दर भूगतिकीय (geodynamical) घटनाओं (जैसे ज्वार-भाटा, ध्रुवीय गति तथा क्रस्टल-गति आदि) का भी अध्ययन किया जाता है। 
पृथ्वी के आकार तथा परिमाण का और भूपृष्ठ पर संदर्भ बिंदुओं की स्थिति का यथार्थ निर्धारण हेतु खगोलीय प्रेक्षणों की आवश्यकता होती है। इस कार्य में इतनी यथार्थता अपेक्षित है कि ध्रुवों (poles) के भ्रमण से उत्पन्न देशांतरों में सूक्ष्म परिवर्तनों पर और समीपवर्ती पहाड़ों के गुरुत्वाकर्षण से उत्पन्न ऊर्ध्वाधर रेखा की त्रुटियों पर ध्यान देना पड़ता है। पृथ्वी पर सूर्य और चंद्रमा के ज्वारीय (tidal) प्रभाओं का भी ज्ञान आवश्यक है और चूँकि सभी थल सर्वेक्षणों में माध्य समुद्रतल (mean sea level) आधार सामग्री होता है, इसलिये माहासागरों के प्रमुख ज्वारों का भी अघ्ययन आवश्यक है। भूगणितीय सर्वेक्षण के इन विभिन्न पहलुओं के कारण भूगणित के विस्तृत अध्ययन क्षेत्र में अब पृथ्वी के गुरुत्वाकर्षण क्षेत्र का, भूमंडल पृष्ठ समाकृति पर इसके प्रभाव का और पृथ्वी पर सूर्य तथा चंद्रमा के गुरुत्वीय क्षेत्रों के प्रभाव का अध्ययन समाविष्ट है।",221,जल
कूलिंग टॉवर,"कूलिंग टॉवर्स ऊष्मा निष्कासन के वे उपकरण हैं जिनका उपयोग संसाधित अपशिष्ट ऊष्मा को वातावरण में छोड़ने के लिए किया जाता है। कूलिंग टॉवर्स में संसाधित उष्मा को निकालने के लिए पानी के वाष्पीकरण के लिए या तो वेट-बल्ब वाले वायु तापमान के समीप क्रियाशील तरल को ठंडा करने के लिए उपयोग किया जाता है या फिर ड्राई-बल्ब वाले वायु तापमान के समीप क्रियाशील तरल को ठंडा करने के लिए पूरी तरह से वायु पर निर्भर रहना पड़ता है। सामान्य अनुप्रयोगों में तेल शोधक कारखाने, रासायनिक संयंत्र, ऊर्जा संयंत्रों और इमारत को ठंडा करने में प्रयुक्त किया जाने वाला प्रवाहित होने वाले पानी को ठंडा करना शामिल है। टॉवर्स छोटी छत से लेकर बड़ी छत वाली बहुत बड़ी अंडाकार संचरनाएं(छवि 1 में दिखाएनुसार) हो सकती हैं जिनकी ऊंचाई लगभग 200 मीटर तक ऊंची और चौड़ाई 100 मीटर तक या आयतकार संरचना (चित्र 2 में दिखाएनुसार) के समान हो सकती हैं जिनकी उंचाई 40 मीटर तक और लंबाई 80 मीटर तक हो सकती है। छोटे टॉवर सामान्यतः फैक्ट्री में बनते हैं, जबकि बड़ों का निर्माण साइट पर ही किया जाता है। उन्हें आमतौर पर परमाणु ऊर्जा संयंत्रों से जोड़ कर देखा जाता है।
अंडाकार कूलिंग टॉवर का पेटेंट फ्रेडरिक वैन इटैरसन और जेरार्ड क्युपर्स द्वारा 1918 में किया गया।",208,जल
मूत्रमेह,"बहुमूत्ररोग एक अवस्था है जो अत्यधिक प्यास तथा अत्यधिक मात्रा में अत्यंत तरल मूत्र के उत्सर्जित होने से चरितार्थ होती है और तरल पदार्थ के सेवन में कमी होने पर भी मूत्र विसर्जन में कोई कमी नहीं आती. बहुमूत्ररोग कई प्रकार के होते हैं तथा प्रत्येक का कारण भिन्न होता है। मनुष्यों में पाया जाने वाला सबसे आम प्रकार है केंद्रीय बहुमूत्ररोग (सेन्ट्रल डीआई) जो आर्गिनिन वेसोप्रेसिन (AVP) की कमी से होता है जिसे मूत्र-स्राव को कम करनेवाले हॉर्मोन (ADH) के नाम से भी जाना जाता है। मूत्रमेह का दूसरा आम प्रकार है नेफ्रोजेनिक बहुमूत्ररोग, जो गुर्दे की ADH के प्रति असंवेदनशीलता के कारण होता है। यह, दवा के इस्तेमाल से उत्पन्न चिकित्सजन्य कृतक के द्वारा भी हो सकता है।",120,जल
क्रिस्टलकी,"क्रिस्टलकी (Crystallography) या मणिविज्ञान एक प्रायोगिक विज्ञान है जिसमें ठोसों में परमाणों के विन्यास (arrangement) का अध्ययन किया जाता है। पहले क्रिस्टलिकी से तात्पर्य उस विज्ञान से था जिसमें क्रिस्टलों का अध्ययन किया जाता है। एक्स-किरण के डिफ्रैक्सन द्वारा क्रिस्टलोंके अध्ययनके पहले क्रिस्टलोंका अध्ययन केवल उनकी ज्यामिति (आकार-प्रकार) देखकर की जाती थी।
किन्तु आजकल विविध-प्रकार के किरण-पुंजों (एक्स-किरण, एलेक्ट्रान, न्यूट्रान, सिन्क्रोट्रान आदि) के डिफ्रैक्सन से किया जाता है।",68,जल
उत्तर प्रदेश सरकार,"उत्तर प्रदेश सरकार भारत में एक लोकतान्त्रिक रूप से चुनी गई राज्य सरकार है। जिसमें भारत के राष्ट्रपति द्वारा राज्य के नियुक्त संवैधानिक प्रमुख के रूप में राज्यपाल हैं। उत्तर प्रदेश के राज्यपाल को पाँच साल की अवधि के लिए नियुक्त किया जाता है और मुख्यमन्त्री और मन्त्रिपरिषद की नियुक्ति कराता है, जो राज्य के विधायी शक्तियों के साथ-साथ कार्यकारी शक्तियों के साथ निहित हैं। राज्यपाल राज्य का एक औपचारिक प्रमुख बना रहता है, जबकि मुख्यमन्त्री और उनकी परिषद दिन-प्रतिदिन सरकारी कार्यों के लिए जिम्मेदार होती हैं। भारतीय राजनीति पर यूपी की प्रभावी सरकार है और सबसे महत्वपूर्ण है क्योंकि यह भारतीय संसद के लिए सबसे अधिक संख्या में लोकसभा सीटों को भेजता है।",114,जल
एकीकृत नाशीजीव प्रबंधन,"एकीकृत नाशीजीव प्रबंधन (Integrated pest management (IPM), या Integrated Pest Control (IPC)) नाशीजीवों के नियंत्रण की सस्ती और वृहद आधार वाली विधि है जो नाशीजीवों के नियंत्रण की सभी विधियों के समुचित तालमेल पर आधारित है। इसका लक्ष्य नाशीजीवों की संख्या एक सीमा के नीचे बनाये रखना है। इस सीमा को 'आर्थिक क्षति सीमा' (economic injury level (EIL)) कहते हैं।
एकीकृत नाशीजीव प्रबंधन एक ऐसी व्यवस्था है जिसमें फसलों को हानिकारक कीड़ों तथा बीमारियों से बचाने के लिए किसानों को एक से अधिक तरीकों को जैसे व्यवहारिक, यांत्रिक, जैविक तथा रासायनिक नियंत्रण इस तरह से क्रमानुसार प्रयोग में लाना चाहिए ताकि फसलों को हानि पहुंचाने वालें की संख्या आर्थिक हानिस्तर से नीचे रहे और रासायनिक दवाईयों का प्रयोग तभी किया जाए जब अन्य अपनाए गये तरिके से सफल न हों।

आई. पी. एम. उददेश्य
१. फसल की बुवाई से लेकर कटाई तक हानिकारक कीड़ो, बीमारियों तथा उनके प्राकृतिक शत्रुओं की लगातार एवं
व्यवस्थित निगरानी रखना।

२. कीड़ो एवं बीमारियो को उनके आर्थिक हानि स्तर से नीचे रखने के लिए सभी उपल्बध नियंत्रण विधियों जैसे व्यवहारिक,
यांत्रिक, अनुवांशिक, जैविक, संगरोध व रासायनिक नियंत्रण का यथायोग्य करना।

३. कीड़ो एवं बिमारियों के आर्थिक हानि स्तर (ई.आई.एल.) को पार कर लेने पर सुरक्षित कीटनाशकों को सही समय पर
सही मात्रा में प्रयोग करना।

४. कृषि उत्पादन में कम लागत लगाकर अधिक लाभ प्राप्त करने तथा साथ साथ वातावरण को प्रदूषण से बचाना।",229,जल
फायर अलार्म (अग्नि सचेतक),"अग्नि सचेतक यन्त्र लोगों को सचेतन देता है जब धूम्र, अग्नि, कार्बन मोनोक्साइड, या अन्य अग्नि से सम्बन्धित या सामान्य अधिसूचना आपात स्थिति का पता चलता है। ये सचेतक धूम्र संसूचकों और ताप संसूचकों से स्वचालित रूप से सक्रिय हो सकते हैं या मैन्युअल कॉल पॉइंट या पुल स्टेशनों जैसे मैन्युअल अग्नि सचेतक सक्रियण उपकरणों के माध्यम से भी सक्रिय हो सकते हैं। सचेतक या तो मोटर चालित घण्टियाँ या दीवार पर लगाने योग्य ध्वनि यन्त्र हो सकते हैं। वे स्पीकर स्ट्रोब भी हो सकते हैं जो सचेतक बजाते हैं, इसके बाद क्या करना है पर स्पष्ट निर्देशों के लिए एक ध्वनि निकासी सन्देश होता है। अग्नि सचेतक ध्वनि यन्त्रोपकरणों को देश और निर्माता के आधार पर कुछ आवृत्तियों और निम्न, मध्यम और उच्च सहित विभिन्न स्वरों पर सेट किया जा सकता है। यूरोप में अधिकांश अग्नि सचेतक यन्त्र वैकल्पिक आवृत्तियों के साथ साइरन की तरह ध्वनि करते हैं। अग्नि सचेतक उपकरणों को विभिन्न वॉल्यूम स्तरों पर भी सेट किया जा सकता है।",163,जल
