title,content,word_count,topic
इन्दिरा गांधी राष्ट्रीय मुक्त विश्वविद्यालय,"इन्दिरा गांधी राष्ट्रीय मुक्त विश्वविद्यालय (संक्षेप में इग्नू‎ -IGNOU) भारतीय संसदीय अधिनियम के द्वारा सितम्बर, 1985 में स्थापित एक केन्द्रीय विश्वविद्यालय है। इसका मुख्य कार्यालय नयी दिल्ली (मैदान गढ़ी) में स्थापित है। यह दुनिया का सबसे बड़ा विश्वविद्यालय है। भारत और अन्य 33 देशों के लगभग 40 लाख विद्यार्थी इसमें अध्ययन करते हैं। यह विश्वविद्यालय भारत में मुक्त और दूरवर्ती अध्ययन का राष्ट्रीय संसाधन केंद्र भी है तथा दूरवर्ती शिक्षा में दुनिया का नायक है।
शिक्षण और अनुसंधान के अलावा, विस्तार और प्रशिक्षण इस विश्वविद्यालय की शैक्षणिक गतिविधियों का मुख्य आधार है।",92,प्रौद्योगिकी
सैप एजी,"इस अनुच्छेद को विकिपीडिया लेख SAP AG  के इस संस्करण  से अनूदित किया गया है।

SAP AG (साँचा:ISIN, FWB: SAP, NYSE: SAP) यूरोप का सबसे बड़ा सॉफ़्टवेयर उद्यम है, जिसका मुख्यालय वाल्डोर्फ जर्मनी में है। यह अपने SAP ERP इंटरप्राईस रिसोर्स प्लानिंग सॉफ्टवेयर के लिए जाना जाता है।",48,प्रौद्योगिकी
जेसन सिल्वा,"जेसन लुइस सिल्वा (जन्म 6 फ़रवरी 1 9 82) एक वेनेजुएलाई अमेरिकी टेलीविजन व्यक्तित्व, फिल्म निर्माता और सार्वजनिक वक्ता हैं। उनका लक्ष्य दर्शन और विज्ञान के बारे में लोगों को उत्तेजित करने के लिए प्रौद्योगिकी का उपयोग करना है| अटलांटिक सिल्वा को ""वायरल वीडियो आयु के ए टिमोथी लेरी"" के रूप में वर्णित करता है। वर्तमान टीवी पर एक पूर्व प्रस्तुतकर्ता सिल्वा, रचनात्मकता, आध्यात्मिकता, प्रौद्योगिकी और मानवता जैसे विषयों पर अंतरराष्ट्रीय स्तर पर व्याख्यान देते हैं, लघु फिल्मों को लिखते हैं और तैयार करते हैं, और नेशनल ज्योग्राफिक के ब्रेन गेम्स को सह-मेजबान करते हैं।",95,प्रौद्योगिकी
रोया रमजानी,रोया रमज़ानी एक ईरानी डिजाइनर और महिला अधिकार प्रचारक हैं।  उन्हें 2017 में बीबीसी के 100 महिला कार्यक्रम के लिए चुना गया था।,23,प्रौद्योगिकी
दुश्चक्र,"दुश्चक्र एक ऐसा काल्पनिक या आभासी चक्र है जिसमें एक बार घुस जाने पर बाहर निकलना सम्भव नहीं होता। इस चक्र में एक तरह का धनात्मक पुनर्भरण काम करता है जो घटनाओं एवं उनके परिणामों को इस चक्र के अन्दर बने रहने के लिए बाध्य करता है। समाज में, अर्थतंत्र, मनोविज्ञान आदि में दुश्चक्र इतस्ततः देखने को मिलता है।",59,प्रौद्योगिकी
अबू धाबी,"अबू धाबी (अरबी: أَبُوظَبِي‎), संयुक्त अरब इमारात (UAE) की राजधानी है। यह वहाँ का दूसरा सर्वाधिक जनसंख्या वाला नगर भी है। अबू धाबी का शासन शेख़ ख़लीफ़ा बिन ज़ैद अल नहयान करते हैं जो UAE के राष्ट्रपति भी हैं।",39,प्रौद्योगिकी
बेंगलुरु,"बेंगलूरु (Bengaluru), जिसका पूर्व नाम बंगलूर या बैंगलोर (Bangalore) भी अनाधिकारिक रूप से प्रचलित हैं, भारत के कर्नाटक राज्य की राजधानी है और भारत का तीसरा सबसे बड़ा नगर और पाँचवा सबसे बड़ा महानगरीय क्षेत्र है। बेंगलूरु नगर की जनसंख्या 84 लाख है और इसके महानगरीय क्षेत्र की जनसंख्या 89 लाख है। दक्षिण भारत में दक्कन के पठार पर 900 मीटर की औसत ऊँचाई पर स्थित यह नगर अपने साल भर के सुहाने मौसम के लिए जाना जाता है, और लोकसंस्कृति में ""भारत का उद्यान नगर"" का उपनाम रखता है। भारत के महानगरों में इसकी ऊँचाई सर्वाधिक है। देश की अग्रणी सूचना प्रौद्योगिकी (IT) निर्यातक के रूप में अपनी भूमिका के कारण बेंगलुरु को व्यापक रूप से भारत की सिलिकॉन वैली या भारत की आईटी राजधानी के रूप में माना जाता है।",132,प्रौद्योगिकी
गूगल विज्ञापन प्रबंधक,"ऐड मैनेजर (Ad Manager) (GAM) एक विज्ञापन सॉफ्टवेयर सेवा के रूप में (SaaS) गूगल द्वारा चलाया जाने वाला एक अनुप्रयोग है।
GAM का उपयोग एक विज्ञापन सर्वर के रूप में किया जा सकता है लेकिन यह प्रकाशकों की समर्पित बिक्री टीम का उपयोग कर ऑनलाइन विज्ञापन की बिक्री प्रक्रिया के प्रबंधन के लिए विभिन्न प्रकार की उपयोगी सुविधाएं प्रदान करते हैं।
यदि प्रकाशक अपनी सभी उपलब्ध विज्ञापन सामग्री को नहीं बेचना चाहता है तो वह GAM में अवशेष सूची के रूप में या तो अन्य एड नेटवर्क या एडसेन्स ऐड्स को चलाने का चुनाव कर सकता है।",97,प्रौद्योगिकी
दयानंद सागर कॉलेज ऑफ़ इंजीनियरिंग,"दयानंद सागर कॉलेज ऑफ इंजीनियरिंग बंगलुरु स्थित एक इंजीनियरिंग महाविद्यालय है। यह 1979 में आर दयानंद सागर द्वारा स्थापित किया गया था और महात्मा गांधी विद्यापीठ ट्रस्ट द्वारा चलाया जाता है। यह कुमारस्वामी लेआउट में एक पहाड़ी पर 28 एकड़ (110,000 वर्गमीटर) भूमि पर स्थित है।",46,प्रौद्योगिकी
पेरोट सिस्टम्स,"पेरोट सिस्टम्स एक सूचना प्रौद्योगिकी सेवा प्रदाता थी जिसकी स्थापना १९८८ में रॉस पेरोट के नेतृत्व में निवेशकों के एक समूह द्वारा की गई थी और यह प्लानो, टेक्सास, संयुक्त राज्य अमेरिका में स्थित थी। पेरोट सिस्टम्स ने स्वास्थ्य देखभाल, सरकार, विनिर्माण, बैंकिंग, बीमा और अन्य उद्योगों में सूचना प्रौद्योगिकी सेवाएं प्रदान कीं। मेडिकल रिकॉर्ड को डिजिटाइज़ करने और स्वचालित करने जैसी सेवाओं के साथ पेरोट सिस्टम्स स्वास्थ्य देखभाल उद्योगों में विशेष रूप से मजबूत था।
२५ से अधिक देशों में कार्यालयों वाला एक फॉर्च्यून १००० निगम, पेरोट सिस्टम्स ने २३,००० से अधिक लोगों को रोजगार दिया था और २००९ में डेल, इंक. द्वारा डेल सर्विसेज के रूप में ३.९ बिलियन डॉलर में अधिग्रहण से पहले इसका वार्षिक राजस्व २.८ बिलियन डॉलर था। नवंबर २०१६ में एनटीटी डेटा द्वारा डेल सर्विसेज का अधिग्रहण कर लिया गया।",136,प्रौद्योगिकी
फ्रांसीस अर्नोल्ड,"फ्रांसिस हैमिल्टन अर्नोल्ड (जन्म 25 जुलाई, 1956)  एक अमेरिकी रासायनिक इंजीनियर और नोबेल पुरस्कार विजेता हैं।  वह कैलिफोर्निया इंस्टीट्यूट ऑफ टेक्नोलॉजी (कैलटेक) में केमिकल इंजीनियरिंग, बायोइंजीनियरिंग और बायोकेमेस्ट्री की लाइनस पॉलिंग प्रोफेसर हैं।  2018 में, उसे इंजीनियर एंजाइमों को निर्देशित विकास के उपयोग के लिए रसायन विज्ञान में नोबेल पुरस्कार से सम्मानित किया गया।",54,प्रौद्योगिकी
स्केल कंप्यूटिंग,"स्केल कंप्यूटिंग एक अमेरिकी प्रौद्योगिकी कंपनी है जो हाइपरकन्वर्ज्ड इन्फ्रास्ट्रक्चर और एज कंप्यूटिंग समाधानों में विशेषज्ञता रखती है। 2007 में स्थापित, कंपनी का मुख्यालय इंडियानापोलिस, इंडियाना में स्थित है।",29,प्रौद्योगिकी
इमरान खान (वेब विकासक),"इमरान खान अलवर, राजस्थान से एक भारतीय शिक्षक और एप विकासक है। वह संस्कृत शिक्षा विभाग में गणित के शिक्षक है, और एक आत्म-शिक्षित कंप्यूटर प्रोग्रामर है। उन्होंने 80 शैक्षिक मोबाइल अनुप्रयोगों और सौ से अधिक वेबसाइट विकसित किये है। वह नवंबर २०१५ में वेम्बली स्टेडियम, लंदन में भारत के प्रधानमंत्री नरेंद्र मोदी द्वारा उनके भाषण में उल्लेखित होने के बाद प्रसिद्ध हुए। मोदी ने कहा, ""मेरा भारत अलवर के इमरान खान में है।""",74,प्रौद्योगिकी
मेक इन इंडिया,"मेक इन इण्डिया अर्थात 'भारत में बनाओ' अभियान भारत सरकार की पहल पर एक बहुआयामी अभियान है, जिसमें भारत को बनाने का अर्थ निहित है। 'मेक इन इण्डिया' अभियान की साफल्य से ही 'मेड इन इण्डिया' अर्थात 'भारत में निर्मित' का स्वर्णिम स्वप्न पूर्ण होगा। इस अभियान का उद्देश्य भारत को विनिर्माण के बड़े केन्द्र के रूप में स्थापित करने का है। यह संकल्प औद्योगिक उत्पादन को बढ़ाकर आर्थिक समृद्धि लाने की धारणा पर आधारित है। इस अभियान का सीधा सा अर्थ है- उत्पादन बढ़ाओ, रोज़गार के अवसर उत्पन्न करो, क्रयशक्ति बढ़ाओ और विकास प्रक्रिया में सबको लाभ दो। इस अभियान से सम्पूर्ण विश्व की लगभग 300 प्रमुख कम्पनियों को जोड़ने की योजना है और इसके लिए मुख्य 25 क्षेत्रों की पहचान कर ली गई है, जिनमें भारत अग्रणी स्थान बना सकता है। मेक इन इंडिया पहल इसकी प्राचीनता को संरक्षित और प्रोत्साहित कर रही है, साथ ही इसकी नवीनता और आधुनिकता को भी मजबूत करेगा। 
इस अभियान को वास्तविक आधार पर सफल बनाने के लिए विदेशी उद्यमियों को अनुकूल वातावरण उपलब्ध कराना अनिवार्य है। इस अभियान का संकल्प देश के विकास के नए रास्ते खोलने में सक्षम है। मार्ग में आने वाली विघ्नों को दूर कर निवेश की नई सम्भावनाओं से यह अभियान वास्तव में, शान्ति, सुरक्षा एवं समृद्धि का मूलमन्त्र सिद्ध होगा।",214,प्रौद्योगिकी
अनुसंधान,"व्यापक अर्थ में अनुसन्धान (Research) किसी भी क्षेत्र में 'ज्ञान की खोज करना' या 'विधिवत गवेषणा' करना होता है तथा पुराने ज्ञान का सत्यापन करना भी होता है। वैज्ञानिक अनुसन्धान में वैज्ञानिक विधि का सहारा लेते हुए जिज्ञासा का समाधान करने की कोशिश की जाती है। नवीन वस्तुओं की खोज और पुरानी वस्तुओं एवं सिद्धान्तों का पुनः परीक्षण करना, जिससे कि नए तथ्य प्राप्त हो सकें, उसे शोध कहते हैं।
शोध उस प्रक्रिया अथवा कार्य का नाम है जिसमें बोधपूर्वक तथ्यों का संकलन कर व्यवस्थित व सावधानीपूर्वक सूक्ष्म बुद्धि से तथ्यों का अवलोकन कर नए तथ्यों या सिद्धांतों का उद्‌घाटन किया जाता है।",103,प्रौद्योगिकी
व्यावहारिक आधुनिकता,"व्यावहारिक आधुनिकता व्यवहार प्रक्रिया और संज्ञानात्मक लक्षणों का एक समूह है तथा इसके बारे में ऐसी मान्यता है कि यह वर्तमान होमो सेपियन्स को अन्य शारीरिक रूप से प्रारंभिक आधुनिक मनुष्यों, इंसानों और नरवानर गण से अलग करता है। अधिकांश विद्वान इस बात पर सहमत हैं कि आधुनिक मानव व्यवहार को अमूर्त सोच, गहन योजना, प्रतीकात्मक व्यवहार (जैसे- कला, अलंकरण), संगीत और नृत्य, बड़े शिकार का शोषण और ब्लेड प्रौद्योगिकी आदि द्वारा चिह्नित किया जा सकता है।
इन व्यवहारों और तकनीकी नवाचारों के पीछे संज्ञानात्मक और सांस्कृतिक आधार हैं जिन्हें विकासवादी और सांस्कृतिक मानवविज्ञानियों द्वारा प्रयोगात्मक और नृवंशविज्ञान संबंधी रूप से प्रलेखित किया गया है। इन मानवीय सार्वभौमिक प्रतिमानों में संचयी सांस्कृतिक अनुकूलन, सामाजिक मानदंड, भाषा और करीबी रिश्तेदारों से परे व्यापक सहकार और सहयोग शामिल हैं।",127,प्रौद्योगिकी
सहकर्मी शिक्षा,,0,प्रौद्योगिकी
सार्वजनिक डोमेन,,0,प्रौद्योगिकी
ई-शिक्षा,"ऑनलाइन शिक्षा प्रणाली (ई-लर्निंग) को सभी प्रकार के इलेक्ट्रॉनिक समर्थित शिक्षा और अध्यापन के रूप में परिभाषित किया जाता है, जो स्वाभाविक तौर पर क्रियात्मक होते हैं और जिनका उद्देश्य शिक्षार्थी के व्यक्तिगत अनुभव, अभ्यास और ज्ञान के सन्दर्भ में ज्ञान के निर्माण को प्रभावित करना है। सूचना एवं संचार प्रणालियां, चाहे इनमें नेटवर्क की व्यवस्था हो या न हो, शिक्षा प्रक्रिया को कार्यान्वित करने वाले विशेष माध्यम के रूप में अपनी सेवा प्रदान करती हैं।
ई-शिक्षा अनिवार्य रूप से कौशल एवं ज्ञान का कंप्यूटर एवं नेटवर्क समर्थित अंतरण है। ई-शिक्षा इलेक्ट्रॉनिक अनुप्रयोगों और सीखने की प्रक्रियाओं के उपयोग को संदर्भित करता है। ई-शिक्षा के अनुप्रयोगों और प्रक्रियाओं में वेब-आधारित शिक्षा, कंप्यूटर-आधारित शिक्षा, आभासी कक्षाएं और डिजीटल सहयोग शामिल है। पाठ्य-सामग्रियों का वितरण इंटरनेट, इंट्रानेट/एक्स्ट्रानेट, ऑडियो या वीडियो टेप, उपग्रह टीवी और सीडी-रोम (CD-ROM) के माध्यम से किया जाता है। इसे खुद ब खुद या अनुदेशक के नेतृत्व में किया जा सकता है और इसका माध्यम पाठ, छवि, एनीमेशन, स्ट्रीमिंग वीडियो और ऑडियो है।
ई-शिक्षा के समानार्थक शब्दों के रूप में सीबीटी (CBT) (कंप्यूटर आधारित प्रशिक्षा), आईबीटी (IBT) (इंटरनेट-आधारित प्रशिक्षा) या डब्ल्यूबीटी (WBT) (वेब-आधारित प्रशिक्षा) जैसे संक्षिप्त शब्द-रूपों का इस्तेमाल किया जा सकता है। आज भी कोई व्यक्ति ई-शिक्षा (ई-लर्निंग/e-learning) के विभिन्न रूपों, जैसे - elearning, Elearning और eLearning (इनमें से प्रत्येक - ईलर्निंग/ईशिक्षा), के साथ-साथ उपर्युक्त शब्दों का भी प्रयोग होता देख सकता है। इ लर्निंग का मुख्यालय बोस्टन, अमेरिका में है।",233,प्रौद्योगिकी
