title,content,word_count,topic
अनुच्छेद 369 (भारत का संविधान),"भारत के संविधान के भाग 21 अनुच्छेद 369 को रखा गया है। भारत के संविधान के भाग 21 का मुख्य विषय “अस्थाई संक्रमणकालीन और विशेष उपबन्ध” है। भारतीय संविधान में भाग 19 में (अनुच्छेद 369 - 392) को जगह दी गई है। भारत के संविधान का अनुच्छेद 369 राज्य सूची के कुछ मामलों के संबंध में संसद को कानून बनाने की अस्थायी शक्ति प्रदान करता है, जैसे कि वे समवर्ती सूची के मामले हों। यह शक्ति संविधान के प्रारंभ से पांच वर्षों के लिए मान्य है और फिर समाप्त हो जाती है।",92,अपराध
देश या क्षेत्र के आधार पर एलजीबीटी अधिकार,"समलैंगिक, उभयलिंगी और ट्रांसजेंडर (LGBT) लोगों को प्रभावित करने वाले अधिकार भिन्न-भिन्न देश या क्षेत्राधिकार पर भिन्न भिन्न होते हैं - समलैंगिकता के लिए मृत्युदंड से लेकर समान लिंग विवाह की कानूनी मान्यता तक।
विशेषत:, 2019 तक, 28 देश समलैंगिक विवाह को मान्यता देते हैं, वे हैं: अर्जेंटीना, ऑस्ट्रेलिया, ऑस्ट्रिया, बेल्जियम, ब्राजील, कनाडा, कोलंबिया, डेनमार्क, इक्वाडोर, फिनलैंड, फ्रांस, जर्मनी, ग्रीनलैंड, आइसलैंड, आयरलैंड, लक्जमबर्ग, माल्टा , मैक्सिको, नीदरलैंड, न्यूजीलैंड, नॉर्वे, पुर्तगाल, दक्षिण अफ्रीका, स्पेन, स्वीडन, ताइवान, यूनाइटेड किंगडम, संयुक्त राज्य अमेरिका और उरुग्वे। इसके विपरीत, 6 देश प्रभावी रूप से समलैंगिक सम्बन्धों पर मृत्युदंड देते हैं, इनमे से तीन एशिया (ईरान, सउदी अरब और यमन) में और तीन  अफ्रीका (नाइजीरिया (उत्तरी राज्यों)), सूडान और सोमालिया (जुबालैंड क्षेत्र) में हैं। इसके अलावा, इन 6 अन्य देशों में मौत की सजा एक संभावित सजा है: अफगानिस्तान, ब्रुनेई, मॉरिटानिया, पाकिस्तान, कतर और संयुक्त अरब अमीरात। इस्लामिक स्टेट (ISIL / ISIS) के खात्मे के बाद इराक को इस सूची से हटा दिया गया है, फिर भी यह सार्वजनिक अभद्रता, वेश्यावृत्ति या अन्य आधार पर कानूनी सजा देने की रिपोर्टों के कारण ""डी फैक्टो(वास्तव में)"" अपराधीकारक देश के रूप में बना हुआ है।
2011 में, संयुक्त राष्ट्र मानवाधिकार परिषद ने एलजीबीटी अधिकारों को मान्यता देते हुए अपना पहला प्रस्ताव पारित किया, जिसके बाद संयुक्त राष्ट्र के उच्चायुक्त के मानवाधिकार कार्यालय ने एलजीबीटी लोगों के अधिकारों के उल्लंघन (जिसमें उनके विरुद्ध घृणा अपराध, समलैंगिक गतिविधि का अपराधीकरण, तथा भेदभाव शामिल है) पर एक रिपोर्ट जारी की। रिपोर्ट जारी होने के बाद, संयुक्त राष्ट्र ने उन सभी देशों से जिन्होंने अभी तक बुनियादी एलजीबीटी अधिकारों की रक्षा करने वाले कानूनों को लागू नहीं किया था, उनसे ऐसा करने का आग्रह किया।",273,अपराध
अन्तरराष्ट्रीय दण्ड विधि,"अन्तरराष्ट्रीय दण्ड विधि (International criminal law) सार्वजनिक अन्तरराष्ट्रीय विधि का वह भाग है जो ऐसे आचरण को रोकने  के उद्देश्य से बनाया गया है जिन्हें गम्भीर नृशंसता माना जाता है। ऐसे अपराधकर्ताओं को अन्तरराष्ट्रीय दण्ड विधि के अनुसार अपने किये अपराध के लिये जिम्मेदार माना जाता है। अन्तरराष्त्रीय विधि के अधीन मुख्य अपराध ये हैं- नरसंहार, युद्ध अपराध, मानवता के प्रति अपराध, तथा आक्रमण का अपराध।",66,अपराध
फ्रांसिस बेकन,"फ्रांसिस बेकन (1561-1626)  फ्रांसिस बेकन का जन्म सन 22 जनवरी 1561 में हुआ था[अंग्रेज़|अंग्रेज]] राजनीतिज्ञ, दार्शनिक और लेखक था। रानी एलिज़बेथ के राज्य में उसके परिवार का बड़ा प्रभाव था। कैंब्रिज और ग्रेज़ इन में शिक्षा प्राप्त की। 1577 में वह फ्रांस स्थित अंग्रेजी दूतावास में नियुक्त हुआ, किंतु पिता सर निकोलस बेकन की मृत्यु के पश्चात् 1579 में वापस लौट आया। उसने वकालत का पेशा अपनाने के लिए कानून का अध्ययन किया। प्रारंभ से ही उसकी रुचि सक्रिय राजनीतिक जीवन में थी। 1584 में वह ब्रिटिश लोकसभा का सदस्य निर्वाचित हुआ। संसद की, जिसमें वह 1614 तक रहा, कार्यप्रणाली में उसका योगदान अत्यंत महत्वपूर्ण रहा। समय समय पर वह महत्वपूर्ण राजनीतिक प्रश्नों पर एलिज़बेथ को निष्पक्ष सम्मतियाँ देता रहा। कहते हैं, अगर उसकी सम्मतियाँ उस समय मान ली गई होतीं तो बाद में शाही और संसदीय अधिकारों के बीच होनेवाले विवाद उठे ही न होते। सब कुछ होते हुए भी उसकी योग्यता का ठीक ठीक मूल्यांकन नहीं हुआ। लार्ड बर्ले ने उसे अपने पुत्र के मार्ग में बाधक मानकर सदा उसका विरोध किया। रानी एलिज़ाबेथ ने भी उसका समर्थन नहीं किया क्योंकि उसने शाही आवश्यकता के लिए संसदीय धनानुदान का विरोध किया था। 1592 के लगभग वह अपने भाई एंथोनी के साथ अर्ल ऑव एसेक्स का राजनीतिक सलाहकार नियुक्त हुआ। किंतु 1601 में, जब एसेक्स ने लंदन की जनता को विद्रोह के लिए भड़काया तो बेकन ने रानी के वकील की हैसियत से एसेक्स को राजद्रोह के अपराध में दंड दिलाया।",242,अपराध
गर्भपात वादविवाद,"गर्भपात वादविवाद, उत्प्रेरित गर्भपात की नैतिक, कानूनी और धार्मिक स्थिति के आसपास चल रहा विवाद है। बहस में शामिल दोनो पक्ष अपने को ""अधिकार-समर्थक"" (प्रो-चॉइस) और ""जीवन-समर्थक "" (प्रो-लाईफ) आंदोलनकारी के रूप में वर्णित करते हैं। ""प्रो-चॉइस"" महिलाओं के अधिकार पर जोर देती है कि वह गर्भ को समाप्त करना चाहती है या नहीं। ""प्रो-लाइफ"" भ्रूण या गर्भ के अधिकार को शब्द के लिए इशारा करने और पैदा होने के अधिकार पर जोर देती है। दोनों शर्तों को मुख्यधारा के मीडिया में भारित भाषा माना जाता है, जहां ""गर्भपात अधिकार"" या ""गर्भपात विरोधी"" जैसी शब्द आम तौर पर पसंद की जाती हैं। प्रत्येक आंदोलन में, विभिन्न परिणामों के साथ, जनता की राय को प्रभावित करने और अपनी स्थिति के लिए कानूनी समर्थन प्राप्त करने की मांग की गई है, जिसमें कुछ गिने चुने गर्भपात विरोधी समर्थकों द्वारा हत्या और आगजनी जैसे हिंसा का उपयोग भी देखा गया है।
कई लोगों के लिए, गर्भपात अनिवार्य रूप से एक नैतिक मुद्दा है, मानव व्यक्तित्व के प्रारंभ, भ्रूण के अधिकार, और अपने शरीर पर एक महिला के अधिकार के संबंध में। गर्भपात विरोधी कानूनों को लागू करने, बनाए रखने और विस्तार करने की मांग करने वाले गर्भपात विरोधी अभियान वाले कुछ देशों में बहस एक राजनीतिक और कानूनी मुद्दा बन गई है, जबकि गर्भपात के अधिकारों का विस्तार करते समय गर्भपात अधिकार प्रचारक ऐसे कानूनों को निरस्त या आसान बनाने की मांग करते हैं। गर्भपात कानून सार्वजनिक क्षेत्र के वित्त पोषण के लिए प्रक्रिया के सीधे निषेध से लेकर क्षेत्राधिकारों के बीच काफी भिन्न होता है। सुरक्षित गर्भपात की उपलब्धता भी दुनिया भर में भिन्न होती है।",264,अपराध
अह्वाज़ी अरब,"अहवाज़ी अरब ईरान में एक अरब समुदाय है जो इराक़ की सीमा के दक्षिण-पश्चिम ईरान में संसाधन संपन्न खुज़ेस्तान प्रांत में रहता है ।  इस क्षेत्र में अरब समुदाय द्वारा Ahwaz के रूप में जाना जाता है, और खुज़ेस्तान की राजधानी है उसके बाद अह्वाज़ । अहवाज़ी अरब ईरान में रहने वाले सबसे बड़े अरब समुदाय हैं।",57,अपराध
केरल सरकार,केरल सरकार  भारत के केरल राज्य की सरकार हैं | राज्यपाल राज्य का संवैधानिक प्रमुख होता है  सरकार का नेतृत्व मुख्यमंत्री और उनकी मंत्रिपरिषद द्वारा किया जाता है तिरुवनंतपुरम केरल की प्रशासनिक राजधानी है केरल के वर्तमान मुख्यमंत्री श्री पिनाराई विजयन हैं .,43,अपराध
बृजभूषण शरण सिंह,"बृजभूषण शरण सिंह भारतीय जनता पार्टी से सोलहवीं लोक सभा के लिए कैसरगंज से पूर्व में सांसद रहे हैं। वे छः बार लोकसभा सदस्य निर्वाचित हो चुके हैं। 
वे बलात्कार और कई जघन्य अपराधों में शामिल है और कई दुष्कर्मों में नामजद हैं। राजनीतिक करियर को कई विवादों से चिह्नित किया गया है, क्योंकि वह उन प्रमुख नामों में से एक थे जिन्हें [बाबरी मस्जिद] के विध्वंस मामले में गिरफ्तार किया गया था और [दाऊद इब्राहिम] गिरोह के निशानेबाजों को शरण देने के लिए आतंकवाद विरोधी कानून टाडा के तहत भी मामला दर्ज किया गया था। हालांकि, बाद में सबूतों के अभाव में उन्हें बरी कर दिया गया था।
वह वर्तमान में भारत की शीर्ष महिला पहलवानों द्वारा यौन उत्पीड़न के आरोपों के केंद्र में हैं, जिसमें 1 नाबालिग सहित 7 महिला पहलवानों ने एक प्राथमिकी शिकायत में उनके खिलाफ गवाही दी है। नई दिल्ली के जंतर मंतर पर चल रहे पहलवानों के विरोध प्रदर्शन में इन पहलवानों में साक्षी मलिक और विनेश फोगट शामिल हैं।",166,अपराध
थ्रिलर (शैली),"थ्रिलर कल्पना की एक शैली है, जिसमें कई, अक्सर अतिव्यापी उपजातियां होती हैं। थ्रिलर्स को उनके द्वारा प्राप्त होने वाली मनोदशाओं द्वारा चित्रित किया जाता है और परिभाषित किया जाता है, जिससे दर्शकों को रहस्य, उत्साह, आश्चर्य, प्रत्याशा और चिंता की भावनाएँ बढ़ जाती हैं। थ्रिलर के सफल उदाहरण अल्फ्रेड हिचकॉक की फिल्में हैं । 
थ्रिलर आम तौर पर दर्शकों को ""अपनी सीटों के किनारे"" पर रखते हैं क्योंकि कथानक चरमोत्कर्ष की ओर बढ़ता है। महत्वपूर्ण जानकारी को छुपाना एक सामान्य तत्व है। रेड हेरिंग्स, प्लॉट ट्विस्ट, अविश्वसनीय नैरेटर और क्लिफहैंगर्स जैसे साहित्यिक उपकरणों का बड़े पैमाने पर उपयोग किया जाता है। एक थ्रिलर अक्सर एक खलनायक द्वारा संचालित कथानक होता है, जिससे वे ऐसी बाधाएँ पेश करते हैं जिन्हें नायक को दूर करना होगा।
थ्रिलर शैली के साथ ओवरलैप होने वाली सबसे आम शैलियों में अपराध, डरावनी और जासूसी कथा शामिल हैं।",143,अपराध
चौथी झारखंड विधानसभा,"2014 झारखंड विधान सभा चुनाव के बाद चौथी झारखंड विधानसभा का गठन किया गया था। भारत में झारखंड राज्य की एकसदनीय राज्य विधानमंडल है। विधान सभा में विधान सभा के 81 सदस्य शामिल हैं, जो सीधे एकल-सीट निर्वाचन क्षेत्रों से चुने जाते हैं।",43,अपराध
राजस्थान पुलिस,"राजस्थान पुलिस भारत के राजस्थान राज्य की नागरिक सेवा है। राजस्थान पुलिस का ध्येय ""अपराधियोँ में डर, आमजन में विश्वास"" है। इसका मुख्यालय जयपुर में स्थित है। राजस्थान पुलिस का स्थापना दिवस 16 अप्रैल को मनाया जाता है।
राजस्थान पुलिस का प्रतीक चिन्ह विजय स्तम्भ है।
राज्य में 8 पुलिस रेंज है एवं 38 पुलिस जिले हैं हाल ही में कोटा को पुलिस कमिश्नरेट घोषित किया गया है।",68,अपराध
कर,"किसी राज्य द्वारा व्यक्तियों या विविध संस्था से जो अपनी आय पर अधिभार या धन लिया जाता है उसे कर या टैक्स कहते हैं। राष्ट्र के अधीन आने वाली विविध संस्थाएँ भी तरह-तरह के कर लगातीं हैं। कर प्राय: धन (money) के रूप में लगाया जाता है किन्तु यह धन के तुल्य श्रम के रूप में भी लगाया जा सकता है। कर दो तरह के हो सकते हैं - प्रत्यक्ष कर (direct tax) या अप्रत्यक्ष कर (indirect tax)। एक तरफ इसे जनता पर बोझ के रूप में देखा जा सकता है वहीं इसे सरकार को चलाने के लिये आधारभूत आवश्यकता के रूप में भी समझा जा सकता है
आधुनिक सरकारों के लिए कराधान (ation), आय का सबसे महत्वपूर्ण स्रोत है। लोकतंत्र में कराधान ही सरकार की राजनीतिक गतिविधियों को स्वरूप प्रदान करता है। कर करदाता द्वारा किया जाने वाला ऐसा अनिवार्य अंशदान है जो कि सामाजिक उद्देश्य जैसे आय व संपत्ति की असमानता को कम करके उच्च रोजगार स्तर प्राप्त करने तथा आर्थिक स्थिरता व वृद्धि प्राप्त करने में सहायक होता है।
कर एक ऐसा भुगतान है जो आवश्यक रुप से सरकार को उसके बनाए गए कानूनों के अनुसार दिया जाता है। इसके बदले में किसी सेवा प्राप्ति की आशा नहीं की जा सकती है।",205,अपराध
पाउडर (टीवी श्रृंखला),पाउडर एक भारतीय अपराध टेलीविजन श्रृंखला है जो 3 जनवरी 2010 से 24 जून 2010 तक सोनी एंटरटेनमेंट टेलीविजन पर प्रसारित हुई,22,अपराध
