title,content,word_count,topic
झारखण्ड सरकार,"झारखण्ड सरकार भारतीय राज्य झारखण्ड और उसके 24 जिलों का सर्वोच्च शासी प्राधिकरण है। इसमें झारखण्ड के राज्यपाल के नेतृत्व में एक कार्यकारी, एक न्यायपालिका और एक विधायी शाखा शामिल है।
भारत के अन्य राज्यों की तरह, झारखण्ड राज्य का प्रमुख राज्यपाल होता है, जिसे केन्द्र सरकार की सलाह पर भारत के राष्ट्रपति द्वारा नियुक्त किया जाता है। राज्यपाल का पद काफी हद तक औपचारिक होता है। मुख्यमंत्री सरकार का मुखिया होता है और उसके पास अधिकांश कार्यकारी शक्तियां निहित होती हैं। राँची झारखण्ड की राजधानी है, और यहां विधानसभा और सचिवालय हैं। रांची में स्थित झारखण्ड उच्च न्यायालय का क्षेत्राधिकार पूरे राज्य पर है। 
झारखण्ड की वर्तमान विधानसभा एक सदनीय है, जिसमें 81 विधानसभा सदस्य शामिल हैं। इसका कार्यकाल पाँच वर्ष है, जब तक कि इसे पहले भंग न किया जाए।",132,पर्यावरण
बलवंतराय मेहता विद्या भवन (ASMA),"बलवंतराय मेहता विद्या भवन अंगूरी देवी शेर सिंह मेमोरियल अकादमी (BMVB : ASMA) एक ग्रेटर कैलाश- II में भारत के दक्षिण जिले नई दिल्ली में स्थित एक वरिष्ठ-माध्यमिक सह-शैक्षिक एकीकृत अंग्रेजी-माध्यम पब्लिक स्कूल है।  स्कूल शेर-ए-पंजाब, लाला लाजपत राय के सपने और सपने को पूरा करता है।   इसे मानव संसाधन विकास मंत्रालय, भारत सरकार द्वारा एकीकृत और समावेशी शिक्षा के क्षेत्र में एक मॉडल स्कूल का दर्जा दिया गया है।",70,पर्यावरण
बीकानेर,"बीकानेर राजस्थान राज्य का एक महानगर है। यह शहर प्रस्तावित नए राज्य मरू प्रदेश की राजधानी के रूप में विकसित किया जा रहा हैं ।
बीकानेर का पुराना नाम जांगल देश था। इसके उत्तर में कुरु और मद्र देश थे, इसलिए महाभारत में जांगल नाम कहीं अकेला और कहीं कुरु और मद्र देशों के साथ जुड़ा हुआ मिलता है। बीकानेर के राजा जंगल देश के स्वामी होने के कारण अब तक ""जंगल धर बादशाह' कहलाते हैं।
बीकानेर राज्य महाभारत काल में जांगल देश था
बीकानेर की भौगोलिक स्तिथि ७३ डिग्री पूर्वी अक्षांश २८.०१ उत्तरी देशंतार पर स्थित है। समुद्र तल से ऊँचाई सामान्य रूप से २४३मीटर अथवा ७९७ फीट है",110,पर्यावरण
माइकल केविन पोलन,"माइकल केविन पोलन (/ˈpɒlən/; जन्म: फरवरी 6, 1955) एक अमेरिकी लेखक और पत्रकार हैं,  जो वर्तमान में नॉन-फिक्शन के अभ्यास के प्रोफेसर और हार्वर्ड विश्वविद्यालय में पहले लुईस के॰ चैन कला व्याख्याता हैं। समवर्ती रूप से, वह विज्ञान और पर्यावरण पत्रकारिता के नाइट प्रोफेसर और यूसी बर्कले ग्रेजुएट स्कूल ऑफ जर्नलिज्म में विज्ञान और पर्यावरण पत्रकारिता में नाइट कार्यक्रम के निदेशक हैं, जहां 2020 में उन्होंने साइकेडेलिक्स के विज्ञान के लिए यूसी बर्कले सेंटर की सह-स्थापना की। जिसमें वह सार्वजनिक-शिक्षा कार्यक्रम का नेतृत्व करते हैं। पोलन को उनकी किताबों के लिए जाना जाता है जो भोजन के सामाजिक-सांस्कृतिक प्रभावों का पता लगाती हैं, जैसे द बॉटनी ऑफ डिज़ायर और द ओमनिवोर्स डिलेमा।",112,पर्यावरण
जमशेदपुर वीमेंस कॉलेज,"जमशेदपुर वीमेंस कॉलेज, झारखंड राज्य के जमशेदपुर १९५३ में स्थापित एक महिला महाविद्यालय है। इसकी स्थापना पेरिन सी मेहता द्वारा की गई थी। १९६२ में रतन टाटा द्वारा महाविद्यालय को इसका अपना परिसर प्राप्त हुआ। यह महाविद्यालय कला, वाणिज्य एवं विज्ञान विषय में डिग्री प्रदान की जाती है। यह महाविद्यालय कोल्हान विश्वविद्यालय से संबद्ध है जिसे राष्ट्रीय मूल्यांकन एवं प्रत्यायन परिषद (NAAC) द्वारा 'ए' ग्रेड प्रदान किया गया है। इस महाविद्यालय को विश्वविद्यालय अनुदान आयोग द्वारा सेंटर फॉर पोटेंशियल ऑफ एक्सीलेंस के केंद्र (CPE) के रूप में पहचान प्राप्त हुई है। अनुसूचित जाति और जनजाति की छात्राओं पर विशेष ध्यान देते हुए यह महाविद्यालय समावेशी शिक्षा प्रदान करता है। झारखंड राज्य विश्वविद्यालय संशोधन कानून २०१७ के अंतर्गत यह महाविद्यालय झारखंड राज्य का पहला महिला विश्वविद्यालय बनने की ओर अग्रसर है। इसके लिये केन्द्र प्रायोजित योजना राष्ट्रीय उच्चतर शिक्षा अभियान (रुसा) द्वारा वित्तीय सहायता दी जा रही है।
झारखंड और बिहार के पहले महिला विश्वविद्यालय का आधार जमशेदपुर में रखा गया। जमशेदपुर वीमेंस कॉलेज को अब जमशेदपुर महिला विश्वविद्यालय के रूप में  में अपग्रेड कर दिया गया। इसके लिए झारखंड राज्य विश्वविद्यालय संशोधन अधिनियम 2018 और झारखंड अधिनियम 06, 2019 की मंजूरी प्राप्त की गई है।",195,पर्यावरण
किरण मजूमदार-शॉ,"किरण मजूमदार-शॉ (कन्नड़: ಕಿರಣ್ ಮಜುಮ್ದರ್ ಷ; जन्म 23 मार्च 1953) एक भारतीय उद्यमी हैं। वे बायोकॉन की अध्यक्ष और प्रबंध निदेशक हैं।
Hurun ने अपनी Global Rich List 2021 मे किरण मजूमदार शॉ को देश की सबसे अमीर महिला उद्यमी बताया था |",43,पर्यावरण
राठौड़ श्रावण,"राठौड श्रावण (जन्म 21 अगस्त 1972) भारत के एक शिक्षाविद, मनोविज्ञानी, समाज विज्ञानी, लेखक, संपादक एवं वर्तमान हिंदी प्राध्यापक शासकीय कनिष्ठ महाविद्यालय इद्रवेल्लि जिला आदिलाबाद तेलंगाना में कार्यरत हैं।",29,पर्यावरण
जॉर्डन विश्वविद्यालय,"जॉर्डन विश्वविद्यालय: (अरबी: الجامعة الأردنية), अक्सर संक्षेप में यूजे, अम्मान, जॉर्डन में स्थित एक राज्य समर्थित विश्वविद्यालय है। 1962 में स्थापित, यह जॉर्डन में उच्च शिक्षा का सबसे बड़ा और सबसे पुराना संस्थान है।
विश्वविद्यालय में देश में सबसे ज्यादा प्रवेश औसत है और इसे जॉर्डन में प्रमुख विश्वविद्यालय माना जाता है।. और अरब दुनिया और मध्य पूर्व में सबसे प्रतिष्ठित माना जाता है। यह अम्मान के विश्वविद्यालय जिले के जुबैहा क्षेत्र में स्थित है। विश्वविद्यालय वर्तमान में लगभग 1400 संकाय कर्मचारियों को रोजगार देता है और इसमें 37,000 से अधिक नामांकित छात्र हैं।.
.",95,पर्यावरण
होप मवानाके,"होप वाकिओ मवानाके (जन्म 1988/1989) एक केन्याई उद्यमी और वैज्ञानिक हैं। उन्हें अफ्रीका के उभरते हुए युवा उद्यमियों में से एक माना जाता है। दिसंबर 2019 में, उसने केन्या में प्लास्टिक प्रदूषण को मिटाने के लिए परित्यक्त प्लास्टिक की बोतलों से घर बनाने के अपने प्रयासों के लिए सुर्खियां बटोरीं थी।",51,पर्यावरण
अभियान्त्रिकी में स्नातक,"बैचलर ऑफ़ इंजीनियरिंग (सामान्यतः संक्षिप्ताक्षर में BE या BEng) एक पूर्वस्नातक की शैक्षिक डिग्री है जिससे ऑस्ट्रेलिया, बांग्लादेश, कनाडा, चीन, डेनमार्क, मिस्र, फिनलैंड, जर्मनी, हांगकांग,भारत, इंडोनेशिया, आयरलैंड, जॉर्डन, कोरिया, लेबनान, मलेशिया, नेपाल, नीदरलैंड, न्यूजीलैंड, नाइजीरिया, नार्वे, पाकिस्तान, सिंगापुर, दक्षिण अफ्रीका, स्वीडन, यूनाइटेड किंगडम, संयुक्त राज्य अमेरिका, वियतनाम, ज़ाम्बिया और जिम्बाब्वे के इंजीनियरिंग विश्वविद्यालयों में [उद्धरण चाहिए]अध्ययनरत छात्रों को तीन से पांच साल के अध्ययन के बाद सम्मानित किया जाता है। विश्व भर में योग्यता का स्वरुप बदलता रहता है अतः यह पेशेवर डिग्री हो भी सकती है और नहीं भी हो सकती है और इसमें इंजीनियरिंग काम का उपक्रम शामिल हो सकता है अथवा नहीं भी हो सकता है। यह पाठ्यक्रम एक राष्ट्रीय पेशेवर संस्था द्वारा मान्यता प्राप्त हो भी सकता हैं या नहीं भी।
कुछ संस्थान बैचलर ऑफ साइंस (बीएससी), बैचलर ऑफ इंजीनियरिंग साइंस (BESc), बैचलर ऑफ साइंस इन इंजीनियरिंग (BSE), या (बैचलर ऑफ एप्लाइड साइंस (BASc) के स्नातक की डिग्री इंजीनियरिंग के पूर्वस्नातक छात्रों को प्रदान करते हैं। उदाहरण के लिए, कनाडा एकमात्र देश है जो स्नातक कर रहे इंजीनियरों को ही BASc की डिग्री प्रदान करता है।
बैचलर इन द आर्ट ऑफ़ इंजीनियरिंग का लैटिन नाम Baccalaureus in Arte Ingeniaria (BAI) (बीएआई) एक आम किस्म की स्नातक डिग्री है। यह आयरलैंड, के डबलिन विश्वविद्यालय के द्वारा प्रदान किया जाता है और अधिक सामान्यतः बैचलर ऑफ इंजीनियरिंग के रूप में संदर्भित किया जाता है, दक्षिण अफ्रीकी विश्वविद्यालयों में इंजीनियरिंग की डिग्री को बीआईएनजी B.Ing. के रूप में उल्लिखित किया जाता है। (Baccalaureus) Ingeniaria)",245,पर्यावरण
व्यवसाय,"व्यवसाय (Business) विधिक रूप से मान्य संस्था है, जो उपभोक्ताओं को कोई उत्पाद या सेवा प्रदान करने के लक्ष्य से निर्मित की जाती है। व्यवसाय को 'कम्पनी', 'इंटरप्राइज' या 'फर्म' भी कहते हैं। पूँजीवादी अर्थव्यवस्थाओं में व्यापार का प्रमुख स्थान है जो अधिकांशत: निजी हाथों में होते हैं और लाभ कमाने के ध्येय से काम करते हैं तथा साथ-साथ स्वयं व्यापार की भी वृद्धि करते हैं। किन्तु सहकारी संस्थाएँ तथा सरकार द्वारा चलायी जानी वाली संस्थाएं प्राय: लाभ के बजाय अन्य उद्देश्यों की पूर्ति के लिये बनायी गयी होती हैं। 
हम व्यावसायिक वातावरण में रहते हैं। यह समाज का एक अनिवार्य अंग है। यह व्यावसायिक क्रियाओं के विस्तृत नेटवर्क के माध्यम से विभिन्न प्रकार की वस्तुएं तथा सेवाएं उपलब्ध कराकर हमारी आश्यकताओं की पूर्ति करता है। 
अन्य शब्दों में - व्यवसाय एक ऐसा है जिसमें अर्थोपार्जन के बदले वस्तुओं अथवा सेवाओं का उत्पादन, विक्रय और विनिमय होता है एवं या कार्य नियमित रूप से किया जाता है। ""व्यवसाय में वे संपूर्ण मानवीय क्रियाएं आ जाती हैं, जो वस्तुओं तथा सेवाओं के उत्पादन एवं वितरण के लिए की जाती है, जिनका उद्देश्य अपनी सेवा
ओं द्वारा समाज की आवश्यकताओं की पूर्ति करके लाभ अर्जन करना होता है।",196,पर्यावरण
प्रफुल्ला सामंतारा,"प्रफुल्ला सामंतारा (जन्म 1952) ओडिशा के एक भारतीय पर्यावरण कार्यकर्ता हैं। 
वह नियमगिरि पहाड़ी क्षेत्र में बॉक्साइट खनन की योजनाओं के विरोध में डंगरिया कांधा के स्वदेशी लोगों के प्रवक्ता रहे हैं।  2013 के सुप्रीम कोर्ट के एक फैसले ने खनन योजनाओं को रोक दिया था। सामंतारा को 2017 में गोल्डमैन पर्यावरण पुरस्कार से सम्मानित किया गया था।",58,पर्यावरण
आन्ध्र विश्वविद्यालय,"आन्ध्र विश्वविद्यालय या आन्ध्र विश्व कला परिषद  (तेलुगु: ఆంధ్ర యూనివర్శిటి / ఆంధ్ర విశ్వకళాపరిషత్), विशाखापट्ट्नम, पूर्व तटीय आन्ध्र प्रदेश में स्थित भारत के प्राचीनतम प्रतिष्ठित विश्वविद्यालयों में से एक है। इसकी स्थापना १९२५ में की गई थी। तब इस विश्वविद्यालय ने मद्रास विश्वविद्यालय के साथ एफिलिएशन योग्यताएं बांटीं थीं।
यह एक सार्वजनिक विश्वविद्यालय है। यह 1926 में स्थापित किया गया।  यह 250 हेक्टेयर (620 एकड़) के परिसर में स्थित है।",69,पर्यावरण
फ्रांस की रूपरेखा,"निम्नलिखित रूपरेखा, फ्रांस का एक अवलोकन और सामयिक गाइड के रूप में है:
फ़्रांस – पश्चिमी यूरोप के कई विदेशी क्षेत्रों का एक देश है। मेट्रोपॉलिटन फ्रांस भूमध्य सागर से अंग्रेजी चैनल और उत्तरी सागर तक और राइन से अटलांटिक महासागर तक फैला हुआ है। इसके आकार से, इसे अक्सर फ्रेंच में 'षट्कोण' (""द हेक्सागोन"") के रूप में जाना जाता है।",61,पर्यावरण
रिलायन्स इण्डस्ट्रीज,"रिलायंस इंडस्ट्रीज़ लिमिटेड (अंग्रेज़ी: Reliance Industries Limited) एक भारतीय संगुटिका नियंत्रक कंपनी है, जिसका मुख्यालय मुंबई, महाराष्ट्र में स्थित है। रिलायंस पूरे भारत में ऊर्जा, पेट्रोकेमिकल, कपड़ा, प्राकृतिक संसाधन, खुदरा और दूरसंचार के क्षेत्र में कारोबार करती है। रिलायंस भारत की सबसे अधिक लाभदायक कंपनियों में से एक है, तथा बाजार पूंजीकरण के आधार पर भारत की सबसे बड़ी सार्वजनिक रूप से कारोबार करने वाली कंपनी है एवं राजस्व के मामले में भी यह भारत की सबसे बड़ी कंपनी है। 
22 जून 2020 को बीएसई पर बाजार पूंजीकरण, 11,43,667 करोड़ को पार करने के बाद, रिलायंस इंडस्ट्रीज बाजार पूंजीकरण में $ 150 बिलियन से अधिक पार करने वाली पहली भारतीय कंपनी बन गयी। 
2022 में फॉर्च्यून ग्लोबल ५०० लिस्ट द्वारा कंपनी को विश्व के सबसे बड़े कारपोरेशन की सूची में 104 वां स्थान प्राप्त हुआ। 
यह 2,36,000 से अधिक कर्मचारियों के साथ भारत में दसवां सबसे बड़ा नियोक्ता भी है | 31 मार्च, 2022 तक RIL का बाजार पूंजीकरण US$243 बिलियन था | रिलायंस इंडस्ट्रीज़ लिमिटेड वर्तमान में 2023 की फॉर्च्यून लिस्ट में 88वें स्थान पर है। यह ""विश्व की सबसे बड़ी कंपनियों"" की ग्लोबल 500 की लिस्ट है। रिलायंस वर्तमान में भारत की सबसे बड़ी निजी क्षेत्र की कंपनी है।[50]",201,पर्यावरण
