title,content,word_count,topic
हैकनी बरो,"""हैकनी का लंदन बरो"" (/ˈhækni/HAK-nee  इनर लंदन, इंग्लैंड में एक लंदन बरो है। हैकनी का ऐतिहासिक और प्रशासनिक केंद्र मारे स्ट्रीट है, जो चेरिंग क्रॉस से 5 मील (8 किमी) उत्तर-पूर्व में स्थित है। इस नगर का नाम इसके प्रमुख जिले हैकनी के नाम पर रखा गया है। नगर के दक्षिणी और पूर्वी हिस्सों को लोकप्रिय रूप से पूर्वी लंदन का हिस्सा माना जाता है, जो लंदन के पारंपरिक पूर्वी छोर के कुछ हिस्से और उत्तर-पश्चिम में उत्तरी लंदन तक फैला हुआ है। इसकी जनसंख्या 281,120 होने का अनुमान है।
ग्रेटर लंदन अथॉरिटी द्वारा जारी लंदन योजना वैधानिक निगरानी, जुड़ाव और संसाधन आवंटन उद्देश्यों के लिए उप-क्षेत्रों को पूरे नगर आवंटित करती है। इस योजना का सबसे हालिया (2011) पुनरावृत्ति हैकनी को 'पूर्व' उप-क्षेत्र को सौंपता है, जबकि 2008 और 2004 संस्करणों ने क्रमशः ""उत्तर"" और ""पूर्व"" उप-क्षेत्रों को नगर सौंपा है। 
आधुनिक नगर का गठन 1965 में हैकनी के मेट्रोपॉलिटन बरो को स्टोक न्यूिंगटन और शोर्डिच के बहुत छोटे मेट्रोपॉलिटन बरो के साथ विलय करके किया गया था। हैकनी पश्चिम में इस्लिंगटन, उत्तर में हरिंगी, उत्तर-पूर्व में वाल्थम वन, पूर्व में न्यूहैम, दक्षिण-पूर्व में टॉवर हैमलेट्स और दक्षिण-पश्चिम में लंदन शहर से घिरा है। हैकनी 2012 में लंदन ओलंपिक के मेजबान नगरों में से एक था, क्वीन एलिजाबेथ ओलंपिक पार्क के कई स्थल इसकी सीमाओं के भीतर आते थे।",220,अपराध
विश्व शांति,"विश्व शान्ति पृथ्वी पर सभी लोगों और राष्ट्रों के भीतर और उनके बीच शान्ति की एक आदर्श स्थिति की अवधारणा है।  विभिन्न संस्कृतियों, धर्मों, दर्शन और संगठनों की अलग-अलग अवधारणाएँ हैं कि ऐसा राज्य कैसे आएगा।
विभिन्न धार्मिक और धर्मनिरपेक्ष संगठनों ने मानवाधिकारों, प्रौद्योगिकी, शिक्षा, अभियान्त्रिकी, चिकित्सा, या राजनय को सम्बोधित करके विश्व शान्ति प्राप्त करने का घोषित उद्देश्य सभी प्रकार की लड़ाई के अन्त के रूप में उपयोग किया है।  1945 से, संयुक्त राष्ट्र और इसकी संयुक्त राष्ट्र सुरक्षा परिषद के स्थायी सदस्य (चीन, फ़्रान्स, रूस, यूनाइटेड किंगडम और संयुक्त राज्य अमेरिका) युद्ध या युद्ध की घोषणा के बिना संघर्षों को हल करने के उद्देश्य से काम कर रहे हैं। बहरहाल, तब से राष्ट्रों ने कई सैन्य संघर्षों में प्रवेश किया है।",123,अपराध
जेफरी डामर,"जेफरी लियोनेल डेमर (/ ˈdɑːmər /; 21 मई, 1960 - 28 नवंबर, 1994), जिसे मिल्वौकी नरभक्षी या मिल्वौकी मॉन्स्टर के रूप में भी जाना जाता है, एक अमेरिकी सीरियल किलर और यौन अपराधी था, जिसने बीच में सत्रह पुरुषों और लड़कों की हत्या और विघटन किया था। 1978 और 1991.उनकी बाद की कई हत्याओं में नेक्रोफिलिया, नरभक्षण, और शरीर के अंगों का स्थायी संरक्षण शामिल था - आमतौर पर कंकाल के सभी या कुछ हिस्से। 
हालांकि उन्हें सीमा रेखा व्यक्तित्व विकार, स्किज़ोटाइपल व्यक्तित्व विकार, और एक मानसिक विकार का निदान किया गया था, डेहमर को उनके परीक्षण में कानूनी रूप से समझदार पाया गया था। उन्हें विस्कॉन्सिन में की गई सोलह हत्याओं में से पंद्रह के लिए दोषी ठहराया गया था और 17 फरवरी, 1992 को पंद्रह आजीवन कारावास की सजा सुनाई गई थी। डेहमर को बाद में 1978 में ओहियो में किए गए एक अतिरिक्त हत्या के लिए आजीवन कारावास की सोलहवीं सजा सुनाई गई थी।
28 नवंबर, 1994 को, डेहमर को पोर्टेज, विस्कॉन्सिन में कोलंबिया सुधार संस्थान में एक साथी कैदी क्रिस्टोफर स्कार्वर द्वारा पीट-पीटकर मार डाला गया था।",181,अपराध
हिंदू अमेरिकन फाउंडेशन,"हिंदू अमेरिकन फाउंडेशन ( abbr. HAF ) 2003 में स्थापित एक अमेरिकी हिंदू गैर-लाभकारी वकालत समूह है। एचएएफ किसी भी प्रकार के धार्मिक भेदभाव के खिलाफ संयुक्त राज्य अमेरिका में हिंदू निवासियों और छात्रों के अधिकारों की रक्षा करना अपना मुख्य उद्देश्य मानता है   । एचएएफ को अक्सर अमेरिका में एक प्रमुख हिंदू वकालत संगठन माना जाता है , और यह संयुक्त राज्य अमेरिका में स्थित पेशेवर संरचना और पूर्णकालिक कर्मचारियों वाले पहले हिंदू संगठनों में से एक है। 
एचएएफ की सक्रियता के क्षेत्रों में हिंदू मुद्दों को उजागर करना, संयुक्त राज्य अमेरिका में हिंदू अधिकारों की रक्षा करना, योग के सांस्कृतिक विनियोग का विरोध करना और हिंदू समुदाय को गलत तरीके से लक्षित करने वाले किसी भी कानून का विरोध करना शामिल है।  जबकि कुछ विद्वानों ने नोट किया है कि एचएएफ ने हिंदू धर्म की सहिष्णुता और धार्मिक बहुलवाद पर ध्यान केंद्रित किया है , अन्य ने दावा किया है कि एचएएफ की सक्रियता हिंदू राष्ट्रवाद के साथ संरेखित है और अक्सर अकादमिक स्वतंत्रता पर आघात करती है।",170,अपराध
सेन पैट्रिक ओ'माली,"सेन पैट्रिक ओ'माली, जीसीआईएच ओ एफ एफ कैप (जन्म 2 9, 1 9 44) कैथोलिक चर्च के एक अमेरिकी कार्डिनल हैं जो बोस्टन के आर्कबिशप के रूप में सेवा करते हैं। ओ'मॅली ऑर्डर ऑफ़ फ्यूरर्स माइनर कैपचिन का सदस्य है, जिसे आमतौर पर कैपचिन के नाम से जाना जाता है।
 ओ'मॅली को 2006 में कार्डिनेट के लिए बढ़ाया गया था। पोप बेनेडिक्ट XVI के सफल होने के लिए उन्हें पपीबिल दावेदार माना गया था, जिन्होंने 28 मार्च 2013 को इस्तीफा दे दिया था, जब तक पोप फ्रांसिस को 13 मार्च, 2013 को चुना नहीं गया था।
 13 अप्रैल 2013 को, पोप फ्रांसिस ने कार्डिनल ओ-माल्ले को कार्डिनल एडवाइजर्स के आठ कार्डिनल्स में से एक के रूप में नियुक्त किया ताकि पोप कैथोलिक चर्च को संचालित कर सके और इसके केंद्रीय प्रशासन को सुधार सके।

 14 जनवरी 2017 को, पोप फ्रांसिस ने विश्वास की सिद्धता के लिए मण्डली के पूर्ण बोर्ड सदस्य के रूप में ओ'मले को नियुक्त किया।",158,अपराध
यूनिसिस,"यूनिसिस कॉरपोरेशन (NYSE: UIS), सूचना प्रौद्योगिकी सेवाओं और कार्यक्रमों का एक वैश्विक प्रदाता है, जिसका मुख्यालय संयुक्त राज्य अमेरिका के पेंसिल्वेनिया के बेल ब्लू में है और, डेलावेयर में निगमित है।",31,अपराध
आम्रपाली,"आम्रपाली बौद्ध काल में वैशाली के वृज्जिसंघ की इतिहास प्रसिद्ध लिच्छवि राजनृत्यांगना थी। इनका एक नाम 'अम्बपाली' या 'अम्बपालिका' भी है। आम्रपाली अत्यन्त सुन्दर थी और कहते हैं जो भी उसे एक बार देख लेता वह उसपर मुग्ध हो जाता था। अजातशत्रु उसके प्रेमियों में था और उस समय के उपलब्ध सहित्य में अजातशत्रु के पिता बिंबसार को भी गुप्त रूप से उसका प्रणयार्थी बताया गया है। कुछ साहित्य में ये भी वर्णित है की अजातशत्रु पुत्र और बिंबिसार के पौत्र उदयभद्र को भी आम्रपाली से प्रणय करने का सौभाग्य प्राप्त हुआ था।[1]  आम्रपाली को लेकर भारतीय भाषाओं में बहुत से काव्य, नाटक और उपन्यास लिखे गए हैं।
अंबपाली बुद्ध के प्रभाव से उनकी शिष्या हुई और उसने अनेक प्रकार के दान से बौद्ध संघ का महत् उपकार किया। उस युग में राजनर्तकी का पद बड़ा गौरवपूर्ण और सम्मानित माना जाता था। साधारण जन तो उस तक पहुँच भी नहीं सकते थे। समाज के उच्च वर्ग के लोग भी उसके कृपाकटाक्ष के लिए लालायित रहते थे। कहते हैं, भगवान तथागत ने भी उसे ""आर्या अंबा"" कहकर संबोधित किया था तथा उसका आतिथ्य ग्रहण किया था। धम्मसंघ में पहले भिक्षुणियाँ नहीं ली जाती थीं, यशोधरा को भी बुद्ध ने भिक्षुणी बनाने से मना कर दिया था, किंतु आम्रपाली की श्रद्धा, भक्ति और मन की विरक्ति से प्रभावित होकर नारियों को भी उन्होंने संघ में प्रवेश का अधिकार प्रदान किया।",228,अपराध
वॉल स्ट्रीट,"वॉल स्ट्रीट एक मार्ग है जो लोवर मैनहट्टन, न्यूयॉर्क सिटी, न्यूयॉर्क, USA में है। यह मार्ग ब्रॉडवे से पूर्व दिशा में ईस्ट नदी की ओर इस आर्थिक जिले के ऐतिहासिक केन्द्र से होते हुए साउथ स्ट्रीट तक जाता है। यह न्यूयॉर्क स्टॉक एक्सचेंज का पहला स्थायी स्थल है; कुछ समय बाद वॉल स्ट्रीट, आसपास के भौगोलिक स्थल का नाम बन गया। वॉल स्ट्रीट, अमेरिकी वित्तीय उद्योग के ""प्रभावशाली वित्तीय हितों"" के लिए संक्षेपीकरण भी है (या एक लक्षणालंकार), जो न्यूयॉर्क शहर क्षेत्र में केंद्रित है। वॉल स्ट्रीट द्वारा बल प्रदत्त, न्यूयॉर्क सिटी दुनिया की वित्तीय राजधानी बनने के लिए लंदन के साथ होड़ लेती है और यह न्यूयॉर्क स्टॉक एक्सचेंज, का गृह है, जो अपनी सूचीबद्ध कंपनियों के बाजार पूंजीकरण के आधार पर दुनिया का सबसे बड़ा स्टॉक एक्सचेंज है।
कई प्रमुख अमेरिकी स्टॉक और अन्य केन्द्रों का मुख्यालय वॉल स्ट्रीट और आर्थिक जिले में है, जिसमें शामिल हैं NYSE, NASDAQ, AMEX, NYMEX और NYBOT.",155,अपराध
नॉटिंघम,"नॉटिंघम आईपीए: /ˈnɒtɪŋəm/, यूनाइटेड किंगडम के इस्ट मिडलैंड्स क्षेत्र में स्थित एक शहर और एकात्मक प्राधिकरण इलाका है। यह नॉटिंघमशायर के सेरेमोनियल काउंटी में स्थित है और आठ सदस्यों के इंग्लिश कोर सिटीज ग्रुप का एक सदस्य है। हालांकि ऐतिहासिक दृष्टि से नॉटिंघम शहर की सीमा काफी कम है जो अपेक्षाकृत 288,700 की कम जनसंख्या है, व्यापक नॉटिंघम शहरी क्षेत्र की आबादी 667,000 है और यह यूनाइटेड किंगडम शहरी क्षेत्र का सातवां सबसे बड़ा क्षेत्र है और लिवरपूल और शेफील्ड के बीच में इसकी रैंकिंग की जाती है।
यथा 2004 यूरोस्टेट के लार्जर अर्बन ज़ोन ने इस क्षेत्र की आबादी 825,600 सूचीबद्ध की. रॉबिन हुड की कथाओं के साथ अपने संबध के चलते नॉटिंघम को ख्याति मिली और औद्योगिक क्रांति के दौरान फीता निर्माण और साइकल उद्योगों के लिए दुनिया भर में इसे पहचान मिली. इसे 1897 में रानी विक्टोरिया के डायमंड जुबली सेलेब्रेशन के हिस्से के रूप में शहरी सूची में शामिल किया गया और तब से आधिकारिक तौर पर इसे नॉटिंघम शहर का नाम दिया गया।",168,अपराध
एफ मूवीज,"एफमूवीज (FMovies) फाइल स्ट्रीमिंग वेबसाइटों का समूह है जो लिंक और एम्बेडेड वीडियो होस्ट करता है, जिससे उपभोक्ता मुफ्त में फिल्में देख या डाउनलोड कर सकते हैं। ये साइटें कॉपीराइट उल्लंघन और पाइरेसी के आरोपों में विभिन्न क्षेत्राधिकारों में कानूनी कार्रवाई का विषय रही हैं।",45,अपराध
धड़ निरावरण,धड़ निरावरण (टॉपलेस) उस अवस्था को कहते हैं जिसमें महिलाएँ कमर से ऊपर कोई वस्त्र धारण नहीं करती हैं। इस अवस्था में वे अपने स्तन उजागर करती हैं।,28,अपराध
झूठ,"झूठ (जिसे वाक्‌छल या असत्यता भी कहा जाता है) एक ज्ञात असत्य है जिसे सत्य के रूप में व्यक्त किया जाता है।

SACH, एक असत्य बयान के रूप में दिया गया एक प्रकार का धोखा है, जो विशेष रूप से किसी को धोखा देने की मंशा से बोला जाता है और प्रायः जिसका उद्देश्य होता है किसी राज़ या प्रतिष्ठा को बरकरार रखना, किसी की भावनाओं की रक्षा करना या सजा या किसी के द्वारा किए गए कार्य की प्रतिक्रिया से बचना. झूठ बोलने का तात्पर्य कुछ ऐसा कहने से होता है जो व्यक्ति जानता है कि गलत है या जिसकी सत्यता पर व्यक्ति ईमानदारी से विश्वास नहीं करता और यह इस इरादे से कहा जाता है कि व्यक्ति उसे सत्य मानेगा. एक झूठा व्यक्ति ऐसा व्यक्ति है जो झूठ बोल रहा है, जो पहले झूठ बोल चुका है, या जो आवश्यकता ना होने पर भी आदतन झूठ बोलता रहता है।
झूठ बोलने को मौखिक या लिखित संचार में आमतौर पर धोखे को संदर्भित करने के लिए किया जाता है। धोखाधड़ी के अन्य रूप जैसे, छद्म वेश बनाना या जालसाजी को आम तौर पर झूठ नहीं माना जाता है, हालांकि इसमें अंतर्निहित आशय वही हो सकता है। हालांकि, एक सच्चे बयान को भी धोखा देने के लिए इस्तेमाल किया जा सकता है। इस स्थिति में, झूठ माने जाने वाले किसी भी व्यक्तिगत बयान की सत्यता के बजाए इसमें एक समग्र रूप से बेईमान होने का इरादा होता है।
गंभीर झूठ (जैसे झूठी गवाही, धोखाधड़ी, मानहानि) कानून द्वारा सजा योग्य हैं।",250,अपराध
