title,content,word_count,topic
अजरबैजान के वन्यजीव,"अजरबैजान का वन्यजीवन इसके वनस्पतियों और जीवों और उनके प्राकृतिक आवास से मिलकर बना  हैं । 

अज़रबैजान में जीव-जंतुओं का प्रतीक  करबख घोड़ा ( अज़ेरी : Qarabağ Atı )है, जिसे  पहाड़-मैदान दौड़ और घुड़सवारी में  उपयोग लिया जाता है  और यह केवल अज़रबैजान में ही पाया जाता है। यह प्राचीन नस्लों में से एक है, जिसकी प्राचीन दुनिया में वंशावली है। घोड़े को मूल रूप से ५ वीं शताब्दी में करबख क्षेत्र में विकसित किया गया था और इसे इसके नाम पर रखा गया था।  
देश के भीतर विभिन्न प्रकार के जानवरों का प्राकृतिक आवास बहुत अलग है। कुछ प्रजातियां विशेष प्रतिबंधित क्षेत्रों (झीलों, पहाड़ी क्षेत्रों के कुछ हिस्सों) को आबाद करती हैं, जबकि अन्य पूरे देश में फैली हुई हैं। उदाहरण के लिए, अज़रबैजान के क्षेत्र में कहीं भी पासरीफ़ोर्मीज़ को पाया जा सकता है। प्रोटोझोआ परजीवी भी देश के सभी क्षेत्रों में मिलते  हैं, जो वाहक जानवरों (मवेशी, मुर्गी, आदि) के प्राकृतिक आवास पर निर्भर करता है। )। स्तनधारियों में, जेरेन गज़ेल्स मैदानी क्षेत्रों को आबाद करते हैं, कोकेशियान बकरी प्रमुख काकेशस क्षेत्रों में निवास करती है, पक्षियों की अधिकांश प्रजातियाँ जंगलों में पाई जा सकती हैं, कुछ पानी के घाटियों में। कीट विभिन्न कृषि क्षेत्रों पर कब्जा कर लेते हैं, जबकि अन्य केवल परिभाषित बायोटोप्स को आबाद करते हैं। 
अजरबैजान में फर और खुर वाले जानवरों के संरक्षण के लिए कई प्राकृतिक संरक्षण बनाए गए हैं और शिकार नियमों को लागू किया गया है।",237,जल
मुरुड जंजीरा,मुरुड (Murud) या मुरुड जंजीरा (Murud Janjira) भारत के महाराष्ट्र राज्य के रायगढ़ ज़िले में स्थित एक नगर है। मुरुड अलीबाग से 45 किलोमीटर की दूरी पर स्थित है और अपने द्वीप पर स्थित दुर्ग के लिए जाना जाता है। यह अपने बालूतट (बीच) के लिए भी एक पर्यटक आकर्षण है।,51,जल
आईबीएम,"आईबीएम (अंग्रेज़ी: International Business Machines Corporation (IBM), अनुवाद: अंतरराष्ट्रीय व्यापार मशीन निगम) एक अमेरिकी बहुराष्ट्रीय सूचना प्रौद्योगिकी कंपनी है। इसका मुख्यालय न्यूयॉर्क,संयुक्त राज्य अमेरिका में स्थित है। ये कंपनी 170 से भी ज्यादा देशों में अपनी सेवाएं प्रदान करती है। इस कंपनी की शुरुआत 1911 में कम्प्यूटिंग-टैबुलैटिंग-रिकॉर्डिंग कंपनी के नाम से हुआ था, जिसे 1924 में बदल कर इंटरनेशनल बिजनेस मशीन कर दिया गया था।
इसे बिग ब्लू नाम से भी जाना जाता है। ये दुनिया की सबसे अधिक कर्मचारियों वाली कंपनी में से एक है, जिसमें 2017 के अनुसार लगभग 3,80,000 कर्मचारी काम कर रहे थे। इन्हें आईबीमर्स के रूप में जाना जाता है। इनके कर्मचारियों को अब तक 5 नोबल पुरस्कार, 6 टुरिन्ग पुरस्कार, तकनीकी के क्षेत्र में 10 और विज्ञान के क्षेत्र में 5 राष्ट्रीय पदक भी मिल चुका है।
इन्टरनेशनल बिजनेस मशीन",136,जल
विजयनगर साम्राज्य,"विजयनगर साम्राज्य (संस्कृत: विजयनगरसाम्राज्यम् ) (जिसे कर्णाट साम्राज्य और पुर्तगालियों द्वारा बिसनेगर साम्राज्य भी कहा जाता था) भारत के डेक्कन(दक्खन) क्षेत्र में स्थित था।  यह 1336 में संगमा राजवंश के दो भाई हरिहर राय और बुक्का राय, द्वारा स्थापित किया गया था।
विजयनगर साम्राज्य (1336-1646) मध्यकालीन का एक साम्राज्य था। इसके राजाओं ने 310 वर्ष तक राज किया। इसका वास्तविक नाम कर्नाटक साम्राज्य था। इसकी स्थापना हरिहर और बुक्का राय नामक दो भाइयों ने की थी। पुर्तगाली इस साम्राज्य को बिसनागा राज्य के नाम से जानते थे।
लगभग सवा दो सौ वर्ष के उत्कर्ष के बाद सन 1565 में इस राज्य की भारी पराजय हुई और राजधानी विजयनगर को जला दिया गया। उसके पश्चात क्षीण रूप में यह 70 वर्ष और चला। राजधानी विजयनगर के अवशेष आधुनिक कर्नाटक राज्य में हम्पी शहर के निकट पाये गये हैं और यह एक विश्व विरासत स्थल है। पुरातात्त्विक खोज से इस साम्राज्य की शक्ति तथा धन-सम्पदा का पता चलता है।
राजा कृष्णदेवराय ने जाम्बवती कल्याणम नामक एक साहित्यिक किताब लिखी । विजयनगर साम्राज्य का नाम  वासु चरितमु नामक एक साहित्यिक रचना में मिलता है ।",182,जल
अक्षय ऊर्जा,"अक्षय उर्जा या नवीकरणीय ऊर्जा (अंग्रेजी:renewable energy) में वे सारी उर्जा शामिल हैं जो प्रदूषणकारक नहीं हैं तथा जिनके स्रोत का क्षय नहीं होता, या जिनके स्रोत का पुनः-भरण होता रहता है। सौर ऊर्जा, पवन ऊर्जा, जलविद्युत उर्जा, ज्वार-भाटा से प्राप्त उर्जा, बायोगैस, जैव इंधन आदि नवीनीकरणीय उर्जा के कुछ उदाहरण हैं। भारत में है",55,जल
संगम काल,"संगम साहित्य समाज (तमिल : சங்ககாலம், संगकालम्) दक्षिण भारत (कृष्णा एवं तुंगभद्रा नदी के दक्षिण में स्थित क्षेत्र) के प्राचीन इतिहास का एक कालखण्ड है। यह कालखण्ड ईसापूर्व तीसरी शताब्दी से लेकर चौथी शताब्दी तक पसरा हुआ है। यह नाम 'संगम साहित्य' के नाम पर पड़ा है। संगम साहित्य, द्रविड़ साहित्य के शुरुआती नमूने थे। 
संगम से अभिप्राय तमिल कवियों के संगम या सम्मलेन से है जो संभवतः किन्हीं प्रमुखों या राजाओं के संरक्षण में ही आयोजित होता था। आठवीं सदी ई. में तीन संगमों का वर्णन मिलता है। पाण्ड्य राजाओं द्वारा इन संगमों को शाही संरक्षण प्रदान किया गया।
तमिल किंवदन्तियों के अनुसार, प्राचीन दक्षिण भारत में तीन संगमों (तमिल कवियों का समागम) का आयोजन किया गया था, जिसे 'मुच्चंगम' कहा जाता था। तीन संगम ये थे- प्रमुख संगम, मध्य संगम और अंतिम संगम ।  इतिहासकार तीसरे संगम काल को ही 'संगम काल' कहते हैं और  पहले दो संगमों को 'पौराणिक' मानते हैं।
माना जाता है कि प्रथम संगम मदुरै में आयोजित किया गया था। इस संगम में देवता और महान संत सम्मिलित हुए थे। किन्तु इस संगम का कोई साहित्यिक ग्रन्थ उपलब्ध नहीं है। द्वितीय संगम कपाटपुरम् में आयोजित किया गया था, और इस संगम का 'तोलकाप्पियम्' नामक एकमात्र ग्रंथ उपलब्ध है जो तमिल व्याकरण ग्रन्थ है। तृतीय संगम भी मदुरै में हुआ था। इस संगम के अधिकांश ग्रंथ नष्ट हो गए थे। इनमें से कुछ सामग्री समूह ग्रंथों या महाकाव्यों के रूप में उपलब्ध है।
600 ई.पू. से 300 ई.पू. के बीच की अवधि, तमिलकम में पांड्य, चोल और चेर के तीन तमिल राजवंशों और कुछ स्वतंत्र सरदारों, वेलिर का शासन था।",265,जल
पाकिस्तान,"पाकिस्तान (उर्दू: پاکِسْتان, अंग्रेज़ी: Pakistan) (अधिकारिक नाम: पाकिस्तान इस्लामी गणराज्य) भारत के पश्चिम में स्थित एक इस्लामी गणराज्य है। २३.१ करोड़ की आबादी के साथ ये दुनिया का पाँचवी बड़ी आबादी वाला देश है। पाकिस्तान में दुनिया की दूसरी सबसे बड़ी मुस्लिम आबादी है। यह 8,81,913 वर्ग किलोमीटर (3,40,509 वर्ग मील) क्षेत्र में फैला 33 वाँ सबसे बड़ा देश है। यहाँ की प्रमुख भाषाएँ उर्दू, पंजाबी, सिंधी, बलूची और पश्तो हिंदी हैं। पाकिस्तान की राजधानी इस्लामाबाद और अन्य महत्वपूर्ण नगर कराची व लाहौर रावलपिंडी हैं। पाकिस्तान के चार सूबे हैं: पंजाब, सिंध, बलोचिस्तान और खैबर पख्तूनख्वा। कबाइली इलाके और इस्लामाबाद भी पाकिस्तान में शामिल हैं। इन के अलावा आजाद कश्मीर और गिलगित-बल्तिस्तान भी पाकिस्तान द्वारा नियंत्रित हैं।
पाकिस्तान का अस्तित्व सन् 1947 में भारत के विभाजन के फलस्वरूप आया था। सर्वप्रथम सन् 1930 में कवि (शायर) मुहम्मद इकबाल ने द्विराष्ट्र सिद्धांत का जिक्र किया था। उन्होंने भारत के उत्तर-पश्चिम में सिंध, बलूचिस्तान, पंजाब तथा अफगान (सूबा-ए-सरहद) को मिलाकर एक नया राष्ट्र बनाने की बात की थी। सन् 1933 में कैंब्रिज विश्वविद्यालय के छात्र चौधरी रहमत अली ने पंजाब, सिंध, कश्मीर तथा बलोचिस्तान के लोगों के लिए पाक्स्तान (जो बाद में पाकिस्तान बना) शब्द का सृजन किया। सन् 1947 से 1970 तक पाकिस्तान दो भागों में बँटा रहा - पूर्वी पाकिस्तान और पश्चिमी पाकिस्तान। दिसंबर, सन् 1971 में भारत के साथ हुई लड़ाई के फलस्वरूप पूर्वी पाकिस्तान बांग्लादेश बना और पश्चिमी पाकिस्तान पाकिस्तान रह गया।",234,जल
पशुधन,"एक या अधिक पशुओं के समूह को, जिन्हें कृषि सम्बन्धी परिवेश में भोजन, रेशे तथा श्रम आदि सामग्रियां प्राप्त करने के लिए पालतू बनाया जाता है, पशुधन के नाम से जाना जाता है। शब्द पशुधन, जैसा कि इस लेख में प्रयोग किया गया है, में मुर्गी पालन तथा मछली पालन सम्मिलित नहीं है; हालांकि इन्हें, विशेष रूप से मुर्गीपालन को, साधारण रूप से पशुधन में सम्मिलित किया जाता हैं।
पशुधन आम तौर पर जीविका अथवा लाभ के लिए पाले जाते हैं। पशुओं को पालना (पशु-पालन) आधुनिक कृषि का एक महत्वपूर्ण भाग है। पशुपालन कई सभ्यताओं में किया जाता रहा है, यह शिकारी-संग्राहक से कृषि की ओर जीवनशैली के अवस्थांतर को दर्शाता है।",112,जल
जत्रोफा,"जत्रोफा लगभग १७५ प्रजाति की वनस्पतियों का समूह है जिसमें झाडियां और पौधे सम्मिलित हैं। इसके पौधे भारत, अफ्रिका, उत्तरी अमेरिका और कैरेबियन् जैसे ट्रापिकल क्षेत्रों में उत्पन्न होते हैं। यह एक बड़ा पादप है जो झाड़ियों के रूप में अर्द्ध शुष्क क्षेत्रों में उगता है। इस पादप से प्राप्त होने वाले बीजों में 25-30 प्रतिशत तक तेल निकाला जा सकता है। इस तेल से कार आदि चलाये जा सकते हैं तथा जो अवशेष बचता है उससे बिजली पैदा की जा सकती है। जत्रोफा अनावृष्टि-रोधी सदाबहार झाडी है। यह कठिन परिस्थितियओं को भी झेलने में सक्षम है।
अन्य नाम : 

रतनजोत, जंगली एरंडी, बंगरेड़ - हिन्दी
करंजी - मराठी
कतमनक (Katamanak) - मलयालम
कट्टमनक्कु (Kattamanakku) - तमिल
पेपलम् (Pepalam) - तेलुगू
कडहरलु (Kadaharalu) - कन्नड़
जेपाल (Jepal) - गुजराती भाषा
कानन रण्ड - संस्कृत भाषा",135,जल
बलिया जिला,"इस से मिलते-जुलते नाम के अन्य लेखों के लिए बलिया (बहुविकल्पी) देखें

बलिया ज़िला (Ballia district) भारत के उत्तर प्रदेश राज्य का एक ज़िला है। ज़िले का मुख्यालय बलिया है। यह ज़िला आज़मगढ़ मंडल के अन्तर्गत आता है और उत्तर प्रदेश का सबसे पूर्वी ज़िला है। बलिया जिले की उत्तरी और दक्षिणी सीमा क्रमशः सरयू और गंगा नदियों द्वारा बनाई जाती है। भारत के स्वतंत्रता आंदोलन में इस जिले के निवासियों के विद्रोही तेवर के कारण इसे ""बागी बलिया"" के नाम से भी जाना जाता है। ददरी-मेला यहाँ का प्रसिद्ध मेला है जो आश्विन मास में  शहर की पूर्वी सीमा पर गंगा और सरयू नदियों के संगम पर स्थित एक मैदान पर मनाया जाता है। मऊ, आजमगढ़, देवरिया, गाजीपुर और वाराणसी के रूप में पास के जिलों के साथ नियमित संपर्क में रेल और सड़क के माध्यम से मौजूद है। यह बिहार की सीमा को छूता हुआ ज़िला है।",149,जल
शंघाई,"शंघाई (चीनी: 上海) चीन का सबसे बड़ा नगर है। यह देश के पूर्वी भाग में यांग्त्ज़े नदी के डेल्टा पर स्थित है। यह अर्थव्यवस्था और जनसंख्या दोनों ही दृष्टि से चीन का सबसे बड़ा नगर है। यह देश की चार नगरपालिकाओं में से एक है और उसी स्तर पर है जिसपर कि चीन का कोई अन्य प्रान्त।
नगर सीमा के भीतर की जनसंख्या ९३ लाख है और पूरी नगरपालिका में १ करोड़ ८१ लाख लोग रहते हैं। १ जनवरी, २००६ की स्थिति तक यहां १ करोड़ ३७ लाख स्थाई निवासी और ४४ लाख अस्थाई निवासी थे जिनके पास रहने का वैध परमिट था। इसके अतिरिक्त यहां ३० लाख लोग अवैध रूप से भी रहते है।",115,जल
अबू धाबी,"अबू धाबी (अरबी: أَبُوظَبِي‎), संयुक्त अरब इमारात (UAE) की राजधानी है। यह वहाँ का दूसरा सर्वाधिक जनसंख्या वाला नगर भी है। अबू धाबी का शासन शेख़ ख़लीफ़ा बिन ज़ैद अल नहयान करते हैं जो UAE के राष्ट्रपति भी हैं।",39,जल
बस्ती जिला,बस्ती ज़िला भारत के उत्तर प्रदेश राज्य का एक ज़िला है।  ज़िले का मुख्यालय बस्ती है। इसे वसिष्ठ नगर भी कह सकते हैं ये रघुकुल घराने के गुरु के नाम पे सुशोभित है।,33,जल
पश्चिमी चम्पारण जिला,चंपारण बिहार के तिरहुत प्रमंडल के अंतर्गत भोजपुरी भाषी जिला है। हिमालय के तराई प्रदेश में बसा यह ऐतिहासिक जिला जल एवं वनसंपदा से पूर्ण है। चंपारण का नाम चंपा + अरण्य से बना है जिसका अर्थ होता है- चम्‍पा के पेड़ों से आच्‍छादित जंगल। बेतिया जिले का मुख्यालय शहर हैं। बिहार का यह जिला अपनी भौगोलिक विशेषताओं और इतिहास के लिए विशिष्ट स्थान रखता है। महात्मा गाँधी ने पूर्वी चंपारण से अंग्रेजों के खिलाफ नील आंदोलन से सत्याग्रह की मशाल जलायी थी।,83,जल
