title,content,word_count,topic
प्रौद्योगिकी का इतिहास,"प्रौद्योगिकी का इतिहास वस्तुत: उपयोगी वस्तुतों का निर्माण करने में प्रयुक्त उपकरणों एवं तकनीकों (tools and techniques) के खोज का इतिहास है। यह मानवता के इतिहास से कई अर्थों में समान है। प्रौद्योगिकी के इतिहास और विज्ञान के इतिहास में घनिष्ट सम्बन्ध है। प्रौद्योगिकी ने वैज्ञानिक शोधों (विशेषकर आधुनिक युग में) के लिये मार्ग बनाया है तो वैज्ञानिक जानकारियों ने नयी प्रौद्योगिकी के विकास का रास्ता साफ किया है।
एक तरफ प्रौद्योगिकीय वस्तुएँ (Technological artifacts) अर्थव्यवस्था की उपज हैं तो दूसरी तरफ वे आर्थिक प्रगति के साधन (कारक) भी हैं। प्रौद्योगिक नवाचार समाज के सांस्कृतिक परम्पराओं से प्रभावित होता है और इसे प्रभावित भी करता है। वैज्ञानिक नवाचार से सैनिक शक्ति के विकास में मदद मिलती है।",117,प्रौद्योगिकी
नवाचार का विसरण,"नवाचार का विसरण (Diffusion of innovations) एक सिद्धान्त है जो इस बात की व्याख्या करने का प्रयत्न करता है कि नये विचारों तथा नयी प्रौद्योगिकी का प्रसार कैसे, क्यों और किस गति से होता है?
एवरेट रोजर्स (Everett Rogers) ने इस सिद्धान्त को  'डिफ्यूजन ऑफ इन्नोवेशन्स' नामक अपनी पुस्तक के द्वारा प्रसारित किया। यह पुस्तक सबसे पहले १९६२ में प्रकाशित हुई और २००३ में इसका पाँचवाँ संस्करण निकला। 
एवरेट रोजर्स का मानना ​​है कि नवाचार को लोगों द्वारा अपनाया जाना पांच मुख्य चरणों पर निर्भर करता है:

(१) जागरूकता (awareness)
(२) रुचि (interest): एक बार जब नई चीजें ज्ञात हो जाती हैं, तो रुचि पैदा होती है।
(३) मूल्यांकन (evaluation) : व्यक्ति यह मापेंगे कि क्या नई चीजें उनकी जरूरतों को पूरा करती हैं। इसे ""आंतरिक परीक्षण"" कहा जाता है।
(४) कार्यान्वयन एवं परीक्षण (trial): इस स्तर पर, नई चीजों को केवल छोटे पैमाने पर अपनाया जा सकता है।
(५) स्वीकरण (adoption): यह निर्णय करना व्यक्ति के ऊपर है कि नई चीज को अपनाया जाना है या नहीं।",168,प्रौद्योगिकी
प्रौद्योगिकी के सिद्धान्त,"प्रौद्योगिकी के सिद्धान्त (Theories of technology) से आशय उन सिद्धान्तों से है जो प्रौद्योगिक नवाचार को बढ़ावा देने वाले कारकों की तथा समाज एवं संस्कृति पर प्रौद्योगिकी के प्रभाव की व्याख्या करते हैं। वर्तमान समय के अधिकांश प्रौद्योगिकी सिद्धान्त पहले के दो प्रचलित सिद्धान्तों, (१) प्रौद्योगिक नवाचार का रैखिक विकास, और (२) प्रौद्योगिकीय नियतत्ववाद (technological determinism), का खण्डन करते हैं।",60,प्रौद्योगिकी
"विज्ञान, प्रौद्योगिकी और समाज","विज्ञान, प्रौद्योगिकी और समाज या विज्ञान और प्रौद्योगिकी अध्ययन ( science, technology and society या Science and technology studies) अध्ययन का वह क्षेत्र है जिसमें यह अध्ययन किया जाता है कि समाज, राजनीति एवं संस्कृति किस तरह से वैज्ञानिक अनुसन्धान एवं प्रौद्योगिक नवाचार को किस प्रकार प्रभावित करते हैं।",49,प्रौद्योगिकी
उच्च प्रौद्योगिकी,"वह प्रौद्योगिकी जो उपलब्ध प्रौद्योगिकियों में से सबसे उन्नत होती है उसे उच्च प्रौद्योगिकी (High technology या high tech या frontier technology) खते हैं। इसका विलोम 'निम्न प्रौद्योगिकी' (low technology) है। सरल और प्रायः पारम्परिक प्रौद्योगिकी को निम्न प्रौद्योगिकी कहा जाता है। उदाहरण के लिए, स्लाइड रूल एक निम्न प्रौद्योगिकी वाली युक्ति है।",53,प्रौद्योगिकी
प्रौद्योगिकी हस्तान्तरण,"किसी वैज्ञानिक अनुसंधान का कोई व्यावहारिक उपयोग सोचना और उस उपयोग को साकार करने के लिये आवश्यक सारी जानकारी और प्रशिक्षण किसी दूसरे व्यक्ति या संस्था को मुहैया कराना प्रौद्योगिकी हस्तान्तरण कहलाता है। तकनीकी हतान्तरण का उद्देश्य यह होता है कि कोई अन्य व्यक्ति इस प्रौद्योगिकी के साथ अपनी पूंजी एवं अन्य संसाधन लगाकर इसका व्यावसायिक उपयोग करे। 
प्राचीन काल से ही प्रौद्योगिकी का हस्तानान्तरण होता आया है किन्तु आजकल यह एक नारा बन गया है और इसे सरकारें एक अभियान के रूप में चला रहीं है> इसके पीछे चिन्तन यह है कि किसी देश में जितनी अधिक तकनीकी का विकास और उपयोग होगा, उस देश की आर्थिक समृद्धि उतनी ही अधिक बढेगी।",113,प्रौद्योगिकी
द्वितीय विश्वयुद्ध काल की प्रौद्योगिकी,"प्रौद्योगिकी ने द्वितीय विश्वयुद्ध के परिणाम को बहुत हद तक प्रभावित और निर्धारित किया। द्वितीय विश्वयुद्ध में बाहर आयी प्रौद्योगिकी का अधिकांश हिस्सा १९२० और १९३० के बीच विकसित किया गया था।
लगभग हर प्रकार की प्रौद्योगिकी का इस्तेमाल हुआ था जिसमें से प्रमुख हैं-

हथियार : जलयान, गाडियाँ, वायुयान, आर्टिलरी, राकेट, जैविक, रासायनिक एवं परमाणु हथियार
लॉजिस्टिक सपोर्ट : सैनिकों एवं खाद्य-सामग्री को लाने और ले जाने के लिये गाडियाँ जैसे ट्रेन, ट्रक, वायुयान आदि
संचार एवं गुप्तचरी : नौवहन, संचार, सुदूर-संवेदन (रिमोट सेंसिंग) तथा गुप्तचरी
औषधियाँ : शल्यचिकित्सा में नवाचार, रासायनिक औषधियाँ आदि
उद्योग : कारखानों एवं उत्पादन केन्द्रों में प्रयुक्त तकनीकों में सुधार",106,प्रौद्योगिकी
भारतीय सॉफ्टवेयर टेक्क्नॉलोजी पार्क,"भारतीय सॉफ्टवेयर टेक्क्नॉलोजी पार्क या 'सॉफ्टवेयर टेक्नोलॉजी पार्क्स ऑफ इंडिया' (एस.टी.पी.आई.) सूचना प्रौद्योगिकी मंत्रालय, भारत सरकार के अधीन सोसाइटी है जिसकी स्थापना भारत से सॉफ्टवेयर के निर्यात को प्रोत्साहित करने, बढ़ावा देने और वृद्धि करने के उद्देश्य से 1991 में की गई थी।
सॉफ्टवेयर टेक्नोलॉजी पार्क्स ऑफ इंडिया परामर्शी, प्रशिक्षण और कार्यान्वयन सेवाएं प्रदान करने के लिए आंतरिक इंजीनियरी संसाधन रखता है। इन सेवाओं में नेटवर्क डिजाइन, प्रणाली एकीकरण, विविध क्षेत्रों में अप्रयुक्त नेटवर्क और सुविधाओं के संस्थापन, प्रचालन और उनका अनुरक्षण शामिल है।
प्रक्रिया का विकास गुणवत्ता प्रबंधन प्रणाली के आधार पर है। एस.टी.पी.आई. के केन्द्र भी आईएसओ 9001 प्रमाणन का अनुपालन करते हैं।",105,प्रौद्योगिकी
"भारती कॉलेज कृषि इंजीनियरिंग और कृषि प्रौद्योगिकी, दुर्ग छत्तीसगढ़",,0,प्रौद्योगिकी
भारतीय प्रौद्योगिकी संस्थान कानपुर,"भारतीय प्रौद्योगिकी संस्थान कानपुर (अंग्रेज़ी: Indian Institute of Technology Kanpur), जो कि आईआईटी कानपुर अथवा आईआईटीके के नाम से भी जाना जाता है, भारतीय प्रौद्योगिकी संस्थानों में से एक है। इसकी स्थापना सन् १९५९ में उत्तर प्रदेश के कानपुर शहर में हुई। आईआईटी कानपुर मुख्य रूप से विज्ञान एवं अभियान्त्रिकी में शोध तथा स्नातक शिक्षा पर केंद्रित एक प्रमुख भारतीय तकनीकी संस्थान बनकर उभरा है।",65,प्रौद्योगिकी
रिपोर्टर (टेलीविज़न चैनल),"रिपोर्टर टीवी भारत के केरल में स्थित 24 घंटे का मलयालम समाचार चैनल है। रिपोर्टर ब्रॉडकास्टिंग कंपनी के स्वामित्व वाला यह चैनल स्थानीय, राष्ट्रीय और वैश्विक समाचारों की व्यापक कवरेज प्रदान करता है। 13 मई 2011 को अपनी स्थापना के बाद से, रिपोर्टर टीवी मलयालम भाषी दर्शकों के लिए जानकारी का एक विश्वसनीय स्रोत बन गया है, जो राजनीति, खेल, मनोरंजन, व्यवसाय, स्वास्थ्य, प्रौद्योगिकी और सामाजिक मुद्दों जैसे विभिन्न विषयों पर समय पर अपडेट प्रदान करता है। पत्रकारिता की अखंडता और नवोन्वेषी प्रसारण के प्रति चैनल की प्रतिबद्धता ने प्रतिस्पर्धी मीडिया परिदृश्य में इसकी प्रतिष्ठा को मजबूत किया है।",99,प्रौद्योगिकी
प्रौद्योगिकीय प्रगति,"प्रौद्योगिकीय प्रगति (technological progress) से मतलब प्रौद्योगिकीय खोज, प्रौद्योगिकीय नवाचार तथा प्रौद्योगिकी विसरण (डिफ्यूजन) से है। इसे प्रौद्योगिकी परिवर्तन (Technological change) या  प्रौद्योगिकीय विकास (technological development), या प्रौद्योगिकीय उपलब्धि (technological achievement) भी कहते हैं।",34,प्रौद्योगिकी
बाबासाहेब भीमराव अम्बेडकर विश्वविद्यालय,"बाबासाहेब भीमराव अम्बेडकर विश्वविद्यालय  लखनऊ में स्थित एक केन्द्रीय विश्वविद्यालय है। यह रायबरेली मार्ग पर चारबाग रेलवे स्टेशन से १० कि.मी दक्षिण में विद्या विहार में स्थित है।
बाबासाहेब भीमराव आंबेडकर विश्वविद्यालय (BBAU) लखनऊ, उत्तर प्रदेश में एक केंद्रीय विश्वविद्यालय है। विश्वविद्यालय का नाम भारतीय संविधान के निर्माता बाबासाहेब अम्बेडकर के नाम पर रखा गया है। विश्वविद्यालय प्राकृतिक और सामाजिक विज्ञान के विभिन्न क्षेत्रों में उच्च शिक्षा के शिक्षण को बढ़ावा देने के लिए समर्पित है। विश्वविद्यालय की स्थापना 10 जनवरी 1996 को हुई थी। इस विश्वविद्यालय में कई छात्र हैं। विश्वविद्यालय का एक शाखा अमेठी परिसर में भी है। अमेठी परिसर 2016 में स्थापित किया गया था।",108,प्रौद्योगिकी
2019 ब्रिक्स शिखर सम्मेलन,"2019 ब्रिक्स शिखर सम्मेलन, ब्रिक्स राष्ट्राध्यक्षों का ग्यारहवां वार्षिक  शिखर सम्मेलन था, जो एक अंतरराष्ट्रीय सम्मेलन है जिसमें पांच सदस्य राज्यों ब्राजील, रूस, भारत, चीन और दक्षिण अफ्रीका के राष्ट्राध्यक्षों या प्रमुखों ने भाग लिया। यह बैठक ब्रासीलिया के इटामारती पैलेस में आयोजित की गई थी, जिसमें ब्राजील का विदेश मंत्रालय स्थित है। ब्राजील की राजधानी ने दूसरी बार ब्रिक्स शिखर सम्मेलन की मेजबानी की। शेरपा बैठक 14 से 15 मार्च के बीच ब्राजील के शहर कुरीतिबा में हुई थी।",80,प्रौद्योगिकी
प्रौद्योगिकी इंजीलवादी,"प्रौद्योगिकी इंजीलवादी एक ऐसे व्यक्ति को कहते हैं जो किसी दी गई तकनीक के लिए महत्वपूर्ण समर्थन का निर्माण करता है, और फिर उसे एक ऐसे बाजार में तकनीकी मानक के रूप में स्थापित करता है जो नेटवर्क प्रभावों के अधीन है। इंजीलवाद शब्द धार्मिक मुद्दों में कहे जाने वाले इंजीलवाद से लिया गया है क्योंकि किसी धर्म की तरह यह भी किसी विशेष अवधारणा के बारे में जानकारी साझा करने और दूसरे लोग उस अवधारणा को अपना ले, इस इरादे से बनाया जाता है। यह आमतौर पर एक तकनीक के संभावित उपयोगों और लाभों को प्रदर्शित करके पूरा किया जाता है ताकि दूसरों को यह समझने में मदद मिल सके कि वे इसे अपने लिए कैसे उपयोग कर सकते हैं।",121,प्रौद्योगिकी
पीएम श्री विद्यालय,"पीएम श्री विद्यालय भारत सरकार की प्रधानमंत्री शैक्षिक योजना (PM Shri School Scheme) के तहत स्थापित एक स्कूल है। यह विद्यालय उच्च शैक्षिक मानकों, समग्र विकास और बच्चों के लिए एक आदर्श शैक्षिक वातावरण प्रदान करने के उद्देश्य से खोला गया है। इसका उद्देश्य बच्चों को प्रौद्योगिकी, शैक्षिक नवाचार और समाज में महत्वपूर्ण बदलावों के लिए तैयार करना है।",59,प्रौद्योगिकी
भारत-इज़राइल सम्बन्ध,"भारत-इज़राइल सम्बन्ध, भारत तथा इज़राइल के मध्य द्विपक्षीय सम्बन्धों को दर्शाते हैं। 1992 तक भारत तथा इज़राइल के मध्य किसी प्रकार के सम्बन्ध नहीं रहे। इसके मुख्यतः दो कारण थे- पहला, भारत गुट निरपेक्ष राष्ट्र था जो की पूर्व सोवियत संघ का समर्थक था तथा दूसरे गुट निरपेक्ष राष्ट्रों की तरह इज़राइल को मान्यता नहीं देता था। दूसरा मुख्य कारण भारत फिलिस्तीन की स्वतन्त्रता का समर्थक रहा। यहाँ तक की 1947 में भारत ने संयुक्त राष्ट्र फिलिस्तीन (उन्स्कोप) नामक संगठन का निर्माण किया परन्तु 1989 में कश्मीर में विवाद तथा सोवियत संघ के पतन तथा पाकिस्तान के गैर-कानूनी घुसपैठ के चलते राजनितिक परिवेश में परिवर्तन आया और भारत ने अपनी सोच बदलते हुए इज़राइल के साथ सम्बन्धों को मजबूत करने पर जोर दिया और 1992 से नया दौर आरम्भ हुआ। 
भारतीय राष्ट्रीय कांग्रेस की पराजय के पश्चात भारतीय जनता पार्टी के सत्ता में आते ही भारत और इज़राइल के मध्य सहयोग बढ़ा और दोनों राजनितिक दलों की इस्लामी कट्टरपन्थ के प्रति एक जैसे मानसिकता होने के कारण से और मध्य पूर्व में यहूदी समर्थक नीति की वजह से भारत और इज़राइल के सम्बन्ध प्रगाढ़ हुए। आज इज़राइल, रूस के बाद भारत का सबसे बड़ा सैनिक सहायक और निर्यातक है।",199,प्रौद्योगिकी
