title,content,word_count,topic
"फुल्ईजागेश्वर, भनोली तहसील",फुल्ईजागेश्वर भारतीय राज्य उत्तराखण्ड राज्य के कुमाऊँ मण्डल के अल्मोड़ा जिले की भनोली तहसील का एक गाँव है।,18,कृषि
"औलियागांव, रानीखेत तहसील",औलियागांव भारतीय राज्य उत्तराखण्ड राज्य के कुमाऊँ मण्डल के अल्मोड़ा जिले की रानीखेत तहसील का एक गाँव है।,18,कृषि
"सुनोली, चौखुटिया तहसील",सुनोली भारतीय राज्य उत्तराखण्ड राज्य के कुमाऊँ मण्डल के अल्मोड़ा जिले की चौखुटिया तहसील का एक गाँव है।,18,कृषि
"पोखरी, भनोली तहसील",पोखरी भारतीय राज्य उत्तराखण्ड राज्य के कुमाऊँ मण्डल के अल्मोड़ा जिले की भनोली तहसील का एक गाँव है।,18,कृषि
"ईडाकोट, भिकियासैण तहसील",ईडाकोट भारतीय राज्य उत्तराखण्ड राज्य के कुमाऊँ मण्डल के अल्मोड़ा जिले की भिकियासैण तहसील का एक गाँव है।,18,कृषि
"वले, सोमेश्वर तहसील",वले भारतीय राज्य उत्तराखण्ड राज्य के कुमाऊँ मण्डल के अल्मोड़ा जिले की सोमेश्वर तहसील का एक गाँव है।,18,कृषि
"बसाण, भनोली तहसील",बसाण भारतीय राज्य उत्तराखण्ड राज्य के कुमाऊँ मण्डल के अल्मोड़ा जिले की भनोली तहसील का एक गाँव है।,18,कृषि
"उगलियासीम, भिकियासैण तहसील",उगलियासीम भारतीय राज्य उत्तराखण्ड राज्य के कुमाऊँ मण्डल के अल्मोड़ा जिले की भिकियासैण तहसील का एक गाँव है।,18,कृषि
"बजीना, रानीखेत तहसील",बजीना भारतीय राज्य उत्तराखण्ड राज्य के कुमाऊँ मण्डल के अल्मोड़ा जिले की रानीखेत तहसील का एक गाँव है।,18,कृषि
"बलसूना, भनोली तहसील",बलसूना भारतीय राज्य उत्तराखण्ड राज्य के कुमाऊँ मण्डल के अल्मोड़ा जिले की भनोली तहसील का एक गाँव है।,18,कृषि
"मजेटी, रानीखेत तहसील",मजेटी भारतीय राज्य उत्तराखण्ड राज्य के कुमाऊँ मण्डल के अल्मोड़ा जिले की रानीखेत तहसील का एक गाँव है।,18,कृषि
"पपौली, भनोली तहसील",पपौली भारतीय राज्य उत्तराखण्ड राज्य के कुमाऊँ मण्डल के अल्मोड़ा जिले की भनोली तहसील का एक गाँव है।,18,कृषि
"सैलटाना, रानीखेत तहसील",सैलटाना भारतीय राज्य उत्तराखण्ड राज्य के कुमाऊँ मण्डल के अल्मोड़ा जिले की रानीखेत तहसील का एक गाँव है।,18,कृषि
"उलिणा, द्वाराहाट तहसील",उलिणा भारतीय राज्य उत्तराखण्ड राज्य के कुमाऊँ मण्डल के अल्मोड़ा जिले की द्वाराहाट तहसील का एक गाँव है।,18,कृषि
"सेली, भनोली तहसील",सेली भारतीय राज्य उत्तराखण्ड राज्य के कुमाऊँ मण्डल के अल्मोड़ा जिले की भनोली तहसील का एक गाँव है।,18,कृषि
"पिलखोली, रानीखेत तहसील",पिलखोली भारतीय राज्य उत्तराखण्ड राज्य के कुमाऊँ मण्डल के अल्मोड़ा जिले की रानीखेत तहसील का एक गाँव है।,18,कृषि
"सलौज, सोमेश्वर तहसील",सलौज भारतीय राज्य उत्तराखण्ड राज्य के कुमाऊँ मण्डल के अल्मोड़ा जिले की सोमेश्वर तहसील का एक गाँव है।,18,कृषि
"बडेत, द्वाराहाट तहसील",बडेत भारतीय राज्य उत्तराखण्ड राज्य के कुमाऊँ मण्डल के अल्मोड़ा जिले की द्वाराहाट तहसील का एक गाँव है।,18,कृषि
"लोटना, रानीखेत तहसील",लोटना भारतीय राज्य उत्तराखण्ड राज्य के कुमाऊँ मण्डल के अल्मोड़ा जिले की रानीखेत तहसील का एक गाँव है।,18,कृषि
"बैरती, चौखुटिया तहसील",बैरती भारतीय राज्य उत्तराखण्ड राज्य के कुमाऊँ मण्डल के अल्मोड़ा जिले की चौखुटिया तहसील का एक गाँव है।,18,कृषि
"मंगचौडा, रानीखेत तहसील",मंगचौडा भारतीय राज्य उत्तराखण्ड राज्य के कुमाऊँ मण्डल के अल्मोड़ा जिले की रानीखेत तहसील का एक गाँव है।,18,कृषि
"वखीना, रानीखेत तहसील",वखीना भारतीय राज्य उत्तराखण्ड राज्य के कुमाऊँ मण्डल के अल्मोड़ा जिले की रानीखेत तहसील का एक गाँव है।,18,कृषि
"रावलसेरा, द्वाराहाट तहसील",रावलसेरा भारतीय राज्य उत्तराखण्ड राज्य के कुमाऊँ मण्डल के अल्मोड़ा जिले की द्वाराहाट तहसील का एक गाँव है।,18,कृषि
"ऊँचाकोट, द्वाराहाट तहसील",ऊँचाकोट भारतीय राज्य उत्तराखण्ड राज्य के कुमाऊँ मण्डल के अल्मोड़ा जिले की द्वाराहाट तहसील का एक गाँव है।,18,कृषि
"भेटा, सोमेश्वर तहसील",भेटा भारतीय राज्य उत्तराखण्ड राज्य के कुमाऊँ मण्डल के अल्मोड़ा जिले की सोमेश्वर तहसील का एक गाँव है।,18,कृषि
"पपोली, भनोली तहसील",पपोली भारतीय राज्य उत्तराखण्ड राज्य के कुमाऊँ मण्डल के अल्मोड़ा जिले की भनोली तहसील का एक गाँव है।,18,कृषि
"भावर, भिकियासैण तहसील",भावर भारतीय राज्य उत्तराखण्ड राज्य के कुमाऊँ मण्डल के अल्मोड़ा जिले की भिकियासैण तहसील का एक गाँव है।,18,कृषि
"हउली, भिकियासैण तहसील",हउली भारतीय राज्य उत्तराखण्ड राज्य के कुमाऊँ मण्डल के अल्मोड़ा जिले की भिकियासैण तहसील का एक गाँव है।,18,कृषि
"बसाण, जैंती तहसील",बसाण भारतीय राज्य उत्तराखण्ड राज्य के कुमाऊँ मण्डल के अल्मोड़ा जिले की जैंती तहसील का एक गाँव है।,18,कृषि
"ल्वाली, जैंती तहसील",ल्वाली भारतीय राज्य उत्तराखण्ड राज्य के कुमाऊँ मण्डल के अल्मोड़ा जिले की जैंती तहसील का एक गाँव है।,18,कृषि
"सैलीसार, द्वाराहाट तहसील",सैलीसार भारतीय राज्य उत्तराखण्ड राज्य के कुमाऊँ मण्डल के अल्मोड़ा जिले की द्वाराहाट तहसील का एक गाँव है।,18,कृषि
"बांगी, जैंती तहसील",बांगी भारतीय राज्य उत्तराखण्ड राज्य के कुमाऊँ मण्डल के अल्मोड़ा जिले की जैंती तहसील का एक गाँव है।,18,कृषि
"विजेपुर, द्वाराहाट तहसील",विजेपुर भारतीय राज्य उत्तराखण्ड राज्य के कुमाऊँ मण्डल के अल्मोड़ा जिले की द्वाराहाट तहसील का एक गाँव है।,18,कृषि
"मौना, रानीखेत तहसील",मौना भारतीय राज्य उत्तराखण्ड राज्य के कुमाऊँ मण्डल के अल्मोड़ा जिले की रानीखेत तहसील का एक गाँव है।,18,कृषि
"सिरदा, चौखुटिया तहसील",सिरदा भारतीय राज्य उत्तराखण्ड राज्य के कुमाऊँ मण्डल के अल्मोड़ा जिले की चौखुटिया तहसील का एक गाँव है।,18,कृषि
"सिरखे, रानीखेत तहसील",सिरखे भारतीय राज्य उत्तराखण्ड राज्य के कुमाऊँ मण्डल के अल्मोड़ा जिले की रानीखेत तहसील का एक गाँव है।,18,कृषि
"भूतकुडी, चौखुटिया तहसील",भूतकुडी भारतीय राज्य उत्तराखण्ड राज्य के कुमाऊँ मण्डल के अल्मोड़ा जिले की चौखुटिया तहसील का एक गाँव है।,18,कृषि
"बोरागांव, सल्ट तहसील",बोरागांव भारतीय राज्य उत्तराखण्ड राज्य के कुमाऊँ मण्डल के अल्मोड़ा जिले की सल्ट तहसील का एक गाँव है।,18,कृषि
"मलाण, भनोली तहसील",मलाण भारतीय राज्य उत्तराखण्ड राज्य के कुमाऊँ मण्डल के अल्मोड़ा जिले की भनोली तहसील का एक गाँव है।,18,कृषि
"रणथमल, सल्ट तहसील",रणथमल भारतीय राज्य उत्तराखण्ड राज्य के कुमाऊँ मण्डल के अल्मोड़ा जिले की सल्ट तहसील का एक गाँव है।,18,कृषि
"बरम, जैंती तहसील",बरम भारतीय राज्य उत्तराखण्ड राज्य के कुमाऊँ मण्डल के अल्मोड़ा जिले की जैंती तहसील का एक गाँव है।,18,कृषि
"सिमाणगूठ, भनोली तहसील",सिमाणगूठ भारतीय राज्य उत्तराखण्ड राज्य के कुमाऊँ मण्डल के अल्मोड़ा जिले की भनोली तहसील का एक गाँव है।,18,कृषि
"बुधिना, द्वाराहाट तहसील",बुधिना भारतीय राज्य उत्तराखण्ड राज्य के कुमाऊँ मण्डल के अल्मोड़ा जिले की द्वाराहाट तहसील का एक गाँव है।,18,कृषि
"सकनणा, भिकियासैण तहसील",सकनणा भारतीय राज्य उत्तराखण्ड राज्य के कुमाऊँ मण्डल के अल्मोड़ा जिले की भिकियासैण तहसील का एक गाँव है।,18,कृषि
"पकून, भनोली तहसील",पकून भारतीय राज्य उत्तराखण्ड राज्य के कुमाऊँ मण्डल के अल्मोड़ा जिले की भनोली तहसील का एक गाँव है।,18,कृषि
"उभ्याडी, द्वाराहाट तहसील",उभ्याडी भारतीय राज्य उत्तराखण्ड राज्य के कुमाऊँ मण्डल के अल्मोड़ा जिले की द्वाराहाट तहसील का एक गाँव है।,18,कृषि
"मछलिया, रानीखेत तहसील",मछलिया भारतीय राज्य उत्तराखण्ड राज्य के कुमाऊँ मण्डल के अल्मोड़ा जिले की रानीखेत तहसील का एक गाँव है।,18,कृषि
"पैठानी, द्वाराहाट तहसील",पैठानी भारतीय राज्य उत्तराखण्ड राज्य के कुमाऊँ मण्डल के अल्मोड़ा जिले की द्वाराहाट तहसील का एक गाँव है।,18,कृषि
"भिडारकोट, रानीखेत तहसील",भिडारकोट भारतीय राज्य उत्तराखण्ड राज्य के कुमाऊँ मण्डल के अल्मोड़ा जिले की रानीखेत तहसील का एक गाँव है।,18,कृषि
"रतगल, रानीखेत तहसील",रतगल भारतीय राज्य उत्तराखण्ड राज्य के कुमाऊँ मण्डल के अल्मोड़ा जिले की रानीखेत तहसील का एक गाँव है।,18,कृषि
"भौरी, सोमेश्वर तहसील",भौरी भारतीय राज्य उत्तराखण्ड राज्य के कुमाऊँ मण्डल के अल्मोड़ा जिले की सोमेश्वर तहसील का एक गाँव है।,18,कृषि
"हटपल्ला, जैंती तहसील",हटपल्ला भारतीय राज्य उत्तराखण्ड राज्य के कुमाऊँ मण्डल के अल्मोड़ा जिले की जैंती तहसील का एक गाँव है।,18,कृषि
"भतौरा, द्वाराहाट तहसील",भतौरा भारतीय राज्य उत्तराखण्ड राज्य के कुमाऊँ मण्डल के अल्मोड़ा जिले की द्वाराहाट तहसील का एक गाँव है।,18,कृषि
"मजूरनायक, चौखुटिया तहसील",मजूरनायक भारतीय राज्य उत्तराखण्ड राज्य के कुमाऊँ मण्डल के अल्मोड़ा जिले की चौखुटिया तहसील का एक गाँव है।,18,कृषि
"फटक्वालडुंगरा, जैंती तहसील",फटक्वालडुंगरा भारतीय राज्य उत्तराखण्ड राज्य के कुमाऊँ मण्डल के अल्मोड़ा जिले की जैंती तहसील का एक गाँव है।,18,कृषि
"सकन्याडी, सल्ट तहसील",सकन्याडी भारतीय राज्य उत्तराखण्ड राज्य के कुमाऊँ मण्डल के अल्मोड़ा जिले की सल्ट तहसील का एक गाँव है।,18,कृषि
"स्यौतरा, भिकियासैण तहसील",स्यौतरा भारतीय राज्य उत्तराखण्ड राज्य के कुमाऊँ मण्डल के अल्मोड़ा जिले की भिकियासैण तहसील का एक गाँव है।,18,कृषि
"ईडा, रानीखेत तहसील",ईडा भारतीय राज्य उत्तराखण्ड राज्य के कुमाऊँ मण्डल के अल्मोड़ा जिले की रानीखेत तहसील का एक गाँव है।,18,कृषि
"मंगडोली, रानीखेत तहसील",मंगडोली भारतीय राज्य उत्तराखण्ड राज्य के कुमाऊँ मण्डल के अल्मोड़ा जिले की रानीखेत तहसील का एक गाँव है।,18,कृषि
"बेलक, भनोली तहसील",बेलक भारतीय राज्य उत्तराखण्ड राज्य के कुमाऊँ मण्डल के अल्मोड़ा जिले की भनोली तहसील का एक गाँव है।,18,कृषि
"मिरगांव, भनोली तहसील",मिरगांव भारतीय राज्य उत्तराखण्ड राज्य के कुमाऊँ मण्डल के अल्मोड़ा जिले की भनोली तहसील का एक गाँव है।,18,कृषि
"पोखरी, द्वाराहाट तहसील",पोखरी भारतीय राज्य उत्तराखण्ड राज्य के कुमाऊँ मण्डल के अल्मोड़ा जिले की द्वाराहाट तहसील का एक गाँव है।,18,कृषि
"बमनचौना, भिकियासैण तहसील",बमनचौना भारतीय राज्य उत्तराखण्ड राज्य के कुमाऊँ मण्डल के अल्मोड़ा जिले की भिकियासैण तहसील का एक गाँव है।,18,कृषि
"सुरखाल, जैंती तहसील",सुरखाल भारतीय राज्य उत्तराखण्ड राज्य के कुमाऊँ मण्डल के अल्मोड़ा जिले की जैंती तहसील का एक गाँव है।,18,कृषि
"वकस्वाड, जैंती तहसील",वकस्वाड भारतीय राज्य उत्तराखण्ड राज्य के कुमाऊँ मण्डल के अल्मोड़ा जिले की जैंती तहसील का एक गाँव है।,18,कृषि
"भटकोट, द्वाराहाट तहसील",भटकोट भारतीय राज्य उत्तराखण्ड राज्य के कुमाऊँ मण्डल के अल्मोड़ा जिले की द्वाराहाट तहसील का एक गाँव है।,18,कृषि
"सलना, द्वाराहाट तहसील",सलना भारतीय राज्य उत्तराखण्ड राज्य के कुमाऊँ मण्डल के अल्मोड़ा जिले की द्वाराहाट तहसील का एक गाँव है।,18,कृषि
"सौरे, भिकियासैण तहसील",सौरे भारतीय राज्य उत्तराखण्ड राज्य के कुमाऊँ मण्डल के अल्मोड़ा जिले की भिकियासैण तहसील का एक गाँव है।,18,कृषि
"फल्द्वाडी, रानीखेत तहसील",फल्द्वाडी भारतीय राज्य उत्तराखण्ड राज्य के कुमाऊँ मण्डल के अल्मोड़ा जिले की रानीखेत तहसील का एक गाँव है।,18,कृषि
"उप्राडी, रानीखेत तहसील",उप्राडी भारतीय राज्य उत्तराखण्ड राज्य के कुमाऊँ मण्डल के अल्मोड़ा जिले की रानीखेत तहसील का एक गाँव है।,18,कृषि
"मेहलखण्ड, रानीखेत तहसील",मेहलखण्ड भारतीय राज्य उत्तराखण्ड राज्य के कुमाऊँ मण्डल के अल्मोड़ा जिले की रानीखेत तहसील का एक गाँव है।,18,कृषि
"पारकोट, द्वाराहाट तहसील",पारकोट भारतीय राज्य उत्तराखण्ड राज्य के कुमाऊँ मण्डल के अल्मोड़ा जिले की द्वाराहाट तहसील का एक गाँव है।,18,कृषि
"लम्बाडी, भिकियासैण तहसील",लम्बाडी भारतीय राज्य उत्तराखण्ड राज्य के कुमाऊँ मण्डल के अल्मोड़ा जिले की भिकियासैण तहसील का एक गाँव है।,18,कृषि
"बिन्ता, द्वाराहाट तहसील",बिन्ता भारतीय राज्य उत्तराखण्ड राज्य के कुमाऊँ मण्डल के अल्मोड़ा जिले की द्वाराहाट तहसील का एक गाँव है।,18,कृषि
