title,content,word_count,topic
ब्रॉडबैंड इंटरनेट अभिगम,"ब्रॉडबैंड इंटरनेट अभिगम, जिसे संक्षिप्त रूप से अक्सर विस्तृत पट्टी कहा जाता है, एक उच्च डेटा दर इंटरनेट अभिगम है- जिसकी तुलना आम तौर पर 56K मॉडेम का उपयोग करने वाले डायल-अप अभिगम से की जाती है।
डायल-अप मॉडेम, 56 kbit/s (किलोबिट्स प्रति सेकंड) से कम के बिटरेट तक सीमित होते हैं और इन्हें पूरे टेलीफोन लाइन के उपयोग की आवश्यकता होती है - जबकि ब्रॉडबैंड प्रौद्योगिकियां, टेलीफोन के उपयोग को प्रायः बिना बाधित किए हुए इस दर से दुगुना प्रदान करती हैं। 
हालांकि ब्रॉडबैंड की परिभाषा में विभिन्न न्यूनतम बैंडविड्थ का इस्तेमाल किया गया है, जिसकी सीमा 64kbit/s से लेकर 2.0Mbit/s तक है, 2006 OECD की रिपोर्ट 
ब्रॉडबैंड को विशिष्ट रूप से परिभाषित करती है कि इसमें डाउनलोड का डेटा अंतरण दर 256 kbit/s के बराबर या तेज़ होता है, जबकि संयुक्त राज्य अमेरिका (US) का संघीय संचार आयोग (FCC) यथा 2009, ""बेसिक ब्रॉडबैंड"" को परिभाषित करता है कि 768 किलोबिट्स प्रति सेकंड (Kbps) से अधिक, या 768,000 बिट्स प्रति सेकंड की डेटा संचरण गति, कम से कम एक दिशा में: नीचे की ओर (इंटरनेट से उपयोगकर्ता के कंप्यूटर की तरफ) या ऊपर की ओर (उपयोगकर्ता के कंप्यूटर से इंटरनेट की तरफ)।  प्रवृत्ति यह है कि जैसे-जैसे बाज़ार, तेज़ सेवाएं प्रदान कर रहा है वैसे-वैसे ब्रॉडबैंड की परिभाषा की सीमा को बढ़ाना.
डेटा दरों को अधिकतम डाउनलोड के संदर्भ में परिभाषित किया जाता है क्योंकि कई आम उपभोक्ता ब्रॉडबैंड प्रौद्योगिकियां जैसे ADSL, ""असममित"" हैं - डाउनलोड की अपेक्षा काफी कम अधिकतम अपलोड डेटा दर का समर्थन करते हुए.
""ब्रॉडबैंड प्रवेश"" को अब मुख्य आर्थिक संकेतक के रूप में लिया जाता है।",262,कृषि
गोपाल नारायण सिंह विश्वविद्यालय,गोपाल नारायण सिंह विश्वविद्यालय ( जीएनएसयू ) एक निजी विश्वविद्यालय है  जो भारत के बिहार के रोहतास जिले के सासाराम शहर के पास जमुहार गांव में स्थित है। यह बिहार में पहले छह निजी विश्वविद्यालयों में से एक है।  विश्वविद्यालय को बिहार कैबिनेट के निर्णय के बाद 5 जून 2018 को बिहार गज़ेट में अधिसूचित किया गया था और इसकी आधिकारिक स्थापना तिथि 15 जून 2018 है।,67,कृषि
खाद्य प्रसंस्करण,"खाद्य प्रसंस्करण घर या खाद्य प्रसंस्करण उद्योग में मानव या पशुओं के उपभोग के लिए कच्चे संघटकों को खाद्य पदार्थ में बदलने या खाद्य पदार्थों को अन्य रूपों में बदलने के लिए प्रयुक्त विधियों और तकनीकों का सेट है। आम तौर पर खाद्य प्रसंस्करण में साफ़ फसल या कसाई द्वारा काटे गए पशु उत्पादों को लिया जाता है और इनका उपयोग आकर्षक, विपणन योग्य और अक्सर दीर्घ शेल्फ़-जीवन वाले खाद्य उत्पादों के उत्पादन के लिए किया जाता है। पशु चारे के उत्पादन के लिए भी इसी तरह की प्रक्रियाओं का इस्तेमाल किया जाता है।
खाद्य प्रसंस्करण के चरम उदाहरणों में शामिल हैं शून्य गुरुत्वाकर्षण के तहत खपत के लिए घातक फुगु मछली का बढ़िया व्यंजन या आकाशीय आहार तैयार करना।",120,कृषि
"भारतीय सब्जी अनुसंधान संस्थान, वाराणसी","भारतीय सब्जी अनुसंधान संस्थान, वाराणसी, भारतीय कृषि अनुसंधान परिषद, नई दिल्ली का एक घटक संस्थान है। सब्जियों की महत्ता को देखते हुए वर्ष 1992 में सातवीं पंचवर्षीय योजना के अंतगर्त सब्जी अनुसंधान परियोजना निदेशालय के रूप में इसकी स्थापना वाराणसी में की गई। निदेशालय के वृहद कार्य क्षेत्र, उपलब्धियां एवं सब्जी पर अनुसंधान की आवश्यकता को ध्यान में रखते हुए, 17 अगस्त, 1999 को इसे राष्ट्रीय संस्थान “भारतीय सब्जी अनुसंधान संस्थान” के रूप में मान्यता प्रदान की गई।
यह संस्थान, 150 एकड़ में वाराणसी से दक्षिण-पश्चिम दिशा में शहँशाह पुर (अदलपुरा के निकट) में वाराणसी स्टेशन से 20 तथा बाबतपुर हवाई अड्डे से लगभग 40 कि॰मी॰ की दूरी पर स्थित है।",111,कृषि
भारत में सहकारिता आन्दोलन,"भारत में सहकारिता का इतिहास सौ वर्षों से भी अधिक पुराना है। यहाँ, विशेषतः १९४७ के बाद, सहकारी समितियों का बहुत तेजी से विकास हुआ। एक अनुमान के अनुसार, देश में 6 लाख सहकारी समितियां सक्रिय हैं, अरबों लोगों को रोजगार मिल रहा है। ये समितियां अधिकांश समाज में काम कर रही हैं, लेकिन कृषि, उर्वरक और दूध उत्पादन में उनकी भागीदारी सबसे अधिक है। अब बैंकिंग क्षेत्र में सहकारी समितियों की संख्या बढ़ रही है लेकिन देश के सहकारी आन्दोलन कई विसंगतियों के जाल में फंस गए हैं।
1904 में, अंग्रेजों ने भारत में सहकारी समितियों की एक निश्चित परिभाषा बनाई। कानून बनाने के बाद, इस क्षेत्र में कई पंजीकृत संगठन काम करने आए। सहकारी समिति की स्थापना करके, सरकार ने इसे तेजी से बढ़ाने की कोशिश की है। सरकार के प्रयासों ने सहकारी समितियों की संख्या में वृद्धि की, लेकिन सहयोग के बुनियादी तत्त्व धीरे-धीरे समाप्त हुए।",149,कृषि
मसूद पेज़ेशकियान,"Masoud Pezeshkian (फारसीः مسعود پزشکیان) जन्म २९ सितंबर १९५४ एक ईरानी राजनेता और चिकित्सक हैं जो २८ जुलाई २०२४ से ईरान के नौवें राष्ट्रपति के रूप में कार्य कर रहे हैं।
पेज़ेश्कियन ने पिरानशहर और नघादेह काउंटियों के गवर्नर के रूप में कार्य किया और ईरानी संसद के लिए पांच बार चुने गए, तबरीज़, ओस्कु और अज़रशहर चुनावी जिले का प्रतिनिधित्व किया। वह २००१ और २००५ के बीच मोहम्मद खातमी की सरकार में स्वास्थ्य और चिकित्सा शिक्षा मंत्री थे।
उन्होंने २०१३ के राष्ट्रपति चुनाव में भाग लिया था, लेकिन बाद में उन्होंने अपना नाम वापस ले लिया। वे २०२१ के ईरानी राष्ट्रपति चुनाव हार गए। वे ६७ वर्ष की उम्र में पदभार ग्रहण करने वाले सबसे उम्रदराज राष्ट्रपति हैं।",119,कृषि
"बैकुंठपुर, छत्तीसगढ़","बैकुंठपुर (Baikunthpur) भारत के छत्तीसगढ़ राज्य के कोरिया ज़िले में स्थित एक नगर, नगर पालिका और अधिसूचित क्षेत्र समिति है। यह कोरिया जिले का प्रशासनिक मुख्यालय है।",27,कृषि
"राष्ट्रीय भौतिक प्रयोगशाला, भारत","राष्ट्रीय भौतिकी प्रयोगशाला, भारत में नई दिल्ली में स्थित देश की मापन्मानक प्रयोगशाला है। इसे भारत का राष्ट्रीय मेट्रोलॉजिकल संस्थान (एन.एम.आई.) भी कहा जाता है। ये भारत में एस.आई इकाइयों का अनुरक्षण तथा राष्ट्रीय भार तथा माप के मानकों का अंशांकन (कैलीब्रेशन) करती है। इस प्रयोगशाला की स्थापना वैज्ञानिक एवं औद्योगिक अनुसंधान परिषद के अधीन भारत के प्रथम प्रधानमंत्री जवाहरलाल नेहरु द्वाआ ४ जनवरी, १९४७ को हुई थी। डॉ॰ के एस कृष्णन इस प्रयोगशाला के प्रथम निदेशक थे। प्रयोगशाला का मुख्य भवन औपचारिक तौर पर भारत के उपप्रधानमंत्री सरदार वल्लभभाई पटेल द्वारा २१ जनवरी, १९५० को आरम्भ की गई थी। पूर्व प्रधानमंत्री श्रीमती इंदिरा गाँधी द्वारा प्रयोगशाला की रजत जयन्ती का उद्घाटन २३ दिसम्बर १९७५ को किया गया था।
लगभग हरेक आधुनिक हुए राष्ट्र में एक राष्ट्रीय मापिकी संस्थान होता है, जो मापन मानक की देखरेख करता है। यूके में नेशनल फिजिकल लैबोरेटरी है। भारत में ये उत्तरदायित्व राष्ट्रीय भौतिक प्रयोगशाला को मिला हुआ है।",155,कृषि
"भारत का दूतावास, सियोल","सियोल में भारतीय दूतावास, दक्षिण कोरिया के लिए राजनयिक मिशन हैं। वर्तमान राजदूत अमित कुमार हैं।",16,कृषि
बिंगु वा मुथारिका,"बिंगू वा मुथारिका  (जन्म ब्रेटसन वेबस्टर राइसन थॉम ; 24 फरवरी 1934 - 5 अप्रैल 2012) एक मलावी राजनेता और अर्थशास्त्री थे जो अप्रैल 2004 में अपनी मृत्यु तक मई 2004 से मलावी के राष्ट्रपति थे । वह डेमोक्रेटिक प्रोग्रेसिव पार्टी के अध्यक्ष भी थे, जो उन्होंने फरवरी 2005 में स्थापना की; 2009 के आम चुनाव में मलावी की संसद में इसे बहुमत प्राप्त हुआ । अपने दो कार्यकालों के दौरान, उन्हें 2010-2011 में अफ्रीकी संघ के अध्यक्ष के रूप में जाना गया, साथ ही साथ कई घरेलू विवादों के लिए भी जाना गया।2009 में, उन्होंने 13.26 मिलियन डॉलर में एक निजी राष्ट्रपति विमान खरीदा। इसके तुरंत बाद लगभग एक राष्ट्रव्यापी ईंधन की कमी हुई, जिसे आधिकारिक तौर पर तार्किक समस्याओं के लिए जिम्मेदार ठहराया गया था, लेकिन अंतरराष्ट्रीय समुदाय द्वारा सहायता की ठंड के कारण कठोर मुद्रा की कमी के कारण अधिक संभावना थी [2]जबकि लिलोंगोंग में कार्डियक अरेस्ट से उनकी मृत्यु हो गई। 5 अप्रैल 2012 को 78 वर्ष की आयु में कार्यालय।",165,कृषि
पाकशास्त्र,"पाकशास्त्र, पाक क्रिया, पाक कला या रन्धन उपभोग के लिए भोजन प्रस्तुति हेतु ताप का प्रयोग करने की कला, विज्ञान और शास्त्र है। पाकशैली और सामग्री व्यापक रूप से भिन्न होती है, एक खुली अग्नि पर भोजन को ग्रिल करने से लेकर वैद्युतिक चूल्हा का उपयोग करने तक, विभिन्न प्रकार के तंदूरी पाककला, स्थानीय परिस्थितियों को दर्शाती है।
रन्धन के प्रकार भी रसोइयों के कौशल स्तर और प्रशिक्षण पर निर्भर करते हैं। पाक कार्य लोगों द्वारा अपने घरों, रेस्तोराँ और अन्य खाद्य प्रतिष्ठानों में पेशेवर रसोइयों और रसोइयों द्वारा किया जाता है।
ताप या अग्नि से भोजन तैयार करना मानव के लिए एक अनोखी गतिविधि है। न्यूनतम 300,000 वर्ष पूर्व पाकाग्नि के पुरातात्विक साक्ष्य मौजूद हैं, लेकिन कुछ का अनुमान है कि मानव ने 20 लाख वर्ष पहले तक पकाना शुरू कर दिया था।
विभिन्न क्षेत्रों में सभ्यताओं के बीच कृषि, वाणिज्य, व्यापार और परिवहन के विस्तार ने कई नूतन सामग्रियों को पकाने की अनुमति दी। नए आविष्कार और प्रौद्योगिकियाँ, जैसे जल का धारण और क्वथन के लिए मृदा के कुम्भकारी का आविष्कार, रन्धन की तकनीकों का विस्तार। कुछ आधुनिक पाकशास्त्री परोसे जाने वाले व्यंजन के स्वाद को और बढ़ाने के लिए भोजन प्रस्तुति हेतु उन्नत वैज्ञानिक तकनीकों का उपयोग करते हैं।",202,कृषि
प्रयोजनमूलक हिन्दी,"प्रयोजनमूलक हिन्दी (Functional Hindi) से तात्पर्य हिन्दी के उस स्वरुप से है जो विज्ञान, तकनीकी, विधि, संचार एवं अन्य गतिविधियों में प्रयुक्त होती है। इसे 'कामकाजी हिन्दी' भी कहा जाता है।
व्यक्ति द्वारा विभिन्न रूपों में बरती जाने वाली भाषा को भाषा-विज्ञानियों ने स्थूल रूप से सामान्य भाषा और प्रयोजनमूलक भाषा इन दो भागों में विभक्त किया है। कुछ लोग भाषा को 'बोलचाल की भाषा', 'साहित्यिक भाषा' और 'प्रयोजनमूलक भाषा' - इन तीन भागों में विभाजित करते हैं। जिस भाषा का प्रयोग किसी विशेष प्रयोजन के लिए किया जाए, उसे 'प्रयोजनमूलक भाषा' कहा जाता है। यह एक सर्वमान्य तथ्य है कि प्रयोजन के अनुसार शब्द-चयन, वाक्य-गठन और भाषा-प्रयोग बदलता रहता है।

अन्य नाम
व्यावहारिक हिन्दी, कामकाजी हिन्दी, प्रयोजनी हिन्दी, प्रयोजनपरक हिन्दी, प्रायोगिक हिन्दी, प्रयोगपरक हिन्दी ।",126,कृषि
भारत में लुगदी एवं कागज उद्योग,"भारत में २०० ईसापूर्व से १८०० के आसपास तक सन (भांग का पटुआ) से कागज बनाया जाता रहा।]]
भारत का लुगदी एवं कागज उद्योग विश्व के सर्वाधिक कागज उत्पादकों में से एक है किन्तु अब भी विश्व के १० सर्वाधिक उत्पादकों में इसका स्थान नहीं है। हाल के वर्षों में भारत ने कागज उत्पादन की नई प्रौद्योगिकी अपना ली है।",60,कृषि
अतीक अहमद,अतीक अहमद (जन्म 12 अगस्त 1962-मृत्यु 15 अप्रैल 2023) उत्तर प्रदेश का कुख्यात माफिया और नेता था। वह समाजवादी पार्टी से सांसद और उत्तर प्रदेश विधानसभा का सदस्य रह चुका था। 15 अप्रैल 2023 को जाँच के लिए अस्पताल ले जाते समय उसकी व उसके भाई अशरफ की गोली मार कर हत्या कर दी गई।,55,कृषि
