title,content,word_count,topic
लक्ष्मी अग्रवाल,"लक्ष्मी अग्रवाल (जन्म 1 जून 1990) स्टॉप सेल एसिड और एक टीवी होस्ट के साथ एक भारतीय प्रचारक हैं। वह एक एसिड अटैक सर्वाइवर है और एसिड अटैक पीड़ितों के अधिकारों के लिए बोलती है। 2005 में 15 साल की उम्र में, एक 32 वर्षीय व्यक्ति गुड्डू उर्फ ​​नईम खान ने उन पर हमला किया था, जिससे शादी करने के लिए उन्होंने इंकार कर दिया था। उनकी कहानी, अन्य लोगों के बीच, हिंदुस्तान टाइम्स द्वारा एसिड अटैक पीड़ितों पर एक श्रृंखला में कही गई थी। उसने एसिड की बिक्री पर अंकुश लगाने के लिए एक याचिका के लिए 27,000 हस्ताक्षर एकत्र करने और भारतीय सर्वोच्च न्यायालय में इसका कारण लेने के लिए एसिड हमलों के खिलाफ भी वकालत की है। उनकी याचिका ने उच्चतम न्यायालय को केंद्र और राज्य सरकारों को एसिड की बिक्री को विनियमित करने का आदेश दिया, और संसद ने एसिड हमलों के अभियोग को आगे बढ़ाने के लिए आसान बना दिया।
वह स्टॉप सेल एसिड की संस्थापक है, जो एसिड हिंसा और एसिड की बिक्री के खिलाफ एक अभियान है। लक्ष्मी ने #StopSaleAcid के साथ इस अभियान की शुरुआत की जिसने राष्ट्रव्यापी व्यापक समर्थन हासिल किया। महिला और बाल विकास मंत्रालय, पेयजल और स्वच्छता मंत्रालय और उनके अभियान स्टॉप सेल एसिड के लिए यूनिसेफ से अंतर्राष्ट्रीय महिला सशक्तिकरण पुरस्कार 2019 मिला। वह छन्न फाउंडेशन की पूर्व निदेशक भी हैं, जो भारत में एसिड हमलों से बचे लोगों की मदद के लिए समर्पित एक गैर सरकारी संगठन है। लक्ष्मी को यूएस फर्स्ट लेडी मिशेल ओबामा द्वारा 2014 का अंतर्राष्ट्रीय महिला सम्मान पुरस्कार मिला। उन्हें एनडीटीवी इंडियन ऑफ़ द ईयर के रूप में भी चुना गया था।
2020 में इनके जीवन पर आधारित बालीवुड फ़िल्म छ्पाक रिलीज़ हुई।",280,महिला
भारती कश्यप,"डॉ. भारती कश्यप (जन्म 15 मई १९६७) भारत के झारखंड राज्य की प्रसिद्द नेत्र रोग विशेषज्ञ हैं, उन्हें विज़न एवं जननी सुरक्षा लेडी के नाम से भी जाना जाता है। उनका सामाजिक दायित्वों के निर्वहन का अंधत्व निवारण से लेकर महिला स्वास्थ्य सुरक्षा तक का बड़ा दायरा है।
झारखण्ड जन-जातीय क्षेत्रों में महिलाओं, गरीबों एवं बच्चों के कल्याणार्थ उन्होंने अपना जीवन समर्पित किया है। उनके अथक प्रयासों के फलस्वरूप लाखों गरीब लोग, महिलाएं एवं बच्चे चिकित्सा सम्बन्धी अपनी समस्याओं का समय रहते निदान कर पाए! 2018 में उन्हें उनके सामाजिक कार्यों के लिए भारत के राष्ट्रपति श्री राम नाथ कोविन्द जी के द्वारा नारी शक्ति सम्मान 2017 से सम्मानित किया गया।",111,महिला
रुहोल्ला खोमैनी,"अयातोल्ला अल-उज़्मा सायद रुहोल्ला मोसावि खोमैनी  (फ़ारसीروح الله موسوی خمینی),
(24 सप्तम्बर, 1902 – 3 जून 1989) शिया मुसल्मान इमाम (अथवा मर्जा) थे। वे ईरान में जन्मे थे। ईरानी क्रान्ति के बाद, उन्होने ईरान में ग्यारह वर्ष शासन किया। वे 1979 से 1989 तक वे ईरान के रहबरे इंकिलाब रहे। उनको सन् १९७९ में टाइम पत्रिका ने साल के सबसे प्रभावशाली नेता के रूप में चुना था।
भारतीय मूल के ब्रितानी लेखक सलमान रुश्दी के ख़िलाफ़ फतवा जारी करने और कई राजनैतिक क़ैदियों को मरवाने के आदेश भी उन्होंने ही दिए।",91,महिला
गिरिवाला महान्ति,"‘’’गिरिवाला महान्ति’’’ (जन्म १९४७) ओड़िसा की एक प्रख्यात नारीवादी कवयित्री, समाज सुधारक तथा नारी सशक्तिकरण की प्रवक्ता हैं । वह ओड़िसा की पहली महिला हवाई जहाज़ पायलट भी हैं । उन्होंने ओडिया साहित्य क्षेत्र में भी अपना उल्लेखनीय योगदान दिया ।",41,महिला
प्रमदा मेनन,"प्रमदा मेनन एक विचित्र नारीवादी कार्यकर्ता हैं, हास्य अभिनेता, लिंग और लैंगिकता सलाहकार है। वह कार्य में सशक्तिकरण के लिए संसाधन की सह-संस्थापक है।",24,महिला
रानी लक्ष्मीबाई,रानी लक्ष्मीबाई (जन्म: 19 नवम्बर 1828 – मृत्यु: 18 जून 1858) मराठा शासित झाँसी राज्य की रानी और 1857 की राज्यक्रान्ति की द्वितीय शहीद वीरांगना थीं। उन्होंने सिर्फ 29 वर्ष की उम्र में अंग्रेज साम्राज्य की सेना से युद्ध किया और रणभूमि में वीरगति को प्राप्त हुईं। बताया जाता है कि सिर पर तलवार के वार से शहीद हुई थी लक्ष्मीबाई।,61,महिला
रीती पाठक,"रीति पाठक (जन्म 1 जुलाई 1977) मध्य प्रदेश के सीधी से भारत में संसद के निचले सदन के सदस्य हैं जो भारतीय जनता पार्टी के हैं । वह पहली बार 2014 के लोकसभा चुनावों में मध्य प्रदेश की सीधी सीट से भारतीय जनता पार्टी के उम्मीदवार के रूप में चुने गए थे, और कांग्रेस उम्मीदवार को 1,08,046 वोटों के अंतर से हराकर सीट जीती थी। वह 2019 में 17 वीं लोक सभा के लिए फिर से चुनी गईं। उन्होंने कांग्रेस प्रत्याशी श्री अजय सिंह को 2,86,524 मतों के अंतर से हराकर सीधी सीट जीती।",94,महिला
बरली ग्रामीण महिला विकास संस्थान,"बरली ग्रामीण महिला विकास संस्थान इन्दौर स्थित एक संस्थान है जो ग्रामीण तथा जनजातीय महिलाओं के लिए आवासीय प्रशिक्षण कार्यक्रम चलाती है जिनको विद्यालय जाने का अवसर नहीं मिला या जिन्होने बीच में ही पढ़ाई छोड़ दी। ज्ञातव्य है कि भिलाला जनजाति में 'बरली' लड़कियों का एक बहुत ही सामान्य नाम है। इस संस्था का मानना है कि महिलाएँ समाज की केन्द्रीय स्तम्भ हैं। यह सम्स्थान इन्दौर के उत्तरी भाग में स्थित है। 
इस संस्थान में प्रशिक्षण पाने वाली अधिकांश महिलाएँ पश्चिमी मध्य प्रदेश से आती हैं। यहाँ सामाजिक और आर्थिक रूप से पिछड़े (जैसे अनुसूचित जाति, जनजाति, पिछड़े वर्ग, शारीरिक रूप से विकलांग, अनाथ, विधवा, परित्यक्ता आदि को प्राथमिकता दी जाती है। छत्तीसगढ़ क्षेत्र में कांकेर, इमलीपाड़ा में इसकी तीन शाखाएँ हैं जहाँ की व्यवस्था बरली से प्रशिक्षण-प्राप्त लड़कियाँ चलातीं हैं।",132,महिला
स्त्री शक्ति पुरस्कार,"स्त्री शक्ति पुरस्कार (महिला शक्ति पुरस्कार), भारत का राष्ट्रीय सम्मान की एक श्रृंखला है, जो अपनी असाधारण उपलब्धि के लिए व्यक्तिगत महिलाओं को प्रदान किया जाता है। यह पुरस्कार महिलाओं और बाल विकास मंत्रालय, भारत सरकार द्वारा छह श्रेणियों में दिया गया है। यह कठिन परिस्थितियों में एक महिला की हिम्मत की भावना को पहचानता है, जिसने अपने निजी या पेशेवर जीवन में साहस की भावना स्थापित की है। यह पुरस्कार महिलाओं के सशक्तिकरण और महिलाओं के मुद्दों को बढ़ाने में एक व्यक्ति के अग्रणी योगदान को भी पहचानता है। 

१९९१ में स्थापित, अंतरराष्ट्रीय महिला दिवस के अवसर पर राष्ट्रपति द्वारा प्रत्येक वर्ष नई दिल्ली में ८ मार्च को पुरस्कार प्रदान किया जाता है। इस पुरस्कार में एक लाख रुपये (१००,००० रुपये) और एक प्रमाण पत्र का नकद पुरस्कार दिया जाता है।
भारत के राष्ट्रपति प्रणब मुखर्जी ने २०१२ में रानी लक्ष्मीबाई स्त्री शक्ति पुरस्कार मृत्यु के बाद दिल्ली में हुए सामूहिक बलात्कार मामला पीड़ित निर्भया को दिया गया था।",160,महिला
वानति श्रीनिवासन,"वानति श्रीनिवासन(Vāṉathi Srīṉivāsaṉ) एक भारतीय राजनीतिज्ञ, सामाजिक कार्यकर्ता और एक वकील हैं जो वर्तमान में भारतीय जनता पार्टी की महिला विंग के राष्ट्रीय अध्यक्ष के रूप में कार्यरत हैं।  वह कोयंबटूर दक्षिण निर्वाचन क्षेत्र से तमिलनाडु विधान सभा की सदस्य हैं।  एक वकील के रूप में, उन्होंने 1993 से चेन्नई उच्च न्यायालय में अभ्यास किया है। 
वनथी एक महिला कल्याण कार्यकर्ता, वक्ता, सामाजिक कार्यकर्ता, लेखक और परोपकारी भी हैं। वह बालिका शिक्षा की वकालत, एकल माताओं के सशक्तिकरण के लिए जानी जाती हैं और लाइव-टेलीविज़न बहस पर विनम्र और सटीक राजनीतिक उत्तर देने वाले कुछ राजनेताओं में से एक हैं।",100,महिला
बांग्लादेश में महिलाएं,"बांग्लादेश में महिलाओं की स्थिति पिछले कुछ शताब्दियों में कई महत्वपूर्ण बदलावों के अधीन रही है। 1971 में देश ने अपनी आजादी हासिल करने के बाद से बांग्लादेशी महिलाओं ने महत्वपूर्ण प्रगति की है। पिछले चार दशकों में महिलाओं के लिए राजनीतिक सशक्तिकरण में वृद्धि हुई है, बेहतर नौकरी की संभावनाएं, शिक्षा के अवसर बढ़े हैं और बांग्लादेश की नीतियों के संबंध में उनके अधिकारों की रक्षा के लिए नए कानूनों को अपनाना है। महिलाओं के अधिकार पितृसत्तात्मक मूल्यों से प्रभावित हैं। [3] 2018 तक, बांग्लादेश के प्रधान मंत्री, संसद के अध्यक्ष, विपक्ष के नेता महिलाएं थीं|",97,महिला
गोपालपुर प्रखण्ड (भागलपुर),"गोपलपुर प्रखंड बिहार राज्य के भागलपुर जिले में स्थित एक प्रशासनिक विभाजन है। राज्य के पूर्वी हिस्से में स्थित, गोपालपुर प्रखंड कई गांवों और ग्रामीण क्षेत्रों को शामिल करता है, जो क्षेत्र की सामाजिक-आर्थिक संरचना में योगदान करते हैं।",39,महिला
हेमा सरदेसाई,हेमा सरदेसाई एक भारतीय पार्श्व गायक और गीतकार है।  हेमा भारत के तटीय राज्य गोवा में रहती हैं और उनका जन्म मुंबई में हुआ था।  वह बीवी नंबर 1 और जानम समझा करो  जैसी फिल्मों से गाने के साथ 1990 के दशक में प्रसिद्ध हुई।,45,महिला
"महिलाओं के यौन उत्पीड़न के खिलाफ कार्यस्थल पर सुरक्षा विधेयक, 2010","महिलाओं के यौन उत्पीड़न के खिलाफ कार्यस्थल पर सुरक्षा विधेयक, 2010 बनाएँ पर 3 अगस्त 2012, सोमवार को मंजूरी दे दी भारत के केंद्रीय मंत्रिमंडल ने संसद में कार्य स्थलों पर महिलाओं के लिए एक सुरक्षित वातावरण सुनिश्चित करने के लिए सार्वजनिक और निजी दोनों क्षेत्रों में, चाहे संगठित या असंगठित. उपाय लिंग समानता और सशक्तिकरण को प्राप्त करने में मदद मिलेगी.
प्रस्तावित विधेयक, यदि अधिनियमित यह सुनिश्चित करना होगा कि सभी कार्य स्थलों पर यौन उत्पीड़न के खिलाफ महिलाओं की रक्षा कर रहे हैं, यह सार्वजनिक या निजी क्षेत्र में. यह उनके लिए शर्तों को हर जगह काम करने में समानता, जीवन और स्वतंत्रता और समानता लिंग का अधिकार की प्राप्ति के लिए योगदान देगा। कार्यस्थल पर सुरक्षा की भावना काम में महिलाओं की भागीदारी में सुधार, उनके आर्थिक सशक्तिकरण और समावेशी विकास में परिणाम होगा।",137,महिला
ज़रीना स्क्रूवाला,"ज़रीना स्क्रूवाला (पूर्व नाम: ज़रीना मेहता, जन्म: 1961) एक भारतीय महिला उद्यमी और परोपकारी है। वर्तमान में वे फिल्म निर्माण से जुड़ी हैं और स्वदेश फाउंडेशन के प्रबंध न्यासी है।",30,महिला
महंत प्रतापपुरी,"महंत प्रतापपुरी (जन्म 05 अगस्त 1964) एक भारतीय आध्यात्मिक धर्मगुरू, राजनीतिज्ञ तथा वर्तमान राजस्थान विधानसभा में जैसलमेर जिले के पोकरण से विधायक है। वे भारतीय जनता पार्टी दल के राजनेता है। वे बाड़मेर जिले की चौहटन तहसील के तारातरा मठ के महंत हैं।वर्तमान में वह  आध्यात्मिक उपदेश और राजनीति के क्षेत्रों में भी सक्रिय रूप से शामिल हैं।",58,महिला
बेबी रानी मौर्य,"बेबी रानी मौर्य  जाटव  (जन्म: 15 अगस्त 1956) एक भारतीय राजनीतिज्ञ हैं, जो 26 अगस्त 2018 से उत्तराखण्ड की सातवीं राज्यपाल के तौर पर कार्यरत थी। 1990 के दशक की शुरुआत में भारतीय जनता पार्टी की सदस्य के तौर पर सक्रिय राजनीति में प्रवेश करने वाली मौर्य 1995 से 2000 तक आगरा की महापौर, तथा फिर 2002 से 2005 तक राष्ट्रीय महिला आयोग की सदस्य भी रह चुकी हैं। 2022 उत्तर प्रदेश बीजेपी सरकार में कैबिनेट मंत्री हैं। बीजेपी ने बेबी रानी मौर्य को महिला कल्याण, बाल विकास एवं पुष्टाहार विभाग का जिम्मा दिया है|",95,महिला
सेन्टर फॉर सोशिअल अक्ट्श्न्,,0,महिला
भारत में लैंगिक असमानता,,0,महिला
माय लाइफ (पुस्तक),"द स्टोरी ऑफ माय लाइफ अमेरिका की प्रसिद्ध लेखिका हेलेन केलर(1903) द्वारा लिखित एक आत्मकथा है। इस पुस्तक में वर्तमान में महिलाओं की शिक्षा और उनके सशक्तिकरण का सवाल हमारे देश में अब भी बना हुआ है। ऐसे में हेलन किसी के लिए भी प्रेरणा हो सकती हैं। हेलन केलर मूक-बधीर थीं, इसके बावजूद उन्होंने आम स्टूडेंट्स के साथ ग्रैजुएशन करने में कायमाबी पाई। उनके जीवन की कहानी पढ़ कर हमें अपनी मुसीबतें बौनी नजर आने लगेंगी। इसका हिंदी अनुवाद भी प्रभात प्रकाशन ने मेरे जीवन की कहानी नाम से निकाला है।",92,महिला
