title,content,word_count,topic
भारतीय अर्थव्यवस्था,"भारत की अर्थव्यवस्था विश्व की पांचवीं सबसे बड़ी अर्थव्यवस्था है। क्षेत्रफल की दृष्टि से भारत विश्व में सातवें स्थान पर है, जनसंख्या में भारत का स्थान दूसरा था, किंतु वर्ष 2023 के मध्य से प्रथम स्थान पर है और केवल 2.4% क्षेत्रफल के साथ भारत विश्व की जनसंख्या के 17.76% भाग को शरण प्रदान करता है।
1991 से भारत में बहुत तेज आर्थिक प्रगति हुई है जब से उदारीकरण और आर्थिक सुधार की नीति लागू की गयी है और भारत विश्व की एक आर्थिक महाशक्ति के रूप में उभरकर आया है। सुधारों से पूर्व मुख्य रूप से भारतीय उद्योगों और व्यापार पर सरकारी नियन्त्रण का बोलबाला था और सुधार लागू करने से पूर्व इसका जोरदार विरोध भी हुआ परन्तु आर्थिक सुधारों के अच्छे परिणाम सामने आने से विरोध काफी हद तक कम हुआ है। हालाँकि मूलभूत ढाँचे में तेज प्रगति न होने से एक बड़ा तबका अब भी नाखुश है और एक बड़ा हिस्सा इन सुधारों से अभी भी लाभान्वित नहीं हुआ हैं।",163,प्रौद्योगिकी
गोदरेज और बॉयस,"गोदरेज एंड बॉयस मैनुफैक्चरिंग कंपनी लिमिटेड गोदरेज समूह की प्रमुख कंपनी है। १८९७ में मुंबई, महाराष्ट्र में स्थापित गोदरेज और बॉयस एक निजी तौर पर आयोजित कंपनी है, जिसकी १० उद्योगों में उपस्थिति है - एयरोस्पेस, रक्षा, स्वच्छ ऊर्जा, रेलवे और ऑटोमोटिव जैसे महत्वपूर्ण उद्योगों के लिए जटिल और कस्टम इंजीनियरिंग समाधान बनाने से लेकर ब्रांडेड सामान के निर्माण तक।
मुंबई के विक्रोली में पिरोजशानगर में मुख्यालय रखने वाली गोदरेज एंड बॉयस यूरोप, अमेरिका, मध्य पूर्व, अफ्रीका और दक्षिण पूर्व एशिया में भी उत्पाद पेश करता है।
श्री जमशेद गोदरेज कंपनी के अध्यक्ष और प्रबंध निदेशक हैं।",97,प्रौद्योगिकी
प्रबंधन परामर्श (मैनेजमेंट कंसल्टिंग),"प्रबंधन परामर्श प्राथमिक रूप से मौजूदा व्यावसायिक समस्याओं के विश्लेषण के माध्यम से संगठनो को अपने प्रदर्शन को बेहतर बनाने और सुधार के लिए योजनाओं के विकास में मदद करने की प्रथा और उद्योग दोनों को संकेत करता है।
संगठन कई कारणों से प्रबंधन सलाहकारों की सेवाओं को हासिल करते हैं जिसमें बाहरी (और शायद निष्पक्ष) सलाह हासिल करना और सलाहकारों की विशिष्ट विशेषज्ञता का उपयोग करना भी शामिल है।
कई संगठनों के साथ सम्बन्ध होने और जोखिम होने की वजह से, परामर्श कंपनियों को कथित तौर पर उद्योग की ""बेहतरीन प्रथाओं"" से सचेत रहना पड़ता है हालांकि एक संगठन से दूसरे संगठन में ऐसी प्रथाओं के स्थानांतरण की योग्यता विचाराधीन परिस्थितियों के आधार पर समस्याग्रस्त हो सकती है.
परामर्श कंपनियां संगठनात्मक परिवर्तन प्रबंधन सहयोग, प्रशिक्षण कौशलों का विकास, प्रौद्योगिकी कार्यान्वयन, रणनीति विकास, या परिचालनात्मक सुधार सेवाएं भी प्रदान कर सकती हैं। प्रबंधन सलाहकार आम तौर पर समस्याओं की पहचान के मार्गदर्शन के लिए और व्यावसायिक कार्यों को अधिक प्रभावी या कुशल तरीके से करने के लिए सिफारिशों के आधार के रूप में काम करने के लिए अपने खुद के, स्वामित्व वाले तरीकों या रूपरेखाओं का इस्तेमाल करते हैं।",189,प्रौद्योगिकी
वरिकशायर,"वरिकशायर (अंग्रेज़ी: Warwickshire) इंग्लैंड के वेस्ट मिडलैंड्स क्षेत्र में एक काउंटी है। काउंटी शहर वारविक है, और सबसे बड़ा शहर नुनेटन है। यह काउंटी स्ट्रैटफ़ोर्ड-ऑन-एवन में विलियम शेक्सपियर के जन्मस्थान और न्युनेटन में विक्टोरियन उपन्यासकार जॉर्ज एलियट (जन्म मैरी एन इवांस) के लिए प्रसिद्ध है। अन्य महत्वपूर्ण शहरों में रग्बी, लीमिंगटन स्पा, बेडवर्थ, केनिलवर्थ और एथरस्टोन शामिल हैं। काउंटी ऐतिहासिक कस्बों और बड़े ग्रामीण क्षेत्रों का मिश्रण प्रदान करता है। यह अंतरराष्ट्रीय और घरेलू पर्यटकों के लिए मध्ययुगीन और हाल के इतिहास दोनों का पता लगाने के लिए एक लोकप्रिय गंतव्य है।
काउंटी को उत्तर वार्विकशायर, नुनेटन और बेडवर्थ, रग्बी, वारविक और स्ट्रैटफ़ोर्ड-ऑन-एवन के पांच जिलों में विभाजित किया गया है।
वर्तमान काउंटी सीमाएँ 1974 में स्थानीय सरकार अधिनियम 1972 द्वारा निर्धारित की गई थीं। ऐतिहासिक काउंटी सीमाओं में कोवेंट्री, सटन कोल्डफ़ील्ड और सोलिहुल, साथ ही साथ बर्मिंघम और टैमवर्थ का अधिकांश भाग शामिल था।",145,प्रौद्योगिकी
जैव विविधता,"जैववैविध्य या जैव विविधता पृथ्वी पर जीवन की विविधता और परिवर्तनशीलता है। जैववैविध्य आनुवंशिक (आनुवंशिक परिवर्तनशीलता), प्रजाति (प्रजाति विविधता), और पारितन्त्र (पारितान्त्रिक वैविध्य) स्तर पर भिन्नता का एक माप है। जैव वैविध्य वन्य जीवन और कृषि फसल प्रजातियों में अत्यधिक समृद्ध है, रूप और कार्य में विविध है किन्तु अन्तर्नैभर्यों के कई संजालों के माध्यम से एक तन्त्र में सुक्ष्म रूप में एकीकृत है।
जैववैविध्य पृथ्वी पर समान रूप से वितरित नहीं है; भूमध्य रेखा के पास के क्षेत्र में उष्ण जलवायु और उच्च प्राथमिक उत्पादन के परिणामस्वरूप यह सामान्यतः उष्णकटिबंधीय क्षेत्रों में अधिक होता है। उष्णकटिबन्धीय वन परितन्त्र पृथ्वी पृष्ठ के 10% से कम को आच्छादित करते हैं और इसमें विश्व की लगभग 90% प्रजातियाँ शामिल हैं। सामुद्रिक जैव वैविध्य सामान्यतः पश्चिमी प्रशान्त क्षेत्र में तटों के साथ अधिक होती है, जहाँ समुद्र पृष्ठ तापमान सर्वाधिक होता है, और सभी महासागरों में मध्य अक्षांशीय बन्ध में होता है। प्रजाति वैविध्य में अक्षांशीय ढाल हैं। जैववैविध्य साधारणतः तप्तस्थलों में समूहीकृत होती है, और समय के साथ बढ़ती जा रही है, किन्तु वनोन्मूलन के प्राथमिक परिणाम के रूप में भविष्य में धीमी होने की संभावना होगी। इसमें विकासवादी, पारिस्थितिक और सांस्कृतिक प्रक्रियाएँ शामिल हैं जो जीवन को बनाए रखती हैं।
मानवोद्भव के बाद की अवधि में एक निरन्तर जैव वैविध्य में क्षति और अनुवांशिक वैविध्य के साथ-साथ होलोसीन विलुप्त होने का नाम दिया गया है, और इसे अक्सर षष्ठ सामूहिक विलुप्त होने के रूप में सन्दर्भित किया जाता है। क्षति मुख्य रूप से मानव प्रभावों, विशेष रूप से आवास विनाश के कारण होती है। इसके विपरीत, जैववैविध्य मानव स्वास्थ्य पर कई प्रकार से सकारात्मक प्रभाव डालती है, यद्यपि कुछ नकारात्मक प्रभावों का अध्ययन किया गया है।",275,प्रौद्योगिकी
लंदन के विश्वविद्यालय,"लंदन दुनिया के उन शहरों में से एक है जहां विश्वविद्यालयों और उच्च शिक्षा संस्थानों का सबसे अधिक जमावड़ा है। यहां 40 उच्च शिक्षा संस्थान हैं (उन विदेशी विश्वविद्यालयों को छोड़कर जिनकी लंदन में शाखाएं हैं) और छात्रों की कुल संख्या 400,000 से अधिक है। लंदन के संस्थानों में से कुछ अत्यंत प्राचीन और विश्व-प्रसिद्ध कॉलेज हैं जो आज संघीय लन्दन विश्वविद्यालय, आधुनिक विश्वविद्यालयों और साथ ही साथ कई छोटे और अक्सर अत्यधिक विशेषज्ञ विश्वविद्यालय और कॉलेजों का गठन करते हैं। इसके अलावा, 180 से अधिक देशों के 45,000 छात्र लंदन विश्वविद्यालय वैदेशिक प्रणाली का पालन करते हैं जो 1858 में स्थापित हुई थी।",104,प्रौद्योगिकी
स्काईवे,"स्काईवे (SkyWay) - उन कंपनियों का एक समूह है जिनकी मुख्य गतिविधि एक उन्नत परिवहन प्रणाली का निर्माण है, जिसमें लंगर के समर्थन के बीच फैला हुआ एक निलंबित स्ट्रिंग-रेल ओवरपास के साथ यातायात का आयोजन किया जाता है।",39,प्रौद्योगिकी
लुईस माउंटबेटन,"लुइस फ्रांसिस एल्बर्ट विक्टर निकोलस जॉर्ज माउंटबेटन, बर्मा के पहले अर्ल माउंटबेटन, बेड़े के एडमिरल, केजी, जीसीबी, ओएम, जीसीएसआई, जीसीआईई, जीसीवीओ, डीएसओ, पीसी, एफआरएस (पूर्व में बैटनबर्ग के राजकुमार लुइस, 25 जून 1900 - 27 अगस्त 1979), एक ब्रिटिश राजनीतिज्ञ और नौसैनिक अधिकारी व राजकुमार फिलिप, एडिनबर्ग के ड्यूक (एलिजाबेथ II के पति) के मामा था। वह भारत के आखिरी वायसरॉय (1947) था और स्वतंत्र भारतीय संघ के पहले गवर्नर-जनरल (1947-48) था, जहां से 1950 में आधुनिक भारत का गणतंत्र उभरेगा। 1954 से 1959 तक वह पहले सी लॉर्ड था, यह पद उनके पिता बैटनबर्ग के राजकुमार लुइस ने लगभग चालीस साल पहले संभाला था। 1979 में उनकी हत्या प्रोविजनल आयरिश रिपब्लिकन आर्मी (आईआरए) ने कर दी, जिसने आयरलैंड रिपब्लिक की स्लीगो काउंटी में मुल्लाग्मोर में उनकी मछली मरने की नाव, शैडो V में बम लगा दिया था। वह बीसवीं सदी के मध्य से अंत तक ब्रिटिश साम्राज्य के पतन के समय के सबसे प्रभावशाली और विवादित शख्सियतों में से एक था।
लार्ड माउंटबॅटन भारत के आखिरी वायसराय  था।",169,प्रौद्योगिकी
मर्सिडीज-बेंज एस-क्लास,"मर्सिडीज-बेंज एस-क्लास, विलासिता सिडैन कार की श्रृंखला है जिसका उत्पादन डेमलर एजी के एक प्रभाग मर्सिडीज-बेन्ज़ द्वारा किया जाता है। इस श्रेणी को आधिकारिक तौर पर W116 एस-क्लास के साथ 1972 में पेश किया गया था, जिसने 1950 के दशक के मध्य के मर्सिडीज-बेन्ज़ मॉडल का स्थान लिया। मर्सिडीज बेंज की श्रृंखला में सर्वोत्कृष्ट के रूप में, एस-क्लास ने कंपनी के कई नवीनतम नवाचारों को पहली बार पेश किया, जिसमें शामिल है ड्राइवट्रेन प्रौद्योगिकी, आतंरिक सुविधाएं और सुरक्षा प्रणालियां (जैसे कि प्रथम सीट बेल्ट प्रीटेंशनर). एस-क्लास, लक्जरी कारों में दुनिया में सबसे अधिक बिकने वाली है, और इसकी नवीनतम पीढ़ी, W221 एस-क्लास का प्रीमियर 2006 में एक बिलकुल नई डिजाइन के रूप में हुआ। जैसा कि इसकी पिछली पुनरावृत्ति में हुआ था, W221 एस-क्लास की बिक्री स्टैंडर्ड और लम्बे व्हीलबेस संस्करणों में होती है; V6, V8, V12, डीजल और हाइब्रिड पॉवरट्रेन को पेश किया गया है। सभी मॉडल जो मेक्सिको में बनते हैं या संयुक्त राज्य अमेरिका में बेचे जाते हैं वे केवल लम्बे व्हीलबेस में उपलब्ध हैं।
""एस-क्लास"" नाम को जर्मन शब्द ""सोन्डेरक्लासे"" से लिया गया जिसका कि ""एस-क्लास"" एक संक्षिप्त रूप है। सोन्डेरक्लासे का अर्थ है ""विशेष क्लास"" (या कहिये:""अपने स्वयं के क्लास में"") और मोटर वाहन के मामले में यह ""एक विशेष परिकल्पित कार"" को इंगित करता है। हालांकि दशकों तक बोलचाल की भाषा में इसे इस्तेमाल किया गया, 1972 में अपने आधिकारिक प्रयोग के बाद, पांच-पीढ़ियों के आधिकारिक तौर पर नामित S-क्लास कारों का उत्पादन किया गया। एस-क्लास के पिछले टू-डोर कूप मॉडल को एसईसी (SEC) और बाद में एस-कूप के रूप में जाना गया। 1998 में उन्हें सीएल-क्लास के रूप में अलग श्रृंखला में निकाला गया, लेकिन 2011 मॉडल वर्ष के लिए इसे एस-कूप के रूप में पुनः नामकरण किया जाएगा.",286,प्रौद्योगिकी
पब्लिसिस सैपिएंट,"पब्लिसिस सैपिएंट एक वैश्विक डिजिटल परिवर्तन परामर्श कंपनी है और दुनिया भर में २०,००० लोगों और ५० से अधिक कार्यालयों के साथ पब्लिसिस ग्रुप का डिजिटल व्यवसाय परिवर्तन केंद्र है। इसे मूल रूप से १९९० में कैम्ब्रिज, मैसाचुसेट्स में सैपिएंट के रूप में स्थापित किया गया था। २०१५ में $३.७ अरब के सौदे के बाद सैपिएंट फ्रांसीसी बहुराष्ट्रीय विज्ञापन फर्म पब्लिसिस की एक स्वतंत्र सहायक कंपनी बन गई। इसका मुख्यालय बोस्टन मैसाचुसेट्स में बना हुआ है और नेतृत्व बरकरार रखा गया है।
२०१६ में कंपनी ने अपने दो डिवीजनों, सैपिएंटनाइट्रो और रेज़ोरफ़िश को मिलाकर सैपिएंटरेज़रफ़िश बनाया, जिसका नेतृत्व एलन वेक्सलर ने किया था। कुछ साल बाद २०१९ में सीईओ निगेल वाज़ के नेतृत्व में सैपिएंटरेज़रफ़िश और सैपिएंट कंसल्टिंग को एक ब्रांड, पब्लिसिस सैपिएंट, में समेकित किया गया।",127,प्रौद्योगिकी
केल्टन,"केल्टन टेक सॉल्यूशंस लिमिटेड एक भारतीय सूचना प्रौद्योगिकी और आउटसोर्सिंग कंपनी है जिसका मुख्यालय हैदराबाद, भारत में है और इसके कार्यालय संयुक्त राज्य अमेरिका और यूरोप में हैं। कंपनी ने १,८०० से अधिक कर्मचारियों के साथ ₹७.३९ अरब का शुद्ध राजस्व दर्ज किया।
केल्टन को बंबई स्टॉक एक्सचेंज [बीओएम: ५१९६०२] और नेशनल स्टॉक एक्सचेंज ऑफ़ इंडिया में [KELLTONTEC] Error: {{Lang}}: unrecognized language tag: KELLTONTEC (help) प्रतीक के तहत सूचीबद्ध किया गया है।",72,प्रौद्योगिकी
