title,content,word_count,topic
मलयालम साहित्य का इतिहास,"मलयालम साहित्य का इतिहास शीर्षक पुस्तक के लिए  मलयालम साहित्य का इतिहास:परमेश्वरम नायर देखें।

मलयालम् भाषा अथवा उसके साहित्य की उत्पत्ति के संबंध में सही और विश्वसनीय प्रमाण प्राप्त नहीं हैं। फिर भी मलयालम् साहित्य की प्राचीनता लगभग एक हजार वर्ष तक की मानी गई हैं। भाषा के संबंध में हम केवल इस निष्कर्ष पर ही पहुँच सके हैं कि यह भाषा संस्कृतजन्य नहीं है - यह द्रविड़ परिवार की ही सदस्या है। परंतु यह अभी तक विवादास्पद है कि यह तमिल से अलग हुई उसकी एक शाखा है, अथवा मूल द्रविड़ भाषा से विकसित अन्य दक्षिणी भाषाओं की तरह अपना अस्तित्व अलग रखनेवाली कोई भाषा है। अर्थात् समस्या यही है कि तमिल और मलयालम् का रिश्ता माँ-बेटी का है या बहन-बहन का। अनुसंधान द्वारा इस पहेली का हल ढूँढने का कार्य भाषा-वैज्ञानिकों का है और वे ही इस गुत्थी को सुलझा सकते हैं। जो भी हो, इस बात में संदेह नहीं है कि मलयालम् का साहित्य केवल उसी समय पल्लवित होने लगा था जबकि तमिल का साहित्य फल फूल चुका था। संस्कृत साहित्य की ही भाँति तमिल साहित्य को भी हम मलयालम् की प्यास बुझानेवाली स्त्रोतस्विनी कह सकते हैं।
सन् 3100 ईसापूर्व से लेकर 100 ईसापूर्व तक यह प्राचीन तमिळ का एक स्थानीय रूप थी। ईसा पूर्व प्रथम सदी से इसपर संस्कृत का प्रभाव हुआ। तीसरी सदी से लेकर पन्द्रहवीं सदी के मध्य तक मलयालम का मध्यकाल माना जाता है। इस काल में जैनियों ने भी भाषा को प्रभावित किया। आधुनिक काल में सन् 1795 में परिवर्तन आया जब इस राज्य पर अंग्रेजी शासन पूर्णरूपेण स्थापित हो गया।",259,रंगमंच
फ्रांस की रूपरेखा,"निम्नलिखित रूपरेखा, फ्रांस का एक अवलोकन और सामयिक गाइड के रूप में है:
फ़्रांस – पश्चिमी यूरोप के कई विदेशी क्षेत्रों का एक देश है। मेट्रोपॉलिटन फ्रांस भूमध्य सागर से अंग्रेजी चैनल और उत्तरी सागर तक और राइन से अटलांटिक महासागर तक फैला हुआ है। इसके आकार से, इसे अक्सर फ्रेंच में 'षट्कोण' (""द हेक्सागोन"") के रूप में जाना जाता है।",61,रंगमंच
भारत में वेश्यावृत्ति,"भारत में वेश्यावृत्ति कानूनी है, लेकिन अभी भी इसके कुछ हिस्सों की कई गतिविधियाँ अवैध हैं जैसे- फुटपाथ पर खड़े होकर अनुरोध करने, धंधा करने, याचना करने पर अंकुश लगाने, वेश्यालय का मालिक होने या प्रबंधन करने, होटल में वेश्यावृत्ति करने, बाल वेश्यावृत्ति, दलाली और पैंडरिंग आदि। हालांकि, मुंबई, दिल्ली, कोलकाता, बैंगलोर और चेन्नई सहित भारतीय शहरों में अवैध रूप से कई वेश्यालय चल रहे हैं। एचआईवी/एड्स पर संयुक्त राष्ट्र कार्यक्रम का अनुमान है कि 2016 तक देश में 657,829 वेश्याएं थीं।
अन्य अनौपचारिक अनुमानों की गणना के अनुसार भारत में लगभग 3-10 मिलियन वेश्याएं हैं। भारत को व्यापक रूप से दुनिया के सबसे बड़े वाणिज्यिक सेक्स उद्योग में से एक माना जाता है। यह यौन पर्यटन के एक वैश्विक केंद्र के रूप में उभरकर सामने आया है, जो धनी देशों के यौन पर्यटकों को आकर्षित करता है।भारत में सेक्स उद्योग एक बहु-अरब डॉलर का है, और सबसे तेजी से बढ़ने वाले उद्योगों में से एक है।",157,रंगमंच
सैनिक संगठन,किसी देश की राष्ट्रीय सुरक्षा नीति के लिये आवश्यक सैनिक क्षमता प्रदान करने हेतु सशस्त्र सेनाओं में जो संरचना निर्मित की जाती है उसे सैनिक संगठन (Military organization) कहते हैं।,30,रंगमंच
चीनी भाषा और साहित्य,"चीनी साहित्य अपनी प्राचीनता, विविधता और ऐतिहासिक उल्लेखों के लिये प्रख्यात है। चीन का प्राचीन साहित्य ""पाँच क्लासिकल"" के रूप में उपलब्ध होता है जिसके प्राचीनतम भाग का ईसा के पूर्व लगभग 15वीं शताब्दी माना जाता है। इसमें इतिहास (शू चिंग), प्रशस्तिगीत (शिह छिंग), परिवर्तन (ई चिंग), विधि विधान (लि चि) तथा कनफ्यूशियस (552-479 ई.पू.) द्वारा संग्रहित वसंत और शरद-विवरण (छुन छिउ) नामक तत्कालीन इतिहास शामिल हैं जो छिन राजवंशों के पूर्व का एकमात्र ऐतिहासिक संग्रह है। पूर्वकाल में शासनव्यवस्था चलाने के लिये राज्य के पदाधिकारियों को कनफ्यूशिअस धर्म में पारंगत होना आवश्यक था, इससे सरकारी परीक्षाओं के लिये इन ग्रंथों का अध्ययन अनिवार्य कर दिया गया था।
कनफ्यूशिअस के अतिरिक्त चीन में लाओत्स, चुआंगत्स और मेन्शियस आदि अनेक दार्शनिक  हुए है, जिनके साहित्य ने चीनी जनजीवन को प्रभावित किया है।",131,रंगमंच
इटालियन फ्रंट,"इटालियन फ्रंट, प्रथम विश्व युद्ध के सबसे कठिन और महत्त्वपूर्ण रंगमंचों में से एक था। यह संघर्ष इटली और ऑस्ट्रिया-हंगरी के बीच हुआ, जहाँ दुर्गम आल्प्स पर्वतों और इसोन्जो नदी के आसपास भीषण लड़ाइयाँ हुईं। 1915 में युद्ध में प्रवेश करने के बाद, इटली का मुख्य उद्देश्य अपने भू-क्षेत्रीय विस्तार को सुनिश्चित करना था, विशेष रूप से उन क्षेत्रों पर दावा करना जिन्हें ""इर्रेडेंटा इटालियाना"" कहा जाता था। इन क्षेत्रों में ट्रेंटिनो, दक्षिण टायरोल, और दलमेशियन तट शामिल थे। हालांकि, इटली को ऑस्ट्रिया-हंगरी की सेना और कठिन भौगोलिक परिस्थितियों के कारण बड़े पैमाने पर संघर्षों का सामना करना पड़ा।
1915 से लेकर 1917 तक, इटालियन फ्रंट पर मुख्यतः इसोन्जो नदी के पास बारह प्रमुख लड़ाइयाँ लड़ी गईं। इन लड़ाइयों में इटली ने बार-बार ऑस्ट्रिया-हंगरी की रक्षात्मक लाइनों को तोड़ने का प्रयास किया, लेकिन उच्च पर्वतीय इलाकों में ऑस्ट्रियाई सेनाओं की मजबूत स्थिति और खराब मौसम के कारण उन्हें अधिकतर असफलता ही मिली। इसके बावजूद, इटली ने इस मोर्चे पर अपनी स्थिति बनाए रखी और मित्र राष्ट्रों की सहायता से अपनी सैन्य क्षमताओं में सुधार किया।",175,रंगमंच
अमेरिकी साहित्य,आधुनिक काल के अमेरिकी साहित्य ने विश्व साहित्य पर अपनी छाप डाल दी है। विशेषतः शैली और प्रयोग पर यहाँ से नए विचार निकल पूरे विश्व के साहित्य में अपनाए गए। 'अमरीका' से यहाँ तात्पर्य संयुक्त राज्य अमरीका से है जहाँ की भाषा अंग्रेजी है। अमरीका की तरह उसका साहित्य भी नया है।,53,रंगमंच
पीटर पैन,"पीटर पैन स्कॉटिश उपन्यासकार एवं नाटककार जे.एम. बैरी (1860-1937) द्वारा रचा गया एक पात्र है। वह एक शरारती लड़का है जो उड़ सकता है और उसने जादुई तरीके से बड़ा होने से मना कर दिया है, पीटर पैन अपना कभी-नहीं ख़त्म होनेवाला बचपन रोमांचक अंदाज में, नेवरलैंड के एक छोटे से द्वीप पर अपने गिरोह ""लॉस्ट ब्वायज"" के लीडर के रूप में मत्स्य कन्याओं, परियों, भारतीयों और समुद्री डाकुओं के संपर्क में रहकर और समय-समय पर बाहर की दुनिया के साधारण बच्चों से मिलकर बिताता है। बैरी द्वारा रचित दो विशिष्ट कृतियों के अलावा, इस पात्र को विभिन्न प्रकार के मीडिया और व्यापार माध्यमों में, रूपांतरण और बैरी के कार्य के विस्तार, दोनों रूपों में चित्रित किया गया है।",119,रंगमंच
बारदेज़,बारदेज़ (Bardez) भारत के गोवा राज्य के उत्तर गोवा ज़िले में स्थित एक उपज़िला (तालुका या तहसील) है। इसका मुख्यालय म्हापसा (मापुसा) है।,23,रंगमंच
हिंदू वास्तुकला,"हिंदू वास्तुकला हिंदू ग्रंथों में वर्णित मंदिरों, मठों, मूर्तियों, घरों, बाजारों, उद्यानों और नगर नियोजन जैसी संरचनाओं के लिए भारतीय वास्तुकला की पारंपरिक प्रणाली है। वास्तुकला संबंधी दिशा-निर्देश संस्कृत पांडुलिपियों और कुछ मामलों में अन्य क्षेत्रीय भाषाओं में भी मौजूद हैं। इन ग्रंथों में वास्तु शास्त्र, शिल्प शास्त्र, बृहत् संहिता, पुराणों और आगमों के स्थापत्य अंश, और क्षेत्रीय ग्रंथ जैसे मानसार आदि शामिल हैं।
अब तक हिंदू वास्तुकला के सबसे महत्वपूर्ण, विशिष्ट और कई जीवित उदाहरण हिंदू मंदिर हैं, एक स्थापत्य परंपरा के साथ जिसने पत्थर, ईंट और रॉक-कट वास्तुकला में जीवित उदाहरण छोड़े हैं जो गुप्त साम्राज्य के समय के हैं। इन वास्तुकलाओं पर प्राचीन फ़ारसी और हेलेनिस्टिक वास्तुकला का प्रभाव था। आधुनिक युग में बहुत कम धर्मनिरपेक्ष हिंदू वास्तुकला बची है, जैसे कि महल, घर और शहर। खंडहर और पुरातात्विक अध्ययन भारत में प्रारंभिक धर्मनिरपेक्ष वास्तुकला का एक दृश्य प्रदान करते हैं।
भारतीय महलों और नागरिक स्थापत्य इतिहास पर अध्ययन ने काफी हद तक मुगल और इंडो-इस्लामिक वास्तुकला पर ध्यान केंद्रित किया है, विशेष रूप से उत्तरी और पश्चिमी भारत के अपने सापेक्ष बहुतायत को देखते हुए। भारत के अन्य क्षेत्रों में विशेष रूप से दक्षिण में हिंदू वास्तुकला १६ वीं शताब्दी के माध्यम से फलती-फूलती रही, जैसे कि मंदिरों, बर्बाद शहरों और विजयनगर साम्राज्य और नायकों के धर्मनिरपेक्ष स्थानों के उदाहरण। धर्मनिरपेक्ष वास्तुकला भारत में कभी भी धार्मिक के विरोध में नहीं थी, और यह पवित्र वास्तुकला है जैसे कि हिंदू मंदिरों में पाए जाते हैं जो धर्मनिरपेक्ष लोगों से प्रेरित और अनुकूलन थे। इसके अलावा, हार्ले कहते हैं, यह मंदिर की दीवारों, स्तंभों, तोरणों और मडपमों पर राहत में है जहां धर्मनिरपेक्ष वास्तुकला का लघु संस्करण पाया जा सकता है।",274,रंगमंच
खोदिनका त्रासदी,"खोदिनका त्रासदी (रूसी: Ходынская трагедия) एक भगदड़ थी जो ३० मई को , मास्को, रूस में खोदिनका मैदान पर हुई थी। यह भगदड़ रूस के अंतिम सम्राट निकोलाई द्वितीय के राज्याभिषेक के बाद उत्सव के दौरान हुआ था। जबकि घटनास्थल से १,२८२ लाशें एकत्र की गईं, घायल लोगों का अनुमान व्यापक रूप से १,२०० से २०,००० तक है।",58,रंगमंच
क्रिस्टॉफ़ वाल्ट्ज़,"क्रिस्टॉफ़ वाल्ट्ज़ (लातिन लिपि: Christoph Waltz, जर्मन उच्चारण:Error: {{IPA}}: unrecognized language tag: ˈkʀɪstɔf ˈvalts; जन्म: ४ अक्टूबर १९५६) एक ऑस्ट्रीयाई-जर्मन अभिनेता तथा निदेशक हैं। २००९ से वे मुख्य रूप से अमेरिका में ही सक्रिय रहें हैं। उनके पुरस्कारों के समक्ष २ अकादमी पुरस्कार, २ गोल्डेन ग्लोब पुरस्कार, ब्रिटिश अकादमी फ़िल्म पुरस्कार और दो स्क्रीन एक्टर्स गिल्ड पुरस्कार शामिल हैं।",59,रंगमंच
गढ़वाल राइफल्स,"गढ़वाल राइफल्स भारतीय सेना की एक थलसेना रेजिमेंट है । यह मूल रूप से 1887 में बंगाल सेना की 39वीं (गढ़वाल) रेजिमेंट के रूप में स्थापित किया गया था । यह तब ब्रिटिश भारतीय सेना का हिस्सा बन गया , और भारत की स्वतंत्रता के बाद , इसे भारतीय सेना में शामिल किया गया।
इसने 19वीं सदी के अंत और 20वीं सदी की शुरुआत के सीमावर्ती अभियानों के साथ-साथ विश्व युद्धों और स्वतंत्रता के बाद लड़े गए युद्धों में भी काम किया। यह मुख्य रूप से राजपूत और ब्राह्मण गढ़वाली सैनिकों से बना है जो मुख्यतः गढ़वाल क्षेत्र के सात जिलों(चमोली , रुद्रप्रयाग , टिहरी गढ़वाल , उत्तरकाशी, देहरादून , पौड़ी गढ़वाल , हरिद्वार ) से आते है।आज यह 25,000 से अधिक सैनिकों से बना है, जो इक्कीस नियमित बटालियन (यानी 2 से 22 वीं) में संगठित हैं, गढ़वाल स्काउट्स जो स्थायी रूप से जोशीमठ में तैनात हैंऔर 121 इंफ बीएन टीए और 127 इन्फ बीएन टीए (इको) और 14 आरआर, 36 आरआर, 48 आरआर बटालियन सहित प्रादेशिक सेना की दो बटालियन भी रेजिमेंट का हिस्सा हैं। तब से पहली बटालियन को मैकेनाइज्ड इन्फैंट्री में बदल दिया गया है और इसकी 6वीं बटालियन के रूप में मैकेनाइज्ड इन्फैंट्री रेजिमेंट का हिस्सा है ।
रेजिमेंटल प्रतीक चिन्ह में एक माल्टीज़ क्रॉस शामिल है और यह निष्क्रिय राइफल ब्रिगेड (प्रिंस कंसोर्ट्स ओन) पर आधारित है क्योंकि वे एक नामित राइफल रेजिमेंट हैं।नियमित राइफल रेजिमेंट के विपरीत, वे भारतीय सेना के समारोहों में उपयोग की जाने वाली नियमित गति से चलने वाली 10 ऐसी इकाइयों में से एक हैं।",256,रंगमंच
