title,content,word_count,topic
बदरीनाथ भट्ट,"बदरीनाथ भट्ट (संवत् 1948 वि. की चैत्र शुक्ल तृतीया - 1 मई सन् 1934) हिन्दी के साहित्यकार, पत्रकार एवं भारत के स्वतंत्रता संग्राम सेनानी थे। इन्होंने हिंदी साहित्य का इतिहास ' हिन्दी' नाम से लिखा",35,रंगमंच
राजस्थान की महत्वपूर्ण कला-संस्कृति इकाइयां,राजस्थान की महत्वपूर्ण कला-संस्कृति इकाइयां इस प्रकार है-,8,रंगमंच
कल्की केकलां,कल्की केक्लां (10 जनवरी 1984) फ्रांसीसी वंश की भारतीय फ़िल्म अभिनेत्री है जिन्होंने अनुराग कश्यप की 2009 हिन्दी फ़िल्म देव-डी से अपने फ़िल्मी करियर को आरम्भ किया। इस फ़िल्म में उन्होंने चन्द्रमुखी नामक पात्र का अभिनय किया था।,38,रंगमंच
सवाई गंधर्व,"रामभाउ कुण्डगोलकर, प्रचलित नाम: पंडित सवाई गंधर्व (१९ जनवरी १८८६ – १२ सितंबर १९५२), एक प्रसिद्ध [हिन्दुस्तानी शास्त्रीय संगीत|हिन्दुस्तानी शास्त्रीय ]] गायक एवं किरण घराने के मराठी रंगमंच कलाकर थे। ये अब्दुल करीम खान के शिष्य थे और इनके शिष्यों में भारत रत्न धारक भीमसेन जोशी हैं। पंडित गंधर्व किरन घराने के शैलियों को विभिन्न शिष्यों में बांटने के लिये प्रसिद्ध रहे हैं। इन शिष्यों में प्रमुख कुछ हैं: भीमसेन जोशी, [[गंगुबाई हंगल][], फिरोज़ दस्तूर Pt. Gandharva is most well known for popularizing the stylings of the Kirana Gharana through his accomplished disciples, including Pt. Bhimsen Joshi, Dr. Gangubai Hangal, Firoz Dastur, and Pt. Basavaraj Rajguru.",106,रंगमंच
पंकज उधास,"पंकज उधास चारण  (17 मई 1951 – 26 फरवरी 2024) भारत देश के पश्चिमी तट पर स्थित गुजरात राज्य के राजकोट शहर में जन्मे एक गज़ल गायक थे। भारतीय संगीत उद्योग में उनको तलत अज़ीज़ और जगजीत सिंह जैसे अन्य संगीतकारों के साथ इस शैली को लोकप्रिय संगीत के दायरे में लाने का श्रेय दिया जाता है। उधास को फिल्म नाम में गायकी से प्रसिद्धि मिली, जिसमें उनका एक गीत ""चिठ्ठी आई है"" काफी लोकप्रिय हुआ था। उसके बाद से उन्होंने कई फिल्मों के लिए एक पार्श्व गायक के रूप में अपनी आवाज दी है। इसके अतिरिक्त उन्होंने कई एल्बम भी रिकॉर्ड किये हैं और एक कुशल गज़ल गायक के रूप में पूरी दुनिया में अपनी कला का प्रदर्शन करते हैं। २००६ में पंकज उधास को पद्मश्री से सम्मानित किया गया।
उनके भाई निर्मल उधास और मनहर उधास भी प्रसिद्ध गायक हैं।  पंकज उधास की मृत्यु 26 फ़रवरी 2024 को हुई",151,रंगमंच
मनोज मित्र,"मनोज मित्र (22 दिसम्बर 1938 – 12 नवम्बर 2024) भारतीय रंगमंच, फ़िल्म और टेलीविजन अभिनेता, निर्देशक और नाटकार थे",19,रंगमंच
नीलदर्पण,नीलदर्पण बांग्ला का प्रसिद्ध नाटक है जिसके रचयिता दीनबन्धु मित्र हैं। इसकी रचना १८५८-५९ में हुई। यह बंगाल में नील विद्रोह का अन्दोलन का कारण बना। यह बंगाली रंगमंच के विकास का अग्रदूत भी बना। कोलकाता के 'नेशनल थिएटर' में सन् १८७२ में खेला गया यह पहला व्यावसायिक नाटक था।,50,रंगमंच
मुक्ति (१९७७ फ़िल्म),मुक्ति 1977 में बनी हिन्दी भाषा की फिल्म है।,9,रंगमंच
संजीव कुमार,"संजीव कुमार (मूल नाम : हरीभाई जरीवाला;  जन्म: 9 जुलाई 1938, मृत्यु: 6 नवम्बर 1985) हिन्दी फ़िल्मों के एक प्रसिद्ध अभिनेता थे। उनका पूरा नाम हरीभाई जरीवाला था। वे मूल रूप से गुजराती थे। इस महान कलाकार का नाम फ़िल्मजगत की आकाशगंगा में एक ऐसे धुव्रतारे की तरह याद किया जाता है जिनके बेमिसाल अभिनय से सुसज्जित फ़िल्मों की रोशनी से बॉलीवुड हमेशा जगमगाता रहेगा। उन्होंने नया दिन नयी रात फ़िल्म में नौ रोल किये थे। कोशिश फ़िल्म में उन्होंने गूँगे बहरे व्यक्ति का शानदार अभिनय किया था। शोले फ़िल्म में ठाकुर का चरित्र उनके अभिनय से अमर हो गया।
उन्हें श्रेष्ठ अभिनेता के लिए राष्ट्रीय फ़िल्म पुरस्कार के अलावा फ़िल्मफ़ेयर क सर्वश्रेष्ठ अभिनेता व सर्वश्रेष्ठ सहायक अभिनेता पुरस्कार दिया गया। वे आजीवन कुँवारे रहे और मात्र 47 वर्ष की आयु में सन् 1985 में हृदय गति रुक जाने से मुम्बई में उनकी मृत्यु हो गयी। 1960 से 1984 तक पूरे पच्चीस साल तक वे लगातार फ़िल्मों में सक्रिय रहे।
उन्हें उनके शिष्ट व्यवहार व विशिष्ट अभिनय शैली के लिये फ़िल्मजगत में हमेशा याद किया जायेगा।",176,रंगमंच
कला,"कला (आर्ट) शब्द इतना व्यापक है कि विभिन्न विद्वानों की परिभाषाएँ केवल एक विशेष पक्ष को छूकर रह जाती है। कला का अर्थ अभी तक निश्चित नहीं हो पाया है, यद्यपि इसकी हजारों परिभाषाएँ की गयी है। भारतीय परम्परा के अनुसार कला उन सारी क्रियाओं को कहते हैं जिनमें कौशल अपेक्षित हो। यूरोपीय शास्त्रियों ने भी कला में कौशल को महत्त्वपूर्ण माना है।

कला एक प्रकार का कृत्रिम निर्माण है जिसमे शारीरिक और मानसिक कौशलों का प्रयोग होता है।",79,रंगमंच
नुक्कड़ नाटक,"नुक्‍कड़ नाटक एक ऐसी नाट्य विधा है, जो परंपरागत रंगमंचीय नाटकों से भिन्‍न है। यह रंगमंच पर नहीं खेला जाता तथा आमतौर पर इसकी रचना किसी एक लेखक द्वारा नहीं की जाती, बल्कि सामाजिक परिस्थितियों और संदर्भों से उपजे विषयों को इनके द्वारा उठा लिया जाता है। जैसा कि नाम से जाहिर है इसे किसी सड़क, गली, चौराहे या किसी संस्‍थान के गेट अथवा किसी भी सार्वजनिक स्‍थल पर खेला जाता है। इसकी तुलना सड़क के किनारे मजमा लगा कर तमाशा दिखाने वाले मदारी के खेल से भी की जा सकती है। अंतर यह है कि यह मजमा बुद्धिजीवियों द्वारा किसी उद्देश्‍य को सामने रख कर लगाया जाता है। भारत में आधुनिक नुक्कड़ नाटक को लोकप्रिय बनाने का श्रेय सफ़दर हाशमी को जाता है। उनके जन्म दिवस १२ अप्रैल को देशभर में राष्ट्रीय नुक्कड़ नाटक दिवस के रूप में मनाया जाता है।",142,रंगमंच
पॉट्सडैम समझौता,"पॉट्सडैम समझौते (जर्मन:Potsdamer Abkommen) के तीन के बीच अगस्त 1945 सहमति थी द्वितीय विश्व युद्ध के सहयोगी दलों , यूनाइटेड किंगडम , संयुक्त राज्य अमेरिका , और सोवियत संघ । इसने जर्मनी के सैन्य सीमाओं और पुनर्निर्माण , उसकी सीमाओं और युद्ध क्षेत्र के पूरे यूरोपीय रंगमंच का संबंध किया। इसने जर्मनी के विमुद्रीकरण , पुनर्मूल्यांकन और युद्ध अपराधियों के अभियोजन को भी संबोधित किया ।
एक सांप्रदायिकता के रूप में निष्पादित, समझौता अंतरराष्ट्रीय कानून के अनुसार एक शांति संधि नहीं थी , हालांकि इसने निपुण तथ्यों को बनाया। यह 12 सितंबर 1990 को हस्ताक्षरित जर्मनी के सम्मान के साथ अंतिम निपटान पर संधि द्वारा अधिग्रहित किया गया था ।
जैसा कि डी गॉल को सम्मेलन में आमंत्रित नहीं किया गया था, फ्रांसीसी ने अपने व्यवसाय के क्षेत्र में पॉट्सडैम समझौतों को लागू करने का विरोध किया। विशेष रूप से, फ्रांसीसी ने पूर्व से निष्कासित जर्मनों को फिर से बसाने से इनकार कर दिया। इसके अलावा, फ्रांसीसी ने मित्र देशों की नियंत्रण परिषद की कार्यवाही में पॉट्सडैम समझौते का पालन करने के लिए किसी भी दायित्व को स्वीकार नहीं किया; विशेष रूप से पूरे जर्मनी में आम नीतियों और संस्थानों को स्थापित करने के लिए सभी प्रस्तावों का विरोध करते हुए, और कुछ भी जिनके बारे में उन्हें आशंका थी, अंततः एक एकीकृत जर्मन सरकार के उदय के लिए प्रेरित कर सकते हैं।",223,रंगमंच
उप्रेती,"उप्रेती (उच्च कुलीन ब्राह्मण) मुख्यतः भारत के उत्तराखण्ड राज्य के कुमाऊँ क्षेत्र में रहने वाले उच्च कुलीन ब्राह्मण हैं ।[उद्धरण चाहिए]
इस समुदाय के लोग, उत्तर प्रदेश, दिल्ली, मध्य प्रदेश, राजस्थान, सिक्किम, आसाम, नेपाल और भूटान,में भी रहते हैं। अपनी परम्पराओं के अनुसार, ये शैव सम्प्रदाय के अनुयायी हैं, जो भगवान शिव को अपना आराध्य मानते हैं।",57,रंगमंच
मिकी रूनी,"मिकी रूनी (जन्म जोसफ यूल, जूनियर; २३ सितम्बर १९२० – ६ अप्रैल २०१४) एक अमेरिकी फ़िल्म अभिनेता और मनोरंजनकर्त्ता थे जो अपने पूर्ण जीवनकाल में फ़िल्मों, टेलीविज़न और रंगमंच में व्यतीत किया।
उन्होंने जुवेनाइल एकेडमी अवार्ड, अकादमी मानद पुरस्कार, एमी और दो गोल्डन ग्लोब पुरस्कारों सहित विभिन्न पुरस्कार प्राप्त किये। एक बाल कलाकार के रूप में कार्य करते हुए युवावस्था में ही एंडी हार्डी का किरदार निभाने के लिए सुपरस्टार बन चुके थे। उन्होंने अपने जीवन का सबसे लम्बा समय अभिनेता के रूप में बिताया। उन्होंने १९२० के दशक से २०१० के दशक तक के १० दसकों के ९२ वर्ष सक्रिय रूप से फ़िल्म निर्माण में व्यतीत किये।
अप्रैल २०१४ में उनके निधन तक रूनी मूक फ़िल्मों में काम करने वाले अन्तिम सितारों में से एक थे। १९३०-१९४० के दशक की विभिन्न फ़िल्मों के कलाकारों में से वो एकमात्र जीवित सदस्य थे।",142,रंगमंच
ब॰ व॰ कारन्त,"बी.वी. कारंत (बाबु कोडि वेंकटरामन कारंत, जन्म:19 सितम्बर 1929; निधन:1 सितम्बर 2002)- भारत के सुप्रसिद्ध रंगकर्मी, निर्देशक, अभिनेता, लेखक, फिल्म निर्देशक और संगीतकार थे। कारन्त आधुनिक भारतीय रंगमंच और कन्नड़ की नई लहर सिनेमा के अग्रदूतों में से थे। नेशनल स्कूल ऑफ ड्रामा में अध्ययन और बाद मे उसके निदेशक बने। बहुत सारे नाटकों और कन्नड़ फिल्मों का निर्देशन किया। भारत सरकार ने उन्हे पद्मश्री से सम्मानित किया। कारन्त जी ने 
गिरीश कर्नाड द्वारा रचित तुगलक का हिन्दी अनुवाद भी किया। प्रमुख भारतीय निर्देशको - इब्राहीम अलकाजी, प्रसन्ना, अरविन्द गौड़ और दिनेश ठाकुर ने तुगलक का अलग- अलग तरीके से प्रभावी व यादगार निर्देशन किया हैं। गिरीश कर्नाड के हयवदन नाटक का स्व. बी.वी. कारंत द्वारा निदेशन आज भी याद किया जाता है। ब.व. कारंत या बी.वी.कारंत को लोग ‘बाबा’ कारंत कहकर बुलाते थे।",134,रंगमंच
अलहोन्दिगा बिलबाओ,"अलहोन्दिगा बिलबाओ ('स्पेनी भाषा में Alhóndiga Bilbao) एक बहु-विकल्पी स्थल है जो कि स्पेन के बिलबाओ शहर में मौजूद है। 
इस स्थल को जन सामान्य के लिए 18 मई और 24 अक्तूबर 2010 के बीच विभिन्न चरणों में खोला गया था। इस स्थान को संस्कृति और मनोरंजन केन्द्र"" माना गया है। यहाँ एक मल्टिप्लेक्स सिनेमा, एक विशाल ग्रंथालय, एक रंगमंच स्थल, दुकान और रस्तराँ हैं।",65,रंगमंच
दूधनाथ सिंह,"दूधनाथ सिंह (जन्म:१७ अक्टूबर, १९३६ एवं निधन १२ जनवरी, २०१८) हिन्दी के आलोचक, सम्पादक एवं कथाकार थे। उन्होने अपनी कहानियों के माध्यम से साठोत्तरी भारत के पारिवारिक, सामाजिक, आर्थिक, नैतिक एवं मानसिक सभी क्षेत्रों में उत्पन्न विसंगतियों को चुनौती दी।",40,रंगमंच
ख्याल (मालवी गीत),"हास्य प्रधान मालवी गीत और चित्र को ख्याल कहते हैं। किंतु इसका अभिप्राय राजस्थान में एक प्रकार के लोकनाट्य से समझा जाता है जो उत्तर प्रदेश की नौटंकी तथा मालवा के माच से मिलता जुलता है। यह खुले प्रांगण में खेला जाता है। चारों ओर दर्शक बैठते हैं, बीच में रंगमंच के लिए स्थान खाली रहता है। वहाँ ख्याल प्रदर्शित करने वाली मंडली बैठती है; नगाड़ा, ढोल, सारंगी और हारमोनियम का बाजे के रूप में प्रयोग किया जाता है। ख्याल की कथा की अभिव्यक्ति लावनी, दूहा, दोहा, चौबोला, चौपाई, छंद, शेर, कवित्त, छप्पय आदि छंदो तथा पांड, सोरठ, कालंगड़ा, आसावरी अदि किसी राग रागनी में गाकर की जाती है। अभिनेता ऊँचे स्वर से गाता हुआ भूमिका के अनुरूप अभिनय करता है। ख्याल के अभिनेता मंच से बाहर रहकर गणपति और सरस्वती पूजन करते हैं। तदनंतर मंच पर एक एक कर भंगी, भिश्ती आदि आकर मंच की सफाई, झाड़पोेंछ का अभिनय करते हैं। तदनंतर आख्यान का मुख्य नायक उपस्थित होकर आत्मपरिचय देता है और ख्याल आरंभ होता हैं। ख्याल का विषय पौराणिक, ऐतिहासिक अथवा प्रेम कथा होते है। इस नाटक का आरंभ मूलत: वीरपूजा की भावना से हुआ था। अनेक कवियों ने राजस्थानी भाषा में ख्यालों की रचना की है।",199,रंगमंच
ललित कला,"सौंदर्य या लालित्य के आशय से व्यक्त होने वाली कलाएँ ललित कला (Fine arts) कहलाती हैं। अर्थात् वह कला जिसके अभिव्यंजन में सुकुमारता और सौंदर्य की अपेक्षा हो और जिसकी सृष्टि मुख्यतः मनोविनोद के लिए हो। जैसे गीत, संगीत, नृत्य, नाट्य, तथा विभिन्न प्रकार की चित्रकला
या 
ललित कला वह कला है जो कलाकार एवं दर्शक के अन्तर्मन को स्पर्श कर मन को मुग्ध करती है।",66,रंगमंच
