title,content,word_count,topic
कैटरिना अल्बर्ट,"कैटरिना अल्बर्ट ई पारादीस (कैटलन: Caterina Albert i Paradís; 11 सितम्बर 1869 – 27 जनवरी 1966) स्पेनी कातालोन्याई लेखिका थीं, जिन्होंने आधुनिकतावाद आंदोलन में हिस्सा लिया था। इनके साहित्यिक कौशल की ख़ोज 1898 में हुई जब इन्हें जोक्स फ़्लोराल्स (हिन्दी: पुष्प खेल) पुरस्कार प्राप्त हुआ। इसके ठीक पश्चात इन्होंने लेखन कार्य के लिए विक्टर कैट्ला छद्म नाम अपना लिया। यह नाम इन्होंने अपने उस उपन्यास के नायक से लिया जिसे ये कभी पूरा नहीं कर पाई थीं। नाटककार के रूप में इनकी सफ़लता और कविता रचना में इनकी उत्कृष्टता के बावजूद इन्हें सबसे अधिक इनके कथा साहित्य में किए गए कार्य के लिए जाना जाता है, विशेष रूप से इनकी शैली की शक्ति और लेखन में शब्दो के चयन की प्रचुरता के लिए ये विख्यात हैं। इनकी मृत्यु इनके गृह नगर ला'इस्काला, कातालोन्या, में 1966 में हुई और इन्हें सेमेंतिरी वैई डी ला'इस्काला (कैटलन: Cementiri Vell de l’Escala) में दफ़नाया गया।",151,रंगमंच
मेरिल स्ट्रीप,"मेरिल स्ट्रीप (जन्म मैरी लुईस स्ट्रीप, २२ जून १९४९) (अंग्रेज़ी: Mary Louise ""Meryl"" Streep) एक अमेरिकी अभिनेत्री हैं जिन्होंने रंगमंच, टीवी और फिल्मों में काम किया है। उन्हे व्यापक रूप से आज तक के सभी प्रतिभाशाली कलाकारों में से एक माना जाता है।

मेरिल ने मंच पर अपनी व्यावसायिक शुरुआत द प्लेबॉय ऑफ़ नेविल्ल (१९७१) के साथ की और परदे पर एक टीवी फिल्म द डेडलिएस्ट सीजन (१९७७) के साथ की। उस ही वर्ष उन्होंने फ़िल्मी जगत में अपनी पहली पिक्चर जूलिया (१९७७) के साथ कदम रखा। १९७८ की फिल्म द डियर हंटर और १९७९ की फिल्म क्रेमर वर्सेज क्रेमर, जिसपर हिंदी फिल्म अकेले हम अकेले तुम आधारित थी, से उन्हें आलोचनात्मक तथा व्यावसायिक सफलता काफी जल्दी हासिल हो गयी; जहाँ पहली फिल्म ने उनहे अपना पहला ऑस्कर नामांकन दिलाया वहीँ दूसरी ने पहली जीत। इसके अलावा उनहे सोफीस चॉइस (१९८२) और द आयरन लेडी (२०११) में भूमिका के लिए सर्वश्रेष्ठ अभिनेत्री के दो और ऑस्कर पुरस्कार मिले।
मेरिल स्ट्रीप ऑस्कर और गोल्डन ग्लोब के इतिहास में सबसे ज्यादा बार नामांकित अभिनेता हैं। उनहे ऑस्कर में १७ बार नामांकन और ३ बार जीत और गोल्डन ग्लोब में २६ बार नामंकान और ८ बार जीत हासिल हुई है। उनहे दो एमी पुरस्कार, दो स्क्रीन एक्टर्स गिल्ड अवार्ड्स, एक कान फ़िल्मोत्सव पुरस्कार, पांच न्यू यॉर्क क्रिटिक्स सर्किल पुरस्कार, दो बाफ्ता पुरस्कार, एक ऑस्ट्रेलियाई फिल्म संसथान पुरस्कार, पांच ग्रैमी नामांकन, एक टोनी पुरस्कार और अन्य पुरस्कार मिले हैं। उनहे २००४ में अमेरिकी फिल्म संस्थान के द्वारा अपने अभिनय से अमेरिकी संस्कृति को योगदान देने के लिए आजीवन उप्लिब्धि पुरस्कार दिया गया। वह इस पुरस्कार के इतिहास की सबसे कम उम्र की अभिनत्री हैं।",270,रंगमंच
उत्तर प्रदेश संगीत नाटक अकादमी पुरस्कार,उत्तर प्रदेश संगीत नाटक अकादमी यह उत्तर प्रदेश राज्य सरकार के अंतर्गत संस्कृति विभाग की प्रमुख शाखा है। उत्तर प्रदेश संगीत नाटक अकादेमी प्रत्येक वर्ष कला व साहित्य में उत्कृष्ट कार्य करने वाले को अकादेमी पुरस्कार से सम्मानित किया जाता है।,41,रंगमंच
मृच्छकटिकम्,"मृच्छकटिकम् (अर्थात्, मिट्टी का खिलोना या मिट्टी की गाड़ी) संस्कृत नाट्य साहित्य में सबसे अधिक लोकप्रिय रूपक है। इसमें 10 अंक है। इसके रचनाकार महाराज शूद्रक हैं। नाटक की पृष्टभूमि पाटलिपुत्र (आधुनिक पटना) है। भरत के अनुसार दस रूपों में से यह 'मिश्र प्रकरण' का सर्वोत्तम निदर्शन है। 'मृच्छकटिकम्' नाटक इसका प्रमाण है कि अंतिम आदमी को साहित्य में जगह देने की परम्परा भारत को विरासत में मिली है जहाँ चोर, गणिका, गरीब ब्राह्मण, दासी, नाई जैसे लोग दुष्ट राजा की सत्ता पलट कर गणराज्य स्थापित कर अंतिम आदमी से नायकत्व को प्राप्त होते हैं।
इसकी कथावस्तु तत्कालीन समाज का पूर्ण रूप से प्रतिनिधित्त्व करती है। यह केवल व्यक्तिगत विषय पर ही नहीं,अपितु इस युग की शासन-व्यवस्था एवं राज्य-स्थिति पर भी प्रचुर प्रकाश डालता है। साथ- ही-साथ वह नागरिक-जीवन का भी यथावत् चित्र अंकित करता है। इसमें नगर की साज-सजावट, वेश्या (वारांगनाओं) का व्यवहार,दास प्रथा,जुआ (द्यूत-क्रीड़ा), 
विट की धूर्तता,चोरी (चौरकर्म), न्यायालय में न्यायनिर्णय की व्यवस्था ,अवांछित राजा के प्रति प्रजा के द्रोह एवं जनमत के प्रभुत्त्व का सामाजिक स्वरूप भली-भाँति चित्रित किया गया है। साथ ही समाज में दरिद्रजन की स्थिति, गुणियों का सम्मान, सुख-दु:ख में समरूप मैत्री के बिदर्शन, उपकृत वर्ग की कृतज्ञता निरपराध के प्रति दंड पर क्षोभ ,राज वल्लभों के अत्याचार, वारनारी की समृद्धि एवं उदारता, प्रणय की वेदी पर बलिदान, कुलांगनाओं का आदर्श-चरित्र जैसे वैयक्तिक विषयों पर भी प्रकाश डाला गया है। इसी विशेषता के कारण यह यथार्थवादी रचना संस्कृत साहित्य में अनूठी है। इसी कारण यह पाश्चात्य सहृदयों को अत्यधिक प्रिय लगी। इसका अनुवाद विविध भाषाओं में हो चुका है और भारत तथा सुदूर अमेरिका, रूस, फ्रांस, जर्मनी,इटली, इंग्लैण्ड के अनेक रंगमंचों पर इसका सफल अभिनय भी किया जा चुका है।",276,रंगमंच
संकेतविज्ञान,"भाषाविज्ञान में, संकेत प्रक्रियाओं (लाक्षणिकता), या अभिव्यंजना और संप्रेषण, लक्षण और प्रतीक का अध्ययन संकेतविज्ञान (Semiotics या semiotic studies या semiology) कहलाता है। इसे आम तौर पर निम्नलिखित तीन शाखाओं में विभाजित किया जाता है:

अर्थ-विज्ञान (semantics): संकेतों और जिनका वे हवाला देते हैं उनके बीच संबंध; उनका निर्देश
वाक्य-विज्ञान (syntactics): औपचारिक संरचनाओं में संकेतों के बीच संबंध
संकेतप्रयोगविज्ञान (pragmatics): संकेत और उनका उपयोग करने वालों (लोगों) पर उनके प्रभाव के बीच संबंध
सांकेतिकता को अक्सर महत्वपूर्ण मानवशास्त्रीय आयामों सहित देखा जाता है; उदाहरण के लिए, अम्बर्टो इको का प्रस्ताव है कि प्रत्येक सांस्कृतिक घटना का अध्ययन संप्रेषण के रूप में किया जा सकता है। तथापि, कुछ लक्षणशास्त्री विज्ञान के तार्किक आयामों पर ध्यान केंद्रित करते हैं। वे प्राकृतिक विज्ञान से संबंधित क्षेत्रों की भी जांच करते हैं-जैसे कि किस प्रकार जीव दुनिया में अपने लाक्षणिक कर्म स्थिति के बारे में भविष्यकथन कर सकते हैं और उसके अनुकूल बन सकते हैं (देखें सेमिऑसिस). सामान्यतः, लाक्षणिक सिद्धांत संकेतों या संकेत प्रणालियों को अपने अध्ययन के उद्देश्य के रूप में लेते हैं: जीवित प्राणियों में सूचना का संप्रेषण जीव-लाक्षणिकी या प्राणि-लाक्षणिकी में आवृत किया जाता है।
वाक्य-विज्ञान लाक्षणिकी की शाखा है, जो संकेतों और प्रतीकों की औपचारिक विशेषताओं के साथ संबंध रखती है। दरअसल, वाक्य-विज्ञान ""उन नियमों से संबंधित है जो यह शासित करे कि किस प्रकार वाक्यांश और वाक्य बनाने के लिए शब्दों को जोड़ा जाए."" चार्ल्स मॉरिस कहते हैं कि अर्थविज्ञान संकेतों का अपने निर्देश और वस्तुओं के साथ वे जो संबंध निरूपित कर सकते हैं या करते हैं, के संबंध से जुड़ा है; और उपयोगितावाद लाक्षणिकता के जैवीय पहलुओं के साथ संबंध रखता है, अर्थात् संकेतों की क्रिया में घटित होने वाले सभी मनोवैज्ञानिक, जैविक या सामाजिक घटनाएं.",279,रंगमंच
हास्य रस तथा उसका साहित्य,जैसे जिह्वा के आस्वाद के छह रस प्रसिद्ध हैं उसी प्रकार हृदय के आस्वाद के नौ रस प्रसिद्ध हैं। जिह्वा के आस्वाद को लौकिक आनंद की कोटि में रखा गया है क्योंकि उसका सीधा संबंध लौकिक वस्तुओं से है। हृदय के आस्वाद को अलौकिक आनंद की कोटि में माना जाता है क्योंकि उसका सीधा संबंध हृदय से होता है।,59,रंगमंच
शंकर शेष,शंकर शेष (1933-1981) हिन्दी की साठोत्तरी पीढ़ी के सुप्रसिद्ध नाटककार थे। समकालीन जीवन की ज्वलंत समस्याओं से जूझते व्यक्ति की त्रासदी शंकर शेष के बहुसंख्यक नाटकों के केंद्र में रहती है। वे मोहन राकेश के बाद की पीढ़ी के महत्वपूर्ण नाटककार के रूप में मान्य हैं। फ़िल्मफ़ेयर पुरस्कार से सम्मानित डॉ० शेष ने फिल्मों के लिए कहानियाँ भी लिखी हैं।,60,रंगमंच
राज ठाकरे,"राज ठाकरे (जन्म १४ जून १९६८) महाराष्ट्र नवनिर्माण सेना के संस्थापक अध्यक्ष हैं, जो भारत के महाराष्ट्र राज्य की एक क्षेत्रीय पार्टी है। वे शिवसेना के पूर्व प्रमुख बाल ठाकरे के भतीजे और महाराष्ट्र के पूर्व मुख्यमंत्री  उद्धव ठाकरे के चचेरे भाई हैं।",43,रंगमंच
सुभाषनी गिरिधर,सुभाषवाणी गिरिधर जन्म (27 अप्रैल 1965)चिन्नई में हुआ था। वह एक भारतनाट्यम में भारतीय शास्त्रीय नृत्यक  और एक चार्टर्ड अकाउंटेंट है।,21,रंगमंच
रिया बेकर्स,"मारिया ब्रिगिटा कैथरीना ""रिया"" बेकर्स-डी ब्रुजन (2 नवंबर 1938 - 22 मार्च 2006) रेडिकल्स की राजनीतिक पार्टी (पीपीआर) की एक डच राजनीतिज्ञ थीं और बाद में ग्रोएनलिंक्स (जीएल) पार्टी और शिक्षक की सह-संस्थापक बनी।",34,रंगमंच
राहुल बारपुते,राहुल बारपुते हिन्दी के पत्रकार थे।,6,रंगमंच
युद्ध,"युद्ध एक लंबे समय तक चलने वाला आक्रामक कृत्य है जो सामान्यतः राज्यों के बीच झगड़ों के आक्रामक और हथियारबंद लड़ाई में परिवर्तित होने से उत्पन्न होता है।
युद्ध से मनुष्य नवीनतम वैज्ञानिक खोजो की ओर 'अग्रसर होता है युद्ध से विषम परिस्थितियों में से निकल कर देश प्रेम और समपर्ण की भावना का जन्म होता है। युद्ध राष्ट्र की भावना, राष्ट्र की अनिश्चितता और राजनीतिक उद्देश्यों को प्राप्त करने का सक्षम साधन है                                            
According to Dr Kajal Mehta -यूक्रेन रशिया युद्ध ने सिद्ध कर दिया है कि राष्ट्रोकी गलत अन्तर्राष्ट्रीय सुरक्षा नीति के कारण मानव सभ्यता को तृतीय विश्वयुद्ध के दरवाजे पर खडा कर दिया है।                  

                                       यद्यपि अपार जन-घन की हानि के साथ ही आज समस्त विश्व में नये-नये युद्ध फ्रंटो का समावेश हो गया है एक ओर चीन ताइवान को निगलते की इच्छा से युद्ध की तैयारिया में लिप्त हूँ दूसरी ओर इजराइल और हमास का भयानक संघर्ष मानवजाति को पृथ्वी से मिटाने की होड़ में है। ईरान अमेरिका को अधिकतम नुकसान पहुंचाने के आयोजनो की तैयारियां कर रहा

एक ओर से विश्व भुखमरी, गरीबी, महंगाई और प्राकृतिक आपदाओ से भयभीत है वही दूसरी और विज्ञान और तकनीकि की खोजो ने युद्ध को वर्तमान में अंतरिक्ष की ऊंचाईयो और समुद्र की गहराईयो में भी लड़ने हेतु समर्थ कर दिया है। सेटेलाइट क्रांति ने आज विश्व के राष्ट्रो के मध्य आकाश में भी विजय प्राप्त करने की और पृथ्वी का विकल्प खोजने की तैयारियां शुरू करदी जिससे हाइड्रोजन बम, परमाणु बम, रसायनिक हथियार और जैविक हथियारों से यदि प्रथ्वी पर मानव जाति का और पृथ्वी के जैब मंडल का विनाश हो तो पहले से ही तैयार सामर्थ्य वान मानव किसी अन्य ग्रह पर अपना जीवन शुरू कर सकें।",279,रंगमंच
दीनानाथ मंगेशकर,"'दीनानाथ मंगेशकर'  (29 दिसंबर 1900 -24 अप्रैल 1942) एक प्रसिद्ध मराठी थिएटर अभिनेता, प्रसिद्ध नाट्य संगीत संगीतकार और हिन्दुस्तानी शास्त्रीय संगीतज्ञ एवं गायक थे। 
वे जाने-माने गायकों लता मंगेशकर, आशा भोसले ,मीना खाड़ीकर ,उषा मंगेशकर और संगीतकार हृदयनाथ मंगेशकर के पिता भी थे।",43,रंगमंच
