title,content,word_count,topic
वि-उपनिवेशीकरण,"व्युपनिवेशीकरण या व्यौपनिवेशीकरण, किसी उपनिवेश को समाप्त करने के सम्बन्ध में प्रयुक्त शब्द है जहाँ एक राष्ट्र का निर्माण होता है जो स्वतन्त्र और सम्प्रभु राष्ट्र के रूप में स्थापित होता है।
द्वितीय विश्व युद्ध के प्रारम्भ में श्रमिक संघों एवं नेताओं ने युद्ध का विरोध किया किन्तु 1941 के रूस के मित्र राष्ट्रों की ओर से युद्ध में सम्मानित हो जाने के उपरान्त उनका रूख परिवर्तित हो गया तथा साम्यवादियों ने इसे लोगों का युद्ध कह कर इसका समर्थन प्रारम्भ कर दिया। साम्यवादियों ने भारत छोड़ो आन्दोलन से भी स्वयं को पृथक कर लिया तथा शान्तिपूर्ण औद्योगिक नीति की वकालत प्रारम्भ कर दी। 1945 में मुम्बई और कोलकाता के बन्दरगाह मजदूरों ने इण्डोनेशिया भेजे जाने वाली रसद को जहाजों पर लादने से इंकार कर दिया 1946 में शादी नौसेना में विद्रोह होने पर मजदूरों ने इसका समर्थन में विद्रोह एवं हड़ताले कीI उपनिवेशिक शासन के अन्तिम वर्ष भी मजदूरों ने पोस्ट रेलवे एवं अन्य प्रतिष्ठानों में आयोजित हड़ताल में भागीदारी निभाई।
द्वितीय विश्वयुद्ध के पश्चात् यूरोपीय साम्राज्यवाद के विध्वंस की गति को तेज करने में कई कारणों ने मदद की। वस्तुतः विश्व युद्ध के पश्चात् तमाम नवोदित राष्ट्र अस्तित्व में आते गए। एशिया, अफ्रीका और लैटिन अमेरिकी देशों में गुलामी को समाप्त कर एक नए युग का आरम्भ किया। साम्राज्यवादी राष्ट्रों की पकड़ से इन राष्ट्रों की स्वतंत्रता की प्रक्रिया को व्युपनिवेशीकरण का नाम दिया। औपनिवेशिक मुक्ति के पश्चात् नव स्वतन्त्र राष्ट्रों ने गुटीय राजनीति को छोड़कर अपनी स्वतंत्र पहचान कायम की। दूसरे शब्दों में दो विश्व में बँटे गुट से अपने को अलग रखा। इसी कारण नवोदित राष्ट्रों को 'तृतीय विश्व' भी कहा गया। इस दृष्टि से उपनिवेशवाद उन्मूलन प्रक्रिया ने तृतीय विश्व के उदय में प्रत्यक्ष भूमिका निभाई।",281,भू-राजनीति
काला चौना,"काला चौना एक गॉंव है। यह रामगंगा नदी के पूर्वी किनारे पर चौखुटिया तहसील के तल्ला गेवाड़ नामक पट्टी में, भारतवर्ष के उत्तराखण्ड राज्य के अन्तर्गत कुमाऊँ मण्डल के अल्मोड़ा जिले में स्थित है। यह गॉंव मूलरूप से कनौंणियॉं नामक उपनाम से विख्यात कुमांऊॅंनी हिन्दू राजपूतों का प्राचीन और पुश्तैनी चार गाँवों में से एक है। दक्षिणी हिमालय की तलहटी में बसा यह काला चौना अपनी ऐतिहासिक व सॉंस्कृतिक विरासत, ठेठ कुमांऊॅंनी सभ्यता व संस्कृति, पर्वतीय जीवन शैली, प्रकृति संरक्षण, अलौकिक प्राकृतिक छटा तथा समतल-उपजाऊ भूमि के लिए पहचाना जाता है।",91,भू-राजनीति
लोम्बार्ड साम्राज्य,"लोंबार्ड राज्य, जिसे लैटिन में ""रेग्नम लैंगोबार्डोरम"" कहा जाता है, 568 ईस्वी से 774 ईस्वी तक इटली में एक महत्वपूर्ण साम्राज्य था। लोंबार्ड्स, जर्मनिक जनजातियों में से एक, ने इटली पर आक्रमण किया और पाविया को राजधानी बनाते हुए एक शक्तिशाली राज्य का निर्माण किया। प्रारंभ में यह राज्य राजनीतिक अस्थिरता और सामरिक संघर्षों से ग्रस्त था, लेकिन अंततः यह मध्यकालीन यूरोपीय राजनीति में एक महत्वपूर्ण शक्ति बन गया।",69,भू-राजनीति
उत्तराखण्ड राज्य आन्दोलन,"उत्तराखण्ड राज्य आन्दोलन, उत्तराखण्ड राज्य के बनने से पहले की वे घटनाएँ हैं जो अन्ततः उत्तराखण्ड राज्य के रूप में परिणीत हुईं। राज्य का गठन ९ नवम्बर, २००० को भारत के सत्ताइसवें राज्य के रूप में हुआ। यहाँ पर यह उल्लेखनीय है कि उत्तराखण्ड राज्य का गठन बहुत लम्बे संघर्ष और बलिदानों के फलस्वरूप हुआ। उत्तराखण्ड राज्य की माँग सर्वप्रथम १८९७ में उठी और धीरे-धीरे यह माँग अनेकों समय उठती रही। १९९४ में इस माँग ने जनान्दोलन का रूप ले लिया और अन्ततः नियत तिथि पर यह देश का सत्ताइसवाँ राज्य बना।",92,भू-राजनीति
हल्द्वानी,"हल्द्वानी (Haldwani) भारत के उत्तराखण्ड राज्य के नैनीताल ज़िले में स्थित एक नगर है। हल्द्वानी कुमाऊँ मण्डल  का सबसे बड़ा एवं देहरादून  के बाद राज्य का दूसरा सबसे बड़ा नगर है। हल्द्वानी कुमाऊँ का सबसे बड़ा आर्थिक, शैक्षिक, व्यापारिक एवम आवासीय केंद्र है इसे ""कुमाऊँ का प्रवेश द्वार"" कहा जाता है। कुमाऊँनी भाषा में इसे ""हल्द्वेणी"" भी कहा जाता है, क्योंकि यहाँ ""हल्दू"" (कदम्ब) प्रचुर मात्रा में मिलता था।",69,भू-राजनीति
"महात्मा गांधी विश्वविद्यालय, केरल","महात्मा गांधी विश्वविद्यालय  (आमतौर पर  एमजी विश्वविद्यालय  या  एमजीयू  के रूप में जाना जाता है) केरल, भारत में एक राज्य विश्वविद्यालय है।  इसकी स्थापना गांधी जयंती दिन, 2 अक्टूबर 1983 को केरल राज्य के कोट्टायम जिला में हुई थी।.महात्मा गांधी विश्वविद्यालय (पूर्व में गांधीजी विश्वविद्यालय), को यूजीसी द्वारा अनुमोदित किया गया है और भारतीय राष्ट्रीय मूल्यांकन और प्रत्यायन परिषद द्वारा मान्यता प्राप्त है।  विश्वविद्यालय के मध्य केरल के पांच जिलों में फैले लगभग 300 संबद्ध कॉलेज हैं।",77,भू-राजनीति
सैंडविच,"सैंडविच बहुत ही लोक प्रिय रेसिपी  [1] Archived 2023-01-05 at the वेबैक मशीन में से एक जो हर किसी को भी पसंद आता है। 
जिनके बीच में कुछ भरा होता है, अथवा टॉपिंग या टॉपिंग्स के साथ ब्रेड का एक स्लाइस होता है जिसे सामान्यतः ओपन सैंडविच कहते हैं। सैंडविच काफी लोकप्रिय खाद्य पदार्थ है, जिसका सेवन पैक किए हुए भोजन के हिस्से के रूप में किया जाता है और आमतौर पर इसे कार्यस्थल, या स्कूल, या पिकनिक पर ले जाया जाता है। आम तौर पर उसमें सलाद वेजीटेबल्स, मांस, पनीर, कई प्रकार के सॉस आदि का एक संयोजन शामिल होता है। ब्रेड का इस्तेमाल उसके मूल रूप में किया जा सकता है, या स्वाद बढ़ाने और रूप परिवर्तन के लिए इसमें कोई मसाला लेपित किया जा सकता है। इन्हें रेस्तरां और कैफे में व्यापक रूप से बेचा जाता है।",140,भू-राजनीति
"काला चौना, चौखुटिया तहसील",काला चौना रामगंगा नदी के पूर्वी छोर पर चौखुटिया ब्लॉक के तल्ला गेवाड़ में भारतवर्ष के उत्तराखण्ड राज्य के अन्तर्गत कुमाऊँ मण्डल के अल्मोड़ा जिले में स्थित कनौंणियॉ बिष्ट नाम से विख्यात कुमॉऊनी हिन्दू राजपूतों के ऐतिहासिक गॉवों में से एक गाँव है।,43,भू-राजनीति
१९५८ पाकिस्तानी तख्तापलट,"१९५८ का पाकिस्तानी तख्तापलट ७ अक्टूबर को शुरू हुआ, जब पाकिस्तान के पहले राष्ट्रपति इस्कंदर मिर्ज़ा ने पाकिस्तान के संविधान को निरस्त कर दिया और मार्शल लॉ घोषित कर दिया, और २७ अक्टूबर तक चला, जब मिर्ज़ा को खुद जनरल द्वारा अपदस्थ कर दिया गया। पाकिस्तानी सेना के कमांडर-इन-चीफ अयूब खान । १९५६ और १९५८ के बीच कई प्रधान मंत्री थे और यह एक ऐसे चरण में पहुंच गया जब जनरल अयूब खान ने महसूस किया कि सेना को स्थिरता बहाल करने के लिए नियंत्रण रखना चाहिए। पूर्वी पाकिस्तान के राजनेता चाहते थे कि केंद्र सरकार के संचालन में अधिक दखल दिया जाए, जिससे तनाव बढ़ गया। इस्कंदर मिर्जा ने कई प्रमुख राजनेताओं का समर्थन खो दिया था और सुहरावर्दी द्वारा उनके खिलाफ बंगाल और पंजाब के राजनीतिक नेतृत्व को एकजुट करने की योजना से चिंतित थे। इसलिए उसने मदद के लिए अयूब खान और सेना की ओर रुख किया।",150,भू-राजनीति
हिमाचल प्रदेश,"हिमाचल प्रदेश (अंग्रेज़ी: Himachal Pradesh, उच्चारण [hɪmaːtʃəl prəd̪eːʃ] ) उत्तर-पश्चिमी भारत में स्थित एक राज्य है। यह 21,629 मील² (56019 किमी²) से अधिक क्षेत्र में फ़ैला हुआ है तथा उत्तर में जम्मू और कश्मीर और लद्दाख केंद्र शासित प्रदेशों के पश्चिम तथा दक्षिण-पश्चिम में पंजाब (भारत), दक्षिण में हरियाणा एवं उत्तर प्रदेश, दक्षिण-पूर्व में उत्तराखण्ड तथा पूर्व में तिब्बत से घिरा हुआ है। हिमाचल प्रदेश का शाब्दिक अर्थ ""बर्फ़ीले पहाड़ों का प्रांत"" है।
हिमाचल प्रदेश को ""देव भूमि"" भी कहा जाता है। इस क्षेत्र में आर्यों का प्रभाव ऋग्वेद से भी पुराना है। आंग्ल-गोरखा युद्ध के बाद, यह ब्रिटिश औपनिवेशिक सरकार‌ के हाथ में आ गया। सन 1857 तक यह महाराजा रणजीत सिंह के शासन के अधीन पंजाब राज्य (पंजाब हिल्स के सीबा राज्य को छोड़कर) का हिस्सा था।
सन 1956 में इसे केन्द्र शासित प्रदेश बनाया गया, लेकिन 1971 में इसे, हिमाचल प्रदेश राज्य अधिनियम-1971 के अन्तर्गत इसे 25 जनवरी 1971 को भारत का अठारहवाँ राज्य बनाया गया।
हिमाचल प्रदेश प्रतिव्यक्ति आय के अनुसार भारत के राज्यों में पन्द्रहवें स्थान पर है। बारहमासी नदियों की बहुतायत के कारण, हिमाचल अन्य राज्यों को पनबिजली बेचता है जिनमे प्रमुख हैं दिल्ली, पंजाब (भारत) और राजस्थान। राज्य की अर्थव्यवस्था तीन प्रमुख कारकों पर निर्भर करती है जो हैं, पनबिजली, पर्यटन और कृषि।
हिंदु राज्य की जनसंख्या का 95% हैं और प्रमुख समुदायों में राजपूत, ब्राह्मण, घिर्थ (चौधरी), गद्दी, कन्नेत, राठी और कोली शामिल हैं। ट्रान्सपरेन्सी इंटरनैशनल के 2005 के सर्वेक्षण के अनुसार, हिमाचल प्रदेश देश में केरल के बाद दूसरी सबसे कम भ्रष्ट राज्य है।",253,भू-राजनीति
सूर्य देवता,"सूर्य को वेदों में जगत की आत्मा कहा गया है। समस्त चराचर जगत की आत्मा सूर्य ही है। सूर्य से ही इस पृथ्वी पर जीवन है, यह आज एक सर्वमान्य सत्य है। वैदिक काल में आर्य सूर्य को ही सारे जगत का कर्ता-धर्ता मानते थे।
सूर्य का शाब्दिक अर्थ है 'सर्व प्रेरक' । यह सर्व प्रकाशक, सर्व प्रवर्तक होने से सर्व कल्याणकारी है। ऋग्वेद के देवताओं में सूर्यदेव का महत्वपूर्ण स्थान है। यजुर्वेद ने ""चक्षो सूर्यो जायत"" कह कर सूर्य को भगवान का नेत्र माना है। छान्दोग्यपनिषद में सूर्य को प्रणव निरूपित कर उनकी ध्यान साधना से पुत्र प्राप्ति का लाभ बताया गया है। ब्रह्मवैवर्त पुराण तो सूर्य को परमात्मा स्वरूप मानता है। प्रसिद्ध गायत्री मंत्र सूर्य परक ही है। सूर्योपनिषद में सूर्य को ही संपूर्ण जगत की उत्पत्ति का एक मात्र कारण निरूपित किया गया है और उन्ही को संपूर्ण जगत की आत्मा तथा ब्रह्म बताया गया है। सूर्योपनिषद की श्रुति के अनुसार संपूर्ण जगत की सृष्टि तथा उसका पालन सूर्य ही करते है। सूर्य ही संपूर्ण जगत की अंतरात्मा हैं। 
अतः कोई आश्चर्य नहीं कि वैदिक काल से ही भारत में सूर्योपासना का प्रचलन रहा है। पहले यह सूर्योपासना मंत्रों से होती थी। बाद में मूर्ति पूजा का प्रचलन हुआ तो यत्र-तत्र सूर्य मन्दिरों का निर्माण हुआ। भविष्य पुराण में ब्रह्मा और विष्णु के मध्य एक संवाद में सूर्य पूजा एवं मन्दिर निर्माण का महत्व समझाया गया है। अनेक पुराणों में यह आख्यान भी मिलता है कि ऋषि दुर्वासा के श्राप से कुष्ठ रोग ग्रस्त श्री कृष्ण पुत्र साम्ब ने सूर्य की आराधना कर इस भयंकर रोग से मुक्ति पायी थी। प्राचीन काल में भगवान सूर्य के अनेक मन्दिर भारत में बने हुए थे। उनमे आज तो कुछ विश्व प्रसिद्ध हैं। वैदिक साहित्य में ही नहीं आयुर्वेद, ज्योतिष, हस्तरेखा शास्त्रों में सूर्य का महत्व प्रतिपादित किया गया है।",300,भू-राजनीति
अमृतसर,"अमृतसर (Amritsar), जिसका ऐतिहासिक नाम रामदासपुर (Ramdaspur) और जिसे आम बोलचाल में अम्बरसर (Ambarsar) कहा जाता है, भारत के पंजाब राज्य का (लुधियाना के बाद) दूसरा सबसे बड़ा नगर है और अमृतसर ज़िले का मुख्यालय है। यह पंजाब के माझा क्षेत्र में है और एक महत्वपूर्ण सांस्कृतिक, धार्मिक, यातायात और आर्थिक केन्द्र है। यह सिख धर्म का सबसे पवित्र नगर है और यहाँ सबसे बड़ा गुरद्वारा, स्वर्ण मंदिर, स्थित है। स्वर्ण मंदिर अमृतसर का हृदय माना जाता है। यह गुरू रामदास का डेरा हुआ करता था। अमृतसर चण्डीगढ़ से 217 किमी (135 मील) पश्चिमोत्तर, नई दिल्ली से 455 किमी (283 मील) पश्चिमोत्तर, पाकिस्तान के लाहौर नगर से 47 किमी (29.2 मील) पूर्वोत्तर और अटारी-वाहगा की भारत-पाक सीमा बिन्दु से 28 किमी (17.4 मील) दूर स्थित है।",126,भू-राजनीति
