title,content,word_count,topic
हरबर्ट स्पेंसर,"हरबर्ट स्पेंसर (27 अप्रैल 1820-8 दिसम्बर 1903)  विक्टोरिया काल के एक अंग्रेज़ दार्शनिक,  जीव-वैज्ञानिक, समाजशास्री और प्रसिद्ध पारंपरिक  उदारवादी राजनैतिक सिद्धांतकार थे। स्पेंसर ने भौतिक विश्व, जैविक सजीवों, मानव मन, तथा मानवीय संस्कृ्ति व समाजों की क्रमिक विकास के रूप में उत्पत्ति की एक सर्व-समावेशक अवधारणा विकसित की. एक बहुश्रुत व्यक्ति के रूप में, उन्होंने विषयों की एक व्यापक श्रेणी में अपना योगदान दिया, जिनमें नीतिशास्र, धर्म, मानविकी, अर्थशास्र, राजनैतिक सिद्धांत, दर्शनशास्र, जीव-विज्ञान, समाजशास्र व मनोविज्ञान शामिल हैं। अपने जीवनकाल के दौरान उन्होंने अत्यधिक प्रभुत्व प्राप्त किया, विशेषतः अंग्रेज़ी-भाषी शैक्षणिक समुदाय के बीच. सन 1902 में, उन्हें साहित्य में नोबेल पुरस्कार के लिये नामित किया गया. वास्तव में, यूनाइटेड किंगडम व संयुक्त राज्य अमेरिका में ""एक समय था, जब स्पेंसर के शिष्य उनकी तुलना अरस्तु के साथ करने से भी नहीं चूके!""
वे ""सर्वश्रेष्ठ की उत्तरजीविता (Survival of the fittest)"" की अवधारणा प्रस्तुत करने के लिये सबसे ज्यादा जाने जाते हैं, जो कि उन्होंने चार्ल्स डार्विन की ऑन द ओरिजिन ऑफ स्पीसीज़ पढ़ने के बाद प्रिंसिपल्स ऑफ बायोलॉजी (1864) में प्रस्तुत की थी। यह शब्दावली दृढ़तापूर्वक प्राकृतिक चयन का सुझाव देती है, लेकिन फिर भी जब स्पेंसर ने उत्पत्ति का विस्तार समाजशास्र और नीति-शास्र के क्षेत्रों में किया, तो उन्होंने लेमार्कवाद का प्रयोग भी किया।",205,भू-राजनीति
कैथरीन केल्विन,कैथरीन केल्विन संयुक्त वैश्विक परिवर्तन अनुसंधान संस्थान (JGCRI) में एक पृथ्वी वैज्ञानिक हैं । वह पैसिफिक नॉर्थवेस्ट नेशनल लेबोरेटरी (PNNL) और मैरीलैंड विश्वविद्यालय के निर्देशन में JGCRI में पृथ्वी मॉडलिंग सिस्टम का उपयोग करके वैश्विक संसाधनों के मानव उपयोग पर शोध करती है। उन्होंने तीसरे अमेरिकी राष्ट्रीय जलवायु मूल्यांकन के साथ-साथ जलवायु परिवर्तन पर अंतर्सरकारी पैनल (IPCC) द्वारा दो विशेष रिपोर्टों में योगदान दिया है।,65,भू-राजनीति
वनोन्मूलन,"वनोन्मूलन का अर्थ है वनों के क्षेत्रों में बहुत से पेड़ों को जलाया या काटा जाता है ऐसा करने के लिए कई कारण हैं; पेडों और उनसे व्युत्पन्न चारकोल को एक वस्तु के रूप में बेचा जा सकता है और मनुष्य के द्वारा उपयोग में लिया जा सकता है जबकि साफ़ की गयी भूमि को चरागाह (pasture) या मानव आवास के रूप में काम में लिया जा सकता है। पेडों को इस प्रकार से काटने और उन्हें पुनः न लगाने के परिणाम स्वरुप आवास (habitat) को क्षति पहुंची है, जैव विविधता (biodiversity) को नुकसान पहुंचा है और वातावरण में शुष्कता (aridity) बढ़ गयी है। साथ ही अक्सर जिन क्षेत्रों से पेडों को हटा दिया जाता है वे बंजर भूमि में बदल जाते हैं।
आंतरिक मूल्यों के लिए जागरूकता का अभाव या उनकी उपेक्षा, उत्तरदायी मूल्यों की कमी, ढीला वन प्रबन्धन और पर्यावरण के कानून, इतने बड़े पैमाने पर वनोन्मूलन की अनुमति देते हैं। कई देशों में वनोन्मूलन निरंतर की जाती है जिसके परिणामस्वरूप विलोपन (extinction), जलवायु में परिवर्तन, मरुस्थलीकरण (desertification) और स्वदेशी लोगों के विस्थापन जैसी प्रक्रियाएं देखने में आती हैं।",181,भू-राजनीति
भारतीय कर व्यवस्था,"सामान्य रूप से शासन सम्बंधी कार्यसंचालन के लिए व्यक्तिगत इकाइयों पर अनिवार्य उद्ग्रहण के रूप में कर (टैक्स) लगाए जाते हैं। करों को सामान्यत: राजस्ववृद्धि का ही साधन माना जाता है किंतु राष्ट्र की अर्थनीति को भी ये प्रभावित करते हैं। कर लगाने का उद्देश्य विकास कार्यों के लिये धन एकत्र करना तथा यथासंभव राष्ट्र की विषमता को दूर करना है। इसीलिए जिनकी अधिक आय है, उन्हें कम आयवालों की अपेक्षा अधिक मात्रा में कर देना पड़ता है।",78,भू-राजनीति
कोटपुतली-बहरोड़ जिला,"कोटपूतली-बहरोड़ जिला भारत के राजस्थान राज्य के उत्तर पूर्वी क्षेत्र में स्थित सन 2023 में नवीन स्थापित  17 जिलों में से एक है। ।  अलवर जिले और तत्कालीन जयपुर जिले से अलग की हुई आठ तहसीलों - कोटपूतली , बहरोड़ , नीमराणा , बानसूर , विराटनगर , माँढण , पावटा व नारायणपुर से बने इस जनपद की अधिकारिक स्थापना 7 अगस्त 2023 को हुई थी। बैराठ इस जिले के प्राचीनतम क्षेत्र में से है जिसका जिक्र पौराणिक कथाओं में कई जगह पर मिलता है, जो कभी मत्स्य साम्राज्य की राजधानी था एवं मौर्य वंश के सम्राट अशोक के नाम - प्रियदशी के बारे में भी इस जिले के भाब्रू में मिले शिलालेख से पता चलता है ।  इस जिले के एक बड़े  क्षेत्र को आमतौर पर ""राठ"" के रूप में जाना जाता है  जिसमें बहरोड़, नीमराणा, माँढण, बानसूर व मुण्डावर तहसीलें आती है जिसमे से मुण्डावर तहसील का अब नवगठित खैरथल-तिजारा जिले में विलय कर दिया गया । अन्य संदर्भ में इसे 'साबी-कांठा' भी कहा जाता है, अर्थात जो साबी नदी के तट के इर्द-र्गिद स्थित है।",177,भू-राजनीति
स्ट्रिंग सिद्धांत,"स्ट्रिंग सिद्धान्त ( स्ट्रिङ्ग सिद्धान्त ) कण भौतिकी का एक सक्रीय शोध क्षेत्र है जो प्रमात्रा यान्त्रिकी और सामान्य सापेक्षता में सामजस्य स्थपित करने का प्रयास करता है। इसे सर्वतत्व सिद्धांत का प्रतियोगी सिद्धान्त भी कहा जाता है, एक आत्मनिर्भर गणितीय प्रतिमान जो द्रव्य के रूप व सभी मूलभूत अन्योन्य क्रियाओं को समझाने में सक्षम है। स्ट्रिंग सिद्धान्त के अनुसार परमाणु में स्थित मूलभूत कण (इलेक्ट्रॉन, क्वार्क आदि) बिन्दु कण नहीं हैं अर्थात इनकी विमा शून्य नहीं है बल्कि एक विमिय दोलक रेखाएं हैं (स्ट्रिंग अथवा रजु)।",87,भू-राजनीति
रघुवीर सिंह (महाराज कुमार),"डॉ रघुवीर सिंह (23 फरवरी, 1908 - 13 फरवरी, 1991 ) कुशल चित्रकार, वास्तुशास्त्री, प्रशासक, सैन्य अधिकारी, प्रबुद्ध सांसद, समर्थ इतिहासकार और सुयोग्य हिन्दी साहित्यकार थे।",26,भू-राजनीति
अफ़्रीका की अर्थव्यवस्था,"विकिपीडिया, निःशुल्क विश्वकोष से
अफ़्रीका की अर्थव्यवस्था में महाद्वीप का व्यापार , उद्योग , कृषि और मानव संसाधन शामिल हैं । 2019 तक , लगभग 1.3 बिलियन लोग  अफ्रीका के 53 देशों में रह रहे थे । अफ़्रीका एक संसाधन-संपन्न महाद्वीप है।  

हालिया वृद्धि बिक्री, वस्तुओं, सेवाओं और विनिर्माण में वृद्धि के कारण हुई है। पश्चिम अफ्रीका, पूर्वी अफ्रीका, मध्य अफ्रीका और विशेष रूप से दक्षिणी अफ्रीका में 2050 तक संयुक्त सकल घरेलू उत्पाद 29 ट्रिलियन डॉलर तक पहुंचने की उम्मीद है।

मार्च 2013 में, अफ्रीका को दुनिया के सबसे गरीब आबादी वाले महाद्वीप के रूप में पहचाना गया था; हालाँकि, विश्व बैंक को उम्मीद है कि यदि मौजूदा विकास दर जारी रही तो अधिकांश अफ्रीकी देश 2025 तक ""मध्यम आय"" स्थिति (प्रति व्यक्ति कम से कम यूएस $ 1,025 अमेरिकी डॉलर के रूप में परिभाषित) तक पहुंच जाएंगे। अफ़्रीका की ख़राब अर्थव्यवस्था के कई कारण हैं। ऐतिहासिक रूप से, भले ही अफ़्रीका में दुनिया के कई हिस्सों के साथ व्यापार करने वाले कई साम्राज्य थे, बहुत से लोग ग्रामीण समाजों में रहते थे। इसके अलावा, यूरोपीय उपनिवेशीकरण और बाद के शीत युद्ध ने राजनीतिक, आर्थिक और सामाजिक अस्थिरता पैदा की। 
सन १९९५ से २००५ तक अफ्रीका की अर्थव्यवस्था में सुधार आया और वर्ष २००५ के लिए यह औसतन ५ प्रतिशत रही। कुछ देश जैसे अंगोला, सूडान और ईक्वीटोरियल गिनी जिन्होंने अपने पेट्रोलियम भंडारों अथवा पेट्रोलियम वितरण प्रणाली का विस्तार किया ने औसत से अधिक विकास दर दर्ज की। विगत कुछ वर्षों में चीन ने अफ्रीकी देशों में काफी निवेश किया है। सन २००७ में चीनी उपक्रमों ने अफ्रीकी देशों में कुल १ बिलियन डॉलर का निवेश किया।",268,भू-राजनीति
योगेन्द्र नाथ मंडल,"योगेन्द्र नाथ मंडल (१९०४ -- 5 अक्टूबर, 1968) पाकिस्तान के प्रमुख जनकों में से एक थे जो वहाँ के पहले कानून मंत्री और श्रमिक के रूप में सेवा करने वाले विधायक थे। वे राष्ट्रमंडल और कश्मीर मामलों के दूसरे मंत्री भी थे। एक भारतीय और बाद में पाकिस्तानी नेता जो पाकिस्तान में कानून और श्रम के पहले मंत्री थे। अनुसूचित जातियों (दलितों) के नेता के रूप में, योगेन्द्रनाथ ने मुस्लिम लीग के पाकिस्तान की मांग के साथ सहभगी बन गये  थे। उन्हें विश्वास था कि दलित जातियों को पाकिस्तान बनने का लाभ मिलेगा। वे पाकिस्तान के पहले कैबिनेट में शामिल हो गए थे। इसके कुछ ही वर्षों बाद पाकिस्तान के हिंदू-विरोधी पूर्वाग्रह का हवाला देते हुए वे कानून और श्रम मंत्री से अपना इस्तीफा देने के बाद भारत लौट आये थे। ।",132,भू-राजनीति
"प्रतापगढ़, राजस्थान",प्रतापगढ़ (Pratapgarh) भारत के राजस्थान राज्य के प्रतापगढ़ ज़िले में स्थित एक नगर है। यह ज़िले का मुख्यालय भी है।,20,भू-राजनीति
गणितीय तर्कशास्त्र,"गणितीय तर्कशास्त्र (Mathematical logic) गणित की शाखा है किसका संगणक विज्ञान एवं दार्शनिक तर्कशास्त्र से निकट का सम्बन्ध है। तर्कशास्त्र का गणितीय अध्ययन तथा गणित के अन्य विधाओं में तर्कशास्त्र (formal logic) के अनुप्रयोग दोनो ही इसके अंतर्गत आते हैं।
प्राय: गणितीय तर्कशास्त्र को समुच्चय सिद्धान्त, मॉडल सिद्धान्त (model theory), रिकर्सन सिद्धान्त (recursion theory) तथा सिद्धि सिद्धान्त (proof theory) नामक क्षेत्रों में विभक्त किया जाता है।",66,भू-राजनीति
त्रिविम रसायन,"विन्यासरसायन, या त्रिविम रसायन (Stereochemisty), रसायन की वह शाखा है जो अणुओं के अन्दर परमाणुओं के सापेक्षिक स्थिति (relative spatial arrangement) एवं उनके प्रभावों का अध्ययन करती है।",28,भू-राजनीति
ग्रह विज्ञान,"ग्रह विज्ञान यानी ग्रहों, उपग्रहों एवं सौर मंडल का वैज्ञानिक अध्ययन| इस विज्ञान में इन पिंडों की उत्पत्ति, भौतिक एवं रासायनिक संरचना, उनकी गति, आपसी निर्भरता और उनसे जुड़े हुए अन्य सभी पहलुओं का अध्ययन शामिल है।",37,भू-राजनीति
अकार्बनिक रसायन,"प्रांगार को छोड़कर शेष सभी तत्वों और उनके योगिकों की मीमांसा करना अकार्बनिक रसायन (Inorganic chemistry) का क्षेत्र है। बोरॉन, सिलिकन, जर्मेनियम आदि तत्त्व भी लगभग उसी प्रकार के विविध यौगिक बनाते हैं, जैसे कार्बन। पर इस पार्थिव सृष्टि में उनका उतना महत्त्व नहीं है जितना कार्बन यौगिकों का, इसलिए कार्बनिक रसायन का अन्य तत्वों से पृथक्‌ रासायनिक क्षेत्र मान लिया गया है। मनुष्य एवं वनस्पतियों का जीवन कार्बन यौगिकों के चक्र पर निर्भर है, अत: कार्बनिक यौगिकों को एक अलग उपांग में रखना कुछ अनुचित नहीं है। यह कार्बन ही है जो पृथ्वी पर पाए जानेवाले सामान्य ताप (०° से ४०°) पर अनेक स्थायी समावयवी यौगिक दे सकता है। hjbhhffhuhjiyv",111,भू-राजनीति
खनिज विज्ञान,"खनिज विज्ञान भूविज्ञान की एक शाखा होती है। इसमें खनिजों के भौतिक और रासायनिक गुणों का अध्ययन किया जाता है। विज्ञान की इस शाखा के अन्तर्गत खनिजों के निर्माण, संरचना, वर्गीकरण, उनके पाए जाने के भौगोलिक स्थानों और उनके गुणों को भी शामिल किया गया है। इसके माध्यम से ही खनिजों के प्रयोग और उपयोग का भी अध्ययन इसी में किया जाता है। विज्ञान की अन्य शाखाओं की भांति ही इसकी उत्पत्ति भी कई हजार वर्ष पूर्व हुई थी। वर्तमान खनिज विज्ञान का क्षेत्र, कई दूसरी शाखाओं जैसे, जीव विज्ञान और रासायनिकी तक विस्तृत हो गया है। यूनानी दार्शनिक सुकरात ने सबसे पहले खनिजों की उत्पत्ति और उनके गुणों को सिद्धांत रूप में प्रस्तुत किया था, हालांकि सुकरात और उनके समकालीन विचारक बाद में गलत सिद्ध हुए लेकिन उस समय के अनुसार उनके सिद्धांत नए और आधुनिक थे। किन्तु ये कहना भी अतिश्योक्ति न होगा कि उनकी अवधारणाओं के कारण ही खनिज विकास की जटिलताओं को सुलझाने में सहयोग मिला, जिस कारण आज उसके आधुनिक रूप से विज्ञान समृद्ध है। १६वीं शताब्दी के बाद जर्मन वैज्ञानिक जॉर्जियस एग्रिकोला के अथक प्रयासों के चलते खनिज विज्ञान ने आधुनिक रूप लेना शुरू किया।",191,भू-राजनीति
