title,content,word_count,topic
आंद्रे रसेल,"आंद्रे ड्वेन रसेल (जन्म 29 अप्रैल 1988) एक जमैका पेशेवर क्रिकेटर है। रसेल अंतर्राष्ट्रीय स्तर पर वेस्टइंडीज के लिए और जमैका में वेस्टइंडीज के घरेलू क्रिकेट में एक ऑलराउंडर के रूप में खेलते हैं। उन्होंने दुनिया भर में लीग में कई पक्षों के लिए 300 से अधिक ट्वेंटी 20 मैच खेले हैं।
व्यापक रूप से सीमित ओवरों की क्रिकेट में गेंद के सबसे शक्तिशाली स्ट्राइकरों में से एक के रूप में माना जाता है, रसेल Archived 2020-09-21 at the वेबैक मशीन ने 2018 कैरिबियन प्रीमियर लीग में रिकॉर्ड 40 गेंदों में शतक बनाया और उसी मैच में एक हैट्रिक ली, लेने वाले दूसरे खिलाड़ी बने। एक हैट्रिक और उसी ट्वेंटी 20 मैच में शतक बनाना।",115,खेल
सु डोकु,"सु डोकु (Sudoku या Su Doku) एक खेल है जो वर्ग पहेली या शतरंज की पहेलियों की तरह अखबार में छपता है। एक शाब्दिक वर्ग पहेली की तरह इस में एक वर्ग के अन्दर ९x९ के (या ६x६) खाने बने होते हैं। इस खेल का उद्देश्य होता है एक पंक्ति या स्तंभ (आड़ी या खड़ी लाइन) में १ से ९ तक के अंकों को इस तरह भरना कि कोई अंक एक पंक्ति में दुबारा ना आये और ना ही ३x३ के वर्ग में ही। 
जापानी में सु डोकु का अर्थ होता है ""अकेला अंक""। 
इस खेल का आकर्षण यह है कि इस खेल के नियम बहुत आसान होने पर भी इसे पूरा करना मुश्किल होता है। आमतौर पर ९x९ के खानों में कुछ अंक पहले से ही दिये होते हैं। खेलने वाले का काम है बाकी खाली खानों को भरना, इस तरह से कि कोई अंक एक पंक्ति या ३x३ के खानों में दुबारा ना आये।
सबसे पहले सु डोकु १९७० में न्यु यार्क में प्रकशित हुआ था। यह पहेली १९८४ में जापान में निकोली अखबार में शुरू हुई। २००५ में यह अन्तरराष्ट्रीय स्तर पर लोकप्रिय हो गयी। भारत में भी कई अखबारों में इसका प्रकाशन शुरू हो गया है।",200,खेल
"सिटी पैलेस, उदयपुर",सिटी पैलेस की स्थापना १६वीं शताब्दी में आरम्भ हुई। इसे स्थापित करने का विचार एक संत ने राजा उदयसिंह द्वितीय को दिया था। इस प्रकार यह परिसर ४०० वर्षों में बने भवनों का समूह है। यह एक भव्य परिसर है। इसे बनाने में २२ राजाओं का योगदान था। इस परिसर में प्रवेश के लिए टिकट लगता है। बादी पॉल से टिकट लेकर आप इस परिसर में प्रवेश कर सकते हैं। परिसर में प्रवेश करते ही आपको भव्य त्रिपोलिया गेट' दिखेगा। इसमें सात  आर्क हैं। ये आर्क उन सात स्मवरणोत्सैवों का प्रतीक हैं जब राजा को सोने और चांदी से तौला गया था तथा उनके वजन के बराबर सोना-चांदी को गरीबों में बांट दिया गया था। इसके सामने की दीवार 'अगद' कहलाती है। यहां पर हाथियों की लड़ाई का खेल होता था। इस परिसर में एक जगदीश मंदिर भी है। इसी परिसर का एक भाग सिटी पैलेस संग्रहालय है। इसे अब सरकारी संग्रहालय घोषित कर दिया गया है। वर्तमान में शम्भूक निवास राजपरिवार का निवास स्थानन है। इससे आगे दक्षिण दिशा में 'फतह प्रकाश भ्‍ावन' तथा 'शिव निवास भवन' है। वर्तमान में दोनों को होटल में परिवर्तित कर दिया गया है।,190,खेल
बीस सरकार,बीस सरकार (अंग्रेज़ी: Beas Sarkar )(जन्म ;२३ दिसम्बर १९७९) एक भारतीय महिला क्रिकेट खिलाड़ी है। इन्होंने भारतीय क्रिकेट टीम के लिए खेलती है और घरेलू क्रिकेट पश्चिम बंगाल की ओर से खेलती है। ये दाहिने हाथ से बल्लेबाजी और दाहिने ही हाथ से मध्यम तेज गति से गेंदबाजी करती है और इन्होंने भारत के लिए कुल एक एक दिवसीय अंतर्राष्ट्रीय मैच खेला है।,63,खेल
रेखा गोडबोले,रेखा गोडबोले (अंग्रेज़ी: Rekha Godbole) एक पूर्व भारतीय महिला क्रिकेट खिलाड़ी है जो १९८० के दशक में भारत की राष्ट्रीय महिला क्रिकेट टीम के लिए एक दिवसीय अंतर्राष्ट्रीय क्रिकेट मैच खेलती थी। इन्होंने भारतीय टीम के लिए चार एक दिवसीय अंतरराष्ट्रीय मैच खेले थे।  जिसमें इन्होंने २६ की औसत से ७८ रन बनाए थे।,54,खेल
पूर्णिमा चौधरी,"पूर्णिमा चौधरी (अंग्रेज़ी: Purnima Choudhary )(जन्म ;१५ अक्तूबर १९७१ ,कोलकाता ,भारत) एक पूर्व भारतीय महिला वनडे क्रिकेट खिलाड़ी है जो भारत की अंतरराष्ट्रीय महिला क्रिकेट टीम के लिए खेलती थी। ये दाएं हाथ से बल्लेबाजी और गेंदबाजी करती थी। इन्होंने अपने कैरियर में कुल पांच एक दिवसीय अंतर्राष्ट्रीय मैच खेले थे जिसमें इन्होंने २० रन बनाए थे।",57,खेल
आईसीसी टी-20 चैम्पियनशिप,"आईसीसी टी 20 चैम्पियनशिप अंतरराष्ट्रीय क्रिकेट परिषद द्वारा चलाए जा रहे एक अंतरराष्ट्रीय टी-20 क्रिकेट प्रतियोगिता है। में है कि यह बस एक रैंकिंग योजना नियमित रूप से टी20ई मैच समय पर मढ़ा है प्रतियोगिता काल्पनिक है। हर टी20ई मैच के बाद दोनों टीमों को एक गणितीय सूत्र के आधार पर अंक प्राप्त शामिल किया गया। कुल प्रत्येक टीम के अंक की कुल मैचों की कुल संख्या से विभाजित किया गया है एक दर्ज़ा देने के लिए, और सभी टीमों रेटिंग के क्रम में एक मेज पर क्रमबद्ध हैं।
वर्तमान में,  न्यूजीलैंड आईसीसी टी-20 चैम्पियनशिप ओर जाता है।",98,खेल
न्यूजीलैंड क्रिकेट,"न्यूजीलैंड क्रिकेट, पूर्व में न्यूजीलैंड क्रिकेट परिषद, न्यूजीलैंड में पेशेवर क्रिकेट के लिए शासी निकाय है। क्रिकेट न्यूजीलैंड में सबसे लोकप्रिय और उच्चतम प्रोफ़ाइल ग्रीष्मकालीन खेल है।
न्यूजीलैंड क्रिकेट न्यूजीलैंड क्रिकेट टीम का संचालन करता है, अन्य देशों के साथ टेस्ट टूर और एक दिवसीय अंतर्राष्ट्रीय का आयोजन करता है। यह न्यूजीलैंड में घरेलू क्रिकेट का आयोजन भी करता है, जिसमें प्लंकेट शील्ड प्रथम श्रेणी प्रतियोगिता, फोर्ड ट्रॉफी घरेलू एक दिवसीय प्रतियोगिता और सुपर स्मैश घरेलू ट्वेंटी 20 प्रतियोगिता शामिल है।
डेविड व्हाइट न्यूजीलैंड क्रिकेट के मुख्य कार्यकारी अधिकारी हैं। केन विलियमसन खेल के सभी रूपों में वर्तमान ब्लैक कैप्स के कप्तान हैं, जो ब्रेंडन मैकुलम के उत्तराधिकारी हैं, जो 2015 में सेवानिवृत्त हुए थे।",115,खेल
कुसाल परेरा,"मथुरागे डॉन कुसाल जनिथ परेरा (अंग्रेज़ी: Mathurage Don Kusal Janith Perera ; जन्म; १७ अगस्त १९९०) श्रीलंका क्रिकेट टीम के एक पेशेवर खिलाड़ी]] हैं। इन्हें आमतौर पर 'कुसाल परेरा' के नाम से जाना जाता है। ये श्रीलंका की राष्ट्रीय क्रिकेट टीम के लिए सभी प्रकार केप्रारूपों में खेल खेलते हैं, और वर्तमान में सभी प्रारूपों में स्थायी विकेट-कीपर हैं। ये २०१४ आईसीसी विश्व ट्वेन्टी-20 के विजेता टीम के एक प्रमुख सदस्य थे। वनडे इतिहास में इन्होंने संयुक्त रूप से संयुक्त दूसरे सबसे तेज अर्धशतक बनाने वाले खिलाड़ी है। घरेलू क्रिकेट में, वे वायम्बा क्रिकेट टीम के लिए खेलते हैं।",99,खेल
बिंदेश्वरी गोयल,"बिंदेश्वरी गोयल (जन्म ; ०१ जून १९७९, इंदौर, मध्य प्रदेश) एक भारतीय महिला क्रिकेट खिलाड़ी है जो टीम के लिए टेस्ट और वनडे मैच खेलती है।
बिंदेश्वरी दाहिने हाथ से बल्लेबाजी और गेंदबाजी करती है। इन्होंने अब तक तीन टेस्ट और चार एक दिवसीय मैच खेले है।",47,खेल
श्यामा शॉ,"श्यामा शॉ (अंग्रेज़ी: Shyama Shaw) (जन्म;०८ जुलाई १९७१ ,हावड़ा ,भारत )। ये एक अंतरराष्ट्रीय स्तर की पूर्व भारतीय महिला क्रिकेट खिलाड़ी है। इन्होंने अपने अंतरराष्ट्रीय क्रिकेट कैरियर की शुरुआत इंग्लैण्ड महिला क्रिकेट टीम के खिलाफ की थी। श्यामा बाएं हाथ से बल्लेबाजी और मध्यम तेज़ गेंदबाजी करती थी। इन्होंने अपने क्रिकेट जीवन में कुल तीन टेस्ट और पाँच एक दिवसीय मैच खेले थे।",63,खेल
भारत तिब्बत सीमा पुलिस,"भारतीय तिब्बत सीमा पुलिस (Indo-Tibetan Border Police) भारतीय अर्ध-सैनिक बल है। इसकी स्थापना भारांग: कार्तिक 2, 1884 / ग्रेगोरी कैलेण्डर: अक्टूबर 24, 1962 में भारत-तिब्बत सीमा की चीन के तिब्बत स्वायत्त क्षेत्र से रक्षा हेतु की गई थी। ये बल इस सीमा पर काराकोरम दर्रा से लिपुलेख दर्रा और भारत-नेपाल-चीन त्रिसंगम तक 2115 कि॰मी॰ की लम्बाई पर फैली सीमा की रक्षा करता है। आरम्भ में इसकी मात्र चार बटालियन की अनुमत थीं, जिन्हें बाद में 1976 में बल की कार्य-सीमा बढ़ाने पर 1978 में बढोत्तरी की गई।",87,खेल
जयदेव उनादकट,जयदेव दीपक भाई उनादकट (जन्म १८ अक्टूबर १९९१) एक भारतीय क्रिकेट खिलाड़ी है जो घरेलू खेलों  में सौराष्ट्र क्रिकेट टीम के लिए खेलते है तथा इंडियन प्रीमियर लीग में राजस्थान रॉयल्स के लिए खेलते हैं। उनादकट मुख्य रूप से गेंदबाजी  के लिए जाने जाते हैं। इन्होंने अपना पहला टेस्ट क्रिकेट मैच दक्षिण अफ्रीका क्रिकेट टीम के विरुद्ध सन् २०१० में खेला जबकि पहला एक दिवसीय अंतर्राष्ट्रीय मैच ज़िम्बाब्वे क्रिकेट टीम के ख़िलाफ़ २०१३ में खेला था |,77,खेल
देवेन्द्र झाझड़िया,"देवेन्द्र झाझड़िया (जन्म; १० जून १९८१) एक भारतीय पैरालंपिक खिलाड़ी है।  ये पैरालंपिक में दो स्वर्ण पदक जीतने वाले पहले भारतीय पैरालिंपियन है। 2004 पैरालंपिक एथेंस में उन्होंने पहला स्वर्ण पदक जीता था रियो डी जनेरियो, 2016 ग्रीष्मकालीन पैरालंपिक खेल में, उन्होंने अपने पहले रिकॉर्ड को बेहतर बनाते हुए, एक ही आयोजन में दूसरा स्वर्ण पदक जीता। देवेन्द्र को फिलहाल पैरा चैंपियंस कार्यक्रम के माध्यम से गो एसपोर्ट फाउंडेशन द्वारा समर्थित किया जा रहा है।",75,खेल
टिम पैन,टिमोथी डेविड (अंग्रेज़ी: Timothy David) जिन्हें अभी ज्यादातर टिम पैन के नाम से जाना जाता है। इनका जन्म ८ दिसम्बर १९८४ को ऑस्ट्रेलिया के होबार्ट शहर के तस्मानिया नामक शहर में हुआ था। ये एक ऑस्ट्रेलियाई क्रिकेट टीम के क्रिकेट खिलाड़ी है जो घरेलू क्रिकेट तस्मानिया टाइगर्स और होबार्ट हरिकेन्स नामक टीमों की ओर से खेलते हैं पैन मुख्य रूप से एक बल्लेबाज और साथ ही विकेटकीपर के लिए भी जाने है। ये आईपीएल में एक सीजन में पुणे वॉरियर्स इंडिया के लिए खेले थे।,85,खेल
रजत पदक,"रजत पदक (silver medal), रजत (चाँदी) से बना या चाँदी का लेप किया हुआ पदक होता है जो किसी खेल या अन्य प्रतियोगिता में द्वितीय स्थान प्राप्त करने वाले प्रतियोगी को पुरस्कार के रूप में प्रदान किया जाता है।",39,खेल
वेस्टइंडीज़ क्रिकेट टीम,"वेस्टइंडीज क्रिकेट टीम, जिसे बोलचाल में और जून 2017 से आधिकारिक रूप में विंडीज बोला जाता है। यह कॅरीबियाई क्षेत्र का प्रतिनिधित्व करने वाली एक बहुराष्ट्रीय क्रिकेट टीम है जिसे क्रिकेट वेस्ट इंडीज प्रशासित करता है। यह एक समग्र टीम है जिसमें खिलाड़ियों का चयन, 15 मुख्य रूप से अंग्रेजी भाषी कैरेबियाई क्षेत्रों की एक श्रृंखला से किया जाता है, जिसमें कई स्वतंत्र देश और अधीन क्षेत्र शामिल हैं। 
1970 के दशक के मध्य से लेकर 1990 के दशक की शुरुआत तक वेस्टइंडीज टीम टेस्ट और वनडे दोनों रूपों में विश्व में सबसे मजबूत थी। दुनिया के कई महान क्रिकेट खिलाड़ी वेस्टइंडीज की तरफ से आये हैं: गारफील्ड सोबर्स, लांस गिब्स, गॉर्डन ग्रीनिज़, जॉर्ज हेडली, ब्रायन लारा, क्लाइव लॉयड, मैल्कम मार्शल, एंडी रॉबर्ट्स, एल्विन कालीचरण, रोहन कन्हई, फ्रैंक वॉरेल, क्लाइड वॉल्कोट, एवर्टन वीक्स, कर्टली एम्ब्रोस, माइकल होल्डिंग, कोर्टनी वॉल्श, जोएल गार्नर और विवियन रिचर्ड्स को आईसीसी क्रिकेट हॉल ऑफ फेम में शामिल किया गया है।
वेस्टइंडीज ने आईसीसी क्रिकेट विश्व कप दो बार 1975 में और 1979 में, आईसीसी विश्व ट्वेंटी -20 दो बार, 2012 में और 2016 में, आईसीसी चैंपियन्स ट्रॉफ़ी एक बार 2004 में और 2016 में आईसीसी अंडर-19 विश्व कप को एक बार जीता है। साथ ही वह 1983 क्रिकेट विश्व कप के और 2004 में अंडर 19 क्रिकेट विश्व कप के उपविजेता थे। वेस्टइंडीज़ दो बार लगातार (1975 और1979) विश्व कप जीतने वाली पहली टीम थीं और वह लगातार तीन विश्व कप फाइनल (1975, 1979 और 1983) में खेली। वेस्टइंडीज ने 2007 क्रिकेट विश्व कप और 2010 आईसीसी विश्व ट्वेंटी 20 की मेजबानी की है। जून 2019 में, 2019 क्रिकेट विश्व कप के दौरान, वेस्टइंडीज ने अपना 800 वां एकदिवसीय मैच खेला।",276,खेल
