title,content,word_count,topic
1960 शीतकालीन ओलंपिक,"1960 शीतकालीन ओलंपिक, आधिकारिक तौर पर VIII ओलंपिक शीतकालीन खेलों के रूप में जाना जाता है, संयुक्त राज्य अमेरिका में कैलिफोर्निया के स्क्वा घाटी में 18-28 फरवरी, 1960 के बीच आयोजित एक शीतकालीन बहु-खेल आयोजन था। स्क्वॉ वैली को अंतरराष्ट्रीय ओलंपिक समिति (आईओसी) की 1956 की बैठक में खेलों की मेजबानी के लिए चुना गया था। यह 1955 में एक अविकसित रिसॉर्ट था, इसलिए 1956 से 1960 तक बुनियादी ढांचे और सभी स्थानों को 80 लाख अमेरिकी डॉलर की लागत से बनाया गया था। इसे अंतरंग बनाया गया था, दर्शकों और प्रतिद्वंद्वियों को लगभग सभी स्थानों पर चलने की इजाजत देनी थी। स्क्वॉ वैली ने तीस राष्ट्रों के एथलीटों की मेजबानी की जो चार खेलों में खेलते थे और 27 घटनाओं में भाग लेते थे। महिला स्पीड स्केटिंग और बायैथलॉन ने अपने ओलंपिक के लिए शुभकामनाएं। आयोजकों ने तय किया कि बोब्स्ले इवेंट ने एक स्थल बनाने के लिए लागत का वारंट नहीं किया, इसलिए पहले और एकमात्र समय के लिए बोबस्लेबल शीतकालीन ओलंपिक कार्यक्रम पर नहीं था। सोवियत संघ कुल 21 पदक जीते, जिनमें से सात स्वर्ण पदक थे। सोवियत स्पीड स्केटर येवगेनी ग्रिशिन और लीडिया स्कोब्लोिकोवा ने दो स्वर्ण पदक जीते। स्वीडिश क्रॉस-कंट्री स्कीयर सिक्सटन जेर्नबर्ग ने 1956 के शीतकालीन खेलों में जीता चार पदक के लिए एक स्वर्ण और रजत जोड़ा।
शीत युद्ध की राजनीति ने आईओसी को चीन, ताइवान, उत्तर कोरिया और पूर्वी जर्मनी की भागीदारी पर बहस करने के लिए मजबूर किया। 1957 में संयुक्त राज्य सरकार ने कम्युनिस्ट देशों के एथलीटों के लिए वीजा से इनकार करने की धमकी दी थी। आईओसी ने 1960 के खेलों की मेजबानी करने के लिए स्क्वॉ घाटी के अधिकार को रद्द करने की धमकी दी थी। संयुक्त राज्य अमेरिका ने कम्युनिस्ट देशों के एथलीटों को प्रवेश स्वीकार किया और अनुमति दी।",293,खेल
कोस्ता रीका,"कोस्ता रीका या कोस्टा रिका मध्य अमेरिका में कैरिबियाई क्षेत्र में स्थित एक देश है। इस देश कि सीमा दक्षिणपूर्व में पनामा और उत्तर में निकारागुआ मिलती हैं।
२०वीं शताब्दी के मध्य काल में एक 44 दिन के भयंकर गृह युद्ध के बाद सन् १९४९ में इस देश ने अपनी सेना समाप्त कर दी और विश्व के उन बहुत कम देशों में से एक हो गया जिसकी अपनी कोई सेना नहीं है।",72,खेल
खिजी चण्डेश्वरी,"खिजी चण्डेश्वरी नेपाल के पूर्वांचल विकास क्षेत्र के सगरमाथा अंचल, ओखलढुंगा जिला में स्थित गाँव विकास समिति है।",18,खेल
1996 ग्रीष्मकालीन ओलंपिक,"1996 ग्रीष्मकालीन ओलंपिक्स, आधिकारिक रूप से XXVI ओलंपियाड खेलों के खेलों के रूप में जाना जाता है और अनौपचारिक रूप से सौ साल का ओलंपिक खेलों के रूप में जाना जाता है, यह एक प्रमुख अंतरराष्ट्रीय बहु-खेल आयोजन था जो अटलांटा, जॉर्जिया, संयुक्त राज्य अमेरिका में 19 जुलाई से 4 अगस्त 1996 तक हुआ था। एक रिकार्ड 197 देशों, सभी मौजूदा आईओसी सदस्य देशों, ने खेलों में भाग लिया, जिसमें 10,318 एथलीट शामिल थे। अंतर्राष्ट्रीय ओलंपिक समिति ने 1986 में ग्रीष्मकालीन और शीतकालीन खेलों को अलग करने के लिए मतदान किया था, जो 1924 के बाद से उसी वर्ष में आयोजित किया गया था, और उन्हें 1994 में शुरू होने वाले क्रमशः वर्षों में भी बदल दिया गया था। शीतकालीन खेलों के एक अलग वर्ष में 1996 ग्रीष्मकालीन खेलों का आयोजन किया गया था। अटलांटा ओलंपिक खेलों की मेजबानी करने वाला पांचवां अमेरिकी शहर बन गया और तीसरी बार ग्रीष्मकालीन ओलंपिक खेलों का आयोजन किया।",155,खेल
नीलिमा जोगलेकर,"नीलिमा जोगलेकर (अंग्रेज़ी: Nilima Jogalekar) (जन्म ०१ जुलाई १९६१) एक पूर्वभारतीय महिला क्रिकेट खिलाड़ी है जिन्होंने अपना पहला अंतरराष्ट्रीय स्तर का मैच १९७८ में खेला था। ये एक मध्यम क्रम की बल्लेबाज और विकेट-कीपर थी। नीलिमा घरेलू क्रिकेट महाराष्ट्र की ओर से खेला करती थी।
नीलिमा जोगलेकर ने अपने क्रिकेट कैरियर में कुल ६ टेस्ट क्रिकेट मैच और २० एक दिवसीय अंतर्राष्ट्रीय मैच खेले थे। इन्होंने निम्नांकित श्रृंख़लाओं में मैच खेले :-

१९७८ महिला क्रिकेट विश्व कप
१९८२ महिला क्रिकेट विश्व कप
१९८३/८४ ऑस्ट्रेलिया का भारत दौरा
१९८४/८५ न्यूजीलैंड का भारत दौरा
नीलिमा जोगलेकर ने भारत की ओर से एकमात्र टेस्ट मैच में कप्तानी की थी जो न्यूजीलैंड महिला क्रिकेट टीम के ख़िलाफ़ खेला गया था।",116,खेल
भारतीय ओलम्पिक संघ,"भारतीय ओलम्पिक संघ भारत की राष्ट्रीय ओलम्पिक समिति (एनओसी) है। संघ का कार्य ओलंपिक खेलों, एशियाई खेलों व अन्य अंतरराष्ट्रीय बहु-खेल प्रतियोगिताओं में भारत का प्रतिनिधित्व करने वाले एथलीटों का चयन करना और भारतीय दल का प्रबंधन करना है। यह भारतीय राष्ट्रमंडल खेल संघ कि तरह भी कार्य करता है, तथा राष्ट्रमंडल खेलों में भारत का प्रतिनिधित्व करने वाले एथलीटों का भी चयन करता है।",65,खेल
डेविड वॉर्नर (क्रिकेटर),"डेविड एंड्रयू वार्नर (जन्म: 23 अक्टूबर   1986) एक ऑस्ट्रेलियाई क्रिकेटर हैं। तेज़ी से रन बनाने वाले बाएं हाथ के सलामी बल्लेबाज वार्नर,क्रिकेट इतिहास सालों  ऐसे पहले क्रिकेटर हैं जिन्होंने ब्रिसबेन में शतक बनाया उससे पहले सर डाॅन ब्रेडमैन ने अपने आखिरी मैच में 80 रन बनाए थे। वाॅर्नर न्यू साउथ वेल्स, डरहम, हैदराबाद और सिडनी सिक्सर्स के लिए खेलते हैं।
IPL मेगा ऑक्शन 2022 में डेविड वॉर्नर को 6.25 करोड़ में दिल्ली कैपिटल्स ने खरीदा है",76,खेल
बरकतुल्ला खाँ स्टेडियम जोधपुर,बरकतुल्ला खाँ स्टेडियम एक प्रमुख खेल का मैदान है। यह राजस्थान के जोधपुर जिले में स्थित है। यहाँ पर दो एक दिवसीय अंतर्राष्ट्रीय मैचों का आयोजन हो चुका है। प्रथम मैच सन २००० में भारत और ज़िम्बाब्वे के बीच हुआ था। दूसरा मैच सन २००२ में भारत और वेस्ट इंडीज के बीच मे हुआ था।इस मैदान पर 20 साल बाद फिर से लेजेंड्स क्रिकेट लीग के मैच 30 सितंबर से 03 अक्टूबर 2022 को हुए है।,76,खेल
अल्वारतिरुनगर,"तूतुकुड़ी ज़िले में इस से मिलते हुए नाम के नगर के लिए अल्वारतिरुनगरी का लेख देखें

अल्वारतिरुनगर (Alwarthirunagar) भारत के तमिल नाडु राज्य में चेन्नई नगर का एक मुहल्ला है। यह चेन्नई निगम के पश्चिमी सीमा पर, और चेन्नई शहर और पूनामल्ली के बीच अर्काट रोड पर पहली बस्ती है।",50,खेल
गुंडप्पा विश्वनाथ,"गुंडप्पा विश्वनाथ (Gundappa Viswanath/, जन्म 12 फरवरी 1949) पूर्व भारतीय क्रिकेटर हैं। उन्होंने 1967 में अपने पहले प्रथम श्रेणी मैच में 230 रन बनाए थे। गुंडप्पा विश्वनाथ 1970 के दशक में भारतीय बैटिंग की रीढ़ थे। वे इस दशक में सुनील गावस्कर के बाद निर्विवाद रूप से सबसे बेहतरीन बल्लेबाज रहे। वे बैकफुट पर बहुत अच्छा खेलते थे। लेट कट शॉट में उन्हें महारत हासिल थी। गुंडप्पा को उनकी खेल भावना के लिए भी याद किया जाता है। उन्होंने गोल्डन जुबली मैच में इंग्लैंड के बॉब टेलर को तब दोबारा बैटिंग के लिए बुला लिया था, जब अंपायर उन्हें आउट दे चुके थे। भारत यह मैच हार गया था, लेकिन कप्तान गुंडप्पा विश्वनाथ ने कहा कि उनके लिए परिणाम से ज्यादा अहमियत इस बात की है कि मैच खेलभावना के साथ खेला जाए।",133,खेल
महमूदुल्लाह,"मोहम्मद महमुदुल्ला रियाद बंग्लादेश के क्रिकेट खिलाड़ी हैं। अभी वे टी-२० क्रिकेट टीम के कप्तान भी हैं। उन्होंने ढाका डिवीजन के लिए प्रथम श्रेणी और सूची ए क्रिकेट खेला है और खेल के सभी रूपों में बांग्लादेश का प्रतिनिधित्व किया है। ऑलराउंडर, वह कम या मध्यक्रम के बल्लेबाज होने के साथ-साथ ऑफ स्पिन गेंदबाज भी हैं। वह अपने खेल पर एक करीबी सीमित खत्म करने की क्षमता के लिए प्रमुख है। वह विश्व कप शतक जड़ने वाले पहले बांग्लादेशी हैं।",80,खेल
एक्सबॉक्स 360,एक्सबॉक्स 360 (अंग्रेज़ी: Xbox 360) माइक्रोसॉफ्ट द्वारा निर्मित दूसरा वीडियो गेम कंसोल है जो एक्सबॉक्स का उत्तराधिकारी है। यह सोनी के प्लेस्टेशन 3 और निनटेंडो के वी से स्पर्धा करता है जो सातवीं पीढ़ी के वीडियो गेम कंसोल है। 9 जनवरी 2012 के अनुसार एक्सबॉक्स 360 की 6 करोड़ 60 लाख बिक्री हो चुकी है।,55,खेल
१९८३ क्रिकेट विश्व कप,"1983 क्रिकेट विश्व कप (आधिकारिक रूप से प्रूडेंशियल कप '83) क्रिकेट विश्व कप टूर्नामेंट का तीसरा संस्करण था। यह इंग्लैंड और वेल्स में 9 से 25 जून 1983 तक आयोजित किया गया था और भारत द्वारा जीता गया था। आयोजन में आठ देशों ने भाग लिया। 1983 का विश्व कप टूर्नामेंट के दौरान नाटकीय क्रिकेट से भरा हुआ था।भारत और जिम्बाब्वे जैसी टीमें जो उस समय के दौरान अच्छा नहीं खेल रही थीं, उन्होंने क्रमशः वेस्टइंडीज और ऑस्ट्रेलिया पर जीत दर्ज की। इंग्लैंड, पाकिस्तान, भारत और टूर्नामेंट पसंदीदा वेस्टइंडीज ने सेमीफाइनल के लिए क्वालीफाई किया। प्रारंभिक मैच चार टीमों में से प्रत्येक के दो समूहों में खेले गए थे, और प्रत्येक देश ने अपने समूह में दो बार दूसरों को खेला था। प्रत्येक समूह में शीर्ष दो टीमों ने सेमीफाइनल के लिए क्वालीफाई किया।
मैचों में प्रति पारी 60 ओवर शामिल थे और पारंपरिक सफेद कपड़ों और लाल गेंदों के साथ खेले गए थे। वे सभी दिन के दौरान खेले जाते थे।",162,खेल
1960 ग्रीष्मकालीन ओलंपिक,"1960 ग्रीष्मकालीन ओलंपिक, जिसे आधिकारिक तौर पर XVII ओलंपियाड के खेलों के नाम से जाना जाता है, रोम, इटली में 25 अगस्त से 11 सितंबर, 1960 तक आयोजित अंतरराष्ट्रीय बहु-खेल आयोजन था। रोम को 1908 के ग्रीष्मकालीन ओलंपिक के संगठन से सम्मानित किया गया था, लेकिन 1906 माउंट वेसूवियस के विस्फोट के बाद, इसे गिरने और लंदन के लिए सम्मान पास करने के लिए मजबूर किया गया था।",68,खेल
शेन वॉर्न,"शेन वॉर्न ऑस्ट्रेलिया के पूर्व क्रिकेट खिलाड़ी थे जिन्हें व्यापक रूप से खेल के इतिहास में सबसे महान गेंदबाजों में से एक माना जाता है। 1992 में शेन वॉर्न ने अपना पहला टेस्ट मैच खेला था और श्रीलंका के मुथैया मुरलीधरन के बाद वह दूसरे गेंदबाज बने थे जिन्होंने 1000 अंतरराष्ट्रीय विकेट (टेस्ट और वनडे मैचों में) लिये। वॉर्न के 708 विकेट टेस्ट क्रिकेट में किसी भी गेंदबाज द्वारा लिये गए सर्वाधिक विकेट थे, जब तक कि मुरलीधरन ने इससे ज्यादा विकेट नहीं ले लिये थे। वॉर्न उपयोगी निचले क्रम के बल्लेबाज भी थे। वह एकमात्र खिलाड़ी है जिन्होंने 3000+ टेस्ट रन बनाए लेकिन कभी शतक नहीं जड़ा। उनका करियर मैदान के बाहर विवादों से ग्रस्त रहा। इन में प्रतिबंधित पदार्थ के लिए सकारात्मक परीक्षण पाए जाने पर क्रिकेट से प्रतिबंध शामिल था। साथ ही सट्टेबाजों से पैसा स्वीकार करके खेल को बदनामी में लाने का आरोप और भी कई विवाद।
वह जनवरी 2007 में ऑस्ट्रेलिया की इंग्लैंड पर 5-0 की द एशेज की जीत के अंत में अंतर्राष्ट्रीय क्रिकेट से सेवानिवृत्त हुए। उस समय ऑस्ट्रेलियाई टीम के अभिन्न अंग में से तीन अन्य खिलाड़ी भी रिटायर हुए- ग्लेन मैकग्रा, डेमियन मार्टिन और जस्टिन लैंगर। अंतरराष्ट्रीय क्रिकेट से अपनी सेवानिवृत्ति के बाद वॉर्न ने हैम्पशायर काउंटी क्रिकेट क्लब के लिये प्रथम श्रेणी क्रिकेट खेला। 2008 में आईपीएल की टीम राजस्थान रॉयल्स के कोच और कप्तान की भूमिका निभाई और टीम को जीत दिलाई। कुल मिलाकर उन्होंने 1992 से 2007 तक 145 टेस्ट मैच खेलें थे जिसमें उन्होंने 25.41 की गेंदबाज़ी औसत से 708 विकेट लिये। 1993 से 2005 तक उन्होंने 194 एक दिवसीय अंतर्राष्ट्रीय में 293 विकेट लिये। 1999 क्रिकेट विश्व कप की विजेता टीम में उनका अहम योगदान था। 'शेन वॉर्न' का 52 साल की उम्र में 4 मार्च 2022 को निधन हुआ।",294,खेल
"लक्ष्मीबाई राष्ट्रीय शारीरिक शिक्षा विश्वविद्यालय, ग्‍वालियर","लक्ष्मीबाई राष्ट्रीय शारीरिक शिक्षा विश्वविद्यालय, ग्‍वालियर भारत का एक विश्वविद्यालय है।",11,खेल
