title,content,word_count,topic
रंगमंच,"रंगमंच (थिएटर) वह स्थान है जहाँ नृत्य, नाटक, खेल आदि हों। रंगमंच शब्द रंग और मंच दो शब्दों के मिलने से बना है। रंग इसलिए प्रयुक्त हुआ है कि दृश्य को आकर्षक बनाने के लिए दीवारों, छतों और पर्दों पर विविध प्रकार की चित्रकारी की जाती है और अभिनेताओं की वेशभूषा तथा सज्जा में भी विविध रंगों का प्रयोग होता है और मंच इसलिए प्रयुक्त हुआ है कि दर्शकों की सुविधा के लिए रंगमंच का तल फर्श से कुछ ऊँचा रहता है। दर्शकों के बैठने के स्थान को प्रेक्षागार और रंगमंच सहित समूचे भवन को प्रेक्षागृह, रंगशाला, या नाट्यशाला (या नृत्यशाला) कहते हैं। पश्चिमी देशों में इसे थिएटर या ऑपेरा नाम दिया जाता है।",114,रंगमंच
हिंदी रंगमंच,हिंदी रंगमंच से अभिप्राय हिंदी और उसकी बोलियों के रंगमंच से है। हिन्दी रंगमंच की जड़ें रामलीला और रासलीला से आरम्भ होती हैं। हिन्दी रंगमंच पर संस्कृत नाटकों का भी प्रभाव है। भारतेन्दु हरिश्चंद्र हिन्दी रंगमंच के पुरोधा हैं।,39,रंगमंच
पारसी रंगमंच,"' पारसी रंगमंच' से 'फारसी भाषा का रंगमंच' या 'इरान का रंगमंच' का अर्थ न समझें। यह अलग है जो भारत से संबन्धित है।

पारसी रंगमंच या पार्सी थिएटर अथवा पारसी थिएटर लगभग 1850 के दशक से लेकर 1930 के दशक तक भारत के पश्चिमी और उत्तरी भाग में प्रचलित रंगमंच परम्परा का सामान्य नाम है। इन थिएटर कम्पनियों के रंगकर्मी अधिकांशतः पार्सी होते थे और इनका स्वामित्व भी अधिकांशतः पार्सियों के हाथों में ही था। इनमें खेले जाने वाले नाटक गुजराती, हिन्दी और उर्दू में होते थे। यह रंगमंच मुम्बई में आरम्भ हुआ किन्तु शीघ्र ही ऐसी कम्पनियाँ बन गयीं जो एक जगह से दूसरे जगह जा-जाकर नाटक प्रदर्शित करतीं थीं।
हिंदी रंगमंच के विकास में पार्सी रंगमंच का ऐतिहासिक दृष्टि से महत्व है। पार्सी रंगमंच ने उस समय समस्त भारत में नाटक के क्षेत्र को विस्तृत करने में बहुत काम किया है। पारसी रंगमंच का व्यावसायिक दृष्टि से अनेक नाट्य मण्डलियों का जन्म हआ। इनमें से बहुत सी नाटक मण्डलियाँ अपने नाटकों के प्रयोग के लिए देश के विविध प्रांतों में भ्रमण करती थीं।",176,रंगमंच
भारतीय रंगमंच,"भारत में रंगमंच का इतिहास बहुत पुराना है। ऐसा समझा जाता है कि नाट्यकला का विकास सर्वप्रथम भारत में ही हुआ। ऋग्वेद के कतिपय सूत्रों में यम और यमी, पुरुरवा और उर्वशी आदि के कुछ संवाद हैं। इन संवादों में लोग नाटक के विकास का चिह्न पाते हैं। अनुमान किया जाता है कि इन्हीं संवादों से प्रेरणा ग्रहण कर लागों ने नाटक की रचना की और नाट्यकला का विकास हुआ। यथासमय भरतमुनि ने उसे शास्त्रीय रूप दिया।",77,रंगमंच
अंतर्राष्ट्रीय रंगमंच दिवस,"अंतर्राष्ट्रीय रंगमंच दिवस की स्थापना 1961 में नेशनल थियेट्रिकल इंस्टीट्यूट द्वारा की गई थी। तब से यह प्रति वर्ष 27 मार्च को विश्वभर में फैले नेशनल थियेट्रिकल इंस्टीट्यूट के विभिन्न केंद्रों में तो मनाया ही जाता है, रंगमंच से संबंधित अनेक संस्थाओं और समूहों द्वारा भी इस दिन को विशेष दिवस के रूप में आयोजित किया जाता है। इस दिवस का एक महत्त्वपूर्ण आयोजन अंतर्राष्ट्रीय रंगमंच संदेश है, जो विश्व के किसी जाने माने रंगकर्मी द्वारा रंगमंच तथा शांति की संस्कृति विषय पर उसके विचारों को व्यक्त करता है। 1962 में पहला अंतर्राष्ट्रीय रंगमंच संदेश फ्रांस की जीन काक्टे ने दिया था। वर्ष 2002 में यह संदेश भारत के प्रसिद्ध रंगकर्मी गिरीश कर्नाड द्वारा दिया गया था।",117,रंगमंच
प्रथम विश्व युद्ध का पूर्वी रंगमंच,"प्रथम विश्व युद्ध का पूर्वी रंगमंच या पूर्वी मोर्चा, एक ऐसा सैन्य अभियान था, जिसमें एक तरफ रूस और रोमानिया और दूसरी तरफ ऑस्ट्रिया-हंगरी, बुल्गारिया, ओटोमन साम्राज्य और जर्मनी के बीच की पूरी सीमा शामिल थी। यह उत्तर में बाल्टिक सागर से लेकर दक्षिण में काला सागर तक फैला हुआ था। इस रंगमंच में पूर्वी यूरोप का अधिकांश भाग मध्य यूरोप में तक फैला हुआ था। पूर्वी रंगमंच, पश्चिमी रंगमंच के मुकाबले काफी अलग था, भौगोलिक दृष्टि से बेल्जियम और फ्रांस युद्ध में स्थिर था। जबकि पूर्वी क्षेत्रों में युद्ध की स्थिति अधिक काफी गतिशील थी, जिसमें सेना के घेराव के कारण 100,000 वर्ग मील क्षेत्र विदेशी कब्जे में चला गया।",111,रंगमंच
द्वितीय विश्व युद्ध का भूमध्यसागर और मध्यपूर्व रंगमंच,"भूमध्यसागरीय और मध्य पूर्व रंगमंच द्वितीय विश्व युद्ध का एक प्रमुख युद्ध क्षेत्र था, जो जून 1940 से मई 1945 तक फैला रहा। इस क्षेत्र में मित्र राष्ट्रों और धुरी राष्ट्रों के बीच लड़ाई हुई, जिसमें उत्तरी अफ्रीका, भूमध्य सागर, और मध्य पूर्व के बड़े हिस्से शामिल थे।
इस अभियान का मुख्य उद्देश्य उत्तरी अफ्रीका और मध्य पूर्व पर नियंत्रण प्राप्त करना था, जो रणनीतिक और आर्थिक दृष्टि से महत्वपूर्ण क्षेत्र थे। यहाँ पर दोनों पक्षों ने संसाधनों और भू-राजनीतिक स्थिति पर प्रभुत्व पाने के लिए युद्ध किया।",88,रंगमंच
नाटक,"पारम्परिक सन्दर्भ में, नाटक, काव्य का एक रूप है (दृश्यकाव्य)। जो रचना श्रवण द्वारा ही नहीं अपितु दृष्टि द्वारा भी दर्शकों के हृदय में रसानुभूति कराती है उसे नाटक या दृश्य-काव्य कहते हैं। नाटक में श्रव्य काव्य से अधिक रमणीयता होती है। श्रव्य काव्य होने के कारण यह लोक चेतना से अपेक्षाकृत अधिक घनिष्ठ रूप से संबद्ध है। नाट्यशास्त्र में लोक चेतना को नाटक के लेखन और मंचन की मूल प्रेरणा माना गया है।",74,रंगमंच
"कालिदास अकादमी, उज्जैन","कालिदास अकादमी संस्कृति विभाग मध्यप्रदेश शासन के सहयोग से उज्जैन में सन् 1978 में स्थापित हुई।महाकवि कालिदास ने नाम पर बनी यह अकादमी शास्त्रीय साहित्य, शास्त्रीय रंगमंच एवं विभिन्न कला-परम्पराओं के गहन अध्ययन, शोध, अनुशीलन, प्रकाशन एवं प्रयोग के सक्रिय केन्द्र के रूप में कार्यरत है।संस्कृत अकादमी का भी इसमें विलय हो चुका है। 

 तथा मध्यप्रदेश संस्कृत अकादमी भोपाल में स्थित हैं जिसे 1985 में स्थापित किया गया था।",69,रंगमंच
रंगमंच तत्परता परिचालन व्यायाम,रंगमंच तत्परता परिचालन व्यायाम (TROPEX) भारत के सबसे बड़े इंटर-सर्विस सैन्य अभ्यास को शामिल सभी सेवाओं के लिए भारतीय सशस्त्र बलों. महीने तक अभ्यास प्रतिवर्ष आयोजित किया जाता है.,29,रंगमंच
हृषीकेश सुलभ,"हृषीकेश सुलभ (जन्म फ़रवरी १५, १९५५) हिन्दी के समकालीन शीर्ष लेखकों में से हैं। 2019 के संगीत नाटक अकादमी पुरस्कार से सम्मानित, सुलभ कहानी, नाटक और बिदेशिया शैली में लेखन के लिए जाने जाते हैं। 1980 से 2015 के बीच आप ऑल इण्डिया रेडियो में कार्यरत थे। सेवानिवृत होने के बाद अपना समय लेखन और नाटक से जुड़ी गतिविधियों में भारत के विभिन्न शहरों में बिताते हैं।",67,रंगमंच
अमरीश पुरी,"अमरीश पुरी  (२२ जून १९३२ – १२ जनवरी २००५) चरित्र अभिनेता मदन पुरी के छोटे भाई अमरीश पुरी हिन्दी फिल्मों की दुनिया का एक प्रमुख स्तंभ रहे है। अभिनेता के रूप निशांत, मंथन और भूमिका जैसी फ़िल्मों से अपनी पहचान बनाने वाले श्री पुरी ने बाद में खलनायक के रूप में काफी प्रसिद्धी पायी। उन्होंने १९८४ में बनी स्टीवेन स्पीलबर्ग की फ़िल्म ""इंडियाना जोन्स एंड द टेम्पल ऑफ़ डूम"" (अंग्रेज़ी- Indiana Jones and the Temple of Doom) में मोलाराम की भूमिका निभाई जो काफ़ी चर्चित रही। इस भूमिका का ऐसा असर हुआ कि उन्होंने हमेशा अपना सिर मुँडा कर रहने का फ़ैसला किया। इस कारण खलनायक की भूमिका भी उन्हें काफ़ी मिली। व्यवसायिक फिल्मों में प्रमुखता से काम करने के बावज़ूद समांतर या अलग हट कर बनने वाली फ़िल्मों के प्रति उनका प्रेम बना रहा और वे इस तरह की फ़िल्मों से भी जुड़े रहे। फिर आया खलनायक की भूमिकाओं से हटकर चरित्र अभिनेता की भूमिकाओं वाले अमरीश पुरी का दौर। और इस दौर में भी उन्होंने अपनी अभिनय कला का जादू कम नहीं होने दिया फ़िल्म मिस्टर इंडिया के एक संवाद ""मोगैम्बो खुश हुआ"" किसी व्यक्ति का खलनायक वाला रूप सामने लाता है तो फ़िल्म DDLJ का संवाद ""जा सिमरन जा - जी ले अपनी ज़िन्दगी"" व्यक्ति का वह रूप सामने लाता है जो खलनायक के परिवर्तित हृदय का द्योतक है। इस तरह हम पाते है कि अमरीश पुरी भारतीय जनमानस के दोनों पक्षों को व्यक्त करते समय याद किये जाते है।",243,रंगमंच
हिन्दी नाटक,"हिंदी में नाटकों का प्रारंभ भारतेन्दु हरिश्चंद्र से माना जाता है। उस काल के भारतेन्दु तथा उनके समकालीन नाटककारों ने लोक चेतना के विकास के लिए नाटकों की रचना की इसलिए उस समय की सामाजिक समस्याओं को नाटकों में अभिव्यक्त होने का अच्छा अवसर मिला। 
जैसाकि कहा जा चुका है, हिन्दी में अव्यावसायिक साहित्यिक रंगमंच के निर्माण का श्रीगणेश आगाहसन ‘अमानत’ लखनवी के ‘इंदर सभा’ नामक गीति-रूपक से माना जा सकता है। पर सच तो यह है कि ‘इंदर सभा’ की वास्तव में रंगमंचीय कृति नहीं थी। इसमें शामियाने के नीचे खुला स्टेज रहता था। नौटंकी की तरह तीन ओर दर्शक बैठते थे, एक ओर तख्त पर राजा इंदर का आसन लगा दिया जाता था, साथ में परियों के लिए कुर्सियाँ रखी जाती थीं। साजिंदों के पीछे एक लाल रंग का पर्दा लटका दिया जाता था। इसी के पीछे से पात्रों का प्रवेश कराया जाता था। राजा इंदर, परियाँ आदि पात्र एक बार आकर वहीं उपस्थित रहते थे। वे अपने संवाद बोलकर वापस नहीं जाते थे।
उस समय नाट्यारंगन इतना लोकप्रिय हुआ कि अमानत की ‘इंदर सभा’ के अनुकरण पर कई सभाएँ रची गई, जैसे ‘मदारीलाल की इंदर सभा’, ‘दर्याई इंदर सभा’, ‘हवाई इंदर सभा’ आदि। पारसी नाटक मंडलियों ने भी इन सभाओं और मजलिसेपरिस्तान को अपनाया। ये रचनाएँ नाटक नहीं थी और न ही इनसे हिन्दी का रंगमंच निर्मित हुआ। इसी से भारतेन्दु हरिश्चन्द्र इनको 'नाटकाभास' कहते थे। उन्होंने इनकी पैरोडी के रूप में ‘बंदर सभा’ लिखी थी।",239,रंगमंच
प्रथम विश्व युद्ध का मध्य पूर्वी रंगमंच,"मध्य पूर्वी रंगमंच प्रथम विश्व युद्ध के दौरान एक प्रमुख युद्धक्षेत्र था, जहां मित्र राष्ट्रों और ओटोमन साम्राज्य के बीच संघर्ष हुआ। इस क्षेत्र में लड़ाइयाँ मुख्य रूप से मेसोपोटामिया, सिनाई, फिलिस्तीन और अर्मेनिया के आसपास केंद्रित थीं। युद्ध के इस रंगमंच का उद्देश्य ओटोमन साम्राज्य की शक्ति को कमजोर करना और उसके नियंत्रण वाले क्षेत्रों पर कब्जा करना था।",60,रंगमंच
दिनेश ठाकुर,"दिनेश ठाकुर - रंगमंच निदेशक, टेलीविजन, रंगमंच और हिन्दी फिल्म अभिनेता है। बासु चटर्जी की फिल्म रजनीगन्था के लिये फ़िल्म फेयर पुरस्कार। वह मुंबई में अन्क सन्स्था के निर्देशक है।",30,रंगमंच
नाटककार,निबंधकार वह है जो साहित्य और रंगमंच की एक विधा नाटक लिखने का व्यावसायिक काम करता है।,17,रंगमंच
अभिनेता,"अभिनेता वह पुरुष कलाकार है जो एक चलचित्र या नाटक में किसी चरित्र का अभिनय करता है। अभिनेता परिकल्पना एवं दर्शक के बीच माध्यम का काम करता है। जो दी गयी भूमिका को किसी मंच (चलचित्र, नाटक, रेडियो ) द्वारा दर्शक के लिए प्रस्तुत करता है। अभिनय की कला का ज्ञान एवं अभिनेता के भाव प्रस्तुतीकरण को सार्थक बनाता है।",60,रंगमंच
राष्ट्रीय नाट्य विद्यालय,"राष्ट्रीय नाट्य विद्यालय, रंगमंच का प्रशिक्षण देने वाली सबसे महत्वपूर्ण संस्था है जो दिल्ली में है। इसकी स्थापना संगीत नाटक अकादमी ने १९५९ में की थी। यह भारत सरकार के अंतर्गत एक स्वशासी संस्थान है।",35,रंगमंच
सत्यदेव दुबे,"सत्यदेव दुबे (19 मार्च 1936 -25 दिसम्बर 2011), भारतीय रंगमंच निर्देशक, अभिनेता, नाटककार, पटकथा लेखक और चलचित्र अभिनेता तथा निर्देशक थे। रंगमंच और चलचित्र से जुड़े महती कार्यों के लिए उन्हें १९७१ ई. में संगीत नाटक अकादमी पुरस्कार से सम्मानित किया गया था। १९७८ में उन्होंने श्याम बेनेगल द्वारा निर्देशित हिंदी चलचित्र भूमिका के लिए सर्वश्रेष्ठ पटकथा का राष्ट्रीय फिल्म पुरस्कार प्राप्त किया। १९८० ई. में उन्हें जुनून के लिए सर्वश्रेष्ठ संवाद का पुरस्कार मिला। २०११ में उन्हें भारत सरकार ने पद्म भूषण से सम्मानित किया।",86,रंगमंच
