title,content,word_count,topic
बांग्लादेश क्रिकेट टीम का श्रीलंका दौरा 2020–21,"बांग्लादेश क्रिकेट टीम दो टेस्ट मैच खेलने के लिए अप्रैल और मई 2021 के दौरान श्रीलंका का दौरा किया था। टेस्ट श्रृंखला,  आईसीसी वर्ल्ड टेस्ट चैंपियनशिप के उद्घाटन संस्करण का हिस्सा थी।
मूल रूप से, तीन-टेस्ट दौरा जुलाई और अगस्त 2020 में होना था,  लेकिन कोविड-19 महामारी के कारण इसे अक्टूबर 2020 तक के लिए टाल दिया गया था। सितंबर 2017 में, इस दौरे को फिर से स्थगित कर दिया गया, दोनों बोर्ड श्रृंखला के लिए संगरोध आवश्यकताओं पर सहमत नहीं हो सके।  दिसंबर 2020 में, बांग्लादेश क्रिकेट बोर्ड (बीसीबी) दो टेस्ट मैच खेलने के लिए अप्रैल 2021 में श्रीलंका का दौरा करने पर विचार कर रहा था। फरवरी 2021 में, बीसीबी ने पुष्टि की कि श्रीलंका का दौरा अप्रैल में होगा।
19 मार्च 2021 को, श्रीलंका क्रिकेट (एसएलसी) ने दौरे की तारीखों की घोषणा की।
पहला टेस्ट मैच ड्रॉ के रूप में समाप्त हुआ,यह टेस्ट बारिश के कारण पांचवें दिन के अंतिम सत्र में समाप्त हो गया। दूसरे टेस्ट मैच को श्रीलंका ने 209 रनों से जीतकर श्रृंखला को 1–0 से जीत लिया।",174,खेल
युगांडा क्रिकेट टीम का नामीबिया दौरा 2020–21,"युगांडा क्रिकेट टीम अप्रैल 2021 में तीन मैचों की ट्वेंटी 20 अंतर्राष्ट्रीय (टी20आई) श्रृंखला और दो   लिस्ट ए मैच खेलने के लिए नामीबिया का दौरा किया था। सभी मैच विंडहोक के वांडरर्स क्रिकेट ग्राउंड में खेले गए थे।
नामीबिया ने पहला मैच सात विकेट से जीता।मेजबान नामीबिया ने 5 अप्रैल को अगले दो मैच और जीते, जिनमें से पहले बारिश प्रभावित था। नामीबिया टी20आई श्रृंखला को 3-0 से जीत लिया।
पहला लिस्ट ए मैच को नामीबिया ने 98 रनों से जीता। दूसरे लिस्ट ए मैच को भी नामीबिया ने 162 रनों से जीत लिया।",94,खेल
२०१८ फीफा विश्व कप,"2018 फीफा विश्व कप (फीफा विश्व कप का 21वां संस्करण) 14 जून 2018 से 15 जुलाई 2018 के बीच रूस में एक अंतर्राष्ट्रीय पुरूष पादकन्दुक  प्रतियोगिता  थी । रूस  इस प्रतियोगिता के  प्रथम बार यजमान थे । 
बत्तीस देशों की टीमें अंतिम प्रतियोगिता  में भाग लिया। सभी मैच रूस के 12 विभिन्न स्टेडियमों में  खेले गए। जर्मनी  में आयोजित हुए 2006 विश्व कप के बाद से यूरोप में आयोजित होने वाला यह पहला विश्व कप है। इससे पहले 2014 की  प्रतियोगिता जर्मनी ने  जीती   थी ।     
प्रतिस्पर्धा का अंतिम द्वंद्व  फ्रांस और क्रोएशिया के  मध्य  मॉस्को के लुज़्निकी स्टेडियम में खेला गया, जिसमें फ्रांस ने 4-2 से क्रोएशिया को हरा कर दूसरी बार विश्वकप का  का अपने नाम किया। 2006 में इटली, 2010 में स्पेन और 2014 में जर्मनी के बाद किसी यूरोपीय टीम द्वारा लगातार चौथी बार यह खिताब जीता हैं।",142,खेल
गणेश सतीश,"गणेश सतीश (जन्म 15 मार्च 1988) एक भारतीय क्रिकेटर हैं। वह एक दाएं हाथ के बल्लेबाज और विकेटकीपर हैं, जो वर्तमान में विदर्भ क्रिकेट टीम के लिए खेलते हैं। उनका जन्म दावणगेरे, कर्नाटक में हुआ था।
सतीश ने अपने क्रिकेटिंग करियर की शुरुआत 2001 में अंडर-14 टीम के लिए खेलकर की थी, जो पहले एक खेल में खेलते थे, जिसमें टीम के खिलाड़ी वीरभेंद्रनाथ पवार का स्कोर 229 रन था। वह फिर से अगले सीजन में अंडर-14 के लिए खेले।
सतीश ने इसे अंडर-22 के माध्यम से युवा रैंक तक जारी रखा। सतीश का लिस्ट ए डेब्यू 2007-08 की विजय हजारे ट्रॉफी प्रतियोगिता में हुआ था। उनकी पहली प्रथम श्रेणी की उपस्थिति नवंबर 2008 में रेलवे के खिलाफ, पहली पारी में 2008 के आईपीएल खिलाड़ी रॉबिन उथप्पा और दूसरी में चंद्रशेखर रघु के रूप में हुई।
सतीश ने कर्नाटक प्रीमियर लीग (2009) के पहले संस्करण में मलनाड ग्लैडिएटर्स का प्रतिनिधित्व किया। सतीश ने रणजी ट्रॉफी में अपने गृह राज्य कर्नाटक का प्रतिनिधित्व किया और 2011 में कप्तानी की।
जुलाई 2018 में, उन्हें 2018-19 दलीप ट्रॉफी के लिए इंडिया ब्लू के लिए टीम में नामित किया गया था।",187,खेल
वॉल्टर हैमंड,"वॉल्टर रेजिनाल्ड ""वॉली"" हैमंड (6 जून 1903 – 1 जुलाई 1965, अंग्रेज़ी: Walter Hammond) अंग्रेज़ क्रिकेट खिलाड़ी थे जिन्होनें 1927 और 1947 के बीच में 85 टेस्ट मैच खेलें। वो मुख्यत दाएँ हाथ के बल्लेबाज थे जो उपयोगी दाएँ हाथ से मध्यम तेज़ गति से गेंदबाज़ी भी करते थे। इन्होंने प्रथम श्रेणी में 50,000 हजार से ज़्यादा रन और 167 शतक बनाए। विज्डन क्रिकेटर्स अल्मनाक ने इन्हें इनकी मृत्यु के बाद क्रिकेट के इतिहास में चार सर्वश्रेष्ठ बल्लेबाजों में से एक रूप में वर्णित किया।",85,खेल
त्रुटि,"त्रुटि उस घटना को कहते हैं जब कोई बनाई गयी प्रणाली अपने निर्धारित काम ढंग से नही करती। शब्द त्रुटि के कई अर्थ है और सापेक्ष रूप से इसे कैसे लागू किया जाता हैं इस आधार पर इसके कई उपयोग भी हैं। लैटिन भाषा के शब्द एरर (error यानि त्रुटि) का वास्तविक अर्थ है ""भटकना"" या ""इधर उधर घूमना"" . एक भ्रम के विपरीत, एक त्रुटि या एक ग़लती कभी कभी ज्ञान होने के बावजूद भी उत्पन्न हो सकती है (अगरआप एक मृगमरीचिका को देख रहें हैं, वास्तविक पानी को नहीं, केवल इस तथ्य को जान लेने से मृगमरीचिका गायब नहीं हो जाती) हालांकि, कुछ त्रुटियां तब भी हो सकती हैं जब एक व्यक्ति को एक काम को सही प्रकार से करने का तरीका पता है। उदाहरण के लिए एक चॉकलेट खरीदने के बाद वेंडिंग मशीन से बचे हुए पैसे लेना भूल जाना, फोटोकॉपी करवाने के बाद अपने मूल दस्तावेज लेना भूल जाना और खाना बनाने के बाद गैस बंद करना भूल जाना. 
इस प्रकार की त्रुटियां अक्सर तब होती हैं जब एक व्यक्ति किसी दूसरी बात की वजह से विचलित है।",182,खेल
2015-17 आईसीसी विश्व क्रिकेट लीग,"2015-17 आईसीसी विश्व क्रिकेट लीग

2015-17 आईसीसी विश्व क्रिकेट लीग चैम्पियनशिप (मूल रूप से इंटरकांटिनेंटल कप वन-डे) आईसीसी इंटरकांटिनेंटल कप के एक सीमित ओवरों के संस्करण का दूसरा संस्करण है। आयरलैंड और अफगानिस्तान टूर्नामेंट में प्रतिस्पर्धा नहीं होगा क्योंकि उन दोनों वनडे रैंकिंग के माध्यम से सीधे 2019 विश्व कप के लिए क्वालीफाई करने के लिए प्रयास करने के लिए पात्र बना दिया है। इसके बजाय, केन्या और नेपाल टूर्नामेंट में शामिल किया गया है। इस टूर्नामेंट के विजेता अधिकारी 12 टीम रैंकिंग तालिका में सबसे कम रैंक एसोसिएट टीम के खिलाफ एक चुनौती शृंखला खेलने के लिए या तो रहने या अगले चक्र के लिए 12 टीम रैंकिंग तालिका में पदोन्नत किया जाना होगा। शीर्ष चार टीमों में भी शामिल हो जाएगा सबसे कम चार टीमें आईसीसी वनडे चैम्पियनशिप से (सितंबर 2017 तक) 2018 आईसीसी क्रिकेट विश्व कप क्वालीफायर में, रैंक नीचे चार टीमों डिवीजन दो के लिए चला जाएगा, जबकि और डिवीजन के फाइनल के साथ खेलते हैं 2018 सीडब्ल्यूसी क्वालीफायर में शेष दो स्थानों के लिए तीन। टूर्नामेंट राउंड रोबिन प्रारूप शामिल होंगे।
मेल खाता है, जिसमें दोनों टीमों की वनडे का दर्जा दिया है एक वनडे मैच के रूप में दर्ज हो जाएगा, माचिस, जिसमें एक या दोनों टीमों की वनडे स्थिति alist के रूप में दर्ज हो जाएगा एक खेल नहीं है, जबकि।",218,खेल
दक्षिण अफ्रीका क्रिकेट टीम का आयरलैंड दौरा 2021,"दक्षिण अफ्रीका क्रिकेट टीम ने जुलाई 2021 में तीन एक दिवसीय अंतर्राष्ट्रीय (वनडे) और तीन ट्वेंटी-20 अंतर्राष्ट्रीय (टी20आई) मैच खेलने के लिए आयरलैंड का दौरा किया। वनडे श्रृंखला उद्घाटन 2020-2023 आईसीसी क्रिकेट विश्व कप सुपर लीग का हिस्सा बनी। क्रिकेट आयरलैंड ने फरवरी 2021 में जुड़नार की पुष्टि की। मूल रूप से, पहला और तीसरा टी20आई मैच क्रमशः 20 और 25 जुलाई को होने थे। हालांकि, जून 2021 में, क्रिकेट आयरलैंड ने उन दोनों मैचों को एक दिन आगे बढ़ाकर दौरे के कार्यक्रम में मामूली बदलाव किया। जून 2007 में बेलफास्ट में पहले एकदिवसीय मैच खेलने के बाद, यह दक्षिण अफ्रीका का आयरलैंड का पहला पूर्ण सीमित ओवरों का दौरा था। उद्घाटन टी20आई मैच पहली बार था जब दोनों टीमों ने उस प्रारूप में एक-दूसरे के साथ खेला था।
पहले एकदिवसीय मैच में आयरलैंड की पारी के केवल 40.2 ओवर बारिश के कारण संभव हो पाए थे और मैच का कोई नतीजा नहीं निकला था। . आयरलैंड ने दूसरा वनडे 43 रन से जीतकर अंतरराष्ट्रीय क्रिकेट में दक्षिण अफ्रीका के खिलाफ अपनी पहली जीत दर्ज की। दक्षिण अफ्रीका ने तीसरा एकदिवसीय मैच 70 रन से जीतकर श्रृंखला 1-1 से ड्रा की। दक्षिण अफ्रीका ने पहले दो टी20आई मैच जीते और एक मैच शेष रहते हुए श्रृंखला जीत ली। दक्षिण अफ्रीका ने तीसरा टी20आई 49 रन से जीतकर श्रृंखला 3-0 से जीत ली।",222,खेल
वेस्ट इंडीज क्रिकेट टीम का श्रीलंका दौरा 2015-16,"वेस्टइंडीज क्रिकेट टीम ने अक्टूबर/नवंबर 2015 में दो टेस्ट, तीन एक दिवसीय अंतर्राष्ट्रीय (वनडे) और दो ट्वेंटी 20 अंतर्राष्ट्रीय (टी20आई) मैच खेलने के लिए श्रीलंका का दौरा किया। इस श्रृंखला के साथ, वेस्टइंडीज और श्रीलंका के बीच सभी द्विपक्षीय टेस्ट दौरों को सोबर्स-टीसेरा ट्रॉफी कहा जाएगा। श्रीलंका ने टेस्ट सीरीज़ 2-0 से जीती, वनडे सीरीज़ 3-0 से टी20आई सीरीज़ 1-1 से ड्रा रही।
पूरी श्रृंखला बारिश से प्रभावित थी और कई मौकों पर खेल बाधित हुआ था। एकदिवसीय श्रृंखला के सभी तीन मैच बारिश से बाधित थे और परिणाम सभी डकवर्थ-लुईस स्टर्न विधि द्वारा निर्धारित किए गए थे।
दूसरा टी20आई मैच, जिसे मूल रूप से 12 नवंबर 2015 को आयोजित किया जाना था, को फिर से शेड्यूल किया गया और 11 नवंबर को आर प्रेमदासा स्टेडियम में आयोजित किया गया, जो दोनों देशों के प्रासंगिक क्रिकेट बोर्ड के साथ चर्चा के बाद हुआ। 12 नवंबर को थेरो के अंतिम संस्कार के साथ आदरणीय मदुलुवॉ सोबिथा थेरो की मृत्यु के कारण, टी20आई को 12 नवंबर को पुनर्निर्धारित किया गया था, सरकार द्वारा शोक का एक राष्ट्रीय दिवस घोषित किया गया था। इसके अलावा, मैच से पहले एक मिनट का मौन रखा गया था और श्रीलंकाई क्रिकेटरों ने सम्मान के एक संकेत के रूप में अपनी बाहों पर एक पीले रंग की पट्टी पहनी थी।",213,खेल
२०१० आईसीसी विश्व ट्वेन्टी २०,"२०१० आईसीसी विश्व ट्वेन्टी २० आईसीसी विश्व ट्वेन्टी २० तीसरा संस्करण था। जो की वेस्ट इंडीज़ की मेजबानी में खेला गया था। इसकी शुरुआत ३० अप्रैल को हुई थी तथा फाइनल मैच १६ मई को खेला गया था। इस विश्व कप में कुल १२ टीमों ने माग लिया था। फाइनल मैच इंग्लैंड ने जीता था तथा इंग्लैंड के ही केविन पीटरसन को मैन ऑफ़ द टूर्नामेंट घोषित किया गया था।
आईसीसी विश्व ट्वेन्टी २० की शुरुआत २००७ में हुई थी। जिसमें भारत को विजय मिली थी।",86,खेल
सिलहट थंडर,"सिलहट थंडर (बांग्ला: সিলেট থান্ডার) एक पेशेवर क्रिकेट फ्रैंचाइज़ी टीम है जो सिलहट, बांग्लादेश में स्थित है। टीम का मुकाबला बांग्लादेश प्रीमियर लीग में है। फ्रेंचाइजी ने 2017 बांग्लादेश प्रीमियर लीग में अपनी शुरुआत की।
सिक्सर्स अपने घरेलू खेल सिलहट इंटरनेशनल क्रिकेट स्टेडियम में खेलते हैं। टीम बांग्लादेश के पूर्व वित्त मंत्री अबुल मौल अब्दुल मुहिथ की देखभाल में सिलहट स्पोर्ट्स लिमिटेड के पास है। उनके बेटे, शहीद मुहिथ टीम के अध्यक्ष हैं। सिक्सर्स ने वकार यूनिस को मुख्य कोच और अंतर्राष्ट्रीय क्रिकेटर, डेविड वार्नर को बांग्लादेश प्रीमियर लीग के 6 वें संस्करण के लिए कप्तान घोषित किया। चोट के कारण बांग्लादेश नेशनल क्रिकेट टीम के पूर्व ऑलराउंडर आलोक कपाली ने वार्नर के जाने के बाद कप्तानी संभाली।
16 नवंबर 2019 को, 24Bazar.biz को टीम के प्रायोजक के रूप में नामित किया गया था और इसका नाम बदलकर सिलहट थंडर रखा गया था।",143,खेल
