title,content,word_count,topic
हुसैन अहमद मदनीः द जिहाद फॉर इस्लाम एंड इंडियाज़ फ्रीडम (पुस्तक),"हुसैन अहमद मदनी: इस्लाम और भारत की स्वतंत्रता के लिए जिहाद: कैलिफोर्निया विश्वविद्यालय में प्रोफेसर बारबरा डी. मेटकाफ द्वारा लिखित एक पुस्तक है, जो हुसैन अहमद मदनी के जीवन और प्रयासों का लेखा-जोखा प्रस्तुत करती है। मदनी की राजनीतिक सक्रियता, आध्यात्मिक यात्रा और धार्मिक योगदान की जांच के साथ, यह पुस्तक एक सूक्ष्म परिप्रेक्ष्य प्रस्तुत करती है।  वनवर्ल्ड पब्लिकेशन्स द्वारा मुस्लिम वर्ल्ड के निर्माता श्रृंखला के एक भाग के रूप में प्रकाशित इस पुस्तक में विशिष्ट विषयों को शामिल किया गया है जो मेटकाफ के ब्रिटिश भारत में इस्लामी पुनरुत्थान नामक अध्ययन की याद दिलाते हैं। मदनी के आख्यान का गहन अध्ययन करके, पुस्तक भारत के स्वतंत्रता संघर्ष की राष्ट्रवादी राजनीति में उनकी केंद्रीय भूमिका को मान्यता देती है। मेटकाफ ने कांग्रेस के नेतृत्व वाले उपनिवेशवाद विरोधी राष्ट्रवाद में मदनी की भागीदारी को मुस्लिम लीग की एक अलग मुस्लिम धार्मिक-राजनीतिक पहचान की वकालत के विपरीत एक विपरीत शक्ति के रूप में प्रस्तुत किया है, जिसकी परिणति 1940 के दशक के उत्तरार्ध में अलगाववादी आंदोलनों के रूप में हुई। लेखक प्रचलित पश्चिमी पूर्वाग्रह को सुधारने का प्रयास करता है, जो मुसलमानों के राजनीतिक व्यवहार को भू-राजनीतिक प्रभावों पर विचार करने के बजाय केवल पवित्र ग्रंथों के आधार पर मानता है। मदनी के जीवन और कार्य के ऐतिहासिककरण के माध्यम से, मेटकाफ़ एक व्यापक परिप्रेक्ष्य प्रदान करने का प्रयास करता है जो उनके योगदान को आकार देने वाले बहुमुखी कारकों के लिए जिम्मेदार है।",232,भू-राजनीति
द्विदलीय प्रणाली,"साँचा:Politics sidebar
द्विदलीय प्रणाली एक दल प्रणाली हैं, जहाँ दो प्रमुख राजनीतिक दल सरकार के भीतर, राजनीति को प्रभावित करते हैं। दो दलों में से आम तौर पर एक के पास विधायिका में बहुमत होता हैं और प्रायः बहुमत या शासक दल कहा जाता हैं, जबकि दूसरा अल्पमत या विपक्ष दल कहा जाता हैं।",54,भू-राजनीति
वी० ओ० चिदम्बरम पिल्लै,"वल्लियप्पन उलगनाथन चिदम्बरम पिल्लै (1872–1936) तमिलनाडु के एक राजनेता एवं स्वतंत्रता संग्राम सेनानी थे। वे बालगंगाधर तिलक के शिष्य थे। वे 'वी. ओ. सी' नाम से विख्यात हैं तथा 'कप्पलोट्टिय तमिलन' नाम से भी जाने जाते हैं। उन्हें भारतीय जलयान उद्योग को सम्मान जनक स्थान दिलवाने के लिए याद किया जाता है, पर वे एक महान स्वतंत्रता संग्राम सेनानी भी थे। भारतीय जहाज कंपनी शुरू करने के कारण उन्हें अंग्रेज सरकार ने अत्यधिक प्रताड़ित किया। वे लंबे समय तक जेल में भी बंद रहे, जहाँ उन्हें कोल्हू तक में जोता गया। श्री पिल्लै एक प्रखर वकील भी थे। अपने जीवन का अंतिम चरण उन्होंने साहित्य सेवा में व्यतीत किया। 
'कप्पलोट्टिय तमिलन' मतलब 'जहाज चलानेवाला तमिल आदमी'।",116,भू-राजनीति
पाकिस्तान का सर्वोच्च न्यायालय,"पाकिस्तान का सर्वोच्च न्यायालय (उर्दू: [عدالت عظمیٰ پاکستان‎; अदालत-ए उज़्मा पाकिस्तान] Error: {{Lang}}: text has italic markup (help)), इस्लामी गणराज्य पाकिस्तान की सर्वोच्च अदालत है और पाकिस्तान की न्यायिक व्यवस्था का शीर्ष हिस्सा है और पाकिस्तानी न्यायिक क्रम का शिखर बिन्दु है। पाकिस्तान की सर्वोच्च न्यायालय, पाकिस्तान कानूनी और संवैधानिक मामलों में फैसला करने वाली अंतिम मध्यस्थ भी है। सर्वोच्च न्यायालय का स्थायी कार्यालय पाकिस्तान की राजधानी इस्लामाबाद में स्थित है, जबकि इस अदालत की कई उप-शाखाएं, पाकिस्तान के महत्वपूर्ण शहरों में कार्यशील हैं जहां मामलों की सुनवाई की जाती है। सर्वोच्च न्यायालय, पाकिस्तान को कई संवैधानिक व न्यायिक विकल्प प्राप्त होते हैं, जिनकी व्याख्या पाकिस्तान के संविधान में की गई है। देश में कई सैन्य सरकारों और असंवैधानिक तानाशाही सरकारों के कार्यकाल में भी सर्वोच्च न्यायालय ने स्वयं को स्थापित कर रखा है। साथ ही, इस अदालत ने सैन्य शक्ति पर एक वास्तविक निरीक्षक के रूप में स्वयं को स्थापित किया है और कई अवसरों में सरकारों की निगरानी की है।
इस अदालत के पास, सभी उच्च न्यायालयों(प्रांतीय उच्च न्यायालयों, जिला अदालतों, और विशेष अदालतों सहित) और संघीय अदालत के ऊपर अपीलीय अधिकार है। इसके अलावा यह कुछ प्रकार के मामलों पर मूल अधिकार भी रखता है। सुप्रीम कोर्ट एक मुख्य न्यायाधीश और एक निर्धारित संख्या के वरिष्ठ न्यायाधीशों द्वारा निर्मित होता है, जो प्रधानमंत्री से परामर्श के बाद राष्ट्रपति द्वारा नामित किया जाता है। एक बार नियुक्त न्यायाधीश को, एक निर्दिष्ट अवधि को पूरा करने और उसके बाद ही रिटायर होने की उम्मीद की जाती है, जब तक कि वे दुराचार के कारण सर्वोच्च न्यायिक परिषद द्वारा निलंबित नहीं किये जाते हैं।",264,भू-राजनीति
पाकिस्तान की न्यायपालिका,"पाकिस्तान की न्यायपालिका, एक श्रेणीबद्ध प्रणाली है जिसमें अदालतों के दो वर्गों है: श्रेष्ठतर (या उच्च) न्यायपालिका और अधीनस्थ (या निम्न) न्यायपालिका। श्रेष्ठतर न्यायपालिका, ""सुप्रीम कोर्ट ने पाकिस्तान के"", ""संघीय शरीयत कोर्ट"" और ""पाँच उच्च न्यायालयों"" से बना है, जिसके शीर्ष पर ""सुप्रीम कोर्ट"" विराजमान है। इसके अलावा, प्रत्येक चार प्रांतों एवं इस्लामाबाद राजधानी क्षेत्र के लिये एक उच्च न्यायालय है। पाकिस्तान का संविधान, न्यायपालिका पर संविधान की रक्षा, संरक्षण व बचाव का दायित्व सौंपता है। ना उच्चतम न्यायालय, ना हीं, उच्च न्यायालय, जनजातीय क्षेत्रों(फाटा) के संबंध में अधिकारिता का प्रयोग कर सकते हैं, सिवाय अन्यथा यदी प्रदान की जाय तो। आजाद कश्मीर और गिलगित-बाल्टिस्तान के विवादित क्षेत्रों के लिये अलग न्यायिक प्रणाली है।
अधीनस्थ न्यायपालिका में, सिविल और आपराधिक जनपदीय न्यायालय व अन्य अनेक विशेष अदालतें शामिल हैं, जो, बैंकिंग, बीमा, सीमा शुल्क व उत्पाद शुल्क, तस्करी, ड्रग्स, आतंकवाद, कराधान, पर्यावरण, उपभोक्ता संरक्षण, और भ्रष्टाचार संबंधित मामलों में अधिकारिता का प्रयोग करती हैं। आपराधिक अदालतों को दंड प्रक्रिया संहिता, 1898 के तहत बनाया गया था और सिविल अदालतें, पश्चिमी पाकिस्तान सिविल न्यायालय अध्यादेश, 1964 द्वारा स्थापित किए गए थे। साथ ही, राजस्व अदालतें भी हैं, जो कि पश्चिमी पाकिस्तान भू-राजस्व अधिनियम, 1967 के तहत काम कर रहे हैं। इसके अलावा, सरकार, विशिष्ट मामलों में विशिष्ट अधिकार कार्यान्वित करने हेतु प्रशासनिक अदालतों और अधिकरणों की स्थापना कर सकती है।",219,भू-राजनीति
"डांग, चौखुटिया तहसील","डांग भारतीय राज्य उत्तराखण्ड राज्य के कुमाऊँ मण्डल के अल्मोड़ा जिले की चौखुटिया तहसील का एक गाँव है। यह गाँव रामगंगा नदी के पश्चिमी किनारे पर स्थित है। यह कनौंणियॉं बिष्ट नामक उपनाम से विख्यात कुमांऊॅंनी हिन्दू राजपूतों का पुश्तैनी गाँव है। यह अपनी ऐतिहासिक व सॉस्कृतिक विरासत, ठेठ कुमांऊॅंनी सभ्यता व संस्कृति, पर्वतीय जीवन शैली तथा समतल उपजाऊ भूमि के लिए पहचाना जाता है।",65,भू-राजनीति
विशाल नेपाल,"विशाल नेपाल का मतलब है, नेपाल का वह भौगोलिक स्वरुप जो सबसे अधिक विस्तृत था। आज के नेपाल का भौगोलिक स्वरुप इतिहास के असमान सन्धि और उन सन्धियों पर कोई क्रियान्वयन न हो पाने का नतिजा है। इतिहास के उसी विशाल भौगोलिक स्वरुप को याद कर के नेपाली लोग प्राचीन नेपाल को विशाल नेपाल कहते हैं। बर्तमान समय मे भी नेपाल का प्राचीन स्वरुप लौटाया जा सकता है। 1950 कि भारत नेपाल शान्ति तथा मैत्री सन्धि कि धारा 8 एवम नेपाल ओर अंग्रेजों क़े बीच 1950 क़े october मे हुयि सन्धि कि भी धारा 8 मे प्रस्ट वर्णन है कि नेपाल ओर ब्रिटिस इंडिया क़े बीच बिगत मे हुई सारी संधिया खारेज कि जाति हैं। इस आधार पर नेपाल कि सिमा टिस्टा से सतलुज नदि तक स्वयम हि स्थापित हो जाती है। पर अफसोस नेपाल कि सरकार का जो नेपाल कि सार्वभौम सत्ता को बचाने क़े बजाए उसको राजनीति मे बिक्रि का उद्देश्य बनाती है।",155,भू-राजनीति
राजनीतिक विचारधाराओं की सूची,"यह राजनीतिक विचारधाराओं की सूची है। अनेक राजनीतिक दल अपने राजनीतिक कार्यों और चुनाव पत्र को किसी विचारधारा पर आधारित रखते हैं। सामाजिक अध्ययन में, राजनीतिक विचारधारा, किसी सामाजिक आन्दोलन, संस्था, वर्ग, और/या बड़े समूह के आदर्शों, सिद्धान्तों, उपदेशनों, मिथकों या प्रतीकों का एक नीतिशास्त्रीय समुच्चय है, जो समाज को कैसे काम करना चाहिए यह समझाती है, और किसी सामाजिक व्यवस्था के लिए कोई राजनीतिक या सांस्कृतिक ब्लूप्रिंट प्रदान करती हैं।
राजनीतिक विचारधाराओं के दो आयाम होते हैं:

लक्ष्य: समाज कैसे संगठित हो।
पद्धतियाँ: यह लक्ष्य हासिल करने के लिए सबसे उचित तरीका क्या हो।",95,भू-राजनीति
दक्षिण एशिया उपग्रह,"दक्षिण एशिया उपग्रह (इंग्लिश: South Asia Satellite ) जिसका नाम पहले सार्क उपग्रह (SAARC Satellite) था, दक्षिण एशियाई क्षेत्रीय सहयोग संगठन (सार्क) क्षेत्र के लिए भारतीय अंतरिक्ष अनुसंधान संगठन (इसरो) द्वारा बनाया गया भू-समकालिक संचार और मौसम विज्ञान उपग्रह है। २०१४ में नेपाल में आयोजित १८वें सार्क शिखर सम्मेलन के दौरान, भारतीय प्रधानमंत्री नरेंद्र मोदी ने एक उपग्रह सार्क के सदस्य देशों की आवश्यकताओं की सेवा का विचार रखा था। जो उनकी 'पहले पड़ोस' नीति का हिस्सा था।
हालांकि उपग्रह सार्क क्षेत्र में सेवा करने का इरादा है, पाकिस्तान कार्यक्रम से बाहर निकल गया, जबकि अफगानिस्तान और बांग्लादेश ने अपनी वचनबद्धता देने का वायदा नहीं किया था।",107,भू-राजनीति
अफ़्रीका,"अफ़्रीका एशिया के बाद विश्व का सबसे बड़ा महाद्वीप है। यह 37°14' उत्तरी अक्षांश से 34°50' दक्षिणी अक्षांश एवं 17°33' पश्चिमी देशांतर(देशान्तर) से 51°23' पूर्वी देशांतर (देशान्तर) के मध्य स्थित है। अफ्रीका के उत्तर में भूमध्यसागर एवं यूरोप महाद्वीप, पश्चिम में अंध महासागर, दक्षिण में दक्षिण महासागर तथा पूर्व में अरब सागर एवं हिंद महासागर(हिन्द महासागर) हैं। पूर्व में स्वेज भूडमरूमध्य इसे एशिया से जोड़ता है तथा स्वेज नहर इसे एशिया से अलग करती है। जिब्राल्टर जलडमरूमध्य इसे उत्तर में यूरोप महाद्वीप से अलग करता है। इस महाद्वीप में विशाल मरुस्थल, अत्यन्त घने वन, विस्तृत घास के मैदान, बड़ी-बड़ी नदियाँ व झीलें तथा विचित्र जंगली जानवर हैं। मुख्य मध्याह्न रेखा (0°) अफ्रीका महाद्वीप के घाना देश की राजधानी अक्रा शहर से होकर गुजरती है। यहाँ सेरेनगेती और क्रुजर राष्‍ट्रीय उद्यान है तो जलप्रपात और वर्षावन भी हैं। एक ओर सहारा मरुस्‍थल है तो दूसरी ओर किलिमंजारो पर्वत भी है और सुषुप्‍त ज्वालामुखी भी है। युगांडा, तंजानिया और केन्या की सीमा पर स्थित विक्टोरिया झील अफ्रीका की सबसे बड़ी तथा सम्पूर्ण पृथ्वी पर मीठे पानी की दूसरी सबसे बड़ी झीलहै। यह झील दुनिया की सबसे लम्बी नदी नील के पानी का स्रोत भी है।
कुछ इतिहासकारों का मानना है कि इसी महाद्वीप में सबसे पहले मानव का जन्म व विकास हुआ और यहीं से जाकर वे दूसरे महाद्वीपों में बसे, इसलिए इसे मानव सभ्‍यता की जन्‍मभूमि माना जाता है। यहाँ विश्व की दो प्राचीन सभ्यताओं (मिस्र एवं कार्थेज) का भी विकास हुआ था। अफ्रीका के बहुत से देश द्वितीय विश्व युद्ध के बाद स्वतंत्र हुए हैं एवं सभी अपने आर्थिक विकास में लगे हुए हैं। अफ़्रीका अपनी बहुरंगी संस्कृति और जमीन से जुड़े साहित्य के कारण भी विश्व में जाना जाता है।",281,भू-राजनीति
