title,content,word_count,topic
राशन कार्ड,राशन कार्ड या राशन स्टांप एक कार्ड है जो किसी सरकार की ओर से जारी किया जाता है। यह कार्डधारक को भोजन या अन्य सामान प्राप्त करने की सुविधा प्रदान करता है जो युद्ध के दौरान कम मात्रा में उपल्ब्ध किए जा रहे हों या किसी अन्य आपात स्थितियों में जब राशन करने लागू की जाती चुकी हो। इसे युद्ध के अंत के बाद भी दोनों पक्षों की ओर से लागू कर रहे हैं जब मषार्बियन की मझेशतें धीरे-धीरे सामान्य पर पहुंचे हैं। राशन स्टांप किसी भी समय पर आवश्यक खाद्यान्न बनाए रखने के लिए भी ब रोए कार लाया जाता है। इसका कारण यह प्रयास है कि किसी भी व्यक्ति को दूसरे व्यक्ति से अधिक खाद्यान्न जमा करने का आधिकारिक रूप से मौका न मिले।,126,पोषण
आलमा माटर,"आलमा माटर (लातिनी और अंग्रेज़ी: alma mater) प्राचीन रोम में देवी माँ के लिए प्रयोग होने वाला एक नाम था जिसका लातिनी भाषा में अर्थ 'पोषक (पोषण करने वाली) माता' है। रोमन संस्कृति में इसका प्रयोग विशेषकर सिरीस (Ceres) और सिबली (Cybele) नामक देवियों के लिए होता था और बाद में ईसाई धर्म में इसे मरियम (ईसा मसीह की माँ) के लिए इस्तेमाल किया जाने लगा। आधुनिक युग में इसका प्रयोग लोग उस विद्यालय, कॉलेज या विश्वविद्यालय के लिए करते हैं जहाँ वे पढ़े हों या उत्तीर्ण हुए हों। इस 'मातृसंस्था' रूप में 'आलमा माटर' बहुत से विद्यालय-गान और आदर्श वाक्यों में मिलता है और कभी-कभी ऐसे विद्यालय-गानों का शीर्षक भी होता है। कभी-कभी यह देवी की प्रतिमा के रूप में भी कॉलेजों में देखा जा सकता है।",128,पोषण
सिस्टिक फाइब्रोसिस,"सिस्टिक फाय्ब्रोसिस (Cystic fibrosis) एक अनुवांशिक रोग है जो शरीर के कई भागों को प्रभावित करता है, जिनमें जिगर, अग्न्याशय (पेंक्रिआज), मूत्राशय के अंग, जननांग और पसीने की ग्रंथियां शामिल हैं।
इन अंगों में पाए जाने वाली कुछ विशिष्ट कोशिकाएं प्रायः लार और जलीय स्राव उत्पन्न करते हैं, परन्तु सिस्टिक फाय्ब्रोसिस में ये कोशिकाएं सामान्य से अधिक गाढ़ा स्राव उत्पन्न करतीं हैं। इससे शरीर का जलीय संतुलन बिगड़ता है और लवण-प्रबन्धन की क्षमता प्रभावित होती है जिससे कई अन्य प्रकार की समस्याएं पैदा होती हैं। उदाहरण के लिए, फेफड़ों में ये गाढ़े स्राव कीटाणुओं को समाहित कर लेते हैं, जिससे बार-बार फेफड़ों के संक्रमण होते हैं। पेंक्रिआज में ये गाढ़े स्राव पेनक्रिएटिक जूस के सामान्य प्रवाह को अवरुद्ध कर देते हैं, जिससे शरीर के लिए वसा और वसा में घुलनशील विटामिनों को पचाना और अवशोषित करना अधिक जटिल हो जाता है। इससे मुख्य रूप से शिशुओं में पोषण सम्बन्धी समस्याएं हो सकती हैं। सिस्टिक फाय्ब्रोसिस से सम्बंधित अन्य समस्याओं में शामिल है साइन्एसाईटस, नेज़ल पोलिप्स, इसाफ्गाईटस, पैनक्रिएटाइटस, लीवर सिरोह्सिस, रेक्टल प्रोलैप्स, डायबिटीज और इनफर्टिलिटी, जो कि मुख्यतया पुरुषों में पाई जाती है।
सिस्टिक फाय्ब्रोसिस को विकसित होने के लिए व्यक्ति में दो अनुवांशिक सिस्टिक फाय्ब्रोसिस ज़ीन आने चाहियें, जिसमें प्रत्येक मूल जनक से एक आना चाहिए। वे व्यक्ति जिनमें वंशानुक्रम से केवल एक सिस्टिक फाय्ब्रोसिस ज़ीन आता है उन्हें ""सिस्टिक फाय्ब्रोसिस कैरियर्स"" कहा जाता है। वे बच्चों में सिस्टिक फाय्ब्रोसिस ज़ीन स्थानांतरित तो कर सकते हैं पर वे स्वयं इस रोग से प्रभावित नहीं होते।",245,पोषण
लालेह बख्तियार,"लालेह बख्तियार (जन्म 29 जुलाई, 1938; इंग्लिश: Laleh Bakhtiar), ईरानी-अमेरिकन मुस्लिम लेखिका, अनुवादक और मनोवैज्ञानिक, कुरआन का इंग्लिश में अनुवाद करने वाली पहली अमेरिकी महिला हैं।",26,पोषण
अनोखेलाल मिश्र,"अनोखेलाल मिश्र (1914 – 10 मार्च 1958) प्रसिद्ध तबलावादक थे। वे संगीत जगत में 'ना धिं धिं ना' के जादूगर के नाम से प्रसिद्ध थे। उनका सम्बन्ध बनारस घराने से था।
पं. अनोखेलाल जी का जन्म सन् 1914 ई. में भारत के उत्तर प्रदेश के ग्राम-ताजपुर, तहसील-सकलडीहा, जिला-चन्दौली, में हुआ था। इनके पिता पं॰ बुद्धू प्रसाद मिश्र जी एक प्रसिद्ध सारंगी वादक थे। जब पं॰ अनोखेलाल जी मात्र ढाई वर्ष के थे तभी इनके पिताजी तथा मात्र 6 वर्ष की अवस्था में इनकी माताजी का स्वर्गवास गया था। इनका पालन-पोषण इनकी दादी श्रीमती जानकी देवी ने किया। श्रीमती जानकी देवी जी इनको लेकर बनारस आ गई तथा इनको बनारस घराने के तबले के प्रकाण्ड विद्वान पं॰ भैरव प्रसाद मिश्र जी से तबला वादन की शिक्षा दिलवाने लगी।
इनका बचपन अत्यन्त कष्ट में बीता था। गुरु पं॰ भैरव प्रसाद मिश्र जी के सानिध्य में इन्होंने कठोर परिश्रम किया तथा सोते-जोगते हर समय केवल तबले के प्रति ही समर्पित हो गये। पं॰ भैरव प्रसाद मिश्र जी से इन्होंने 15 वर्षों तक बनारस घराने के तबले की विधिवत शिक्षा प्राप्त की। सच्ची लगन व अथक परिश्रम द्वारा 8-10 घण्टे प्रतिदिन के अभ्यास को आपने धीरे-धीरे अभ्यास बढ़ाते हुए 18 घण्टे तक कर दिया। इस कठिन अभ्यास के कारण इनको शारीरिक कष्ट भी उठाना पड़ा, परन्तु ये अपनी साधना में निरन्तर निमग्न रहे। इनके समान अभ्यास करना, किसी भी कलाकार के लिये अत्यन्त कठिन व असाध्य है। इन्होंने पं॰ दाउजी मिश्र के साथ गायन तथा पं॰ मोहन लाल जी व प्रसिद्ध नृत्यांगना शिवकुँवर बाई के कथक के साथ प्रतिदिन घण्टों अभ्यास करते थे। मात्र सोलह वर्ष की अवस्था में ही स्वतंत्र वादन तथा संगति दोनों में ही आप प्रवीण हो गये थे।",278,पोषण
ता हा,सूरा ता. हा. (इंग्लिश: Ta-Ha) इस्लाम के पवित्र ग्रन्थ कुरआन का 20 वां सूरा या अध्याय है। इसमें 135 आयतें हैं।,21,पोषण
कायलाणी लेइ,"कायलाणी लेइ (जन्म 5 अगस्त 1980) विश्व प्रसिद्ध पॉर्न फिल्म अभिनेत्री हैं। उन्होंने 200 से अधिक चलचित्रों में कार्य किया है।
कल्याणी देवी का जन्म सिंगापुर में हुआ, एवं उनका पालन-पोषण मैसाचुसेट्स में किया गया।
कल्याणी देवी ने निम्नलिखित पारितोषिक प्राप्त किये हैं -

2005 - सर्वोत्तम अनुबंध अभिनेत्री, ऐडम फिल्म वर्ल्ड गाइड पुरस्कार
2008 - सर्वश्रेष्ठ कामोद्दीपक पुनरागमन, ऐडम फिल्म वर्ल्ड गाइड पुरस्कार
2008 - सर्वश्रेष्ठ महिला कलाकार (संपादक की पसंद), नाइट मूवीज़ सम्मान
2008 - सर्वश्रेष्ठ पुनरागमन, एक्स-रेटेड आलोचक संगठन पुरस्कार
2010 - सर्वश्रेष्ठ सामूहिक यौन-क्रिया दृश्य, वयस्क वीडियो समाचार पुरस्कार
2015 - वयस्क वीडियो समाचार हॉल ऑफ फेम",101,पोषण
सुंईया मेला,"सुंईया मेला, राजस्थान के बाड़मेर जिले के चौहटन कस्बे में पौष कृष्ण पक्ष अमावस्या की सोमवती अमावस्या, मूल नक्षत्र, व्यादिपद योग को मुहूर्त पर लगता है। इसे ""मारवाड़ का अर्द्धकुंभ"" कहा जाता है। सुंईया महादेव एक ""मरु कुंभ"" भी है। इस दो दिवसीय मेले में लाखों की तादाद में श्रद्धालु भारत के दूर-दूर प्रदेशों से यहां आते हैं।अनुमान के तौर पर करीब 10 लाख श्रद्धालु इस मेले में आते हैं और महास्नान का लाभ लेते हैं।सूईंया मेले में पवित्र स्नान की मान्यता है। यहां लाखों श्रद्धालु कड़कड़ाती सर्दी में पवित्र स्नान के लिये पहुंचते है। इस दिन यहां सूईंया महादेव मंदिर का झरना, कपालेश्वर महादेव मंदिर का झरना, धर्मराज की बेरी इंद्रभान तालाब   और विष्णु पगला के पांच स्थलों के पवित्र मिश्रित जल से स्नान करते है।",127,पोषण
आचार्य महाप्रज्ञ,"आचार्य श्री महाप्रज्ञ (14 जून 1920 – 9 मई 2010) जैन धर्म के श्वेतांबर तेरापंथ के दसवें संत थे। महाप्रज्ञ एक संत, योगी, आध्यात्मिक, दार्शनिक, अधिनायक, लेखक, वक्ता और कवि थे।
उनकी बहुत पुस्तकें और लेख उनके पूर्व नाम मुनि नथमल के नाम से प्रकाशित हुई।
उन्होंने दस वर्ष की आयु में जैन संन्यासी के रूप में विकास और धार्मिक प्रतिबिंब का जीवन आरम्भ किया। महाप्रज्ञ ने अनुव्रत आंदोलन में मुख्य भूमिका निभाई जो गुरु आचार्य तुलसी ने 1949 में आरम्भ किया था और 1995 के आंदोलन में स्वीकृत अधिनायक बन गए। आचार्य महाप्रज्ञ ने 1970 के दशक में अच्छी तरह से नियमबद्ध प्रेक्षा ध्यान तैयार किया और शिक्षा प्रणाली में ""जीवन विज्ञान"" का विकास किया जो छात्रों के संतुलित विकास और उसका चरित्र निर्माण के लिए प्रयोगिक पहुँच है।",130,पोषण
एल्स हॉस्क,"एल्स अन्ना सोफ़ी होस्क (जन्म 7 नवम्बर 1988) स्वीडन की फ़ैशन मॉडल हैं जो डायर (अंग्रेजी:Christian Dior S.A.), डोल्से और गब्बाना (Dolce & Gabbana), एमानुएल उन्गारो (Emanuel Ungaro), एच&एम, लिली पुलित्जर और गॅस जैसे प्रमुख ब्रांडों सहित कई कम्पनीयों की मॉडल रह चुकी हैं। उन्होंने 2011 और 2012 में विक्टोरिया'ज सीक्रेट ब्रांड के वार्षिक फैशन शो में दिखने लिए मॉडलिंग की। वो कई ट्रेड-मार्क अभियानों में भी काम कर चुकी हैं, मुख्य रूप से पिंक (पीआयएनके) उप-प्रभाग में। उन्होंने स्वीडन के लिए वृत्तिक बास्केटबॉल खिलाड़ी रह चुकी हैं।",88,पोषण
भाई भैया और ब्रदर,"भाई भैया और ब्रदर एक भारतीय कॉमेडी टेलीविजन श्रृंखला है, जो 4 जून 2012 से 10 अगस्त 2012 तक सब टीवी पर प्रसारित हुई।",24,पोषण
पीरो प्रेमण,पीरो प्रेमण (जन्म अनुमान 1832 - 1882) को पंजाबी भाषा की पहिली कवित्री माना जाता है। उनका ज़िक्र पहली बार डा दविंदर सिंह ने अपने शोध पात्र में किया था।,30,पोषण
फ्रांसीसी भारत,"फ्रांसीसी भारत 17 वीं सदी के दूसरे आधे में भारत में फ्रांसीसी ईस्ट इंडिया कंपनी द्वारा स्थापित फ्रांसीसी प्रतिष्ठानों के लिए एक आम नाम है और आधिकारिक तौर पर एस्तब्लिसेमेन्त फ्रन्से द्दे इन्द्दए (फ़्रान्सीसी:Établissements français de l'Inde) रूप में जाना जाता, सीधा फ्रेंच शासन 1816 शुरू हुआ और 1954 तक जारी रहा जब प्रदेशों नए स्वतंत्र भारत में शामिल कर लिया गया। उनके शासक क्षेत्रों पॉन्डिचेरी, कराईकल, यानम, माहे और चन्दननगर थे। फ्रांसीसी भारत मे भारतीय शहरों में बनाए रखा कई सहायक व्यापार स्टेशन (लॉज) शामिल थे।
कुल क्षेत्र 510 km2 (200 वर्ग मील) था, जिनमें से 293 km2 (113 वर्ग मील) पॉन्डिचेरी का क्षेत्र था। 1936 में, उपनिवेश की आबादी कुल 2,98,851 निवासिया थी, जिनमें से 63% (1,87,870) पॉन्डिचेरी के क्षेत्र में निवास करती थी।",126,पोषण
स्वच्छमण्डल,"स्वच्छमण्डल या कनीनिया (अंग्रेज़ी:कॉर्निया) आंखों का वह पारदर्शी भाग होता है जिस पर बाहर का प्रकाश पड़ता है और उसका प्रत्यावर्तन होता है। यह आंख का लगभग दो-तिहाई भाग होता है, जिसमें बाहरी आंख का रंगीन भाग, पुतली और लेंस का प्रकाश देने वाला हिस्सा होते हैं। कॉर्निया में कोई रक्त वाहिका नहीं होती बल्कि इसमें तंत्रिकाओं का एक जाल होता है। इसको पोषण देने वाले द्रव्य वही होते हैं, जो आंसू और आंख के अन्य पारदर्शी द्रव का निर्माण करते हैं। प्रायः कॉर्निया की तुलना लेंस से की जाती है, किन्तु इनमें लेंस से काफी अंतर होता है। एक लेंस केवल प्रकाश को अपने पर गिरने के बाद फैलाने या सिकोड़ने का काम करता है जबकि कॉर्निया का कार्य इससे कहीं व्यापक होता है। कॉर्निया वास्तव में प्रकाश को नेत्रगोलक (आंख की पुतली) में प्रवेश देता है। इसका उत्तल भाग इस प्रकाश को आगे पुतली और लेंस में भेजता है। इस तरह यह दृष्टि में अत्यंत सहायक होता है। कॉर्निया का गुंबदाकार रूप ही यह तय करता है कि किसी व्यक्ति की आंख में दूरदृष्टि दोष है या निकट दृष्टि दोष। देखने के समय बाहरी लेंसों का प्रयोग बिंब को आंख के लेंस पर केन्द्रित करना होता है। इससे कॉर्निया में बदलाव आ सकता है। ऐसे में कॉर्निया के पास एक कृत्रिम कांटेक्ट लेंस स्थापित कर इसकी मोटाई को बढ़ाकर एक नया केंद्र बिंदु (फोकल प्वाइंट) बना दिया जाता है। कुछ आधुनिक कांटेक्ट लेंस कॉर्निया को दोबारा इसके वास्तविक आकार में लाने के लिए दबाव का प्रयोग करते हैं। यह प्रक्रिया तब तक चलती है, जब तक अस्पष्टता नहीं जाती।",261,पोषण
युग वर्णन,"युग का अर्थ होता है एक निर्धारित संख्या के वर्षों की काल-अवधि। उदाहरणः कलियुग, द्वापर, सत्ययुग, त्रेतायुग आदि। युग वर्णन का अर्थ होता है कि उस युग में किस प्रकार से व्यक्ति का जीवन, आयु, ऊँचाई होती है एवं उनमें होने वाले अवतारों के बारे में विस्तार से परिचय दे।
प्रत्येक युग के वर्ष प्रमाण और उनकी विस्तृत जानकारी कुछ इस तरह है :",64,पोषण
