title,content,word_count,topic
तफ़हीमुल क़ुरआन,"तफ़हीम-उल-क़ुरआन (उर्दू: تفہيم القرآن) पाकिस्तानी इस्लामवादी विचारक और कार्यकर्ता सैयद अबुल अला मौदुदी द्वारा कुरआन का 6-खंड अनुवाद और टिप्पणी (तफ़सीर,भाष्य, टीका,व्याख्या) है। मौदुदी ने 1942 में किताब लिखना शुरू किया  और 1972 में इसे लगभग ३० वर्ष में पूरा किया  

तफ़हीम अरबी शब्द फ़हम से बना है जिसका अर्थ है ""समझना""।   तफ़हीमुल क़ुरआन  रूढ़िवादी और आधुनिकतावादी व्याख्या का एक संयोजन है और इसने आधुनिक इस्लामी विचारों को गहराई से प्रभावित किया है। यह कई मायनों में पारंपरिक व्याख्याओं से भिन्न है। यह धर्मग्रंथ पर एक पारंपरिक टिप्पणी से कहीं अधिक है क्योंकि इसमें अर्थशास्त्र, समाजशास्त्र, इतिहास और राजनीति के संबंध में चर्चा और बहस शामिल है। अपने पाठ में, मौदुदी ने क़ुरआन  के परिप्रेक्ष्य पर प्रकाश डाला और तर्क दिया कि इस्लाम सभी क्षेत्रों में पर्याप्त मार्गदर्शन प्रदान करता है।
मौदुदी, मुहम्मद की सुन्नत से क़ुरआन की आयतों की व्याख्या प्रदान करने की मानक तकनीक का उपयोग करता है, जिसमें आयतों के पीछे के ऐतिहासिक कारण भी शामिल हैं।
तफ़हीम आम तौर पर आधुनिक दुनिया और विशेष रूप से मुस्लिम समुदाय के सामने आने वाले मुद्दों से बड़े पैमाने पर निपटता है। 
मौदुदी ने अपना काम उर्दू में लिखा। तब से इसका अंग्रेजी, हिंदी, बंगाली, मलयालम, मराठी, पश्तो और सिंधी सहित भाषाओं में अनुवाद किया गया है। 2006 में, इस्लामिक फाउंडेशन ने टुवार्ड्स अंडरस्टैंडिंग द क़ुरआन  शीर्षक के तहत जफर इशाक अंसारी द्वारा एक संक्षिप्त एक-खंड अंग्रेजी अनुवाद प्रकाशित किया।",231,समाजशास्त्र
जाँजी हेमनाथ शर्मा कॉलेज,"जाँजी हेमनाथ शर्मा कॉलेज  शिवसागर, असम, भारत में है। इसकी स्थापना 25 जुलाई 1964 को हुई थी। कॉलेज डिब्रूगढ़ विश्वविद्यालय से संबद्ध है और विश्वविद्यालय अनुदान आयोग द्वारा मान्यता प्राप्त है।",31,समाजशास्त्र
श्रमिक वर्ग,"कामगार वर्ग (या श्रमिक वर्ग) एक ऐसा शब्द है, जिसका उपयोग सामाजिक विज्ञानों और साधारण बातचीत में वैसे लोगों के वर्णन के लिए होता है, जो निम्न स्तरीय कार्यों (दक्षता, शिक्षा और निम्न आय द्वारा मापदंड पर) में लगे होते हैं और अक्सर इस अर्थ का विस्तार बेरोजगारी या औसत से नीचे आय वाले लोगों तक भी होता है। कामगार वर्ग मुख्यत: औद्योगीकृत अर्थव्यवस्थाओं और गैर-औद्योगीकृत अर्थव्यवस्थाओं वाले शहरी क्षेत्रों में पाये जाते हैं।

सामाजिक वर्ग के वर्णन में कई तरह के शब्दों का उपयोग किया जाता है, मगर कामगार वर्ग को विभिन्न तरीकों से परिभाषित और प्रयुक्त किया जाता है। जब इसका प्रयोग गैर-अकादमिक रूप में होता है तो यह आमतौर पर समाज के एक खंड को संदर्भित करने के लिए होता है, जो शारीरिक श्रम पर आश्रित है, खासतौर पर जिन्हें घंटे के आधार पर मजदूरी दी जाती है। शैक्षिक वार्तालाप में इसका प्रयोग विवादास्पद रहा है, विशेष रूप से उत्तर-औद्योगीकृत समाजों में मानव श्रम में गिरावट के बाद. कुछ शिक्षाविद कामगार वर्ग की अवधारणा की उपयोगिता पर सवाल उठाते हैं। 
यह शब्द आमतौर पर आर्थिक संसाधन, शिक्षा और सांस्कृतिक हितों तक पहुंच के मामले में उच्च वर्ग और मध्य वर्ग के हितों के साथ विषम होता है। कामगार वर्ग और मध्य वर्ग के बीच सीमा रेखा वहां और स्पष्ट हो जाती है, जहां एक आबादी प्राथमिक तौर पर जीवन रक्षा की तुलना में जीवन शैली पर ज्यादा पैसा खर्च करती है (उदाहरण के लिए फैशन बनाम सिर्फ पोषण और आवास) समस्या यह है कि भेद की इस पद्धति पर निर्भर रहने से वैसे बहुत सारे लोग बाहर हो जायेंगे, जो अक्सर कामगार वर्ग के रूप में पहचाने जाते हैं। 
इसका प्रयोग एकांतर रूप से अपमानजनक हो सकता है या कामगार वर्ग के रूप में स्व-पहचान रखने वाले लोगों में गर्व का भाव व्यक्त कर सकता है।",299,समाजशास्त्र
कोलन वर्गीकरण,"द्विबिन्दु वर्गीकरण या कोलन वर्गीकरण (Colon classification (CC)), पुस्तकालय वर्गीकरण की एक प्रणाली है जिसका विकास एस आर रंगनाथन ने किया था। यह प्रथम मुखर (या विश्लेषणात्मक-संश्लेषणात्मक) वर्गीकरण था। इसका प्रथम संस्करण 1933 में प्रकाशित हुआ था। तब से छह और संस्करण प्रकाशित हो चुके हैं। यह वर्गीकरण भारत में पुस्तकालयों में विशेष रूप से उपयोग किया जाता है। कोलन वर्गीकरण प्रणाली एक वैज्ञानिक तथा तार्किक प्रणाली के रूप में स्थापित हो चुकी है; फिर भी इसके विभिन्न सिद्धान्तों तथा प्रावधानों को कभी-कभी 'कठिन' करार दिया जाता है इसमें मिश्रित अंकन का प्रयोग किया गया हैं।इसके अब तक 7 संस्करण आ चुके है अंतिम संकरण 1987 में आया था।

उदाहरण
""research in the cure of tuberculosis of lungs by x-ray conducted in India in 1950"" नामक विषय को निम्नलिखित श्रेणी में रखा जाएगा-

Medicine,Lungs;Tuberculosis:Treatment;X-ray:Research.India'1950
इसको एक विशिष्ट पुकार संख्या (call number) के रूप में निम्न प्रकार से लिखा जाता है :

L,45;421:6;253:f.44'N5",152,समाजशास्त्र
लुई अल्थुसर,"लुई पियरे आल्थुसर (  Louis Pierre Althusser ; 16 अक्टूबर 1918 - 22 अक्टूबर 1990) या एल० अलथ्यूजर,  एक अल्जीरियाई मूल के फ्रांसीसी मार्क्सवादी दार्शनिक थे, जिन्होंने पेरिस में एकोल नॉर्मल सुपिरियर (École normale supérieure) में अध्ययन किया, जहां वे अंततः दर्शनशास्त्र के प्राध्यापक बन गए।
अल्थुसेर लंबे समय से  फ्रांसीसी साम्यवादी दल ( Parti communiste français, पीसीएफ) के सदस्य तथा कभी कभी उसके कड़े आलोचक थे। उनके तर्क और सिद्धांत उन खतरों के विरुद्ध थे जिनकों  उन्होंने मार्क्सवाद की सैद्धांतिक नींव पर हमला करते हुए देखा। इनमें मार्क्सवादी सिद्धांत पर अनुभववाद का प्रभाव, और मानवतावादी और सुधारवादी समाजवादी अभिविन्यास दोनों शामिल थे जो यूरोपीय साम्यवादी दलों में विभाजन के साथ-साथ व्यक्तित्व-पूजा और विचारधारा की समस्या के रूप में प्रकट हुए। अल्थुसर को आमतौर पर एक संरचनात्मक मार्क्सवादी के रूप में जाना जाता है, हालांकि फ्रांसीसी संरचनावाद के अन्य स्कूलों के साथ उनका संबंध कोई साधारण संबद्धता नहीं है और वह संरचनावाद के कई पहलुओं के आलोचक थे।
अल्थुसेर का जीवन तीव्र मानसिक बीमारी के दौर से गुजरा। 1980 में, उन्होंने अपनी पत्नी, समाजशास्त्री हेलेन रिटमैन की गला दबाकर हत्या कर दी। उन्हें पागलपन के कारण मुकदमा चलाने के लिए अयोग्य घोषित कर दिया गया और तीन साल के लिए एक मनोरोग अस्पताल में भर्ती कराया गया। 1990 में उनकी मृत्यु के बाद उन्होंने थोड़ा और शैक्षणिक कार्य किया।",219,समाजशास्त्र
अंग्रेजी और विदेशी भाषाओ का केन्द्रीय संस्थान,"अंग्रेजी और विदेशी भाषा विश्वविद्यालय (EFLU) (जिसे पहले CIEFL के नाम से जाना जाता था) भारत में स्थित एक केन्द्रीय विश्वविद्यालय है। यह उच्चतर शिक्षा के लिए राष्ट्रीय स्तर का विश्वविद्यालय है। इसका मुख्य परिसर में हैदराबाद में स्थित है। हालांकि लखनऊ और शिलौंग में भी इसके परिसर हैं।
ईएफएलयू (EFLU) में अंग्रेजी और विदेशी भाषाओं के साथ उनके साहित्य के बारे में भी पढ़ाया जाता है। साथ ही ये इन भाषाओं से जुड़े अनुसंधान (रिसर्च), शिक्षकों के प्रशिक्षण, प्रशिक्षण सामग्री को मुहैया कराने का भी काम करता है, एक तरह से कहा जाए तो ईएफएलयू सेवाओं का शिक्षा विस्तार है जिसका मुख्य उदेश्य भारत में अंग्रेजी और विदेशी भाषाओं की पढ़ाई के स्तर को सुधारना है। ये देश का अकेला ऐसा शिक्षण संस्थान है जो पूरी तरह से अंग्रेजी और विदेशी भाषाओं की पढ़ाई को लेकर प्रतिबद्ध है।
ईन वर्षोमें ईएफएलयु (EFLU) ने विभिन्न विदेशी भाषाओं की पढाई शरू की है जिनकी काफी माग थी। यहां अंग्रेजी, अरबी, फ्रेंच, जर्मन, जापानी, रशियन, स्पैनिश, पोर्टेगीज, पर्सियन, तुर्की, इटालियन, चीनी, कोरियन और हिंदी जैसी भाषाओं की पढ़ाई होती है।
ईएफएलयु (EFLU) एम.ए. (M.A) के साथ उस विषय में एक सांस्कृतिक अध्ययन पाठ्यक्रम शुरू करने वाला देश का पहला शिक्षण संस्थान भी है। ईएफएलयु (EFLU) समाजशास्त्र, फिल्म स्टूडियो, मानवशास्त्र, इतिहास और साहित्य जैसे क्षेत्र, जहां ईन शिक्षा शाखाओं को पृथक करना कठिन हो जाता है, एसे क्षत्रोमें एम.फिल. (M.Phil) और पीएच.डी. (Ph.D.) भी कराता है। 
2006 में भारतीय संसद ने इसे केन्द्रीय युनिर्वसिटी का दर्जा दे दिया। [1]
3 अगस्त 2007 को इसका दुबारा नामकरण किया गया और इसे इंग्लिश एंड फॉरेन लैंग्वेज विश्वविद्यालय (ईएफएलयू) (EFLU) नाम दिया गया। दिल्ली विश्वविद्यालय के स्लाविक स्टडी डिपार्टमेंट के अभय मौर्य इसके पहले वाइस चांसलर बनें। [2]",282,समाजशास्त्र
भौतिक शास्त्र,"भौतिक शास्त्र या भौतिकी प्राकृतिक विज्ञान का एक मूल विषय है जो पदार्थ, उसके मूलभूत घटकों, उसकी गति और व्यवहार, देशकाल के माध्यम से और ऊर्जा और बल की सम्बन्धित संस्थाओं का अध्ययन करता है। भौतिकी सबसे मौलिक वैज्ञानिक विषयों में से एक है, जिसका मुख्य लक्ष्य यह समझना है कि ब्रह्माण्ड कैसे व्यवहार करता है। एक वैज्ञानिक जो भौतिकी के क्षेत्र में विशेषज्ञता रखता है, भौतिक शास्त्री कहलाता है।
भौतिकी प्राचीनतम शैक्षणिक विषयों में से एक है और, खगोल शास्त्र के समावेश के कारण, प्रायः प्राचीनतम है।  पिछली दो सहस्राब्दी में, भौतिकी, रसायन विज्ञान, जीव विज्ञान और गणित की कुछ शाखाएँ प्राकृतिक दर्शनशास्त्र का एक अंश थीं, परन्तु 17वीं शताब्दी में वैज्ञानिक क्रान्ति के दौरान ये प्राकृतिक विज्ञान अपने आप में अद्वितीय शोध प्रयासों के रूप में उभरे। भौतिकी अनुसन्धान के कई अन्तर्विषयक क्षेत्रों, जैसे जैवभौतिकी और प्रमात्रा रसायनिकी के साथ प्रतिच्छेद करती है, और भौतिकी की सीमाओं को कठोर रूप से परिभाषित नहीं किया गया है।  भौतिकी में नए विचार प्रायः अन्य विज्ञानों द्वारा अध्ययन किए गए मौलिक तन्त्रों की व्याख्या करते हैं और इन और अन्य शैक्षणिक विषयों जैसे दर्शनशास्त्र में अनुसन्धान के नूतन मार्ग सुझाते हैं।
भौतिकी में प्रगति अक्सर नूतन तकनीकों में प्रगति को सक्षम बनाती है। उदाहरण के लिए, विद्युच्चुम्बकत्व, ठोसावस्था भौतिकी और परमाणु भौतिकी की समझ में हुई प्रगति ने सीधा नूतनोत्पादों के विकास का मार्ग प्रशस्त किया जिन्होंने आधुनिक समाज को नाटकीय रूप से बदल दिया है, जैसे कि दूरदर्शन, संगणकों, गृहोपकरण और परमाण्वस्त्र;  ऊष्मगतिकी में प्रगति के कारण औद्योगीकरण का विकास हुआ; और यान्त्रिकी में हुई प्रगति ने कलन के विकास को प्रेरित किया।",263,समाजशास्त्र
चित्रालेख,"चित्रालेख या ग्राफ़िक्स ऐसे दृश्य प्रदर्शन को कहते हैं जो किसी दीवार, कपड़े, काग़ज़, पत्थर, कंप्यूटर स्क्रीन या अन्य सतह पर ज्ञान, मनोरंजन, सन्देश, मार्गदर्शन, पहचान या अन्य किसी ध्येय से बनाया गया हो। इसके उदहारण लिखाई, फ़ोटो, चित्र, अंक, अक्षर, इत्यादि हैं। चित्रालेख में अक्सर लिखाई, चित्र, रंगों और अन्य तत्वों को मिलाया जाता है। मानवों में यह क्षमता है कि वे चित्रलेखों को देखकर उन से अर्थ भाप पाते हैं। इस प्रक्रिया पर लक्षण-विज्ञान में अध्ययन किया जाता है।
ग्राफ़िक डिज़ाइन आज के युग में बहुत ही ज्यादा प्रसिद्ध होने वाला स्किल है आपने बहुत सारे फिल्म के पोस्टर देखे होंगे , लोगो देखे होंगे , पोस्टर देखे होंगे , वेब डिज़ाइन , किताब की कवर डिज़ाइन , एप्लीकेशन डिज़ाइन ये सब काम एक ग्राफ़िक डिज़ाइनर का होता है अगर आप एक बार ग्राफ़िक डिज़ाइनर बन जाते हो तो आप फ्रीलांसर की तरह काम करके बहुत सारे पैसे कमा सकते हो",153,समाजशास्त्र
कामशास्त्र,"मानव जीवन के लक्ष्यभूत चार पुरुषार्थों में ""काम"" अन्यतम पुरुषार्थ माना जाता है। संस्कृत भाषा में उससे संबद्ध विशाल साहित्य विद्यमान है।",22,समाजशास्त्र
