title,content,word_count,topic
दरभंगा राज,"दरभंगा राज बिहार प्रान्त के मिथिला क्षेत्र में लगभग 8380 किलोमीटर के दायरे में फैला हुआ था। इसका मुख्यालय दरभंगा शहर था। इस राज की स्थापना मैथिल ब्राह्मण जमींदारों ने 16वीं सदी की शुरुआत में की थी। ब्रिटिश राज के दौरान तत्कालीन बंगाल के 18 सर्किल के 4,495 गाँव दरभंगा नरेश के शासन में थे। राज के शासन-प्रशासन को देखने के लिए लगभग 7,500 अधिकारी बहाल थे। भारत के रजवाड़ों में एवं प्राचीन संस्कृति को लेकर दरभंगा राज का अपना महत्त्वपूर्ण स्थान रहा है।
दरभंगा-महाराज खण्डवाल कुल से थे जिसके शासन-संस्थापक श्री महेश ठाकुर थे। इनका गोत्र शाण्डिल्य था। उनकी अपनी विद्वता व उनके शिष्य रघुनन्दन की विद्वता की चर्चा सम्पूर्ण भारत में उत्कृष्ट स्तर पर था। महाराजा मानसिंह के सहयोग से शहंशाह अकबर द्वारा उन्हें राज्य की स्थापना के लिए अपेक्षित सहयोग व धन प्राप्त हुई थी।",138,कला
टॉम हैंक्स,"थॉमस जेफ्री ""टॉम "" हैंक्स (जन्म 9 जुलाई 1956) एक अमेरिकी अभिनेता, निर्माता, लेखक और निर्देशक हैं। एक नाटकीय अभिनेता के रूप में कई उल्लेखनीय भूमिका में सफलता प्राप्त करने के पूर्व हैंक्स ने एंड्रयू बेकेट की फिलाडेल्फिया, फॉरेस्ट गंप (Forrest Gump) में शीर्षक पात्र की भूमिका, अपोलो 13 में कमांडर जेम्स ए लवेल, सेविंग प्राइवेट रायन में कप्तान जॉन एच. मिलर की भूमिका, पिक्सार की टॉय स्टोरी में शेरिफ वुडी की भूमिका और कास्ट अवे में चक नोलैंड की भूमिका सहित टेलीविजन और परिवार के अनुकूल हास्य प्रधान नाटकों में काम किया। हैंक्स ने 1993 में फिलाडेल्फिया के लिए और 1994 में फॉरेस्ट गंप के लिए लगातार सर्वश्रेष्ठ अभिनेता का अकादमी अवार्ड्स जीता. घरेलू बॉक्स ऑफिस में उनकी फ़िल्मों से कुल आय 3.3 अरब डॉलर से अधिक है। वे अभिनेता कॉलिन हैंक्स के पिता हैं।",136,कला
कीश द्वीप,"कीश ( फ़ारसी: [کیش] Error: {{Lang}}: text has italic markup (help)   (तेहरान)कड़ी=|इस ध्वनि के बारे में बात सुनो ; अरबी .5ays या Qeys ) 91.5-वर्ग-किलोमीटर (35.3 वर्ग मील) फ़ारस की खाड़ी में ईरान के दक्षिणी तट पर बंदर लेंगे काउंटी, होर्मोज़्गान प्रांत में रिसॉर्ट द्वीप। अपने मुक्त व्यापार क्षेत्र की स्थिति के कारण, यह द्वीप एक उपभोक्ता के स्वर्ग के रूप में है, जिसमें कई मॉल, शॉपिंग सेंटर, पर्यटक आकर्षण और रिज़ॉर्ट होटल हैं।  इसकी अनुमानित आबादी लगभग 40,000 निवासियों और सालाना लगभग 1 मिलियन आगंतुक है। 
दुबई और शर्म अल-शेख के बाद किश द्वीप दक्षिण - पश्चिम एशिया में सबसे अधिक देखी जाने वाली छुट्टियों में से एक है।   कई देशों के पर्यटक जिनके लिए ईरान को आमतौर पर वीजा की आवश्यकता होती है, जो किश फ्री ज़ोन में प्रवेश करना चाहते हैं, उन्हें वीज़ा प्राप्त करने की छूट होती है । उन यात्रियों के लिए, किश अधिकारियों द्वारा आगमन पर यात्रा परमिट जारी किए जाते हैं और १४ दिनों के लिए वैध होते हैं।",166,कला
सुज़ुकी,"सुज़ुकी एक जापानी बहुराष्ट्रीय निगम है जिसका मुख्यालय हमामात्सू, जापान में स्थित है और जो काम्पैक्ट ऑटोमोबाइल और 4x4 वाहन, सभी रेंज की मोटरसाइकिल, ऑल-टेरेन वाहन (ATVs), आउटबोर्ड जहाज इंजन, व्हीलचेयर और अन्य प्रकार के छोटे आंतरिक दहन इंजन का उत्पादन करती है। उत्पादन मात्रा के आधार पर सुज़ुकी दुनिया भर में नौवीं सबसे बड़ी ऑटोमोबाइल निर्माता है, करीब 45,000 से अधिक लोगों को रोजगार देती है और 23 देशों में इसकी 35 मुख्य उत्पादन इकाइयां और 192 देशों में इसके 133 वितरक हैं। [उद्धरण चाहिए] आंकड़ों के अनुसार जापान ऑटोमोबाइल मैन्युफैक्चरर्स एसोसिएशन (जेएएमए) से सुज़ुकी जापान की छोटी कारों और ट्रकों की दूसरी सबसे बड़ी निर्माता है।
जापानी भाषा में ""सुज़ुकी"" को [suzuki] उच्चारित किया जाता है, जिसमें [ki] पर बलाघात दिया जाता है। अंग्रेजी में इसका उच्चारण आईपीए: /səˈzuːki/ sə-ZOO-kee किया जाता है और ज़ु पर जोर डाला जाता है। इस उच्चारण का इस्तेमाल सुज़ुकी कंपनी द्वारा उन विपणन अभियानों के लिए किया जाता है जो अंग्रेजी भाषियों के लिए होते हैं।",164,कला
पारंपरिक संगीत,"साँचा:Infobox Music genre
ग्रैमी अवार्ड्स की शब्दावली में अब पारंपरिक संगीत शब्द का प्रयोग ""लोक संगीत "" के स्थान पर किया जाता है। इस बदलाव का पूर्ण विवरण विश्व संगीत लेख के शब्दावली अनुभाग में पाया जा सकता है। अन्य संगठनों ने इसी तरह के परिवर्तन किए हैं, हालांकि गैर-शैक्षणिक हलकों में, तथा सीडी बेचने वाली कई वेबसाइटों पर, ""लोक संगीत"" वाक्यांश का प्रयोग बहुत सारे अर्थों में किया जाता है।",71,कला
अयलान,"अयलान ( /əjəlɑːn/ अनुवाद. Alien ) 2024 की भारतीय तमिल भाषा की साइंस फिक्शन फिल्म है, जो आर. रविकुमार द्वारा निर्देशित और केजेआर स्टूडियो के तहत कोटापडी जे. राजेश द्वारा निर्मित है। यह अयलान फिल्म श्रृंखला की पहली किस्त है और इसमें शरद केलकर, ईशा कोप्पिकर, भानुप्रिया, योगी बाबू, करुणाकरण और बाला सरवनन के साथ शिवकार्तिकेयन् और रकुल प्रीत सिंह मुख्य भूमिका में हैं, जबकि सिद्धार्थ ने एलियन की आवाज दी है। यह एक ऐसे व्यक्ति की कहानी है जो एक दुष्ट वैज्ञानिक को घातक नोवा गैस बनाने से रोकने के लिए एक एलियन के साथ मिलकर काम करता है, जो पृथ्वी को खतरे में डाल सकती है।
फिल्म की घोषणा 24AM स्टूडियो द्वारा अक्टूबर 2016 में अस्थायी शीर्षक SK14 के तहत की गई थी, क्योंकि यह मुख्य अभिनेता के रूप में शिवकार्तिकेयन की 14वीं फिल्म है, लेकिन KJR स्टूडियो के अधिग्रहण से पहले स्टूडियो पीछे हट गया। आधिकारिक शीर्षक की घोषणा फरवरी 2020 में की गई थी। मुख्य फोटोग्राफी जून 2018 में शुरू हुई। फिल्म की शूटिंग मुख्य रूप से चेन्नई में की गई थी, और वित्तीय मुद्दों, अन्य परियोजनाओं के लिए अभिनेताओं की प्रतिबद्धताओं और सीओवीआईडी -19 महामारी के कारण देरी के बाद जनवरी 2021 की शुरुआत में पूरी हो गई, जबकि अतिरिक्त फोटोग्राफी नवंबर 2022 में हुई। फिल्म में संगीत एआर रहमान ने दिया है, छायांकन नीरव शाह ने किया है और संपादन रूबेन ने किया है। इसमें 4500 से अधिक दृश्य प्रभाव शॉट्स हैं, जो किसी भारतीय फिल्म के लिए सबसे अधिक हैं।
अयालान को पोंगल के सप्ताह के दौरान 12 जनवरी 2024 को नाटकीय रूप से रिलीज़ किया गया था, आलोचकों की सकारात्मक समीक्षाओं के कारण, अधूरे पोस्ट-प्रोडक्शन कार्यों के कारण दिवाली 2023 से विलंबित हो गया था।",283,कला
शिरडी साईं बाबा,"शिरडी के साईं बाबा (सी. 1838? - 15 अक्टूबर 1918), जिन्हें शिरडी साईं बाबा के नाम से भी जाना जाता है, एक भारतीय आध्यात्मिक गुरु और फकीर थे, जिन्हें एक संत माना जाता था, उनके जीवनकाल के दौरान और उसके बाद हिंदू और मुस्लिम दोनों भक्त उनका सम्मान करते थे।
साईं बाबा के जीवन से प्राप्त वृत्तांतों के अनुसार, उन्होंने स्वयं की प्राप्ति पर बहुत जोर दिया, साथ ही नाशवान चीजों के प्रति प्रेम की अवधारणा की आलोचना की। उनकी शिक्षाएँ एक नैतिक संहिता के इर्द-गिर्द केंद्रित थीं जो प्रेम, क्षमा, दान, दूसरों की मदद, संतोष, आंतरिक शांति और भगवान और गुरु के प्रति समर्पण के गुणों का समर्थन करती थी। ये शिक्षाएँ आध्यात्मिक संतुष्टि का जीवन जीने का प्रयास करने वालों के लिए मूल्यवान मार्गदर्शन प्रदान करती हैं।
साईं बाबा ने धर्म या जाति के आधार पर भेदभाव की निंदा की। उनके हिंदू और मुस्लिम दोनों अनुयायी थे, लेकिन जब उन पर अपनी धार्मिक संबद्धता के बारे में दबाव डाला गया, तो उन्होंने खुद को एक के साथ पहचानने से इनकार कर दिया और दूसरे को छोड़ दिया।  उनकी शिक्षाओं में हिंदू धर्म और इस्लाम के तत्वों का मिश्रण था: उन्होंने जिस मस्जिद में रहते थे, उसे हिंदू नाम द्वारकामाई दिया,  हिंदू और मुस्लिम दोनों रीति-रिवाजों का अभ्यास किया, और उन शब्दों और आंकड़ों का उपयोग करना सिखाया जो दोनों परंपराओं से लिए गए थे। उनकी मृत्यु के तुरंत बाद लिखी गई जीवनी, श्री साईं सच्चरित्र के अनुसार, उनके हिंदू भक्त उन्हें हिंदू देवता दत्तात्रेय का अवतार मानते थे।",250,कला
"रोचेस्टर, न्यूयॉर्क","रोचेस्टर, संयुक्त राज्य अमेरिका में लेक ओंटारियो के दक्षिण में स्थित न्यूयॉर्क की मॉनरो काउंटी का एक शहर है। रोचेस्टर महानगरीय क्षेत्र, यू.एस. इंटरनल रिवेन्यू के अनुसार पूरे न्यूयॉर्क राज्य की दूसरी सबसे बड़ी क्षेत्रीय अर्थव्यवस्था है; पहला नंबर न्यूयॉर्क सिटी महानगरीय क्षेत्र का है। द वर्ल्ड्स इमेज सेंटर के नाम से मशहूर इस शहर को पहले द फ्लाउर सिटी और अभी हाल ही में द फ्लावर सिटी के नाम से भी जाना जाता था। यह मॉनरो काउंटी की काउंटी सीट है।
रोचेस्टर की शहरी आबादी लगभग 219,773 है जिससे यह न्यूयॉर्क शहर और बफेलो के बाद न्यूयॉर्क का तीसरा सबसे ज्यादा आबादी वाला शहर है। यह विशाल मेट्रोपोलिटन एरिया के केन्द्र में है जिसका विस्तार मॉनरो काउंटी से बाहर तक है और जिसमें मॉनरो काउंटी के अलावा गेनेसी काउंटी, लिविंगस्टन काउंटी, ओंटारियो काउंटी, ओरलियंस काउंटी और वेन काउंटी भी शामिल हैं। पश्चिमी न्यूयॉर्क क्षेत्र के इस हिस्से की आबादी 2000 की जनगणना के समय 1,037,831 थी। जुलाई 2005 तक इसकी आबादी थोड़ी बढ़कर 1,039,028 हो गई।
रोचेस्टर को प्लेसेस रेटेड ऑल्मनैक के 25वें संस्करण (2007) में 379 यू.एस. महानगरीय क्षेत्रों में छठवें 'सर्वाधिक रहनेयोग्य शहर' की रैंक दी गयी। रोचेस्टर क्षेत्र को एक्सपांशन मैनेजमेंट मैग्जीन के 2007 के अध्ययन में 1 मिलियन से अधिक आबादी वाले यू.एस. महानगरों में जीवन की समग्र गुणवत्ता के लिए शीर्ष रैंकिंग भी प्राप्त हुई।  उसी अध्ययन में एक्सपांशन मैनेजमेंट ने देश भर में इस क्षेत्र के पब्लिक स्कूलों को छठवां सर्वश्रेष्ठ दर्जा दिया।  2010 में फ़ोर्ब्स ने रोचेस्टर को परिवार बढ़ाने के लिए तीसरे सबसे अच्छे स्थान का दर्जा दिया। 
रोचेस्टर के वर्तमान मेयर रॉबर्ट डफी है जो पहले शहर के पुलिस चीफ थे। 2010 के आम चुनाव में वे अटार्नी जनरल एंड्रियू कुओमो द्वारा सफलतापूर्वक गवर्नर के ऑफिस के लिए चुने जाने के समय उनके साथी उम्मीदवार थे।",296,कला
मरुस्थलीकरण,"मरुस्थलीकरण ज़मीन का क्षरण है, जो शुष्क और अर्द्ध-नम क्षेत्रों में विभिन्न कारकों की वजह से होता है: जिनमें विविध जलवायु और मानवीय गतिविधियां भी शामिल है। मरुस्थलीकरण मुख्यतः मानव निर्मित गतिविधियों [उद्धरण चाहिए] के परिणाम स्वरूप होता है: विशेष तौर पर ऐसा अधिक चराई, भूमिगत जल के अत्यधिक इस्तेमाल और मानवीय एवं औद्योगिक कार्यों [उद्धरण चाहिए] के लिए नदियों के जल का रास्ता बदलने की वजह से है और यह सारी प्रक्रियाएं मूलतः अधिक आबादी [उद्धरण चाहिए] की वजह से संचालित होती हैं।
मरुस्थलीकरण का सबसे गहरा प्रभाव है जैव विविधता और उत्पादक क्षमता में कमी, उदाहरण के लिए संक्रमण से झाड़ियों से भरे ज़मीनों के गैर देशीय चरागाह [उद्धरण चाहिए] में तब्दील होना. उदाहरण के लिए, दक्षिणी कैलिफोर्निया के अर्द्ध-शुष्क क्षेत्रों में, कई तटीय वृक्षों और झाड़-झंखाड़ों वाले पारितंत्रों की जगह नियमित अंतराल पर आग की वापसी से गैर देशीय, आक्रामक घास भर गयी हैं। इसकी वजह से वार्षिक घास की ऐसी श्रृंखला पैदा हो सकती है जो कभी मूल पारितंत्र में पाये जाने वाले जानवरों को सहारा नहीं दे सकती[उद्धरण चाहिए]. मेडागास्कर की केंद्रीय उच्चभूमि के पठार [उद्धरण चाहिए] में, स्वदेशी लोगों द्वारा काटने और जलाने की कृषि पद्धति की वजह से पूरे देश का 10% हिस्सा मरुस्थलीकरण में तब्दील हो गया है[उद्धरण चाहिए].",207,कला
मुक्त सामग्री,"मुफ़्त सामग्री, मुफ़्त जानकारी, या मुफ़्त जानकारी, किसी भी प्रकार का कार्यात्मक क्रिया ,  कला का काम, या अन्य रचनात्मक सामग्री है जो मुफ़्त सांस्कृतिक कार्य की परिभाषा को पूर्ण करती है।
मुफ़्त सामग्री में सार्वजनिक डोमेन के सभी कार्य और वे कॉपीराइट कार्य भी शामिल हैं जिनके लाइसेंस ऊपर उल्लिखित स्वतंत्रता का सम्मान करते हैं और उन्हें कायम रखते हैं।  क्योंकि अधिकांश देशों में बर्न कन्वेंशन डिफ़ॉल्ट रूप से कॉपीराइट धारकों को उनकी रचनाओं पर एकाधिकार नियंत्रण प्रदान करता है, कॉपीराइट सामग्री को स्पष्ट रूप से मुक्त घोषित किया जाना चाहिए, आमतौर पर काम के भीतर से लाइसेंसिंग बयानों को संदर्भित या शामिल करके कार्य करना चाहिए।",108,कला
