title,content,word_count,topic
निर्भरता का सिद्धान्त,"अंतरराष्ट्रीय राजनीति में नैर्भर्य सिद्धान्त यह है कि संसाधन, निर्धन एवं अल्पविकसित देशों के परिधि से धनी देशों के केन्द्र की ओर प्रवाहित होते हैं और निर्धन देशों को और गरीब करते हुए धनी देशों को और धनी बनाते हैं। नैर्भर्य सिद्धान्त इस मूल मान्यता पर आधारित है कि राजनैतिक एवं आर्थिक कारकों के बीच एक गहन सम्बन्ध होता है। ये दोनों कारक परस्पर प्रभावित करते हैं तथा काफी हद तक आर्थिक कारकों के आधार पर राजनीति में महत्वपूर्ण बदलाव देखने को मिलते हैं।
नैर्भर्य सिद्धान्त मूल रूप से मार्क्सवाद से प्रभावित रहा है। मार्क्सवाद के साथ-साथ होबसन व लेनिन के साम्राज्यवाद की अवधारणा ने इसे और शक्तिशाली बना दिया है। परन्तु चुंकी मार्क्सवादी 'राज्य' के अस्तित्व को नहीं मानते इसीलिए इसे 'नव-मार्क्सवादी' अवधारणा मानना अधिक तर्कसंगत होगा। वैसे तो यह अवधारणा अन्तर्राष्ट्रीय राजनीति में 1950 के दशक से विद्यमान है, परन्तु 1970 के दशक से ज्यादा महत्वपूर्ण बन गई है। इस काल के अन्तर्राष्ट्रीय राजनीति के अध्ययन हेतु राजनीतिक-आर्थिक तत्वों में सम्बन्ध पर अधिक बल दिया जाने लगा है।
इस सिद्धान्त के मुख्य समर्थकों में फ्रांसेस सांडर्स, स्टुअर्ट हालैंड और ंंपांल बरान, पॉल स्वीजी, हेरी मैडगाफ, एंड्रि गुंडर फैंक, अग्रहीरी इमेनुअल, समीर अमीन, इमेनुअल वालरस्टेन आदि प्रमुख हैं।",199,समाजशास्त्र
भारतीय विधि,"भारतीय कानून, ब्रितानी कानून पर आधारित है। अंग्रेज़ो ने इसे पहली बार अपने शासनकाल के दौरान लागू किया। अंग्रेज़ो द्वारा लागू किये कई अधिनियम (acts) और अध्यादेश (ordinances) आज भी प्रभावशील हैं।

भारतीय संविधान के लेखन के दौरान इसमें आयरलैंड, संयुक्त राज्य अमेरीका, ब्रिटेन और फ्रांस के कानूनों को समाहित (synthesize) किया गया था। भारतीय कानून, संयुक्त राष्ट्र के मानवाधिकार और वातावरण संम्बधी दिशानिर्देशों के अनुरूप है। इसमें कुछ अंतरराष्ट्रीय कानूनों, जैसे बौधिक अधिकारों आदि, को भारत में लागू किया गया है।
भारतीय नागरिक कानून (Indian Civil Law) एक जटिल कानून है जिसमें प्रत्येक धर्म-विशेष के अपने कानून हैं। अधिकांश राज्यों में विवाह और तलाक के लिए पंजीकरण आवश्यक नहीं है। हिंदू, मुसलमान, ईसाई, सिक्ख व अन्य धर्मों के अपने कानून हैं। इसका अकेला अपवाद गोवा राज्य है जहां पुर्तगाली समान नागरिक संहिता प्रभावी है और सभी धर्मों के लिए विवाह, तलाक और (बच्चा) गोद लेने सम्बंधी एक जैसे कानून हैं",151,समाजशास्त्र
पितृसत्ता,"पितृसत्ता एक सामाजिक व्यवस्था है जिसमे पुरुषों की प्राथमिक सत्ता होती हैं यानी उन्हें समाज में उच्च माना जाता हैं। राजनैतिक नेतृत्व, नैतिक अधिकार, सामाजिक सम्मान, सम्पत्ति का नियंत्रण की भूमिकाओं में प्रबल होते हैं। परिवार के क्षेत्र में पिता या अन्य पुरुष महिलाओं और बच्चों के ऊपर अधिकार जमाते है। इस व्यवस्था में स्त्री तथा पुरुष को समाज द्वारा दिए गए कार्यो के अनुसार चलना पडता है। धर्म, समाज व रूढ़िवादी परम्पराएं पितृसत्ता को अधिक ताक़तवर बनाती हैं। सदियों से महिलाएं पितृसत्ता के कारण उत्पीड़ित हो रही हैं। पिता ही घर के ठेकेदार होते है पिता से ही घर होता है",102,समाजशास्त्र
सांस्कृतिक मानवशास्त्र,"सांस्कृतिक मानवशास्त्र (अंग्रेज़ी-Cultural anthropology) अथवा सांस्कृतिक नृतत्व विज्ञान नृविज्ञान की वह शाखा है जिसमें, किसी संकृति-समुदाय में रह रहे मानव, उनके व्यवहार और उनके सांकृतिक मानदंडो के स्वभाव, उद्भव और विकास का अध्ययन है।

मानवशास्त्र की दो प्रमुख अंग हैं-

शारीरिक मानवशास्त्र, तथा
सांस्कृतिक मानवशास्त्र
मनुष्य का प्राणिशास्त्रीय अध्ययन, उसका उद्भव एवं विकास, मानव-शरीर-रचना, प्रजनन शास्त्र एवं प्रजाति इत्यादि शारीरिक मानव शास्त्र के अंतर्गत हैं।",65,समाजशास्त्र
आदर्शवाद (अन्तरराष्ट्रीय सम्बन्ध),"फ्रांसीसी क्रांति (1789) व अमेरिकी क्रान्ति (1776) को अन्तरराष्ट्रीय सम्बन्धों में आदर्शवादी उपागम (Idealist Approach) की प्रेरणा माना गया है। इसके g^jeijrgg
प्रमुख समर्थक रहे हैं - कौण्डरसैट, वुडरो विल्सन, बटन फिल्ड, बनार्ड रसल आदि। इनके द्वारा एक आदर्श विश्व की रचना की गई है जो अहिंसा व नैतिक आधारों पर आधारित होगा व युद्धों को त्याग देगा।",58,समाजशास्त्र
रसायन विज्ञान का इतिहास,रसायन विज्ञान का इतिहास बहुत पुराना है। १००० ईसापूर्व में प्राचीन सभ्यताओं के लोग ऐसी प्राविधियों का प्रयोग करते थे जो बाद में रसायन विज्ञान की विविध शाखाएं बनीं।,29,समाजशास्त्र
उमा चक्रवर्ती,"उमा चक्रवर्ती एक भारतीय इतिहासकार और नारीवादी हैं जिन्होंने मिरांडा हाउस, दिल्ली विश्वविद्यालय में पढ़ाया था। उनकी छात्रवृत्ति बौद्ध धर्म, प्रारंभिक भारतीय इतिहास, 19वीं सदी के इतिहास और समकालीन मुद्दों पर केंद्रित थी। वह महिलाओं के आंदोलन और लोकतांत्रिक अधिकारों के आंदोलन से जुड़ी एक कार्यकर्ता भी रही हैं, जिसमें कई तथ्य-शोध समितियों में भाग लेना शामिल है, जिसमें 'गुजरात के लिए न्याय पर अंतर्राष्ट्रीय न्यायाधिकरण' शामिल है। वो भारत में नारीवादी इतिहास-लेखन की एक प्रमुख विद्वान हैं और उसे भारतीय महिला आंदोलन की 'संस्थापक माँ' कहा जाता है।",89,समाजशास्त्र
मीमेटिक्स,"मेमेटिक्स (memetics) डार्विन के विकासवाद के साथ समानता पर आधारित सूचना और संस्कृति का अध्ययन है। समर्थकों ने मेमोरिक्स को सांस्कृतिक जानकारी हस्तान्तरण के विकासवादी मॉडल के दृष्टिकोण के रूप में वर्णित किया है। मीमेटिक्स के आलोचक इसे 'अपरीक्षित', 'निराधार' या 'असत्य' मानते हैं। मेमेटिक्स बताता है कि एक विचार सफलतापूर्वक कैसे प्रचारित कर सकता है, लेकिन जरूरी नहीं कि एक अवधारणा तथ्यात्मक हो।
मेमे शब्द का अर्थ रिचर्ड डॉकिंस की 1976 की पुस्तक द सेल्फिश जीन में रखा गया था, लेकिन बाद में डॉकिंस ने अध्ययन के परिणामी क्षेत्र से खुद को दूर कर लिया। एक जीन के अनुरूप, मेम को ""संस्कृति की एक इकाई"" (एक विचार, विश्वास, व्यवहार का पैटर्न, आदि) के रूप में कल्पना की गई थी जो एक या अधिक व्यक्तियों के दिमाग में ""होस्ट"" है, और जो खुद को पुन: पेश कर सकता है। एक व्यक्ति के दिमाग से दूसरे व्यक्ति के दिमाग में कूदने की भावना। इस प्रकार एक विश्वास को अपनाने के लिए दूसरे को प्रभावित करने वाले व्यक्ति को एक नए मेजबान में खुद को पुन: पेश करने वाले विचार-प्रतिकारक के रूप में देखा जाता है। आनुवंशिकी के साथ, विशेष रूप से एक डॉकिंसियन व्याख्या के तहत, एक मेम की सफलता इसके मेजबान की प्रभावशीलता में योगदान के कारण हो सकती है।
यूज़नेट न्यूज़ग्रुप alt.memetics 1993 में 1990 के दशक के मध्य में शिखर पोस्टिंग वर्षों के साथ शुरू हुआ। 1997 से 2005 तक जर्नल ऑफ मेमेटिक्स को इलेक्ट्रॉनिक रूप से प्रकाशित किया गया था।",243,समाजशास्त्र
सरदारसिंहजी रावाजी राणा,"सरदारसिंहजी रावाजी राणा (जन्म 1870 - मृत्यु 1957), अक्सर एसआर राणा का संक्षेप में, भारतीय राजनीतिक कार्यकर्ता थे, पेरिस इंडियन सोसाइटी के संस्थापक सदस्य और भारतीय गृह नियम समिति के उपाध्यक्ष थे।",32,समाजशास्त्र
विशेषज्ञ प्रणाली,"कृत्रिम बुद्धि के सन्दर्भ में, विशेषज्ञ प्रणाली या विशेषज्ञ तन्त्र (expert system) उस कम्प्यूटर प्रणाली (या सॉफ्टवेयर) को कहते हैं जो किसी विशेषज्ञ मानव के निर्णय लेने की क्षमता जैसी क्षमता का प्रदर्शन करता है। विशेषज्ञ प्रणालियाँ जटिल समस्याओं को हल करने के लिए डिजाइन की गयी होतीं हैं और इसके लिए एक ज्ञान-भण्डार और मुख्यतः 'यदि-तो  स्टेटमेन्ट' के सहारे तर्क करते हुए प्रोग्राम बनाया जाता है (न कि परम्परागत 'विधि-सम्बन्धी' (प्रोसीजरल) कोड के द्वारा) । १९७० के दशक में पहले पहल इस तरह की प्रणालियाँ निर्मित की गयीं थीं। विशेषज्ञ प्रणालियाँ ही सबसे पहली सफल कृत्रिम बुद्धि वाले सॉफ्टवेयरों बने। (कृत्रिम बुद्धि सॉफ्तवेयर अन्य प्रकार से भी बनए जाते हैं।)
किसी विशेषज्ञ प्रणाली के मुख्यतः दो भाग होते हैं- ज्ञान-भण्डार (नॉलेज बेस) तथा उससे निष्कर्ष निकालने वाला 'इंजन' (जिसे 'shell' कहते हैं)। ज्ञान-भण्डार के अन्तर्गत तथ्य और नियम आते हैं।",141,समाजशास्त्र
चिरसम्मत यांत्रिकी का इतिहास,इस अनुच्छेद का सम्बंध चिरसम्मत यांत्रिकी के इतिहास से है।,10,समाजशास्त्र
विकासवाद का इतिहास,"विकासवाद (Evolutionary thought) की धारणा है कि समय के साथ जीवों में क्रमिक-परिवर्तन होते हैं। इस सिद्धान्त के विकास का लम्बा इतिहास है। १८वीं शती तक पश्चिमी जीववैज्ञानिक चिन्तन में यह विश्वास जड़ जमाये था कि प्रत्येक जीव में कुछ विलक्षण गुण हैं जो बदले नहीं जा सकते। इसे इशेंसियलिज्म (essentialism) कहा जाता है। पुनर्जागरण काल में यह धारणा बदलने लगी।
१९वीं शती के आरम्भ में लैमार्क ने अपना विकासवाद का सिद्धान्त दिया जो क्रम-विकास (evolution) से सम्बन्धित प्रथम पूर्णत: निर्मित वैज्ञानिक सिद्धान्त था। सर जे . डब्ल्यू डासन कहते हैं कि ' विज्ञान को बन्दर और मनुष्य के बीच की आकृति का कुछ भी पता नहीं है । मनुष्य की प्राचीनतम अस्थियाँ भी वर्तमान मनुष्य जैसी ही हैं । इनसे उस विकास का कुछ पता नहीं लगता , जो इस मनुष्य शरीर के पहले हुआ था । '",139,समाजशास्त्र
तर्कशास्त्र का इतिहास,"अनेकों संस्कृतियों ने तर्क करने की सूक्ष्मतिसूक्ष्म प्रणाली अपनायी तथा मानव के सम्पूर्ण चिन्तन में तर्क उपस्थित रहा है। किन्तु तर्क करने की स्पष्ट और विधिवत प्रणाली मुख्यत: और मूलत: भारत, चीन और यूनान में ही विकसित हुई। इनमें से केवल भारतीय और यूनानी तर्क परिपाटी ही आधुनिक काल तक बिना व्यवधान के विकास करती रही।",56,समाजशास्त्र
खगोलिकी का इतिहास,"सभी प्राकृतिक विज्ञानों में से खगोलिकी (Astronomy) सबसे प्राचीन है। इसका आरम्भ प्रागैतिहासिक काल से हो चुका था तथा प्राचीन धार्मिक एवं मिथकीय कार्यों में इसके दर्शन होते हैं। खगोलिकी के साथ फलित ज्योतिष (astrology) का बहुत ही नजदीकी सम्बन्ध रहा है और आज भी जनता दोनो को अलग नहीं कर पाती। खगोलिकी (सिद्धान्त ज्योतिष) और फलित ज्योतिष केवल कुछ शताब्दी पहले ही एक-दूसरे से अलग हुए हैं।
प्राचीन खगोलविद तारों और ग्रहों के बीच के अन्तर को समझते थे। तारे शताब्दियों तक लगभग एक ही स्थान पर बने रहते हैं जबकि ग्रह कम समय में भी अपने स्थान से हटे हुए दिख जाते हैं।",105,समाजशास्त्र
भौमिकी का इतिहास,"भौमिकी का इतिहास बहुत पुराना है। शायद 'पृथ्वी की उत्पत्ति' सम्बन्धी विचारों को सबसे पहला भूवैज्ञानिक विचार कहा जा सकता है।

सन् १७४९ में गार्गिस-लूई लेक्लर्क (Georges-Louis Leclerc) ने प्रदर्शित किया कि पृथ्वी की आयु बाइबल में वर्णित आयु से कई गुना अधिक है।
स्कॉटलैण्ड के भूविज्ञानी जेम्स हट्टन (James Hutton) का दृढ मत था कि जिन प्रक्रमों ने पृथ्वी को अब तक बदला है वे ही अब भी इसे बदल रहे हैं।
उन्नीसवीं शती में भूविज्ञान के क्षेत्र में बहुत प्रगति हुई। सन् १८१५ में विलियम स्मिथ ने विश्व का प्रथम भूवैज्ञानिक मानचित्र बनाया। इसमें उन्होने 'स्ट्राटा' के अपने ज्ञान का उपयोग किया।
चार्ल्स लेल (Charles Lyell) उस समय के सबसे विख्यात शैक्षिक भूवैज्ञानिक थे। उन्होने बताया कि भिन्न-भिन्न स्ट्राटा, भिन्न-भिन्न जीवाश्मों से संबन्धित हैं।
डार्विन के समय तक अधिकांश भूवैज्ञानिक ज्ञान जीवाश्मों के अध्ययन से प्राप्त ज्ञान ही था। इसलिये डार्विन के विकासवाद ने आधुनिक भूवैज्ञानिक चिन्तन में महत्वपूर्ण भूमिका निभाई।
बीसवीं शती में भूवैज्ञानिक पृथ्वी की आयु और अधिक बताने लगे। जहाँ पहले मिलियन वर्षों की बात होती थी, अब 'बिलियन वर्षों' की बात होने लगी। वैगनर (Wagner) के 'महाद्वीपीय शिफ्ट' के सिद्धान्त को बल मिला।",189,समाजशास्त्र
आंद्रे बेटियेले,आंद्रे बेटियेले  को भारत सरकार द्वारा सन २००५ में साहित्य एवं शिक्षा के क्षेत्र में पद्म भूषण से सम्मानित किया था। ये दिल्ली राज्य से हैं।,26,समाजशास्त्र
