title,content,word_count,topic
"कैलिफोर्निया विश्वविद्यालय, लॉस एंजिल्स","कैलिफोर्निया विश्वविद्यालय, लॉस एंजिल्स  (यूसीएलए) एक सरकारी अनुसंधान विश्वविद्यालय है जो वैस्टवुड में स्थित है। यह जगह लॉस एंजिल्स, कैलिफोर्निया, यूनाइटेड स्टेट्स के पड़ोस में स्थित है। इसकी स्थापना 1919 में हुई थी और यह कैलिफोर्निया विश्वविद्यालय से सम्बद्ध दस परिसरों में दूसरा सबसे पुराना परिसर है। यूसीएलए विविध विषयों में 300 से अधिक पूर्वस्नातक और स्नातक डिग्री कार्यक्रम प्रस्तावित करता है और यूनाइटेड स्टेट्स और सम्पूर्ण विश्व के तकरीबन 26,000 पूर्व स्नातक और 11,000 स्नातक छात्र नामांकन करता है।
यह विश्वविद्यालय 5 पूर्व स्नातक महाविद्यालयों, 7 व्यावसायिक विद्यालयों और 5 पांच पेशेवर स्वास्थ्य विज्ञान विद्यालयों में विभाजित है। 
ग्यारह नोबेल पुरस्कार विजेता इस विश्वविद्यालय से अध्यापक, शोधकर्ता अथवा भूतपूर्व छात्रों के रूप में जुड़े रहे हैं, 37 लोग नेशनल एकेडमी ऑफ साइंसेस में चुन लिए गए, 20 लोग नेशनल एकेडमी ऑफ इंजीनियरिंग और 97 लोग अमेरिकन अकादमी ऑफ आर्ट्स एंड साइंसेस में चुन लिए गए। 
यूसीएलए को लगातार महाविद्यालयों और विश्विद्यालयों की रैंकिंग में उच्च स्थान मिला है। इसकी गणना देश के शीर्ष 10 विद्यालयों में होती है और इसे अधिकतम संकाय पुरस्कार मिलते हैं। वैज्ञानिक सूचना संस्थान के अनुसार अपने शोधकार्य की वजह से यहाँ के अध्यापकों के कार्य को अधिकतम लोग अपने कार्य में उल्लेख करते हैं। 
यूसीएलए के छात्र-एथलीट ब्रुइंस के रूप में प्रतियोगिताओं में भाग लेते हैं। पैसिफिक-10 सम्मलेन के सदस्य के रूप में 2010 तक, ब्रुइंस ने 125 राष्ट्रीय चैंपियनशिप जीती है जिसमे 106 एनसीसीए (एनसीएए) चैंपियनशिप भी शामिल हैं, इतनी चैंपियनशिप किसी भी दूसरे विश्वविद्यालय ने कभी नहीं। जीती.",246,मनोविज्ञान
मंगलाप्रसाद पारितोषिक,"मंगलाप्रसाद पारितोषिक (सन् १९२३ से आरंभ) हिन्दी साहित्य सम्मेलन, प्रयाग के द्वारा साहित्य के क्षेत्र में विशेष योगदान देने वाले व्यक्ति को प्रदान किया जाता है। इसकी स्थापना पुरुषोत्तम दास टंडन ने १९२३ ई॰ में की थी।",37,मनोविज्ञान
कृति शेट्टी,कृति शेट्टी (जन्म 21 सितंबर 2003)  एक भारतीय अभिनेत्री हैं जो मुख्य रूप से तेलुगु फिल्मों में दिखाई देती हैं। उन्होंने व्यावसायिक रूप से सफल फिल्म उप्पेना (2021) से अपनी शुरुआत की।  उसने एक फिल्मफेयर अवार्ड साउथ और एक साईमा (SIIMA) अवार्ड जीता है।,44,मनोविज्ञान
महर्षि अरविन्द का शिक्षा दर्शन,"अरविन्द ने भारतीय शिक्षा चिन्तन में महत्त्वपूर्ण योगदान किया। उन्होंने सर्वप्रथम घोषणा की कि मानव सांसारिक जीवन में भी दैवी शक्ति प्राप्त कर सकता है। वे मानते थे कि मानव भौतिक जीवन व्यतीत करते हुए तथा अन्य मानवों की सेवा करते हुए अपने मानस को `अति मानस' (supermind) तथा स्वयं को `अति मानव' (Superman) में परिवर्तित कर सकता है। शिक्षा द्वारा यह संभव है। 
आज की परिस्थितियों में जब हम अपनी प्राचीन सभ्यता, संस्कृति एवं परम्परा को भूल कर भौतिकवादी सभ्यता का अंधानुकरण कर रहे हैं, अरविन्द का शिक्षा दर्शन हमें सही दिशा का निर्देश करता हैं। आज धार्मिक एवं अध्यात्मिक जागृति की नितान्त आवश्यकता है। वी आर तनेजा के शब्दों में-

""अरविन्द का शिक्षा-दर्शन लक्ष्य की दृष्टि से आदर्शवादी, उपागम की दृष्टि से यथार्थवादी, क्रिया की दृष्टि से प्रयोजनवादी तथा महत्त्वाकांक्षा की दृष्टि से मानवतावादी है। हमें इस दृष्टिकोण को शिक्षा में अपनाना चाहिए।""",145,मनोविज्ञान
एडिडास,"एडिडास एजी (Adidas AG) FWB: ADS) खेल का सामान और कपड़े बनाने वाली एक जर्मन कम्पनी है, यह एडिडास समूह की मूल कम्पनी है, जिसमें खेल का साजो सामान बनाने वाली कम्पनी रिबॉक, गोल्फ कम्पनी (एशवर्थ सहित) और रोकपोर्ट शामिल हैं। 
खेल के जूतों के अलावा, कम्पनी अन्य उत्पादों का निर्माण भी करती है जैसे बैग, शर्ट, घड़ियां, चश्मे और खेल एवं कपड़ों से सम्बंधित अन्य सामान. यह यूरोप में खेल का साजो सामान बनाने वाली सबसे बड़ी कम्पनी है और दुनिया में अपने अमेरिकी प्रतिस्पर्धी नाइकी के बाद खेल का सामान बनाने वाली दूसरी सबसे बड़ी कम्पनी है।
एडिडास की स्थापना 1948 में एडोल्फ ""एडी"" डास्लर के द्वारा की गयी थी। इसकी स्थापना गेब्रदर डास्लर शूफैब्रिक और उनके बड़े भाई रुडोल्फ के बीच विभाजन के बाद हुई थी। रुडोल्फ ने बाद में प्यूमा की स्थापना की, जो प्रारंभ में एडिडास की प्रतिद्वंद्वी थी। 
1949 में पंजीकृत, एडिडास वर्तमान में प्यूमा के साथ जर्मनी के हरजोनाउराच में स्थित है। 
कंपनी के कपड़ों और जूतों के डिजाइन में आमतौर पर तीन समानांतर लाइनें होती हैं और इसी प्रतिरूप को एडिडास के वर्तमान अधिकारिक लोगो में भी शामिल किया गया है। 
""तीन धारियों"" को 1951 में फिन्निश खेल कम्पनी कार्हू स्पोर्ट्स से ख़रीदा गया था। 
कम्पनी का राजस्व 2009 के लिए €10.38 बिलियन सूचीबद्ध किया गया और 2008 के लिए € 10.80 सूचीबद्ध किया गया।",223,मनोविज्ञान
जोकर (द डार्क नाइट),"जोकर (अंग्रेज़ी: Joker) एक काल्पनिक चरित्र है, जो क्रिस्टोफर नोलन की २००८ की सुपरहीरो फिल्म द डार्क नाइट में मुख्य खलनायक के रूप में प्रदर्शित हुआ है। डीसी कॉमिक्स के इसी नाम के एक चरित्र पर आधारित जोकर का अभिनय ऑस्ट्रेलियाई अभिनेता हीथ लेजर ने किया था। जोकर एक मनोरोगी जन-हत्यारा है, जिसके पास हास्य के एक संवेदनाशील भावना है, और वह गौथम नगर को अपराध से मुक्ति दिलाने के बैटमैन (क्रिश्चियन बेल), जेम्स गॉर्डन (गैरी ओल्डमैन) और हार्वे डेंट (हारून एख्हार) के प्रयासों को कमजोर करने के अपने प्रयासों के लिए जाना जाता है। यह चरित्र अव्यवस्था, अराजकता और जुनून इत्यादि विषयों का प्रतीक है; पूरी फिल्म के दौरान वह अपराध के माध्यम से सामाजिक व्यवस्था को उथल-पुथल करते रहने की इच्छा व्यक्त करता है, और बैटमैन के साथ अपने संघर्ष से ही खुद को परिभाषित करता है।
चरित्र की लेजर की व्याख्या विशेष रूप से ग्राफिक उपन्यास बैटमैन: द किलिंग जॉक और आर्कम एसाइलम: ए सीरियस हाउस ऑन सीरियस अर्थ से प्रभावित होती है। फिल्म में चरित्र ने अपना पारंपरिक रंग पैलेट पहना है, जबकि उसके चेहरे पर जोकर का मेकअप है, और चेहरे पर ग्लासगो स्माइल के निशान हैं। जोकर के रूप में लेजर का चयन शुरू में विवादास्पद माना गया था, और वह इस भूमिका के लिए अपेक्षित विकल्प नहीं थे।
जोकर को लेजर का सबसे बेहतरीन प्रदर्शन माना जाता है; और उन्होंने खुद इसे अपने सबसे सुखद पात्र के रूप में माना है। एक आकस्मिक दवा की अत्यधिक मात्रा लेने के कारण लेजर की मृत्यु के छह महीने बाद जुलाई २००८ में जब फिल्म को रिलीज़ किया गया था, तो उनका यह प्रदर्शन रातों-रात एक सनसनी बन गया, और उन्हें सार्वभौमिक प्रशंसा के साथ साथ मरणोपरांत कई पुरस्कार प्राप्त हुए, जिनमें से एक सर्वश्रेष्ठ सहायक अभिनेता के लिए अकादमी पुरस्कार भी था।",297,मनोविज्ञान
प्रौद्योगिकी इंजीलवादी,"प्रौद्योगिकी इंजीलवादी एक ऐसे व्यक्ति को कहते हैं जो किसी दी गई तकनीक के लिए महत्वपूर्ण समर्थन का निर्माण करता है, और फिर उसे एक ऐसे बाजार में तकनीकी मानक के रूप में स्थापित करता है जो नेटवर्क प्रभावों के अधीन है। इंजीलवाद शब्द धार्मिक मुद्दों में कहे जाने वाले इंजीलवाद से लिया गया है क्योंकि किसी धर्म की तरह यह भी किसी विशेष अवधारणा के बारे में जानकारी साझा करने और दूसरे लोग उस अवधारणा को अपना ले, इस इरादे से बनाया जाता है। यह आमतौर पर एक तकनीक के संभावित उपयोगों और लाभों को प्रदर्शित करके पूरा किया जाता है ताकि दूसरों को यह समझने में मदद मिल सके कि वे इसे अपने लिए कैसे उपयोग कर सकते हैं।",121,मनोविज्ञान
विश्वरूपम,"विश्वरूपम एक भारतीय जासूसी रोमांचक फिल्म है, जिसका निर्माण हिन्दी और तमिल भाषा में किया गया है। इस फिल्म का अनुवाद तेलुगू भाषा में किया गया है। इस फिल्म में कमल हासन मुख्य किरदार निभा रहे हैं। यह फिल्म 25 जनवरी 2013 को सिनेमाघरों में प्रदर्शित की गई थी।",49,मनोविज्ञान
गुरजोत सिंह कलेर,"गुरजोत सिंह कलेर एक भारतीय पुलिस अधिकारी, लेखक और गायक हैं, जो 2018 में प्रकाशित एक बेस्ट सेलिंग पुस्तक, न्यू इंडिया - द रियलिटी रीलोडेड के लेखक हैं। वह पंजाब पुलिस में पुलिस अधीक्षक (एसपी) के रूप में सेवारत हैं और वर्तमान में, वे यूनाइटेड किंगडम में डिजिटल पुलिसिंग के क्षेत्र में 'एवन एवं समरसेट पुलिस बल' के साथ काम कर रहे हैं।
उन्होंने कई गानों के लिए आवाज दी है, जिनमे माय हीरो फ़ार्मर,दिल से सलाम, बंदेया आदि शामिल है जिसे टाइम्स म्यूजिक ने जारी किया है।",88,मनोविज्ञान
गुणात्मक अनुसंधान,"साँचा:Sociology

गुणात्मक अनुसंधान (Qualitative research) कई अलग शैक्षणिक विषयों में विनियोजित, पारंपरिक रूप से सामाजिक विज्ञान, साथ ही बाज़ार अनुसंधान और अन्य संदर्भों में जांच की एक विधि है। गुणात्मक शोधकर्ताओं का उद्देश्य मानवीय व्यवहार और ऐसे व्यवहार को शासित करने वाले कारणों को गहराई से समझना है। गुणात्मक विधि निर्णय के न केवल क्या, कहां, कब की छानबीन करती है, बल्कि क्यों और कैसे को खोजती है। इसलिए, बड़े नमूनों की बजाय अक्सर छोटे पर संकेंद्रित नमूनों की ज़रूरत होती है।
गुणात्मक विधियां केवल विशिष्ट अध्ययन किए गए मामलों पर जानकारी उत्पन्न करती हैं और इसके अतिरिक्त कोई भी सामान्य निष्कर्ष केवल परिकल्पनाएं (सूचनात्मक अनुमान) हैं। इस तरह की परिकल्पनाओं में सटीकता के सत्यापन के लिए मात्रात्मक पद्धतियों का प्रयोग किया जा सकता है।",125,मनोविज्ञान
टेड बन्डी,"थिओडोर रॉबर्ट बन्डी (पैदाइश: बतौर थिओडोर रॉबर्ट कॉवेल; 24 नवंबर 1946 – 24 जनवरी 1989) एक अमेरिकी सीरियल किलर और शवप्रेमी थे जिन्होंने 1970 के दशक के दौरान, और मुमकिन है कि उससे पहले भी, कई जवान औरतों और लड़कियों का अपहरण, बलात्कार, और ख़ून किया था। एक दशक से ज़्यादा वक़्त तक इनकार करने के बाद, 1989 में सज़ा-ए-मौत पर अमल होने से पहले उन्होंने 30 क़त्ल कबूल किए जो उन्होंने सात राज्यों में 1974 और 1978 के बीच करे थे। उनके शिकारों की असली गिनती अनजान है और मुमकिन है कि ज़्यादा हो।",95,मनोविज्ञान
वैज्ञानिक क्रांति,"वैज्ञानिक क्रांति उस समयावधि को इंगित करती है जब भौतिकी, खगोलशास्त्र, जीवविज्ञान, मानव शरीररचना, रसायन विज्ञान एवं अन्य विज्ञानों की प्रगति ने पुराने सिद्धन्तों को अस्वीकर कर दिया। इस प्रकार आधुनिक विज्ञान की नींव पड़ी। वैज्ञानिक क्रान्ति की धारणा को मानने वालों का विचार है कि यूरोप के पुनर्जागरण का अन्तिम काल से वैज्ञानिक क्रांति आरम्भ हुई और १८वीं शताब्दी के अन्तिम चरण तक चली। इस प्रकार वैज्ञानिक क्रान्ति ने यूरोपीय ज्ञानोदय को प्रभावित किया।
किन्तु सातत्य सिद्धान्त में विश्वास करने वाले बहुत से लोगों का विश्वास है कि इस प्रकार की कोई क्रान्ति नहीं हुई बल्कि प्राचीन और मध्य काल से वैज्ञानिक विकास की जो धारा चली थी वही अपनी सहज गति से आगे बढती रही।",117,मनोविज्ञान
डेसमंड टूटू,"डेसमंड्आ मपीलो टूटू (जन्म ७ अक्टूबर १९३१ - 26 दिसंबर 2021।) दक्षिण अफ्रीकी समाजसेवी, राजनेता एवं केप टाउन शहर के आर्चबिशप हैं।
इन्हें [[ २००५[५] ]] में भारत सरकार द्वारा गाँधी शांति पुरस्कार से सम्मानित किया गया था।",38,मनोविज्ञान
लोक प्रशासन का इतिहास,"एक व्यवस्थित अध्ययन के रूप में लोक-प्रशासन का विकास अभी नया ही है। लोक-प्रशासन के शैक्षिक अध्ययन का प्रारम्भ करने का श्रेय वुडरो विल्सन को जाता है जिसने १८८७ में प्रकाशित अपने लेख ‘द स्टडी ऑफ ऐडमिनिस्ट्रेशन' में इस शास्त्र के वैज्ञानिक आधार को विकसित करने की आवश्यकता पर बल दिया। इस लेख में राजनीति तथा प्रशासन के बीच स्पष्ट भिन्नता दिखाई गई और घोषित किया गया कि प्रशासन की राजनीति से दूर रहना चाहिए। इसी को तथाकथित ‘राजनीति-प्रशासन-द्विभाजन’ कहते हैं।
लोक प्रशासन का इतिहास निम्नलिखित 5 चरणों में विभाज्य है-",91,मनोविज्ञान
