title,content,word_count,topic
लंदन में पर्यटन,"लंदन दुनिया के अग्रणी पर्यटन स्थलों में से एक है, इस शहर में कई प्रसिद्द पर्यटक आकर्षण के केंद्र बिंदु हैं। लंदन में हर साल लगभग 15 मिलियन से अधिक अंतर्राष्ट्रीय पर्यटक आते हैं, इस दृष्टि से पर्यटकों के द्वारा दुनिया के सबसे ज्यादा अंतर्राष्ट्रीय दौरे यहीं पर किये जाते हैं। लंदन के लिए पर्यटन बोर्ड कहा जाता है लंदन पर जाएँ. ब्रिटेन और लंदन में विजिटर सेंटर पिकाडिली सर्कस के पास, लोवर रिगेंट स्ट्रीट पर स्थित है।",78,कला
लैरी पेज,"लॉरेंस ""लैरी"" पेज (जन्म 26 मार्च 1973) एक अमेरिकी कंप्यूटर वैज्ञानिक और उद्योगपति हैं, जिन्होंने सर्गी ब्रिन के साथ मिलकर गूगल इंक. की सह-स्थापना की। वे दोनों अक्सर ही ""Google Guys"" के नाम से जाने जाते हैं। फ़ोर्ब्स के मुताबिक बर्तमान वे दुनिया के 24वें सबसे धनी व्यक्ति हैं, जिनकी 2010 में कुल निजी संपत्ति US$17.5 बिलियन है।",58,कला
राष्ट्रीय रक्षा अकादमी (भारत),"राष्ट्रीय रक्षा अकादमी, भारतीय सशस्त्र सेना की एक संयुक्त सेवा प्रशिक्षण अकादमी है, जहां तीनों सेवाओं, थलसेना, नौसेना और वायु सेना के कैडेटों को उनके संबंधित सेवा अकादमी के पूर्व-कमीशन प्रशिक्षण में जाने से पहले, एक साथ प्रशिक्षित किया जाता है। यह महाराष्ट्र में पुणे के करीब खडकवासला में स्थित है।
जब से अकादमी की स्थापना हुई है तब से एनडीए के पूर्व छात्रों ने सभी बड़े संघर्षों का नेतृत्व किया है जिसमें भारतीय थलसेना को कार्यवाही के लिए आमंत्रित किया जाता रहा है। पूर्व प्रशिक्षित छात्रों में 3 परमवीर चक्र प्राप्तकर्ता और 12 अशोक चक्र प्राप्तकर्ता शामिल हैं। साथ ही यहां से स्नातक हुए 27 अधिकारी आगे चलकर भारतीय सशस्त्र सेनाओं (थलसेना, नौसेना एवं वायुसेना) के सेनाध्यक्ष के पद पर सेवारत रह चुके हैं।",125,कला
कैसानोवा के प्यार,"कैसानोवा या कैसानोवा का प्यार आलेक्सांद्र वोल्कोफ द्वारा निर्देशित और इवान मोज़्झुखिन, सुज़ैन बियानचेती और डायना कैरेन द्वारा अभिनीत एक १९२७ की फ्रांसीसी ऐतिहासिक नाटकीय फिल्म है। फिल्म जियाकोमो कैसानोवा (१७२५-१७९८) के जीवन और रोमांच को चित्रित करती है। फिल्म से जुड़े कलाकारों में से कई रूसी प्रवासी थे जो रूसी क्रांति के बाद फ्रांस में बस गए थे।",59,कला
सेवाभिमुख आर्किटेक्चर (Service-oriented architecture),"कम्प्यूटिंग में, सेवाभिमुख आर्किटेक्चर (सर्विस ओरिएंटेड आर्किटेक्चर - SOA) की कई भिन्न परिभाषाएं हैं, जिनमें से कुछ सार्वजनिक रूप से चर्चित है। SOA सिद्धांतों के एक समुच्चय या ऐसी नियंत्रक अवधारणाओं को उपलब्ध कराने का एक प्रयास है जिनका उपयोग सिस्टम के विकास और एकीकरण की प्रवास्थाओं के दौरान किया जाता है। 

ऐसा आर्किटेक्चर उन भिन्न व्यापार डोमेन के सन्दर्भ में इन्टरोपेरेबल सेवाओं (interoperable services) के रूप में पैकेज क्रियाशीलता के लिए प्रयास करता हैं, जो इसका प्रयोग करते हैं। एक कंपनी के कईं विभाग या विभिन्न संगठन एकीकृत हो सकते हैं या ऐसी सेवाओं का प्रयोग कर सकते हैं-चाहे उनके निजी ग्राहक सिस्टम काफी अलग हों - फिर भी सोफ्टवेयर मोड्यूल एक सेवा के रूप में उपलब्ध हो सकते हैं। SOA सोफ्टवेयर मोड्यूल एकीकरण के अन्य प्रकारों को विकसित करने के का एक प्रयास है। एक API को परिभाषित करने के बजाय, SOA इंटरफेस को प्रोटोकोल और क्रियाशीलता के सन्दर्भ में परिभाषित करता है। 
एक अंतिम बिंदु (endpoint) ऐसे एक SOA क्रियान्वयन के लिए एक प्रवेश बिंदु है।

सर्विस ओरिएंटेशन के लिए ऑपरेटिंग सिस्टम में सेवाओं के ढीले संयोजन (loose coupling) की आवश्यकता होती है और अन्य तकनीकों की आवश्यकता होती है जो अनुप्रयोगों के अंतर्गत आती हैं। SOA कार्यों को विभेदित इकाइयों, या सेवाओं में अलग करता है, जिसे विकासकर्ता एक नेटवर्क में उपलब्ध करता है, ताकि उपयोगकर्ता उन्हें अनुप्रयोगों के उत्पादन में संयोजित और पुनः उपयोग कर सके. एक सेवा से दूसरी सेवा को डेटा को पास करके या दो या अधिक सेवाओं के बीच एक गतिविधि के समन्वय के द्वारा ये सेवाएं एक दूसरे के साथ संचार करती हैं।
SOA की परिकल्पना सातत्य के एक प्रकार के रूप में की जा सकती है, जो की वितरित कम्प्यूटिंग या मॉड्यूलर प्रोग्रामिंग के विपरीत है।",287,कला
घोस्ट इन द शेल,"घोस्ट इन द शेल (जापानी: 攻殻機動隊, हेपबर्न: कोकाकू किदोताई, शाब्दिक रूप से ""मोबाइल आर्मर्ड रायट पुलिस"") मासमुन शिरो द्वारा लिखित और सचित्र एक जापानी मंगा है, जिसने इसी नाम की मीडिया फ्रेंचाइजी को जन्म दिया। इसे पहली बार 1989 से 1991 तक कोडनशा की सेनेन मंगा पत्रिका यंग मैगज़ीन ज़ोकन काइज़ोकुबन में द घोस्ट इन द शेल के उपशीर्षक के तहत क्रमबद्ध किया गया था, और एक टैंकोबोन वॉल्यूम में संकलित किया गया था। 21वीं सदी के मध्य में स्थापित, यह काल्पनिक प्रति-साइबर आतंकवादी संगठन सार्वजनिक सुरक्षा धारा 9 की कहानी बताता है, जिसका नेतृत्व नायक मेजर मोटोको कुसानागी करते हैं।
मंगा के बाद दो सीक्वेल आए, घोस्ट इन द शेल 1.5: ह्यूमन-एरर प्रोसेसर, और घोस्ट इन द शेल 2: मैन-मशीन इंटरफ़ेस।
मंगा में डिजाइन और दर्शन पर शिरो के विचार शामिल हैं, जिसमें समाजशास्त्रीय मुद्दे, तकनीकी प्रगति के परिणाम और चेतना और पहचान की प्रकृति पर विषय शामिल हैं। अवधारणा कला और शेल में भूत की दुनिया का विवरण देने के लिए कई कला पुस्तकें जारी की गई हैं। तीनों खंडों को मुख्यतः सकारात्मक समीक्षाएँ मिली हैं।",178,कला
राष्ट्रीय पाठ्यचर्या रूपरेखा- 2005,"राष्ट्रीय पाठ्यचर्या की रूपरेखा 2005 (NCF 2005) में चौथे राष्ट्रीय पाठ्यचर्या की रूपरेखा द्वारा 2005 में प्रकाशित है शैक्षिक अनुसंधान और प्रशिक्षण की राष्ट्रीय परिषद (NCERT) में भारत। इसके पूर्ववर्षी 1975, 1988 और 2000 में प्रकाशित हुए थे।
NCF 2005 भारत में स्कूलों के लिए पाठ्यक्रम,  पाठ्यपुस्तकों और शिक्षण प्रथाओं के लिए एक दिशानिर्देश के रूप में कार्य करता है। NCF 2005  ने शिक्षा पर पिछली सरकार की रिपोर्टों, जैसे लर्निंग विदाउट बर्डन  और नेशनल पॉलिसी ऑफ़ एजुकेशन 1986-1992,  और फ़ोकस ग्रुप डिस्कशन पर अपनी नीतियों को आधारित किया है ।  कई विचार-विमर्श के बाद NCF 2005 के लिए इनपुट प्रदान करने के लिए 21 नेशनल फोकस ग्रुप पोजिशन पेपर्स प्रकाशित किए गए हैं। NCF 2005 और इसके ऑफशूट पाठ्यपुस्तकों ने प्रेस में विभिन्न रूपों की समीक्षा की है। 
इसके मसौदा दस्तावेज की केंद्रीय शिक्षा सलाहकार बोर्ड (CABE) ने आलोचना की थी।  2008  फरवरी 20  में, एनसीईआरटी के निदेशक कृष्ण कुमार ने भी एक साक्षात्कार में दस्तावेज़ के सामने आने वाली चुनौतियों पर चर्चा की।  Of  NCF 2005 के विषयों में भारत के सभी शैक्षणिक संस्थान शामिल हैं। उदाहरण के लिए, इसकी कई सिफारिशें ग्रामीण स्कूलों पर केंद्रित हैं। इसके आधार पर पाठ्यक्रम और पाठ्यपुस्तकों का उपयोग सभी सीबीएसई स्कूलों और कई राज्य स्कूलों द्वारा किया जा रहा है । 
NCF 2005 को 22 भाषाओं में अनुवादित किया गया है और 17 राज्यों में पाठ्यक्रम को प्रभावित किया है। एनसीईआरटी ने सभी राज्यों को अपनी स्थानीय भाषा में एनसीएफ को बढ़ावा देने के लिए, 10,00,000 का अनुदान प्रदान किया और इसके वर्तमान पाठ्यक्रम की तुलना प्रस्तावित सिलेबस से की, ताकि भविष्य में सुधार की योजना बनाई जा सके। इस अभ्यास को शैक्षिक अनुसंधान और प्रशिक्षण (एससीईआरटी) और जिला शिक्षा संस्थानों और प्रशिक्षण (डाइट) के लिए राज्य परिषदों के सहयोग से निष्पादित किया जा रहा है।",295,कला
डाउनटाउन दुबई,"डाउनटाउन दुबई या द दुबई डाउनटाउन , दुबई , संयुक्त अरब अमीरात में एक बड़े पैमाने पर, मिश्रित उपयोग परिसर है । दुबई डाउनटाउन एमार प्रॉपर्टीज द्वारा बनाया गया था। 2000 से पहले, जगह को उम्म अल तारिफ कहा जाता था। यह बुर्ज खलीफा , दुबई मॉल , और दुबई फाउंटेन सहित शहर के कुछ सबसे बड़े स्थलों का घर है । यह 2 वर्ग किलोमीटर (0.77 वर्ग मील) के क्षेत्र को कवर करता है, पूरा होने पर 20 बिलियन अमेरिकी डॉलर (Dh73 बिलियन) की अनुमानित लागत पर और 2017 तक, इसकी आबादी 13,201 थी।

विकास शेख जायद रोड के साथ , उत्तर-पश्चिम में अल वासल इलाके से स्थित है। यह दक्षिण में बिजनेस बे और पूर्वोत्तर में फाइनेंशियल सेंटर रोड से घिरा है, जो इसे ज़ाबील 2 और ट्रेड सेंटर 2 से अलग करता है ।
ओल्ड टाउन में वास्तुकला की अरबी कम-वृद्धि वाली स्थानीय शैली मौजूद है, जबकि ऊंची-ऊंची समकालीन इमारतें बाकी के विकास पर हावी हैं। डाउनटाउन दुबई में एड्रेस डाउनटाउन, विदा डाउनटाउन, अल मंज़िल डाउनटाउन जैसे उच्च श्रेणी के होटलों के साथ-साथ लक्ज़री अरेबियन बाज़ार, सूक अल बहार और शेख मोहम्मद पर रेस्तरां और कैफे की 3.5 किमी लंबी पट्टी जैसे आकर्षण हैं। बिन राशिद बुलेवार्ड। सूक अल बहार में 100 से अधिक दुकानें और 20 से अधिक रेस्तरां, कैफे और दुबई फाउंटेन से सटे लाउंज हैं।",221,कला
डेली टेलीग्राफ,"द डेली टेलीग्राफ, जिसे ऑनलाइन और अन्य स्थानों पर द टेलीग्राफ के रूप में जाना जाता है, एक ब्रिटिश दैनिक ब्रॉडशीट समाचारपत्र है जिसे लंदन में टेलीग्राफ मीडिया ग्रुप द्वारा प्रकाशित किया जाता है और यह यूनाइटेड किंगडम और अंतरराष्ट्रीय स्तर पर वितरित होता है। इसकी स्थापना 1855 में आर्थर बी. स्ले द्वारा द डेली टेलीग्राफ एंड कूरियर के रूप में की गई थी। द टेलीग्राफ को यूके में एक महत्वपूर्ण समाचार पत्र माना जाता है। अखबार का आदर्श वाक्य, ""था, है, और रहेगा"", इसके प्रतीक में शामिल था, जिसका उपयोग 1858 से एक सदी से अधिक समय तक किया गया।
इसकी सहयोगी पत्रिका, द संडे टेलीग्राफ, जो 1961 में शुरू हुई थी, की दिसंबर 2018 तक 281,025 प्रतियों का प्रसार था। दोनों सहयोगी समाचार पत्रों का संचालन अलग-अलग किया जाता है, और उनके संपादकीय स्टाफ भी अलग होते हैं, लेकिन कहानियों का एक-दूसरे के बीच उपयोग किया जाता है। यह अब राजनीतिक रूप से रूढ़िवादी है और कंजरवेटिव पार्टी का समर्थन करता है। 1870 के दशक के अंत तक यह राजनीतिक रूप से उदार था।
द टेलीग्राफ ने कई प्रमुख समाचारों को सबसे पहले प्रकाशित किया है, जिनमें से कुछ प्रमुख हैं: द्वितीय विश्वयुद्ध का प्रकोप, जिसे नए रिपोर्टर क्लेयर हॉलिंगवर्थ द्वारा कवर किया गया और इसे ""सदी की सबसे बड़ी खबर"" कहा गया; 2009 में संसदीय खर्चों का घोटाला, जिसके कारण कई प्रमुख राजनीतिक इस्तीफे हुए और इसके लिए इसे 2009 का ब्रिटिश न्यूज़पेपर ऑफ द ईयर नामित किया गया; 2016 में इंग्लैंड के फुटबॉल मैनेजर सैम एलार्डाइस पर किया गया अंडरकवर अन्वेषण; और 2023 में लॉकडाउन फाइल्स का खुलासा।",262,कला
पार्क विशाखापत्तनम,"द पार्क विशाखापत्तनम, 1968 में खोला गया विशाखापत्तनम का एक लग्ज़री 5-स्टार है। यह होटल के भारत में पार्क होटल की श्रृंखला के 8 होटलों में से एक है। बंगाल की खाड़ी के ठीक सामने स्थित यह होटल 6 एकड़ भूमि में फैला हुआ है। समुद्र तट के ठीक सामने स्थित इस पांच सितारा होटल में कई महत्वपूर्ण हस्तिया एवं अंतरराष्ट्रीय पर्यटक अक्सर आते हैं। यह द पार्क होटल समूह का दूसरा होटल था जो आंध्र प्रदेश में खोला गया था। इस श्रृंखला का पहला होटल 1967 में कोलकाता में स्थापित किया गया था।",94,कला
