title,content,word_count,topic
बिहार योग विद्यालय,"बिहार योग विद्यालय योग से सम्बन्धित शिक्षण-प्रशिक्षण का अन्तरराष्ट्रीय ख्यातिप्राप्त विश्वविद्यालय है। यह बिहार के मुंगेर नगर में गंगा नदी के किनारे स्थित है। यह विद्यालय 'गंगा दर्शन' के लिए प्रसिद्ध है। इसकी स्थापना सन् १९६४ में स्वामी सत्यानन्द सरस्वती ने अपने गुरु स्वामी शिवानन्द की इच्छानुसार विश्व को योग की प्राचीन विद्या की शिक्षा देने के निमित्त की थी।
बिहार योग विद्यालय योग प्रशिक्षण प्रदान करने वाली एक दातव्य एवं शैक्षणिक संस्था है। आज यह विश्व का प्रथम योग विश्वविद्यालय है। इसके 200 से अधिक अंतर्राष्ट्रीय एवं सैकड़ों राष्ट्रीय योग एवं आध्यात्मिक केन्द्र है। इसे मानद विश्वविद्यालय (डीम्ड यूनिवर्सिटी) का दर्जा दिया गया है। वर्तमान में गुरुकुल शैली में यहाँ चातुर्मासिक योग सर्टिफिकेट कोर्स का संचालन होता है। 
यह संस्था योग दर्शन, योग मनोविज्ञान, अप्लाइड योग एवं पर्यावरण योग विज्ञान में उच्च अध्ययन के लिए एक वर्ष एवं दो वर्ष का कोर्स कराती है। यहां योग शोध संस्थान का एक वृहद पुस्तकालय भी है। इसमें विश्व के कोने-कोने से विद्यार्थी अध्ययन करने आते हैं। बाद में वे अपने-अपने देश में जाकर योग केंद्र भी चलाते हैं।",177,मनोविज्ञान
चित्त,चित्त को भारतीय दर्शन में 'मन' के लिए सामान्य तौर पर प्रयोग किया गया है। इसके अलावा 'मानस' और विज्ञान का भी उपयोग किया गया है।,26,मनोविज्ञान
रेणुका चौधरी,"श्रीमति रेणुका चौधरी एक भारतीय राजनेता हैं, वे कांग्रेस की ओर से चौदहवीं लोकसभा में खम्मम संसदीय सीट से प्रतिनिधित्व करती हैं। संप्रग सरकार बनने के बाद से (सन २००४ से) सरकार में केंद्रीय महिला एवं बाल विकास मंत्री का पदभार संभाला।",42,मनोविज्ञान
हिन्दू संस्कार,"हिन्दू धर्म की महान आध्यात्मिक विरासत सफल और सार्थक यात्रा के लिए जहाँ यात्रा के काम आने वाले आवश्यकता - भोजन, वस्त्र, उपकरण आदि होते हैं, वही यह जानना भी कि यात्रा किस उद्देश्य से की जा रही है? उपाय क्या है? मार्ग में कहाँ-किस तरह की समस्याएँ आयेंगी तथा किन लोगों को मार्गदर्शन उपयोग रहेगा? इन जानकारियों के अभाव में  अनेक अवरोध और संकट उठ खड़े हो सकते हैं। मनुष्य का  सफल-सार्थक जीवन यात्रा महत्वपूर्ण है।",77,मनोविज्ञान
आद्यप्ररूप,"आद्यप्ररूप या मूलादर्श   की अवधारणा (अंग्रेज़ी:  Archetype /ˈɑrkɪˌtaɪp/ ;  प्राचीन यूनानी ἄρχω (आर्खो), 'आरम्भ करना' और τῠ́πος (तुपोस ) 'प्रकार' से व्युत्पन्न) व्यवहारिक, ऐतिहासिक मनोविज्ञान और साहित्यिक विश्लेषण से संबंधित क्षेत्रों में प्रकट होता है।
एक आद्यप्ररुप निम्नलिखित में से कोई भी हो सकता है:

एक कथन, व्यवहार का प्रतिरूप, आदिरूप (prototype), ""पहला"" रूप, या एक मुख्य प्रतिदर्श या प्रारूप  (model) जिसे अन्य कथन, व्यवहार के पैटर्न और वस्तुएं नकल, अनुसरण, अनुकरण या जिसमें ""विलय"" करती हैं। इस परिभाषा के लिए अक्सर उपयोग किए जाने वाले अनौपचारिक पर्यायवाची शब्दों में ""मानक उदाहरण"", ""मूल उदाहरण"", और  ""आद्यप्ररूप उदाहरण"" शामिल हैं; गणितीय आद्यप्ररूप अक्सर "" विहित (अभिनियम) उदाहरण"" के रूप में प्रकट होते हैं।
शुद्ध रूप (प्रत्यय या आकर) की प्लेटोनीय अवधारणा, किसी चीज़ की मूलभूत विशेषताओं को समाहित करने वाली मानी जाती है।
एक सामूहिक रूप से विरासत में मिला अचेतन विचार, विचार, छवि आदि की एक अभिरचना, जो व्यक्तिगत मानस में सार्वभौमिक रूप से मौजूद है, जैसा कि जुंगियन मनोविज्ञान में है
साहित्य, चित्रकला, या पौराणिक कथाओं में लगातार आवर्ती प्रतीक या रूपांकन। यह परिभाषा श्रेण्य कथाकारिता, मीडिया आदि में विभिन्न प्रतीत होने वाले असंबंधित मामलों में समान लक्षण साझा करने वाले पात्रों या विचारों की पुनरावृत्ति को संदर्भित करती है। शब्द का यह प्रयोग तुलनात्मक नृविज्ञान और युंगीय आद्यप्ररूप सिद्धांत दोनों से लिया गया है।
आद्यप्ररुप सहज प्रवृति के भी बहुत करीबी सादृश्य हैं, ऐसे कि, किसी भी चेतना के विकसित होने से बहुत पहले, यह मनुष्य के अवैयक्तिक और विरासत में मिले लक्षण हैं जो मानव व्यवहार को प्रस्तुत और प्रेरित करते हैं। बाद में कुछ हद तक चेतना विकसित होने के बाद भी वे भावनाओं और व्यवहार को प्रभावित करना जारी रखते हैं।",276,मनोविज्ञान
शिक्षाशास्त्र,"शिक्षण-कार्य की प्रक्रिया का विधिवत अध्ययन शिक्षाशास्त्र या शिक्षणशास्त्र (Pedagogy) कहलाता है। इसमें अध्यापन की शैली या नीतियों का अध्ययन किया जाता है। शिक्षक अध्यापन कार्य करता है तो वह इस बात का ध्यान रखता है कि अधिगमकर्ता को अधिक से अधिक समझ में आवे।
शिक्षा एक सजीव गतिशील प्रक्रिया है। इसमें अध्यापक और शिक्षार्थी के मध्य अन्तःक्रिया (interaction) होती रहती है और सम्पूर्ण अन्तःक्रिया किसी लक्ष्य की ओर उन्मुख होती है। शिक्षक और शिक्षार्थी शिक्षाशास्त्र के आधार पर एक दूसरे के व्यक्तित्व से लाभान्वित और प्रभावित होते रहते हैं और यह प्रभाव किसी विशिष्‍ट दिशा की और स्पष्ट रूप से अभिमुख होता है। बदलते समय के साथ सम्पूर्ण शिक्षा-चक्र गतिशील है। उसकी गति किस दिशा में हो रही है? कौन प्रभावित हो रहा है? इस दिशा का लक्ष्य निर्धारण शिक्षाशास्त्र करता है।",133,मनोविज्ञान
सुखवाद,"सुखवाद (Hedonism) नीतिशास्त्र के अंतर्गत नैतिक अपेक्षाओं की अभिपुष्टि करने वाला सिद्धांत है। सुखवाद के अनुसार अच्छाई वह है जो आनन्द प्रदान करती है या दुःख-पीड़ा से छुटकारा दिलाती है तथा बुराई वह है जो दुःख-पीड़ा को जन्म देती है। सैद्धांतिक तौर पर सुखवाद नीतिशास्त्र में प्रकृतिवाद का एक रूपांतर है। उसका आधार इस विचार में निहित है कि आनन्द मनुष्य का मुख्य निर्णायक गुण है, जो उसके स्वभाव में निहित है और उसके समस्त कार्यकलाप को निर्धारित करता है। सिद्धांत के रूप में सुखवाद की उत्पत्ति प्राचीन काल में ही हो गयी थी। यूनान में सुखवादी अरिस्टिप्पस के नीतिशास्त्र के अनुयायी रहे। सुखवाद एपीक्यूरस की शिक्षा में अपने चरम शिखर पर पहुँचा। सुखवाद के विचारों को मिल तथा बेंथम के उपयोगितावाद में केंद्रीय स्थान प्राप्त है।
‘हिडोनिज्म‘ शब्द की उत्पत्ति ग्रीक शब्द हिडोन ;ीēकवदēद्ध से हुई है जिसका अर्थ है ‘प्रसन्नता, सुख या आनंद‘। हिडोनिज्म मानव जीवन से सम्बंधित विभिन्न सिद्धांतों को संदर्भित करता है जैसे-हमारे लिए क्या अच्छा है, हमें कैसे व्यवहार करना चाहिए और हमें जिस तरह से व्यवहार करना चाहिए, उसके लिए क्या प्रेरित करता है। 
हिडोनिज्म व्यक्ति की जीवनशैली, कार्यों या विचारों में आनंद को प्राथमिकता देता है। इस शब्द में दर्शन, कला और मनोविज्ञान के कई सिद्धांत या प्रक्रियाएँ सम्मिलित हो सकती हैं, जिसमें संवेदी आनंद और अधिक बौद्धिक या व्यक्तिगत खोज दोनों शामिल हैं, लेकिन इसे दूसरों के प्रति अल्पकालिक संतुष्टि हेतु रोजमर्रा के जीवन में इस्तेमाल किया जा सकता है।",238,मनोविज्ञान
इब्न सीना,"अबू अली सीना (फारसी: بو علی‌ سینا ; ९८० – १०३७, अंग्रेजी: Avicenna or Ibn-Sina) फारस के विद्वान, दार्शनिक एवं चिकित्सक थे। उन्होने विविध विषयों पर लगभग ४५० पुस्तकें लिखी जिसमें से २४० अब भी प्राप्य हैं। इसमें से १५ पुस्तकें चिकित्सा विज्ञान से संबंधित हैं। उनकी विश्वविख्यात किताब का नाम क़ानून है। यह किताब मध्यपूर्व जगत में मेडिकल सांइस की सबसे ज़्यादा प्रभावी और पढ़ी जाने वाली किताब है। इस प्रकार अपने समय के प्रसिद्ध चिकित्सक थे। अबू अली सीना न केवल नास्तिक चिकित्सकों और दार्शनिकों में सबसे आगे हैं बल्कि पश्चिम में शताब्दियों तक वे चिकित्सकों के सरदार के रूप में प्रसिद्ध रहे।[उद्धरण चाहिए]
इब्न  सिन्ना (एविसेना) पर दुनिया की प्राचीनता, उसके (दुनिया के) बाद की अस्वीकृति और ""भीतर की महान विचारधारा"" के अलावा अन्य नास्तिक सिद्धांतों के बारे में अपने बयानों के कारण काफिर और नास्तिक होने का आरोप लगाया गया था।अन्य विद्वानों जिन्होंने यह कहा कि इब्न सिन्ना एक नास्तिक था (शेख अल-थुवैनी के पहले), अल-ग़ज़ाली, इब्न तैमियाह, इब्न अल-क़ायम और अल-ढाबी है।
दर्शनशास्त्र और चिकित्सा के अलावा, इब्न सीना के संग्रह में खगोल विज्ञान, कीमियागरी, भूगोल और भूविज्ञान, मनोविज्ञान, इस्लामी धर्मशास्त्र, तर्कशास्त्र, गणित, भौतिकी और कविता पर लेखन शामिल है।",195,मनोविज्ञान
विश्वंभर नाथ शर्मा 'कौशिक',"विश्वंभर नाथ शर्मा 'कौशिक' (१८९९- १९४५) प्रेमचन्द परम्परा के ख्याति प्राप्त कहानीकार थे। प्रेमचन्द के समान साहित्य में कौशिक का दृष्टिकोण भी आदर्शोन्मुख यथार्थवाद था। 'कौशिक' का जन्म १८९९ में पंजाब के अम्बाला नामक नगर में हुआ था। इनकी अधिकांश कहानियाँ चरित्र प्रधान हैं। इन कहानियों के पात्रों में चरित्र निर्माण में लेखक ने मनोविज्ञान का सहारा लिया है और सुधारवादी मनोवृत्तियों से परिचालित होने के कारण उन्हें अन्त में दानव से देवता बना दिया है।
कौशिक की कहानियों में पारिवारिक जीवन की समस्याओं और उनके समाधान का सफल प्रयास हुआ है। उनकी कहानियों में पात्र हमारी यथार्थ जीवन के जीते जागते लोग हैं जो सामाजिक चेतना से अनुप्राणित तथा प्रेरणादायी हैं। इनका प्रथम कहानी संग्रह 'रक्षाबंधन' सन 1913 में प्रकाशित हुआ था। इनकी कहानियां अपनी मूल संवेदना को पूर्ण मार्मिकता के साथ प्रकट करती हैं। इनका निधन सन 1945 में हुआ।",142,मनोविज्ञान
तारा ब्राच,"तारा ब्राख (Tara Brach; जन्म 17 मई 1953) एक अमेरिकी मनोवैज्ञानिक, लेखिका और बौद्ध ध्यान की प्रस्तावक हैं। वो एक मार्गदर्शक शिक्षिका हैं और वाशिंगटन, डीसी (आईएमसीडब्ल्यू) की इनसाइट मेडिटेशन कम्युनिटी की संस्थापक हैं। ब्राख संयुक्त राज्य अमेरिका और यूरोप में ध्यान और योग केंद्रों में बौद्ध ध्यान के बारे में भी पढ़ाती हैं, जिसमें वुडक्रे, कैलिफ़ोर्निया में स्पिरिट रॉक मेडिटेशन सेंटर कृपालु केंद्र; और ओमेगा इंस्टीट्यूट फॉर होलिस्टिक स्टडीज भी शामिल है।
ब्राख एक आधुनिक बौद्ध धर्मावलम्बी हैं, जो भावनात्मक उपचार के लिए बौद्ध शिक्षाओं और सति मेडिटेशन के अनुप्रयोग में विशेषज्ञता रखती हैं। उन्होंने रेडिकल एक्सेप्टेंस, ट्रू रिफ्यूज और रेडिकल कम्पैशन सहित इन विषयों पर कई किताबें लिखी हैं।",111,मनोविज्ञान
अद्भुत रस,"अदभुत रस, भारतीय काव्य शास्त्र के विभिन्न रसों में से एक है, इसका स्थायी भाव आश्चर्य होता है। जब किसी जीव के मन में विचित्र अथवा आश्चर्यजनक वस्तुओं को देखकर जो विस्मय आदि का भाव उत्पन्न होता है , उसे अद्भुत रस कहा जाता है। इसके अन्दर आँसु आना, रोमांच, गद्गद होना, काँपना, आँखे फाड़कर देखना आद शामिल हैं। अद्भुत रस के भरतमुनि ने दो भेद दिये हैं: दिव्य तथा आनन्दज। वैष्णव आचार्य इसके दृष्ट, श्रुत, संकीर्तित तथा अनुमित नामक भेद करते हैं। उदाहरण :",85,मनोविज्ञान
आसव,"आसव एक पालि शब्द हैं (संस्कृत:आश्रव) जो बौद्ध शास्त्र, दर्शन, और मनोविज्ञान में प्रयोग किया जाता है, जिसका अर्थ हैं ""अन्तर्वाह"" या ""नासूर""। 
यह कामुक सुख, अस्तित्व के लिए तरसना, और अज्ञानता के मानसिक कलंक को संदर्भित करता हैं, जो संसार - पुनर्जन्म, दुःख, और फिर मरने के अनादि चक्र - को कायम रखता हैं। बौद्ध धर्म में, आसव का अनुवाद ""कर्म-संबंधी पूर्वाभिरुचि का पकना"" या ""कर्म-संबंधी झुकाव"" भी होता हैं। यह शब्द जैन साहित्य में भी आम हैं, और कभी कभी ""आश्रव"" के रूप में प्रकट होता हैं। हालांकि, बौद्ध धर्म जैन धर्म की कर्म और आश्रव के वाद को नकारता हैं, और एक अन्य संस्करण प्रस्तुत करता हैं।",110,मनोविज्ञान
