title,content,word_count,topic
फेशियल,"फेशियल एक तरह का सौंदर्य उपचार (ट्रीटमेंट) होता है, जो चेहरे पर किया जाता है। फेशियल मुख्यतः ५ चरणों (स्टेप्स) में किया जाता है। जिनमें त्वचा की सफाई (क्लीनिंग), स्क्रब करना, भाप देना, क्रीम या लोशन से त्वचा की मसाज करना, तथा फेशियल मास्क लगाना शामिल हैं। फेशियल से दाग-धब्बे, झुर्रियाँ, मुहाँसें, शुष्क त्वचा, तथा एक्ने जैसी त्वचा सम्बन्धित समस्याओं को कम किया जा सकता है। फेशियल का चुनाव अपनी त्वचा के प्रकार के हिसाब से करना चाहिए। फेशियल के बहुत से प्रकार होते हैं, जो अलग-अलग त्वचा की समस्याओं के हिसाब से बने होते हैं। जिनका इस्तेमाल कर के त्वचा को सुन्दर और कांतिवान बनाया जा सकता है। फेशियल रुपी इस सौंदर्य उपचार को हाथों  तथा मशीन दोनों ही तरीकों से किया जाता है। यह मुख्यतः पार्लर एवं ब्यूटी स्टूडियो में किया जाने वाला उपचार है। जो फेशियल करने की प्रक्रिया में प्रवीणता रखता हो उससे ही फेशियल उपचार लेना चाहिए अन्यथा गलत तरह से किया गया फेशियल त्वचा पर अच्छे प्रभाव की जगह गलत प्रभाव डाल सकता है।",170,पोषण
देनदारी लेखे,,0,पोषण
कामधेनु,"कामधेनु हिन्दू धर्म में एक देवी है जिनका स्वरूप गाय का है। इन्हें 'सुरभि' भी कहते हैं। कामधेनु जिसके पास होती हैं वह जो कुछ कामना करता है उसे वह मिल जाता है। (काम = इच्छा , धेनु=गाय)। इनके जन्म के बारे में विभिन्न कथाएँ हैं। एक कथानुसार ये समुद्र मन्थन में निकलीं थीं। इनकी बेटी का नाम नन्दिनी है। कामधेनु दक्ष प्रजापति की कन्या और महर्षि कश्यप की पत्नी तथा गौ और महिष तथा भगवान शिव के ग्यारह रुद्रावतारों की माता हैं। जो ग्यारह रुद्र कामधेनु से उत्पन्न हुए थे उनके नाम हैं -:  

कपाली
पिंगल
भीम
विरूपाक्ष
अजपाद
अहिर्बंधुन्य
शम्भू
चण्ड
भव
शास्ता
विलोहित",106,पोषण
पुष्य नक्षत्र,"पुष्य का अर्थ है पोषण करने वाला, ऊर्जा व शक्ति प्रदान करने वाला. मतान्तर से पुष्य को पुष्प का बिगडा़ रूप मानते हैं। पुष्य का प्राचीन नाम तिष्य शुभ, सुंदर तथा सुख संपदा देने वालाहै। विद्वान इस नक्षत्र को बहुत शुभ और कल्याणकारी मानते हैं। विद्वान इस नक्षत्र का प्रतीक चिह्न गाय का थन मानते हैं। उनके विचार से गाय का दूध पृथ्वी लोक का अमृत है। पुष्य नक्षत्र गाय के थन से निकले ताजे दूध सरीखा पोषणकारी, लाभप्रद व देह और मन को प्रसन्नता देने वाला होता है। राशि में 3 डिग्री 20 मिनट से 16 डिग्री 40 मिनट तक होती है। यह क्रान्ति वृ्त्त से 0 अंश 4 कला 37 विकला उत्तर तथा विषुवत वृ्त्त से 18 अंश 9 कला 59 विकला उत्तर में है। इस नक्षत्र में तीन तारे तीर के आगे का तिकोन सरीखे जान पड़ते हैं। बाण का शीर्ष बिन्दु या पैनी नोंक का तारा पुष्य क्रान्ति वृत्त पर पड़ता है। पुष्य को ऋग्वेद में तिष्य अर्थात शुभ या माँगलिक तारा भी कहते हैं। सूर्य जुलाई के तृतीय सप्ताह में पुष्य नक्षत्र में गोचर करता है। उस समय यह नक्षत्र पूर्व में उदय होता है। मार्च महीने में रात्रि 9 बजे से 11 बजे तक पुष्य नक्षत्र अपने शिरोबिन्दु पर होता है। पौष मास की पूर्णिमा को चन्द्रमा पुष्य नक्षत्र में रहता है। इस नक्षत्र का स्वामी ग्रह शनि है।",225,पोषण
चॉकलेट,"चॉकलेट कोको के बीजों से निर्मित एक कच्चा या संसाधित भोज्य पदार्थ है। कोको के बीजों का स्वाद अत्यन्त कड़ुवा होता है। इसमें स्वाद उत्पन्न करने के लिए इसका किण्वन करना पड़ता है। चॉकलेट भुने और पिसे हुए कोको पॉड्स से बना एक खाद्य उत्पाद है, जो कि तरल, ठोस या पेस्ट के रूप में या अन्य खाद्य पदार्थों में स्वाद बढ़ाने वाले एजेंट के रूप में उपलब्ध है। कम से कम ओल्मेक सभ्यता (19वीं-11वीं शताब्दी ईसा पूर्व) के बाद से कोको का किसी न किसी रूप में सेवन किया जाता रहा है,  और मेसोअमेरिकन लोगों के अधिकांश- माया और एज़्टेक सहित - ने चॉकलेट पेय बनाया।",107,पोषण
गुहिल राजवंश,"गुहिल/गहलौत राजवंश एक प्रमुख राजवंश था जो भारतीय उपमहाद्वीप के राजस्थान क्षेत्र में मेवाड़ शहर में शासन करता था | इसका प्रारंभिक संंस्थापक राजा गुहादित्य थेे, जिन्होंने छटी शताब्दी में गुहिल वंंश की नींव रखी। गुुुहादित्य के पश्चात् 734 ई'. में  बप्पा रावल को गुहिल वंश का वास्तविक संंस्थापक माना जाता है। 

शुरुआत में गुहिल राजवंश प्रतिहार साम्राज्य के सामंतों का रूप निभाया करते थे लेकिन रावल अल्लट के द्वारा प्रतिहार सम्राट देवपाल के वध के बाद वह स्वतन्त्र बन गए | दसवीं शताब्दी में गुहिल रावल राष्ट्रकूट राजवंशज के अधीन हुआ करते थे तथा ग्यारहवीं शताब्दी में परमार और चौहान साम्राज्यों के अधीन शासन करते थे | बारहवीं शताब्दी में गुहिल राजवंश दो हिस्सों में विभाजित होगया जिनमें से मुख्या राजवंश मेवाड़ पर वर्ष 1303 तक शासन करता रहा जब मुसलमान आक्रमणकारी अलाउद्दीन खिलजी ने चित्तौड़ पर घेरा डालकर गुहिलों को पराजित करा था |",146,पोषण
रेशम का इतिहास,"रेशम की खोज 118 ई•पू• में चीन में हुई थी। इसका उत्पादन सबसे पहले नवपाषाण काल में चीन में आरम्भ हुआ और वहाँ से विश्व के अन्य भागों में पहुँचा। रेशम का सबसे पहला प्रमाण ज़िया काउंटी, शांक्सी में यांगशाओ संस्कृति की साइटों पर पाया गया था। बुने हुए रेशमी कपड़े का सबसे पुराना उदाहरण 3630 ईसा पूर्व का है।",60,पोषण
शैक्षणिक विषयों की सूची,यहाँ शैक्षणिक विषय (academic discipline) से मतलब ज्ञान की किसी शाखा से है जिसका अध्ययन महाविद्यालय स्तर या विश्वविद्यालय स्तर पर किया जाता है या जिन पर शोध कार्य किया जाता है।,32,पोषण
पशुधन,"एक या अधिक पशुओं के समूह को, जिन्हें कृषि सम्बन्धी परिवेश में भोजन, रेशे तथा श्रम आदि सामग्रियां प्राप्त करने के लिए पालतू बनाया जाता है, पशुधन के नाम से जाना जाता है। शब्द पशुधन, जैसा कि इस लेख में प्रयोग किया गया है, में मुर्गी पालन तथा मछली पालन सम्मिलित नहीं है; हालांकि इन्हें, विशेष रूप से मुर्गीपालन को, साधारण रूप से पशुधन में सम्मिलित किया जाता हैं।
पशुधन आम तौर पर जीविका अथवा लाभ के लिए पाले जाते हैं। पशुओं को पालना (पशु-पालन) आधुनिक कृषि का एक महत्वपूर्ण भाग है। पशुपालन कई सभ्यताओं में किया जाता रहा है, यह शिकारी-संग्राहक से कृषि की ओर जीवनशैली के अवस्थांतर को दर्शाता है।",112,पोषण
मोन राष्ट्रीय दिवस,"मोन राष्ट्रीय दिवस(मोन: တ္ၚဲကောန်ဂကူမန်, rungmoam kaun kay kaw mon; बर्मी: မွန်အမျိုးသားနေ့; थाई: วันชาติมอญ)एक वार्षिक राष्ट्रीय दिवस है जो हन्थावड्डी राज्य की स्थापना का स्मरण कराता है।मोन राष्ट्रीय दिवस म्यांमार और थाईलैंड में मोन लोगों द्वारा और विदेशी मोन समुदायों द्वारा मनाया जाता है।दिन बर्मी कैलेंडर में (मोन में माइक) ताबोदवे के चांद्र मास के पहले घट दिन पर आयोजित किया जाता है, तो निम्न मागा पूजा।",66,पोषण
दुग्धपायन,"दुग्धपान या दुग्धस्रवन या लैक्टेशन, स्तन ग्रंथि से दूध निकलने, उस दूध को बच्चे को पिलाने की प्रक्रिया तथा एक माँ द्वारा अपने बच्चे को दूध पिलाने में लगने वाले समय को वर्णित करता है। यह प्रक्रिया सभी मादा स्तनपायी प्राणियों में होती है और मनुष्यों में इसे आम तौर पर स्तनपान या नर्सिंग कहा जाता है। अधिकांश प्रजातियों में माँ के निपल्स से दूध निकलता है; हालाँकि, प्लैटिपस (एक गैर-गर्भनालीय स्तनपायी प्राणी) के पेट की नलिकाओं से दूध निकलता है। स्तनपायी प्राणियों की केवल एक प्रजाति दयाक फ्रूट चमगादड़ में दूध उत्पन्न करना नर का एक सामान्य कार्य है। कुछ अन्य स्तनपायी प्राणियों में हार्मोन के असंतुलन की वजह से नर दूध उत्पन्न कर सकते हैं। इस घटना को नवजात शिशुओं में भी देखा जा सकता है (उदाहरण के लिए डायन का दूध (विचेज मिल्क))।
गैलक्टोपोइएसिस दूध उत्पादन को बनाये रखने को कहते हैं। इस चरण में प्रोलैक्टिन (पीआरएल) और ऑक्सीटोसिन की जरूरत पड़ती है।",156,पोषण
"जी-20 नई दिल्ली शिखर सम्मेलन, 2023","2023 जी 20 दिल्ली शिखर सम्मेलन बीस के समूह (G20) की आगामी अठारहवीं बैठक है, जो 2023 में प्रगति मैदान, नई दिल्ली में होने वाली है।
इसके अलावा G 20 शिखर सम्मेलन 2023,23 से 25 फरवरी तक आयोजित हुआ",39,पोषण
मादक पेय,"मादक पेय इथेनॉल युक्त एक पेय है। मादक पेयों को सामान्यतः तीन सामान्य वर्गों में विभाजित किया जाता है: बीयर, वाइन और स्प्रिट्स.
मादक पेय की खपत विश्व के अधिकांश देशों में है। इंटरनेशनल सेंटर ऑफ़ अल्कोहलिक पोलिसी (ICAP) के अनुसार, 100 से अधिक देशों में इनके उत्पादन, बिक्री और खपत नियंत्रित करने के लिए कानून हैं। विशेष रूप से, ऐसे कानून इन्हें क़ानूनी रूप से खरीदने और पीने की न्यूनतम आयु निर्दिष्ट करतें हैं। यह न्यूनतम आयु 16 और 25 वर्ष के बीच होती है, यह राष्ट्र और पेय के प्रकार पर निर्भर करता है। अधिकांश देशों में यह आयु 18 वर्ष है।
अल्कोहल का उत्पादन और खपत, शिकारी-संग्रहकर्ता के समय के लोगों से लेकर देश-राज्य तक, विश्व की अधिकांश संस्कृतियों में मौजूद है। मादक पेय पदार्थ इन संस्कृतियों में सामाजिक घटनाओं का एक महत्वपूर्ण हिस्सा हैं। कई संस्कृतियों में, सामाजिक संपर्क में पीना महत्वपूर्ण भूमिका निभाता है - खासकर अल्कोहल के स्नायविक प्रभाव के कारण.
अल्कोहल एक मनोसक्रिय ड्रग है, जिसमें अवसादकीय का प्रभाव होता है। एक उच्च रक्त अल्कोहल सामग्री को सामान्यतः क़ानूनी मादकता माना जाता है, क्योंकि यह ध्यान लगाने की क्षमता कम कर देता है और प्रतिक्रिया देने की गति को धीमा कर देता है। अल्कोहल के नशे की लत लग सकती है और अल्कोहल के नशे की लत लगने की अवस्था को मादकता कहते है।",221,पोषण
फ्रीड्रिक फ्रोबेल,"फ़्रीड्रिक विलियम अगस्त फ्रोबेल (Friedrich Wilhelm August Fröbel ; जर्मन उच्चारण : [ˈfʁiːdʁɪç ˈvɪlhɛlm ˈaʊɡʊst ˈfʁøːbəl] ; 21 अप्रैल, 1782 – 21 जून, 1852) जर्मनी के प्रसिद्ध शिक्षाशास्त्री थे। वे पेस्तालोजी के शिष्य थे। उन्होने किंडरगार्टन (बालवाड़ी) की संकल्पना दी। उन्होने शैक्षणिक खिलौनों का विकास किया जिन्हें 'फ्रोबेल उपहार' के नाम से जाना जाता है।
इन्होंने दुनिया का पहला प्लेइंग स्कूल सन् 1837 ई में खोला था।
शिक्षा जगत में फ्रोबेल का महत्वपूर्ण स्थान है। बालक को पौधे से तुलना करके, फ्रोबेल ने बालक के स्वविकास की बात कही। वह पहला व्यक्ति था जिसने प्राथमिक स्कूलों के अमानवीय व्यवहार के विरूद्ध आवाज उठाई और एक नई शिक्षण विधि का प्रतिपादन किया। उसने आत्मक्रिया स्वतन्त्रता, सामाजिकता तथा खेल के माध्यम से स्कूलों की नीरसता को समाप्त किया। संसार में फ्रोबेल ही पहला व्यक्ति था जिसने अल्पायु बालकों की शिक्षा के लिए एक व्यवहारिक योजना प्रस्तुत किया। उसने शिक्षकों के लिए कहा कि वे बालक की आन्तरिक शक्तियों के विकास में किसी प्रकार का हस्तक्षेप न करें, बल्कि प्रेम एवं सहानुभूति पूर्वक व्यवहार करते हुए बालकों को पूरी स्वतन्त्रता दें। शिक्षा के क्षेत्र में इस प्रकार का परिवर्तन लाने के लिए फ्रोबेल को हमेशा याद किया जायेगा।",195,पोषण
ऊष्मायित्र (अंडा),अण्ड ऊष्मायित्र या डिंबौषक (Incubator) एक प्रकार का उपकरण है जिसके द्वारा कृत्रिम विधि से अंडों को सेआ जाता है और उनसे बच्चे उत्पन्न कराए जाते हैं।,27,पोषण
