title,content,word_count,topic
समाजशास्त्र,"समाजशास्त्र मानव समाज का अध्ययन है। यह सामाजिक विज्ञान की एक शाखा है, जो मानवीय सामाजिक संरचना और गतिविधियों से सम्बन्धित जानकारी को परिष्कृत करने और उनका विकास करने के लिए, अनुभवजन्य विवेचन और समालोचनात्मक विश्लेषण की विभिन्न पद्धतियों का उपयोग करता है, अक्सर जिसका ध्येय सामाजिक कल्याण के अनुसरण में ऐसे ज्ञान को लागूं

छ करना होता है। समाजशास्त्र की विषयवस्तु के विस्तार, आमने-सामने होने वाले सम्पर्क के सूक्ष्म स्तर से लेकर व्यापक तौर पर समाज के बृहद स्तर तक है।
समाजशास्त्र, पद्धति और विषय वस्तु, दोनों के मामले में एक विस्तृत विषय है। परम्परागत रूप से इसकी केन्द्रियता सामाजिक स्तर-विन्यास (या ""वर्ग""), सामाजिक संबंध, सामाजिक संपर्क, धर्म,  संस्कृति और विचलन पर रही है, तथा इसके दृष्टिकोण में गुणात्मक और मात्रात्मक शोध तकनीक, दोनों का समावेश है। चूँकि अधिकांशतः मनुष्य जो कुछ भी करता है वह सामाजिक संरचना या सामाजिक गतिविधि की श्रेणी के अर्न्तगत सटीक बैठता है, समाजशास्त्र ने अपना ध्यान धीरे-धीरे अन्य विषयों जैसे- चिकित्सा, सैन्य और दंड संगठन, जन-संपर्क और यहाँ तक कि वैज्ञानिक ज्ञान के निर्माण में सामाजिक गतिविधियों की भूमिका पर केन्द्रित किया है। सामाजिक वैज्ञानिक पद्धतियों की सीमा का भी व्यापक रूप से विस्तार हुआ है। 20वीं शताब्दी के मध्य के भाषाई और सांस्कृतिक परिवर्तनों ने तेज़ी से सामाज के अध्ययन में भाष्य विषयक और व्याख्यात्मक दृष्टिकोण को उत्पन्न किया। इसके विपरीत, हाल के दशकों ने नये गणितीय रूप से कठोर पद्धतियों का उदय देखा है, जैसे सामाजिक नेटवर्क विश्लेषण।
W.SHIV SIDDH",239,समाजशास्त्र
राजनीतिक समाजशास्त्र,"19वीं शताब्दी में राज्य और समाज के आपसी सम्बन्ध पर वाद-विवाद शुरू हुआ तथा 20वीं शताब्दी में, द्वितीय विश्वयुद्ध के बाद सामाजिक विज्ञानों में विभिन्नीकरण और विशिष्टीकरण की उदित प्रवृत्ति तथा राजनीति विज्ञान में व्यवहारवादी क्रान्ति और अन्तः अनुशासनात्मक उपागम के बढ़े हुए महत्व के परिणामस्वरूप जर्मन और अमरीकी विद्वानों में राजनीतिक विज्ञान के समाजोन्मुख अध्ययन की एक नूतन प्रवृत्ति शुरू हुई। इस प्रवृत्ति के परिणामस्वरूप राजनीतिक समस्याओं की समाजशास्त्रीय खोज एवं जांच की जाने लगी। ये खोजें एवं जांच न तो पूर्ण रूप से समाजशास्त्रीय थीं और न ही पूर्णतः राजनीतिक। अतः ऐसे अध्ययनों को ‘राजनीतिक समाजशास्त्र’ के नाम से पुकारा जाने लगा।",104,समाजशास्त्र
समाजशास्त्र का इतिहास,"समाजशास्त्र का उदय, फ्रांसीसी क्रान्ति के थोड़े ही समय हुआ।",10,समाजशास्त्र
साहित्य का समाजशास्त्र,"साहित्य का समाजशास्त्र  साहित्य और समाज के संबंधों का अध्ययन करने वाला शास्त्र है।  
इसके अंतर्गत शैली अध्ययन भी होने लगा है। इसकी उत्पत्ति अमेरिका में हुई थी। समाजशास्त्रियों का यह प्रयास रहा है कि मार्क्सवादी समाजशास्त्र को भी इसी में सम्मिलित कर लिया जाए। यह साहित्य की का अध्ययन और मूल्यांकन की एक शाखा है।",56,समाजशास्त्र
आनंद कुमार (समाजशास्त्री),"आनंद कुमार एक भारतीय समाज वैज्ञानिक, राजनीति विश्लेषक और राजनीतिज्ञ हैं। आनंद कुमार आम आदमी पार्टी के संस्‍थापक सदस्‍य हैं। आनंद कुमार दिल्ली स्थित जवाहरलाल नेहरू विश्‍वविद्यालय के सेवानिवृत्त प्रोफेसर हैं। इन्होंने जवाहरलाल नेहरू विश्वविद्यालय में लंबे समय तक समाजशास्‍त्र का अध्ययन और अध्यापन किया है।",46,समाजशास्त्र
चिकित्सा समाजशास्त्र,समाजशास्त्र के संदर्भ में चिकित्सा से अभिप्राय स्वास्थ्य के क्षेत्र में समाज के सभी व्यक्ति- विषेश का समर्थन।,18,समाजशास्त्र
मैसूर नरसिंहाचार श्रीनिवास,"मैसूर नरसिंहाचार श्रीनिवास (1916-1999) भारत के सुप्रसिद्ध समाजशास्त्री थे। उन्होने दक्षिण भारत में जाति तथा जाति प्रथा, सामाजिक स्तरीकरण, सांस्कृतीकरण तथा पश्चिमीकरण पर कार्य किया। उन्होने 'प्रबल जाति' (Dominant Caste) की अवधारण प्रस्तुत की।
'मैसूर नरसिंहाचार श्रीनिवास' को सन १९७७ में भारत सरकार द्वारा विज्ञान एवं अभियांत्रिकी के क्षेत्र में पद्म भूषण से सम्मानित किया गया था। ये कर्नाटक से हैं।",61,समाजशास्त्र
समाजशास्त्रियों की सूची,"रिचर्ड अल्बा ,अमेरिकन समाजशात्री 
पीटर एबेल ,ब्रिटिश समाजशास्त्री 
डॉ॰ भीमराव आंबेडकर, भारतीय समाजशास्त्री
अल्फ्रेड रेडक्लिफ ब्राउन अमेरिका के समाजशास्त्री है।",20,समाजशास्त्र
राधा कमल मुखर्जी,"राधा कमल मुखर्जी (7 दिसम्बर 1889 - 24 अगस्त 1968 ) आधुनिक भारत के प्रसिद्ध चिन्तक एवं समाजविज्ञानी थे। वे लखनऊ विश्वविद्यालय के अर्थशास्त्र एवं समाजशास्त्र के प्राध्यापक तथा उपकुलपति रहे। उन्होने भारत के स्वतंत्रता संग्राम में महत्वपूर्ण भूमिका निभायी।
प्रोफेसर मुकर्जी के ही नेतृत्व में उत्तर प्रदेश में सर्वप्रथम लखनऊ विश्वविद्यालय में 1921 में समाजशास्त्र का अध्ययन प्रारम्भ हुआ इसलिए वे उत्तर प्रदेश में समाजशास्त्र के प्रणेता के रूप में भी विख्यात हैं।
प्रोफेसर मुकर्जी वे इतिहास के अत्यन्त मौलिक दार्शनिक थे। वे 20वीं सदी के कतिपय बहुविज्ञानी सामाजिक वैज्ञानिकों में से एक थे जिन्होंने विभिन्न विषयों- अर्थशास्त्र, समाजशास्त्र, मानवशास्त्र, परिस्थितिविज्ञान, दर्शनशास्त्र, मनोविज्ञान, साहित्य, समाजकार्य, संस्कृति, सभ्यता, कला, रहस्यवाद, संगीत, धर्मशास्त्र, अध्यात्म, आचारशास्त्र, मूल्य आदि विभिन्न अनुशासनों को अपना बहुमूल्य योगदान प्रदान किया है। इन समस्त क्षेत्रों में प्रोफेसर मुकर्जी की अद्वितीय देन उनके द्वारा प्रणयित 50 अमर कृतियों में स्पष्टतः दृष्टिगोचर होती है। 
भारत सरकार द्वारा उन्हें सन १९६२ में पद्म भूषण से सम्मानित किया गया था।
इनकी बहुचर्चित पुस्तकें निम्न हैं।

1.The Fundamentals of Indian economics
2.The culture and the art of India.",176,समाजशास्त्र
इमाईल दुर्खीम,डेविड इमाईल दुर्खीम (Émile Durkheim ; फ्रेंच उच्चारण : [eˈmil dyʀˈkɛm]) (1858-1917) फ्रांस के महान समाजशास्त्री थे। कार्ल मार्क्स तथा मैक्स वेबर के साथ वे भी आधुनिक समाज विज्ञान के मुख्य शिल्पी एवं समाजशास्त्र के जनक कहे जाते हैं।,39,समाजशास्त्र
संरचनात्मक प्रकार्यवाद,"सरचनात्मक प्रकार्यवाद (Structural functionalism) या केवल प्रकार्यवाद समाजशास्त्र की प्रमुख अवधारणा है। प्रकार्यवादी सोच को विकसित करने वाले समाजशास्त्रियों में जिन दो विचारकों को महत्वपूर्ण माना जाता है उसमें दुर्खिम (1858-1917) तथा टालकाट पार्सन्स (1902-1979) प्रमुख रहे हैं। अमेरीकी समाजशास्त्र में प्रकार्यवादी सिद्धान्त का एक खास स्थान रहा है।
समाजशास्त्र में प्रत्यक्षवाद के साथ ही साथ प्रकार्यवादी सोच का एक विशेष स्थान रहा है। प्रकार्यवादी सिद्धान्त के समर्थक यह मानते हैं कि समाज की क्रियाएँ व्यवस्थित तरीकें से चलती है और इसलिए वह समाज को एक व्यवस्था (सिस्टम) के रूप में देखतें हैं। सामाजिक व्यवस्था को व्यवस्थित रूप से चलाए रखने में विभिन्न तत्वों के बीच आत्मनिर्भरता पाई जाती है। समाज के ये विभिन्न तत्व एक सम्पूर्ण व्यवस्था का प्रतिनिधित्व करते हैं। अतः समाज एक सम्पूर्ण व्यवस्था है जिसके व्यवस्थित स्वरूप को बनाए रखने में विभिन्न समूहों तथा संस्थाओं का महत्वपूर्ण योगदान होता है। समाजशास्त्र में प्रकार्यवादी सिद्धान्त के जनक इमाइल दुर्खिम को माना जाता है जिन्होंने यह
बताया था कि समाज में एकता बनाए रखने के लिए धर्म, नैतिक आधार प्रदान करता है। धर्म के आधार पर समाज के नैतिक मूल्य, समाज के एकाकी स्वरूप को पुष्ट करते हैं।
श्रेण:समाजशास्त्र",191,समाजशास्त्र
सामाजिक विज्ञान,"सामाजिक विज्ञान (Social science) मानव समाज का अध्ययन करने वाली शैक्षिक विधा है। प्राकृतिक विज्ञानों के अतिरिक्त अन्य  का एक  नाम है 'सामाजिक विज्ञान'। इसमें नृविज्ञान, पुरातत्व, अर्थशास्त्र
, ।भूगोल, इतिहास, विधि, भाषाविज्ञान, राजनीति शास्त्र, समाजशास्त्र, अंतरराष्ट्रीय अध्ययन और संचार आदि विषय सम्मिलित हैं। कभी-कभी मनोविज्ञान को भी इसमें शामिल कर लिया जाता है।",54,समाजशास्त्र
इरावती कर्वे,"इरावती कर्वे (15 दिसम्बर 1905 - 11 अगस्त 1970) भारत की शिक्षाशास्त्री, लेखिका एवं नृवैज्ञानिक (एंथ्रोपोलोजिस्ट) थीं।",17,समाजशास्त्र
सामाजिक नियंत्रण,"सामाजिक नियंत्रण (Social control) से तात्पर्य उन सामाजिक तथा राजनैतिक युक्तियों/प्रक्रियाओं से है जो किसी व्यक्ति या व्यक्तियों के समूह को राज्य, समाज या सामाजिक समूहों के नियमों का पालन करने के लिए नियंत्रित करतीं हैं। समाजशास्त्री सामाजिक नियंत्रण के दो मूलभूत साधन बताते हैं:

(१) अनौपचारिक साधन
(२) औपचारिक साधन",51,समाजशास्त्र
उलरिक़ बेक,"उलरिक़ बेक (मई 15, 1944 – जनवरी 1, 2015) प्रसिद्ध जर्मन समाजशास्त्री तथा अपने जीवनकाल में सबसे अधिक उद्धृत सामाजिक वैज्ञानिकों में से एक थे। उनका कार्य आधुनिक काल में असहनीयता, अनभिज्ञता और अनिश्चितता के प्रश्नों पर केन्द्रित था। उन्होंने ""रिस्क सोसाइटी"" (सामाजिक जोखिम) और ""सेकण्ड मोडर्नीटी"" (दूसरी आधुनिकता) अथवा ""रिफ्लेक्सिव मोडर्नाइज़ेशन"" (कर्मकर्त्ता आधुनिकीकरण) जैसे शब्दों को गढ़ा।",58,समाजशास्त्र
वार्तालाप,"वार्तालाप या बातचीत मनुष्य द्वारा समाज में परस्पर संपर्क क़ायम करने का एक बहुपक्षीय और स्वाभाविक माध्यम है इस से मनुष्य अपने विचारो का आदान प्रदान करता है। वार्तालाप विश्लेषण (English:Conversation Analysis) समाजशास्त्र की वह शाखा है जो मानव अंतरक्रिया की बनावट और संगठन का अध्ययन करती है, जिसमें वार्तालाप संपर्क विषय प्रमुख होता है। वार्तालाप ही समाज में,सस्थान में,कार्यालय में,देश-विदेश में अपनी विशिष्ट पहचान बनाने का सशक्त माध्यम है आप विनम्रता जैसे तत्वों को अपनाकर वार्तालाप को प्रभावशाली बना सकते है वार्तालाप में सिर्फ बात करना ही महत्वपूर्ण नहीं होता है अपितु दुसरो कि बातो को ध्यान से सुनना और समझना भी जरूरी होता है बातचीत करने के लिए आत्मविश्वास,शारीरिक भाषा और नेत्र संपर्क जैसे पहलुओ पर ध्यान दे कर आप एक सफल इन्सान बन सकते है!",128,समाजशास्त्र
माधव सदशिव गोरे,माधव सदशिव गोरे  को समाजशास्त्र के क्षेत्र में भारत सरकार द्वारा सन १९७५ में पद्म भूषण से सम्मानित किया गया था। ये महाराष्ट्र से हैं।,25,समाजशास्त्र
सरस्वती मेनन,"सरस्वती मेनन एक भारतीय महिला शोधकर्ता, शिक्षाविद् और समाजशास्त्री हैं। 
वर्तमान में वे संयुक्त राष्ट्र की शांति निर्माण संरचना की नीति एवं संस्थागत समीक्षा हेतु नियुक्त सलाहकार समूह की सदस्य हैं। समिति का नाम 'एडवाइजरी ग्रुप ऑन द रिव्यू ऑफ द पीसबिल्डिंग आर्किटेक्चर' है। इस पद पर वे 23 जनवरी, 2015 को संयुक्त राष्ट्र प्रमुख बान की मून द्वारा नियुक्त हुई हैं। इसके पहले वे यूएन वूमेन के नीति प्रभाग तथा संयुक्त राष्ट्र विकास कार्यक्रम (UNDP) के मूल्यांकन कार्यालय की निदेशक रह चुकी हैं। 
वे यू एन डी पी में शामिल होने से पूर्व मद्रास विश्वविद्यालय चेन्नई में समाज शास्त्र की प्रवक्ता थीं। वह मंगोलिया और नेपाल में संयुक्त राष्ट्र विकास कार्यक्रम के तहत भी जिम्मेदारी निभा चुकी हैं। उन्होंने दिल्ली के जवाहरलाल नेहरू यूनिवर्सिटी (जेएनयू) से समाजशास्त्र में शोध किया है।",132,समाजशास्त्र
अंकुर पारे,"डॉ. अंकुर पारे (जन्म 20 दिसंबर 1984) एक भारतीय समाजशास्त्री, शिक्षाविद और परोपकारी है| उन्हें अपने काम के लिए कई पुरस्कार मिले हैं| उन्हें भारत सरकार द्वारा इंदिरा गांधी राष्ट्रीय सेवा योजना पुरस्कार और मध्यप्रदेश सरकार द्वारा मध्यप्रदेश राज्य स्तर राष्ट्रीय सेवा योजना पुरस्कार से सम्मानित किया गया है।",49,समाजशास्त्र
