title,content,word_count,topic
जमशेदपुर वीमेंस कॉलेज,"जमशेदपुर वीमेंस कॉलेज, झारखंड राज्य के जमशेदपुर १९५३ में स्थापित एक महिला महाविद्यालय है। इसकी स्थापना पेरिन सी मेहता द्वारा की गई थी। १९६२ में रतन टाटा द्वारा महाविद्यालय को इसका अपना परिसर प्राप्त हुआ। यह महाविद्यालय कला, वाणिज्य एवं विज्ञान विषय में डिग्री प्रदान की जाती है। यह महाविद्यालय कोल्हान विश्वविद्यालय से संबद्ध है जिसे राष्ट्रीय मूल्यांकन एवं प्रत्यायन परिषद (NAAC) द्वारा 'ए' ग्रेड प्रदान किया गया है। इस महाविद्यालय को विश्वविद्यालय अनुदान आयोग द्वारा सेंटर फॉर पोटेंशियल ऑफ एक्सीलेंस के केंद्र (CPE) के रूप में पहचान प्राप्त हुई है। अनुसूचित जाति और जनजाति की छात्राओं पर विशेष ध्यान देते हुए यह महाविद्यालय समावेशी शिक्षा प्रदान करता है। झारखंड राज्य विश्वविद्यालय संशोधन कानून २०१७ के अंतर्गत यह महाविद्यालय झारखंड राज्य का पहला महिला विश्वविद्यालय बनने की ओर अग्रसर है। इसके लिये केन्द्र प्रायोजित योजना राष्ट्रीय उच्चतर शिक्षा अभियान (रुसा) द्वारा वित्तीय सहायता दी जा रही है।
झारखंड और बिहार के पहले महिला विश्वविद्यालय का आधार जमशेदपुर में रखा गया। जमशेदपुर वीमेंस कॉलेज को अब जमशेदपुर महिला विश्वविद्यालय के रूप में  में अपग्रेड कर दिया गया। इसके लिए झारखंड राज्य विश्वविद्यालय संशोधन अधिनियम 2018 और झारखंड अधिनियम 06, 2019 की मंजूरी प्राप्त की गई है।",195,मनोविज्ञान
टेरेंस मैककेना,"टेरेंस मैककेना (Terence McKenna; नवंबर 16, 1946 – अप्रैल 3, 2000) एक अमेरिकी लोकवानस्पतिकीशास्त्री और रहस्यवादी थे। उन्होंने प्राकृतिक रूप से पाए जाने वाले साइकेडेलिक पौधों के अच्छे उपयोग पर काम किया। उन्होंने विभिन्न विषयों के बारे में बात की और लिखा, जिनमें साइकेडेलिक दवा, पौधे-आधारित एंथोजेन, शमनवाद, तत्वमीमांसा, कीमिया, भाषा, दर्शन, संस्कृति, प्रौद्योगिकी, नृवंशविज्ञान, पर्यावरणवाद और मानव की सैद्धांतिक उत्पत्ति चेतना शामिल हैं। उन्हें '90 के दशक का टिमोथी लेरी' ""शमनवाद की ऑन्टोलॉजिकल नींव पर अग्रणी अधिकारियों में से एक"",, और ""रेव कल्चर की बौद्धिक आवाज"" कहा जाता था।",90,मनोविज्ञान
बुद्धि,"बुद्धि (Intelligence) वह मानसिक शक्ति है जो वस्तुओं एवं तथ्यों को समझने, उनमें आपसी सम्बन्ध खोजने तथा तर्कपूर्ण ज्ञान प्राप्त करने में सहायक होती है। यह 'भावना' और अन्तःप्रज्ञा (Intuition/इंट्युसन) से अलग है। बुद्धि ही मनुष्य को नवीन परिस्थितियों को ठीक से समझने और उसके साथ अनुकूलित (adapt) होने में सहायता करती है। बुद्धि को 'सूचना के प्रसंस्करण की योग्यता' की तरह भी समझा जा सकता है।",67,मनोविज्ञान
व्यष्टि अर्थशास्त्र,"सूक्ष्मअर्थशास्त्र (ग्रीक उपसर्ग माइक्रो - अर्थ ""छोटा"" + ""अर्थशास्त्र"") अर्थशास्त्र की एक शाखा है जो यह अध्ययन करता है कि किस प्रकार अर्थव्यवस्था के व्यक्तिगत अवयव, परिवार एवं फर्म, विशिष्ट रूप से उन बाजारों में सीमित संसाधनों के आवंटन का निर्णय करते हैं, जहां वस्तुएं एवं सेवाएं खरीदी एवं बेचीं जाती हैं। सूक्ष्म अर्थशास्त्र यह परीक्षण करता है कि ये निर्णय एवं व्यवहार किस प्रकार वस्तुओं एवं सेवाओं की आपूर्ति एवं मांगों को प्रभावित करते हैं, जो मूल्यों का निर्धारण करती हैं और किस प्रकार, इसके बदले में, मूल्य, वस्तुओं एवं सेवाओं की आपूर्ति एवं मांगों को निर्धारित करती है। 
वृहतअर्थशास्त्र में इसके विपरीत होता है, जिसमें वृद्धि, मुद्रास्फीति, एवं बेरोजगारी से संबंधित क्रियाकलापों का कुल योग शामिल होता है। सूक्ष्मअर्थशास्त्र अर्थव्यवस्था के पूर्व में बताये गए पहलुओं पर राष्ट्रीय आर्थिक नीतियों (जैसे कि कराधान के बदलते स्तरों) के प्रभावों की भी चर्चा करता है। विशेष रूप से लुकास की आलोचना के मद्देनजर, अधिकांश आधुनिक वृहत आर्थिक सिद्धांत का निर्माण 'सूक्ष्मआधारशिला' - अर्थात् सूक्ष्म-स्तर व्यवहार के संबंध में बुनियादी पूर्वधारणाओं के आधार पर किया गया है। 
सूक्ष्मअर्थशास्त्र का एक लक्ष्य बाजार तंत्र का विश्लेषण करना है जो वस्तुओं एवं सेवाओं के बीच सापेक्ष मूल्य की स्थापना और कई वैकल्पिक उपयोगों के बीच सीमित संसाधनों का आवंटन करता है। सूक्ष्मअर्थशास्त्र बाजार की विफलता का विश्लेषण करता है, जहां बाजार प्रभावशाली परिणाम उत्पन्न करने में विफल रहते हैं और यह पूर्ण प्रतियोगिता के लिए आवश्यक सैद्धांतिक अवस्थाओं का वर्णन करता है। सूक्ष्मअर्थशास्त्र में अध्ययन के महत्वपूर्ण क्षेत्रों में सामान्य संतुलन, असममित जानकारी के अंतर्गत बाजार, अनिश्चितता के अंतर्गत विकल्प और खेल सिद्धांत के आर्थिक अनुप्रयोग शामिल हैं। बाजार व्यवस्था के भीतर उत्पादों के लोच पर भी विचार किया जाता है।",278,मनोविज्ञान
बिग फ़ाइव व्यक्तित्व लक्षण,"समकालीन मनोविज्ञान में, व्यक्तित्व के ""बिग फ़ाइव"" कारक हैं व्यक्तित्व के पांच व्यापक डोमेन या आयाम, जिनका मानव व्यक्तित्व को वर्णित करने के लिए उपयोग किया जाता है।
बिग फ़ाइव कारक हैं खुलापन (Openness), कर्तव्यनिष्ठा (Conscientiousness), बहिर्मुखता (Extraversion), सहमतता (Agreeableness) और मनोविक्षुब्धता (Neuroticism) (यदि पुनर्व्यवस्थित किया जाए तो OCEAN, या CANOE). मनोविक्षुब्धता कारक को कभी-कभी भावनात्मक स्थिरता के रूप में भी संदर्भित किया जाता है। खुलेपन के घटक की व्याख्या के संबंध में कुछ असहमति अभी बाकी है, जिसे कभी-कभी ""समझ"" कहा जाता है। 

प्रत्येक कारक के साथ अनेक विशिष्ट लक्षणों का समूह जुड़ा हुआ है जो एक साथ सह-संबद्ध हैं। उदाहरण के लिए, बहिर्मुखता में सामाजिकता, उत्साही, आवेग और सकारात्मक भावनाएं जैसे संबंधित गुण शामिल हैं।

पांच कारक मॉडल व्यक्तित्व का विशुद्ध व्याख्यात्मक मॉडल है, लेकिन मनोवैज्ञानिकों ने बिग फ़ाइव (महान पांच) के लिए असंख्य सिद्धांत विकसित किए हैं।",140,मनोविज्ञान
अनजा हजदुक,अंजा हजुक (जन्म 8 जून 1963) एक जर्मन राजनीतिज्ञ हैं।  वह 1995 से एलायंस '90 / द ग्रीन्स की सदस्य हैं।,21,मनोविज्ञान
डेविड कार्प,"डेविड कार्प (जन्म: 6 जुलाई 1986 एक अमेरिकी जालस्थल विकासकर्ता और उद्यमी है। वो लघु-रूपी चिठ्ठा स्थल टम्बलर (Tumblr) के संस्थापक और मुख्य कार्यकारी अधिकारी हैं। फोर्ब्स के मुताबिक़, कार्प की कुल संपत्ति 200 मिलियन डॉलर और टम्बलर 800 मिलियन डॉलर से अधिक है। 20 मई 2013 को घोषणा की गयी थी की याहू और टम्बलर एक सौदे तय कर चुके हैं जिसके तहत याहू 1.1 बिलयन डॉलर के बदले अधिग्रहण करेगा। कार्प कंपनी के मुख्य कार्यकारी अधिकारी बने रहेंगे।
न्यूयॉर्क शहर में जन्मे और बड़े हुए कार्प एनीमेशन कंपनी फ्रेडेरेटर स्टूडियो में फ्रेड सीबर्ट के तहत एक प्रशिक्षु के रूप में अपना कैरियर शुरू किया। इसके पश्चात् कार्प 2006 में ऑनलाइन माता-पिता सहायक मंच मंच अर्बनबेबी (UrbanBaby) के लिए काम किया जिसे बाद में सीनेट (CNET) को बेच दिया गया था। कार्प ने अपनी स्वयं की सॉफ्टवेर सलाहकार कंपनी खोली तो जिसका नाम उसने डेविडविल्ल (Davidville) रखा। यहाँ पर कार्प ने ग्राहकों की परियोजनाओं के लिए कंप्यूटर इंजीनियर मार्को अर्मेंट के साथ काम किया है। 2006 के अंतराल के दौरान 2 फरवरी 2007 में टम्बलर पर कम शुरू किया जो एक लघु चिट्ठाकारी जालस्थल के रूप में प्रारंभ हुई। 19 मई 2013 तक 108 मिलियन ब्लॉग से अधिक टम्बलर पर मौजूद थे। अगस्त 2009 में, कार्प बिज़नेस वीक द्वारा सर्वश्रेष्ठ युवा टेक उद्यमी 2009 घोषित हुआ। और 2010 में एम् आई टी रिव्यु द्वारा 25 साल की उम्र में दुनिया के सर्वोच्च नवीन आविष्कारियों में से एक घोषित हुआ।",240,मनोविज्ञान
कोलन वर्गीकरण,"द्विबिन्दु वर्गीकरण या कोलन वर्गीकरण (Colon classification (CC)), पुस्तकालय वर्गीकरण की एक प्रणाली है जिसका विकास एस आर रंगनाथन ने किया था। यह प्रथम मुखर (या विश्लेषणात्मक-संश्लेषणात्मक) वर्गीकरण था। इसका प्रथम संस्करण 1933 में प्रकाशित हुआ था। तब से छह और संस्करण प्रकाशित हो चुके हैं। यह वर्गीकरण भारत में पुस्तकालयों में विशेष रूप से उपयोग किया जाता है। कोलन वर्गीकरण प्रणाली एक वैज्ञानिक तथा तार्किक प्रणाली के रूप में स्थापित हो चुकी है; फिर भी इसके विभिन्न सिद्धान्तों तथा प्रावधानों को कभी-कभी 'कठिन' करार दिया जाता है इसमें मिश्रित अंकन का प्रयोग किया गया हैं।इसके अब तक 7 संस्करण आ चुके है अंतिम संकरण 1987 में आया था।

उदाहरण
""research in the cure of tuberculosis of lungs by x-ray conducted in India in 1950"" नामक विषय को निम्नलिखित श्रेणी में रखा जाएगा-

Medicine,Lungs;Tuberculosis:Treatment;X-ray:Research.India'1950
इसको एक विशिष्ट पुकार संख्या (call number) के रूप में निम्न प्रकार से लिखा जाता है :

L,45;421:6;253:f.44'N5",152,मनोविज्ञान
फोरेंसिक (2022 फ़िल्म),"फोरेंसिक : द ट्रुथ लाइज़ विदिन (हिन्दी अनुवाद: सत्य भीतर छिपा है; प्रचलित नाम फोरेंसिक) सन् 2022 की हिंदी भाषा की भारतीय मनोविज्ञान थ्रिलर फ़िल्म है। फ़िल्म का निर्देशन विशाल फुरिया ने किया हैं। यह सन् 2020 की मलयालम फ़िल्म फोरेंसिक का आधिकारिक रीमेक है। फ़िल्म में विक्रांत मैस्सी, राधिका आप्टे, प्राची देसाई, रोहित रॉय और हरबंदना कौर मुख्य भूमिकाओं में हैं। फ़िल्म की कहानी मसूरी के एक पुलिस अधिकारी और एक फोरेंसिक विशेषज्ञ के इर्द-गिर्द घूमती है, जो एक सीरियल किलर की तलाश में हैं। इसे 24 जून 2022 को ज़ी5 पर रिलीज़ किया गया था। फ़िल्म को दर्शकों से सकारात्मक समीक्षाएँ मिलीं थी।",105,मनोविज्ञान
"बाल विद्या मंदिर, लखनऊ","बाल विद्या मंदिर, लखनऊ, (जिसे बीवीएम के रूप में संक्षिप्त किया गया है) भारत के लखनऊ में स्थित एक अंग्रेजी माध्यम, सह-शिक्षा विद्यालय है।  1963 में उत्तर प्रदेश के पूर्व मुख्यमंत्री, श्रध्देय चन्द्र भानु गुप्ता द्वारा स्थापित,  सीबीएसई से संबद्ध स्कूल, नर्सरी से बारहवीं कक्षा (10 + 2) तक शिक्षा प्रदान करता है।   स्कूल ने वर्ष 2014 में अपना अर्धवार्षिक उत्सव मनाया था। यह मोतीलाल नेहरू मार्ग पर स्थित है।  चारबाग रेलवे स्टेशन, स्टेशन रोड, लखनऊ।
सुरम्य वातावरण के बीच संस्थान एक विशाल इमारत में स्थित है।  इंस्टीट्यूशन में विभिन्न विषयों पर पुस्तकों के एक बड़े संग्रह के साथ एक अच्छी तरह से सुसज्जित पुस्तकालय है, जो ज्ञान के क्षेत्र की खोज करने में मदद करता है। स्कूल के साथ ही बाल संघराय भी है, जो अपने आप में एक शिक्षा प्रणाली है।
यद्यपि बाल विद्या मंदिर सीनियर सेकेंडरी स्कूल पब्लिक स्कूल की तर्ज पर चलता है, फिर भी यह भारतीय सोच, संस्कृति और परंपराओं में गहराई से निहित है।  बच्चों के सर्वांगीण विकास को सुविधाजनक बनाने के लिए स्कूल की शिक्षा प्रणाली तैयार की गई है।  बच्चों को आत्म-अनुशासन, स्वयं-सेवा और एक संगठित प्रीफेक्ट प्रणाली के विकास के माध्यम से यथासंभव अपने मामलों का प्रबंधन करने के लिए प्रोत्साहित किया जाता है।",203,मनोविज्ञान
राठौड़ श्रावण,"राठौड श्रावण (जन्म 21 अगस्त 1972) भारत के एक शिक्षाविद, मनोविज्ञानी, समाज विज्ञानी, लेखक, संपादक एवं वर्तमान हिंदी प्राध्यापक शासकीय कनिष्ठ महाविद्यालय इद्रवेल्लि जिला आदिलाबाद तेलंगाना में कार्यरत हैं।",29,मनोविज्ञान
महिला कामोत्तेजना विकार,"इस लेख में शव्द विचित्र ढंग से बिखरे पड़े है, संभवतः गूगल से अनुवाद करने के बाद यथा स्थिति छोड़ दिया गया है, ।  यहाँ क्लिक कर  त्रुटियों को सुधार सकते हैं।

महिला यौन कामोत्तेजना विकार (एफएसएडी, सामान्यतः मंदकामुकता/0} रूप में जाना जाता है यौनकामोत्तेजना प्राप्त करने के लिए एक असमर्थता विकार विशेषता द्वारा एक आवर्तक या लगातार या अन्यथा कामोत्तेजना कि यौन गतिविधि पूरा होने तक कामोत्तेजना प्रतिक्रिया बनाए रखने के लिए, या एक कामोत्तेजना और यौन गतिविधि के दौरान पर्याप्त स्नेहन-सूजन उपस्थिति नहीं होती है।  इस तरह की हालत को सामान्य कामोन्माद रुचिहानिऔर यौन गतिविधि विकार से विलग किया जाना चाहिए है जैसे अन्य यौन रोग और अधःसक्रियता यौन इच्छा विकार, और विशेषता के रूप में यौन फंतासी अभाव या अनुपस्थिति के एक यौन समय की कुछ अवधि के लिए गतिविधि. 
वर्तमान में हालांकि महिला यौन रोग उत्पादों को बढ़ावा देने है नैदानिक कंपनियों FSD के इलाज के लिए दवा के लिए शुरुआत कर रहे हैं, अक्सर कम खुराककी टेस्टोस्टेरोनशामिल है।",163,मनोविज्ञान
