title,content,word_count,topic
रेनर,"रेनर एक जर्मनिक पुरुष नाम है।

रैनर वाइस, अमेरिकी भौतिक विज्ञानी
रैनर ज़िटलमैन, जर्मन इतिहासकार, समाजशास्त्री और उद्यमी",18,समाजशास्त्र
जॉर्ज रिटज़र,जॉर्ज रिटज़र (जन्म 1940) एक अमरीकी समाजशास्‍त्री हैं।,8,समाजशास्त्र
१ जनवरी,१ जनवरी ग्रेगोरी कैलंडर के अनुसार वर्ष का पहला दिन है। वर्ष में अभी और ३६४ दिन बाकी है (लीप वर्ष में ३६५)।,23,समाजशास्त्र
नियाज़ फ़तेहपुरी,"नियाज़ फ़तेहपुरी (1884-1966) नियाज़ मुहम्मद खान,  एक उर्दू कवि, लेखक और नीतिशास्त्री थे। वह निगार के संस्थापक और संपादक भी थे, जो प्रतिष्ठित उर्दू साहित्यिक पत्रिकाओं में से एक था। 1962 में उन्हें ""साहित्य और शिक्षा"" के लिए भारत के राष्ट्रपति द्वारा पद्म भूषण से सम्मानित किया गया था।",49,समाजशास्त्र
धर्मशास्त्र,"धर्मशास्त्र संस्कृत ग्रन्थों का एक वर्ग है, जो कि शास्त्र का ही एक प्रकार है। इसमें सभी स्मृतियाँ सम्मिलित हैं। यह वह शास्त्र है जो हिन्दुओं के धर्म का ज्ञान सम्मिलित किये हुए हैं, धर्म शब्द में यहाँ पारंपरिक अर्थ में धर्म तथा साथ ही कानूनी कर्तव्य भी सम्मिलित हैं। 
धर्मशास्त्रों का बृहद् पाठ भारत की ब्राह्मण परंपरा का अंग है, तथा यह विद्वत्परंपरा की देन एवं एक विशद तंत्र है। इसके गहन न्यायशास्त्रीय विवेचन के कारण प्रारंभिक ब्रिटिश औपनिवेशिक प्रशासकों द्वारा यह हिंदुओं के लिए कानून के रूप में माना गया था तब से लेकर आज भी धर्मशास्त्र को हिन्दू विधिसंहिता के रूप में देखा जाता है। धर्मशास्त्र में उपस्थित रिलीजन व कानून के बीच जो अंतर किया जाता है, दरअसल वह कृत्रिम है और बार-बार उसपर प्रश्न उठाये गये हैं। जबकि कुछ लोग, धर्मशास्त्र में धार्मिक व धर्मनिरपेक्ष कानूनों के बीच अंतर रखा गया है ऐसा पक्ष लेते हैं। धर्मशास्त्र हिन्दू परंपरा में महत्त्वपूर्ण है, क्योंकि- एक, यह एक आदर्श गृहस्थ के लिए धार्मिक नियमों का स्रोत है, तथा दूसरे, यह धर्म, विधि, आचारशास्त्र आदि से संबंधित हिंदू ज्ञान का सुसंहत रूप है।
""पांडुरंग वामन काणे, सामाजिक सुधार को समर्पित एक महान विद्वान्, ने इस पुरानी परंपरा को जारी रखा है। उनका धर्मशास्त्र का इतिहास, पाँच भागों में प्रकाशित है, प्राचीन भारत के सामाजिक विधियों तथा प्रथाओं का विश्वकोश है। इससे हमें प्राचीन भारत में सामाजिक प्रक्रिया को समझने में मदद मिलती है।""",235,समाजशास्त्र
डेविड सी. लेन,"डेविड क्रिस्टोफर लेन का जन्म 29 अप्रैल 1956 में, बर्बैंक, कैलीफोर्निया में हुआ और वे वाल्नेट, कैलिफ़ोर्निया के माऊंट सैन एंटोनियो कालेज में दर्शनशास्त्र और समाजशास्त्र के प्रोफेसर हैं। इन्हें अपनी पुस्तक 'द मेकिंग ऑफ अ स्पिरीचुअल मूवमेंट: द अनटोल्ड स्टोरी ऑफ पॉल ट्विचटेल एंड एकंकार' में एकंकार (En-Eckankar) को संप्रदाय के तौर पर और उसके संस्थापक को साहित्यिक चोरी के लिए पहचानने के लिए सबसे अधिक जाना जाता है। भारत में इन्हें नए धार्मिक आंदोलनों विशेषकर राधास्वामी मत पर उनके शोध और भारत के आमूलपरिवर्तनवादी और सुरत शब्द योग के साधक और खोजी फकीर बाबा फकीर चंद को पाश्चात्य जगत में परिचित कराने के लिए भी जाना जाता है। लेन ने एक पुस्तक 'द अननोइंग सेज:लाइफ एंड वर्क ऑफ बाबा फकीर चंद' का संपादन और प्रकाशन किया। इस पुस्तक की भूमिका जो लेन ने लिखी है वह सुरत शब्द अभ्यासियों (योगियों) के आंतरिक अनुभवों के वैज्ञानिक पक्षों का वर्णन करती है और फकीर की बेबाक उक्तियों को समेटे हुए हैं। लेन ने सैन डीगो में यूनीवर्सिटी ऑफ कैलीफोर्निया से डॉक्टरेट (पीएच. डी) और 'सोशियॉलॉजी ऑफ नॉलेज' में स्नात्कोत्तर डिग्री (एम ए) किया हुआ है। इसके अतिरिक्त इन्होंने 'धार्मिक घटना-क्रिया-विज्ञान (दृश्यप्रपंचशास्त्र) और उसका इतिहास' में भी 'एम ए' किया हुआ है। इस समय ये कैलीफोर्निया स्टेट यूनीवर्सिटी में 'धार्मिक अध्ययन' के प्राध्यापक हैं और संप्रदायों सहित नए धार्मिक आंदोलनों के अध्ययन के विशेषज्ञ हैं। जन्म से रोमन कैथोलिक हैं। 1978 में राधास्वामी सत्संग ब्यास के बाबा सत्गुरु चरण सिंह से नामदान लिया। बाद में इनका हृदय परिवर्तन हुआ और इन्होंने सभी तो नहीं परंतु कुछ शिक्षाओं को त्याग दिया।  अपने एक इंटरव्यू में लेन ने कई धार्मिक आंदोलनों के समर्थकों से मिल रही हत्या की धमकियों की भी बात की है।",281,समाजशास्त्र
समाज-विज्ञान विश्वकोश,"समाज-विज्ञान विश्वकोश हिन्दी भाषा में समाज-विज्ञान एवं मानविकी से सम्बद्ध विषयों पर केन्द्रित एक बहुआयामी विश्वकोश है। इसमें इन विषयों से सम्बद्ध प्रविष्टियों में विश्लेषणात्मक रूप से विविध विचारों, मुद्दों विचारक-लेखक-व्यक्तित्व-कृतित्व एवं आंदोलनों का परिमार्जित अध्ययन प्रस्तुत किया गया है। इसका सम्पादन अभय कुमार दुबे ने किया है।",48,समाजशास्त्र
अवव्याख्यावाद,दर्शनशास्त्र में अवव्याख्यावाद (reductionism) ऐसी विचारधारा होती है जो यह दावा करे कि किसी भी जटिल परिघटना को समझने के लिये केवल उस से सम्बधित सबसे सरल भौतिक भागों के गुणों व व्यवहारों की समझने की ही आवश्यकता है। मसलन अवव्याख्यावादी मनोवैज्ञानिक यह कहते हैं कि समाजशास्त्र का अध्ययन काफ़ी हद तक व्यर्थ है और केवल मानवों के मस्तिष्क व मनोवैज्ञानिक गुणों के अध्ययन ही सभी समाजिक विषयों को समझने के लिए पर्याप्त है क्योंकि समाज मनुष्यों से बना हुआ होता है। अवव्याख्यावाद के विरोधी यह कहते हैं कि समाज को केवल व्यक्तियों के मनोविज्ञान से नहीं समझा जा सकता और उसके साथ-साथ सामाजिक तंत्रों का भी अध्ययन करना आवश्यक है।,111,समाजशास्त्र
जॉर्ज हर्बर्ट मीड,"जॉर्ज हर्बर्ट मीड (George Herbert Mead ; 1863 -- 1931) अमेरिकी समाजशास्त्री थे जो अमेरिकी व्यावहारिकता (प्रैग्मैटिज्म) के संस्थापक, प्रतीकात्मक अन्तःक्रियावाद (symbolic interactionism) के अग्रणी और सामाजिक मनोविज्ञान के संस्थापकों में से एक के रूप में जाने जाते थे।",39,समाजशास्त्र
प्रीति शिनॉय,"प्रीति शिनॉय' भारत में सबसे अच्छे लेखकों में से एक हैं। फोर्ब्स इंडिया की 100 सबसे प्रभावशाली हस्तियों की सूची (2013 संस्करण) में उनका नाम है। शेनॉय फोटोग्राफी और योग से समाजशास्त्र को लेकर विविध रुचियाँ रखती हैं। ब्रिटेन में संक्षिप्त रहने के बाद, शेनॉय ने शादी की और दो बच्चों की माँ बनीं। वह वर्तमान में बंगलौर में रहती है।
वेस्टलैंड लिमिटेड द्वारा प्रकाशित उनकी नवीनतम पुस्तक, "" द् वन यू कन्नोट हैव "" (The one you cannot have) नवंबर में जारी किया है और पाठकों से उत्साही, सकारात्मक समीक्षा सभा गया है ॥",95,समाजशास्त्र
पिपीलिका विज्ञान,"पिपीलिकाशास्त्र या पिपीलिका विज्ञान या चींटी विज्ञान (Myrmecology, मिरमेकोलोजी) कीट विज्ञान की वह शाखा है जिसमें चींटी व दीमक का वैज्ञानिक अध्ययन करा जाता है। पिपीलिकाशास्त्री चींटियों के समाज तथा उसके संगठन और प्रक्रियाओं का भी अध्ययन करते हैं। पिपीलिकाशास्त्र का कीट अध्ययन में महत्व तो है ही, लेकिन चींटियों की आपसी अंतःक्रिया को संगणिकी (कम्प्यूटिंग) में भी यंत्र शिक्षण (मशीन लरनिंग) व समांतर संगणिकी जैसे क्षेत्रों में सैद्धांतिक प्रतिमान के रूप में प्रयोग करा जाता है।",77,समाजशास्त्र
बेंजामिन किड,बेंजामिन किड (Benjamin Kidd ; 1858–1916) ब्रिटेन के समाजशास्त्री थे जिनकी 'सामाजिक विकास' (Social Evolution) नामक पुस्तक १८९४ में बहुत प्रसिद्ध हुई। इस पुस्तक में उन्होने तर्क दिया है कि 'समाज एवं आधुनिक सभ्यता' का विकास 'तर्क' अथवा 'विज्ञान' से नहीं होता बल्कि 'धार्मिक विश्वासों' के बल से होता है।,50,समाजशास्त्र
अभिजाततंत्र,"अभिजाततंत्र (अरिस्टॉक्रैसी) वह शासनतंत्र है जिसमें राजनीतिक सत्ता अभिजन के हाथ में हो। इस संदर्भ में ""अभिजन"" का अर्थ है कुलीन, विद्वान, सद्गुणी, उत्कृष्ट। पश्चिम में ""अरिस्टॉक्रैसी"" का अर्थ भी लगभग यही है। अफ़लातून (प्लेटो) और उसके शिष्य अरस्तू ने अपनी पुस्तकों में अरिस्टाक्रैसी को बुद्धिमान, सद्गुणी व्यक्तियों का शासनतंत्र माना है।",52,समाजशास्त्र
फर्नँडो हेनरीक़ुए कार्डोसो,"फर्नांडो हेनरिक कार्डसो ( पुर्तगाली:  [ferɐ̃nʊdẽˈ ikihiki karˈdozʊ] ; जन्म 18 जून, 1931), जिसे उनके प्रारंभिक एफएचसी द्वारा भी जाना जाता है ([isfjaɛaˈse] ), एक ब्राजील के समाजशास्त्री , प्रोफेसर और राजनेताजिन्होंने1 जनवरी, 1995 से 31 दिसंबर, 2002 तकब्राज़ील के 34 वें राष्ट्रपति के रूप में कार्य किया। वह बाद में दोबारा चुने जाने वाले पहले ब्राजील के राष्ट्रपति थे अवधि। एक निपुण विद्वान ने दासता और राजनीतिक सिद्धांत पर शोध के लिए विख्यात किया, कार्डसो ने कई सम्मान अर्जित किए हैं, जिनमें प्रिंस ऑफ एस्टुरियस अवार्डफॉर इंटरनेशनल कोऑपरेशन (2000) औरयूएसलाइब्रेरी ऑफ कांग्रेस (2012)से क्लूज पुरस्कार शामिल हैं ।",99,समाजशास्त्र
राधा कुमुद मुखर्जी,"राधाकुमुद मुखर्जी  (१८८४ - १९६४) भारतीय इतिहासकार तथा प्रसिद्ध राष्ट्रवादी चिन्तक थे। वे समाजशास्त्री राधाकमल मुखर्जी के भाई थे। भारत सरकार ने उन्हें सन १९५७ में पद्म भूषण से सम्मानित किया गया। 
'हिन्दू सिविलाइजेशन' उनकी प्रमुख कृति है जिसका हिंदी अनुवाद वासुदेवशरण अग्रवाल ने 'हिन्दू सभ्यता' शीर्षक से किया है।
प्रो० राधकुमुद मुखर्जी का जन्म बंगाल के एक शिक्षित परिवार में हुआ। कोलकाता के प्रेजीडेंसी कॉलेज से इतिहास तथा अंग्रेजी में एम.ए. की डिग्री लेने के बाद उन्होंने कलकत्ता विश्वविद्यालय से पीएच.डी. की डिग्री प्राप्त की।
अपने शैक्षणिक जीवन का आरम्भ उन्होंने अंग्रेजी के प्रोफ़ेसर के रूप में की, लेकिन कुछ समय बाद ही वे इतिहास में चले गए और बनारस हिन्दू विश्वविद्यालय में प्राचीन भारतीय इतिहास तथा संस्कृति के महाराजा सर मनीन्द्रचन्द्र नन्दी प्रोफ़ेसर के रूप में नियुक्त हुए। इस पर वे केवल एक वर्ष रहे और उसके तुरन्त बाद मैसूर विश्वविद्यालय में इतिहास के पहले प्राध्यपक नियुक्त हुए। सन् 1921 में उन्होंने लखनऊ विश्वविद्यालय के इतिहास विभागाध्यक्ष का पदभार ग्रहण किया और मृत्युपर्यन्त वहीं बने रहे। सन् 1963 में 83 वर्ष की आयु में उनका देहान्त हुआ।
प्रो. राधाकुमुद मुखर्जी आजीवन प्राचीन भारतीय इतिहास के अध्ययन में लगे रहे और उन्होंने प्राचीन भारत के विभिन्न पक्षों पर विस्तृत एवं आलोचनात्मक शोध-निबन्ध लिखे। अपने अनेक ग्रन्थों में उन्होंने निष्कर्षों तक पहुँचने से पहले सभी उपलब्ध स्रोतों और जानकारियों का भरपूर उपयोग किया।",223,समाजशास्त्र
