title,content,word_count,topic
कैरोलिन वॉकर-डायलो,"कैरोलिन वॉकर-डियालो: एक अमेरिकी न्यायाधीश हैं। वह न्यूयॉर्क राज्य में न्यायाधीश के रूप में निर्वाचित पहली मुस्लिम थीं।
2015 में, वॉकर-डियालो को न्यूयॉर्क सिटी सिविल कोर्ट के लिए चुना गया, जो 7वें म्यूनिसिपल कोर्ट डिस्ट्रिक्ट का प्रतिनिधित्व करता है, जिसमें ब्राउन्सविले, ब्रुकलिन, ईस्ट न्यूयॉर्क, साइप्रस हिल्स और बुशविक शामिल हैं। 10 दिसंबर 2015 को उन्होंने 

क़ुरआन पर अपने पद की औपचारिक शपथ ली थी।",64,पोषण
भारतीय कृषि में महिलाएं,"भारत में कृषि उर्वरता सिमित करती राष्ट्रीय परंपरा है। उत्तर में, सिंधु घाटी और ब्रह्मपुत्र क्षेत्र, गंगा नदी और सावन के मौसम के कारण महत्वपूर्ण कृषि क्षेत्र हैं। २०११ के विश्व बैंक के आंकड़ों के मुताबिक, भारत के सकल घरेलू उत्पाद का केवल १७.५% हिस्सा कृषि उत्पादन से आता है। फिर भी, कृषि देश के अधिकांश लोग जो ग्रामीण भारत में रहते हैं उनके जीवन निर्वाह का मुख्य साधन है।
भारत में कृषि पारिवारिक परंपरा, सामाजिक संबंधों और लैंगिक भूमिकाओं को परिभाषित करती है। कृषि क्षेत्र में महिला, चाहे पारंपरिक साधनों के माध्यम से हो या औद्योगिक, निर्वाह के लिए या एक कृषि मजदूर के रूप में, एक क्षणिक जनसांख्यिकीय समूह का प्रतिनिधित्व करती है। कृषि सीधे आर्थिक स्वतंत्रता, निर्णय लेने की क्षमता, एजेंसी और शिक्षा और स्वास्थ्य सेवाओं तक पहुंच जैसे मुद्दों से जुड़ी हुई है और इस तरीके से गरीबी और हाशिए पर रहने वाले और लैंगिक असमानता जैसे जटिल मुद्दे पैदा हुए हैं।",156,पोषण
लॉरेन लेन,"लॉरा ""लॉरेन"" लेन (Laura ""Lauren"" Lane; जन्म 2 फरवरी 1961) एक अमेरिकी फिल्म, टेलीविजन, मंच अभिनेत्री और प्रोफेसर हैं। उन्हें द नैनी में सी॰सी॰ बेबकॉक के अभिनय के लिए जाना जाता है।",32,पोषण
चार्वाक दर्शन,"चार्वाक दर्शन एक प्राचीन भारतीय भौतिकवादी नास्तिक दर्शन है। यह मात्र प्रत्यक्ष प्रमाण को मानता है तथा पारलौकिक सत्ताओं को यह सिद्धांत स्वीकार नहीं करता है। यह दर्शन वेदबाह्य भी कहा जाता है।
वेदबाह्य दर्शन छः हैं- चार्वाक, माध्यमिक, योगाचार, सौत्रान्तिक, वैभाषिक, और आर्हत (जैन)। इन सभी में वेद से असम्मत सिद्धान्तों का प्रतिपादन है।
अजित केशकंबली को चार्वाक के अग्रदूत के रूप में श्रेय दिया जाता है, जबकि बृहस्पति को आमतौर पर चार्वाक या लोकायत दर्शन के संस्थापक के रूप में जाना जाता है।  चार्वाक , बृहस्पति सूत्र (600 ईसा पूर्व) के अधिकांश प्राथमिक साहित्य गायब या खो गए हैं।  इसकी शिक्षाओं को ऐतिहासिक माध्यमिक साहित्य से संकलित किया गया है जैसे कि शास्त्र, सूत्र, और भारतीय महाकाव्य कविता में और गौतम बुद्ध के संवाद और जैन साहित्य से।  चार्वाक प्राचीन भारत के एक अनीश्वरवादी और नास्तिक तार्किक थे। ये नास्तिक मत के प्रवर्तक बृहस्पति के शिष्य माने जाते हैं। बृहस्पति और चार्वाक कब हुए इसका कुछ भी पता नहीं है। बृहस्पति को चाणक्य ने अपने अर्थशास्त्र ग्रन्थ में अर्थशास्त्र का एक प्रधान आचार्य माना है।
चार्वाक दर्शन शब्द में 'चर्व' का अर्थ है - खाना । इस 'चर्व' पदसे ही 'खाने-पीने और मौज करने' का संदेश देने वाले इस दर्शन का नाम 'चार्वाक दर्शन' पड़ा है । 'गुणरत्न' ने इसकी व्याख्या इस प्रकार से की है- परमेश्वर, वेद, पुण्य-पाप, स्वर्ग-नरक, आत्मा, मुक्ति इत्यादि का जिसने 'चर्वण' (नामशेष) कर दिया है, वह 'चार्वाक दर्शन' है। इस मत के लोगों का लक्ष्य अपने मत की स्थापना की अपेक्षा दूसरे के मत का खण्डन के प्रति अधिक रहने से उनको 'वैतण्डिक' कहा गया है।",263,पोषण
प्राकृतिक चिकित्सा,"प्राकृतिक चिकित्सा (नेचुरोपैथी / naturopathy) एक वैकल्पिक चिकित्सा-पद्धति एवं दर्शन है जिसमें 'प्राकृतिक', 'स्व-चिकित्सा' (self-healing), 'अनाक्रामक'  (non-invasive) आदि कहे जाने वाले तरीकों का उपयोग होता है जिन्हें छद्मवैज्ञानिक तरीके कहा जा सकता है । प्राकृतिक चिकित्सा का दर्शन और विधियाँ प्राणतत्त्ववाद (vitalism ) और लोक चिकित्सा पर आधारित हैं न कि प्रमाण-आधारित चिकित्सा (EBM) पर। 
प्राकृतिक चिकित्सा के अन्तर्गत रोगों का उपचार व स्वास्थ्य-लाभ का आधार है - 'रोगाणुओं से लड़ने की शरीर की स्वाभाविक शक्ति'। डा0 श्री प्रकाश बरनवाल राष्ट्रीय अध्यक्ष एकयुप्रेशर योग नेचुरोपैथी काउंसिल का कहना है कि प्राकृतिक चिकित्सा के अन्तर्गत समाज में

अनेक पद्धतियां हैं जैसे - जल चिकित्सा, होमियोपैथी, सूर्य चिकित्सा, एक्यूपंक्चर, एक्यूप्रेशर, मृदा चिकित्सा आदि। प्राकृतिक चिकित्सा के प्रचलन में विश्व की कई चिकित्सा पद्धतियों का योगदान है। 

प्राकृतिक चिकित्सा प्रणाली चिकित्सा की एक रचनात्मक विधि है, जिसका लक्ष्य प्रकृति में प्रचुर मात्रा में उपलब्ध तत्त्वों के उचित इस्तेमाल द्वारा रोग का मूल कारण समाप्त करना है। यह न केवल एक चिकित्सा पद्धति है बल्कि मानव शरीर में उपस्थित आंतरिक महत्त्वपूर्ण शक्तियों या प्राकृतिक तत्त्वों के अनुरूप एक जीवन-शैली है। यह जीवन कला तथा विज्ञान में एक सम्पूर्ण क्रांति है। इस प्राकृतिक चिकित्सा पद्धति में प्राकृतिक भोजन, विशेषकर ताजे फल तथा कच्ची व हलकी पकी सब्जियाँ विभिन्न बीमारियों के इलाज में निर्णायक भूमिका निभाती हैं। प्राकृतिक चिकित्सा निर्धन व्यक्तियों एवं गरीब देशों के लिये विशेष रूप से वरदान है।",225,पोषण
जेमिनी गणेशन,"जेमिनी गणेशन (तमिल: ஜெமினி கணேசன்)(17 नवम्बर 1920-22 मार्च 2005) एक भारतीय अभिनेता थे। फिल्मों में रोमांटिक भूमिकाएं निभाने के लिए तमिल सिनेमा जगत में उन्हें ""कादल मन्नान""(रोमांस का देवता) का उपनाम दिया गया था।",34,पोषण
जमशेदपुर वीमेंस कॉलेज,"जमशेदपुर वीमेंस कॉलेज, झारखंड राज्य के जमशेदपुर १९५३ में स्थापित एक महिला महाविद्यालय है। इसकी स्थापना पेरिन सी मेहता द्वारा की गई थी। १९६२ में रतन टाटा द्वारा महाविद्यालय को इसका अपना परिसर प्राप्त हुआ। यह महाविद्यालय कला, वाणिज्य एवं विज्ञान विषय में डिग्री प्रदान की जाती है। यह महाविद्यालय कोल्हान विश्वविद्यालय से संबद्ध है जिसे राष्ट्रीय मूल्यांकन एवं प्रत्यायन परिषद (NAAC) द्वारा 'ए' ग्रेड प्रदान किया गया है। इस महाविद्यालय को विश्वविद्यालय अनुदान आयोग द्वारा सेंटर फॉर पोटेंशियल ऑफ एक्सीलेंस के केंद्र (CPE) के रूप में पहचान प्राप्त हुई है। अनुसूचित जाति और जनजाति की छात्राओं पर विशेष ध्यान देते हुए यह महाविद्यालय समावेशी शिक्षा प्रदान करता है। झारखंड राज्य विश्वविद्यालय संशोधन कानून २०१७ के अंतर्गत यह महाविद्यालय झारखंड राज्य का पहला महिला विश्वविद्यालय बनने की ओर अग्रसर है। इसके लिये केन्द्र प्रायोजित योजना राष्ट्रीय उच्चतर शिक्षा अभियान (रुसा) द्वारा वित्तीय सहायता दी जा रही है।
झारखंड और बिहार के पहले महिला विश्वविद्यालय का आधार जमशेदपुर में रखा गया। जमशेदपुर वीमेंस कॉलेज को अब जमशेदपुर महिला विश्वविद्यालय के रूप में  में अपग्रेड कर दिया गया। इसके लिए झारखंड राज्य विश्वविद्यालय संशोधन अधिनियम 2018 और झारखंड अधिनियम 06, 2019 की मंजूरी प्राप्त की गई है।",195,पोषण
केला,,0,पोषण
लॉर्ड वोल्डेमॉर्ट,"लॉर्ड वोल्डेमॉर्ट (अंग्रेज़ी: Lord Voldemort) जे॰ के॰ रोलिंग द्वारा रचित हैरी पॉटर (उपन्यास) शृंखला का एक काल्पनिक चरित्र है। वो इस उपन्यास के मुख्य किरदार हैरी पॉटर का मुख्य प्रतिद्वन्दी व खलनायक है। वोल्डेमॉर्ट का असली नाम टॉम (मार्वोलो) रिडल है। उसका प्रथम अवतरण हैरी पॉटर और पारस पत्थर में होता है। वह तृतीय भाग हैरी पॉटर और अज़्काबान का क़ैदी को छोड़कर बाकी हर भाग में है। तृतीय भाग में केवल उसका जिक्र मिलता है।   
वोल्डेमॉर्ट तन्त्र-मन्त्र और जादू-टोने के विद्यालय हॉग्वार्ट्स से शिक्षित है। उसका पिता टॉम रिडल सीनियर सामान्य मगलू (ग़ैर-जादूगर) था। उसकी माँ मेरोपी रिडल (जन्म : मेरोपी गॉण्ट) सलाज़ार स्लिदरिन, से निकले शुद्ध रक्त वाले ख़ानदान से थी, जो कि हॉग्वार्ट्स तन्त्र-मन्त्र और जादू-टोना विद्यालय के चार संस्थापकों में एक थे। बालक टॉम रिडल अनाथालय में जन्मा और पला-बढ़ा। जल्द ही उसे मगलू इंसानों और अशुद्ध रक्त (मगलुओं की पैदाइश) वाले जादूगरों से सख़्त नफ़रत होते लगी और साथ ही साथ काले जादू में उसका उत्साह बढ़ता गया। धीरे धीरे उसने अपनी तरह सोचने वाले बहुत से जादूगर इकठ्ठे किये और प्राण भक्षी नाम का गिरोह बनाया और उनका सरदार बन गया तथा लॉर्ड वोल्डेमॉर्ट के नाम से जाना गया। जो भी उसका विरोध करता था, वो और उसका गिरोह प्राण भक्षी उसका कत्ल कर देते थे। उसने हैरी पॉटर के माता पिता दोनो का ही मृत्यु दंशम अभिशाप से कत्ल कर दिया। एक वर्षीय हैरी पर भी उसने यही अभिशाप चलाया। पर हैरी के मरने के बजाय अभिशाप पलट कर ख़ुद वोल्डेमॉर्ट को ही लग गया। हैरी बच निकला, पर वोल्डेमॉर्ट आधा-ज़िदा प्रेतात्मा बन कर रह गया। बाद में वोल्डेमॉर्ट जिस्मो-जान समेत वापस आ जाता है। उसके पास एक पालतू सर्पिनी नगिनी थी और वोल्डेमॉर्ट ख़ुद सर्पभाषा जानता है।",285,पोषण
एमिलियानो साला,"एमिलियानो राउल साला टैफ़रेल (31 अक्टूबर 1990 – 21 जनवरी 2019) अर्जेंटीना के एक पेशेवर फ़ुटबॉल खिलाड़ी थे, जो फ़ॉरवर्ड के रूप में खेलते थे। 
अर्जेंटीना में युवा फ़ुटबॉल खेलने और पुर्तगाल की क्षेत्रीय लीग में थोड़े समय के लिए खेलने के बाद, साला ने फ्रांस में बोर्डो के साथ अपने पेशेवर करियर की शुरुआत की, और फ़रवरी 2012 में अपना पेशेवर पदार्पण किया। पहली टीम में जगह बनाने के लिए संघर्ष करने के बाद, उन्हें लगातार सीज़न में चैंपियननेट नेशनल की ओर से ऑरलियन्स और लीग 2 की ओर से नीओर्ट को ऋण पर दिया गया। उन्होंने दोनों क्लबों के साथ शानदार समय बिताया, और बोर्डो में लौटने से पहले उन्होंने दोनों के बीच 39 गोल किए। अपने सफल ऋणों के बाद शुरू में बढ़ी हुई भूमिका का वादा किए जाने के बाद, साला फिर से पक्ष से बाहर हो गए, और इसके बजाय, ऋण पर साथी लीग 1 की ओर से कैन फुटबाल संघ में शामिल हो गए।",160,पोषण
यासीन खां,"चौधरी मोहम्मद यासीन खां मेव एक भारतीय राजनीतिज्ञ, समाज सुधारक और भारत के मेवात इलाके के एक प्रमुख राजनेता थे।",20,पोषण
सवारे सबके सपने प्रीतो,"सवारे सबके सपने प्रीतो ( एसएसएसपी ) एक भारतीय टेलीविजन श्रृंखला है जिसका प्रीमियर 4 जुलाई 2011 को इमेजिन टीवी पर हुआ और 12 अप्रैल 2012 को अचानक समाप्त हो गया।  कहानी एक पंजाबी पृष्ठभूमि के खिलाफ स्थित है और पांच बहनों के जीवन पर आधारित है। सुरम्य उत्तर भारतीय शहर अमृतसर में स्थित, जो एक भारतीय वायु सेना का अड्डा भी है, यह विचित्र, प्यारे ढिल्लों परिवार की कहानी है। वे एक पीढ़ी पहले विभाजन के बाद पाकिस्तान से भारत आकर बसे एक जर्जर हवेली में रहते हैं। कई मायनों में ढिल्लों परिवार एक विशिष्ट निम्न-मध्यम वर्गीय भारतीय परिवार है।इसे दंगल टीवी और दंगल 2 पर भी प्रसारित किया गया है ।
परिवार के मुखिया सेवानिवृत्त स्कूल मास्टर गंगनदीप ढिल्लों हैं, जो अपनी पत्नी कंवल और पांच बेटियों के साथ रहते हैं।",133,पोषण
"घरेलू हिंसा से महिला संरक्षण अधिनियम, 2005","घरेलू हिंसा से महिला संरक्षण अधिनियम, 2005 भारत की संसद् द्वारा पारित एक अधिनियम है जिसका उद्देश्य घरेलू हिंसा से महिलाओं को बचाना है और पीड़ित महिलाओं को विधिक सहायता उपलब्ध कराना है। यह 26 अक्टूबर 2006 को लागू हुआ।",40,पोषण
