title,content,word_count,topic
प्रणव मिस्त्री,"प्रणव मिस्त्री (जन्म 14 मई 1981) एक कंप्यूटर वैज्ञानिक और आविष्कारक हैं। वे सैमसंग में रिसर्च के ग्लोबल सीनियर वाइस प्रेसिडेंट और थिंक टैंक टीम के प्रमुख हैं। वह अपने काम के लिए जाने-माने सिक्स्थ सेंस (कम्प्यूटर सिस्टम), सैमसंग गैलेक्सी गियर और प्रोजेक्ट बियॉन्ड में जाने जाते हैं।   विश्व आर्थिक मंच ने मिस्त्री को २०१३ में युवा वैश्विक नेता (यंग ग्लोबल लीडर) के रूप में सम्मानित किया था। 
उनका जन्म पालनपुर, गुजरात, भारत में हुआ था। उन्होंने निर्मा इंस्टिट्यूट अव टेक्नॉलजी से कम्प्यूटर साइंस और इंजीनियरिंग में स्नातक की, फिर वे डिज़ाइन में मास्टर्ज़ करने भारतीय प्रौद्योगिकी संस्थान मुम्बई (IIT-B) चले गए। बाद में वे पीएचडी करने मैसाचुसेट्स प्रौद्योगिकी संस्थान चले गए।",112,कला
"भारत का दूतावास, बर्लिन","बर्लिन में भारतीय दूतावास जर्मनी संघीय गणराज्य में भारत गणराज्य का राजनयिक प्रतिनिधित्व है। दूतावास की इमारत 2001 से बर्लिन के दूतावास जिले में टियरगार्टनस्ट्रैस पर स्थित है। ""पुराने"" संघीय गणराज्य और भारत के बीच पहले राजदूतों का आदान-प्रदान 1952 में हुआ था, जब भारत 1949 में नए संघीय गणराज्य को मान्यता देने वाले पहले देशों में से एक था। 7 मार्च, 1951 को दोनों राज्यों ने इसी संधि पर हस्ताक्षर किये। 1972 से 1990 के बीच जीडीआर में एक भारतीय दूतावास भी था।",84,कला
राम सुतार,"राम सुतार (अंग्रेजी: Ram Vanji Sutar, जन्म: 19 फ़रवरी 1925) भारत के एक सुप्रसिद्ध मूर्तिकार हैं। महाराष्ट्र में जन्मे इस शिल्पकार का पूरा नाम राम वनजी सुतार है। आपने कई महापुरुषों की बहुत विशाल मूर्तियाँ बनायीं और उनके माध्यम से प्रचुर मात्रा में नाम और काम दोनों कमाया। अटल बिहारी वाजपेयी के प्रधानमन्त्रित्व काल में भारत सरकार ने आपकी कलात्मक शिल्प साधना को सम्मानित करते हुए 1999 में पद्मश्री से अलंकृत किया। इन्हें पद्म भूषण पुरस्कार भी मिला। 2018 में टैगोर कल्चरल अवॉर्ड भी मिलेगा।",85,कला
गैस टर्बाइन,"गैस टर्बाइन (gas turbine) एक प्रकार का अंतर्दहन इंजन है जो घूमने के लिए आवश्यक ऊर्जा ज्वलनशील गैस के प्रवाह से प्राप्त करता है और इसी कारण इसे 'दहन टर्बाइन' (combustion turbine) भी कहा जाता है। चूंकि टरबाइन की गति घूर्णी (रोटरी) होती है, यह विद्युत जनित्र को घुमाने के लिए विशेष रूप से उपयुक्त है। यूएसए की लगभग ९० प्रतिशत विद्युत ऊर्जा भाप टरबाइनों के सहारे ही पैदा की जाती है (१९९६)। भाप टरबाइन की दक्षता अन्य ऊष्मा इंजनों से अधिक होती है। अधिक दक्षता भाप के प्रसार के लिए कई चरणों का प्रयोग करने से प्राप्त होती है।
'गैस टरबाइन' की विभिन्न परिभाषाएँ दी जाती हैं। विस्तृत परिभाषा के अनुसार गैस टरबाइन वह मूल चालक (prime mover) है जिसके संपूर्ण उष्मीय चक्र में कार्यकारी तरल गैसीय अवस्था में ही बना रहता है एवं जिसके सभी यंत्रांगों की गति परिभ्रमी होती है। संकीर्ण परिभाषा के अनुसार इस शब्द का प्रयोग सिर्फ उस मुख्य टरबाइन अंग के लिये किया जाता है जिसका माध्यम गरम वायु होती है। कुछ विद्वानों के मतानुसार गैस टरबाइन वह यंत्र है जिसमें प्रवाह प्रक्रम अविरत रहता है एवं शक्ति टरबाइन द्वारा प्राप्त होती है।",189,कला
अल्बर्ट हॉल संग्रहालय,"अल्बर्ट हॉल संग्रहालय (अंग्रेजी :Albert Hall Museum) भारत के राजस्थान राज्य के जयपुर ज़िले में स्थित एक संग्रहालय है।  यह राजस्थान का सबसे पुराना संग्रहालय है। यह संग्रहालय ""राम निवास उद्यान"" के बाहरी ओर सीटी वॉल के नये द्वार के सामने है।  यह ""भारत-अरबी शैली"" में बनाई गयी एक बिल्डिंग है। इसकी डिजाइन सैमुअल स्विंटन जैकब ने की थी तथा यह पब्लिक संग्रहालय के रूप में 1887 में खुला था।",70,कला
डिजिटल क़ुरआन,डिजिटल कुरान : क़ुरआन को इलेक्ट्रॉनिक पाठ या एक इलेक्ट्रॉनिक कुरान का पाठ प्रदर्शित करने और कुरान रीडिंग के डिजिटल रिकॉर्डिंग चलाने के लिए समर्पित डिवाइस के लिए इस्तेमाल किया जाता है।,32,कला
ओम शांति ओम,"ओम शांति ओम २००७ में आई बॉलीवुड की एक फिल्म है जिसका निर्देशन और नृत्य निर्देशन फराह खान ने किया है। इसमें शाहरुख खान और दीपिका पादुकोण प्रमुख भूमिकाओं में हैं जबकि श्रेयस तलपड़े, अर्जुन रामपाल और किरन खेर ने अन्य महत्वपूर्ण भूमिकाएं निभाई है। अर्जुन रामपाल फिल्म में खलनायक हैं। इसके अतिरिक्त बॉलीवुड के कई अन्य सितारों ने इस फिल्म में विशेष भूमिकायें की हैं।",66,कला
शिगेरू बान,"शिगेरू बान (अँग्रेजी: Shigeru Ban,जापानी भाषा: 반 시게루, जन्म: 1957) एक जापानी और अंतरराष्ट्रीय वास्तुकार है, जो वास्तुकारिता में अपने अभिनव काम के लिए विश्व प्रसिद्ध है, विशेष रूप से पुनर्नवीनीकरण और कुशलता से आपदा पीड़ितों के घर बनाने में उन्हें महारत हासिल है। उन्हें वास्तुकला और डिजाइन की रूपरेखा के क्षेत्र में नवीन आविष्कारों तथा प्रक्षेपण के लिए 21 वीं सदी के वास्तुकारों में अँग्रेजी पत्रिका टाइम द्वारा शामिल किया गया था।
बान को वर्ष 2014 में वास्तुकला में उल्लेखनीय योगदान हेतु विश्व प्रसिद्ध प्रिज़कर आर्किटेक्चर प्राइज़ प्राप्त हुआ है। यह पुरस्कार प्राप्त करने वाले वे विश्व के 37 वें व्यक्ति हैं।",103,कला
दरभंगा तारामंडल,"तारामंडल सह विज्ञान संग्रहालय दरभंगा

दरभंगा तारामंडल बिहार का दूसरा तारामंडल-सह-विज्ञान संग्रहालय (जिसे तारामंडल या नक्षत्र-भवन भी कहा जाता है) यह कादिराबाद पॉलिटेक्निक ग्राउंड, दरभंगा, बिहार में बनाया गया है। पहले चरण में 92.8 करोड़ रुपये के बजट के साथ लगभग 21,000 वर्ग मीटर क्षेत्र में निमार्ण किया है। 2018 में निर्माण कार्य के लिए कुल 164 करोड़ रुपये के बजट की घोषणा की गई थी और पहले चरण का निर्माण दिसंबर 2022 तक पूरा हो गया था । और दुसरा चरण जनवरी 2023 में पूरा हुआ और इसका उद्घाटन 12 जनवरी 2023 को बिहार के माननीय मुख्यमंत्री नीतीश कुमार जी द्वारा किया गया था।",105,कला
अस्चांसका विला,अस्चांसका विला उत्तरी स्वीडन के शहर ऊमेओ की एक उलेखनीय इमारत है। इसका निर्माण शास्त्री रागनार ओसतबर्ग है और यह 1906 में कर्नल विल्हेम अस्चान के लिए बनाई गई थी। आज की तारीक में यह एक रेस्तरां है।,38,कला
जॉनी क्वेस्ट,"जॉनी क्वेस्ट (अंग्रेज़ी: Jonny Quest) एक मिडिया फ़्रैंचाईज़ी है जो जॉनी क्वेस्ट नाम के बच्चे पर केंद्रित है जो अपने पिता के साथ अनोखे व रोमांचकारी सफरों पर जाता है। इस फ़्रैंचाईज़ी की शुरुआत १९६४-६५ की टेलिविज़न शृंखला के रूप में हुई थी और आगे चलकर इसमें दो अन्य टेलिविज़न शृंखलाएँ, दो टेलिविज़न फ़िल्में और एक वीडियो गेम जुड गए।",60,कला
दक्षिण सिक्किम जिला,"दक्षिण सिक्किम  भारतीय राज्य सिक्किम का एक जिला है। जिले का मुख्यालय नामची है। सिक्किम राज्य का यह छोटा-सा जिला बौद्ध संस्कृति, कला और धर्म के लिए जाना जाता है। जिले के अनेक मठ इसे भव्य और खूबसूरत बनाते हैं। राज्य की सबसे प्राचीनतम मठ इसी जिले में स्थित हैं। नामची जिले का प्रशासनिक मुख्यालय है। पश्चिम बंगाल से यहां आसानी से पहुंचा जा सकता है। इस खूबसूरत जिले में ट्रैकिंग के अनेक अवसर उपलब्ध हैं। यहां की तेंदांग पहाड़ी में बौद्ध लामाओं ने काफी समय ध्यान में व्यतीत किया है। टेमी टी गार्डन सिक्किम का पहला और एकमात्र टी गार्डन है जिसकी चाय की आपूर्ति अन्तर्राष्ट्रीय बाजारों में की जाती है। धार्मिक दृष्टि से भी इस जिले का विशेष महत्व है। राज्य की चार पवित्र गुफाओं में एक यहीं स्थित है।",132,कला
दरभंगा,दरभंगा (𑂠𑂩𑂦𑂁𑂏𑂰) भारत के बिहार राज्य के अंग क्षेत्र में दरभंगा ज़िले में स्थित एक नगर है। यह ज़िले का मुख्यालय भी है।,23,कला
लहरिया,"लहरिया, राजस्थान की एक पारम्परिक 'टाई-डाई' वस्त्रकला है जिसमें वस्त्रों पर कुछ विशिष्ट पैटर्न में गहरे रंगों के डिजाइन बनाए जाते हैं। लहर या तरंग के आकार से मिलते-जुलते होने के कारण इसका नाम 'लहरिया' पड़ा है। इसे विशेषतः मेवाड़ में तैयार किया और पहना जाता है, लेकिन अब पूरे भारत में लहरिया की माँग है।
लहरिया, राजस्थान की लोक कला से प्रेरित है। इस प्रिन्ट की शुरुआत १९वीं शताब्दी में हुई थी।  यह प्रिंट पहले केवल मेवाड़ राजघराने की महिलाओं के लिए तैयार किया जाता था। नीले रंग का लहरिया आज भी मेवाड़ राजपरिवार की निशानी है। पानी की तरंगों की बनावट इस प्रिंट में साफ नजर आती है। ऊपर-नीचे उठती हुई आड़ी-तिरछी रेखाओं की छाप एक नया भाव व्यक्त करती हैं। इस प्रिंट को मारवाड़ी और राजपूत महिलाएँ काफी पसंद करतीं हैं।  
एक ही कपड़े को बहुत बार रंग कर अलग-अलग रंगों की लाइनें बनाई जाती हैं। इसी के साथ कपड़े को अलग ढंग से बांधा जाता है जिससे तिरछी लाइनें बन सकें। इस प्रिन्ट को बनाने में मेहनत होने के साथ रंगरेज की रचनात्मकता की भी उतनी ही बड़ी भूमिका है।  
हिन्दू समाज में कुछ प्रिंट और रंगों को अच्छे भाग्य का प्रतीक माना गया है। लहरिया भी इनमे से एक है। शिव-गौरी की पूजा में भी इसका बहुत महत्व है, खासकर सुहागनें इसे पहन कर ही सावन में पूजा करती हैं। सावन में लहरिया पहनने के पीछे की मंशा बारिश और पानी के मौसम को उत्सव के रूप में मनाना है।",245,कला
माधवी पारेख,"माधवी पारेख (जन्म 1942) एक भारतीय समकालीन कलाकार हैं जो नई दिल्ली में रहती हैं ।  
माधवी पारेख का जन्म अहमदाबाद के  पास संजया गाँव में हुआ था , जहाँ उनके पिता एक गांधीवादी स्कूल शिक्षक और पोस्टमास्टर थे।  
1957 में, पंद्रह साल की उम्र में, उन्होंने एक भारतीय कलाकार मनु पारेख से शादी की, जो जेजे स्कूल ऑफ आर्ट में पढ़ते थे। वे पहले अहमदाबाद, फिर मुंबई चले गए जहाँ उन्होंने मॉन्टेसरी प्रशिक्षण में एक कोर्स किया। 1964 में, वे फिर कोलकाता चले गए, जहाँ वे नई दिल्ली जाने से पहले 1965 तक रहे।",95,कला
कानपुर देहात जिला,कानपुर देहात भारतीय राज्य उत्तर प्रदेश का एक जिला है। जिले का मुख्यालय माती (अकबरपुर) है। वर्ष १९७७ में कानपुर जिले को दो भागों (कानपुर नगर तथा 'कानपुर देहात') में विभाजित कर दिया गया। १९७९ में पुनः दोनो को मिला दिया गया किन्तु १९८१ में पुनः विभाजन किया गया। १ जुलाई २०१० को इसका नाम बदलकर 'रमाबाई नगर जिला' कर दिया गया जिसे २०१२ में फिर से 'कानपुर देहात' कर दिया गया।,72,कला
ताजमहल पैलेस एंड टॉवर,"मुंबई की कोलाबा नामक जगह पर स्थित ताज महल पैलेस होटल पांच सितारा होटल है जो कि गेटवे ऑफ़ इंडिया के पास है। ‘ताज होटल, रिसॉर्ट्स एंड पैलेस’ का एक हिस्सा, यह इमारत इस समूह की प्रमुख संपत्ति मानी जाती है, जिसमे ५६० कमरे एवं ४४ सुइट्स हैं।
ताज महल होटल ११६ साल पुरानी इमारत है। मुंबई की पहचान बन चुकी इस इमारत में महानगर के अमीर और संभ्रांत लोग आते-जाते रहते हैं। विदेशी पर्यटकों में भी गेटवे ऑफ़ इंडिया के पास स्थित ताज महल होटल काफ़ी लोकप्रिय है। ताज महल होटल से समुद्र का दृश्य दिखाई देता है। २६ नवम्बर २००८ मुंबई में श्रेणीबद्ध गोलीबारी के समय यह होटल लगभग ६० घंटों तक आतंकवादियों ने अपने कब्ज़े में कर रखा था।",122,कला
रेमिंग्टन 1100 (बन्दूक),"रेमिंग्टन 1100 (बन्दूक) (अंग्रेजी: Remington Model 1100) यूनाइटेड स्टेट्स की शस्त्र निर्माता कम्पनी रेमिंग्टन आर्म्स द्वारा बनायी गयी 12 बोर की एक नाल वाली अर्द्ध स्वचालित बन्दूक है। इसकी आन्तरिक नलीनुमा मैगज़ीन में 10 और 1 चैम्बर में यानी 11 कारतूस एक के बाद एक फायर किये जा सकते हैं। 12 बोर के अलावा अब यह बन्दूक 16, 20, 28 और .410 के गेज़ (बोर व्यास) में भी बनने लगी है। यह वजन में काफी हल्की है और इससे फायर करना भी बहुत आसान है। इसका उत्पादन सन् 1963 में प्रारम्भ हुआ था तब से अब तक इस बन्दूक के कई मॉडल बाजार में आ चुके हैं और अभी भी आ रहे हैं।",113,कला
भारतीय कृत्रिम अंग निर्माण निगम,भारतीय कृत्रिम अंग निर्माण निगम (Artificial Limbs Manufacturing Corporation of India (ALIMCO/अल्मिको)) भारत सरकार का सार्वजनिक क्षेत्र का एक उपक्रम है जो विकलांग लोगों के लिये कृत्रिम अंग एवं अन्य सहायक उपकरणों का निर्माण करता है। इसकी स्थापना १९७२ में की गयी थी। इसका मुख्यालय कानपुर में है। इसका ध्येय (विजन) 'भारत और विदेशों में विकलांग व्यक्तियों के लिए सस्ती कीमत पर राज्य के अत्याधुनिक सहायक उपकरणों का सबसे बड़ा निर्माता और आपूर्तिकर्ता होने का दर्जा हासिल करना और बनाए रखना' है।,82,कला
