title,content,word_count,topic
प्राणनाथ छुटानी,प्राणनाथ छुटानी को साहित्य एवं शिक्षा के क्षेत्र में भारत सरकार द्वारा सन १९७२ में पद्म भूषण से सम्मानित किया गया था। ये चंडीगढ़ से हैं।,26,साहित्य
कृष्णस्वामी स्वामिनाथन,कृष्णस्वामी स्वामिनाथन को साहित्य एवं शिक्षा के क्षेत्र में भारत सरकार द्वारा सन १९७२ में पद्म भूषण से सम्मानित किया गया था। ये दिल्ली से हैं।,26,साहित्य
उदय प्रकाश,"उदय प्रकाश (जन्म : १ जनवरी १९५२) चर्चित कवि, कथाकार, पत्रकार और फिल्मकार हैं। आपकी कुछ कृतियों के अंग्रेज़ी, जर्मन, जापानी एवं अन्य अंतरराष्ट्रीय भाषाओं में अनुवाद भी उपलब्ध हैं। लगभग समस्त भारतीय भाषाओं में रचनाएं अनूदित हैं। इनकी कई कहानियों के नाट्यरूपंतर और सफल मंचन हुए हैं। 'उपरांत' और 'मोहन दास' के नाम से इनकी कहानियों पर फीचर फिल्में भी बन चुकी हैं, जिसे अंतरराष्ट्रीय सम्मान मिल चुके हैं। उदय प्रकाश स्वयं भी कई टी.वी.धारावाहिकों के निर्देशक-पटकथाकार रहे हैं। सुप्रसिद्ध राजस्थानी कथाकार विजयदान देथा की कहानियों पर बहु चर्चित लघु फिल्में प्रसार भारती के लिए निर्देशित-निर्मित की हैं। भारतीय कृषि का इतिहास पर महत्वपूर्ण पंद्रह कड़ियों का सीरियल 'कृषि-कथा' राष्ट्रीय चैनल के लिए निर्देशित कर चुके हैं।",118,साहित्य
मदनलाल ‘मधु’,"मदनलाल 'मधु'  (२२ मई, १९२५ - ७ जुलाई, २०१४) एक भारतीय कवि, लेखक और अनुवादक थे, जिन्हें हिन्दी भाषा में रूसी क्लासिक्स के अनुवाद के लिए जाना जाता है। वे हिन्दुस्तानी समाज, जो कि मॉस्को में एक भारतीय समुदाय था, के संस्थापकों में से एक थे। उन्हें 'पुश्किन-पदक' और पूर्व सोवियत संघ के 'ऑर्डर ऑफ फ्रेंडशिप' से सम्मानित किया गया था। 1991 में भारत सरकार ने उन्हें चौथे सर्वोच्च नागरिक सम्मान पद्म श्री से सम्मानित किया।",76,साहित्य
पंकज बिष्ट,"पंकज बिष्ट हिन्दी साहित्य के प्रतिष्ठित पत्रकार, कहानीकार, उपन्यासकार व समालोचक है। वर्तमान में वे दिल्ली से प्रकाशित समयांतर नामक हिन्दी साहित्य की मासिक पत्रिका का सम्पादन व संचालन कर रहे हैं।",32,साहित्य
सुधा मूर्ति,"सुधा मूर्ति एक भारतीय शिक्षिका, लेखिका और सांसद हैं। इसके अलावा यह इंफोसिस फाउंडेशन की अध्यक्ष भी हैं। इन्होंने इंफोसिस के सह-संस्थापक एन आर नारायण मूर्ति से शादी की थी। इन्हें 2006 में भारत सरकार द्वारा सामाजिक कार्यों के लिए मूर्ति को भारत के चौथे सर्वोच्च नागरिक पुरस्कार पद्म श्री से, एवं २०२३ में पद्म भूषण पुरूस्कार से सम्मानित किया गया।",61,साहित्य
कयलाथ पोथेन फिलिप,कयलाथ पोथेन फिलिप को साहित्य एवं शिक्षा के क्षेत्र में भारत सरकार द्वारा सन १९७२ में पद्म भूषण से सम्मानित किया गया था। ये महाराष्ट्र से हैं।,27,साहित्य
पैट्रिक व्हाइट,"पैट्रिक विक्टर मार्टिनडेल व्हाइट (अंग्रेज़ी: Patrick Victor Martindale White) (28 मई 1912 – 30 सितम्बर 1990) इंग्लैंड में जन्मे ऑस्ट्रेलियाई लेखक थे, जिन्हें व्यापक रूप से 20वी सदी के अंग्रेजी भाषा के सबसे महत्वपूर्ण उपन्यासकारों में से एक माना जाता है। 1935 से लेकर अपनी मृत्यु तक इन्होंने कुल 12 उपन्यास, दो छोटी कहानी संग्रह और आठ नाटको को प्रकाशित किया था। वर्ष 1973 में अपने कार्य के लिए इन्हें साहित्य के नोबेल पुरस्कार से सम्मानित किया गया था। यह सम्मान प्राप्त करने वाले व्हाइट एकमात्र ऑस्ट्रेलियाई नागरिक थे।",89,साहित्य
अंतरिक्ष,"अंतरिक्ष - वह विस्तार है जो पृथ्वी से परे और आकाशीय पिंडों के बीच मौजूद है। बाहरी स्थान पूरी तरह से खाली नहीं है - यह एक कठोर निर्वात है जिसमें कणों का कम घनत्व होता है, मुख्य रूप से हाइड्रोजन और हीलियम का एक प्लाज्मा, साथ ही विद्युत चुम्बकीय विकिरण, चुंबकीय क्षेत्र, न्यूट्रिनो, धूल और ब्रह्मांडीय किरणें। बाहरी अंतरिक्ष का आधारभूत तापमान, जैसा कि बिग बैंग से पृष्ठभूमि विकिरण द्वारा निर्धारित किया गया है, 2.7 केल्विन (-270.45 डिग्री सेल्सियस; -454.81 डिग्री फारेनहाइट) है।
बाह्य अंतरिक्ष पृथ्वी की सतह से एक निश्चित ऊंचाई पर शुरू नहीं होता है। समुद्र तल से १०० किमी (६२ मील) की ऊँचाई पर स्थित कार्मन रेखा, पारंपरिक रूप से अंतरिक्ष संधियों में और एयरोस्पेस रिकॉर्ड रखने के लिए बाहरी अंतरिक्ष की शुरुआत के रूप में उपयोग की जाती है। अंतर्राष्ट्रीय अंतरिक्ष कानून की रूपरेखा बाहरी अंतरिक्ष संधि द्वारा स्थापित की गई थी, जो 10 अक्टूबर 1967 को लागू हुई थी।
किसी ब्रह्माण्डीय पिण्ड, जैसे पृथ्वी, से दूर जो शून्य होता है उसे अंतरिक्ष कहते हैं।",170,साहित्य
गुण्टर ग्रास,"गुण्टर ग्रास
1999 में नोबेल पुरस्कार साहित्य विजेता नोबल पुरस्कार से सम्मानित जर्मनी के लेखक गुण्टर ग्रास का 13 अप्रैल 2015 को 87 वर्ष की उम्र में देहान्त हो गया।
‘द टिन ड्रम’ नामक मशहूर उपन्यास के लेखक ग्रास के प्रकाशक ने मीडिया को बताया कि लुइबेक शहर के एक क्लिनिक में गुण्टर ग्रास ने अन्तिम साँसें लीं।
गुण्टर ग्रास ने द्वितीय विश्व युद्ध के दौरान जर्मनी की नाज़ीवादी सेना में काम किया था। लेकिन उनका कहना था कि उन्होंने दमन और हत्याओं में सेना का हाथ नहीं बँटाया था। उनका महत्वपूर्ण उपन्यास, द टिन ड्रम, 1959 में प्रकाशित हुआ था। बाद में इस किताब पर बनी फ़िल्म को ऑस्कर और कान में पाल्म डि ओर पुरस्कार मिले। बाद में वह 1990 में जर्मनी के एकीकरण के बहुत बड़े आलोचक रहे और कहते रहे कि यह बहुत जल्दबाज़ी में किया गया था।",142,साहित्य
गोपालदास नीरज,"गोपालदास नीरज (4 जनवरी 1925 - 19 जुलाई 2018), हिन्दी साहित्यकार, शिक्षक, एवं कवि सम्मेलनों के मंचों पर काव्य वाचक एवं फ़िल्मों के गीत लेखक थे। वे पहले व्यक्ति थे जिन्हें शिक्षा और साहित्य के क्षेत्र में भारत सरकार ने दो-दो बार सम्मानित किया, पहले पद्म श्री से, उसके बाद पद्म भूषण से। यही नहीं, फ़िल्मों में सर्वश्रेष्ठ गीत लेखन के लिये उन्हें लगातार तीन बार फिल्म फेयर पुरस्कार भी मिला था ।",73,साहित्य
पर्ल एस बक,"पर्ल एस बक (जून 26, 1892 – मार्च 6, 1973) एक अमेरिकी लेखिका और उपन्यासकार थीं। बक एक मिशनरी की बेटी थीं और उन्होंने अपने पिता के साथ और उनके देहान्त के बाद भी जिंदगी का लंबा हिस्सा चीन के झेनझियांग में बिताया। चीन की समाजिक पृष्ठभूमि पर लिखा उनका उपन्यास द गुड अर्थ अमेरिका में 1931 और 1932 के बीच बेस्टसेलर रहा और इस उपन्यास को 1932 में पुलित्ज़र पुरस्कार से सम्मानित किया गया। इसी उपन्यास के लिए 1938 में उन्हें नोबल पुरस्कार और रमन मैगेसैस से सम्मानित किया गया।",91,साहित्य
शिवसिंहसरोज,"शिवसिंहसरोज, किसी भारतीय द्वारा लिखी गई हिन्दी साहित्य के इतिहास  की पहली पुस्तक है। इसके लेखक शिवसिंह सेंगर हैं। 1877 ई० मे लिखी गई इस पुस्तक में एक हजार साहित्यकारों का परिचय दिया गया है। इसमें वास्तव में हिंदी साहित्य के इतिहास का एक ढाँचा तैयार करने का प्रयास मिलता है।  इसमें एक सहस्र (838 कवि) 'भाषा कवियों' का जीवनचरित तथा उनकी कविताओं के उदाहरण दिये गये हैं। इसका प्रकाशन 1878 ई. में हुआ। 1883 ई. में इसका तीसरा संस्करण निकल था।",82,साहित्य
विमान,"विमान शब्द भारतीय साहित्य (मुख्यतः वेद, रामायण, महाभारत एवं जैन साहित्य में) में एक उड़ाने वाली युक्ति को इंगित करता है। कहीं-कहीं पर यह 'मंदिर', 'स्थान' आदि का भी अर्थ रखता है। समरांगणसूत्रधार तथा वैमानिक शास्त्र आदि कई ग्रन्थों में इनका विशद तकनीकी वर्णन भी मिलता है। वर्तमान युग में वैज्ञानिक एवं संस्कृताचार्य शिवकर बापूजी तलपदे ने वेद शास्त्रों के अध्ययन के आधार पर विमान की रचना कर उस विमान का यशस्वी उड़ान प्रदर्शन मुम्बई के चौपाटी पर किया था । इस अभूतपूर्व वैज्ञानिक समारोह में मुम्बई के असंख्य नागरिकों के बीच बड़ौदा संस्थान के महाराज के प्रतिनिधि और कई संस्थाओं के मान्यवर उपस्थित थे । इस विमान का नाम था ' मरुतसखा '। शिवकर बापूजी तलपड़े के हाथ महर्षि भारद्वाज की पुस्तक वैमानिक शास्त्र लगी और उससे प्रेरित होकर उन्होंने भारत में यह पहला सफल प्रयोग किया। यह विमान उन्होंने राइट बंधु से भी पहले सन १८९५ मे उडाया था। भारतीय पांडुलिपियों मे अंशुबोधिनी नामक एक प्राचीन पुस्तक विमानों से संबंधित है।",163,साहित्य
मीरा बाई,"मीराबाई (1498-1547) सोलहवीं शताब्दी की एक कृष्ण भक्त और कवयित्री थीं। मीरा बाई ने कृष्ण भक्ति के स्फुट पदों की रचना की है। 
मीराबाई को उनके देवर विक्रमादित्य ने मारने के लिए जहर का प्याला भेजा था जिसका उन पर कोई असर नहीं हुआ था",45,साहित्य
कुबेर नाथ राय,"कुबेरनाथ राय (२६ मार्च १९३३ - ५ जून १९९६) हिन्दी ललित निबन्ध परम्परा के महत्वपूर्ण हस्ताक्षर, सांस्कृतिक निबन्धकार और भारतीय आर्ष-चिन्तन के गन्धमादन थे। उनकी गिनती आचार्य हजारीप्रसाद द्विवेदी और विद्यानिवास मिश्र जैसे ख्यातिलब्ध निबन्धकारों के साथ की जाती है।",40,साहित्य
आचार्य मम्मट,"आचार्य मम्मट संस्कृत काव्यशास्त्र के सर्वश्रेष्ठ विद्वानों में से एक समझे जाते हैं। वे अपने शास्त्रग्रंथ काव्यप्रकाश के कारण प्रसिद्ध हुए। कश्मीरी पंडितों की परंपरागत प्रसिद्धि के अनुसार वे नैषधीय चरित के रचयिता श्रीहर्ष के मामा थे। उन दिनों कश्मीर विद्या और साहित्य के केंद्र था तथा सभी प्रमुख आचार्यों की शिक्षा एवं विकास इसी स्थान पर हुआ। वे कश्मीरी थे, ऐसा उनके नाम से भी पता चलता है लेकिन इसके अतिरिक्त उनके विषय में बहुत कम जानकारी मिलती है। वे भोजराज के उत्तरवर्ती माने जाते है, इस हिसाब से उनका काल दसवीं शती का लगभग उत्तरार्ध है। ऐसा विवरण भी मिलता है कि उनकी शिक्षा-दीक्षा वाराणसी में हुई।",109,साहित्य
रामदरश मिश्र,"डॉ॰ रामदरश मिश्र (जन्म: १५ अगस्त, १९२४) हिन्दी के प्रतिष्ठित साहित्यकार हैं। ये जितने समर्थ कवि हैं उतने ही समर्थ उपन्यासकार और कहानीकार भी। इनकी लंबी साहित्य-यात्रा समय के कई मोड़ों से गुजरी है और नित्य नूतनता की छवि को प्राप्त होती गई है। ये किसी वाद के कृत्रिम दबाव में नहीं आये बल्कि उन्होंने अपनी वस्तु और शिल्प दोनों को सहज ही परिवर्तित होने दिया। अपने परिवेशगत अनुभवों एवं सोच को सृजन में उतारते हुए, उन्होंने गाँव की मिट्टी, सादगी और मूल्यधर्मिता को अपनी रचनाओं में व्याप्त होने दिया जो उनके व्यक्तित्व की पहचान भी है। गीत, नई कविता, छोटी कविता, लंबी कविता यानी कि कविता की कई शैलियों में उनकी सर्जनात्मक प्रतिभा ने अपनी प्रभावशाली अभिव्यक्ति के साथ-साथ गजल में भी उन्होंने अपनी सार्थक उपस्थिति रेखांकित की। इसके अतिरक्त उपन्यास, कहानी, संस्मरण, यात्रावृत्तांत, डायरी, निबंध आदि सभी विधाओं में उनका साहित्यिक योगदान बहुमूल्य है।",146,साहित्य
अनुशासनपर्व,"अनुशासन पर्व महाभारत के 18 पर्वों में से एक प्रमुख पर्व है। इसमें भीष्म के साथ युधिष्ठिर का धर्म कर्म के विषय में संवाद है। भीष्म युधिष्ठिर को नाना प्रकार से तप, धर्म और दान की महिमा बतलाते हैं और अन्त में युधिष्ठिर पितामह की अनुमति पाकर हस्तिनापुर चले जाते हैं। भीष्मस्वर्गारोहण पर्व में भीष्म के पास युधिष्ठिर का जाना, युधिष्ठिर की भीष्म से बात, भीष्म का प्राणत्याग, युधिष्ठिर द्वारा उनका अन्तिम संस्कार किए जाने का वर्णन है। इस अवसर पर वहाँ उपस्थित लोगों के सामने गंगा जी प्रकट होती हैं और पुत्र के लिए शोक प्रकट करने पर श्री कृष्ण उन्हें समझाते हैं।
अनुशासन पर्व के अन्तर्गत २ उपपर्व हैं-

(1) दान-धर्म-पर्व,
(2) भीष्मस्वर्गारोहण पर्व
अनुशासन पर्व में कुल मिलाकर १८६ अध्याय हैं।",124,साहित्य
