title,content,word_count,topic
रामजी ठाकुर,रामजी ठाकुर  संस्कृत भाषा के प्रतिष्ठित साहित्यकार हैं। इनके द्वारा रचित एक खंडकाव्य लद्युपद्यप्रबन्धत्रयी के लिये उन्हें सन् 2012 में साहित्य अकादमी पुरस्कार से सम्मानित किया गया।,27,साहित्य
राधाकान्‍त ठाकुर,राधाकान्‍त ठाकुर  संस्कृत भाषा के प्रतिष्ठित साहित्यकार हैं। इनके द्वारा रचित एक कविता-संग्रह चलदूरवाणी के लिये उन्हें सन्2013 में साहित्य अकादमी पुरस्कार से सम्मानित किया गया।,26,साहित्य
परम ए. अबीचंदाणी,परम ए. अबीचंदाणी  सिन्धी भाषा के विख्यात साहित्यकार हैं। इनके द्वारा रचित एक समालोचना तक तोर  के लिये उन्हें सन् 2000 में साहित्य अकादमी पुरस्कार से सम्मानित किया गया।,29,साहित्य
गुमानसिंह चामलिंग,गुमानसिंह चामलिंग  नेपाली भाषा के विख्यात साहित्यकार हैं। इनके द्वारा रचित एक निबंध–संग्रह मौलो  के लिये उन्हें सन् 1979 में साहित्य अकादमी पुरस्कार से सम्मानित किया गया।,27,साहित्य
पठानी पट्टनायक,पठानी पट्टनायक  ओड़िया भाषा के विख्यात साहित्यकार हैं। इनके द्वारा रचित एक आत्मकथा जीबनर चलपथे  के लिये उन्हें सन् 2010 में साहित्य अकादमी पुरस्कार से सम्मानित किया गया।,28,साहित्य
पी. श्रीआचार्य,पी. श्रीआचार्य  तमिल भाषा के विख्यात साहित्यकार हैं। इनके द्वारा रचित एक जीवनी श्री रामानुजर  के लिये उन्हें सन् 1965 में साहित्य अकादमी पुरस्कार से सम्मानित किया गया।,28,साहित्य
उपेन्द्रनाथ झा,उपेन्द्रनाथ झा  मैथिली भाषा के विख्यात साहित्यकार हैं। इनके द्वारा रचित एक उपन्यास दु पत्र  के लिये उन्हें सन् 1969 में साहित्य अकादमी पुरस्कार से सम्मानित किया गया।,28,साहित्य
जी. सी. तोम्ब्रा,जी. सी. तोम्ब्रा  मणिपुरी भाषा के विख्यात साहित्यकार हैं। इनके द्वारा रचित एक नाटक नाबोङखाउ  के लिये उन्हें सन् 1978 में साहित्य अकादमी पुरस्कार से सम्मानित किया गया।,28,साहित्य
देवेन्द्रनाथ आचार्य,देवेन्द्रनाथ आचार्य  असमिया भाषा के विख्यात साहित्यकार हैं। इनके द्वारा रचित एक उपन्यास जंगम  के लिये उन्हें सन् 1984 में साहित्य अकादमी पुरस्कार से सम्मानित(मरणोपरांत) किया गया।,27,साहित्य
मोहन परमार,मोहन परमार  गुजराती भाषा के विख्यात साहित्यकार हैं। इनके द्वारा रचित एक कहानी–संग्रह अंचळो  के लिये उन्हें सन् 2011 में साहित्य अकादमी पुरस्कार से सम्मानित किया गया।,27,साहित्य
मेदिनी शर्मा,मेदिनी शर्मा  असमिया भाषा के विख्यात साहित्यकार हैं। इनके द्वारा रचित एक उपन्यास बिपन्न समय  के लिये उन्हें सन् 1999 में साहित्य अकादमी पुरस्कार से सम्मानित किया गया।,28,साहित्य
के. गोकुलदास प्रभु,के. गोकुलदास प्रभु  कोंकणी भाषा के विख्यात साहित्यकार हैं। इनके द्वारा रचित एक कहानी–संग्रह अंतरआयामी  के लिये उन्हें सन् 1994 में साहित्य अकादमी पुरस्कार से सम्मानित किया गया।,28,साहित्य
ए. चित्रेश्वर शर्मा,ए. चित्रेश्वर शर्मा  मणिपुरी भाषा के विख्यात साहित्यकार हैं। इनके द्वारा रचित एक उपन्यास थरोशंबी  के लिये उन्हें सन् 1992 में साहित्य अकादमी पुरस्कार से सम्मानित किया गया।,28,साहित्य
मोहिउद्दीन हाजिनी,मोहिउद्दीन हाजिनी  कश्मीरी भाषा के विख्यात साहित्यकार हैं। इनके द्वारा रचित एक निबंध–संग्रह मक़ालात  के लिये उन्हें सन् 1970 में साहित्य अकादमी पुरस्कार से सम्मानित किया गया।,27,साहित्य
रसिक शाह,रसिक शाह  गुजराती भाषा के विख्यात साहित्यकार हैं। इनके द्वारा रचित एक निबंध अंते आरंभ  के लिये उन्हें सन् 2015 में साहित्य अकादमी पुरस्कार से सम्मानित किया गया।,28,साहित्य
चिटिप्रोलु कृष्णमूर्ति,चिटिप्रोलु कृष्णमूर्ति  तेलुगू भाषा के विख्यात साहित्यकार हैं। इनके द्वारा रचित एक कविता–संग्रह पुरुषोत्तमुडु  के लिये उन्हें सन् 2008 में साहित्य अकादमी पुरस्कार से सम्मानित किया गया।,27,साहित्य
राजम कृष्णन्,राजम कृष्णन्  तमिल भाषा के विख्यात साहित्यकार हैं। इनके द्वारा रचित एक उपन्यास वेरुक्कु नीर  के लिये उन्हें सन् 1973 में साहित्य अकादमी पुरस्कार से सम्मानित किया गया।,28,साहित्य
रामलाल अधिकारी,रामलाल अधिकारी  नेपाली भाषा के विख्यात साहित्यकार हैं। इनके द्वारा रचित एक निबंध–संग्रह निसंस्मरण  के लिये उन्हें सन् 2000 में साहित्य अकादमी पुरस्कार से सम्मानित किया गया।,27,साहित्य
सत्यप्रकाश जोशी,सत्यप्रकाश जोशी  राजस्थानी भाषा के विख्यात साहित्यकार हैं। इनके द्वारा रचित एक काव्य बोल भारमली  के लिये उन्हें सन् 1977 में साहित्य अकादमी पुरस्कार से सम्मानित किया गया।,28,साहित्य
रामचंद्र बेहेरा,रामचंद्र बेहेरा  ओड़िया भाषा के विख्यात साहित्यकार हैं। इनके द्वारा रचित एक कहानी–संग्रह गोपपुर  के लिये उन्हें सन् 2005 में साहित्य अकादमी पुरस्कार से सम्मानित किया गया।,27,साहित्य
रामचंद्र गिरि,रामचंद्र गिरि  नेपाली भाषा के विख्यात साहित्यकार हैं। इनके द्वारा रचित एक महाकाव्य समाज दर्पण  के लिये उन्हें सन् 1984 में साहित्य अकादमी पुरस्कार से सम्मानित किया गया।,28,साहित्य
कातिन्द्र सोरगियारि,कातिन्द्र सोरगियारि  बोडो भाषा के विख्यात साहित्यकार हैं। इनके द्वारा रचित एक उपन्यास सानमोखांआरि लामाजों  के लिये उन्हें सन् 2006 में साहित्य अकादमी पुरस्कार से सम्मानित किया गया।,28,साहित्य
एन. शिवदास,एन. शिवदास  कोंकणी भाषा के विख्यात साहित्यकार हैं। इनके द्वारा रचित एक कहानी–संग्रह भांगरसाळ  के लिये उन्हें सन् 2005 में साहित्य अकादमी पुरस्कार से सम्मानित किया गया।,27,साहित्य
शफ़ी शैदा,शफ़ी शैदा  कश्मीरी भाषा के विख्यात साहित्यकार हैं। इनके द्वारा रचित एक कविता–संग्रह अमार  के लिये उन्हें सन् 1992 में साहित्य अकादमी पुरस्कार से सम्मानित किया गया।,27,साहित्य
उदय थुलुङ,उदय थुलुङ  नेपाली भाषा के विख्यात साहित्यकार हैं। इनके द्वारा रचित एक कहानी–संग्रह एकान्तवास  के लिये उन्हें सन् 2012 में साहित्य अकादमी पुरस्कार से सम्मानित किया गया।,27,साहित्य
दिनेश पंचाल,दिनेश पंचाल  राजस्थानी भाषा के विख्यात साहित्यकार हैं। इनके द्वारा रचित एक कहानी–संग्रह पगरवा  के लिये उन्हें सन् 2008 में साहित्य अकादमी पुरस्कार से सम्मानित किया गया।,27,साहित्य
उमाप्रसाद मुखोपाध्याय,उमाप्रसाद मुखोपाध्याय  बंगाली भाषा के विख्यात साहित्यकार हैं। इनके द्वारा रचित एक यात्रा–वृत्तांत मणिमहेश  के लिये उन्हें सन् 1971 में साहित्य अकादमी पुरस्कार से सम्मानित किया गया।,27,साहित्य
गोविन्दचंद्र उद्गाता,गोविन्दचंद्र उद्गाता  ओड़िया भाषा के विख्यात साहित्यकार हैं। इनके द्वारा रचित एक समालोचना काव्यशिल्पी गंगाधर  के लिये उन्हें सन् 1995 में साहित्य अकादमी पुरस्कार से सम्मानित किया गया।,28,साहित्य
गुप्‍त प्रधान,गुप्‍त प्रधान  नेपाली भाषा के विख्यात साहित्यकार हैं। इनके द्वारा रचित एक कहानी समयका प्रतिविम्‍बहरू  के लिये उन्हें सन् 2015 में साहित्य अकादमी पुरस्कार से सम्मानित किया गया।,28,साहित्य
मिशॉल सुल्तानपुरी,मिशॉल सुल्तानपुरी  कश्मीरी भाषा के विख्यात साहित्यकार हैं। इनके द्वारा रचित एक समालोचनात्मक अध्ययन वोंत  के लिये उन्हें सन् 2009 में साहित्य अकादमी पुरस्कार से सम्मानित किया गया।,28,साहित्य
मनोहर सरदेसाई,मनोहर सरदेसाई  कोंकणी भाषा के विख्यात साहित्यकार हैं। इनके द्वारा रचित एक कविता–संग्रह पीसोलिम  के लिये उन्हें सन् 1980 में साहित्य अकादमी पुरस्कार से सम्मानित किया गया।,27,साहित्य
अशोक एस. कामत,अशोक एस. कामत  कोंकणी भाषा के विख्यात साहित्यकार हैं। इनके द्वारा रचित एक उपन्यास घणाघाय नियतीचे  के लिये उन्हें सन् 2008 में साहित्य अकादमी पुरस्कार से सम्मानित किया गया।,29,साहित्य
तुम्मल सीताराममूर्ति,तुम्मल सीताराममूर्ति  तेलुगू भाषा के विख्यात साहित्यकार हैं। इनके द्वारा रचित एक काव्य महात्मा कथा  के लिये उन्हें सन् 1969 में साहित्य अकादमी पुरस्कार से सम्मानित किया गया।,28,साहित्य
माया राही,माया राही  सिन्धी भाषा के विख्यात साहित्यकार हैं। इनके द्वारा रचित एक कहानी मँहगी मुर्क  के लिये उन्हें सन् 2015 में साहित्य अकादमी पुरस्कार से सम्मानित किया गया।,28,साहित्य
रशीद नाज़की,रशीद नाज़की  कश्मीरी भाषा के विख्यात साहित्यकार हैं। इनके द्वारा रचित एक कविता–संग्रह वहरात  के लिये उन्हें सन् 1999 में साहित्य अकादमी पुरस्कार से सम्मानित किया गया।,27,साहित्य
अशोक रा. केळकर,अशोक रा. केळकर  मराठी भाषा के विख्यात साहित्यकार हैं। इनके द्वारा रचित एक समालोचना रुजुवात  के लिये उन्हें सन् 2010 में साहित्य अकादमी पुरस्कार से सम्मानित किया गया।,28,साहित्य
अरांबम समरेन्द्र सिंह,अरांबम समरेन्द्र सिंह  मणिपुरी भाषा के विख्यात साहित्यकार हैं। इनके द्वारा रचित एक नाटक लेपाकले  के लिये उन्हें सन् 1995 में साहित्य अकादमी पुरस्कार से सम्मानित किया गया।,28,साहित्य
एस. एन. बनहट्टी,एस. एन. बनहट्टी  मराठी भाषा के विख्यात साहित्यकार हैं। इनके द्वारा रचित एक जीवनी नाट्याचार्य देवल  के लिये उन्हें सन् 1969 में साहित्य अकादमी पुरस्कार से सम्मानित किया गया।,29,साहित्य
अली मोहम्मद लोण,अली मोहम्मद लोण  कश्मीरी भाषा के विख्यात साहित्यकार हैं। इनके द्वारा रचित एक नाटक सुय्या  के लिये उन्हें सन् 1972 में साहित्य अकादमी पुरस्कार से सम्मानित किया गया।,28,साहित्य
देविदास रा. कदम,देविदास रा. कदम  कोंकणी भाषा के विख्यात साहित्यकार हैं। इनके द्वारा रचित एक उपन्यास दिका  के लिये उन्हें सन् 2007 में साहित्य अकादमी पुरस्कार से सम्मानित किया गया।,28,साहित्य
भीमनाथ झा,भीमनाथ झा  मैथिली भाषा के विख्यात साहित्यकार हैं। इनके द्वारा रचित एक निबंध–संग्रह विविधा  के लिये उन्हें सन् 1992 में साहित्य अकादमी पुरस्कार से सम्मानित किया गया।,27,साहित्य
संतोष मायामोहन,संतोष मायामोहन  राजस्थानी भाषा के विख्यात साहित्यकार हैं। इनके द्वारा रचित एक कविता–संग्रह सिमरण  के लिये उन्हें सन् 2003 में साहित्य अकादमी पुरस्कार से सम्मानित किया गया।,27,साहित्य
टिक्कोडियन (पी. के. नायर),टिक्कोडियन (पी. के. नायर)  मलयालम भाषा के विख्यात साहित्यकार हैं। इनके द्वारा रचित एक आत्मकथा अरंगुकाणात्त  के लिये उन्हें सन् 1995 में साहित्य अकादमी पुरस्कार से सम्मानित किया गया।,29,साहित्य
जॅस फेर्नांडिस,जॅस फेर्नांडिस  कोंकणी भाषा के विख्यात साहित्यकार हैं। इनके द्वारा रचित एक कविता–संग्रह किरवंट  के लिये उन्हें सन् 2009 में साहित्य अकादमी पुरस्कार से सम्मानित किया गया।,27,साहित्य
कृष्णसिंह मोक्तान,कृष्णसिंह मोक्तान  नेपाली भाषा के विख्यात साहित्यकार हैं। इनके द्वारा रचित एक उपन्यास जीवन गोरेटोमा  के लिये उन्हें सन् 2005 में साहित्य अकादमी पुरस्कार से सम्मानित किया गया।,28,साहित्य
मंत्रेश्वर झा,मंत्रेश्वर झा  मैथिली भाषा के विख्यात साहित्यकार हैं। इनके द्वारा रचित एक संस्मरण कतेक डारिपर  के लिये उन्हें सन् 2008 में साहित्य अकादमी पुरस्कार से सम्मानित किया गया।,28,साहित्य
डॉम मोरेस,डॉम मोरेस  अंग्रेज़ी भाषा के विख्यात साहित्यकार हैं। इनके द्वारा रचित एक कविता–संग्रह सेरेंडिप  के लिये उन्हें सन् 1994 में साहित्य अकादमी पुरस्कार से सम्मानित किया गया।,27,साहित्य
नगीनदास पारीख,नगीनदास पारीख  गुजराती भाषा के विख्यात साहित्यकार हैं। इनके द्वारा रचित एक समालोचना अभिनवानो रसविचार  के लिये उन्हें सन् 1970 में साहित्य अकादमी पुरस्कार से सम्मानित किया गया।,28,साहित्य
एस. वी. जोगाराव,एस. वी. जोगाराव  तेलुगू भाषा के विख्यात साहित्यकार हैं। इनके द्वारा रचित एक निबंध–संग्रह मणिप्रवाळमु  के लिये उन्हें सन् 1989 में साहित्य अकादमी पुरस्कार से सम्मानित किया गया।,28,साहित्य
राम पंजवाणी,राम पंजवाणी  सिन्धी भाषा के विख्यात साहित्यकार हैं। इनके द्वारा रचित एक संस्मरण अनोखा अज़मूदा  के लिये उन्हें सन् 1964 में साहित्य अकादमी पुरस्कार से सम्मानित किया गया।,28,साहित्य
