title,content,word_count,topic
सृजन सम्मान,"सृजन-सम्मान का गठन सृजनात्मकता और मौलिक लेखन की साधना को अक्षुण्ण बनाए रखने के उद्देश्य से स्व. हरि ठाकुर ने 1995 में रायपुर में किया। वे छत्तीसगढ़ राज्य निर्माण के कुशल शिल्पी, विचारक, इतिहासविद्, स्वतंत्रतासंग्राम सेनानी और साहित्यकार थे। सृजन-सम्मान इन कठिन लक्ष्यों के लिए स्वयंसेवी भाव से जुड़ने वाले रचनाकारों का अखिल भारतीय संगठन है। इसमें शिक्षाविद् एवं युवा रचनाकार जयप्रकाश मानस की महती भूमिका रही है।",68,साहित्य
चैत सिंह,"राजा चेत सिंह  सन 1770 से अगस्त 1781 तक काशी राज्य के नरेश रहे। सन् 1770 ई. में महाराज बलवन्त सिंह की मृत्यु के बाद उनके ज्येष्ठ पुत्र भूमिहार ब्राह्मण चेत सिंह काशी-राज की गद्दी पर आसीन हुए और मात्र १० वर्षों तक ही के शासनकाल में अपनी शूरवीरता और पराक्रम से प्रथम ब्रिटिश गवर्नर जनरल वारेन हेस्टिंग्स को काशी पर आक्रमण करने के परिणाम स्वरुप समस्त काशीवासियों के विरोध के कारण, भयभीत होकर काशी से भाग जाने पर मजबूर कर दिया, इस घटना को बनारस विद्रोह कहा जाता है, जिसके पलायन की हड़बड़ी और घबराहट से सम्बन्धित एक कहावत आज भी प्रचलित है- 

घोड़ा पर हौदा और हाथी पर जीन,
चुपके से भागा, वारेन हेस्टिंग।",116,साहित्य
प्राचीन यूनानी भाषा,"प्राचीन यूनानी भाषा (अथवा प्राचीन ग्रीक, अंग्रेज़ी : Ancient Greek, यूनानी : हेल्लेनिकी) प्राचीन काल के यूनान देश और उसके आस-पास के क्षेत्रों की मुख्य भाषा थी। इसे संस्कृत की बहिन भाषा माना जा सकता है। ये हिन्द-यूरोपीय भाषा-परिवार की यूनानी शाखा में आती है। इसे एक शास्त्रीय भाषा माना जाता है, जिसमें काफ़ी ज़्यादा और उच्च कोटि का साहित्य रचा गया था, जिसमें सबसे ख़ास होमर के दो महाकाव्य इलियाड और ओडेस्सी हैं। इसके व्याकरण, शब्दावली, ध्वनि-तन्त्र और संगीतमय बोली इसे संस्कृत के काफ़ी करीब रख देते हैं। इसकी बोलचाल की बोली कोइने में ही बाइबल का लगभग सारा नया नियम लिखा गया था।",105,साहित्य
२१ जून,"21 जून ग्रेगोरी कैलंडर के अनुसार वर्ष का 172वाँ (लीप वर्ष में 173 वाँ) दिन है। साल में अभी और 193 दिन बाकी हैं।

२१जून   को अंतरराष्ट्रीय योग दिवस भी भी मनाया जाता है जिसकी पहल भारत के प्रधानमंत्री नरेन्द्र दामोदर दास मोदी ने संयुक्त राष्ट्र में रखकर की जिसकी स्वीकृति संयुक्त राष्ट्र ने ११ दिसंबर २०१४ को दे दी। भारत में योग का प्रतिनिधित्व योगगुरु बाबा रामदेव करते है जिन्होंने लाखो गरीब लोगो को निशुल्क योग शिविर लगा कर कई गंभीर बीमारियों से निजात दिलाई है। योग मन की शांति का एक मार्ग है।",95,साहित्य
चिदानंद मूर्ति,"एम चिदानंद मूर्ति  एक विख्यात कन्नड़ साहित्यकार है जिन्होंने कन्नड़ भाषा के इतिहास पर बहुत शोध किया है। ये बैंगलूर विश्वविद्यालय के कन्नड़ विभाग के अध्यक्ष भी रहे हैं, इनका जन्म १९३१ में हुआ। उन्होंने हम्पी के ऐतिहासिक अवशेषों को सुरक्षित सहेजने के लिए भी अमूल्य प्रयास किया है। ये भग्नावशेष १५-६वीं सदी के विजयनगर साम्राज्य की शुरुआती राजधानी के हैं। 
इनके द्वारा रचित एक समालोचना होसतु होसतु के लिये उन्हें सन् १९९७ में साहित्य अकादमी पुरस्कार (कन्नड़) से सम्मानित किया गया।",82,साहित्य
नामदेव धोंडो महानोर,नामदेव धोंडो महानोर  मराठी भाषा के विख्यात साहित्यकार हैं। इनके द्वारा रचित एक कविता–संग्रह पानझड  के लिये उन्हें सन् 2000 में साहित्य अकादमी पुरस्कार से सम्मानित किया गया।,28,साहित्य
श्याम मनोहर,श्याम मनोहर  मराठी भाषा के विख्यात साहित्यकार हैं। इनके द्वारा रचित एक उपन्यास उत्सुकतेने मी झोपलो  के लिये उन्हें सन् 2008 में साहित्य अकादमी पुरस्कार से सम्मानित किया गया।,29,साहित्य
डी. आर. नागराज,डी. आर. नागराज  कन्नड़ भाषा के विख्यात साहित्यकार हैं। इनके द्वारा रचित एक निबंध–संग्रह साहित्य कथन  के लिये उन्हें सन् 1999 में साहित्य अकादमी पुरस्कार से सम्मानित(मरणोपरांत) किया गया।,29,साहित्य
लक्ष्मीनाथ बेजबरुवा,"लक्ष्मीनाथ बेजबरुवा ( १८६४-१९३८) आधुनिक असमिया साहित्य के पथ-प्रदर्शक कहे जाते हैं। कविता, नाटक, गल्प, उपन्यास, निबन्ध, रम्यरचना, समालोचना, प्रहसन, जीवनी, आत्मजीवनी, शिशुसाहित्य, इतिहास अध्ययन, सांवादिकता आदि दृष्टियों से बेजबरुवा का योगदान अमूल्य है।
असमिया साहित्य में उन्होंने कहानी तथा ललित निबंध के बीच के एक सहित्य रूप को अधिक प्रचलित किया। बेजबरुआ की हास्यरस की रचनाओं को काफी लोकप्रियता मिली। इसीलिए उसे ""रसराज"" की उपाधि दी गई।",68,साहित्य
समरेश बसु कालकूट,समरेश बसु कालकूट  बंगाली भाषा के विख्यात साहित्यकार हैं। इनके द्वारा रचित एक उपन्यास शांब  के लिये उन्हें सन् 1980 में साहित्य अकादमी पुरस्कार से सम्मानित किया गया।,28,साहित्य
गगन गिल,गगन गिल हिंदी की सुप्रसिद्ध कवयित्री हैं। उन्हें हिंदी कविता में अपने विशिष्ट योगदान के लिए साहित्य अकादमी पुरस्कार 2024 एवं केदार सम्मान से सम्मानित किया गया है।,28,साहित्य
जी. वी. सुब्रह्मण्यम्,जी. वी. सुब्रह्मण्यम्  तेलुगू भाषा के विख्यात साहित्यकार हैं। इनके द्वारा रचित एक समालोचना आंध्र साहित्य विमर्श आंग्ल प्रभावम्  के लिये उन्हें सन् 1986 में साहित्य अकादमी पुरस्कार से सम्मानित किया गया।,32,साहित्य
भोगला सोरेन,भोगला सोरेन (संताली:ᱵᱷᱚᱜᱽᱞᱟ ᱥᱚᱨᱮᱱ) संताली भाषा के विख्यात साहित्यकार हैं। इनके द्वारा रचित एक नाटक राही रांवाक् काना  के लिये उन्हें सन् 2010 में भारतीय साहित्य अकादमी पुरस्कार से सम्मानित किया गया।,32,साहित्य
शक्ति पीठ,"हिन्दू धर्म के अनुसार जहां सती देवी के शरीर के अंग गिरे, वहां वहां शक्ति पीठ बन गईं। ये अत्यंत पावन तीर्थ कहलाये। ये तीर्थ पूरे भारतीय उपमहाद्वीप पर फैले हुए हैं। जयंती देवी शक्ति पीठ भारत के मेघालय राज्य में नाॅरटियांग नामक स्थान पर है।",46,साहित्य
राधामोहन गडनायक,राधामोहन गडनायक  ओड़िया भाषा के विख्यात साहित्यकार हैं। इनके द्वारा रचित एक कविता–संग्रह सूर्य ओ अंधकार  के लिये उन्हें सन् 1975 में साहित्य अकादमी पुरस्कार से सम्मानित किया गया।,29,साहित्य
राजनगर,राजनगर  बंगाली भाषा के विख्यात साहित्यकार अमियभूषण मजूमदार द्वारा रचित एक उपन्यास है जिसके लिये उन्हें सन् 1986 में बंगाली भाषा के लिए साहित्य अकादमी पुरस्कार से सम्मानित किया गया।,30,साहित्य
नरहर रघुनाथ फाटक,नरहर रघुनाथ फाटक  मराठी भाषा के विख्यात साहित्यकार हैं। इनके द्वारा रचित एक जीवन–चरित आदर्श भारत–सेवक  के लिये उन्हें सन् 1970 में साहित्य अकादमी पुरस्कार से सम्मानित किया गया।,29,साहित्य
विजया राजाध्यक्ष,विजया राजाध्यक्ष  मराठी भाषा के विख्यात साहित्यकार हैं। इनके द्वारा रचित एक समालोचना मर्ढेकरांची कविता : स्वरूप आणि संदर्भ  के लिये उन्हें सन् 1993 में साहित्य अकादमी पुरस्कार से सम्मानित किया गया।,32,साहित्य
९ अक्टूबर,"9 अक्टूबर ग्रेगोरी कैलंडर के अनुसार वर्ष का 282वॉ (लीप वर्ष मे 283 वॉ) दिन है। साल मे अभी और 83 दिन बाकी है। 

विश्व डाक दिवस
दक्षिण कोरिया में हंगुल दिवस
युगांडा में गणतंत्र दिवस",36,साहित्य
अरुंधति सुब्रमण्यम,"अरुंधति सुब्रमण्यम कवयित्री, कलाकार और आध्यात्मिकता और संस्कृति पर लिखने वाली लेखिका हैं। कई वर्षों में उन्होंने कविता संपादक और संग्रहाध्यक्ष के रूप में काम किया है, और साहित्य, शास्त्रीय नृत्य और रंगमंच पर पत्रकार के रूप में काम किया है।",41,साहित्य
मारिज विण्टरनित्ज,"मारिज विण्टरनित्ज (Moriz Winternitz ; 23 दिसम्बर 1863 – 9 जनवरी 1937) आस्ट्रिया के गणमान्य पौर्वात्यविद (Orientalist) थे। उन्होने आक्सफोर्ड विश्वविद्यालय में मैक्समूलर के साथ मिलकर भारत विद्या से सम्बन्धित कार्य आरम्भ किया। १९०८ से १९२२ के बीच उन्होने 'Geschichte der indischen Literatur' नामक संस्कृत साहित्य का इतिहास लिखा। उनके योगदान से ही आधुनिक युग में हिन्दू, बौद्ध और जैन धर्म से सम्बन्धित अध्ययन के क्षेत्र में क्रान्ति आ गयी।",70,साहित्य
जोसेफ़ स्टालिन,जोज़ेफ विसारिओनोविच स्टालिन (रूसी : Ио́сиф Виссарио́нович Джугашвили) (1878-1953) एक रूसी क्रांतिकारी और राजनेता थे। वे 1924 से 1953 में अपनी मृत्यु तक सोवियत संघ के नेता थे। वे 1941 से 1953 तक सोवियत संघ के प्रधानमंत्री भी थे।  स्टालिन का जन्म गोरी जॉर्जिया में हुआ था।,47,साहित्य
गोकुल सिंह,"गोकुल सिंह जाट तिलपत गाँव का सरदार थे। 10 मई 1666 को जाटों व औरंगजेब की सेना में तिलपत में लड़ाई हुई। 
लड़ाई में जाटों की विजय हुई। 
मुगल शासन ने इस्लाम धर्म को बढावा दिया और किसानों पर कर बढ़ा दिया। वीर गोकुल जाट ने किसानों को संगठित किया और कर जमा करने से मना कर दिया और औरंगजेब के खिलाफ विद्रोह छेड़ दिया। औरंगजेब ने अपने कुछ  सेनापतियों के साथ शक्तिशाली सेना भेजी। जाटों और मुगलों में युद्ध हुआ। युद्ध में जाटों की विजय हुई। परंतु युद्ध हारने के बाद औरंगजेब खुद सेना लेके चल दिया और गोकुला और उनके साथियों को बंधी बनाने के लिए बहुत बड़ी सेना भेजी , वीर गोकुल जाट को बन्दी बना लिया गया और 1 जनवरी 1670 को आगरा के किले पर जनता को आतंकित करने के लिये टुकडे़-टुकड़े कर मारा गया। इस तरह वो शहीद हो गए।",146,साहित्य
बौद्ध ग्रंथ,"बौद्ध धर्म और बौद्ध दर्शन से संबन्धित ग्रंथ प्रागैतिहासिक काल से लिखे गये हैं। ये संस्कृत, पालि तथा अन्य कई भाषाओं में लिखे या अनूदित किये गये हैं।",28,साहित्य
क्षेम चंद 'सुमन',"आचार्य क्षेम चन्द 'सुमन' (16 सितम्‍बर, 1916 -- 23 अक्‍तूबर, 1993) हिन्दी साहित्यकार एवं पत्रकार थे। उन्हें १९८४ में पद्मश्री से सम्मानित किया गया था। उनके जीवन का सबसे महत्वपूर्ण कार्य है- 'दिवंगत हिन्दी साहित्यसेवी कोश' का दो भागों में प्रकाशन। इस असाधारण ग्रन्थ को तैयार करने के लिये सुमन जी ने सम्पूर्ण भारत के गाँव-गाँव, नगर-नगर को दो बार लगभग पैदल ही नाप दिया। बनारसीदास चतुर्वेदी का लक्ष्य यदि स्वतन्त्रता सेनानियों और शहीदों के बलिदानों को उजागर करना तथा उनके आश्रितों की सहायता करना और करवाना था तो 'सुमन' जी का लक्ष्य लेखकों की मदद करना था।",98,साहित्य
कोई मिल गया,कोई मिल गया 2003 में बनी हिन्दी भाषा की विज्ञान कथा साहित्य फिल्म है। इसका निर्देशन और निर्माण राकेश रोशन ने किया और मुख्य भूमिकाओं में ऋतिक रोशन और प्रीति जिंटा है। रेखा की भी महत्त्वपूर्ण सहायक भूमिका है। जारी होने पर फिल्म सफल रही थी और इसने कई पुरस्कार जीते थे। इसकी अगली दो कड़ी भी आई - कृष और कृष 3।,63,साहित्य
देवनूर महादेव,देवनूर महादेव (१९४८) कन्नड़ के सुप्रसिद्ध साहित्यकार हैं। उनका जन्म कर्नाटक में नंजगुड़ा तालुक के देवनूर ग्राम में हुआ था। उनका पहला कहानी संग्रह द्यावानूरु १९७३ में प्रकाशित हुआ। १९८१ में प्रकाशित उनके उपन्यास औडालाला को भारतीय भाषा परिषद द्वारा तथा कर्नाटक सरकार द्वारा राज्योत्सव प्रशस्ति से सम्मानित किया गया है। उनके लघु उपन्यास कुसुमबाले को साहित्य अकादमी का पुरस्कार प्राप्त हुआ है।,63,साहित्य
श्रीरंगम श्रीनिवास राव,श्री श्री  तेलुगू भाषा के विख्यात साहित्यकार और कवि हैं। इनके द्वारा रचित एक कविता–संग्रह श्री श्री साहित्यमु  के लिये उन्हें सन् 1972 में साहित्य अकादमी पुरस्कार से सम्मानित किया गया।,31,साहित्य
