title,content,word_count,topic
ब्लेज़र,"ब्लेज़र एक प्रकार का जैकेट होता है, जिसे एक अच्छे दिखने वाले अनौपचारिक पोशाक के रूप में पहना जाता है। ब्लेज़र शब्द कभी-कभी, दो अलग प्रकार के वस्त्रों, बोटिंग जैकेट और स्पोर्ट्स जैकेट के समानार्थक के रूप में प्रयोग किया जाता है। ब्लेज़र, अनौपचारिक तौर पर एक सूट कोट से मिलता जुलता होता है - जो कभी-कभी पट्टेरहित पैच पॉकेट और धातु के बटन से युक्त होता है। ब्लेज़र बाहर पहनने वाला स्पोर्ट्स जैकेट होता है इसलिए इसका कपड़ा आमतौर पर टिकाऊ (14 ओजेड) होता है। शैलीगत ढंग से, ब्लेज़र प्रायः यूनिफार्म के रूप में प्रयोग की जाने वाली पोशाक होते हैं, अर्थात, एयरलाइन, स्कूल और नौकायान और नौका विहार के समय पहने जाने वाली पोशाक.
ब्लेज़र शब्द, दो भिन्न प्रकार के जैकेट की ओर संकेत करता है; पहला, वास्तविक ब्लेज़र, यह इकहरे अग्रभाग वाला बोट क्लब जैकेट होता था, जो चटक रंग का, प्रायः धारीदार कपडे का और विपरीत रंग की पाइपिंग लगा होता था, यह प्रारंभ में अनिवार्य रूप से स्पोर्ट्स जैकेट की तरह प्रयोग किया जाता था, जिसे नौकायान के दौरान पहना जाता था। दूसरा ब्लेज़र एक चुस्त, आदर्श कट वाला, दोहरे अग्रभाग वाला नेवी ब्ल्यू जैकेट होता है, इसे वास्तव में रीफर जैकेट के नाम से जाना जाता है, अब इस नाम का प्रयोग बहुत कम ही होता है। जब से पुरुषों ने वास्तविक बोट क्लब ब्लेज़र पहनना बंद कर दिया, तब से यह नाम सिर्फ दोहरे अग्रभाग वाले, धातु की बटन युक्त नाविकीय संस्करण के लिए ही प्रयोग किया जाने लगा; सेना का वास्तविक ब्लेज़र काले रंग का होता था।",255,खेलकूद
"पोर्टलैंड, ऑरेगॉन","पोर्टलैंड, पश्चिमोत्तर संयुक्त राज्य अमेरिका में ऑरेगॉन राज्य की विल्मेट और कोलंबिया नदियों के संगम के पास स्थित एक शहर है।
जुलाई 2009 तक, इसकी अनुमानित आबादी 582,130 थी और यह संयुक्त राज्य अमेरिका का सबसे अधिक आबादी वाला 29वां राज्य है। 
इसे दुनिया में दूसरा और संयुक्त राज्य अमेरिका में सबसे अधिक पर्यावरण के अनुकूल या ""ग्रीन"" शहर माना गया है।
पोर्टलैंड ऑरेगॉन का सबसे अधिक आबादी वाला शहर है और सिएटल, वाशिंगटन और वैंकूवर, ब्रिटिश कोलंबिया के बाद पश्चिमोत्तर प्रशांत महासागर का तीसरा सबसे अधिक आबादी वाला शहर है।
जुलाई 2006 तक, संयुक्त राज्य अमेरिका के 23वें सबसे अधिक आबादी वाले पोर्टलैंड महानगरीय क्षेत्र (एमएसए) में लगभग 20 लाख लोग रहते थे।

पोर्टलैंड को 1851 में शामिल किया गया और यह मल्टनोमाह काउंटी (मल्टनोमाह County) की काउंटी सीट है। 
शहर पश्चिम में थोड़ा वाशिंगटन काउंटी और दक्षिण में क्लैकामस काउंटी (क्लैकामस County) में फैला हुआ है।
यह एक महापौर और अन्य चार आयुक्तों की अध्यक्षता वाली आयोग-आधारित सरकार द्वारा शासित है। 
यह शहर और क्षेत्र, सुदृढ़ भूमि-उपयोग योजना और मेट्रो द्वारा समर्थित, लाइट रेल में किए गए निवेश के लिए प्रसिद्ध एक विशिष्ट क्षेत्रीय सरकार है।
पोर्टलैंड बड़ी संख्या में अपनी माइक्रो मद्यनिर्माणशाला और माइक्रो भट्टियों तथा कॉफ़ी के शौक के लिए जाना जाता है।
यह ट्रेल ब्लेज़र्स एनबीए टीम का भी घर है।
पोर्टलैंड पश्चिम समुद्री तटीय जलवायु क्षेत्र में पड़ता है जहां गर्म, शुष्क गर्मियां और बरसातें किन्तु समशीतोष्ण सर्दियां होती हैं।

यह मौसम गुलाब की खेती के लिए आदर्श है और एक सदी से भी अधिक समय से पोर्टलैंड को ""गुलाबों का शहर"" के रूप में जाना जाता है, यहां कई गुलाब के उद्यान हैं जिनमें सबसे प्रमुख अंतरराष्ट्रीय गुलाब टेस्ट गार्डन है।",278,खेलकूद
"सैन होज़े, कैलिफोर्निया","सान ख़ोसे (स्पेनी: San Jose) कैलिफोर्निया का तीसरा सबसे बड़ा शहर, संयुक्त राज्य अमेरिका का दसवाँ सबसे बड़ा शहर और सांता क्लारा काउंटी का काउंटी सीट है। यह देश के 31वें सबसे बड़े महानगरीय क्षेत्र का एक ऐंकर है जो सैन फ्रांसिस्को खाड़ी के दक्षिणी छोर पर स्थित है। 
सान ख़ोसे कभी एक छोटा सा कृषि शहर था जहां 1950 के दशक से अब तक बड़ी तेज़ी से विकास हुआ है। जनसंख्या, भूमि क्षेत्र, एवं औद्योगिक विकास की दृष्टि से सैन ख़ोसे खाड़ी क्षेत्र का सबसे बड़ा शहर है। 1 जनवरी 2010 तक इसकी अनुमानित जनसंख्या 1,023,083 थी। 
सान ख़ोसे की नींव 29 नवम्बर 1777 को नुएवा कैलिफोर्निया के स्पेनिश कॉलोनी के पहले कस्बे, एल पुएब्लो डी सैन होज़े डी ग्वाडालूप (El पुएब्लो de San José de Guadalupe), के रूप में रखी गई, जो बाद में अल्टा कैलिफोर्निया बना. इस शहर ने सैन फ्रांसिस्को और मोंटेरे में स्पेनिश सैन्य प्रतिष्ठानों के समर्थन में एक कृषि समुदाय के रूप काम किया। जब कैलिफोर्निया को 1850 में एक राज्य का दर्ज़ा प्राप्त हुआ था, उस समय सैन होज़े ने इसकी पहली राजधानी के रूप अपनी सेवा प्रदान की. एक कृषि केंद्र के रूप में 150 वर्ष से अधिक समय तक अपनी सेवा प्रदान करने के बाद सैन होज़े ने द्वितीय विश्व युद्ध से लौटने वाले सैनिकों और सेवानिवृत सैनिकों के आवासन की अत्यधिक मांग के साथ-साथ 1950 और 1960 के दशक में और अधिक भूमि क्षेत्र को मिलाकर आक्रामक विस्तार का अनुभव किया। 1990 के दशक तक, उत्तरोत्तर विकासशील स्थानीय प्रौद्योगिकी उद्योग के अंतर्गत आने वाले सैन होज़े के क्षेत्र को कैपिटल ऑफ़ सिलिकन वैली (सिलिकन घाटी की राजधानी) उपनाम दिया गया.",270,खेलकूद
जॉर्ज हर्बर्ट मीड,"जॉर्ज हर्बर्ट मीड (George Herbert Mead ; 1863 -- 1931) अमेरिकी समाजशास्त्री थे जो अमेरिकी व्यावहारिकता (प्रैग्मैटिज्म) के संस्थापक, प्रतीकात्मक अन्तःक्रियावाद (symbolic interactionism) के अग्रणी और सामाजिक मनोविज्ञान के संस्थापकों में से एक के रूप में जाने जाते थे।",39,खेलकूद
2026 एशियाई खेल,"2026 एशियाई खेल (जापानी: 2026年アジア競技大会), जिसे 20वें एशियाई खेल (जापानी: 第20回アジア競技大会) और आइची-नागोया 2026 (जापानी: 愛知/名古屋2026)  के नाम से भी जाना जाता है, एक बहु-खेल प्रतियोगिता प्रतियोगिता है, जो कि जापान के आइची प्रीफ़ेक्चर के राजधानी नागोया नगर में 18 सितम्बर से 3 अक्टूबर तक आयोजित होंगे। टोक्यो 1958 के बाद और हिरोशिमा 1994 के बाद नागोया एशियाई खेलों की मेजबानी करने वाला तीसरा जापानी शहर होगा। कोविड-19 महामारी के कारण चीन में हांग्जो में 2022 एशियाई खेल को 2023 तक स्थगित कर दिए जाने के बाद, यह आयोजन अपने पारंपरिक 4-वर्षीय चक्र पर लौटने के लिए तैयार है।",99,खेलकूद
ओलंपिक में नेपाल,"नेपाल ने बारह ग्रीष्मकालीन खेलों में और चार शीतकालीन ओलंपिक खेलों में हिस्सा लिया है।
नेपाली राष्ट्रीय, तेजबीर बुरा ने 1922 के एवरेस्ट अभियान में उनकी भूमिका के लिए 1924 शीतकालीन ओलंपिक में मिश्रित अलपितावाद में स्वर्ण पदक जीता। हालांकि, इस अभियान में अन्य देशों के नागरिकों ने भी भाग लिया, क्योंकि यह पुरस्कार मिश्रित टीम में चला गया। इसके अलावा, अंतर्राष्ट्रीय ओलंपिक समिति की वेबसाइट इस पदक को अधिकारी के रूप में पहचान नहीं करती है।
नेपाल के तायक्वोंडो व्यवसायी बिधान लामा ने सिओल में 1988 के ग्रीष्मकालीन ओलंपिक में कांस्य पदक जीता था, जब तायक्वोंडो एक प्रदर्शनी खेल था।
नेपाल ओलंपिक समिति का गठन 1962 में हुआ था और 1963 में मान्यता प्राप्त थी।",116,खेलकूद
वैयक्‍तिक सहायक,"वैयक्तिक सहायक (परसनल असिस्टैण्ट), बोलचाल शब्द में निजी सचिव (परसनल सेक्रेटरी) होती है। निजी सचिव एक कार्यपालक सहायक होता है जिसे कार्यालयी कौशलों में प्रवीणता प्राप्त होती है, उसमें बिना प्रत्यक्ष पर्यवेक्षण के उत्तरदयित्वों को वहन करने की क्षमता होती है तथा उसे सौंपे गए दयित्वों के भीतर पहल करने तथा निर्णय लेने की क्षमता होती है।",57,खेलकूद
क्षेत्री,"क्षेत्री या छेत्री नेपाल के पहाड़ी क्षेत्रों में रहने वाले योद्धा वर्ण के हैं, इन्हें पहाड़ी भी कहाँ जाता है। ये एक हिन्द-आर्य भाषिक  जाति हैं। क्षेत्री या छेत्री या क्षथरीय सब क्षत्रिय के अपभ्रंश हैं और ये हिन्दू वर्ण व्यवस्था के अन्तर्गत क्षत्रिय वर्ण में आते हैं। ये लोग मूल रूप से सैनिक, राजा और प्रशासनिक क्षेत्र में काफी आगे हैं। ये [[बाहुन] और खस दलित के जैसे खस समुदाय के एक विभाजन हैं।
क्षेत्री नेपाल के कुल जनसंख्या में सर्वाधिक १६.६% हैं। इस जाति को नेपाल में सत्तारुढ माना जाता है। इन लोगों की उत्पत्ति के बारे में विभिन्न इतिहासकार और खोजकर्ता जेसै कि डोरबहादुर विष्ट और सूर्यमणि अधिकारी, आदि के अनुसार भारत के राज्स्थान  प्रदेश में हुआ था। इस जाति के पूर्वज पूर्वी इरानी भाषिक खस जाति हैं जो बाह्लिक-गान्धार क्षेत्रमें पाए जाते थे।  आज ये नेपाल के सभी क्षेत्रों और भारत के कुछ क्षेत्रों में भी पाए जाते हैं। ये लोग पूर्णत: हिन्दु होते हैं और स्थानिय मष्टो देवता की पुजा करते हैं। इस पुजा को मष्ट पुजा या देवाली कहते हैं। इन का मातृभाषा नेपाली भाषा है और ये इंडो-यूरोपियन भाषा परिवार के सदस्य हैं। 

नेपाल के खस राजवंश, खप्तड राजवंश, सिंजा राजवंश, बस्नेत, कुँवर और पाँडे वंश, दरबारिया समुह और नेपाल के पिछले समय के क्रुर शासक राणा वंश भी क्षेत्रीजाति में आते हैं।  क्षेत्री अधिकतर नेपाल सरकार और नेपाली सेना में कार्यरत पाए जाते हैं। इन के लिए भारतिय सेना में एक सैनिक दस्ता 9 वीं गोरखा रेजिमेन्त आरक्षित है।",247,खेलकूद
मुनि की रेती,मुनि की रेती (Muni Ki Reti) भारत के उत्तराखण्ड राज्य के टिहरी गढ़वाल ज़िले में स्थित एक नगर है। यह ऋषिकेश के समीप और गंगा नदी के किनारे बसा हुआ है। मुनि की रेती अपने आश्रमों के लिए जाना जाता है।,41,खेलकूद
ओलंपिक में थाईलैंड,"1952 में थाईलैंड ने पहली बार ओलंपिक खेलों में भाग लिया, और 1980 के ग्रीष्मकालीन ओलंपिक के यूएस-नेतृत्व वाले बहिष्कार में भाग लेने के अलावा, तब से हर ग्रीष्मकालीन ओलंपिक खेलों में प्रतिस्पर्धा करने के लिए एथलीटों को भेजा है। थाईलैंड 2002 के बाद से शीतकालीन ओलंपिक खेलों में भी भाग लिया है।
थाईलैंड ने मॉन्ट्रियल में 1976 के खेलों में अपना पहला पदक जीता था, जब मुक्केबाज पीएओ पौंटैट ने पुरुषों की लाइट फ्लावेवेट श्रेणी में कांस्य पदक जीता था। थाईलैंड का पहला स्वर्ण पदक अटलांटा में 1996 के खेलों में मुक्केबाजी में भी आ जाएगा, जब सोमलक कामसिंग ने पुरुषों की फेदरवेट श्रेणी जीती थी। तब से, थाई एथलीटों ने लंदन में 2012 के खेलों के अपवाद के बाद हर ग्रीष्मकालीन ओलंपिक में स्वर्ण पदक जीते हैं, पुरुषों के मुक्केबाजी में आने वाले सभी स्वर्ण पदक और महिला भारोत्तोलन के साथ।
थाई एथलीटों ने कुल 31 पदक जीते हैं। आज की तारीख में थाईलैंड के सबसे सफल खेल एथेंस में 2004 के खेल थे, जहां उन्होंने आठ पदक जीते, उनमें से तीन स्वर्ण थे।
थाईलैंड के लिए राष्ट्रीय ओलंपिक समिति 1948 में बनाई गई थी और 1950 में मान्यता प्राप्त थी।",193,खेलकूद
जम्मू-कश्मीर में भारतीय सेना का ऑपरेशन,"जम्मू-कश्मीर में भारतीय सेना का ऑपरेशन ऑपरेशन जैसे सुरक्षा कार्यों को शामिल करें रक्षक जो 1990 में शुरू हुआ, ऑपरेशन सर्प विनाश 2003 और ऑपरेशन मेंरंदोरी बहक में 2020 में ख़तम हुआ .अन्य अभियानों में मानवीय मिशन शामिल हैं जैसे ऑपरेशन  मेघ राहत  और ऑपरेशन गुडविल और ऑपरेशन कैलम डाउन जैसे सामाजिक उद्देश्य के साथ संचालन किया गया । भारतीय सेना भारतीय सशस्त्र बलों और जम्मू-कश्मीर में सुरक्षा बलों जैसे मिशन सायाता  सहायता ’’ या संयुक्त अभियानों के दौरान अन्य हथियारों के साथ मिलकर काम करती है।",87,खेलकूद
अखिल भारतीय फुटबॉल महासंघ,"अखिल भारतीय फुटबॉल महासंघ (ऑल इंडिया फुटबॉल फेडरेशन), एआईएफएफ के रूप में भी जाना जाता है, भारत में एसोसिएशन फुटबॉल के शासी निकाय है।
१९४८ में स्थापित, संघ एशियाई फुटबॉल परिसंघ के संस्थापक सदस्यों में से एक था, जो एशिया में फुटबॉल का पर्यवेक्षक था।

एआईएफएफ ने राष्ट्रीय स्तर पर सभी प्रतियोगी फुटबॉल टूर्नामेंट और लीग चलाए, अर्थात् आई-लीग और फेडरेशन कप
महासंघ भी अप्रत्यक्ष रूप से राज्य संघों के माध्यम से स्थानीय फुटबॉल प्रतियोगिताओं का प्रबंधन करता है।
फेडरेशन भारत की राष्ट्रीय फुटबॉल टीम के साथ-साथ महिला टीम और विभिन्न युवा राष्ट्रीय पक्षों के प्रबंधन के लिए भी जिम्मेदार है।
एआईएफएफ दक्षिण एशियाई फुटबॉल महासंघ का भी हिस्सा है, जो संगठन दक्षिण एशिया में फुटबॉल चलाता है। महासंघ वर्तमान में द्वारका, दिल्ली में स्थित है।",126,खेलकूद
