title,content,word_count,topic
उलिसस (कविता),"उलिसस विक्टोरियन कवि लॉर्ड अल्फ्रेड टेनिसन द्वारा रचित मुक्तछंद की कविता है। यह कविता सन् १८३३ में लिखी गई थी जिसका दूसरा संस्करण १८४२ में प्रकाशित हुआ था। यह नाटकीय एकालाप की प्रायः उद्धृत की जाने वाली प्रसिद्ध कृति है। साहित्य में उलिसस (ग्रीक, ओडीसियस) के चरित्र का व्यापक रूप से अन्वेषण किया गया है। ओडीसियस के कारनामों को पहले होमर के इलियड और ओदिसी (८००-७०० ईसा पूर्व) में वर्णित किया गया था। टेनिसन ने होमर की कथा को कविता में चित्रित किया है।
कविता में उलिसस को दृढ़ वीर के रूप में देखा गया है तथा उनके दृढ़ संकल्प के लिए उनकी प्रशंसा की गई है। यह विचार कि टेनिसन ने एक वीर पात्र की कल्पना की थी, कविता के बारे में उनके बयानों और उनके जीवन की घटनाओं से ही प्रदर्शित होता है। जैसे: उनके सबसे करीबी दोस्त की मृत्यु-जिसने उन्हें इसे लिखने के लिए प्रेरित किया। बीसवीं शताब्दी की ""उलिसस"" की कुछ नई व्याख्याओं ने कविता में संभावित विडंबनाओं को उजागर किया। उदाहरणस्वरूप- उन्होंने यह तर्क दिया कि उलिसस अपने राज्य और परिवार को स्वार्थपरता से त्यागना चाहता है तथा उन्होंने उलिसस के चरित्र के अधिक सकारात्मक आकलन पर सवाल उठाते हुए यह प्रदर्शित किया कि वह पहले के साहित्य में त्रुटिपूर्ण नायक जैसा दिखता है। 
""उलिसस"" के सकारात्मक पठन की कुंजी कविता का जीवनीगत सन्दर्भ है।",220,मानसिक
मैसाचुसेट्स प्रौद्योगिकी संस्थान,"मैसाचुसेट्स प्रौद्योगिकी संस्थान (मैसाचुसेट्स इन्स्टिट्यूट ऑफ टैक्नोलॉजी - एमआईटी) (अंग्रेज़ी: Massachusetts Institute of Technology) कैम्ब्रिज, मैसाचुसेट्स में स्थित एक निजी शोध विश्वविद्यालय है। एमआईटी में 32 शैक्षणिक विभागों से युक्त पांच विद्यालय और एक महाविद्यालय है, जिसमें वैज्ञानिक और प्रौद्योगिकी अनुसंधान पर विशेष जोर दिया जाता है। एमआईटी दो निजी भूमि अनुदान विश्वविद्यालयों में से एक है और वह समुद्री-अनुदान और अंतरिक्ष-अनुदान विश्वविद्यालय भी है।
विलियम बार्टन रोजर्स द्वारा 1861 में संयुक्त राज्य अमेरिका के औद्योगिकीकरण की जरुरतो को ध्यान में रख कर स्थापित किए गए इस विश्वविद्यालय ने यूरोपीय विश्वविद्यालय प्रतिमान को अपनाया और इसमें प्रारंभ से ही प्रयोगशाला शिक्षा पर जोर दिया गया। इसका मौजूदा 168-एकड़ (68.0 हे॰) परिसर 1916 में खुला, जो चार्ल्स नदी घाटी के उत्तरी किनारे पर 1 मील (1.6 कि॰मी॰) फैला हुआ है। एमआईटी शोधकर्ता द्वितीय विश्वयुद्ध और शीतयुद्ध के दौरान सुरक्षा अनुसंधान के संबंध में कम्प्यूटर, रडार और इनर्टिअल (inertial) मार्गदर्शन रचने के प्रयत्नो में जुड़े हुए थे। पिछले 60 वर्षों में, एमआईटी के शिक्षात्मक कार्यक्रम भौतिक विज्ञान और अभियांत्रिकी से परे अर्थशास्त्र, दर्शन, भाषा विज्ञान, राजनीति विज्ञान और प्रबंधन जैसे सामाजिक विज्ञान तक भी विस्तरीत हुए है।
एमआईटी में वर्ष 2009-2010 के पतझड़ के सत्र के लिए अवरस्नातक स्तर पर 4,232 और स्नातक स्तर पर 6,152 छात्रों को प्रवेश दिया गया है। इसमें करीबन 1,009 संकाय सदस्यों को रोजगार प्रदान किया है। इसकी बंदोबस्ती और अनुसंधान पर वार्षिक व्यय अन्य किसी भी अमेरिकी विश्वविद्यालयो में से सबसे अधिक है। अब तक 75 नोबल पुरस्कार विजेता, 47 राष्ट्रीय विज्ञान पदक प्रापक और 31 मैकआर्थर अध्येता इस विश्वविद्यालय के साथ वर्तमान या भूतपूर्व समय में सम्बद्ध रहे है। एमआईटी के पूर्व छात्रों द्वारा स्थापित कंपनियों का एकत्रित राजस्व विश्व की सबसे बड़ी सत्तरहवीं अर्थव्यवस्था है।
इंजिनीयर्स द्वारा 33 खेल प्रायोजित है, जिनमें से ज्यादातर NCAA श्रेणी III के न्यू इंग्लैंड महिला और पुरुषों के व्यायामी सम्मेलन में भाग लेते है, श्रेणी I के नौकायन कार्यक्रम EARC और EAWRC प्रतिस्पर्धा के भाग है। अमेरिका के मैसाचुसेट्स में स्थित इस विश्वविद्यालय में 34 एकेडमिक विभाग, डिविजन और डिग्री-ग्रांटिड प्रोग्राम हैं। इसमें 1025 फैकल्टी सदस्य हैं। 2009-10 में इसमें 10000 छात्र एनरोल थे। वर्तमान में इसमें 2700 विदेशी छात्र भी पढ़ाई कर रहे हैं।",357,मानसिक
स्व-चोट जागरूकता दिवस,"आत्म-चोट जागरूकता दिवस ( SIAD ) (जिसे सेल्फ-हार्म अवेयरनेस डे के रूप में भी जाना जाता है) १ मार्च को एक जमीनी स्तर पर वार्षिक वैश्विक जागरूकता कार्यक्रम / अभियान है,  जहां इस दिन, और सप्ताह में इसके लिए अग्रणी और बाद में, कुछ लोग अपने स्वयं के नुकसान के बारे में अधिक खुले रहना पसंद करते हैं, और स्वयं को नुकसान पहुंचाने और आत्म-चोट के बारे में जागरूकता बढ़ाने के लिए जागरूकता संगठन विशेष प्रयास करते हैं।  कुछ लोग एक नारंगी जागरूकता रिबन पहनते हैं, अपनी बाहों पर ""लव"" लिखते हैं, ""बटरफ्लाई प्रोजेक्ट"" कलाईबैंड या मनके कंगन के बारे में जागरूकता बढ़ाने के लिए अपनी कलाई पर एक तितली खींचते हैं जो आत्म-नुकसान की जागरूकता को प्रोत्साहित करते हैं।   एसआईएडी का निरीक्षण करने वाले लोगों का लक्ष्य आत्म-क्षति के आसपास के सामान्य रूढ़ियों को तोड़ना और चिकित्सा पेशेवरों को स्थिति के बारे में शिक्षित करना है।",147,मानसिक
जठरांत्ररोगविज्ञान,"जठरांत्ररोगविज्ञान (Gastroenterology) चिकित्सा शास्त्र का वह विभाग है जो पाचन तंत्र तथा उससे सम्बन्धित रोगों पर केंद्रित है। इस शब्द की उत्पत्ति प्राचीन ग्रीक शब्द gastros (उदर), enteron (आँत) एवं logos (शास्त्र) से हुई है। 
जठरांत्ररोगविज्ञान पोषण नाल (alimentary canal) से सम्बन्धित मुख से गुदाद्वार तक के सारे अंगों और उनके रोगों पर केन्द्रित है। इससे सम्बन्धित चिकित्सक जठरांत्ररोगविज्ञानी (gastroenterologists) कहलाते हैं।",62,मानसिक
संवेग (भावना),"संवेग वस्तुतः ऐसी प्रकिया है, जिसे व्यक्ति उद्दीपक द्वारा अनुभव करता है। संवेदनात्मक अनुभव:- संवेदन चेतन उत्पन्न करने की अत्यंत प्रारम्भिक स्थिति है। शिशु का संवेदन टूटा-फूटा अधूरा होता है। प्रौढ़ की संवेदना विकृतजन्य होती है।
भावनाओं का कोई निश्चित वर्गीकरण मौजूद नहीं है, हालांकि कई वर्गीकरण प्रस्तावित किये गये हैं। इनमें से कुछ वर्गीकरण हैं: 

'संज्ञानात्मक' बनाम 'गैर-संज्ञानात्मक' भावनाएं
स्वाभाविक भावनाएं (जो एमिग्डाला/मस्तिष्क के एक विशेष हिस्से से उत्पन्न होती है), बनाम संज्ञानात्मक भावनाएं (जो प्रीफ्रंटल कोर्टेक्स/ मस्तिष्क के अगले हिस्से से उत्पन्न होती है)
बुनियादी बनाम जटिल: जहाँ मूल भावनाएं और अधिक जटिल हो जाती हैं।
अवधि के आधार पर वर्गीकरण : कुछ भावनाएं कुछ सेकंड की अवधि के लिए होती हैं (उदाहरण के लिए आश्चर्य), जबकि कुछ कई वर्षों तक की होती हैं (उदाहरण के लिए, प्यार).
भावना और भावना के परिणामों के बीच संबंधित अंतर मुख्य व्यवहार और भावनात्मक अभिव्यक्ति है। अपनी भावनात्मक स्थिति के परिणामस्वरूप अक्सर लोग कई तरह की अभिव्यक्तियां करते हैं, जैसे रोना, लड़ना या घृणा करना. यदि कोई बिना कोई संबंधित अभिव्यक्ति के भावना प्रकट करे तो हम मान सकते हैं की भावनाओं के लिए अभिव्यक्ति की आवश्यकता नहीं है। न्यूरोसाइंटिफिक (स्नायुविज्ञान) शोध से पता चलता है कि एक ""मैजिक क्वार्टर सैकंड"" होता है जिसके दौरान भावनात्मक प्रतिक्रिया बनने से पहले विचार को जाना जा सकता है। उस पल में, व्यक्ति भावना को नियंत्रित कर सकता है।
[[जेम्स-लैंग सिद्धांत] बताता है कि शारीरिक परिवर्तनों से होने वाले अनुभवों के कारण बड़े पैमाने पर भावनाओं की अनुभूति होती है। भावनाओं के प्रति क्रियात्मक दृष्टिकोण, (उदाहरण के लिए, निको फ्रिज्दा और फ्रितास-मेगाल्हेस) से पता चलता है कि भावनाएं किसी विशेष क्रिया के फलस्वरूप एक विषय के रूप में सुरक्षित रखने के लिए उभरी हैं।",280,मानसिक
संयुक्त हिन्दू परिवार,"हिन्दू संयुक्त परिवार जिसमें एक साथ एक ही घर में कई पीढ़ियों के लोग रहते हैं जिस परिवार मे तीन या अधिक पीढ़ियों के सदस्य साथ साथ निवास करते है जिनकी रसोई,पूजा पाठ एवं संपत्ति सामूहिक होती है उसे ही सयुंक्त परिवार कहते है।",44,मानसिक
वर वधु की प्रतिज्ञाएं,"हिन्दू धर्म में; सद्गृहस्थ की, परिवार निर्माण की जिम्मेदारी उठाने के योग्य शारीरिक, मानसिक परिपक्वता आ जाने पर युवक-युवतियों का विवाह संस्कार कराया जाता है। समाज के सम्भ्रान्त व्यक्तियों की, गुरुजनों की, कुटुम्बी-सम्बन्धियों की, देवताओं की उपस्थिति इसीलिए इस धर्मानुष्ठान के अवसर पर आवश्यक मानी जाती है कि दोनों में से कोई इस कत्तर्व्य-बन्धन की उपेक्षा करे, तो उसे रोकें और प्रताड़ित करें। पति-पत्नी इन सन्भ्रान्त व्यक्तियों के सम्मुख अपने निश्चय की, प्रतिज्ञा-बन्धन की घोषणा करते हैं। यह प्रतिज्ञा समारोह ही विवाह संस्कार है। विवाह संस्कार में देव पूजन, यज्ञ आदि से सम्बन्धित सभी व्यवस्थाएँ पहले से बनाकर रखनी चाहिए।",100,मानसिक
एनोरेक्सिया नर्वोज़ा,"क्षुधा अभाव (एनोरेक्सिया नर्वोज़ा) (AN) एक प्रकार का आहार-संबंधी विकार है जिसके लक्षण हैं - स्वस्थ शारीरिक वजन बनाए रखने से इंकार और स्थूलकाय हो जाने का डर जो विभिन्न बोधसंबंधी पूर्वाग्रहों पर आधारित विकृत स्व-छवि के कारण उत्पन्न होता है। ये पूर्वाग्रह व्यक्ति की अपने शरीर, भोजन और खाने की आदतों के बारे में चिंतन-मनन की क्षमता को बदल देते हैं। AN एक गंभीर मानसिक रोग है जिसमें अस्वस्थता व मृत्युदरें अन्य किसी मानसिक रोग जितनी ही होती हैं।
यद्यपि यह मान्यता है कि AN केवल युवा श्वेत महिलाओं में ही होता है तथापि यह सभी आयु, नस्ल, सामाजिक-आर्थिक और सांस्कृतिक पृष्ठभूमि के पुरूषों और महिलाओं को प्रभावित कर सकता है।
एनोरेक्सिया नर्वोज़ा पद का प्रयोग महारानी विक्टोरिया के निजी चिकित्सकों में से एक, सर विलियम गल द्वारा 1873 में किया गया था। इस शब्द की उत्पत्ति ग्रीक से हुई है: a (α, निषेध का उपसर्ग), n (ν, दो स्वर वर्णों के बीच की कड़ी) और orexis (ओरेक्सिस) (ορεξις, भूख), इस तरह इसका अर्थ है – भोजन करने की इच्छा का अभाव.",173,मानसिक
