title,content,word_count,topic
लज्जाराम तोमर,"लज्जाराम तोमर (२१ जुलाई १९३० - १७ नवम्बर २००४) शिक्षक तथा शिक्षाविद थे। वे 1979 से 2004 तक विद्या भारती के प्रमुख थे।   विद्याभारती, राष्ट्रीय स्वयंसेवक संघ का अनुसांगिक संगठन है जो शिक्षा के क्षेत्र में कार्य करता है।
लज्जाराम तोमर का जन्म २१ जुलाई, १९३० को मध्य प्रदेश के मुरैना जिले के वघपुरा गाँव में हुआ था। उनके परिवार की उस क्षेत्र में अत्यधिक प्रतिष्ठा थी। मेधावी छात्र होने के कारण सभी परीक्षाएं उच्च श्रेणी में उत्तीर्ण करने के बाद उन्होंने 1957 में एम.ए तथा बी.एड किया। उनकी अधिकांश शिक्षा आगरा में हुई।
सन् 1945 में वे राष्ट्रीय स्वयंसेवक संघ के सम्पर्क में आये। अब तक वे आगरा में एक इंटर कालिज में प्राध्यापक हो चुके थे। उस समय उ.प्र. के प्रांत प्रचारक भाऊराव देवरस थे। लज्जाराम जी इंटर कालिज में और उच्च पद पर पहुंच सकते थे किन्तु भाउराव के आग्रह पर वे सरकारी नौकरी छोड़कर सरस्वती शिशु मंदिर योजना में आ गये। उन्होंने अनेक नये प्रयोग किये, जिसकी ओर विद्या भारती के साथ ही अन्य सरकारी व निजी विद्यालयों के प्राचार्य तथा प्रबंधक भी आकृष्ट हुए।  आपातकाल के विरोध में उन्होंने जेल यात्रा भी की।
इन्हीं दिनों उनके एकमात्र पुत्र के देहान्त से उनका मन विचलित हो गया। वे छात्र जीवन से ही योग, प्राणायाम, ध्यान और साधना करते थे। अतः इस मानसिक उथल-पुथल में वे संन्यास लेने पर विचार करने लगे। पर भाउराव देवरस के आग्रह पर लज्जाराम जी ने संन्यास के बदले अपना शेष जीवन शिक्षा विस्तार के लिए समर्पित कर दिया।
उस समय तक पूरे भारत में सरस्वती शिशु मंदिर के नाम से हजारों विद्यालय खुल चुके थे; पर उनका कोई राष्ट्रीय संजाल नहीं था। 1979 में सब विद्यालयों को एक सूत्र में पिरोने के लिए ‘विद्या भारती’ का गठन किया गया और लज्जाराम जी को उसका राष्ट्रीय संगठन मंत्री बनाया गया।
विद्या भारती की प्रगति को देखकर विदेश के लोग भी इस ओर आकृष्ट हुए। अतः उन्हें अनेक अंतरराष्ट्रीय गोष्ठियों में आमन्त्रित किया गया। उन्होंने भारतीय चिन्तन के आधार पर अनेक पुस्तकें भी लिखीं, जिनमें भारतीय शिक्षा के मूल तत्व, प्राचीन भारतीय शिक्षा पद्धति, विद्या भारती की चिन्तन दिशा, नैतिक शिक्षा के मनोवैज्ञानिक आधार आदि प्रमुख हैं।
उनके कार्यों से प्रभावित होकर उन्हें कई संस्थाओं ने सम्मानित किया। कुरुक्षेत्र के गीता विद्यालय परिसर में उन्होंने संस्कृति संग्रहालय की स्थापना कराई; पर इसी बीच वे कैंसर से पीड़ित हो गये। समुचित चिकित्सा के बाद भी उनके स्वास्थ्य में सुधार नहीं हुआ। 17 नवम्बर, 2004 को विद्या भारती के निराला नगर, लखनऊ स्थित परिसर में उनका देहान्त हुआ। उनकी अंतिम इच्छानुसार उनका दाह संस्कार उनके पैतृक गांव में ही किया गया।",426,मानसिक
बाल संस्कार,"शिशु के जन्म से लेकर उसके वयस्क होने तक उसे शिक्षित एवं संस्कारित करना पालन-पोषण या बाल संस्कार (पैरेन्टिंग) कहलाता है।
अधिकांश शिशु एवं बालक/बालिका अपने माता-पिता के साथ रहते हैं। कुछ शिशुओं के साथ उनके दादा-दादी या नाना-नानी भी रहते हैं। किन्तु कुछ स्थितियों में सरकार या स्वयंसेवी संस्थायें बच्चों देखभाल करती हैं।",54,मानसिक
कार्य संतुष्टि,कार्य संतुष्टि (job satisfaction) को कई तरह से परिभाषित किया जाता है। कुछ लोग समझते हैं कि कार्य संतुष्टि से यह तात्पर्य है कि कोई व्यक्ति अपने कार्य (जॉब) से कितना संतुष्ट है। किन्तु अन्य लोग यह मानते हैं कार्य संतुष्टि का अर्थ इतना सरल नहीं है बल्कि इसके अनेकों मनोवैज्ञानिक पहलू हैं।,53,मानसिक
पार्किंसन रोग,"पार्किन्‍सोनिज्‍म का आरम्भ आहिस्ता-आहिस्ता होता है। पता भी नहीं पड़ता कि कब लक्षण शुरू हुए। अनेक सप्ताहों व महीनों के बाद जब लक्षणों की तीव्रता बढ़ जाती है तब अहसास होता है कि कुछ गड़बड़ है। डॉक्टर जब हिस्‍ट्री (इतिवृत्त) कुरेदते हैं तब मरीज़ व घरवाले पीछे मुड़ कर देखते हैं याद करते हैं और स्वीकारते हैं कि हां सचमुय ये कुछ लक्षण, कम तीव्रता के साथ पहले से मौजूद थे। लेकिन तारीख बताना सम्भव नहीं होता।
कभी-कभी किसी विशिष्ट घटना से इन लक्षणों का आरम्भ जोड़ दिया जाता है - उदाहरण के लिये कोई दुर्घटना, चोट, बुखार आदि। यह संयोगवश होता है। उक्त तात्कालिक घटना के कारण मरीज़ का ध्यान पार्किन्‍सोनिज्‍म के लक्षणों की ओर चला जाता है जो कि धीरे-धीरे पहले से ही अपनी मौजूदगी बना रहे थे।
बहुत सारे मरीजों में पार्किन्‍सोनिज्‍म रोग की शुरूआत कम्पन से होती है। कम्पन अर्थात् धूजनी या धूजन या ट्रेमर या कांपना।
पार्किंसन किसी को तब होता है जब रसायन पैदा करने वाली मस्तिष्क की कोशिकाएँ गायब होने लगती हैं",169,मानसिक
मनोविज्ञान,"मनोविज्ञान वह शैक्षिक और अनुप्रयोगात्मक विद्या है जो प्राणी (मनुष्य, पशु आदि) के मानसिक प्रक्रियाओं, अनुभवों तथा व्यक्त व अव्यक्त दोनों प्रकार के व्यवहार का एक क्रमबद्ध तथा वैज्ञानिक अध्ययन करती है। दूसरे शब्दों में यह कहा जा सकता है कि मनोविज्ञान एक ऐसा विज्ञान है जो क्रमबद्ध रूप से प्रेक्षणीय व्यवहार का अध्ययन करता है तथा प्राणी के भीतर के मानसिक एवं दैहिक प्रक्रियाओं जैसे - चिन्तन, भाव आदि तथा वातावरण की घटनाओं के साथ उनका संबंध जोड़कर अध्ययन करता है। इस परिप्रेक्ष्य में मनोविज्ञान को व्यवहार एवं मानसिक प्रक्रियाओं के अध्ययन का विज्ञान कहा गया है। 'व्यवहार' में मानव व्यवहार तथा पशु व्यवहार दोनों ही सम्मिलित होते हैं। मानसिक प्रक्रियाओं के अन्तर्गत संवेदन, अवधान, प्रत्यक्षण, सीखना (अधिगम), स्मृति, चिन्तन आदि आते हैं।
मनोविज्ञान अनुभव का विज्ञान है। इसका उद्देश्य चेतनावस्था की प्रक्रिया के तत्त्वों का विश्लेषण, उनके परस्पर संबंधों का स्वरूप तथा उन्हें निर्धारित करनेवाले नियमों का पता लगाना है।",152,मानसिक
परवरिश क्या है,"परवरिश (Parenting) एक ऐसा व्यवहार है जिसको माता पिता अपने बच्चे पर अपनाते हैं। इस व्यव्हार के द्वारा बच्चे के सभी पहलुओं का ध्यान रखा जाता है। यह एक ऐसी क्रिया है जो बालक में बचपन से लेकर प्रौढ़ावस्था तक चलती है। इसके अंतर्गत शारीरिक, मानसिक, तथा सामजिक सभी पहलु शामिल होते हैं। हम सभी के जीवन में परवरिytoश का बहुत ही ज्यादा महत्व होता है। हमारा व्यवहार, आदतें और रहने का तरीका आदि सभी चीज़ें परवरिश के ज़रिये ही हमें मिल पाती हैं।
बच्चों की परवरिश जिस प्रकार के वातावरण में होगी, बच्चे का जीवन भी उसी प्रकार का होगा। अर्थात बच्चों की मानसिक स्थिति, स्वस्थ्य, आत्मसम्मान आदि सभी उनकी परवरिश पर ही निर्भर करते हैं। बच्चों की परवरिश अलग-अलग प्रकार की होने की वजह से ही उनमें-अलग अलग गुण पाए जाते हैं। परवरिश कई प्रकार से की जाती है और उन सभी परवरिश के तरीकों को हम परवरिश की शैलियों का नाम देते हैं।",156,मानसिक
मन-शरीर समस्या,"मन-शरीर की समस्या (mind-body problem) मानव मन में विचार और चेतना, तथा शरीर के बीच संबंध विषयक एक दार्शनिक समस्या है।  
मुद्दा ये है. हालाँकि यह स्पष्ट है कि मानसिक घटनाएँ और शारीरिक घटनाएँ किसी तरह संबंधित हैं, यह स्पष्ट नहीं है कि इस संबंध की प्रकृति व इसका स्वभाव क्या है। उदाहरण के लिए, यह स्पष्ट है कि उदासी की भावनाएँ (जो मानसिक घटनाएँ हैं) लोगों को रोने पर मजबूर कर देंगी (जो कि शरीर की एक भौतिक स्थिति है), या कि किसी चुटकुले को मज़ेदार समझना (एक मानसिक घटना) किसी को हँसने पर मजबूर कर देगी (दूसरी शारीरिक स्थिति), या कि दर्द की भावनाएँ (मन में) परिहार व्यवहार का कारण बनेंगी (शरीर में), और इसी तरह। इसी तरह, यह सर्वविदित है कि दवाओं (जैसे एंटीसाइकोटिक्स (मनोविक्षिप्तरोधि), एसएसआरआई जैसे प्रतिअवसादक या अल्कोहल) के माध्यम से शरीर (और विशेष रूप से मस्तिष्क) की रसायनिकी को बदलने से किसी की मनःस्थिति को अतुच्छ तरीकों से अहम पैमाने पर बदला जा सकता है। या, दूसरी दिशा में, यह ज्ञात है कि संज्ञानात्मक व्यवहारपरक चिकित्सा जैसे चिकित्सीय हस्तक्षेप उन तरीकों से संज्ञान को बदल देंगे जिनका शारीरिक स्वास्थ्य पर अनुप्रवाह प्रभाव पड़ता है। ये उन असंख्य तरीकों के केवल कुछ उदाहरण हैं जिनमें मन और शरीर की स्थिति घनिष्ठ रूप से जुड़ी हुई प्रतीत होती है; किसी के दिन-प्रतिदिन के अनुभवों पर चिंतन करने से और भी कई उदाहरण मिल सकते हैं।
सामान्य तौर पर, इन मन-शरीर संबंधों का अस्तित्व असमस्यात्मक लगता है। हालाँकि, मुद्दे तब उठते हैं, जब कोई इस पर विचार करता है कि हमें इन संबंधों को तत्त्वमीमांसक या वैज्ञानिक दृष्टिकोण से वास्तव में क्या समझना चाहिए। इस तरह के विचार तुरंत कई प्रश्न खड़े करते हैं जैसे:

क्या मन और शरीर दो अलग-अलग इकाईयाँ हैं, या एक ही इकाई है?
यदि मन और शरीर दो अलग-अलग इकाईयां हैं, तो क्या वे दोनों अन्योन्यक्रिया (interact) यूँ ही करते हैं?
क्या इन दो अलग-अलग इकाईयों के लिए अन्योन्यक्रिया यूँ ही करना संभव है?
इस अन्योन्यक्रिया की प्रकृति (स्वभाव, nature of interaction) क्या है?
क्या यह अन्योन्यक्रिया कभी अनुभवजन्य अध्ययन का विषय हो सकती है?
यदि मन और शरीर एक ही इकाई हैं, तो क्या मानसिक घटनाओं को भौतिक घटनाओं के संदर्भ में समझा जा सकता है, या इसके विपर्येण?
क्या मानसिक और भौतिक घटनाओं के बीच संबंध कुछ ऐसा है जो विकास के एक निश्चित बिंदु पर नए सिरे (de novo) से उत्पन्न होता है?
और इसी तरह कई अन्य। ये और अन्य प्रश्न जो मन और शरीर के बीच संबंध पर चर्चा करते हैं वे सभी प्रश्न 'मन-शरीर समस्या' के बैनर तले आते हैं।",424,मानसिक
स्वप्न,"एक स्वप्न छवियों, विचारों, भावनाओं और संवेदनाओं का एक क्रम है जो आमतौर पर निद्रा के कुछ चरणों के दौरान मन में अनैच्छिक रूप से होता है। मनुष्य प्रति रात लगभग दो घंटे स्वप्न देखने में व्यतीत करता है, और प्रत्येक स्वप्न लगभग 5 से 20 मिनट तक रहता है, यद्यपि स्वप्न देखने वाले को यह स्वप्न इससे कहीं अधिक लंबा लग सकता है।
स्वप्नों की सामग्री और कार्य पूरे लिपिबद्ध इतिहास में वैज्ञानिक, दार्शनिक और धार्मिक रुचि के विषय रहे हैं।  तीसरी सहस्राब्दी ईसा पूर्व में बेबीलोनियों द्वारा और प्राचीन सुमेरियों द्वारा पहले भी प्रचलित स्वप्न व्याख्या, कई परंपराओं में धार्मिक ग्रंथों में प्रमुखता से आती है, और मनोचिकित्सा में प्रमुख भूमिका निभाई है। स्वप्नों के वैज्ञानिक अध्ययन को ओनेइरोलोजी कहा जाता है। अधिकांश आधुनिक स्वप्नाध्ययन स्वप्नों के तंत्रिका-क्रियाविज्ञान और स्वप्न कार्य के संबंध में परिकल्पनाओं के प्रस्ताव और परीक्षण पर केंद्रित होते हैं। यह ज्ञात नहीं है कि मस्तिष्क में स्वप्नों की उत्पत्ति कहाँ से होती है, यदि स्वप्नों की एक ही उत्पत्ति है या यदि मस्तिष्क के कई क्षेत्र शामिल हैं, या शरीर या मन के लिए सपने देखने का उद्देश्य क्या है।
स्वप्न देखना और निद्रा आपस में जुड़े हुए हैं। स्वप्न मुख्य रूप से नींद के तीव्र नेत्र संचलन (REM) चरण में होते हैं - जब मस्तिष्क की गतिविधि अधिक होती है और जाग्रत होने के समान होती है। क्योंकि कई प्रजातियों में REM निद्रा का पता लगाया जा सकता है, और क्योंकि शोध से पता चलता है कि सभी स्तनधारी REM का अनुभव करते हैं, स्वप्नों को REM निद्रा से जोड़ने से यह अनुमान लगाया जाता है कि जानवर सपने देखते हैं। यद्यपि, मनुष्य गैर-REM निद्रा के दौरान भी स्वप्न देखते हैं, और सभी REM जागरण स्वप्न की संदेश नहीं देते हैं। अध्ययन करने के लिए, एक स्वप्न को पहले एक मौखिक विवरण में ही किया जाना चाहिए, जो कि विषय की स्वप्न की स्मृति का एक खाता है, न कि विषय के स्वप्न के अनुभव का।  इसलिए, गैर-मनुष्यों द्वारा स्वप्न देखना वर्तमान में अप्राप्य है, जैसा कि मानव भ्रूण और पूर्व-मौखिक शिशुओं द्वारा स्वप्न देखा जा रहा है।",345,मानसिक
