title,content,word_count,topic
मिस्बाह-उल-हक़,"मिस्बाह-उल-हक़ (अंग्रेज़ी: Misbah-ul-Haq Khan Niazi/उर्दू: مصباح الحق خان نیازی‎) (जन्म २८ मई १९७४ ,मिंयावाली ,पंजाब ,पाकिस्तान ) एक पूर्व प्रोफेशनल क्रिकेट खिलाड़ी है जो पाकिस्तान क्रिकेट टीम की ओर से खेलते थे। साथ मिस्बाह पाकिस्तान टीम के टेस्ट क्रिकेट प्रारूप में कप्तान भी थे। इनके अलावा २०१५ क्रिकेट विश्व कप तक मिस्बाह टीम के एक दिवसीय अंतर्राष्ट्रीय में भी कप्तान थे लेकिन बाद में क्रिकेट के अलविदा कह दिया और इनकी जगह टीम के वनडे के लिए अज़हर अली को कप्तान चुना गया। ये मध्यम क्रम (middle-order) के बल्लेबाज है साथ ही बड़े शॉट्स के लिए भी जाने जाते है ,जब टीम को बड़े हिट्स की जरूरत होती है तो इनका बल्ला खूब बोलता है। मिस्बाह ने एक दिवसीय क्रिकेट में एक भी शतक नहीं लगाया था इस कारण इनके नाम यह एक अजीब रिकॉर्ड कायम है कि बिना शतक सबसे ज्यादा रन बनाए। हालांकि मिस्बाह के नाम सबसे तेज टेस्ट क्रिकेट में अर्द्धशतक लगाने का रिकॉर्ड है। मिस्बाह-उल-हक़ के पास एमबीए की डिग्री भी है यानी मिस्बाह ने यूनिवर्सिटी ऑफ़ मैनेजमेंट एंड टेक्नोलॉजी लाहौर ,पाकिस्तान से एमबीए (मास्टर ऑफ़ बिजनेस एडमिनिस्ट्रेटर) की पढ़ाई की थी। मिस्बाह का सम्बंध पूर्व पाकिस्तानी क्रिकेट कप्तान इमरान ख़ान से भी है जो कि अभी एक राजनेता है।",204,खेलकूद
चण्डीगढ़,"चण्डीगढ़, (पंजाबी: ਚੰਡੀਗੜ੍ਹ), भारत का एक संघ राज्यक्षेत्र है, जो दो भारतीय राज्यों, पंजाब और हरियाणा की राजधानी भी है। इसे पंजाब के २८ गावों को उजाड़ कर बनाया गया था। इसके नाम का अर्थ है चण्डी का किला। यह हिन्दू देवी दुर्गा के एक रूप चण्डिका या चण्डी के एक मन्दिर के कारण पड़ा है। यह मन्दिर आज भी शहर से कुछ दूर हरियाणा के पंचकुला जिले में स्थित है। इसे सिटी ब्यूटीफुल भी कहा जाता है। चण्डीगढ़ राजधानी क्षेत्र में मोहाली, पंचकुला और ज़ीरकपुर आते हैं, जिनकी २००१ की जनगणना के अनुसार जनसंख्या ११६५१११ (१ करोड़ १६ लाख) है। भारत की लोकसभा में प्रतिनिधित्व हेतु चण्डीगढ़ के लिए एक सीट आवण्टित है। वर्तमान सत्रहवीं लोकसभा में भारतीय जनता पार्टी की श्रीमती किरण खेर यहाँ से संसद सदस्य हैं। २०२० ईसवी से पूर्व चण्डीगढ में सेक्टर १३ नाम से कोइ सेक्टर नहीं था क्योंकि चण्डीगढ़ शहर के शिल्पकार ली कार्बूजियर इस अंक को अशुभ मानते थे। किन्तु फ़रवरी २०२० में संघ राज्यक्षेत्र प्रशासन द्वारा नगर के ८ क्षेत्रों को क्षेत्रक १३ अधिसूचित किया गया। 
इस शहर का नामकरण दुर्गा के एक रूप ‘चण्डिका’ के कारण हुआ है और चंडी का मंदिर आज भी इस शहर की धार्मिक पहचान है। इस शहर के निर्माण में तत्कालीन प्रधानमन्त्री जवाहर लाल नेहरू की भी निजी रुचि रही है, जिन्होंने नए राष्ट्र के आधुनिक प्रगतिशील दृष्टिकोण के रूप में चण्डीगढ़ को देखते हुए इसे राष्ट्र के भविष्य में विश्वास का प्रतीक बताया था। चण्डीगढ़ को तत्कालीन भारत राष्ट्रपति श्री राजेन्द्र प्रसाद द्वारा १९५३ ई० में किया गया था।
अन्तर्राष्ट्रीय स्तर पर शहरी योजनाबद्धता और वास्तु-स्थापत्य के लिए प्रसिद्ध यह शहर आधुनिक भारत का प्रथम योजनाबद्ध शहर है। चण्डीगढ़ के मुख्य वास्तुकार फ्रांसीसी वास्तुकार ली कार्बूजियर हैं, लेकिन शहर में पियरे जिएन्नरेट, मैथ्यु नोविकी एवं अल्बर्ट मेयर के बहुत से अद्भुत वास्तु नमूने देखे जा सकते हैं। शहर का भारत के समृद्ध राज्यों और संघ शसित प्रदेशों की सूची में अग्रणी नाम आता है, जिसकी प्रति व्यक्ति आय ९९,२६२ रु (वर्तमान मूल्य अनुसार) एवं स्थिर मूल्य अनुसार ७०,३६१ (२००६-०७) रु है।",337,खेलकूद
ढाका,"ढाका (बांग्ला: ঢাকা) बांग्लादेश की राजधानी है। बूढ़ी गंगा नदी के तट पर स्थित यह देश का सबसे बड़ा शहर है। राजधानी होने के अलावा यह बांग्लादेश का औद्यौगिक और प्रशासनिक केन्द्र भी है। यहाँ पर धान, गन्ना और चाय का व्यापार होता है। ढाका की जनसंख्या लगभग 1.1 करोड़ है (२००१ की जनसंख्या: ९,०००,०२)) जो इसे दुनिया के ग्यारहवें सबसे बड़ी जनसंख्या वाले शहर का दर्जा भी दिलाता है। ढाका का अपना इतिहास रहा है और इसे दुनिया में मस्जिदों के शहर के नाम से जाना जाता है।
मुगल सल्तनत के दौरान इस शहर को १७ वीं सदी में जहांगीर नगर के नाम से भी जाना जाता था, यह न सिर्फ प्रादेशिक राजधानी हुआ करती थी बल्कि यहाँ पर निर्मित होने वाले मलमल के व्यापार में इस शहर का पूरी दुनिया में दबदबा था। आधुनिक ढाका का निर्माण एवं विकास ब्रिटिश शासन के दौरान उन्नीसवीं शताब्दी में हुआ और जल्द ही यह कोलकाता के बाद पूरे बंगाल का दूसरा सबसे बड़ा शहर बन गया। 
भारत विभाजन के बाद १९४७ में ढाका पूर्वी पाकिस्तान की प्रशासनिक राजधानी बना तथा १९७२ में बांग्लादेश के स्वतंत्र राष्ट्र के रूप में अस्तित्व में आने पर यह राष्ट्रीय राजधानी घोषित हुआ। आधुनिक ढाका देश की राजनीति, अर्थव्यवस्था, एवं संस्कृति का मुख्य केन्द्र है। ढाका न सिर्फ देश का सबसे साक्षर (६३%) शहर है- - बल्कि बांग्लादेश के शहरों में सबसे ज्यादा विविधता वाला शहर भी है। हालांकि आधुनिक ढाका का शहरी आधारभूत ढांचा देश में सबसे ज्यादा विकसित है परंतु प्रदूषण, यातायात कुव्यवस्था, गरीबी, अपराध जैसी समस्यायें इस शहर के लिए बड़ी चुनौतियां हैं। सारे देश से लोगों का ढाका की ओर पलायन भी सरकार के लिए एक बड़ी समस्या का रूप लेता जा रहा है।",282,खेलकूद
खेल चोट,"खेलकूद में लगने वाली चोटें (sports injuries) नियमित चोटों से अलग होती हैं, क्योंकि खिलाड़ी अपने शरीर पर बहुत दबाव डालते हैं, जो कभी-कभी मांसपेशियों, जोड़ों और हड्डियों में टूट-फूट का कारण बनता है। खेल, प्रशिक्षण और व्यायाम में भाग लेने के दौरान खेल की चोटें होती हैं। ओवरट्रेनिंग, कंडीशनिंग की कमी, और कार्य करने की अनुचित तकनीक से खेल में चोट लगती है। व्यायाम या किसी भी शारीरिक खेल को खेलने से पहले वार्म अप न करने से भी चोटों का खतरा बढ़ जाता है।
स्पोर्ट्स फिजियोथेरेपी, फिजियोथेरेपी की एक विशेष शाखा है जिसकी मदद से खेल की चोटों का इलाज बेहतर तरीके से किया जाता है। स्पोर्ट्स फिजियोथेरेपिस्ट के पास खेल विशिष्ट ज्ञान होता है और एथलीट की तेजी से रिकवरी करने में मदद करने में बेहतर होते हैं। आम तौर पर खेल की चोटों के उपचार में एथलीटों को राहत पहुंचाने के लिए उचित दवा के साथ स्पोर्ट्स फिजियोथेरेपी का उपयोग किया जाता है। वास्तव में खेल की चोट में फिजियोथेरेपी एथलीटों की तेजी से रिकवरी काफी उपयोगी साबित हुई है और उपचार के सबसे भरोसेमंद रूपों में से एक है।",184,खेलकूद
रामठाकुर बाबा,"बिहार के सुपौल जिले के प्रतापगंज प्रखंड के सिरीपुर गाँव में रामठाकुर बाबा का गहबर है। यहाँ आसपास के कई गाँवों से लोग अपनी इच्छा लेकर आते हैं,और संतुष्ट होकर जातेहै।यहाँ रामठाकुर बाबा पिंडी रुप में विराजमान हैं॥

श्री राम राम रामेति
रमे रामे मनोरमे
शहस्त्रनाम तत्तुल्यं श्री
रामनाम वरानने",50,खेलकूद
समर कैम्प (ग्रीष्मकालीन शिविर),"समर कैम्प (ग्रीष्मकालीन शिविर), कुछ देशों में (आमतौर पर) गर्मियों के महीनों में बच्चों और/या किशोर-किशोरियों के लिए निगरानी के तहत आयोजित किये जाने वाला एक कार्यक्रम को कहते हैं। समर कैम्प में शामिल होने वाले बच्चों और किशोर-किशोरियों को कैम्पर्स के नाम से जाना जाता है।
विभिन्न प्रकार के विशेष क्रियाकलापों वाले नए समर कैम्पों की अधिक से अधिक स्वीकृति के साथ, हाइकिंग (लंबी पैदल यात्रा), कैनोइंग (नौकायन) और कैम्पफायर (अलाव या शिविर-समारोह) के साथ एक जंगली स्थान के रूप में एक समर कैम्प के पारंपरिक नज़रिए का विकास हो रहा है। उदाहरण के लिए, प्रदर्शन कला, संगीत, जादू, कंप्यूटर, भाषा शिक्षण, गणित, विशेष जरूरतों वाले बच्चों और वजन कम करने के लिए कैम्पों का आयोजन किया जाता है। 2006 में, अमेरिकन कैम्प एसोसिएशन ने बताया कि कुल कैम्पों में से 75 प्रतिशत कैम्पों में नए कार्यक्रम शामिल किए गए हैं। छोटे आकार के परिवारों, पूरक शैक्षिक कार्यक्रमों में वृद्धि तथा इलेक्ट्रॉनिक मीडिया की बढ़ती लोकप्रियता के कारण समर कैम्पों के नामांकन में बड़े पैमाने पर होने वाली गिरावट को कम करने के लिए ऐसा किया गया है; इन सभी के कारण पिछली पीढ़ियों की तुलना में बच्चों को घर के अंदर ही व्यस्त रखना काफी आसान हो गया है। ये कैम्प हर उम्र के लोगों के लिए हो सकते हैं।
धर्म से जुड़े समर कैम्पों का भी आयोजन किया जाता है जैसे कि इवान्जेलिकल ईसाई समूहों द्वारा आयोजित कैम्प.
कई कैम्पों का मुख्य उद्देश्य शैक्षिक या सांस्कृतिक विकास होता है। समर कैम्प के माहौल में बच्चों को एक सुरक्षित और परवरिश के माहौल में गुणकारी जोखिम उठाने का अवसर मिल सकता है।",264,खेलकूद
ममता सौदा,"ममता सौदा, एक भारतीय खिलाड़ी हैं, जिन्हें माउंट एवरेस्ट को 2010 में फतह करने के सफल प्रयास के लिए जाना जाता हैं। पर्वतारोहण खेल के क्षेत्र में उनकी सेवाओं के लिए 2014 में उन्हें भारत सरकार द्वारा देश के चौथे सर्वोच्च नागरिक सम्मान पद्म श्री से सम्मानित किया गया था।",50,खेलकूद
मद्रास प्रैज़िडन्सी,"मद्रास प्रेसीडेंसी (तमिल: சென்னை மாகாணம், तेलुगु: చెన్నపురి సంస్థానము, मलयालम: മദ്രാസ് പ്രസിഡന്‍സി, कन्नड़: ಮದ್ರಾಸ್ ಪ್ರೆಸಿಡೆನ್ಸಿ, ओड़िया: ମଦ୍ରାସ୍ ପ୍ରେସୋଦେନ୍ଚ୍ଯ), जिसे आधिकारिक तौर पर फोर्ट सेंट जॉर्ज की प्रेसीडेंसी तथा मद्रास प्रोविंस के रूप में भी जाना जाता है, ब्रिटिश भारत का एक प्रशासनिक अनुमंडल था। अपनी सबसे विस्तृत सीमा तक प्रेसीडेंसी में दक्षिण भारत के अधिकांश हिस्सों सहित वर्तमान भारतीय राज्य तमिलनाडु, उत्तरी केरल का मालाबार क्षेत्र, लक्षद्वीप द्वीपसमूह, तटीय आंध्र प्रदेश और आंध्र प्रदेश के रायलसीमा क्षेत्र, गंजाम, मल्कानगिरी, कोरापुट, रायगढ़, नवरंगपुर और दक्षिणी उड़ीसा के गजपति जिले और बेल्लारी, दक्षिण कन्नड़ और कर्नाटक के उडुपी जिले शामिल थे। प्रेसीडेंसी की अपनी शीतकालीन राजधानी मद्रास और ग्रीष्मकालीन राजधानी ऊटाकामंड थी।
1639 में ब्रिटिश ईस्ट इंडिया कंपनी ने मद्रासपट्टनम गांव को खरीदा था और इसके एक साल बाद मद्रास प्रेसीडेंसी की पूर्ववर्ती, सेंट जॉर्ज किले की एजेंसी की स्थापना की थी, हालांकि मछलीपट्टनम और आर्मागोन में कंपनी के कारखाने 17वीं सदी के प्रारंभ से ही मौजूद थे। 1655 में एक बार फिर से इसकी पूर्व की स्थिति में वापस लाने से पहले एजेंसी को 1652 में एक प्रेसीडेंसी के रूप में उन्नत बनाया गया था। 1684 में इसे फिर से एक प्रेसीडेंसी के रूप में उन्नत बनाया गया और एलीहू येल को पहला प्रेसिडेंट नियुक्त किया गया। 1785 में पिट्स इंडिया एक्ट के प्रावधानों के तहत मद्रास ब्रिटिश ईस्ट इंडिया कंपनी द्वारा स्थापित तीन प्रांतों में से एक बन गया। उसके बाद क्षेत्र के प्रमुख को ""प्रेसिडेंट"" की बजाय ""गवर्नर"" का नाम दिया गया और कलकत्ता में गवर्नर-जनरल का अधीनस्थ बनाया गया, यह एक ऐसा पद था जो 1947 तक कायम रहा. न्यायिक, विधायी और कार्यकारी शक्तियां राज्यपाल के साथ रह गयीं जिन्हें एक काउंसिल का सहयोग प्राप्त था जिसके संविधान को 1861, 1909, 1919 और 1935 में अधिनियमित सुधारों द्वारा संशोधित किया गया था। 1939 में द्वितीय विश्व युद्ध छिड़ने के समय तक मद्रास में नियमित चुनाव आयोजित किए गए। 1908 तक प्रांत में 22 जिले शामिल थे जिनमें से प्रत्येक एक जिला कलेक्टर के अधीन था और आगे इसे तालुका तथा फिरका में उपविभाजित किया गया था जिसमें गांव प्रशासन की सबसे छोटी इकाई के रूप में थे।
मद्रास ने 20वीं सदी के प्रारंभिक दशकों में भारतीय स्वतंत्रता आंदोलन में एक महत्वपूर्ण योगदान दिया और यह 1919 के मोंटेग-चेम्सफोर्ड सुधारों के बाद ब्रिटिश भारत में द्विशासन की प्रणाली को लागू करने वाला पहला प्रांत था। इसके बाद गवर्नर ने एक प्रधानमंत्री के साथ-साथ शासन किया। 15 अगस्त 1947 को भारतीय स्वतंत्रता के आगमन के साथ प्रेसीडेंसी को भंग कर दिया गया। 26 जनवरी 1950 को भारतीय गणराज्य के शुभारंभ के अवसर पर मद्रास को भारतीय संघ के राज्यों में से एक के रूप में स्वीकृत किया गया।",437,खेलकूद
