title,content,word_count,topic
हेपेटाइटिस बी,"यकृतशोथ ख (हेपाटाइटिस बी) हेपाटाइटिस बी वायरस (HBV) के काऱण होने वाली एक संक्रामक बीमारी है जो मनुष्य के साथ बंदरों की प्रजाति के लीवर को भी संक्रमित करती है, जिसके कारण लीवर में सूजन और जलन पैदा होती है जिसे हेपाटाइटिस कहते हैं। मूलतः, ""सीरम हेपेटाइटिस"" के रूप में ज्ञात इस बीमारी के कारण एशिया और अफ्रिका में महामारी पैदा हो चुकी है और चीन में यह स्थानिक मारक है। विश्व की जनसंख्या के एक तिहाई लोग, दो अरब से अधिक, हेपेटाइटिस बी वायरस से संक्रमित हो चुके हैं। इनमें से 35 करोड़ इस वायरस के दीर्घकालिक वाहक के रूप शामिल हैं। हेपेटाइटिस बी वायरस का संचरण संक्रमित रक्त या शरीर के तरल पदार्थ के संपर्क में जाने से होता है।",122,मानसिक
आर्थर कॉनन डॉयल,"सर आर्थर इग्नाशियस कॉनन डॉयल,  (22 मई 1859 - जुलाई 7, 1930) एक स्कॉटिश चिकित्सक और लेखक थे जिन्हें अधिकतर जासूस शरलॉक होम्स की उनकी कहानियों (इन कहानियों को आम तौर पर काल्पनिक अपराध कथा के क्षेत्र में एक प्रमुख नवप्रवर्तन के तौर पर देखा जाता है) और प्रोफ़ेसर चैलेंजर के साहसिक कारनामों के लिए जाना जाता है।
वह विज्ञान कल्पना कथाएँ, ऐतिहासिक उपन्यासों, नाटकों और रोमांस, कविता और विभिन्न कल्पना साहित्य के एक विपुल लेखक थे। वे एक सफल लेखक थे जिनकी अन्य रचनाओं में काल्पनिक विज्ञान कथाएं, ऐतिहासिक उपन्यास, नाटक एवं रोमांस, कविता और गैर-काल्पनिक कहानियां शामिल हैं।",100,मानसिक
जैव संरक्षण,"जैव संरक्षण, प्रजातियां, उनके प्राकृतिक वास और पारिस्थितिक तंत्र को विलोपन से बचाने के उद्देश्य से प्रकृति और पृथ्वी की जैव विविधता के स्तरों का वैज्ञानिक अध्ययन है। यह विज्ञान, अर्थशास्त्र और प्राकृतिक संसाधन प्रबंधन के व्यवहार से आहरित अंतरनियंत्रित विषय है। शब्द कन्सर्वेशन बॉयोलोजी को जीव-विज्ञानी ब्रूस विलकॉक्स और माइकल सूले द्वारा 1978 में ला जोला, कैलिफ़ोर्निया स्थित कैलिफ़ोर्निया विश्वविद्यालय में आयोजित सम्मेलन में शीर्षक के तौर पर प्रवर्तित किया गया। बैठक वैज्ञानिकों के बीच उष्णकटिबंधीय वनों की कटाई, लुप्त होने वाली प्रजातियों और प्रजातियों के भीतर क्षतिग्रस्त आनुवंशिक विविधता पर चिंता से उभरी. परिणत सम्मेलन और कार्यवाहियों ने एक ओर उस समय के पारिस्थितिकी सिद्धांत और जीव-समुदाय जैविकी के बीच मौजूद अंतराल को पाटने और दूसरी ओर संरक्षण नीति और व्यवहार की मांग की।  जैव संरक्षण और जैव विविधता की अवधारणा (जैव विविधता), संरक्षण विज्ञान और नीति के आधुनिक युग को निश्चित रूप देने में मदद देते हुए, एक साथ उभरी।
दुनिया भर में स्थापित जैविक प्रणालियों में तेजी से गिरावट का मतलब है जीव संरक्षण को अक्सर ""सीमा सहित अनुशासन"" के रूप में निर्दिष्ट किया जाता है। जीव विज्ञान छितराव, प्रवास, जनसांख्यिकी, प्रभावी जनसंख्या आकार, अंतःप्रजनन अवसाद और दुर्लभ या लुप्तप्राय प्रजातियों की न्यूनतम आबादी व्यवहार्यता के शोध की पारिस्थितिकी के साथ बारीकी से बंधा हुआ है। जैव संरक्षण, जैव विविधता के रखरखाव, हानि को प्रभावित करने वाले तथ्य और आनुवंशिक, आबादी, प्रजातियां और पारिस्थितिकी तंत्र विविधता को पैदा करने वाली विकासवादी प्रक्रिया को बनाए रखने के विज्ञान से जुड़ी हुई है। चिंता इस सुझाए गए अनुमान से उभरती है कि अगले 50 सालों में ग्रह के सभी प्रजातियों का 50% लुप्तप्राय हो जाएगा, जिसने ग़रीबी, भुखमरी को योगदान दिया है और इस ग्रह पर विकास की गति को दुबारा सेट किया है।
संरक्षण जीव-विज्ञानी जैव विविधता क्षति, प्रजातियों के विलोपन की प्रवृत्ति और प्रक्रिया और मानव समाज के कल्याण के संपोषण की हमारी क्षमता पर उसके नकारात्मक प्रभाव के बारे में शोध और शिक्षित करते हैं। संरक्षण जीव-विज्ञानी क्षेत्र और कार्यालय, सरकार, विश्वविद्यालय, लाभरहित संगठन और उद्योगों में काम करते हैं। उनका अनुसंधान, निगरानी और पृथ्वी के हर कोण की सूची और समाज के साथ उसके संबंध के लिए वित्त पोषित किया जाता है। विषयों में विविधता है, क्योंकि यह जैविक और साथ ही सामाजिक विज्ञान में व्यावसायिक सहयोग सहित अंतर्विषयक नेटवर्क है। उद्देश्य और पेशे के प्रति समर्पित लोग आचार, नैतिकता और वैज्ञानिक कारणों के आधार पर वर्तमान जैव विविधता संकट के प्रति वैश्विक प्रतिक्रिया के लिए पैरवी करते हैं। संगठन और नागरिक वैश्विक मानदंडों के जरिए स्थानीय स्तर पर चिंताओं से जुड़ने वाले शैक्षिक कार्यक्रमों को निर्देशित करने वाले संरक्षण कार्य योजनाओं के माध्यम से जैव विविधता संकट के प्रति प्रतिक्रिया कर रहे हैं।",440,मानसिक
विकिरण चिकित्सा,"आयनकारी विकिरण का उपयोग करके की जाने वाली चिकित्सा विकिरण चिकित्सा (Radiation therapy या radiotherapy) कहलाती है। यह प्रायः कैंसर के उपचार में खराब (malignant) कोशिकाओं को मारने के काम आती है।विकिरण चिकित्सा पद्धति मानव चिकित्सा का वह औषधीय अनुशासन है जिसके द्वारा कैंसर तथा कुछ अन्य रोगों की चिकित्सा या रोकथाम विकीरण के चिकित्सीय अनुप्रयोग में विशेष विशेषज्ञता वाले रेडिएशन थेरापिस्ट द्वारा किया जाता है।मुख्य रूप से विकिरण चिकित्सा की दो तकनीकें हैं = टेलीथेरेपी  तथा ब्रैकी थैरेपी।टेलीथेरापी से चिकित्सा के भी बहुत से आयाम हैं जैसे_ कन्वेन्शनल टेलीथेरापी, (त्रि आयामी कन्फर्मल रेडियोथेरापी)टेलीथेरापी,आइएमआरटी(इन्टेन्सिटी मॉडूलेटेड रेडियोथेरापी),एक्स नाईफ,गामा नाईफ,टोमोथेरापी,इलेक्ट्रॉन थेरापी,इन्ट्राऑपरेटिव टेलीथेरापी आदि।इसी प्रकार ब्रेकीथेरापी की भी अलग अलग तकनीक है जैसे कन्वेंशनल,थ्री डी कन्फर्मल तथा इन्टेंसिटी मॉडूलेटेल ब्रेकीथेरापी।",117,मानसिक
शुक्रनीति,"शुक्रनीति या शुक्रनीतिसार एक प्रसिद्ध नीतिग्रन्थ है। इसकी रचना करने वाले शुक्र का नाम महाभारत में 'शुक्राचार्य' के रूप में मिलता है। शुक्रनीति के रचनाकार और उनके काल के बारे में कुछ भी पता नहीं है।
शुक्रनीति में पाँच अध्याय और २००० श्लोक हैं जो इसके चौथे अध्याय में उल्लिखित है। उसमें यह भी लिखा है कि इस नीतिसार का रात-दिन चिन्तन करने वाला राजा अपना राज्य-भार उठा सकने में सर्वथा समर्थ होता है। इसमें कहा गया है कि तीनों लोकों में शुक्रनीति के समान दूसरी कोई नीति नहीं है और व्यवहारी लोगों के लिये शुक्र की ही नीति है, शेष सब 'कुनीति' है।
शुक्रनीति की सामग्री कामन्दकीय नीतिसार से भिन्न मिलती है। इसके चार अध्यायों में से प्रथम अध्याय में राजा, उसके महत्व और कर्तव्य, सामाजिक व्यवस्था, मन्त्री और युवराज सम्बन्धी विषयों का विवेचन किया गया है।",138,मानसिक
समानता,"सामाजिक सन्दर्भों में समानता का अर्थ किसी समाज की उस स्थिति से है जिसमें उस समाज के सभी लोग समान (अलग-अलग नहीं) अधिकार या प्रतिष्ठा (status) रखते हैं।( समानता का अधिकार  एक अत्यंत महत्वपूर्ण अधिकार है और इसका तात्पर्य यह है की प्रत्येक  क्षेत्र में व्यक्ति को व्यक्ति होने के नाते सम्मान और महत्त्व प्राप्त होना चाहिए और जाती धर्म व आर्थिक स्थिति के भेद के बिना सभी व्यक्तियों को अपने जीवन का विकास करने के लिए सम्मान सुविधाए प्राप्त होनी चाहिए समानता का अधिकार प्रजातंत्र की आत्मा है | ) सामाजिक समानता के लिए 'कानून के सामने समान अधिकार' एक न्यूनतम आवश्यकता है जिसके अन्तर्गत सुरक्षा, मतदान का अधिकार, भाषण की स्वतंत्रता, एकत्र होने की स्वतंत्रता, सम्पत्ति अधिकार, सामाजिक वस्तुओं एवं सेवाओं पर समान पहुँच (access) आदि आते हैं। सामाजिक समानता में स्वास्थ्य समानता, आर्थिक समानता, तथा अन्य सामाजिक सुरक्षा भी आतीं हैं। इसके अलावा समान अवसर तथा समान दायित्व भी इसके अन्तर्गत आता है।
सामाजिक समानता किसी समाज की वह अवस्था है जिसके अन्तर्गत उस समाज के सभी व्यक्तियों को सामाजिक आधार पर समान महत्व प्राप्त हो। समानता की अवधारणा मानकीय राजनीतिक सिद्धान्त के मर्म में निहित है। यह एक ऐसा विचार है जिसके आधार पर करोड़ों-करोड़ों लोग सदियों से निरंकुश शासकों, अन्यायपूर्ण समाज व्यवस्थाओं और अलोकतांत्रिक हुकूमतों या नीतियों के खिलाफ संघर्ष करते रहे हैं और करते रहेंगे। इस लिहाज से समानता को स्थाई और सार्वभौम अवधारणाओं की श्रेणी में रखा जाता है।
दो या दो से अधिक लोगों या समूहों के बीच सम्बन्ध की एक स्थिति ऐसी होती है जिसे समानता के रूप में परिभाषित किया जा सकता है। आम तौर पर साधारण भाषा में समानता का अर्थ है ""लोगो के साथ समान व्यवहार"" लेकिन, एक विचार के रूप में समानता इतनी सहज और सरल नहीं है, क्योंकि उस सम्बन्ध को परिभाषित करने, उसके लक्ष्यों को निर्धारित करने और उसके एक पहलू को दूसरे पर प्राथमिकता देने के एक से अधिक तरीके हमेशा उपलब्ध रहते हैं। अलग-अलग तरीके अख्तियार करने पर समानता के विचार की भिन्न-भिन्न परिभाषाएँ उभरती हैं। प्राचीन यूनानी सभ्यता से लेकर बीसवीं सदी तक इस विचार की रूपरेखा में कई बार जबरदस्त परिवर्तन हो चुके हैं। बहुत से चिंतकों ने इसके विकास और इसमें हुई तब्दीलियों में योगदान किया है जिनमें अरस्तू, हॉब्स, रूसो, मार्क्स और टॉकवील प्रमुख हैं।",376,मानसिक
अल कपोन,"एल्फोंसे गेब्रिएल ""अल"" कपोन (17 जनवरी 1899 - 25 जनवरी 1947) एक अमेरिकी गैंगस्टर थे जो प्रोहिबिशन-एरा (निषेध-युग) के समय ""कपोन्स"" नाम से जाने जाने वाले एक आपराधिक सिंडिकेट के मुखिया थे। यह सिंडिकेट 1920 से 1931 के बीच तस्करी तथा शराब की अवैध बिक्री एवं अन्य गैर क़ानूनी गतिविधियों में संलग्न था। 1931 में अल कपोन को कर चोरी के मामले में सजा सुनाइ गयी और फेडरल जेल भेज दिया गया जहाँ उन्हें कुख्यात एल्केट्राज़ फेडरल जेल में भी रखा गया। उनके बिजनेस कार्ड में कथित तौर पर उनको पुराने फर्नीचरों का एक डीलर बताया गया था।",98,मानसिक
अंग प्रत्यारोपण,"अंग प्रत्यारोपण से अभिप्राय किसी शरीर से एक स्वस्थ और कार्यशील अंग निकाल कर उसे किसी दूसरे शरीर के क्षतिग्रस्त या विफल अंग की जगह प्रत्यारोपित करने से है, (किसी रोगी के एक अंग को उसी रोगी के किसी दूसरे अंग में प्रत्यारोपित करना भी अंग प्रत्यारोपण की श्रेणी में आता है)। अंग दाता जीवित या मृत दोनो हो सकता है।
जो अंग प्रत्यारोपित हो सकते हैं उनमे हृदय, गुर्दे, यकृत, फेफड़े, अग्न्याशय, शिश्न, आँखें और आंत शामिल हैं। ऊतक जो प्रत्यारोपित हो सकते हैं उनमे अस्थियाँ, कंडर (टेंडन), कॉर्निया, हृदय वाल्व, नसें, बाहु और त्वचा शामिल हैं।
प्रत्यारोपण औषधि, आधुनिक चिकित्सा क्षेत्र के सबसे चुनौतीपूर्ण और जटिल क्षेत्रों में से एक है। चिकित्सा प्रबंधन क्षेत्र की कुछ सबसे बड़ी समस्याओं में किसी शरीर द्वारा प्रत्यारोपित अंग को अस्वीकार कर देना है- जहां शरीर का प्रतिरक्षा तंत्र प्रत्यारोपित अंग के विरुद्ध प्रतिक्रिया कर उसे नकार देता है और इसके कारण प्रत्यारोपण विफल हो जाता है और अब इस प्रत्यारोपित अंग को उस शरीर में ही कार्यशील बनाए रखना प्रत्यारोपण औषधि के लिए एक बड़ी चुनौती होती है। यह एक बहुत ही समय संवेदनशील प्रक्रिया है।
अधिकांश देशों में प्रत्यारोपण के लिए उपयुक्त अंगों की कमी है। अधिकांश देशों में अस्वीकृति के जोखिम को कम करने और आवंटन का प्रबंधन करने के लिए एक औपचारिक प्रणाली है। कुछ देश यूरोट्रांसप्लांट जैसे अंतर्राष्ट्रीय संगठनों से जुड़े हैं ताकि दाता अंगों की आपूर्ति को सुनिश्चित किया जा सके।
प्रत्यारोपण कुछ जैव नैतिक मुद्दे भी उठाता है जैसे मृत्यु की परिभाषा, कब और कैसे एक अंग के लिए सहमति दी जानी चाहिए और प्रत्यारोपण में प्रयुक्त अंग के लिए भुगतान करना आदि।",268,मानसिक
