title,content,word_count,topic
मानसिक स्वास्थ्य,"मानसिक स्वास्थ्य या तो संज्ञानात्मक, व्यवहारात्मक अथवा भावनात्मक सलामती के स्तर का वर्णन करता है या फिर किसी मानसिक विकार की अनुपस्थिति को दर्शाता है। मानसिक स्वास्थ्य एक स्थिति है जो लोगों को जीवन के तनावों से निपटने, अपनी क्षमताओं का एहसास करने, अच्छी तरह से सीखने और अच्छी तरह से काम करने और अपने समुदाय में योगदान करने में सक्षम बनाती है। सकारात्मक मनोविज्ञान विषय या साकल्यवाद के दृष्टिकोण से मानसिक स्वास्थ्य में एक व्यक्ति के जीवन का आनंद लेने की क्षमता और जीवन की गतिविधियों और मनोवैज्ञानिक लचीलापन हासिल करने के प्रयास के बीच सामंजस्य शामिल हो सकता है। मानसिक स्वास्थ्य हमारी भावनाओं की अभिव्यक्ति है और मांग की विस्तृत श्रृंखला के लिए एक सफल अनुकूलन का प्रतीक है।
विश्व स्वास्थ्य संगठन, मानसिक स्वास्थ्य को परिभाषित करते हुए कहता है कि यह ""सलामती की एक स्थिति है जिसमें किसी व्यक्ति को अपनी क्षमताओं का एहसास रहता है, वह जीवन के सामान्य तनावों का सामना कर सकता है, लाभकारी और उपयोगी रूप से काम कर सकता है और अपने समाज के प्रति योगदान करने में सक्षम होता है। यह पहले कहा जा चुका है कि मानसिक स्वास्थ्य की कोई एक ""आधिकारिक"" परिभाषा नहीं है। सांस्कृतिक मतभेद, व्यक्तिपरक आकलन और प्रतिस्पर्धी पेशेवर सिद्धांत, ये सभी इस बात को प्रभावित करते हैं कि ""मानसिक स्वास्थ्य"" को कैसे परिभाषित किया जाता है। मानसिक स्वास्थ्य विकार के विभिन्न प्रकार हैं जिनमें से कुछ आम हैं, जैसे अवसाद और दुश्चिंता विकार और कुछ आम नहीं हैं, जैसे कि विखंडितमानसिकता और द्विध्रुवी विकार.
सबसे हाल में, वैश्विक मानसिक स्वास्थ्य का क्षेत्र उभरा है जिसे 'अध्ययन, शोध और अभ्यास के ऐसे क्षेत्र के रूप में परिभाषित किया गया है जो मानसिक स्वास्थ्य को सुधारने को प्राथमिकता देता है और दुनिया भर में सभी लोगों में मानसिक स्वास्थ्य के समान स्तर को हासिल करने का प्रयास करता है।",301,मानसिक
विश्व मानसिक स्वास्थ्य दिवस,"विश्व मानसिक स्वास्थ्य दिवस (अंग्रेज़ी: World Mental Health Day) प्रत्येक वर्ष 10 अक्टूबर को मानसिक स्वास्थ्य शिक्षा के प्रति जागरूकता फैलाने के लिए मनाया जाता है। यह पहली बार 1992 में विश्व मानसिक स्वास्थ्य संघ की पहल पर मनाया गया था, जो एक वैश्विक मानसिक स्वास्थ्य संगठन है जिसके सदस्य और संपर्क 150 से अधिक देशों में हैं। इस दिन, हजारों समर्थक मानसिक बीमारी और दुनिया भर में लोगों के जीवन पर इसके प्रमुख प्रभावों पर ध्यान देने के लिए इस वार्षिक जागरूकता कार्यक्रम को मनाने के लिए आते हैं।  कुछ देशों में जैसे ऑस्ट्रेलिया में यह दिन मानसिक स्वास्थ्य सप्ताह का हिस्सा होता है।",105,मानसिक
स्वास्थ्य,"विश्व स्वास्थ्य संगठन (W.H.O.) ने सन् 1948 में स्वास्थ्य या आरोग्य की निम्नलिखित परिभाषा दी गई है।

1) दैहिक, मानसिक और सामाजिक रूप से पूर्णतः स्वस्थ होना (समस्या-विहीन होना) ही स्वास्थ्य है।
या,

2) किसी व्यक्ति की मानसिक,शारीरिक और सामाजिक रुप से अच्छे होने की स्थिति को स्वास्थ्य कहते हैं।। 
स्वास्थ्य सिर्फ बीमारियों की अनुपस्थिति का नाम नहीं है। स्वस्थ ही जीवन है हमें सर्वांगीण स्वास्थ्य के बारे में जानकारी होना बहुत आवश्यक है। स्वास्थ्य का अर्थ विभिन्न लोगों के लिए अलग-अलग होता है। लेकिन अगर हम एक सार्वभौमिक दृष्टिकोण की बात करें तो अपने आपको स्वस्थ कहने का यह अर्थ होता है कि हम अपने जीवन में आनेवाली सभी सामाजिक, शारीरिक और भावनात्मक चुनौतियों का प्रबन्धन करने में सफलतापूर्वक सक्षम हों।
स्वास्थ्य क्या होता है
स्वास्थ्य, हमारे जीवन का सबसे महत्वपूर्ण आयाम होता है। यह हमारे शारीरिक, मानसिक, और सामाजिक तंतु का संतुलन होता है जो हमारी जीवन की गुणवत्ता को प्रभावित करता है। स्वास्थ्य का मतलब बस बीमार नहीं होना नहीं होता, बल्कि यह विभिन्न पहलुओं का सम्मिलित होता है जो हमारे जीवन को सुखमय और सफल बनाते हैं।",181,मानसिक
मानसिक चिकित्सालय,"मानसिक चिकित्सालय (Psychiatric hospitals या mental hospitals) उन चिकित्सालयों को कहते हैं जहाँ गम्भीर मनोविकारों (जैसे द्विध्रुवी विकार, मनोविदालिता आदि) की चिकित्सा होती है।",24,मानसिक
विश्व मानसिक स्वास्थ्य संघ,"विश्व मानसिक स्वास्थ्य संघ (अंग्रेज़ी: World Federation for Mental Health) एक अंतरराष्ट्रीय, बहु-पेशेवर गैर-सरकारी संगठन (एनजीओ) है। इसमें स्वयंसेवक के तौर पर नागरिक और पूर्व रोगी शामिल हैं। इसकी स्थापना 1948 में हुई थी।",34,मानसिक
मानसिक स्वास्थ्य सप्ताह (ऑस्ट्रेलिया),"मानसिक स्वास्थ्य सप्ताह ऑस्ट्रेलिया में मानसिक स्वास्थ्य के प्रति जागरूकता सप्ताह है। यह पहली बार 1985 में आयोजित किया गया था और अब यह एक वार्षिक कार्यक्रम है। यह अक्टूबर में आयोजित किया जाता है, जिसमें 10 अक्टूबर शामिल है, जो विश्व मानसिक स्वास्थ्य दिवस है।",46,मानसिक
मानसिक स्वास्थ्य विज्ञान,,0,मानसिक
कोविड-19 महामारी के समय मानसिक स्वास्थ्य,"दुनिया भर में फैले कोविड-19 महामारी ने पूरे जगत में लोगों के मानसिक स्वास्थ्य को काफी प्रभावित किया है। इस बढ़ते वायरस के संक्रमण से बचने के लिए संयुक्त राष्ट्र की अंतर-एजेंसी गठन की स्थायी समिति मानसिक स्वास्थ्य और मनोसामाजिक समर्थन की टीम ने कहा है कि अगर इससे बचना चाहते है तो आपको इस दौरान मानसिक स्वास्थ्य सहायता के मुख्य सिद्धांतों को अपनाना होगा। ये मुख्य सिद्धांत इस कोरोना काल में मानव अधिकारों और समानता को बढ़ावा देते है, अगर लोग आज इन सिद्धांतों को अच्छे ढंग से अपनाते है तो यह सिद्धांत आज इस महामारी संकट से बचने के लिए लोगों की भागीदारी का हिस्सा बनते है और अच्छे भविष्य निर्माण करते है। कोविड-19 की वजह से आज लोगों में दूरियाँ बढ़ती जा रही है, जिस कारण विभिन्न प्रकार की संस्थान चाहे वह कॉलेज हो या फिर फ़ैक्टरी सब कुछ बंद है। इस कारण लोगों की आय का साधन भी खत्म हो चुका है, जो कि दुनिया भर के लोगों के लिए चिंता का विषय बना है इस कारण लोगों के मानसिक स्वास्थ्य पर बुरा असर पड़ा है।",180,मानसिक
"मानसिक स्वास्थ्य संस्थान एवं चिकित्सालय, आगरा","मानसिक स्वास्थ्य संस्थान एवं चिकित्सालय, आगरा, जिसे पहले आगरा पागलखाने के नाम से जाना जाता था, १८५९ में ब्रिटिश राज में उत्तर प्रदेश की राज्य सरकार द्वारा स्थापित किया गया था। यह संस्थान सिकंदरा के पास बिलोचपुरा रेलवे स्टेशन के सामने १७२.८ एकड़ के परिसर में फैला हुआ है। इस संस्थान को मानव मानसिक विकारों पर उपचार, अनुसंधान और प्रशिक्षण के लिए भारत भर में जाना जाता है।",68,मानसिक
दक्षिण कोरिया में मानसिक स्वास्थ्य,"मानसिक स्वास्थ्य के मुद्दे दक्षिण कोरिया में प्रचलित हैं, जहां ओईसीडी (OECD) में आत्महत्या की दर सबसे अधिक है और ओईसीडी (आर्थिक सहयोग और विकास संगठन) देशों में मानसिक रोग के लिए अस्पताल में भर्ती होने की उच्चतम दर है। दक्षिण कोरिया में राज्य द्वारा वित्त पोषित मानसिक स्वास्थ्य सेवाएं हैं, जिनमें से अधिकांश इनपेशेंट अस्पताल की सुविधाएं हैं, लेकिन वे बड़े संख्या पर अल्प वित्तपोषित और कम उपयोग की जाती हैं। मानसिक रोग की व्यापकता के बावजूद, पूरे दक्षिण कोरियाई आबादी में सामाजिक कलंक प्रचलित है, जो पीड़ितों को उपचार लेने से हतोत्साहित करता है। मानसिक रोग, जबकि सभी जनसांख्यिकीय समूहों में मौजूद है, दक्षिण कोरिया में वृद्ध और किशोरों में सबसे आम है।",115,मानसिक
राष्ट्रीय मानसिक जाँच एवं तंत्रिका विज्ञान संस्थान,"राष्ट्रीय मानसिक जाँच एवं स्नायु विज्ञान संस्थान(अंग्रेज़ी:नेशनल इंस्टिटयूट ऑफ मेण्टल हेल्थ एण्ड न्यूरो साइंसेस) बंगलुरु स्थित एशिया के सम्मानित मानसिक संस्थानों में से एक है। नेशनल मेंटल हेल्थ एंड न्यूरो (निमहांस), मानसिक स्वास्थ्य और तंत्रिका तंत्र के क्षेत्र में एक बहुकषेत्रीय संस्थान है। दिनांक २७ दिसंबर, १९७४ को पूर्व मानसिक अस्पताल और अखिल भारतीय मानसिक स्वास्थ्य संस्थान के एकीकरण का परिणाम यह संसथान था।
१४ नवंबर, १९९४ को संस्थान को विश्वविद्यालय अनुदान आयोग की धारा-३ १९५६ के तहत, मानित विश्वविद्यालय का स्तर प्राप्त हुआ था।",85,मानसिक
मानसिक विकार,"एक मानसिक विकार, जिसे एक मानसिक बीमारी या मनोरोग विकार भी कहा जाता है, एक व्यवहार या मानसिक पैटर्न है जो व्यक्तिगत कामकाज के महत्वपूर्ण संकट या हानि का कारण बनता है। इस तरह की विशेषताएं लगातार, रिलेपेसिंग और रीमिटिंग या एकल एपिसोड के रूप में हो सकती हैं। कई विकारों का वर्णन संकेतों और लक्षणों के साथ किया गया है, जो विशिष्ट विकारों के बीच व्यापक रूप से भिन्न हैं।  इस तरह के विकारों का निदान मानसिक स्वास्थ्य पेशेवर द्वारा किया जा सकता है।
मानसिक विकारों के कारण अक्सर स्पष्ट नहीं होते हैं। सिद्धांत कई क्षेत्रों के निष्कर्षों को शामिल कर सकते हैं। मानसिक विकारों को आमतौर पर इस बात से परिभाषित किया जाता है कि कोई व्यक्ति कैसे व्यवहार करता है, महसूस करता है, मानता है या सोचता है।  यह मस्तिष्क के विशेष क्षेत्रों या कार्यों से जुड़ा हो सकता है, अक्सर सामाजिक संदर्भ में। एक मानसिक विकार मानसिक स्वास्थ्य का एक पहलू है। सांस्कृतिक और धार्मिक मान्यताओं के साथ-साथ सामाजिक मानदंडों को भी निदान करते समय ध्यान में रखा जाना चाहिए।
सेवाएँ मनोरोग अस्पतालों या समुदाय में आधारित होती हैं, और मानसिक स्वास्थ्य पेशेवरों जैसे मनोचिकित्सकों, मनोवैज्ञानिकों, मनोरोग नर्सों और नैदानिक ​​सामाजिक कार्यकर्ताओं द्वारा मूल्यांकन किया जाता है, मनोचिकित्सा परीक्षणों जैसे विभिन्न तरीकों का उपयोग करते हुए, लेकिन अक्सर अवलोकन और पूछताछ पर निर्भर होते हैं। उपचार विभिन्न मानसिक स्वास्थ्य पेशेवरों द्वारा प्रदान किए जाते हैं। मनोचिकित्सा और मानसिक चिकित्सा दो प्रमुख उपचार विकल्प हैं। अन्य उपचारों में जीवनशैली में बदलाव, सामाजिक हस्तक्षेप, सहकर्मी सहायता और स्वयं सहायता शामिल हैं। अल्पसंख्यकों के मामलों में, अनैच्छिक निरोध या उपचार हो सकता है। रोकथाम कार्यक्रम अवसाद को कम करने के लिए दिखाए गए हैं। 
2019 में, दुनिया भर में सामान्य मानसिक विकारों में अवसाद शामिल है, जो लगभग 264 मिलियन, द्विध्रुवी विकार को प्रभावित करता है, जो लगभग 45 मिलियन, मनोभ्रंश को प्रभावित करता है, जो लगभग 50 मिलियन, और सिज़ोफ्रेनिया और अन्य साइकोस को प्रभावित करता है, जो लगभग 20 मिलियन लोगों को प्रभावित करता है। विकासात्मक विकारों में बौद्धिक विकलांगता और व्यापक विकास संबंधी विकार शामिल हैं जो आमतौर पर बचपन या बचपन में पैदा होते हैं। कलंक और भेदभाव मानसिक विकारों से जुड़े दुख और विकलांगता को जोड़ सकते हैं।",364,मानसिक
मनोविकार,"मनोविकार (Mental disorder) किसी व्यक्ति के मानसिक स्वास्थ्य की वह स्थिति है जिसे किसी स्वस्थ व्यक्ति से तुलना करने पर 'सामान्य' नहीं कहा जाता। स्वस्थ व्यक्तियों की तुलना में मनोरोगों से ग्रस्त व्यक्तियों का व्यवहार असामान्‍य अथवा दुरनुकूली (मैल एडेप्टिव) निर्धारित किया जाता है और जिसमें महत्‍वपूर्ण व्‍यथा अथवा असमर्थता अन्‍तर्ग्रस्‍त होती है। इन्हें मनोरोग, मानसिक रोग, मानसिक बीमारी अथवा मानसिक विकार भी कहते हैं।
मनोरोग मस्तिष्क में रासायनिक असंतुलन की वजह से पैदा होते हैं तथा इनके उपचार के लिए मनोरोग चिकित्सा की जरूरत होती है।",87,मानसिक
