title,content,word_count,topic
देहरादून जिला,"देहरादून, भारत के उत्तराखंड राज्य की राजधानी है इसका मुख्यालय देहरादून नगर में है। इस जिले में ६ तहसीलें, ६ सामुदायिक विकास खंड, १७ शहर और ७६४ आबाद गाँव हैं। इसके अतिरिक्त यहाँ १८ गाँव ऐसे भी हैं जहाँ कोई नहीं रहता। देश की राजधानी से २३० किलोमीटर दूर स्थित इस नगर का गौरवशाली पौराणिक इतिहास है। प्राकृतिक सौंदर्य से भरपूर यह नगर अनेक प्रसिद्ध शिक्षा संस्थानों के कारण भी जाना जाता है। यहाँ तेल एवं प्राकृतिक गैस आयोग, सर्वे ऑफ इंडिया, भारतीय पेट्रोलियम संस्थान आदि जैसे कई राष्ट्रीय संस्थान स्थित हैं। देहरादून में वन अनुसंधान संस्थान, भारतीय राष्ट्रीय मिलिटरी कालेज और इंडियन मिलिटरी एकेडमी जैसे कई शिक्षण संस्थान हैं। यह एक प्रसिद्ध पर्यटन स्थल है। अपनी सुंदर दृश्यवाली के कारण देहरादून पर्यटकों, तीर्थयात्रियों और विभिन्न क्षेत्र के उत्साही व्यक्तियों को अपनी ओर आकर्षित करता है। विशिष्ट बासमती चावल, चाय और लीची के बाग इसकी प्रसिद्धि को और बढ़ाते हैं तथा शहर को सुंदरता प्रदान करते हैं।
देहरादून दो शब्दों देहरा और दून से मिलकर बना है। इसमें देहरा शब्द को डेरा का अपभ्रंश माना गया है। जब सिख गुरु हर राय के पुत्र रामराय इस क्षेत्र में आए तो अपने तथा अनुयायियों के रहने के लिए उन्होंने यहाँ अपना डेरा स्थापित किया। कालांतर में नगर का विकास इसी डेरे का आस-पास प्रारंभ हुआ। इस प्रकार डेरा शब्द के दून शब्द के साथ जुड़ जाने के कारण यह स्थान देहरादून कहलाने लगा। कुछ इतिहासकारों का यह भी मानना है कि देहरा शब्द स्वयं में सार्थकता लिए हुए है, इसको डेरा का अपभ्रंश रूप नहीं माना जा सकता है। देहरा शब्द हिंदी तथा पंजाबी में आज भी प्रयोग किया जाता है। हिंदी में देहरा का अर्थ देवग्रह अथवा देवालय है, जबकि पंजाबी में इसे समाधि, मंदिर तथा गुरुद्वारे के अर्थो में सुविधानुसार किया गया है। इसी तरह दून शब्द दूण से बना है और यह दूण शब्द संस्कृत के द्रोणि का अपभ्रंश है। संस्कृत में द्रोणि का अर्थ दो पहाड़ों के बीच की घाटी है। यह भी विश्वास किया जाता है कि यह पूर्व में ऋषि द्रोणाचार्य का डेरा था।",339,खेलकूद
सुत्तपिटक,"सुत्तपिटक बौद्ध धर्म का एक ग्रंथ है। यह ग्रंथ त्रिपिटक के तीन भागों में से एक है। सुत्त पिटक में तर्क और संवादों के रूप में भगवान बुद्ध के सिद्धांतों का संग्रह है। इनमें गद्य संवाद हैं, मुक्तक छन्द हैं तथा छोटी-छोटी प्राचीन कहानियाँ हैं। यह पाँच निकायों या संग्रहों में विभक्त है।
।",54,खेलकूद
कम्यून,"सुविचारित ढंग से एक साथ रहने वाले लोगों के समुदाय को कम्यून (Commune) कहते हैं। कम्यून के सभी सदस्यों के लक्ष्य, सम्पत्ति, स्रोत आदि एक होते हैं अनुर कुछ मामलों में तो काम और आय भी एक ही होती है।",40,खेलकूद
श्री चन्द्रमुनि,"बाबा श्री चन्द्र जी (8 सितम्बर 1494 – 13 जनवरी 1629) गुरु नानक के ज्येष्ट पुत्र थे जिन्होने उदासीन सम्प्रदाय की स्थापना की थी। 
आप लुप्तप्राय उदासीन संप्रदाय के पुनः प्रवर्तक आचार्य है। उदासीन गुरुपरंपरा में आपका १६५ वाँ स्थान हैं। आपकी आविर्भावतिथि संवत १५५१ भाद्रपद शुक्ला नवमी तथा अंतर्धानतिथि संवत् १७०० श्रावण शुक्ला पंचमी है। आपके प्रमुख शिष्य श्री बालहास, अलमत्ता, पुष्पदेव, गोविन्ददेव, गुरुदत्त भगवद्दत्त, कर्ताराय, कमलासनादि मुनि थे।
बाबा श्रीचंद का जन्म 8 सितम्बर 1494 को पंजाब के कपूरथला जिला के सुल्तानपुर लोधी में हुवा था। उनका माता का नाम सुलखनी था। जन्म के समय उनके शरीर पर विभूति की एक पतली परत तथा कानों में मांस के कुंडल बने थे। अतः लोग उन्हें भगवान शिव का अवतार मानने लगे। जिस अवस्था में अन्य बालक खेलकूद में व्यस्त रहते हैं, उस समय बाबा श्रीचंद गहन वन के एकान्त में समाधि लगाकर बैठ जाते थे। कुछ बड़े होने पर वे देश भ्रमण को निकल पड़े। उन्होंने तिब्बत, कश्मीर, सिन्ध, काबुल, कंधार, बलूचिस्थान, अफगानिस्तान, गुजरात, पुरी, कटक, गया आदि स्थानों पर जाकर साधु-संतों के दर्शन किये। वे जहां जाते, वहां अपनी वाणी एवं चमत्कारों से दीन-दुखियों के कष्टों का निवारण करते थे।
श्रीचंद जी ने बहुत छोटी उम्र में ही योग के तरीकों में महारथ हासिल कर ली थी। वे अपने पिता गुरु नानक के प्रति हमेशा समर्पित रहे तथा उन्होंने उदासीन सम्प्रदाय की नीव रखी। उन्होंने दूर-दूर तक यात्रा की और गुरु नानक के बारे में जागरूकता फैल गई।
बाबा श्रीचंद की मृत्यु माघ सदी में 13 जनवरी 1629 को किरतपुर में हुई। उदासीन सम्प्रदाय परम्पराओं का मानना है की बाबा श्रीचंद कभी मर नहीं सकते। वे चम्बा के जंगल में गायब हो गए। बाबा श्रीचंद के अदृश्य होने के बाद बाबा गुरदित्ता उदासीन सम्प्रदाय के प्रमुख उत्तराधिकारी बने।",290,खेलकूद
"बैकुण्ठ चतुर्दशी मेला, श्रीनगर","उत्तराखण्ड के गढ़वाल अंचल में श्रीनगर में बैकुंठ चतुर्दशी का मेला प्रतिवर्ष लगा करता है। विभिन्न पर्वों की भांति वैकुण्ठ चतुर्दशी वर्षभर में पडने वाला हिन्दू समाज का महत्वपूर्ण पर्व है। सामान्यतः दीपावली तिथि से 14 वे दिन बाद आने वाले साल का यह पर्व धार्मिक महत्व का है। इस अवसर पर विभिन्न शिवालयों में पूजा/अर्चना साधना का विशेष महत्व है। गढवाल जनपद के प्रसिद्ध शिवालयों श्रीनगर में कमलेश्वर तथा थलीसैण में बिन्सर शिवालय में इस पर्व पर अधिकाधिक संख्या में श्रृद्धालु दर्शन हेतु आते हैं तथा इस पर्व को आराधना व मनोकामना पूर्ति का मुख्य पर्व मानते हैं। श्रीनगर स्थित कमलेश्वर मन्दिर पौराणिक मन्दिरों में से है। इसकी अतिशय धार्मिक महत्ता है, किवदंती है कि यह स्थान देवताओं की नगरी भी रही है। इस शिवालय में भगवान विष्णु ने तपस्या कर सुदर्शन-चक्र प्राप्त किया तो श्री राम ने रावण वध के उपरान्त ब्रह्म हत्या के पाप से मुक्ति हेतु कामना अर्पण कर शिव जी को प्रसन्न किया व पापमुक्त हुए।",161,खेलकूद
"बसंत पंचमी मेला, कोटद्वार","बसन्त पंचमी हिन्दू समाज का प्रमुख पर्व है, परिवर्तन व आशा-उमंग के इस पर्व का विभिन्न धार्मिक स्थलों पर उत्साह पूर्वक मनाया जाता है। जनपद पौडी में कोटद्वार के समीप (कोटद्वार से 14 कि.मी.) कण्वाश्रम ऐतिहासिक, सांस्कृतिक महत्व का स्थल है। यहॉ पर प्रति वर्ष बसन्त पंचमी पर्व पर दो दिवसीय सांस्कृतिक कार्यक्रमों का आयोजन होता है। जिसमें हजारों की संख्या में दर्शक मौजूद रहते हैं।",66,खेलकूद
2015-16 शेफील्ड शील्ड,"2015-16 शेफील्ड शील्ड

2015-16 के शेफील्ड शील्ड मौसम शेफील्ड शील्ड, घरेलू प्रथम श्रेणी क्रिकेट में ऑस्ट्रेलिया प्रतियोगिता के चल रहे 123 वें मौसम है। मौसम मेटाडोर BBQs वन-डेकप के समापन के बाद शुरू हुआ और आधे रास्ते में बिग बैश लीग के लिए अनुमति देने के लिए के माध्यम से एक ब्रेक शामिल थे। एक गुलाबी गेंद के साथ दिन / रात के टेस्ट मैचों के लिए परीक्षण जारी रखा, पिछले सत्र के दौरान पेश किया गया है। दौर एक और खेलकूद-प्रतियोगिता के सात मैचों में से सभी दिन / रात के खेल के रूप में खेला गया। गत खेलविजेता है विक्टोरिया।",102,खेलकूद
सरकारी नालडांगा भूषण पाइलट माध्यमिक विद्यालय,सरकारी नलडांगा भूषण पायलट माध्यमिक विद्यालय (बांग्ला: সরকারি নলডাঙ্গা ভূষণ পাইলট মাধ্যমিক বিদ্যালয়) बांग्लादेश के झिनाइदह जिला के कालिगंज उपजिला में स्थित एक माध्यमिक विद्यालय है। यह विद्यालय 1882 में स्थापित किया गया था।,34,खेलकूद
सीताराम अग्रहरि,"सीताराम अग्रहरि 'प्रकाश' (जन्म: १९५७) नेपाल के कवि, साहित्यकार एवं प्रख्यात पत्रकार हैं। वे नेपाल के सबसे पुराने समाचार पत्र गोरखापत्र के प्रधान संम्पादक हैं।",25,खेलकूद
"राजकीय अभियांत्रिकी महाविद्यालय, जाफरपुर","चौधरी ब्रह्म प्रकाश राजकीय अभियांत्रिकी महाविद्यालय, जाफरपुर या GEC का निर्माण दिल्ली सरकार के ट्रेनिंग एंड टेक्नीकल विभाग द्वारा सन २००७ में किया गया था। महाविद्यालय का नाम, दिल्ली के प्रथम मुख्य मंत्री, चौधरी ब्रह्म प्रकाश के नाम के ऊपर समर्पित किया गया है। यह महाविद्यालय देश का पहला ऐसा अभियांत्रिकी महाविद्यालय है जो सिविल इंजीनियरिंग को समर्पित है। यह महाविद्यालय गुरु गोबिन्द सिंह इन्द्रप्रस्थ विश्वविद्यालय से सम्बद्ध है।",69,खेलकूद
देव संस्कृति विश्वविद्यालय,देव संस्कृति विश्वविद्यालय हरिद्वार में स्थित है। इस संस्थान की स्थापना गायत्री परिवार के पितृपुरुष पंडित श्रीराम शर्मा आचार्य द्वारा 11 अप्रैल 2002 में की गयी।,26,खेलकूद
"चम्बा, हिमाचल प्रदेश","चंबा भारत के हिमाचल प्रदेश प्रान्त का एक नगर है। हिमाचल प्रदेश का चंबा अपने रमणीय मंदिरों और हैंडीक्राफ्ट के लिए सर्वविख्यात है। रवि नदी के किनारे 996 मीटर की ऊँचाई पर स्थित चंबा पहाड़ी राजाओं की प्राचीन राजधानी थी। चंबा को राजा साहिल वर्मन ने 920 ई. में स्थापित किया था। इस नगर का नाम उन्होंने अपनी प्रिय पुत्री चंपावती के नाम पर रखा। चारों ओर से ऊंची पहाड़ियों से घिरे चंबा ने प्राचीन संस्कृति और विरासत को संजो कर रखा है। प्राचीन काल की अनेक निशानियां चंबा में देखी जा सकती हैं।
जाब 
'जाब', चंबा का अरबी नाम है। इसके जाफ, हाब, आब और गाँव नाम भी हैं। इसकी प्राचीन राजधानी ब्रह्मपुर (वयराटपट्टन) थी। हुएनत्सांग ने इसका वर्णन करते हुए लिखा है कि यह अलखनंदा और करनाली नदियों के बीच बसा है। कुछ काल बाद इस प्रदेश की राजधानी चंबा हो गई। 15 अप्रैल 1948 में इसका विलयन भारत सरकार द्वारा शासित हिमाचल प्रदेश में हो गया।
अरब लेखकों ने सामान्यत: चंबा के सूर्यवंशी राजपूत शासकों को 'जाब' की उपाधि के साथ लिखा है। हब्न रुस्ता का मत है कि यह शासन सालुकि वंश के थे परंतु राजवंश की उत्पत्ति के संबंध में विद्वानों में मतभेद है। ८४६ ई. में सर्वप्रथम हब्न खुर्रदद्बी ने 'जाब' का प्रयोग किया, पर ऐसा लगता है कि इस शब्द की उत्पत्ति अरब साहित्य में इससे पूर्व हो चुकी थी। इस प्रकार यह प्रामाणिक माना जाता है कि चंबा नगर ९ वीं शताब्दी के प्रथम दशक में विद्यमान था। इब्न रुस्ता ने लिखा है कि चंबा के शासक प्राय: गुर्जरों और प्रतिहारों से शत्रुता रखते थे।",263,खेलकूद
